"1712.07432","Michael Finkelberg","Michael Finkelberg, Mikhail Kapranov, Vadim Schechtman","Fourier transform on hyperplane arrangements","The final published version","""Representation Theory and Algebraic Geometry'', Trends in
  Mathematics, Birkh\""auser (2022), 87--131","10.1007/978-3-030-82007-7_4",,"math.AT","http://arxiv.org/licenses/nonexclusive-distrib/1.0/","  We consider the category of perverse sheaves on a complex vector space smooth
with respect to a stratification given by an arrangement of hyperplanes with
real equations. As shown in an earlier wotk of two of the authors, this
category can be described in terms of certain diagrams of vector spaces
labelled by all the faces of the real arrangement (we call such diagrams
hyperbolic sheaves). In this paper we calculate, in these terms, several
fundamental operations of sheaf theory such as forming the space of vanishing
cycles, specialization and the Fourier-Sato transform.
","[{""version"":""v1"",""created"":""Wed, 20 Dec 2017 11:53:46 GMT""},{""version"":""v2"",""created"":""Fri, 16 Feb 2018 17:17:19 GMT""},{""version"":""v3"",""created"":""Sat, 25 Jun 2022 05:32:57 GMT""}]","2022-06-28"
"1712.07433","Jacek Jezierski","Pawe{\l} Czajka, Jacek Jezierski","Conformal Yano-Killing tensors for space-times with cosmological
  constant","27 pages","Acta Physica Pol B 49 (2018)","10.5506/APhysPolB.49.785",,"gr-qc","http://arxiv.org/licenses/nonexclusive-distrib/1.0/","  We present a new method for constructing conformal Yano-Killing tensors in
five-di\-men\-sio\-nal Anti-de Sitter space-time. The found tensors are
represented in two different coordinate systems. We also discuss, in terms of
CYK tensors, global charges which are well defined for asymptotically
(five-dimensional) Anti-de Sitter space-time. Additionally in Appendix we
present our own derivation of conformal Killing one-forms in four-dimensional
Anti-de Sitter space-time as an application of the Theorem presented in the
paper.
","[{""version"":""v1"",""created"":""Wed, 20 Dec 2017 11:57:57 GMT""},{""version"":""v2"",""created"":""Mon, 29 Jan 2018 19:44:14 GMT""},{""version"":""v3"",""created"":""Sun, 22 Apr 2018 12:42:18 GMT""}]","2018-10-29"
"1712.07434","Dongho Chae","Dongho Chae and Joerg Wolf","Removing Type II singularities off the axis for the 3D axisymmetric
  Euler equations","47 pages",,,,"math.AP","http://arxiv.org/licenses/nonexclusive-distrib/1.0/","  We prove local blow-up criterion for smooth axisymmetric solutions to the 3D
incompressible Euler equation. If the vorticity satisfies $ \intl_{0}^{t_*}
(t_*-t) \| \omega (t)\|_{ L^\infty(B(x_{ \ast}, R_0))} dt <+\infty$ for a ball
$B(x_{ \ast}, R_0)$ away from the axis of symmetry, then there exists no
singularity at $t=t_*$ in the torus $T(x_*, R)$ generated by rotation of the
ball $B(x_{ \ast}, R_0)$ around the axis. This implies that possible
singularity at $t=t_*$ in the torus $T(x_*, R)$ is excluded if the vorticity
satisfies the blow-up rate $ \|\o (t)\|_{L^\infty (T(x_*, R))}=
O\left(\frac{1}{(t_*-t)^\gamma}\right)$ as $t\to t_*$, where $\gamma <2$ and
the torus $T(x_*, R)$ does not touch the axis.
","[{""version"":""v1"",""created"":""Wed, 20 Dec 2017 12:02:27 GMT""},{""version"":""v2"",""created"":""Thu, 21 Dec 2017 01:50:48 GMT""},{""version"":""v3"",""created"":""Wed, 3 Jan 2018 22:27:49 GMT""},{""version"":""v4"",""created"":""Sun, 14 Jan 2018 05:45:05 GMT""},{""version"":""v5"",""created"":""Sun, 11 Mar 2018 05:21:50 GMT""},{""version"":""v6"",""created"":""Wed, 26 Sep 2018 07:24:42 GMT""}]","2018-09-27"
"1712.07435","Bayram Cevdet Akdeniz","Bayram Cevdet Akdeniz, Nafi Ahmet Turgut, H. Birkan Yilmaz,
  Chan-Byoung Chae, Tuna Tugcu, and Ali Emre Pusane","Molecular Signal Modeling of a Partially Counting Absorbing Spherical
  Receiver","submitted to Transactions on Communications",,,,"cs.ET eess.SP","http://arxiv.org/licenses/nonexclusive-distrib/1.0/","  To communicate at the nanoscale, researchers have proposed molecular
communication as an energy-efficient solution. The drawback to this solution is
that the histogram of the molecules' hitting times, which constitute the
molecular signal at the receiver, has a heavy tail. Reducing the effects of
this heavy tail, inter-symbol interference (ISI), has been the focus of most
prior research. In this paper, a novel way of decreasing the ISI by defining a
counting region on the spherical receiver's surface facing towards the
transmitter node is proposed. The beneficial effect comes from the fact that
the molecules received from the back lobe of the receiver are more likely to be
coming through longer paths that contribute to ISI. In order to justify this
idea, the joint distribution of the arrival molecules with respect to angle and
time is derived. Using this distribution, the channel model function is
approximated for the proposed system, i.e., the partially counting absorbing
spherical receiver. After validating the channel model function, the
characteristics of the molecular signal are investigated and improved
performance is presented. Moreover, the optimal counting region in terms of bit
error rate is found analytically.
","[{""version"":""v1"",""created"":""Wed, 20 Dec 2017 12:04:05 GMT""}]","2018-08-21"
"1712.07436","Markus Wulfmeier","Markus Wulfmeier, Alex Bewley and Ingmar Posner","Incremental Adversarial Domain Adaptation for Continually Changing
  Environments","International Conference on Robotics and Automation 2018",,,,"stat.ML cs.CV cs.RO","http://arxiv.org/licenses/nonexclusive-distrib/1.0/","  Continuous appearance shifts such as changes in weather and lighting
conditions can impact the performance of deployed machine learning models.
While unsupervised domain adaptation aims to address this challenge, current
approaches do not utilise the continuity of the occurring shifts. In
particular, many robotics applications exhibit these conditions and thus
facilitate the potential to incrementally adapt a learnt model over minor
shifts which integrate to massive differences over time. Our work presents an
adversarial approach for lifelong, incremental domain adaptation which benefits
from unsupervised alignment to a series of intermediate domains which
successively diverge from the labelled source domain. We empirically
demonstrate that our incremental approach improves handling of large appearance
changes, e.g. day to night, on a traversable-path segmentation task compared
with a direct, single alignment step approach. Furthermore, by approximating
the feature distribution for the source domain with a generative adversarial
network, the deployment module can be rendered fully independent of retaining
potentially large amounts of the related source training data for only a minor
reduction in performance.
","[{""version"":""v1"",""created"":""Wed, 20 Dec 2017 12:08:04 GMT""},{""version"":""v2"",""created"":""Sat, 24 Feb 2018 16:05:02 GMT""}]","2018-02-27"
"1712.07437","Marcelo Hartmann","Marcelo Hartmann and Jarno Vanhatalo","Laplace approximation and the natural gradient for Gaussian process
  regression with the heteroscedastic Student-t model",,"Statistics and Computing 2018","10.1007/s11222-018-9836-0)",,"stat.ME","http://creativecommons.org/licenses/by-nc-sa/4.0/","  This paper considers the Laplace method to derive approximate inference for
the Gaussian process (GP) regression in the location and scale parameters of
the Student-t probabilistic model. This allows both mean and variance of the
data to vary as a function of covariates with the attractive feature that the
Student-t model has been widely used as a useful tool for robustifying data
analysis. The challenge in the approximate inference for the GP regression with
the Student-t probabilistic model, lies in the analytical intractability of the
posterior distribution and the lack of concavity of the log-likelihood
function. We present the natural gradient adaptation for the estimation process
which primarily relies on the property that the Student-t model naturally has
orthogonal parametrization with respect to the location and scale paramaters.
Due to this particular property of the model, we also introduce an alternative
Laplace approximation by using the Fisher information matrix in place of the
Hessian matrix of the negative log-likelihood function. According to
experiments this alternative approximation provides very similar posterior
approximations and predictive performance when compared to the traditional
Laplace approximation. We also compare both of these Laplace approximations
with the Monte Carlo Markov Chain (MCMC) method. Moreover, we compare our
heteroscedastic Student-t model and the GP regression with the heteroscedastic
Gaussian model. We also discuss how our approach can improve the inference
algorithm in cases where the probabilistic model assumed for the data is not
log-concave.
","[{""version"":""v1"",""created"":""Wed, 20 Dec 2017 12:10:13 GMT""},{""version"":""v2"",""created"":""Sat, 23 Dec 2017 10:32:09 GMT""}]","2019-08-09"
"1712.07438","Richard Gerum","Richard Gerum, Sebastian Richter, Alexander Winterl, Ben Fabry, Daniel
  Zitterbart","CameraTransform: a Scientific Python Package for Perspective Camera
  Corrections","8 pages, 5 figures",,"10.1016/j.softx.2019.100333",,"cs.MS","http://arxiv.org/licenses/nonexclusive-distrib/1.0/","  Scientific applications often require an exact reconstruction of object
positions and distances from digital images. Therefore, the images need to be
corrected for perspective distortions. We present \textit{CameraTransform}, a
python package that performs a perspective image correction whereby the height,
tilt/roll angle and heading of the camera can be automatically obtained from
the images if additional information such as GPS coordinates or object sizes
are provided. We present examples of images of penguin colonies that are
recorded with stationary cameras and from a helicopter.
","[{""version"":""v1"",""created"":""Wed, 20 Dec 2017 12:13:44 GMT""}]","2019-10-04"
"1712.07439","Amol Holkundkar Dr","Amol R. Holkundkar and Gert Brodin","Transition from wakefield generation to soliton formation","7 Pages, 7 Figures","Phys. Rev. E 97, 043204 (2018)","10.1103/PhysRevE.97.043204",,"physics.plasm-ph","http://arxiv.org/licenses/nonexclusive-distrib/1.0/","  It is well known that when a short laser pulse propagates in an underdense
plasma, it induces longitudinal plasma oscillations at the plasma frequency
after the pulse, typically referred to as the 'wakefield'. However, for plasma
densities approaching the critical density wakefield generation is suppressed,
and instead the EM-pulse undergoes nonlinear self-modulation. In this article
we have studied the transition from the wakefield generation to formation of
quasi-solitons as the plasma density is increased. For this purpose we have
applied a one dimensional (1D) relativistic cold fluid model, which has also
been compared with particle-in-cell simulations. A key result is that the
energy loss of the EM-pulse due to wakefield generation has its maximum for a
plasma density of the order 10 percent of the critical density, but that
wakefield generation is sharply suppressed when the density is increased
further.
","[{""version"":""v1"",""created"":""Wed, 20 Dec 2017 12:15:24 GMT""}]","2018-04-25"
"1712.07440","Sergiy Kolesnikov","Sergiy Kolesnikov, Norbert Siegmund, Christian K\""astner, Sven Apel","On the Relation of External and Internal Feature Interactions: A Case
  Study",,,,,"cs.SE","http://arxiv.org/licenses/nonexclusive-distrib/1.0/","  Detecting feature interactions is imperative for accurately predicting
performance of highly-configurable systems. State-of-the-art performance
prediction techniques rely on supervised machine learning for detecting feature
interactions, which, in turn, relies on time consuming performance measurements
to obtain training data. By providing information about potentially interacting
features, we can reduce the number of required performance measurements and
make the overall performance prediction process more time efficient. We expect
that the information about potentially interacting features can be obtained by
statically analyzing the source code of a highly-configurable system, which is
computationally cheaper than performing multiple performance measurements. To
this end, we conducted a qualitative case study in which we explored the
relation between control-flow feature interactions (detected through static
program analysis) and performance feature interactions (detected by performance
prediction techniques using performance measurements). We found that a relation
exists, which can potentially be exploited to predict performance interactions.
","[{""version"":""v1"",""created"":""Wed, 20 Dec 2017 12:20:03 GMT""},{""version"":""v2"",""created"":""Mon, 22 Jan 2018 13:23:04 GMT""}]","2018-01-23"
"1712.07441","Daniel Malz","Daniel Malz and Andreas Nunnenkamp","Current rectification in double quantum dot through fermionic reservoir
  engineering","5 pages + appendix. Accepted version","Phys. Rev. B 97, 165308 (2018)","10.1103/PhysRevB.97.165308",,"cond-mat.mes-hall quant-ph","http://arxiv.org/licenses/nonexclusive-distrib/1.0/","  Reservoir engineering is a powerful tool for the robust generation of quantum
states or transport properties. Using both a weak-coupling quantum master
equation and the exact solution, we show that directional transport of
electrons through a double quantum dot can be achieved through an appropriately
designed electronic environment. Directionality is attained through the
interference of coherent and dissipative coupling. The relative phase is tuned
with an external magnetic field, such that directionality can be reversed, as
well as turned on and off dynamically. Our work introduces fermionic reservoir
engineering, paving the way to a new class of nanoelectronic devices.
","[{""version"":""v1"",""created"":""Wed, 20 Dec 2017 12:26:14 GMT""},{""version"":""v2"",""created"":""Tue, 17 Apr 2018 13:48:53 GMT""}]","2018-05-02"
"1712.07442","Marvin Gottowik","Marvin Gottowik, Christian Glaser, Tim Huege, Julian Rautenberg","Determination of the absolute energy scale of extensive air showers via
  radio emission: systematic uncertainty of underlying first-principle
  calculations","22 pages, 3 figures, accepted for publication in Astroparticle
  Physics",,"10.1016/j.astropartphys.2018.07.004",,"astro-ph.HE","http://arxiv.org/licenses/nonexclusive-distrib/1.0/","  Recently, the energy determination of extensive air showers using radio
emission has been shown to be both precise and accurate. In particular, radio
detection offers the opportunity for an independent measurement of the absolute
energy scale of cosmic rays, since the radiation energy (the energy radiated in
the form of radio signals) can be predicted using first-principle calculations
involving no free parameters, and the measurement of radio waves is not subject
to any significant absorption or scattering in the atmosphere. To quantify the
uncertainty associated with such an approach, we collate the various
contributions to the uncertainty, and we verify the consistency of
radiation-energy calculations from microscopic simulation codes by comparing
Monte Carlo simulations made with the two codes CoREAS and ZHAireS. We compare
a large set of simulations with different primary energies and shower
directions and observe differences in the radiation energy prediction for the
30 - 80 MHz band of 5.2 %. This corresponds to an uncertainty of 2.6 % for the
determination of the absolute cosmic-ray energy scale. Our result has general
validity and can be built upon directly by experimental efforts for the
calibration of the cosmic-ray energy scale on the basis of radio emission
measurements.
","[{""version"":""v1"",""created"":""Wed, 20 Dec 2017 12:26:16 GMT""},{""version"":""v2"",""created"":""Tue, 17 Jul 2018 12:31:08 GMT""}]","2018-08-29"
"1712.07443","Eli Kinney-Lang","Eli Kinney-Lang, Loukianos Spyrou, Ahmed Ebied, Richard FM Chin,
  Javier Escudero","Tensor-driven extraction of developmental features from varying
  paediatric EEG datasets","16 pages, 6 figures, pre-print, under consideration for publication.
  Reduced figure resolution due to size limit-please contact corresponding
  author for full figure resolution",,,,"q-bio.NC eess.SP","http://arxiv.org/licenses/nonexclusive-distrib/1.0/","  Objective. Consistently changing physiological properties in developing
children's brains challenges new data heavy technologies, like brain-computer
interfaces (BCI). Advancing signal processing methods in such technologies to
be more sensitive to developmental changes could help improve their function
and usability in paediatric populations. Taking advantage of the
multi-dimensional structure of EEG data through tensor analysis offers a
framework to extract relevant developmental features present in paediatric
resting-state EEG datasets. Methods. Three paediatric datasets from varying
developmental states and populations were analyzed using a developed two-step
constrained Parallel Factor (PARAFAC) tensor decomposition. The datasets
included the Muir Maxwell Epilepsy Centre, Children's Hospital Boston-MIT and
the Child Mind Institute, outlining two impaired and one healthy population,
respectively. Within dataset cross-validation used support vector machines
(SVM) for classification of out-of-fold data predicting subject age as a proxy
measure of development. t-distributed Stochastic Neighbour Embedding (t-SNE)
maps complemented classification analysis through visualization of the
high-dimensional feature structures. Main Results. Development-sensitive
features were successfully identified for the developmental conditions of each
dataset. SVM classification accuracy and misclassification costs were improved
significantly for both healthy and impaired paediatric populations. t-SNE maps
revealed suitable tensor factorization was key in extracting developmental
features. Significance. The described methods are a promising tool for
incorporating the unique developmental features present throughout childhood
EEG into new technologies like BCI and its applications.
","[{""version"":""v1"",""created"":""Wed, 20 Dec 2017 12:28:22 GMT""}]","2017-12-21"
"1712.07444","William Crawley-Boevey","William Crawley-Boevey","Representations of equipped graphs: Auslander-Reiten theory","Submitted to Proceedings of the 50th Symposium on Ring Theory and
  Representation Theory (Yamanashi, 2017)",,,,"math.RA","http://arxiv.org/licenses/nonexclusive-distrib/1.0/","  Representations of equipped graphs were introduced by Gelfand and Ponomarev;
they are similar to representation of quivers, but one does not need to choose
an orientation of the graph. In a previous article we have shown that, as in
Kac's Theorem for quivers, the dimension vectors of indecomposable
representations are exactly the positive roots for the graph. In this article
we begin by surveying that work, and then we go on to discuss Auslander-Reiten
theory for equipped graphs, and give examples of Auslander-Reiten quivers.
","[{""version"":""v1"",""created"":""Wed, 20 Dec 2017 12:30:36 GMT""}]","2017-12-21"
"1712.07445","Mahmoud Abo Khamis","Mahmoud Abo Khamis, Hung Q. Ngo, Dan Olteanu, Dan Suciu","Boolean Tensor Decomposition for Conjunctive Queries with Negation",,,,,"cs.DB cs.DM math.CO","http://arxiv.org/licenses/nonexclusive-distrib/1.0/","  We propose an algorithm for answering conjunctive queries with negation,
where the negated relations have bounded degree. Its data complexity matches
that of the best known algorithms for the positive subquery of the input query
and is expressed in terms of the fractional hypertree width and the submodular
width. The query complexity depends on the structure of the negated subquery;
in general it is exponential in the number of join variables occurring in
negated relations yet it becomes polynomial for several classes of queries.
  This algorithm relies on several contributions. We show how to rewrite
queries with negation on bounded-degree relations into equivalent conjunctive
queries with not-all-equal (NAE) predicates, which are a multi-dimensional
analog of disequality (not-equal). We then generalize the known color-coding
technique to conjunctions of NAE predicates and explain it via a Boolean tensor
decomposition of conjunctions of NAE predicates. This decomposition can be
achieved via a probabilistic construction that can be derandomized efficiently.
","[{""version"":""v1"",""created"":""Wed, 20 Dec 2017 12:30:59 GMT""},{""version"":""v2"",""created"":""Mon, 10 Sep 2018 20:58:56 GMT""},{""version"":""v3"",""created"":""Wed, 23 Jan 2019 01:59:24 GMT""},{""version"":""v4"",""created"":""Thu, 24 Jan 2019 20:00:06 GMT""},{""version"":""v5"",""created"":""Mon, 28 Jan 2019 03:17:29 GMT""}]","2019-01-29"
"1712.07446","Maxim Dvornikov","Maxim Dvornikov (IZMIRAN, Tomsk State University)","Strong magnetic fields in compact stars as a macroscopic parity
  violation phenomenon","5 pages in LaTeX2e, 8 eps figures; contribution to the proceedings of
  the International Conference ""Modern Trends in Physics"" (Baku, Azerbaijan,
  April 20-22, 2017)",,,,"astro-ph.HE hep-ph","http://arxiv.org/licenses/nonexclusive-distrib/1.0/","  We review the results in our recent works on the generation of strong
magnetic fields in compact stars driven by the parity violating electroweak
interactions between background fermions. The cases of a neutron star, a hybrid
star, and a quark star are considered. We formulate the system of kinetic
equations for the description of the spectra of the magnetic energy and the
magnetic helicity, as well as for the chiral imbalances. Turbulence effects,
which can be important for the evolution of small-scale magnetic field, are
also taken into account. We find the numerical solution of these equations in
case of large- and small-scale magnetic fields in quark matter. The
applications of the obtained results for the generation of large-scale magnetic
fields in magnetars and for the explanation of magnetar bursts are discussed.
","[{""version"":""v1"",""created"":""Wed, 20 Dec 2017 12:33:51 GMT""}]","2017-12-21"
"1712.07447","Michael Bukatin","Michael Bukatin, Jon Anthony","Dataflow Matrix Machines and V-values: a Bridge between Programs and
  Neural Nets","28 pages, 5 figures; appeared in ""K + K = 120: Papers dedicated to
  Laszlo Kalman and Andras Kornai on the occasion of their 60th birthdays""
  Festschrift; http://www.nytud.hu/kk120",,,,"cs.NE cs.PL","http://arxiv.org/licenses/nonexclusive-distrib/1.0/","  1) Dataflow matrix machines (DMMs) generalize neural nets by replacing
streams of numbers with linear streams (streams supporting linear
combinations), allowing arbitrary input and output arities for activation
functions, countable-sized networks with finite dynamically changeable active
part capable of unbounded growth, and a very expressive self-referential
mechanism.
  2) DMMs are suitable for general-purpose programming, while retaining the key
property of recurrent neural networks: programs are expressed via matrices of
real numbers, and continuous changes to those matrices produce arbitrarily
small variations in the associated programs.
  3) Spaces of V-values (vector-like elements based on nested maps) are
particularly useful, enabling DMMs with variadic activation functions and
conveniently representing conventional data structures.
","[{""version"":""v1"",""created"":""Wed, 20 Dec 2017 12:34:17 GMT""},{""version"":""v2"",""created"":""Wed, 23 May 2018 13:24:05 GMT""}]","2018-05-24"
"1712.07448","Michael Stefszky Dr","Michael Stefszky, Ville Ulvila, Zeina Abdallah, Christine Silberhorn
  and Markku Vainio","Towards optical frequency comb generation in continuous-wave pumped
  titanium indiffused lithium niobate waveguide resonators",,"Phys. Rev. A 98, 053850 (2018)","10.1103/PhysRevA.98.053850",,"physics.optics","http://arxiv.org/licenses/nonexclusive-distrib/1.0/","  Much progress, both experimentally and theoretically, has recently been made
towards optical frequency comb generation from continuously pumped second-order
nonlinear systems. Here, we present the first observations towards finding an
integrated solution for such a system, using a titanium indiffused lithium
niobate waveguide resonator. These results are compared to recently developed
theory for equivalent systems. The system is seen to exhibit strong
instabilities, which require further investigation in order to fully determine
the suitability of this platform for stable optical frequency comb generation.
","[{""version"":""v1"",""created"":""Wed, 20 Dec 2017 12:36:50 GMT""},{""version"":""v2"",""created"":""Fri, 25 May 2018 12:43:38 GMT""},{""version"":""v3"",""created"":""Fri, 28 Sep 2018 07:25:05 GMT""},{""version"":""v4"",""created"":""Mon, 1 Oct 2018 07:12:33 GMT""}]","2018-12-05"
