"1712.07013","Huaiyu Duan","Sajad Abbar and Huaiyu Duan (UNM)","Fast neutrino flavor conversion: roles of dense matter and spectrum
  crossing","11 pages, 4 figures. Updated with editorial changes and
  clarifications","Phys. Rev. D 98, 043014 (2018)","10.1103/PhysRevD.98.043014",,"hep-ph astro-ph.HE nucl-th","http://arxiv.org/licenses/nonexclusive-distrib/1.0/","  The flavor conversion of a neutrino usually occurs at densities $\lesssim
G_F^{-1} \omega$, whether in the ordinary matter or the neutrino medium, and on
time/distance scales of order $\omega^{-1}$, where $G_F$ is the Fermi weak
coupling constant and $\omega$ is the vacuum oscillation frequency of the
neutrino. In 2005 Sawyer and more recently both he and other groups have shown
that neutrino flavor conversions can occur on scales much shorter than
$\omega^{-1}$ in a very dense, anisotropic neutrino gas such as that in a
core-collapse supernova or a binary neutron star merger. It has also been
suggested that the fast neutrino flavor conversion require a crossing in the
electron lepton number (ELN) angular distribution or spectrum. We study a few
simple analytical models with which we elucidate the roles of the dense matter
and the ELN spectrum crossing in neutrino fast flavor conversions. We show that
a large matter density can induce fast neutrino flavor conversions in certain
astrophysical scenarios such as at the early epoch of a core-collapse
supernova.
","[{""version"":""v1"",""created"":""Tue, 19 Dec 2017 16:00:09 GMT""},{""version"":""v2"",""created"":""Fri, 17 Aug 2018 14:24:24 GMT""}]","2018-08-22"
"1712.07014","David Abarca","W{\l}odek Klu\'zniak, David Abarca, and Bhupendra Mishra","Radiative GRMHD simulations of accretion disks","6 pages, 4 figures, Proceeding for SMFNS2017 5th International
  Symposium on Strong Electromagnetic Fields and Neutron Stars, 10-13 May, 2017
  Varadero, Cuba",,"10.1002/asna.201713419",,"astro-ph.HE","http://arxiv.org/licenses/nonexclusive-distrib/1.0/","  We describe some recent results on the evolution of accretion disks around
black holes and neutron stars obtained in magnetohydrodynamic (MHD) simulations
in general relativity (GR) with the inclusion of radiation (GRRMHD).
","[{""version"":""v1"",""created"":""Tue, 19 Dec 2017 16:02:59 GMT""}]","2017-12-20"
"1712.07015","Annalisa Massaccesi","Maria Colombo, Camillo De Lellis and Annalisa Massaccesi","The generalized Caffarelli-Kohn-Nirenberg Theorem for the
  hyperdissipative Navier-Stokes system",,,,,"math.AP","http://arxiv.org/licenses/nonexclusive-distrib/1.0/","  We introduce a notion of suitable weak solution of the hyperdissipative
Navier-Stokes equations and we achieve a corresponding extension of the
regularity theory of Caffarelli-Kohn-Nirenberg.
","[{""version"":""v1"",""created"":""Tue, 19 Dec 2017 16:03:25 GMT""}]","2017-12-20"
"1712.07016","Alessandra Faggionato","Alessandra Faggionato, Hlafo Alfie Mimun","Connection probabilities in Poisson random graphs with uniformly bounded
  edges","25 pages. corrected version. the proof of Lemma 3.4 is much shorter.
  the concept of good function is less restrictive",,,,"math.PR math-ph math.MP","http://arxiv.org/licenses/nonexclusive-distrib/1.0/","  We consider random graphs with uniformly bounded edges on a Poisson point
process conditioned to contain the origin. In particular we focus on the random
connection model, the Boolean model and Miller-Abrahams random resistor network
with lower-bounded conductances. The latter is relevant for the analysis of
conductivity by Mott variable range hopping in strongly disordered systems. By
using the method of randomized algorithms developed by Duminil-Copin et al. we
prove that in the subcritical phase the probability that the origin is
connected to some point at distance $n$ decays exponentially in $n$, while in
the supercritical phase the probability that the origin is connected to
infinity is strictly positive and bounded from below by a term proportional to
$ (\lambda-\lambda_c)$, $\lambda$ being the density of the Poisson point
process and $\lambda_c$ being the critical density.
","[{""version"":""v1"",""created"":""Tue, 19 Dec 2017 16:04:15 GMT""},{""version"":""v2"",""created"":""Thu, 11 Jan 2018 10:31:54 GMT""},{""version"":""v3"",""created"":""Tue, 9 Oct 2018 07:05:38 GMT""}]","2018-10-10"
"1712.07017","Amir-Kian Kashani-Poor","Michele Del Zotto, Jie Gu, Min-xin Huang, Amir-Kian Kashani-Poor,
  Albrecht Klemm, Guglielmo Lockhart","Topological Strings on Singular Elliptic Calabi-Yau 3-folds and Minimal
  6d SCFTs","67 pages; v2 typos corrected, references added",,"10.1007/JHEP03(2018)156",,"hep-th math.AG","http://arxiv.org/licenses/nonexclusive-distrib/1.0/","  We apply the modular approach to computing the topological string partition
function on non-compact elliptically fibered Calabi-Yau 3-folds with higher
Kodaira singularities in the fiber. The approach consists in making an ansatz
for the partition function at given base degree, exact in all fiber classes to
arbitrary order and to all genus, in terms of a rational function of weak
Jacobi forms. Our results yield, at given base degree, the elliptic genus of
the corresponding non-critical 6d string, and thus the associated BPS
invariants of the 6d theory. The required elliptic indices are determined from
the chiral anomaly 4-form of the 2d worldsheet theories, or the 8-form of the
corresponding 6d theories, and completely fix the holomorphic anomaly equation
constraining the partition function. We introduce subrings of the known rings
of Weyl invariant Jacobi forms which are adapted to the additional symmetries
of the partition function, making its computation feasible to low base wrapping
number. In contradistinction to the case of simpler singularities, generic
vanishing conditions on BPS numbers are no longer sufficient to fix the modular
ansatz at arbitrary base wrapping degree. We show that to low degree, imposing
exact vanishing conditions does suffice, and conjecture this to be the case
generally.
","[{""version"":""v1"",""created"":""Tue, 19 Dec 2017 16:04:50 GMT""},{""version"":""v2"",""created"":""Fri, 13 Jul 2018 13:38:11 GMT""}]","2018-07-16"
"1712.07018","Frederic Br\""unner","Frederic Br\""unner and Vyacheslav P. Spiridonov","4d $\mathcal{N}=1$ quiver gauge theories and the $\mathrm{A_n}$ Bailey
  lemma","34 pages",,"10.1007/JHEP03(2018)105",,"hep-th math-ph math.MP","http://arxiv.org/licenses/nonexclusive-distrib/1.0/","  We study the integral Bailey lemma associated with the $\mathrm{A_n}$-root
system and identities for elliptic hypergeometric integrals generated thereby.
Interpreting integrals as superconformal indices of four-dimensional
$\mathcal{N}=1$ quiver gauge theories with the gauge groups being copies of
$\mathrm{SU(n+1)}$, we provide evidence for various new dualities. Further
confirmation is achieved by explicitly checking that the `t Hooft anomaly
matching conditions holds. We discuss a flavour symmetry breaking phenomenon
for supersymmetric quantum chromodynamics (SQCD), and by making use of the
Bailey lemma we indicate its manifestation in a web of linear quivers dual to
SQCD that exhibits full s-confinement.
","[{""version"":""v1"",""created"":""Tue, 19 Dec 2017 16:08:47 GMT""}]","2018-04-18"
"1712.07022","Marzieh Haghighi","Marzieh Haghighi, Simon K. Warfield, Sila Kurugol","Automatic Renal Segmentation in DCE-MRI using Convolutional Neural
  Networks",,,,,"cs.CV stat.ML","http://arxiv.org/licenses/nonexclusive-distrib/1.0/","  Kidney function evaluation using dynamic contrast-enhanced MRI (DCE-MRI)
images could help in diagnosis and treatment of kidney diseases of children.
Automatic segmentation of renal parenchyma is an important step in this
process. In this paper, we propose a time and memory efficient fully automated
segmentation method which achieves high segmentation accuracy with running time
in the order of seconds in both normal kidneys and kidneys with hydronephrosis.
The proposed method is based on a cascaded application of two 3D convolutional
neural networks that employs spatial and temporal information at the same time
in order to learn the tasks of localization and segmentation of kidneys,
respectively. Segmentation performance is evaluated on both normal and abnormal
kidneys with varying levels of hydronephrosis. We achieved a mean dice
coefficient of 91.4 and 83.6 for normal and abnormal kidneys of pediatric
patients, respectively.
","[{""version"":""v1"",""created"":""Tue, 19 Dec 2017 16:13:01 GMT""}]","2017-12-20"
"1712.07023","Patricia Teles Rebello","David d'Enterria, Patricia Rebello Teles, Daniel E. Martins","Measurements of $\gamma \gamma \to \mbox{Higgs}$ and $\gamma \gamma \to
  W^{+}W^{-}$ in $e^{+}e^{-}$ collisions at the Future Circular Collider","Presented at EDS Blois 2017 Conference , Prague, Czech Republic, June
  26--30, 2017",,,,"hep-ph hep-ex","http://arxiv.org/licenses/nonexclusive-distrib/1.0/","  The measurements of the two-photon production of the Higgs boson and of
$W^{\pm}$ boson pairs in $e^{+}e^{-}$ collisions at the Future Circular
Collider (FCC-ee) are investigated. The processes
$e^{+}e^{-}\xrightarrow{\gamma \gamma}e^+\,{\rm H}\,e^-,e^+\,{\rm W^+W^-}\,e^-$
are computed using the effective photon approximation for electron-positron
beams, and studied in their ${\rm H}\to b\bar{b}$ and ${\rm W^+W^-}\to 4j$
decay final-states including parton showering and hadronization, jet
reconstruction, $e^\pm$ forward tagging, and realistic experimental cuts. After
selection criteria, up to 75 Higgs bosons and 6600 $\rm W^{\pm}$ pairs will be
reconstructed on top of controllable continuum backgrounds at $\sqrt{s} = $240
and 350 GeV for the total expected integrated luminosities, by tagging the
scattered $e^\pm$ with near-beam detectors. A 5$\sigma$ observation of $\gamma
\gamma \to$H is thereby warranted, as well as high-statistics studies of triple
$\rm \gamma WW$ and quartic $\rm \gamma\gamma WW$ electroweak couplings,
improving by at least factors of 2 and 10 the current limits on dimension-6
anomalous quartic gauge couplings.
","[{""version"":""v1"",""created"":""Tue, 19 Dec 2017 16:15:51 GMT""}]","2017-12-20"
"1712.07024","Hua-Sheng Shao","Aleksander Kusina, Jean-Philippe Lansberg, Ingo Schienbein and
  Hua-Sheng Shao","Gluon Shadowing in Heavy-Flavor Production at the LHC","4 pages + references + appendix, 1 figure; v2: match to the journal
  version, add the supplemental material","Phys. Rev. Lett. 121, 052004 (2018)","10.1103/PhysRevLett.121.052004",,"hep-ph hep-ex nucl-ex nucl-th","http://arxiv.org/licenses/nonexclusive-distrib/1.0/","  We study the relevance of experimental data on heavy-flavor [$D^0$, $J/\psi$,
$B\rightarrow J/\psi$ and $\Upsilon(1S)$ mesons] production in proton-lead
collisions at the LHC to improve our knowledge of the gluon-momentum
distribution inside heavy nuclei. We observe that the nuclear effects encoded
in both most recent global fits of nuclear parton densities at next-to-leading
order (nCTEQ15 and EPPS16) provide a good overall description of the LHC data.
We interpret this as a hint that these are the dominant ones. In turn, we
perform a Bayesian-reweighting analysis for each particle data sample which
shows that each of the existing heavy-quark(onium) data set clearly points
--with a minimal statistical significance of 7 $\sigma$-- to a shadowed gluon
distribution at small $x$ in the lead. Moreover, our analysis corroborates the
existence of gluon antishadowing. Overall, the inclusion of such heavy-flavor
data in a global fit would significantly reduce the uncertainty on the gluon
density down to $x\simeq 7\times 10^{-6}$ --where no other data exist-- while
keeping an agreement with the other data of the global fits. Our study accounts
for the factorization-scale uncertainties which dominate for the charm(onium)
sector.
","[{""version"":""v1"",""created"":""Tue, 19 Dec 2017 16:17:07 GMT""},{""version"":""v2"",""created"":""Fri, 3 Aug 2018 16:13:01 GMT""}]","2018-08-06"
"1712.07025","Zhe Cheng","Zhe Cheng, Brian M. Foley, Thomas Bougher, Luke Yates, Baratunde A.
  Cola, Samuel Graham","Thermal Rectification in CVD Diamond Membranes Driven by Gradient Grain
  Structure",,,"10.1063/1.5021681",,"cond-mat.mes-hall","http://arxiv.org/licenses/nonexclusive-distrib/1.0/","  As one of the basic components of phononics, thermal diodes transmit heat
current asymmetrically similar to electronic rectifiers and diodes in
microelectronics. Heat can be conducted through them easily in one direction
while being blocked in the other direction. In this work, we report an
easily-fabricated mesoscale chemical vapor deposited (CVD) diamond thermal
diode without sharp temperature change driven by the gradient grain structure
of CVD diamond membranes. We build a spectral model of diamond thermal
conductivity with complete phonon dispersion relation to show significant
thermal rectification in CVD diamond membranes. To explain the observed thermal
rectification, the temperature and thermal conductivity distribution in the CVD
diamond membrane are studied. Additionally, the effects of temperature bias and
diamond membrane thickness are discussed, which shed light on tuning the
thermal rectification in CVD diamond membranes. The conical grain structure
makes CVD diamond membranes, and potentially other CVD film structures with
gradient grain structure, excellent candidates for easily-fabricated mesoscale
thermal diodes without a sharp temperature change.
","[{""version"":""v1"",""created"":""Tue, 19 Dec 2017 16:21:44 GMT""},{""version"":""v2"",""created"":""Sat, 30 Dec 2017 02:23:02 GMT""}]","2018-04-04"
"1712.07026","Mathias Schacht","Oliver Ebsen and Mathias Schacht","Homomorphism thresholds for odd cycles","21 pages, second version addresses changes arising from the referee
  reports","Combinatorica 40 (2020), no. 1, 39-62","10.1007/s00493-019-3920-8",,"math.CO","http://arxiv.org/licenses/nonexclusive-distrib/1.0/","  The interplay of minimum degree conditions and structural properties of large
graphs with forbidden subgraphs is a central topic in extremal graph theory.
For a given graph $F$ we define the homomorphism threshold as the infimum over
all $\alpha\in[0,1]$ such that every $n$-vertex $F$-free graph $G$ with minimum
degree at least $\alpha n$ has a homomorphic image $H$ of bounded order
(independent of $n$), which is $F$-free as well. Without the restriction of $H$
being $F$-free we recover the definition of the chromatic threshold, which was
determined for every graph $F$ by Allen et al. [Adv. Math. 235 (2013),
261-295]. The homomorphism threshold is less understood and we address the
problem for odd cycles.
","[{""version"":""v1"",""created"":""Tue, 19 Dec 2017 16:24:55 GMT""},{""version"":""v2"",""created"":""Mon, 4 Mar 2019 11:40:06 GMT""}]","2020-05-26"
"1712.07027","Adil Salim","Adil Salim, Pascal Bianchi and Walid Hachem","Snake: a Stochastic Proximal Gradient Algorithm for Regularized Problems
  over Large Graphs",,,,,"math.OC cs.LG stat.ML","http://arxiv.org/licenses/nonexclusive-distrib/1.0/","  A regularized optimization problem over a large unstructured graph is
studied, where the regularization term is tied to the graph geometry. Typical
regularization examples include the total variation and the Laplacian
regularizations over the graph. When applying the proximal gradient algorithm
to solve this problem, there exist quite affordable methods to implement the
proximity operator (backward step) in the special case where the graph is a
simple path without loops. In this paper, an algorithm, referred to as ""Snake"",
is proposed to solve such regularized problems over general graphs, by taking
benefit of these fast methods. The algorithm consists in properly selecting
random simple paths in the graph and performing the proximal gradient algorithm
over these simple paths. This algorithm is an instance of a new general
stochastic proximal gradient algorithm, whose convergence is proven.
Applications to trend filtering and graph inpainting are provided among others.
Numerical experiments are conducted over large graphs.
","[{""version"":""v1"",""created"":""Tue, 19 Dec 2017 16:28:17 GMT""}]","2017-12-20"
"1712.07028","Simon Bogner","Simon Bogner, Jens Harting, and Ulrich R\""ude","Direct simulation of liquid-gas-solid flow with a free surface lattice
  Boltzmann method","submitted to International Journal of Computational Fluid Dynamics",,"10.1080/10618562.2018.1424836",,"physics.comp-ph physics.flu-dyn","http://arxiv.org/licenses/nonexclusive-distrib/1.0/","  Direct numerical simulation of liquid-gas-solid flows is uncommon due to the
considerable computational cost. As the grid spacing is determined by the
smallest involved length scale, large grid sizes become necessary -- in
particular if the bubble-particle aspect ratio is on the order of 10 or larger.
Hence, it arises the question of both feasibility and reasonability. In this
paper, we present a fully parallel, scalable method for direct numerical
simulation of bubble-particle interaction at a size ratio of 1-2 orders of
magnitude that makes simulations feasible on currently available
super-computing resources. With the presented approach, simulations of bubbles
in suspension columns consisting of more than $100\,000$ fully resolved
particles become possible. Furthermore, we demonstrate the significance of
particle-resolved simulations by comparison to previous unresolved solutions.
The results indicate that fully-resolved direct numerical simulation is indeed
necessary to predict the flow structure of bubble-particle interaction problems
correctly.
","[{""version"":""v1"",""created"":""Tue, 19 Dec 2017 16:29:11 GMT""}]","2018-02-14"
"1712.07029","Paul Vickers","Mohamed Debashi and Paul Vickers","Sonification of Network Traffic Flow for Monitoring and Situational
  Awareness","17 pages, 7 figures plus supplemental material in Github repository",,"10.1371/journal.pone.0195948",,"cs.HC","http://arxiv.org/licenses/nonexclusive-distrib/1.0/","  Maintaining situational awareness of what is happening within a network is
challenging, not least because the behaviour happens within computers and
communications networks, but also because data traffic speeds and volumes are
beyond human ability to process. Visualisation is widely used to present
information about the dynamics of network traffic dynamics. Although it
provides operators with an overall view and specific information about
particular traffic or attacks on the network, it often fails to represent the
events in an understandable way. Visualisations require visual attention and so
are not well suited to continuous monitoring scenarios in which network
administrators must carry out other tasks. Situational awareness is critical
and essential for decision-making in the domain of computer network monitoring
where it is vital to be able to identify and recognize network environment
behaviours.Here we present SoNSTAR (Sonification of Networks for SiTuational
AwaReness), a real-time sonification system to be used in the monitoring of
computer networks to support the situational awareness of network
administrators. SoNSTAR provides an auditory representation of all the TCP/IP
protocol traffic within a network based on the different traffic flows between
between network hosts. SoNSTAR raises situational awareness levels for computer
network defence by allowing operators to achieve better understanding and
performance while imposing less workload compared to visual techniques. SoNSTAR
identifies the features of network traffic flows by inspecting the status flags
of TCP/IP packet headers and mapping traffic events to recorded sounds to
generate a soundscape representing the real-time status of the network traffic
environment. Listening to the soundscape allows the administrator to recognise
anomalous behaviour quickly and without having to continuously watch a computer
screen.
","[{""version"":""v1"",""created"":""Tue, 19 Dec 2017 16:32:02 GMT""}]","2018-04-10"
"1712.07030","Vittorio Del Duca","Vittorio Del Duca","Iterating QCD scattering amplitudes in the high-energy limit","13 pages. Typos corrected. References added/removed. Shortened
  appendix A, results unchanged",,"10.1007/JHEP02(2018)112",,"hep-ph hep-th","http://arxiv.org/licenses/nonexclusive-distrib/1.0/","  We analyse the high-energy limit of the gluon-gluon scattering amplitude in
QCD, and display an intriguing relation between the finite parts of the
one-loop gluon impact factor and the finite parts of the two-loop Regge
trajectory.
","[{""version"":""v1"",""created"":""Tue, 19 Dec 2017 16:32:13 GMT""},{""version"":""v2"",""created"":""Mon, 19 Feb 2018 11:57:16 GMT""}]","2018-04-04"
"1712.07031","Jorge Morais","Jorge Morais, Brigitte Hiller, Alexander A. Osipov","The effects of explicit chiral symmetry breaking multiquark interactions
  on the spin 0 and 1 meson nonets: the ruling of the vector mesons","5 pages, 3 tables; based on a talk given at Hadron 2017, Salamanca",,"10.22323/1.310.0046",,"hep-ph","http://arxiv.org/licenses/nonexclusive-distrib/1.0/","  We have recently extended the scalar-pseudoscalar sector of a generalized NJL
Lagrangian that includes all NLO non derivative interactions in Nc counting
(including explicit symmetry breaking ones) in order to incorporate the spin 1
mesons in the low-lying ground state of QCD [1]. Upon bosonization, the well
known mixing of the scalar-vector and of the pseudoscalar- axial-vector fields
occurs in the quadratic part of the Lagrangian. We show that a linearized
diagonalization of these terms can be effected in a completely general way
without compromising the underlying symmetries of the Lagrangian [2]. The
resulting spin 1 mass spectra evidence a relation involving only the vector and
axial-vector meson masses and the constituent quark masses. We discuss the
dominant role of this relation in the fits and we show that the model may be
fitted to accommodate to a very good accuracy the 4 low-lying meson spectra.
","[{""version"":""v1"",""created"":""Tue, 19 Dec 2017 16:33:16 GMT""}]","2018-04-23"
"1712.07032","Sebastian Restrepo","Sebastian Restrepo, Javier Cerrillo, Philipp Strasberg and Gernot
  Schaller","From quantum heat engines to laser cooling: Floquet theory beyond the
  Born-Markov approximation","Updated version. 13 + 9 pages incl. references, appendix and 6
  figures","New J. Phys, 20, 053063 (2018)","10.1088/1367-2630/aac583",,"quant-ph","http://arxiv.org/licenses/nonexclusive-distrib/1.0/","  We combine the formalisms of Floquet theory and full counting statistics with
a Markovian embedding strategy to access the dynamics and thermodynamics of a
periodically driven thermal machine beyond the conventional Born-Markov
approximation. The working medium is a two-level system and we drive the
tunneling as well as the coupling to one bath with the same period. We identify
four different operating regimes of our machine which include a heat engine and
a refrigerator. As the coupling strength with one bath is increased, the
refrigerator regime disappears, the heat engine regime narrows and their
efficiency and coefficient of performance decrease. Furthermore, our model can
reproduce the setup of laser cooling of trapped ions in a specific parameter
limit.
","[{""version"":""v1"",""created"":""Tue, 19 Dec 2017 16:35:50 GMT""},{""version"":""v2"",""created"":""Fri, 15 Jun 2018 11:02:21 GMT""}]","2018-06-18"
"1712.07033","Masakazu Toyokawa","Masakazu Toyokawa, Masanobu Yahiro, Takuma Matsumoto, and Michio Kohno","Effects of chiral three-nucleon forces on $^{4}$He-nucleus scattering in
  a wide range of incident energies","14 pages, 15 figures",,,,"nucl-th","http://arxiv.org/licenses/nonexclusive-distrib/1.0/","  It is a current important subject to clarify properties of chiral
three-nucleon forces (3NFs) not only in nuclear matter but also in scattering
between finite-size nuclei. Particularly for the elastic scattering, this study
has just started and the properties are not understood in a wide range of
incident energies ($E_{\rm in}$). We investigate basic properties of chiral
3NFs in nuclear matter with positive energies by using the
Brueckner-Hartree-Fock method with chiral two-nucleon forces of N$^{3}$LO and
3NFs of NNLO, and analyze effects of chiral 3NFs on $^{4}$He elastic scattering
from targets $^{208}$Pb, $^{58}$Ni and $^{40}$Ca over a wide range of $30
\lesssim E_{\rm in}/A_{\rm P} \lesssim 200$ MeV by using the $g$-matrix folding
model, where $A_{\rm P}$ is the mass number of projectile. In symmetric nuclear
matter with positive energies, chiral 3NFs make the single-particle potential
less attractive and more absorptive. The effects mainly come from the
Fujita-Miyazawa 2$\pi$-exchange 3NF and slightly become larger as $E_{\rm in}$
increases. These effects persist in the optical potentials of $^{4}$He
scattering. As for the differential cross sections of $^{4}$He scattering,
chiral-3NF effects are large in $E_{\rm in}/A_{\rm P} \gtrsim 60$ MeV and
improve the agreement of the theoretical results with the measured ones.
Particularly in $E_{\rm in}/A_{\rm P} \gtrsim 100$ MeV, the folding model
reproduces measured differential cross sections pretty well. Cutoff ($\Lambda$)
dependence is investigated for both nuclear matter and $^{4}$He scattering by
considering two cases of $\Lambda=450$ and $550$ MeV. The uncertainty coming
from the dependence is smaller than chiral-3NF effects even at $E_{\rm
in}/A_{\rm P}=175$ MeV.
","[{""version"":""v1"",""created"":""Tue, 19 Dec 2017 16:37:42 GMT""},{""version"":""v2"",""created"":""Tue, 26 Dec 2017 10:51:47 GMT""}]","2017-12-27"
