"1712.07291","The ATLAS Collaboration","ATLAS Collaboration","Measurement of the production cross section of three isolated photons in
  $pp$ collisions at $\sqrt{s}$ = 8 TeV using the ATLAS detector","36 pages in total, author list starting page 20, 3 figures, 2 tables,
  published in Physics Letters B. All figures including auxiliary figures are
  available at
  http://atlas.web.cern.ch/Atlas/GROUPS/PHYSICS/PAPERS/STDM-2016-06","Phys. Lett. B 781 (2018) 55","10.1016/j.physletb.2018.03.057","CERN-EP-2017-302","hep-ex","http://creativecommons.org/licenses/by/4.0/","  A measurement of the production of three isolated photons in proton-proton
collisions at a centre-of-mass energy $\sqrt{s}$ = 8 TeV is reported. The
results are based on an integrated luminosity of 20.2 fb$^{-1}$ collected with
the ATLAS detector at the LHC. The differential cross sections are measured as
functions of the transverse energy of each photon, the difference in azimuthal
angle and in pseudorapidity between pairs of photons, the invariant mass of
pairs of photons, and the invariant mass of the triphoton system. A measurement
of the inclusive fiducial cross section is also reported. Next-to-leading-order
perturbative QCD predictions are compared to the cross-section measurements.
The predictions underestimate the measurement of the inclusive fiducial cross
section and the differential measurements at low photon transverse energies and
invariant masses. They provide adequate descriptions of the measurements at
high values of the photon transverse energies, invariant mass of pairs of
photons, and invariant mass of the triphoton system.
","[{""version"":""v1"",""created"":""Wed, 20 Dec 2017 02:37:13 GMT""},{""version"":""v2"",""created"":""Thu, 3 May 2018 16:37:55 GMT""}]","2018-05-04"
"1712.07292","Albert Yang","Albert C. Yang, Norden E. Huang, Chung-Kang Peng","Causal Decomposition in the Mutual Causation System","5 figures",,"10.1038/s41467-018-05845-7",,"physics.data-an q-bio.QM","http://arxiv.org/licenses/nonexclusive-distrib/1.0/","  Inference of causality in time series has been principally based on the
prediction paradigm. Nonetheless, the predictive causality approach may
overlook the simultaneous and reciprocal nature of causal interactions observed
in real world phenomena. Here, we present a causal decomposition approach that
is not based on prediction, but based on the instantaneous phase dependency
between the intrinsic components of a decomposed time series. The method
involves two assumptions: (1) any cause effect relationship can be quantified
with instantaneous phase dependency between the source and target decomposed as
intrinsic components at specific time scale, and (2) the phase dynamics in the
target originating from the source are separable from the target itself. Using
empirical mode decomposition, we show that the causal interaction is encoded in
instantaneous phase dependency at a specific time scale, and this phase
dependency is diminished when the causal-related intrinsic component is removed
from the effect. Furthermore, we demonstrate the generic applicability of our
method to both stochastic and deterministic systems, and show the consistency
of the causal decomposition method compared to existing methods, and finally
uncover the key mode of causal interactions in both the modelled and actual
predator prey system. We anticipate that this novel approach will assist with
revealing causal interactions in complex networks not accounted for by current
methods.
","[{""version"":""v1"",""created"":""Wed, 20 Dec 2017 02:44:42 GMT""}]","2018-10-24"
"1712.07293","Guo-An Yan","Guo-An Yan, Jia-Xin Chen, Hua Lu and Ai-Xi Chen","Room temperature high-fidelity non-adiabatic holonomic quantum
  computation on solid-state spins in Nitrogen-Vacancy centers","Some errors in the article need to be corrected",,,,"quant-ph","http://arxiv.org/licenses/nonexclusive-distrib/1.0/","  The high-speed implementation and robustness against of non-adiabatic
holonomic quantum computation provide a new idea for overcoming the difficulty
of quantum system interacting with the environment easily decoherence, which
realizing large-scale quantum computer construction. Here, we show that a
high-fidelity quantum gates to implement non-adiabatic holonomic quantum
computation under solid-state spin in Nitrogen-Vacancy(NV) centers, providing
an extensible experimental platform that has the potential for room-temperature
quantum computing, which has increased attention recent years. Compared with
the previous method, we can implement both the one and two-qubit gates by
varying the amplitude and phase of the microwave pulse applied to control the
non-Abelian geometric phase acquired by NV centers. We also find that our
proposed scheme may be implemented in the current experiment to discuss the
gate fidelity with the experimental parameters. Therefore, the scheme adopts a
new method to achieve high-fidelity non-adiabatic holonomic quantum
computation.
","[{""version"":""v1"",""created"":""Wed, 20 Dec 2017 02:47:31 GMT""},{""version"":""v2"",""created"":""Thu, 26 Apr 2018 03:07:47 GMT""},{""version"":""v3"",""created"":""Thu, 27 Dec 2018 07:05:15 GMT""},{""version"":""v4"",""created"":""Sat, 28 Mar 2020 01:10:04 GMT""}]","2020-03-31"
"1712.07294","Caiming Xiong Mr","Tianmin Shu, Caiming Xiong, Richard Socher","Hierarchical and Interpretable Skill Acquisition in Multi-task
  Reinforcement Learning","14 pages, 6 figures",,,,"cs.AI","http://arxiv.org/licenses/nonexclusive-distrib/1.0/","  Learning policies for complex tasks that require multiple different skills is
a major challenge in reinforcement learning (RL). It is also a requirement for
its deployment in real-world scenarios. This paper proposes a novel framework
for efficient multi-task reinforcement learning. Our framework trains agents to
employ hierarchical policies that decide when to use a previously learned
policy and when to learn a new skill. This enables agents to continually
acquire new skills during different stages of training. Each learned task
corresponds to a human language description. Because agents can only access
previously learned skills through these descriptions, the agent can always
provide a human-interpretable description of its choices. In order to help the
agent learn the complex temporal dependencies necessary for the hierarchical
policy, we provide it with a stochastic temporal grammar that modulates when to
rely on previously learned skills and when to execute new skills. We validate
our approach on Minecraft games designed to explicitly test the ability to
reuse previously learned skills while simultaneously learning new skills.
","[{""version"":""v1"",""created"":""Wed, 20 Dec 2017 02:50:20 GMT""}]","2017-12-21"
"1712.07295","Li-Ye Xiao","Li-Ye Xiao, Qi-Fang L\""u and Shi-Lin Zhu","Strong decays of the 1P and 2D doubly charmed states","12 pages,7 figures","Phys. Rev. D 97, 074005 (2018)","10.1103/PhysRevD.97.074005",,"hep-ph","http://arxiv.org/licenses/nonexclusive-distrib/1.0/","  We perform a systematical investigation of the strong decay properties of the
low-lying $1P$- and $2D$-wave doubly charmed baryons with the $^3P_0$ quark
pair creation model. The main predictions include: (i) in the $\Xi_{cc}$ and
$\Omega_{cc}$ family, the $1P~\rho$ mode excitations with $J^P=1/2^-$ and
$3/2^-$ should be the fairly narrow states. (ii) For the $1P~\lambda$ mode
excitations, $|^2P_{\lambda}\frac{3}{2}^-\rangle$ and
$|^4P_{\lambda}\frac{3}{2}^-\rangle$ have a width of $\Gamma\sim150$ MeV, and
mainly decay into the $J^P=3/2^+$ ground state. Meanwhile,
$|^2P_{\lambda}\frac{1}{2}^-\rangle$ and $|^4P_{\lambda}\frac{5}{2}^-\rangle$
are the narrow states with a width of $\Gamma\sim40$ MeV, and mainly decay into
the ground state with $J^P=1/2^+$. (iii) The $2D_{\rho\rho}$ states mainly
decay via emitting a heavy-light meson if their masses are above the threshold
of $\Lambda_cD$ or $\Xi_cD$, respectively. Their strong decay widths are
sensitive to the masses and can reach several tens MeV. (iv) The
$2D_{\lambda\lambda}$ states may be broad states with a width of $\Gamma>100$
MeV. It should be emphasized that the states with $J^P=3/2^+$ and $5/2^+$
mainly decay into the ground state with $J^P=3/2^+$ plus a light-flavor meson,
while the states with $J^P=1/2^+$ and $7/2^+$ mainly decay into the ground
state with $J^P=1/2^+$ plus a light-flavor meson.
","[{""version"":""v1"",""created"":""Wed, 20 Dec 2017 02:51:14 GMT""}]","2018-04-11"
"1712.07296","Caiming Xiong Mr","Huishuai Zhang, Caiming Xiong, James Bradbury, Richard Socher","Block-diagonal Hessian-free Optimization for Training Neural Networks","10 pages, 3 figures",,,,"cs.LG cs.AI stat.ML","http://arxiv.org/licenses/nonexclusive-distrib/1.0/","  Second-order methods for neural network optimization have several advantages
over methods based on first-order gradient descent, including better scaling to
large mini-batch sizes and fewer updates needed for convergence. But they are
rarely applied to deep learning in practice because of high computational cost
and the need for model-dependent algorithmic variations. We introduce a variant
of the Hessian-free method that leverages a block-diagonal approximation of the
generalized Gauss-Newton matrix. Our method computes the curvature
approximation matrix only for pairs of parameters from the same layer or block
of the neural network and performs conjugate gradient updates independently for
each block. Experiments on deep autoencoders, deep convolutional networks, and
multilayer LSTMs demonstrate better convergence and generalization compared to
the original Hessian-free approach and the Adam method.
","[{""version"":""v1"",""created"":""Wed, 20 Dec 2017 02:52:35 GMT""}]","2017-12-21"
"1712.07297","Chao Chen","Chao Chen, Hadi Pouransari, Sivasankaran Rajamanickam, Erik G. Boman,
  Eric Darve","A distributed-memory hierarchical solver for general sparse linear
  systems",,,,,"math.NA cs.MS cs.NA","http://arxiv.org/licenses/nonexclusive-distrib/1.0/","  We present a parallel hierarchical solver for general sparse linear systems
on distributed-memory machines. For large-scale problems, this fully algebraic
algorithm is faster and more memory-efficient than sparse direct solvers
because it exploits the low-rank structure of fill-in blocks. Depending on the
accuracy of low-rank approximations, the hierarchical solver can be used either
as a direct solver or as a preconditioner. The parallel algorithm is based on
data decomposition and requires only local communication for updating boundary
data on every processor. Moreover, the computation-to-communication ratio of
the parallel algorithm is approximately the volume-to-surface-area ratio of the
subdomain owned by every processor. We present various numerical results to
demonstrate the versatility and scalability of the parallel algorithm.
","[{""version"":""v1"",""created"":""Wed, 20 Dec 2017 02:54:20 GMT""}]","2017-12-21"
"1712.07298","Ross Cawthon","R. Cawthon, C. Davis, M. Gatti, P. Vielzeuf, J. Elvin-Poole, E. Rozo,
  J. Frieman, E. S. Rykoff, A. Alarcon, G. M. Bernstein, C. Bonnett, A. Carnero
  Rosell, F. J. Castander, C. Chang, L. N. da Costa, J. De Vicente, J. DeRose,
  A. Drlica-Wagner, E. Gaztanaga, T. Giannantonio, D. Gruen, J. Gschwend, W. G.
  Hartley, B. Hoyle, H. Lin, M. A. G. Maia, R. Miquel, R. L. C. Ogando, M. M.
  Rau, A. Roodman, A. J. Ross, I. Sevilla-Noarbe, M. A. Troxel, R. H. Wechsler,
  T. M. C. Abbott, F. B. Abdalla, S. Allam, J. Annis, S. Avila, M. Banerji, K.
  Bechtol, R. A. Bernstein, E. Bertin, D. Brooks, D. L. Burke, M. Carrasco
  Kind, J. Carretero, C. E. Cunha, C. B. D'Andrea, D. L. DePoy, S. Desai, H. T.
  Diehl, P. Doel, T. F. Eifler, A. E. Evrard, B. Flaugher, P. Fosalba, J.
  Garc\'ia-Bellido, D. W. Gerdes, R. A. Gruendl, G. Gutierrez, D. Hollowood, K.
  Honscheid, D. J. James, T. Jeltema, E. Krause, K. Kuehn, S. Kuhlmann, N.
  Kuropatkin, O. Lahav, M. Lima, J. L. Marshall, P. Martini, F. Menanteau, C.
  J. Miller, A. A. Plazas, E. Sanchez, V. Scarpine, R. Schindler, M. Schubnell,
  E. Sheldon, M. Smith, R. C. Smith, M. Soares-Santos, F. Sobreira, E. Suchyta,
  M. E. C. Swanson, G. Tarle, D. Thomas, D. L. Tucker, A. R. Walker","Dark Energy Survey Year 1 Results: Calibration of redMaGiC Redshift
  Distributions in DES and SDSS from Cross-Correlations","18 pages, 12 figures. Minor changes to text to match version accepted
  by MNRAS",,"10.1093/mnras/sty2424","FERMILAB-PUB-17-594-AE","astro-ph.CO","http://arxiv.org/licenses/nonexclusive-distrib/1.0/","  We present calibrations of the redshift distributions of redMaGiC galaxies in
the Dark Energy Survey Year 1 (DES Y1) and Sloan Digital Sky Survey (SDSS) DR8
data. These results determine the priors of the redshift distribution of
redMaGiC galaxies, which were used for galaxy clustering measurements and as
lenses for galaxy-galaxy lensing measurements in DES Y1 cosmological analyses.
We empirically determine the bias in redMaGiC photometric redshift estimates
using angular cross-correlations with Baryon Oscillation Spectroscopic Survey
(BOSS) galaxies. For DES, we calibrate a single parameter redshift bias in
three photometric redshift bins: $z \in[0.15,0.3]$, [0.3,0.45], and [0.45,0.6].
Our best fit results in each bin give photometric redshift biases of $|\Delta
z|<0.01$. To further test the redMaGiC algorithm, we apply our calibration
procedure to SDSS redMaGiC galaxies, where the statistical precision of the
cross-correlation measurement is much higher due to a greater overlap with BOSS
galaxies. For SDSS, we also find best fit results of $|\Delta z|<0.01$. We
compare our results to other analyses of redMaGiC photometric redshifts.
","[{""version"":""v1"",""created"":""Wed, 20 Dec 2017 02:57:28 GMT""},{""version"":""v2"",""created"":""Wed, 3 Oct 2018 20:05:00 GMT""}]","2018-10-05"
"1712.07299","Saber Moradi","Saber Moradi, Sunil A. Bhave and Rajit Manohar","Energy-efficient Hybrid CMOS-NEMS LIF Neuron Circuit in 28 nm CMOS
  Process",,,,,"cs.ET","http://arxiv.org/licenses/nonexclusive-distrib/1.0/","  Designing analog sub-threshold neuromorphic circuits in deep sub-micron
technologies e.g. 28 nm can be a daunting task due to the problem of excessive
leakage current. We propose novel energy-efficient hybrid CMOS-nano
electro-mechanical switches (NEMS) Leaky Integrate and Fire (LIF) neuron and
synapse circuits and investigate the impact of NEM switches on the leakage
power and overall energy consumption. We analyze the performance of
biologically-inspired neuron circuit in terms of leakage power consumption and
present new energy-efficient neural circuits that operate with biologically
plausible firing rates. Our results show the proposed CMOS-NEMS neuron circuit
is, on average, 35% more energy-efficient than its CMOS counterpart with same
complexity in 28 nm process. Moreover, we discuss how NEM switches can be
utilized to further improve the scalability of mixed-signal neuromorphic
circuits.
","[{""version"":""v1"",""created"":""Tue, 19 Dec 2017 17:20:28 GMT""}]","2017-12-21"
"1712.07305","Bo Xin","Xiangyu Kong, Bo Xin, Fangchen Liu, Yizhou Wang","Revisiting the Master-Slave Architecture in Multi-Agent Deep
  Reinforcement Learning",,,,,"cs.AI","http://arxiv.org/licenses/nonexclusive-distrib/1.0/","  Many tasks in artificial intelligence require the collaboration of multiple
agents. We exam deep reinforcement learning for multi-agent domains. Recent
research efforts often take the form of two seemingly conflicting perspectives,
the decentralized perspective, where each agent is supposed to have its own
controller; and the centralized perspective, where one assumes there is a
larger model controlling all agents. In this regard, we revisit the idea of the
master-slave architecture by incorporating both perspectives within one
framework. Such a hierarchical structure naturally leverages advantages from
one another. The idea of combining both perspectives is intuitive and can be
well motivated from many real world systems, however, out of a variety of
possible realizations, we highlights three key ingredients, i.e. composed
action representation, learnable communication and independent reasoning. With
network designs to facilitate these explicitly, our proposal consistently
outperforms latest competing methods both in synthetic experiments and when
applied to challenging StarCraft micromanagement tasks.
","[{""version"":""v1"",""created"":""Wed, 20 Dec 2017 03:00:46 GMT""}]","2017-12-21"
"1712.07306","Hyungseok Moon","Hyungseok Chad Moon and Kyungsun Moon","Random Walk by Majority Rule and L\'evy walk",,,,,"physics.bio-ph physics.data-an","http://arxiv.org/licenses/nonexclusive-distrib/1.0/","  We have studied a random walk model based on majority rule. At a given
instant, the moving direction of a cargo is determined by motor coordination
mediated by a tug-of-war mechanism between two kinds of competing motor
proteins. We have demonstrated that the probability distribution $P(t)$ for
unidirectional run time $t$ of a cargo can be remarkably described by Levy walk
for $t<\gamma_u^{-1}$ as $P(t)\propto t^{-3/2} e^{-\gamma_u t}$ with $\gamma_u$
being the unbinding rate of a motor protein from microtubule. The mean squared
displacement of a cargo changes from super-diffusive behavior $\langle
X^2\rangle\propto t^2$ for $t<\gamma_u^{-1}$ to normal diffusion $\langle
X^2\rangle\propto t$ for $t>\gamma_u^{-1}$. By considering the correlation
effect in binding of a motor protein to microtubule, we have shown that Levy
walk behavior of $P(t)\propto t^{-{3/2}}$ persists robustly against
correlations only adding an effective cutoff time $\gamma_b/\gamma_c^2$ with
$\gamma_c$ representing the amount of correlations.
","[{""version"":""v1"",""created"":""Wed, 20 Dec 2017 03:03:03 GMT""},{""version"":""v2"",""created"":""Sat, 30 Dec 2017 06:44:10 GMT""}]","2018-01-03"
"1712.07307","Jian Li","Nitish K. Panigrahy, Jian Li, Don Towsley, Christopher V. Hollot","Network Cache Design under Stationary Requests: Exact Analysis and
  Poisson Approximation",,,,,"cs.NI cs.PF","http://arxiv.org/licenses/nonexclusive-distrib/1.0/","  The design of caching algorithms to maximize hit probability has been
extensively studied. In this paper, we associate each content with a utility,
which is a function of either the corresponding content hit rate or hit
probability. We formulate a cache optimization problem to maximize the sum of
utilities over all contents under stationary and ergodic request processes.
This problem is non-convex in general but we reformulate it as a convex
optimization problem when the inter-request time (irt) distribution has a
non-increasing hazard rate function. We provide explicit optimal solutions for
some irt distributions, and compare the solutions of the hit-rate based (HRB)
and hit-probability based (HPB) problems. We formulate a reverse engineering
based dual implementation of LRU under stationary arrivals. We also propose
decentralized algorithms that can be implemented using limited information and
use a discrete time Lyapunov technique (DTLT) to correctly characterize their
stability. We find that decentralized algorithms that solve HRB are more robust
than decentralized HPB algorithms. Informed by these results, we further
propose lightweight Poisson approximate decentralized and online algorithms
that are accurate and efficient in achieving optimal hit rates and hit
probabilities.
","[{""version"":""v1"",""created"":""Wed, 20 Dec 2017 03:06:48 GMT""},{""version"":""v2"",""created"":""Mon, 9 Apr 2018 17:31:08 GMT""},{""version"":""v3"",""created"":""Tue, 5 Mar 2019 14:05:14 GMT""}]","2019-03-06"
"1712.07308","Serkan Gugercin","Andrea Carracedo Rodriguez and Serkan Gugercin and Jeff Borggaard","Interpolatory Model Reduction of Parameterized Bilinear Dynamical
  Systems",,,,,"math.NA cs.SY math.DS","http://arxiv.org/licenses/nonexclusive-distrib/1.0/","  Interpolatory projection methods for model reduction of nonparametric linear
dynamical systems have been successfully extended to nonparametric bilinear
dynamical systems. However, this is not the case for parametric bilinear
systems. In this work, we aim to close this gap by providing a natural
extension of interpolatory projections to model reduction of parametric
bilinear dynamical systems. We introduce necessary conditions that the
projection subspaces must satisfy to obtain parametric tangential interpolation
of each subsystem transfer function. These conditions also guarantee that the
parameter sensitivities (Jacobian) of each subsystem transfer function is
matched tangentially by those of the corresponding reduced order model transfer
function. Similarly, we obtain conditions for interpolating the parameter
Hessian of the transfer function by including extra vectors in the projection
subspaces. As in the parametric linear case, the basis construction for
two-sided projections does not require computing the Jacobian or the Hessian.
","[{""version"":""v1"",""created"":""Wed, 20 Dec 2017 03:09:33 GMT""}]","2017-12-21"
"1712.07309","James Van Zandt","James R. Van Zandt","Efficient Cubature Rules","26 pages, 4 figures, 95 supplemental files. The 10 point rule for
  E_2^{r^2} was known, but had not been published. It was found by Jankewitz
  (private communication to R. Cools, 1998). Both the 15 and 16 point formulas
  of degree 4 for the sphere in 4 dimensions are new, and different from the 16
  point formula found by Mysovskih","Electronic Transactions on Numerical Analysis, vol 51, pp 219-239,
  2019","10.1553/etna_vol51s219",,"math.NA cs.NA","http://arxiv.org/licenses/nonexclusive-distrib/1.0/","  73 new cubature rules are found for three standard multidimensional integrals
with spherically symmetric regions and weights, using direct search with a
numerical zero-finder. All but four of the new rules have fewer integration
points than known rules of the same degree, and twenty are within three points
of M{\""o}ller's lower bound. Most have all positive coefficients and most have
some symmetry, including some supported by one or two concentric spheres. They
include degree 7 formulas for integration over the sphere and Gaussian-weighted
integrals over all space, each in 6 and 7 dimensions, with 127 and 183 points,
respectively.
","[{""version"":""v1"",""created"":""Wed, 20 Dec 2017 03:26:30 GMT""},{""version"":""v2"",""created"":""Tue, 3 Apr 2018 01:05:54 GMT""},{""version"":""v3"",""created"":""Sun, 16 Jun 2019 02:12:08 GMT""}]","2019-08-09"
"1712.07310","Pramod  Shukla","Xin Gao, Pramod Shukla, Rui Sun","Symplectic formulation of the type IIA nongeometric scalar potential","v4: 33 pages, typos fixed in eqn. (4.22) and (4.23), and some
  cosmetic changes in the title; version to appear in PRD","Phys. Rev. D 98, 046009 (2018)","10.1103/PhysRevD.98.046009","IFT-UAM/CSIC-17-121","hep-th math-ph math.MP","http://arxiv.org/licenses/nonexclusive-distrib/1.0/","  We study the four-dimensional (4D) scalar potential arising from a
generalized type IIA flux superpotential including the (non-)geometric fluxes.
First, we show that using a set of peculiar flux combinations, the 4D scalar
potential can be formulated into a very compact form. This is what we call as
the `symplectic formulation' from which one could easily anticipate the
ten-dimensional origin of the effective scalar potential. We support our
formulation through an alternate derivation of the scalar potential via
considering the Double Field Theory (DFT) reduction on a generic Calabi Yau
orientifold. In addition, we also exemplify the insights of our formulation
with explicit computations for two concrete toroidal examples using
orientifolds of the complex threefolds ${\mathbb T}^6/{({\mathbb Z}_2 \times
{\mathbb Z}_2)}$ and ${\mathbb T}^6/{\mathbb Z}_4$.
","[{""version"":""v1"",""created"":""Wed, 20 Dec 2017 03:29:13 GMT""},{""version"":""v2"",""created"":""Wed, 27 Dec 2017 00:06:25 GMT""},{""version"":""v3"",""created"":""Wed, 2 May 2018 22:25:37 GMT""},{""version"":""v4"",""created"":""Thu, 26 Jul 2018 10:09:06 GMT""}]","2023-02-02"
"1712.07311","Aidan Dang","Aidan Dang, Charles D. Hill, Lloyd C. L. Hollenberg","Optimising Matrix Product State Simulations of Shor's Algorithm","8 pages, 2 figures, 2 tables. v2 using PDFLaTeX compiler. v3 to
  include extra references. v4 for publication in Quantum","Quantum 3, 116 (2019)","10.22331/q-2019-01-25-116",,"quant-ph","http://creativecommons.org/licenses/by/4.0/","  We detail techniques to optimise high-level classical simulations of Shor's
quantum factoring algorithm. Chief among these is to examine the entangling
properties of the circuit and to effectively map it across the one-dimensional
structure of a matrix product state. Compared to previous approaches whose
space requirements depend on $r$, the solution to the underlying order-finding
problem of Shor's algorithm, our approach depends on its factors. We performed
a matrix product state simulation of a 60-qubit instance of Shor's algorithm
that would otherwise be infeasible to complete without an optimised
entanglement mapping.
","[{""version"":""v1"",""created"":""Wed, 20 Dec 2017 03:49:39 GMT""},{""version"":""v2"",""created"":""Thu, 21 Dec 2017 03:25:20 GMT""},{""version"":""v3"",""created"":""Mon, 2 Jul 2018 07:37:25 GMT""},{""version"":""v4"",""created"":""Wed, 9 Jan 2019 07:38:15 GMT""}]","2019-01-28"
