"1712.07149","Laurence Mailaender","Arkady Molev-Shteiman, Laurence Mailaender, Xiao-Feng Qi","Distributed Massive MIMO Channel Estimation and Channel Database
  Assistance",,,,,"cs.IT math.IT","http://arxiv.org/licenses/nonexclusive-distrib/1.0/","  Due to the low per-antenna SNR and high signaling overhead, channel
estimation is a major bottleneck in Massive MIMO systems. Spatial constraints
can improve estimation performance by exploiting sparsity. Solutions exist for
far field - beam domain channel estimation based on angle of arrival
estimation. However, there is no equivalent solution for near field and
distributed MIMO spatial channel estimation. We present a solution- source
domain channel estimation- that is based on source location estimation. We
extend this to employ a ""Channel Database"" incorporating information about the
physical scattering environment into channel estimation. We present methods for
generation, storage and usage of the Channel Database to assist localization
and communication.
","[{""version"":""v1"",""created"":""Tue, 19 Dec 2017 19:06:21 GMT""}]","2017-12-21"
"1712.07150","Ahmad Sabra","Piotr Rybka, Ahmad Sabra","The planar Least Gradient problem in convex domains",,,,,"math.AP","http://arxiv.org/licenses/nonexclusive-distrib/1.0/","  We study the two dimensional least gradient problem in a convex, but not
necessary strictly convex region. We look for solutions in the space of $BV$
functions satisfying the boundary data $f$ in trace sense. We assume that $f$
is in $BV$ too. We state admissibility conditions on the trace and on the
domain that are sufficient for existence of solutions.
","[{""version"":""v1"",""created"":""Tue, 19 Dec 2017 19:08:03 GMT""}]","2017-12-21"
"1712.07151","Gabriel Menezes","G. Menezes","Entanglement dynamics in a Kerr spacetime","Accepted for publication in Physical Review D","Phys. Rev. D 97, 085021 (2018)","10.1103/PhysRevD.97.085021",,"gr-qc hep-th quant-ph","http://arxiv.org/licenses/nonexclusive-distrib/1.0/","  We consider the entanglement dynamics between two-level atoms in a rotating
black hole background. In our model the two-atom system is envisaged as an open
system coupled with a massless scalar field prepared in one of the physical
vacuum states of interest. We employ the quantum master equation in the
Born-Markov approximation in order to describe the time evolution of the atomic
subsystem. We investigate two different states of motion for the atoms, namely
static atoms and also stationary atoms with zero angular momentum. The purpose
of this work is to expound the impact on the creation of entanglement coming
from the combined action of the different physical processes underlying the
Hawking effect and the Unruh-Starobinskii effect. We demonstrate that, in the
scenario of rotating black holes, the degree of quantum entanglement is
significantly modified due to the phenomenon of superradiance in comparison
with the analogous cases in a Schwarzschild spacetime. In the perspective of a
zero angular momentum observer (ZAMO), one is allowed to probe entanglement
dynamics inside the ergosphere, since static observers cannot exist within such
a region. On the other hand, the presence of superradiant modes could be a
source for violation of complete positivity. This is verified when the quantum
field is prepared in the Frolov-Thorne vacuum state. In this exceptional
situation, we raise the possibility that the loss of complete positivity is due
to the breakdown of the Markovian approximation, which means that any arbitrary
physically admissible initial state of the two atoms would not be capable to
hold, with time evolution, its interpretation as a physical state inasmuch as
negative probabilities are generated by the dynamical map.
","[{""version"":""v1"",""created"":""Tue, 19 Dec 2017 19:08:10 GMT""},{""version"":""v2"",""created"":""Tue, 17 Apr 2018 02:46:36 GMT""}]","2018-05-09"
"1712.07152","Mahouton    Norbert Hounkonnou","Mahouton Norbert Hounkonnou and Gbevewou Damien Houndedji","Double constructions of Heisenberg Frobenius algebras and Connes
  cocycles, and solutions of the three-dimensional associative Yang-Baxter
  equation",,,,,"math.RA","http://arxiv.org/licenses/nonexclusive-distrib/1.0/","  We consider the three-dimensional associative algebra H consisting of the 3x3
strictly upper triangular matrices whose the commutator is the Heisenberg Lie
algebra. We determine the solutions of the Yang-Baxter associative equation in
H. For the antisymmetric solutions, the corresponding bialgebraic structures,
double constructions of Frobenius algebras and properties are given
explicitly.Besides, we determine some related compatible dendriform algebras
and solutions of their D-equations. Using symmetric solutions of these
equations, we build the double constructions of related Connes cocycles.
Finally, we compute solutions of the three-dimensional non decomposable
associative Yang-Baxter equation and build the double constructions of
associated Frobenius algebras.
","[{""version"":""v1"",""created"":""Tue, 19 Dec 2017 19:09:33 GMT""}]","2017-12-21"
"1712.07153","David Pere\~n\'iguez Mr","Cristiano Germani and David Pere\~niguez","Remnants in two-dimensional quantum gravity","6 pages, 3 figures","Phys. Rev. D 97, 126011 (2018)","10.1103/PhysRevD.97.126011","ICCUB-17-023","hep-th gr-qc","http://arxiv.org/licenses/nonexclusive-distrib/1.0/","  In this work we consider a two-dimensional quantum black hole sourced by the
trace anomaly of a conformal field theory. By using holography, we are able to
prove that the black hole size is always proportional to the number of states
inside the black hole, a result that might be interpreted as a two dimensional
version of the Bekenstein entropy law. Finally, we also show that such a black
hole has a minimal size (a remnant). Extrapolating this result for higher
dimensions, we show that this would imply that the remnant has a size way
larger than the Planck length and is, therefore, always weakly coupled.
","[{""version"":""v1"",""created"":""Tue, 19 Dec 2017 19:09:40 GMT""},{""version"":""v2"",""created"":""Sun, 24 Dec 2017 12:04:01 GMT""}]","2018-06-27"
"1712.07154","Alex Abraham","Alex Abraham, Apratim Chatterji","Self assembled linear polymeric chains with tuneable semiflexibility
  using isotropic interactions","14 pages, 8 figures and 6 supplementary figures",,"10.1063/1.5018462",,"cond-mat.soft","http://arxiv.org/licenses/nonexclusive-distrib/1.0/","  We propose a two-body spherically symmetric (isotropic) potential such that
particles interacting by the potential self assemble into linear semiflexible
polymeric chains without branching. By suitable control of the potential
parameters we can control the persistence length of the polymer, and can even
introduce a controlled number of branches. Thus we show how to achieve
effective directional interactions starting from spherically symmetric
potentials. The self assembled polymers have a exponential distribution of
chain lengths akin to what is observed for worm-like micellar systems. On
increasing particle density the polymeric chains self-organize to an ordered
line-hexagonal phase where every chain is surrounded by six parallel chains,
the transition is first order. On further increase in monomer density, the
order is destroyed and we get a branched gel like phase. This potential can be
used to model semi-flexible equilibrium polymers with tunable semiflexibility
and excluded volume. The use of the potential is computationally cheap and
hence, can be used to simulate and probe complex micellar dynamics with long
chains. The potential also gives a plausible method of tuning colloidal
interactions in experiments such that one can obtain self-assembling polymeric
chains made up of colloids and probe polymer dynamics using an optical
microscope.
","[{""version"":""v1"",""created"":""Tue, 19 Dec 2017 19:11:30 GMT""}]","2018-05-09"
"1712.07155","Ernesto Perez-Chavela epc","Montserrat Corbera, Josep M. Cors, Jaume Llibre, Ernesto Perez-Chavela","Trapezoid central configurations",,,,,"math.DS","http://arxiv.org/licenses/nonexclusive-distrib/1.0/","  We classify all planar four-body central configurations where two pairs of
the bodies are on parallel lines. Using Cartesian coordinates, we show that the
set of four-body trapezoid central configurations with positive masses forms a
two-dimensional surface where two symmetric families, the rhombus and isosceles
trapezoid, are on its boundary. We also prove that, for a given position of the
bodies, in some cases an specific order of the masses determine the geometry of
the configuration, namely acute or obtuse trapezoid central configuration. We
also prove the existence on non-symmetric trapezoid central configuration with
two pairs of equal masses.
","[{""version"":""v1"",""created"":""Tue, 19 Dec 2017 19:12:17 GMT""}]","2017-12-21"
"1712.07156","Muhammad Akashi","Muhammad Akashi, Ealeal Bear, and Noam Soker. (Technion, Israel)","Forming H-shaped and barrel-shaped nebulae with interacting jets","28 pages, 12 figures. Submitted",,"10.1093/mnras/sty029",,"astro-ph.SR","http://arxiv.org/licenses/nonexclusive-distrib/1.0/","  We conduct three-dimensional hydrodynamical simulations of two opposite jets
launched from a binary stellar system into a previously ejected shell and show
that the interaction can form barrel-like and H-like shapes in the descendant
nebula. Such features are observed in planetary nebulae and supernova remnants.
Under our assumption the dense shell is formed by a short instability phase of
the giant star as it interacts with a stellar companion, and the jets are then
launched by the companion as it accretes mass through an accretion disk from
the giant star. We find that the H-shaped and barrel-shaped morphological
features that the jets form evolve with time, and that there are complicated
flow patterns, such as vortices, instabilities, and caps moving ahead along the
symmetry axis. We compare our numerical results with images of 12 planetary
nebulae, and show that jet-shell interaction that we simulate can account for
the barrel-like or H-like morphologies that are observed in these PNe.
","[{""version"":""v1"",""created"":""Tue, 19 Dec 2017 19:16:41 GMT""}]","2018-01-24"
"1712.07157","Bruno Amorim","Jo\~ao E. H. Braz, B. Amorim, Eduardo V. Castro","Valley polarized magnetic state in hole-doped mono layers of transition
  metal dichalcogenides","5 pages, 3 figures","Phys. Rev. B 98, 161406 (2018)","10.1103/PhysRevB.98.161406",,"cond-mat.mes-hall cond-mat.mtrl-sci cond-mat.str-el","http://arxiv.org/licenses/nonexclusive-distrib/1.0/","  We compute the valley/magnetic phase diagram of mono layers of transition
metal dichalcogenides in the hole doped region where spin-orbit effects are
particularly relevant. Taking into account the moderate to high local
electron-electron interactions due to the presence of transition metal atoms,
we show that the system is unstable to an itinerant ferromagnetic phase where
all charge carriers are spin and valley polarized. This phase shows an
anomalous charge Hall and anomalous spin-Hall response, and may thus be
detected experimentally.
","[{""version"":""v1"",""created"":""Tue, 19 Dec 2017 19:18:56 GMT""}]","2018-10-24"
"1712.07158","The CMS Collaboration","CMS Collaboration","Identification of heavy-flavour jets with the CMS detector in pp
  collisions at 13 TeV","Replaced with the published version. Added the journal reference and
  the DOI. All the figures and tables can be found at
  http://cms-results.web.cern.ch/cms-results/public-results/publications/BTV-16-002
  (CMS Public Pages)","JINST 13 (2018) P05011","10.1088/1748-0221/13/05/P05011","CMS-BTV-16-002, CERN-EP-2017-326","physics.ins-det hep-ex","http://creativecommons.org/licenses/by/4.0/","  Many measurements and searches for physics beyond the standard model at the
LHC rely on the efficient identification of heavy-flavour jets, i.e. jets
originating from bottom or charm quarks. In this paper, the discriminating
variables and the algorithms used for heavy-flavour jet identification during
the first years of operation of the CMS experiment in proton-proton collisions
at a centre-of-mass energy of 13 TeV, are presented. Heavy-flavour jet
identification algorithms have been improved compared to those used previously
at centre-of-mass energies of 7 and 8 TeV. For jets with transverse momenta in
the range expected in simulated $\mathrm{t}\overline{\mathrm{t}}$ events, these
new developments result in an efficiency of 68% for the correct identification
of a b jet for a probability of 1% of misidentifying a light-flavour jet. The
improvement in relative efficiency at this misidentification probability is
about 15%, compared to previous CMS algorithms. In addition, for the first time
algorithms have been developed to identify jets containing two b hadrons in
Lorentz-boosted event topologies, as well as to tag c jets. The large data
sample recorded in 2016 at a centre-of-mass energy of 13 TeV has also allowed
the development of new methods to measure the efficiency and misidentification
probability of heavy-flavour jet identification algorithms. The heavy-flavour
jet identification efficiency is measured with a precision of a few per cent at
moderate jet transverse momenta (between 30 and 300 GeV) and about 5% at the
highest jet transverse momenta (between 500 and 1000 GeV).
","[{""version"":""v1"",""created"":""Tue, 19 Dec 2017 19:19:00 GMT""},{""version"":""v2"",""created"":""Tue, 8 May 2018 19:48:01 GMT""}]","2018-05-10"
"1712.07159","Mathias Vetter","Ole Martin and Mathias Vetter","The null hypothesis of common jumps in case of irregular and
  asynchronous observations",,,,,"math.ST stat.TH","http://arxiv.org/licenses/nonexclusive-distrib/1.0/","  This paper proposes novel tests for the absence of jumps in a univariate
semimartingale and for the absence of common jumps in a bivariate
semimartingale. Our methods rely on ratio statistics of power variations based
on irregular observations, sampled at different frequencies. We develop central
limit theorems for the statistics under the respective null hypotheses and
apply bootstrap procedures to assess the limiting distributions. Further we
define corrected statistics to improve the finite sample performance.
Simulations show that the test based on our corrected statistic yields good
results and even outperforms existing tests in the case of regular
observations.
","[{""version"":""v1"",""created"":""Tue, 19 Dec 2017 19:23:30 GMT""}]","2017-12-21"
"1712.07160","Hugues Beauchesne","Hugues Beauchesne, Enrico Bertuzzo, Giovanni Grilli di Cortona, Zahra
  Tabrizi","Collider phenomenology of Hidden Valley mediators of spin 0 or 1/2 with
  semivisible jets","40 pages, 11 figures, published version",,"10.1007/JHEP08(2018)030",,"hep-ph","http://arxiv.org/licenses/nonexclusive-distrib/1.0/","  Many models of Beyond the Standard Model physics contain particles that are
charged under both Standard Model and Hidden Valley gauge groups, yet very
little effort has been put into establishing their experimental signatures. We
provide a general overview of the collider phenomenology of spin 0 or 1/2
mediators with non-trivial gauge numbers under both the Standard Model and a
single new confining group. Due to the possibility of many unconventional
signatures, the focus is on direct production with semivisible jets. For the
mediators to be able to decay, a global $U(1)$ symmetry must be broken. This is
best done by introducing a set of operators explicitly violating this symmetry.
We find that there is only a finite number of such renormalizable operators and
that the phenomenology can be classified into five distinct categories. We show
that large regions of the parameter space are already excluded, while others
are unconstrained by current search strategies. We also discuss how searches
could be modified to better probe these unconstrained regions by exploiting
special properties of semivisible jets.
","[{""version"":""v1"",""created"":""Tue, 19 Dec 2017 19:24:08 GMT""},{""version"":""v2"",""created"":""Tue, 14 Aug 2018 18:45:35 GMT""}]","2018-08-29"
"1712.07161","Yahia Shabara","Yahia Shabara, C. Emre Koksal and Eylem Ekici","Linear Block Coding for Efficient Beam Discovery in Millimeter Wave
  Communication Networks","To appear in the proceedings of IEEE INFOCOM '18",,,,"cs.IT math.IT","http://arxiv.org/licenses/nonexclusive-distrib/1.0/","  The surge in mobile broadband data demands is expected to surpass the
available spectrum capacity below 6 GHz. This expectation has prompted the
exploration of millimeter wave (mm-wave) frequency bands as a candidate
technology for next generation wireless networks. However, numerous challenges
to deploying mm-wave communication systems, including channel estimation, need
to be met before practical deployments are possible. This work addresses the
mm-wave channel estimation problem and treats it as a beam discovery problem in
which locating beams with strong path reflectors is analogous to locating
errors in linear block codes. We show that a significantly small number of
measurements (compared to the original dimensions of the channel matrix) is
sufficient to reliably estimate the channel. We also show that this can be
achieved using a simple and energy-efficient transceiver architecture.
","[{""version"":""v1"",""created"":""Tue, 19 Dec 2017 19:25:11 GMT""}]","2017-12-21"
"1712.07162","Erick Franklin","Carlos Azael Alvarez Zambrano, Erick de Moraes Franklin","Birth of a subaqueous barchan dune","Accepted manuscript for PHYSICAL REVIEW E 96, 062906 (2017), DOI:
  10.1103/PhysRevE.96.062906","Alvarez, C.A, Franklin, E.M., Birth of a subaqueous barchan dune.
  Physical Review E, v. 96, n. 062906, 2017,
  https://journals.aps.org/pre/abstract/10.1103/PhysRevE.96.062906","10.1103/PhysRevE.96.062906",,"physics.flu-dyn","http://arxiv.org/licenses/nonexclusive-distrib/1.0/","  Barchan dunes are crescentic shape dunes with horns pointing downstream. The
present paper reports the formation of subaqueous barchan dunes from initially
conical heaps in a rectangular channel. Because the most unique feature of a
barchan dune is its horns, we associate the timescale for the appearance of
horns to the formation of a barchan dune. A granular heap initially conical was
placed on the bottom wall of a closed conduit and it was entrained by a water
flow in turbulent regime. After a certain time, horns appear and grow, until an
equilibrium length is reached. Our results show the existence of the timescales
$0.5t_c$ and $2.5t_c$ for the appearance and equilibrium of horns,
respectively, where $t_c$ is a characteristic time that scales with the grains
diameter, gravity acceleration, densities of the fluid and grains, and shear
and threshold velocities.
","[{""version"":""v1"",""created"":""Tue, 19 Dec 2017 19:27:14 GMT""},{""version"":""v2"",""created"":""Fri, 5 Oct 2018 01:57:35 GMT""}]","2018-10-08"
"1712.07163","Cristina Furlanetto","Cristina Furlanetto, S. Dye, N. Bourne, S. Maddox, L. Dunne, S. Eales,
  E. Valiante, M. W. Smith, D. J. B. Smith, R. J. Ivison, E. Ibar","The second Herschel-ATLAS Data Release - III: optical and near-infrared
  counterparts in the North Galactic Plane field","19 pages, 24 figures, submitted to MNRAS",,"10.1093/mnras/sty151",,"astro-ph.GA","http://arxiv.org/licenses/nonexclusive-distrib/1.0/","  This paper forms part of the second major public data release of the Herschel
Astrophysical Terahertz Large Area Survey (H-ATLAS). In this work, we describe
the identification of optical and near-infrared counterparts to the
submillimetre detected sources in the $177$ deg$^2$ North Galactic Plane (NGP)
field. We used the likelihood ratio method to identify counterparts in the
Sloan Digital Sky Survey and in the UKIRT Imaging Deep Sky Survey within a
search radius of $10$ arcsec of the H-ATLAS sources with a $4\sigma$ detection
at $250 \, \mu$m. We obtained reliable ($R \ge 0.8 $) optical counterparts with
$r< 22.4$ for 42429 H-ATLAS sources ($37.8$ per cent), with an estimated
completeness of $71.7$ per cent and a false identification rate of $4.7$ per
cent. We also identified counterparts in the near-infrared using deeper
$K$-band data which covers a smaller $\sim25$ deg$^2$. We found reliable
near-infrared counterparts to $61.8$ per cent of the $250$-$\mu$m-selected
sources within that area. We assessed the performance of the likelihood ratio
method to identify optical and near-infrared counterparts taking into account
the depth and area of both input catalogues. Using catalogues with the same
surface density of objects in the overlapping $\sim25$ deg$^2$ area, we
obtained that the reliable fraction in the near-infrared ($54.8$ per cent) is
significantly higher than in the optical ($36.4$ per cent). Finally, using deep
radio data which covers a small region of the NGP field, we found that $80 -
90$ per cent of our reliable identifications are correct.
","[{""version"":""v1"",""created"":""Tue, 19 Dec 2017 19:28:46 GMT""}]","2018-01-31"
"1712.07164","Mrs Oksana A. Dobush","M.P. Kozlovskii, I.V. Pylyuk, O.A. Dobush","The equation of state of a cell fluid model in the supercritical region","26 pages, 6 figures, 1 table","Condens. Matter Phys., 2018, vol. 21, No. 4, 43502","10.5488/CMP.21.43502",,"cond-mat.stat-mech","http://creativecommons.org/licenses/by/4.0/","  The analytic method for deriving the equation of state of a cell fluid model
in the region above the critical temperature ($T \geqslant T_\text{c}$) is
elaborated using the renormalization group transformation in the collective
variables set. Mathematical description with allowance for non-Gaussian
fluctuations of the order parameter is performed in the vicinity of the
critical point on the basis of the $\rho^4$ model. The proposed method of
calculation of the grand partition function allows one to obtain the equation
for the critical temperature of the fluid model in addition to universal
quantities such as critical exponents of the correlation length. The isothermal
compressibility is plotted as a function of density. The line of extrema of the
compressibility in the supercritical region is also represented.
","[{""version"":""v1"",""created"":""Tue, 19 Dec 2017 19:30:05 GMT""},{""version"":""v2"",""created"":""Thu, 20 Dec 2018 14:21:04 GMT""}]","2018-12-21"
"1712.07165","Tyler Spears","Tyler A. Spears, Brandon G. Jacques, Marc W. Howard, Per B. Sederberg","Scale-invariant temporal history (SITH): optimal slicing of the past in
  an uncertain world","Preprint for submission to Neural Computation. Submitted to Neural
  Computation - Update 12/18/2018: revised based on reviewer comments,
  resubmitted to Neural Computation on 15 December, 2018. Restructured
  introduction and discussion, combined figures, added section for SITH
  parameterization",,,,"cs.AI cs.NE","http://arxiv.org/licenses/nonexclusive-distrib/1.0/","  In both the human brain and any general artificial intelligence (AI), a
representation of the past is necessary to predict the future. However, perfect
storage of all experiences is not feasible. One approach utilized in many
applications, including reward prediction in reinforcement learning, is to
retain recently active features of experience in a buffer. Despite its prior
successes, we show that the fixed length buffer renders Deep Q-learning
Networks (DQNs) fragile to changes in the scale over which information can be
learned. To enable learning when the relevant temporal scales in the
environment are not known *a priori*, recent advances in psychology and
neuroscience suggest that the brain maintains a compressed representation of
the past. Here we introduce a neurally-plausible, scale-free memory
representation we call Scale-Invariant Temporal History (SITH) for use with
artificial agents. This representation covers an exponentially large period of
time by sacrificing temporal accuracy for events further in the past. We
demonstrate the utility of this representation by comparing the performance of
agents given SITH, buffer, and exponential decay representations in learning to
play video games at different levels of complexity. In these environments, SITH
exhibits better learning performance by storing information for longer
timescales than a fixed-size buffer, and representing this information more
clearly than a set of exponentially decayed features. Finally, we discuss how
the application of SITH, along with other human-inspired models of cognition,
could improve reinforcement and machine learning algorithms in general.
","[{""version"":""v1"",""created"":""Tue, 19 Dec 2017 19:33:02 GMT""},{""version"":""v2"",""created"":""Sat, 11 Aug 2018 03:17:31 GMT""},{""version"":""v3"",""created"":""Tue, 18 Dec 2018 16:50:32 GMT""}]","2018-12-19"
