"1712.10264","Mikhail Voloshin","M.B. Voloshin","Equality of $e^+e^-$ production amplitudes for scalar-vector and
  pseudoscalar-axial heavy meson-antimeson pairs","5 pages","Phys. Rev. D 97, 034008 (2018)","10.1103/PhysRevD.97.034008","FTPI-MINN-17/24, UMN-TH-3707/17","hep-ph","http://arxiv.org/licenses/nonexclusive-distrib/1.0/","  The production of heavy meson-antimeson pairs of the type $S\,V$ and $P \, A$
in $e^+e^-$ annihilation is considered, with $P$ and $V$ being the ground-state
$J^P=0^-$ and $J^P=1^-$ (anti)mesons from the $(1/2)^-$ doublet, and $S$ and
$A$ standing for the excited $J^P=0^+$ and $J^P=1^+$ (anti)mesons from the
$(1/2)^+$ doublet. It is argued that the production amplitudes in these two
channels should be equal up to a higher (than one) order in the heavy quark
mass ($\Lambda_{QCD}/M_Q$) expansion, $A(e^+e^- \to S \bar V) = A(e^+e^- \to A
\bar P)$, including both the $S$-wave and the $D$-wave amplitudes. Given that
the $S\,V$ and $P \, A$ thresholds are extremely close, the production cross
section in both channels should be the same to a high degree of accuracy. In
practice this behavior can be studied for the processes $e^+e^- \to
D_{s0}(2317) \bar D_s^* +$ c.c. and $e^+e^- \to D_{s1}(2460) \bar D_s +$ c.c.
in the charm sector and $e^+e^- \to B_{s0} \bar B_s^* +$ c.c. and $e^+e^- \to
B_{s1} \bar B_s +$ c.c. in the $B$ sector.
","[{""version"":""v1"",""created"":""Fri, 29 Dec 2017 16:01:10 GMT""}]","2018-02-14"
"1712.10265","Nikolai Priezjev V.","Nikolai V. Priezjev and Maxim A. Makeev","Structural transformations in porous glasses under mechanical loading.
  II. Compression","25 pages, 12 figures","Journal of Non-Crystalline Solids 500, 1-10 (2018)","10.1016/j.jnoncrysol.2018.04.008",,"cond-mat.soft cond-mat.mtrl-sci physics.comp-ph","http://arxiv.org/licenses/nonexclusive-distrib/1.0/","  The role of porous structure and glass density in response to compressive
deformation of amorphous materials is investigated via molecular dynamics
simulations. The disordered, porous structures were prepared by quenching a
high-temperature binary mixture below the glass transition into the phase
coexistence region. With decreasing average glass density, the pore morphology
in quiescent samples varies from a random distribution of compact voids to a
porous network embedded in a continuous glass phase. We find that during
compressive loading at constant volume, the porous structure is linearly
transformed in the elastic regime and the elastic modulus follows a power-law
increase as a function of the average glass density. Upon further compression,
pores deform significantly and coalesce into large voids leading to formation
of domains with nearly homogeneous glass phase, which provides an enhanced
resistance to deformation at high strain.
","[{""version"":""v1"",""created"":""Fri, 29 Dec 2017 16:05:50 GMT""}]","2018-09-18"
"1712.10266","Chang Ge","Chang Ge, Xi He, Ihab F. Ilyas, Ashwin Machanavajjhala","APEx: Accuracy-Aware Differentially Private Data Exploration","Full version of the ACM SIGMOD 2019 paper",,,,"cs.DB","http://arxiv.org/licenses/nonexclusive-distrib/1.0/","  Organizations are increasingly interested in allowing external data
scientists to explore their sensitive datasets. Due to the popularity of
differential privacy, data owners want the data exploration to ensure provable
privacy guarantees. However, current systems for answering queries with
differential privacy place an inordinate burden on the data analysts to
understand differential privacy, manage their privacy budget, and even
implement new algorithms for noisy query answering. Moreover, current systems
do not provide any guarantees to the data analyst on the quality they care
about, namely accuracy of query answers.
  We present APEx, a novel system that allows data analysts to pose adaptively
chosen sequences of queries along with required accuracy bounds. By translating
queries and accuracy bounds into differentially private algorithms with the
least privacy loss, APEx returns query answers to the data analyst that meet
the accuracy bounds, and proves to the data owner that the entire data
exploration process is differentially private. Our comprehensive experimental
study on real datasets demonstrates that APEx can answer a variety of queries
accurately with moderate to small privacy loss, and can support data
exploration for entity resolution with high accuracy under reasonable privacy
settings.
","[{""version"":""v1"",""created"":""Fri, 29 Dec 2017 16:09:37 GMT""},{""version"":""v2"",""created"":""Tue, 2 Jan 2018 09:59:36 GMT""},{""version"":""v3"",""created"":""Thu, 8 Feb 2018 00:02:42 GMT""},{""version"":""v4"",""created"":""Fri, 10 May 2019 20:17:35 GMT""}]","2019-05-14"
"1712.10267","Andreas Winter","Andreas Winter","Energy-constrained diamond norm with applications to the uniform
  continuity of continuous variable channel capacities","Very preliminary version, 13 pages",,,,"quant-ph math-ph math.MP","http://arxiv.org/licenses/nonexclusive-distrib/1.0/","  The channels, and more generally superoperators acting on the trace class
operators of a quantum system naturally form a Banach space under the
completely bounded trace norm (aka diamond norm). However, it is well-known
that in infinite dimension, the norm topology is often ""too strong"" for
reasonable applications. Here, we explore a recently introduced
energy-constrained diamond norm on superoperators (subject to an energy bound
on the input states). Our main motivation is the continuity of capacities and
other entropic quantities of quantum channels, but we also present an
application to the continuity of one-parameter unitary groups and certain
one-parameter semigroups of quantum channels.
","[{""version"":""v1"",""created"":""Fri, 29 Dec 2017 16:17:58 GMT""}]","2018-01-01"
"1712.10268","Alan Kostelecky","Alan Kostelecky, Matthew Mewes","Lorentz and Diffeomorphism Violations in Linearized Gravity","17 pages","Phys.Lett.B779: 136-142, 2018","10.1016/j.physletb.2018.01.082","IUHET 626","gr-qc astro-ph.HE hep-ph","http://arxiv.org/licenses/nonexclusive-distrib/1.0/","  Lorentz and diffeomorphism violations are studied in linearized gravity using
effective field theory. A classification of all gauge-invariant and
gauge-violating terms is given. The exact covariant dispersion relation for
gravitational modes involving operators of arbitrary mass dimension is
constructed, and various special limits are discussed.
","[{""version"":""v1"",""created"":""Fri, 29 Dec 2017 16:20:20 GMT""}]","2018-02-23"
"1712.10269","Linda Carpenter","Linda M. Carpenter","Exploring Non-Universal Gauge Mediation","17 pages, 2 figures, 1 table",,,,"hep-ph","http://arxiv.org/licenses/nonexclusive-distrib/1.0/","  I explore the phenomenology and models of Gauge Mediation with a mixed
spectrum of Dirac and Majorana gauginos. Scalar sfermion masses are generated
using a mixture of Supersoft and Minimal Gauge Mediated communication
mechanisms. I build simple models where Dirac and Majorana gauginos arise from
distinct SUSY breaking sectors. I explore the phenomenology of the gauge
mediated parameter space, identifying candidate NLSP's and possible mass
hierarchies. The phenomenological focus is on 'collider safe' models where the
gluino is Dirac. Within this model space I find a range of complex SUSY spectra
and decay chains.
","[{""version"":""v1"",""created"":""Fri, 29 Dec 2017 16:26:53 GMT""}]","2018-01-01"
"1712.10270","Oscar Cata","Luigi Cappiello, Oscar Cata and Giancarlo D'Ambrosio","Closing in on the radiative weak chiral couplings","14 pages, 4 figures",,"10.1140/epjc/s10052-018-5748-6",,"hep-ph","http://arxiv.org/licenses/nonexclusive-distrib/1.0/","  We point out that, given the current experimental status of radiative kaon
decays, a subclass of the ${\cal O} (p^4)$ counterterms of the weak chiral
lagrangian can be determined in closed form. This involves in a decisive way
the decay $K^\pm \to \pi ^\pm \pi ^0 l^+ l^-$, currently being measured at CERN
by the NA48/2 and NA62 collaborations. We show that consistency with other
radiative kaon decay measurements leads to a rather clean prediction for the
${\cal{O}}(p^4)$ weak couplings entering this decay mode. This results in a
characteristic pattern for the interference Dalitz plot, susceptible to be
tested already with the limited statistics available at NA48/2. We also provide
the first analysis of $K_S\to \pi^+\pi^-\gamma^*$, which will be measured by
LHCb and will help reduce (together with the related $K_L$ decay) the
experimental uncertainty on the radiative weak chiral couplings. A precise
experimental determination of the ${\cal{O}}(p^4)$ weak couplings is important
in order to assess the validity of the existing theoretical models in a
conclusive way. We briefly comment on the current theoretical situation and
discuss the merits of the different theoretical approaches.
","[{""version"":""v1"",""created"":""Fri, 29 Dec 2017 16:31:11 GMT""}]","2018-04-18"
"1712.10271","Hongfei Zhu","Hongfei Zhu, Ting-Wei Liu and Fabio Semperlotti","Design and Experimental Observation of Valley-Hall Edge States in
  Diatomic-Graphene-like Elastic Waveguides",,"Phys. Rev. B 97, 174301 (2018)","10.1103/PhysRevB.97.174301",,"cond-mat.mes-hall cond-mat.mtrl-sci","http://arxiv.org/licenses/nonexclusive-distrib/1.0/","  We report on the design and experimental validation of a two-dimensional
phononic elastic waveguide exhibiting topological Valley-Hall edge states. The
lattice structure of the waveguide is inspired by the diatomic graphene and it
is imprinted in an initially flat plate by means of geometric indentations. The
indentations are distributed according to a hexagonal lattice structure which
guarantees the existence of Dirac dispersion at the boundary of the Brillouin
zone. Starting from this basic material, domain walls capable of supporting
edge states can be obtained by contrasting waveguides having broken space
inversion symmetry (SIS) achieved by using local resonant elements. Our
theoretical study shows that such material maps into the acoustic analog of the
quantum valley Hall effect (QVHE) while numerical and experimental results
confirm the existence of protected edge states traveling along the walls of
topologically distinct domains.
","[{""version"":""v1"",""created"":""Fri, 29 Dec 2017 16:34:25 GMT""}]","2018-05-09"
"1712.10272","Alexander Vikman","David A. Dobre, Andrei V. Frolov, Jos\'e T. G\'alvez Ghersi, Sabir
  Ramazanov, Alexander Vikman","Unbraiding the Bounce: Superluminality around the Corner","published version. 16 pages + references, 4 figures, new section on
  Conformal Transformations, Gauges and Acoustic Geometry, new figure.
  Corrected typos, added references","JCAP 1803 (2018) 020","10.1088/1475-7516/2018/03/020",,"gr-qc astro-ph.CO hep-ph hep-th","http://arxiv.org/licenses/nonexclusive-distrib/1.0/","  We study a particular realization of the cosmological bounce scenario
proposed recently by Ijjas and Steinhardt. First, we find that their bouncing
solution starts from a divergent sound speed and ends with its vanishing. Thus,
the solution connects two strongly coupled configurations. These pathologies
are separated from the bouncing regime by only a few Planck times. We then
reveal the exact structure of the Lagrangian, which reproduces this bouncing
solution. This reconstruction allowed us to consider other cosmological
solutions of the theory and analyze the phase space. In particular, we find
other bouncing solutions and solutions with superluminal sound speed. These
stable superluminal states can be continuously transformed into the solution
constructed by Ijjas and Steinhardt. We discuss the consequences of this
feature for a possible UV-completion.
","[{""version"":""v1"",""created"":""Fri, 29 Dec 2017 16:34:48 GMT""},{""version"":""v2"",""created"":""Mon, 15 Jan 2018 18:58:59 GMT""},{""version"":""v3"",""created"":""Tue, 13 Mar 2018 14:15:14 GMT""}]","2018-03-14"
"1712.10273","Noam Touitou","Yossi Azar, Noam Touitou","Improved Online Algorithm for Weighted Flow Time","20 pages, 4 figures",,,,"cs.DS","http://arxiv.org/licenses/nonexclusive-distrib/1.0/","  We discuss one of the most fundamental scheduling problem of processing jobs
on a single machine to minimize the weighted flow time (weighted response
time). Our main result is a $O(\log P)$-competitive algorithm, where $P$ is the
maximum-to-minimum processing time ratio, improving upon the
$O(\log^{2}P)$-competitive algorithm of Chekuri, Khanna and Zhu (STOC 2001). We
also design a $O(\log D)$-competitive algorithm, where $D$ is the
maximum-to-minimum density ratio of jobs. Finally, we show how to combine these
results with the result of Bansal and Dhamdhere (SODA 2003) to achieve a
$O(\log(\min(P,D,W)))$-competitive algorithm (where $W$ is the
maximum-to-minimum weight ratio), without knowing $P,D,W$ in advance. As shown
by Bansal and Chan (SODA 2009), no constant-competitive algorithm is achievable
for this problem.
","[{""version"":""v1"",""created"":""Fri, 29 Dec 2017 16:35:59 GMT""},{""version"":""v2"",""created"":""Tue, 10 Apr 2018 15:43:10 GMT""},{""version"":""v3"",""created"":""Thu, 16 Aug 2018 00:16:41 GMT""}]","2018-08-17"
"1712.10274","Muhammad Mohsin Hakeem","Muhammad Mohsin Hakeem, Ken-ichi Suzuki","Foreign Portfolio Investment and Economy: The Network Perspective",,"International Journal of Economics, Finance and Business
  Management Studies, Vol. 3, No. 1, pp. 15-26, April 2017",,,"q-fin.GN","http://arxiv.org/licenses/nonexclusive-distrib/1.0/","  The European Union and Eurozone present an inquisitive case of strongly
interconnected network with high degree of dependence among nodes. This
research focused on investment network of European Union and its major trading
partners for specific time period 2001 to 2014. The changing investment
patterns within Eurozone suggest strong financial and trade links with central
and large economies. This study is about the association between portfolio
investment and economic indicators with respect to financial networks. The
analysis used the strongly connected investment network of Eurozone and its
large trading partners. A strong correlation between, increasing or decreasing
investment patterns with economic indicators of particular economy was found.
Interestingly correlation patterns for network members other than Eurozone
states were not as strong and depicted mild behavior. This as well, explains
the significance of interconnectedness level among nodes of one network with
varying centrality measures. Investment network visualization techniques helped
to validate the results based on network`s statistical measures.
","[{""version"":""v1"",""created"":""Fri, 29 Dec 2017 16:36:54 GMT""}]","2018-01-01"
"1712.10275","Hector Sanchez-Morgado","Hector Sanchez Morgado","Time-periodic Evans approach to weak KAM theory",,,,,"math.AP math.OC","http://arxiv.org/licenses/nonexclusive-distrib/1.0/","  We study the time-periodic version of Evans approach to weak KAM theory.
Evans minimization problem is equivalent to a first oder mean field game
system. For the mechanical Hamiltonian we prove the existence of smooth
solutions. We introduce the corresponding effective Lagrangian and Hamiltonian
and prove that they are smooth. We also consider the limiting behavior of the
effective Lagrangian and Hamiltonian, Mather measures and minimizers.
","[{""version"":""v1"",""created"":""Fri, 29 Dec 2017 16:40:08 GMT""}]","2018-01-01"
"1712.10276","Christoph Fischbacher","Christoph Fischbacher, G\""unter Stolz","Droplet states in quantum XXZ spin systems on general graphs","32 pages, 5 figures, updated version with additional graph-theoretic
  references",,"10.1063/1.5023216",,"math-ph math.MP math.SP","http://arxiv.org/licenses/nonexclusive-distrib/1.0/","  We study XXZ spin systems on general graphs. In particular, we describe the
formation of droplet states near the bottom of the spectrum in the Ising phase
of the model, where the Z-term dominates the XX-term. As key tools we use
particle number conservation of XXZ systems and symmetric products of graphs
with their associated adjacency matrices and Laplacians. Of particular interest
to us are strips and multi-dimensional Euclidean lattices, for which we discuss
the existence of spectral gaps above the droplet regime. We also prove a
Combes-Thomas bound which shows that the eigenstates in the droplet regime are
exponentially small perturbations of strict (classical) droplets.
","[{""version"":""v1"",""created"":""Fri, 29 Dec 2017 16:55:08 GMT""},{""version"":""v2"",""created"":""Mon, 22 Jan 2018 19:38:23 GMT""}]","2018-05-23"
"1712.10277","Frank E. Curtis","Frank E. Curtis, Katya Scheinberg, Rui Shi","A Stochastic Trust Region Algorithm Based on Careful Step Normalization",,,,"Lehigh ISE/COR@L Technical Report 17T-017","math.OC stat.ML","http://arxiv.org/licenses/nonexclusive-distrib/1.0/","  An algorithm is proposed for solving stochastic and finite sum minimization
problems. Based on a trust region methodology, the algorithm employs normalized
steps, at least as long as the norms of the stochastic gradient estimates are
within a specified interval. The complete algorithm---which dynamically chooses
whether or not to employ normalized steps---is proved to have convergence
guarantees that are similar to those possessed by a traditional stochastic
gradient approach under various sets of conditions related to the accuracy of
the stochastic gradient estimates and choice of stepsize sequence. The results
of numerical experiments are presented when the method is employed to minimize
convex and nonconvex machine learning test problems. These results illustrate
that the method can outperform a traditional stochastic gradient approach.
","[{""version"":""v1"",""created"":""Fri, 29 Dec 2017 16:59:25 GMT""},{""version"":""v2"",""created"":""Sat, 27 Jan 2018 16:19:08 GMT""},{""version"":""v3"",""created"":""Tue, 26 Jun 2018 16:14:56 GMT""}]","2018-06-27"
"1712.10278","Jan Slovak","D. Alekseevsky, A. Medvedev, J. Slovak","Constant Curvature Models in Sub-Riemannian Geometry","The second version reflected comments from the reviewing process.
  Introduction and parts of exposition are extended, some proofs made more
  precise. Paper accepted in Journal of Geometry adn Physics",,,,"math.DG","http://arxiv.org/licenses/nonexclusive-distrib/1.0/","  Each sub-Riemannian geometry with bracket generating distribution enjoys a
background structure determined by the distribution itself. At the same time,
those geometries with constant sub-Riemannian symbols determine a unique Cartan
connection leading to their principal invariants. We provide cohomological
description of the structure of these curvature invariants in the cases where
the background structure is one of the parabolic geometries. As an
illustration, constant curvature models are discussed for certain
sub-Riemannian geometries.
","[{""version"":""v1"",""created"":""Fri, 29 Dec 2017 17:08:01 GMT""},{""version"":""v2"",""created"":""Thu, 4 Oct 2018 14:40:16 GMT""}]","2018-10-05"
"1712.10279","Yongxin Chen","Ernest K. Ryu, Yongxin Chen, Wuchen Li, and Stanley Osher","Vector and Matrix Optimal Mass Transport: Theory, Algorithm, and
  Applications","22 pages, 5 figures, 3 tables",,,,"math.OC cs.SY math.FA","http://arxiv.org/licenses/nonexclusive-distrib/1.0/","  In many applications such as color image processing, data has more than one
piece of information associated with each spatial coordinate, and in such cases
the classical optimal mass transport (OMT) must be generalized to handle
vector-valued or matrix-valued densities. In this paper, we discuss the vector
and matrix optimal mass transport and present three contributions. We first
present a rigorous mathematical formulation for these setups and provide
analytical results including existence of solutions and strong duality. Next,
we present a simple, scalable, and parallelizable methods to solve the vector
and matrix-OMT problems. Finally, we implement the proposed methods on a CUDA
GPU and present experiments and applications.
","[{""version"":""v1"",""created"":""Fri, 29 Dec 2017 17:14:52 GMT""},{""version"":""v2"",""created"":""Sun, 17 Jun 2018 03:59:16 GMT""}]","2018-06-19"
"1712.10282","Bo Dai","Bo Dai, Albert Shaw, Niao He, Lihong Li, Le Song","Boosting the Actor with Dual Critic","21 pages, 9 figures",,,,"cs.LG","http://arxiv.org/licenses/nonexclusive-distrib/1.0/","  This paper proposes a new actor-critic-style algorithm called Dual
Actor-Critic or Dual-AC. It is derived in a principled way from the Lagrangian
dual form of the Bellman optimality equation, which can be viewed as a
two-player game between the actor and a critic-like function, which is named as
dual critic. Compared to its actor-critic relatives, Dual-AC has the desired
property that the actor and dual critic are updated cooperatively to optimize
the same objective function, providing a more transparent way for learning the
critic that is directly related to the objective function of the actor. We then
provide a concrete algorithm that can effectively solve the minimax
optimization problem, using techniques of multi-step bootstrapping, path
regularization, and stochastic dual ascent algorithm. We demonstrate that the
proposed algorithm achieves the state-of-the-art performances across several
benchmarks.
","[{""version"":""v1"",""created"":""Fri, 29 Dec 2017 17:17:58 GMT""}]","2018-01-01"
"1712.10283","John McCloy","Yue Cao, Mostafa Ahmadzadeh, Ke Xu, Brad Dodrill, John S. McCloy","Multiphase Magnetic Systems: Measurement and Simulation",,,"10.1063/1.5010799",,"cond-mat.mtrl-sci","http://arxiv.org/licenses/nonexclusive-distrib/1.0/","  Multiphase magnetic systems are common in nature and are increasingly being
recognized in technical applications. One characterization method which has
shown great promise for determining separate and collective effects of
multiphase magnetic systems is first order reversal curves (FORCs). Several
examples are given of FORC patterns which provide distinguishing evidence of
multiple phases. In parallel, a visualization method for understanding
multiphase magnetic interaction is given, which allocates Preisach magnetic
elements as an input 'Preisach hysteron distribution pattern' (PHDP) to enable
simulation of different 'wasp-waisted' magnetic behaviors. These simulated
systems allow reproduction of different major hysteresis loop, FORC pattern,
and switching field distributions of real systems and parameterized theoretical
systems. The experimental FORC measurements and FORC diagrams of four
commercially obtained magnetic materials, particularly those sold as
nanopowders, shows that these materials are often not phase pure. They exhibit
complex hysteresis behaviors that are not predictable based on relative phase
fraction obtained by characterization methods such as diffraction. These
multiphase materials, consisting of various fractions of BaFe12O19,
epsilon-Fe2O3, and gamma-Fe2O3, are discussed.
","[{""version"":""v1"",""created"":""Fri, 29 Dec 2017 17:19:45 GMT""}]","2018-02-14"
"1712.10284","Dhaval Adjodah","Dhaval Adjodah, Shi Kai Chong, Yan Leng, Peter Krafft, Alex Pentland","Large-Scale Experiment on the Importance of Social Learning and
  Unimodality in the Wisdom of the Crowd",,,,,"cs.SI physics.soc-ph stat.AP","http://arxiv.org/licenses/nonexclusive-distrib/1.0/","  In this study, we build on previous research to understand the conditions
within which the Wisdom of the Crowd (WoC) improves or worsens as a result of
showing individuals the predictions of their peers. Our main novel
contributions are: 1) a dataset of unprecedented size and detail; 2) we observe
the novel effect of the importance of the unimodality of the social information
shown to individuals: if one does not see only one clear peak in the
distribution of the crowd's predictions, the WoC is worsened after social
exposure; and 3) we estimate social learning weights that we use to show that
there exists individuals who are much better at learning from the crowd and can
be filtered to improve collective accuracy.
","[{""version"":""v1"",""created"":""Fri, 29 Dec 2017 17:22:15 GMT""}]","2018-01-01"
"1712.10285","Bo Dai","Bo Dai, Albert Shaw, Lihong Li, Lin Xiao, Niao He, Zhen Liu, Jianshu
  Chen, Le Song","SBEED: Convergent Reinforcement Learning with Nonlinear Function
  Approximation","28 pages, 13 figures. To appear at the 35th International Conference
  on Machine Learning (ICML 2018)",,,,"cs.LG","http://arxiv.org/licenses/nonexclusive-distrib/1.0/","  When function approximation is used, solving the Bellman optimality equation
with stability guarantees has remained a major open problem in reinforcement
learning for decades. The fundamental difficulty is that the Bellman operator
may become an expansion in general, resulting in oscillating and even divergent
behavior of popular algorithms like Q-learning. In this paper, we revisit the
Bellman equation, and reformulate it into a novel primal-dual optimization
problem using Nesterov's smoothing technique and the Legendre-Fenchel
transformation. We then develop a new algorithm, called Smoothed Bellman Error
Embedding, to solve this optimization problem where any differentiable function
class may be used. We provide what we believe to be the first convergence
guarantee for general nonlinear function approximation, and analyze the
algorithm's sample complexity. Empirically, our algorithm compares favorably to
state-of-the-art baselines in several benchmark control problems.
","[{""version"":""v1"",""created"":""Fri, 29 Dec 2017 17:27:59 GMT""},{""version"":""v2"",""created"":""Tue, 29 May 2018 00:35:24 GMT""},{""version"":""v3"",""created"":""Thu, 31 May 2018 20:42:41 GMT""},{""version"":""v4"",""created"":""Tue, 5 Jun 2018 18:55:26 GMT""}]","2018-06-07"
