"1801.00104","Djiby Fall","Djiby Fall, Yuncheng You","Global attractors for the damped nonlinear wave equation in unbounded
  domains",,,,,"math.AP math.DS","http://arxiv.org/licenses/nonexclusive-distrib/1.0/","  The existence of a global attractor for wave equations in unbounded domains
is a challenging problem due to the non-compactness of the Sobolev embeddings.
To overcome this difficulty, some authors have worked with weighted Sobolev
spaces which restrict the choice of the initial data. Using the ""tail
estimation method"" introduced by B. Wang for reaction diffusion equations, we
establish in this paper the existence of a global attractor for two wave
equations in the traditional Hilbert spaces $\displaystyle H^1(\Omega)\times
L^2(\Omega)$ where $\Omega$ is an unbounded domain of $\R^N$. The first
equation, with a mass term is studied in the whole space $\R^N$ and the second
one without mass term is considered in a domain bounded in only one direction
so that Poincar\'e inequality will hold.
","[{""version"":""v1"",""created"":""Sat, 30 Dec 2017 09:12:02 GMT""}]","2018-01-03"
"1801.00105","Tzee-Ming Huang","Yu-Hsiang Cheng and Tzee-Ming Huang and Su-Yun Huang","Random Partitioning and Distribution-based Thresholding for Iterative
  Variable Screening in High Dimensions",,,,,"stat.ME","http://arxiv.org/licenses/nonexclusive-distrib/1.0/","  In big data analysis, a simple task such as linear regression can become very
challenging as the variable dimension $p$ grows. As a result, variable
screening is inevitable in many scientific studies. In recent years, randomized
algorithms have become a new trend and are playing an increasingly important
role for large scale data analysis. In this article, we combine the ideas of
variable screening and random partitioning to propose a new iterative variable
screening method. For moderate sized $p$ of order $O(n^{2-\delta})$, we propose
a basic algorithm that adopts a distribution-based thresholding rule. For very
large $p$, we further propose a two-stage procedure. This two-stage procedure
first performs a random partitioning to divide predictors into subsets of
manageable size of order $O(n^{2-\delta})$ for variable screening, where
$\delta >0$ can be an arbitrarily small positive number. Random partitioning is
repeated a few times. Next, the final estimate of variable subset is obtained
by integrating results obtained from multiple random partitions. Simulation
studies show that our method works well and outperforms some renowned
competitors. Real data applications are presented. Our algorithms are able to
handle predictors in the size of millions.
","[{""version"":""v1"",""created"":""Sat, 30 Dec 2017 09:12:21 GMT""},{""version"":""v2"",""created"":""Tue, 12 Feb 2019 11:47:26 GMT""}]","2019-02-13"
"1801.00106","Zolfa Zeinalpour-Yazdi","Mostafa Javedankherad and Zolfa Zeinalpour-Yazdi","Content Placement in Cache Networks Using Graph-Coloring",,,,,"cs.IT math.IT","http://arxiv.org/licenses/nonexclusive-distrib/1.0/","  Small cell densification is one of the effective ideas addressing the demand
for higher capacity in cellular networks. The major problem faced in such
networks is the wireless backhaul link and its limited capacity. Caching most
popular files in the memories of small cells base station (SBSs) is an
effective solution to this problem. One of the main challenges in caching is
choosing the files that are going to be stored in the memory of SBS. In this
paper, we model the described caching problem as a graph. This graph is divided
into four sub-graphs including placement, access, SBSs and delivery graphs. By
making some modifications to the SBS graph, we convert it to a graph that can
be colored. Coloring of the generated graph is NP-hard and we use an algorithm
proposed in graph-coloring area to color it. To overcome the complexity of
above coloring technique, we then propose a simple graph-coloring method based
on two point processes, Matern Core-type I and II. We model our network with a
new weighted graph which simply can be colored and after that the files are
cached accordingly. We evaluate the performance of our proposed methods through
simulations. Our results show that by employing out proposed method in a
typical considered SBSs network, the load on the macro base station can be
reduced by around $25 \%$, at the distribution parameter of popularity of files
equals to $0.6$, compared to conventional policy which caches the most popular
content every where.
","[{""version"":""v1"",""created"":""Sat, 30 Dec 2017 09:26:35 GMT""}]","2018-01-03"
"1801.00107","Zsigmond Tarcsay","Zsigmond Tarcsay and Tam\'as Titkos","Quasi-units as orthogonal projections","12 pages",,,,"math.FA","http://arxiv.org/licenses/nonexclusive-distrib/1.0/","  The notion of quasi-unit has been introduced by Yosida in unital Riesz
spaces. Later on, a fruitful potential theoretic generalization was obtained by
Arsove and Leutwiler. Due to the work of Eriksson and Leutwiler, this notion
also turned out to be an effective tool by investigating the extreme structure
of operator segments. This paper has multiple purposes which are interwoven,
and are intended to be equally important. On the one hand, we identify
quasi-units as orthogonal projections acting on an appropriate auxiliary
Hilbert space. As projections form a lattice and are extremal points of the
effect algebra, we conclude the same properties for quasi-units. Our second aim
is to apply these results for nonnegative sesquilinear forms. Constructing an
order preserving bijection between operator- and form segments, we provide a
characterization of being extremal in the convexity sense, and we give a
necessary and sufficient condition for the existence of the greatest lower
bound of two forms. Closing the paper we revisit some statements by using the
machinery developed by Hassi, Sebesty\'en, and de Snoo. It will turn out that
quasi-units are exactly the closed elements with respect to the antitone Galois
connection induced by parallel addition and subtraction.
","[{""version"":""v1"",""created"":""Sat, 30 Dec 2017 09:36:59 GMT""}]","2018-01-03"
"1801.00108","Mingyang Guo","Mingyang Guo, Xin Ye, Junyu He, Goulven Qu\'em\'ener, and Dajun Wang","High-resolution Internal State Control of Ultracold $^{23}$Na$^{87}$Rb
  Molecules",,"Phys. Rev. A 97, 020501 (2018)","10.1103/PhysRevA.97.020501",,"cond-mat.quant-gas physics.atom-ph","http://arxiv.org/licenses/nonexclusive-distrib/1.0/","  We report the full control over the internal states of ultracold
$^{23}$Na$^{87}$Rb molecules, including vibrational, rotational and hyperfine
degrees of freedom. Starting from a sample of weakly bound Feshbach molecules,
we realize the creation of molecules in single hyperfine levels of both the
rovibrational ground and excited states with a high-efficiency and
high-resolution stimulated Raman adiabatic passage. Starting from the
rovibrational and hyperfine ground state, we demonstrate rotational and
hyperfine control with one- and two-photon microwave spectroscopy. This
achievement of fully controlling the molecular internal states paves the way to
study state dependent molecular collisions and state controlled chemical
reactions.
","[{""version"":""v1"",""created"":""Sat, 30 Dec 2017 10:03:03 GMT""}]","2018-03-07"
"1801.00109","Changhao Chen","Changhao Chen","Finite field analogue of restriction theorem for general measures","8 pages, no figures",,,,"math.CA math.CO","http://arxiv.org/licenses/nonexclusive-distrib/1.0/","  We study restriction problem in vector spaces over finite fields. We obtain
finite field analogue of Mockenhaupt-Mitsis-Bak-Seenger restriction theorem,
and we show that the range of the exponentials is sharp.
","[{""version"":""v1"",""created"":""Sat, 30 Dec 2017 10:09:21 GMT""}]","2018-01-03"
"1801.00110","Jian-Jhih Kuo","Sheng-Hao Chiang and Jian-Jhih Kuo and Shan-Hsiang Shen and De-Nian
  Yang and Wen-Tsuen Chen","Online Multicast Traffic Engineering for Software-Defined Networks","Full version (accepted by INFOCOM 2018)",,,,"cs.NI","http://arxiv.org/licenses/nonexclusive-distrib/1.0/","  Previous research on SDN traffic engineering mostly focuses on static
traffic, whereas dynamic traffic, though more practical, has drawn much less
attention. Especially, online SDN multicast that supports IETF dynamic group
membership (i.e., any user can join or leave at any time) has not been
explored. Different from traditional shortest-path trees (SPT) and graph
theoretical Steiner trees (ST), which concentrate on routing one tree at any
instant, online SDN multicast traffic engineering is more challenging because
it needs to support dynamic group membership and optimize a sequence of
correlated trees without the knowledge of future join and leave, whereas the
scalability of SDN due to limited TCAM is also crucial. In this paper,
therefore, we formulate a new optimization problem, named Online Branch-aware
Steiner Tree (OBST), to jointly consider the bandwidth consumption, SDN
multicast scalability, and rerouting overhead. We prove that OBST is NP-hard
and does not have a $|D_{max}|^{1-\epsilon}$-competitive algorithm for any
$\epsilon >0$, where $|D_{max}|$ is the largest group size at any time. We
design a $|D_{max}|$-competitive algorithm equipped with the notion of the
budget, the deposit, and Reference Tree to achieve the tightest bound. The
simulations and implementation on real SDNs with YouTube traffic manifest that
the total cost can be reduced by at least 25% compared with SPT and ST, and the
computation time is small for massive SDN.
","[{""version"":""v1"",""created"":""Sat, 30 Dec 2017 10:36:20 GMT""}]","2018-01-03"
"1801.00111","Jozef Siran","So\v{n}a Pavl\'ikov\'a and Jozef \v{S}ir\'a\v{n}","Inverting non-invertible trees","14 pages",,,,"math.CO","http://arxiv.org/licenses/nonexclusive-distrib/1.0/","  If a graph has a non-singular adjacency matrix, then one may use the inverse
matrix to define a (labeled) graph that may be considered to be the inverse
graph to the original one. It has been known that an adjacency matrix of a tree
is non-singular if and only if the tree has a unique perfect matching; in this
case the determinant of the matrix turns out to be $\pm 1$ and the inverse of
the tree was shown to be `switching-equivalent' to a simple graph [C. Godsil,
Inverses of Trees, Combinatorica 5 (1985), 33--39]. Using generalized inverses
of symmetric matrices (that coincide with Moore-Penrose, Drazin, and group
inverses in the symmetric case) we prove a formula for determining a
`generalized inverse' of a tree.
","[{""version"":""v1"",""created"":""Sat, 30 Dec 2017 10:38:42 GMT""}]","2018-01-03"
"1801.00112","The ATLAS Collaboration","ATLAS Collaboration","Measurement of the cross section for isolated-photon plus jet production
  in $pp$ collisions at $\sqrt s=13$ TeV using the ATLAS detector","40 pages in total, author list starting page 24, 5 figures, 1 table,
  published in Physics Letters B, All figures including auxiliary figures are
  available at
  http://atlas.web.cern.ch/Atlas/GROUPS/PHYSICS/PAPERS/STDM-2017-01/","Phys. Lett. B 780 (2018) 578","10.1016/j.physletb.2018.03.035","CERN-EP-2017-265","hep-ex","http://creativecommons.org/licenses/by/4.0/","  The dynamics of isolated-photon production in association with a jet in
proton-proton collisions at a centre-of-mass energy of 13 TeV are studied with
the ATLAS detector at the LHC using a dataset with an integrated luminosity of
3.2 fb$^{-1}$. Photons are required to have transverse energies above 125 GeV.
Jets are identified using the anti-$k_t$ algorithm with radius parameter
$R=0.4$ and required to have transverse momenta above 100 GeV. Measurements of
isolated-photon plus jet cross sections are presented as functions of the
leading-photon transverse energy, the leading-jet transverse momentum, the
azimuthal angular separation between the photon and the jet, the photon-jet
invariant mass and the scattering angle in the photon-jet centre-of-mass
system. Tree-level plus parton-shower predictions from SHERPA and PYTHIA as
well as next-to-leading-order QCD predictions from JETPHOX and SHERPA are
compared to the measurements.
","[{""version"":""v1"",""created"":""Sat, 30 Dec 2017 10:51:31 GMT""},{""version"":""v2"",""created"":""Sun, 8 Apr 2018 07:24:31 GMT""}]","2018-04-10"
"1801.00113","Mohammad Zarrin","A. Ahmadkhah, S. Marzang and M. Zarrin","A generalization of Neumann's Question","10 pages",,,,"math.GR","http://arxiv.org/licenses/nonexclusive-distrib/1.0/","  Let $G$ be a group, $m\geq2$ and $n\geq1$. We say that $G$ is an
$\mathcal{T}(m,n)$-group if for every $m$ subsets $X_1, X_2, \dots, X_m$ of $G$
of cardinality $n$, there exists $i\neq j$ and $x_i \in X_i, x_j \in X_j$ such
that $x_ix_j=x_jx_i$. In this paper, we give some examples of finite and
infinite non-abelian $\mathcal{T}(m,n)$-groups and we discuss finiteness and
commutativity of such groups. We also show solvability length of a solvable
$\mathcal{T}(m,n)$-group is bounded in terms of $m$ and $n$.
","[{""version"":""v1"",""created"":""Sat, 30 Dec 2017 10:52:59 GMT""}]","2018-01-03"
"1801.00114","Hermano Velten","Hermano Velten, Syrios Gomes and Vinicius C. Busti","{\it Gauging} the cosmic acceleration with recent type Ia supernovae
  data sets","7 pages, 4 figures, 7 tables","Phys. Rev. D 97, 083516 (2018)","10.1103/PhysRevD.97.083516",,"astro-ph.CO gr-qc","http://arxiv.org/licenses/nonexclusive-distrib/1.0/","  We revisit a model-independent estimator for cosmic acceleration based on
type Ia supernovae distance measurements. This approach does not rely on any
specific theory for gravity, energy content or parameterization for the scale
factor or deceleration parameter and is based on falsifying the {\it null
hypothesis} that the Universe never expanded in an accelerated way. By
generating mock catalogues of known cosmologies we test the robustness of this
estimator establishing its limits of applicability. We detail the pros and cons
of such approach. For example, we find that there are specific counterexamples
in which the estimator wrongly provides evidence against acceleration in
accelerating cosmologies. The dependence of the estimator on the $H_0$ value is
also discussed. Finally, we update the evidence for acceleration using the
recent UNION2.1 and JLA samples. Contrary to recent claims, available data
strongly favors an accelerated expansion of the Universe in complete agreement
with the standard $\Lambda$CDM model.
","[{""version"":""v1"",""created"":""Sat, 30 Dec 2017 10:53:28 GMT""}]","2018-05-02"
"1801.00115","Jan Naudts","Jan Naudts","Emergent Coulomb forces in reducible Quantum Electrodynamics","7p., submitted proc. Symposium ""Worlds of Entanglement"" Extended to
  36 p. by adding appendices with formalism and mathematical proofs",,,,"quant-ph hep-th math-ph math.MP","http://arxiv.org/licenses/nonexclusive-distrib/1.0/","  This paper discusses an attempt to develop a mathematically rigorous theory
of Quantum Electrodynamics (QED). It deviates from the standard version of QED
mainly in two aspects: it is assumed that the Coulomb forces are carried by
transversely polarized photons, and a reducible representation of the canonical
commutation and anti-commutation relations is used. Both interventions together
should suffice to eliminate the mathematical inconsistencies of standard QED.
","[{""version"":""v1"",""created"":""Sat, 30 Dec 2017 10:59:13 GMT""},{""version"":""v2"",""created"":""Fri, 4 Jan 2019 07:15:34 GMT""}]","2019-01-07"
"1801.00116","Sophie Weber","Sophie F. Weber, Ru Chen, Qimin Yan, Jeffrey B. Neaton","Prediction of $\mathrm{TiRhAs}$ as a Dirac Nodal Line Semimetal via
  First-Principles Calculations",,"PRB vol. 96, iss. 23, Dec. 2017","10.1103/PhysRevB.96.235145",,"cond-mat.mes-hall","http://arxiv.org/licenses/nonexclusive-distrib/1.0/","  Using first-principles calculations we predict that $\mathrm{TiRhAs}$, a
previously synthesized compound, is a Dirac nodal line (DNL) semimetal. The DNL
in this compound is found to be protected both by the combination of inversion
and time-reversal symmetry, and by a reflection symmetry, in the absence of
spin-orbit coupling (SOC). Our calculations show that band velocities
associated with the nodal line have a high degree of directional anisotropy,
with in-plane velocities $v_\perp$ perpendicular to the nodal line between
$1.2-2.8\times10^5$ m/s. The crossings along the DNL are further found to
exhibit a prominent and position-dependent tilt along directions perpendicular
to the nodal line. We calculate $\mathbb{Z}_2$ indices based on parity
eigenvalues at time-reversal invariant momenta and show that $\mathrm{TiRhAs}$
is topological. A tight-binding model fit from our first-principles
calculations demonstrates the existence of two-dimensional drumhead surface
states on the surface Brillouin zone. Based on the small gapping of the DNL
upon inclusion of SOC and the clean Fermi surface free from trivial bands,
$\mathrm{TiRhAs}$ is a promising candidate for further studies of the
properties of topological semimetals.
","[{""version"":""v1"",""created"":""Sat, 30 Dec 2017 11:13:15 GMT""}]","2018-01-03"
"1801.00117","Markus Haltmeier","Markus Haltmeier, Michael Sandbichler, Thomas Berer, Johannes
  Bauer-Marschallinger, Peter Burgholzer, and Linh Nguyen","A New Sparsification and Reconstruction Strategy for Compressed Sensing
  Photoacoustic Tomography","15 pages, 10 figures",,"10.1121/1.5042230",,"math.NA physics.med-ph","http://arxiv.org/licenses/nonexclusive-distrib/1.0/","  Compressed sensing (CS) is a promising approach to reduce the number of
measurements in photoacoustic tomography (PAT) while preserving high spatial
resolution. This allows to increase the measurement speed and to reduce system
costs. Instead of collecting point-wise measurements, in CS one uses various
combinations of pressure values at different sensor locations. Sparsity is the
main condition allowing to recover the photoacoustic (PA) source from
compressive measurements. In this paper we introduce a new concept enabling
sparse recovery in CS PAT. Our approach is based on the fact that the second
time derivative applied to the measured pressure data corresponds to the
application of the Laplacian to the original PA source. As typical PA sources
consist of smooth parts and singularities along interfaces the Laplacian of the
source is sparse (or at least compressible). To efficiently exploit the induced
sparsity we develop a reconstruction framework to jointly recover the initial
and the modified sparse source. Reconstruction results with simulated as well
as experimental data are given.
","[{""version"":""v1"",""created"":""Sat, 30 Dec 2017 11:15:51 GMT""}]","2018-08-01"
"1801.00118","Prabodh Shukla","Prabodh Shukla","Hysteresis in the Ising model with Glauber dynamics","This is the published version. Title slightly expanded following
  editor's suggestion","Phys. Rev. E 97, 062127 (2018)","10.1103/PhysRevE.97.062127",,"cond-mat.stat-mech","http://arxiv.org/licenses/nonexclusive-distrib/1.0/","  We use Glauber dynamics to study frequency and temperature dependence of
hysteresis loops in the pure (without quenched disorder) Ising model on cubic,
square, honeycomb lattices and random graphs. Results are discussed in the
context of more extensive studies of hysteresis in the random field Ising
model.
","[{""version"":""v1"",""created"":""Sat, 30 Dec 2017 11:18:49 GMT""},{""version"":""v2"",""created"":""Thu, 19 Apr 2018 16:21:27 GMT""},{""version"":""v3"",""created"":""Wed, 23 May 2018 10:51:05 GMT""},{""version"":""v4"",""created"":""Wed, 20 Jun 2018 06:35:24 GMT""}]","2018-06-27"
"1801.00119","Pawel Koperek","W{\l}odzimierz Funika and Pawe{\l} Koperek","Towards co-evolution of fitness predictors and Deep Neural Networks",,,,,"cs.NE","http://arxiv.org/licenses/nonexclusive-distrib/1.0/","  Deep neural networks proved to be a very useful and powerful tool with many
practical applications. They especially excel at learning from large data sets
with labeled samples. However, in order to achieve good learning results, the
network architecture has to be carefully designed. Creating an optimal topology
requires a lot of experience and knowledge. Unfortunately there are no
practically applicable algorithms which could help in this situation. Using an
evolutionary process to develop new network topologies might solve this
problem. The limiting factor in this case is the speed of evaluation of a
single specimen (a single network architecture), which includes learning based
on the whole large dataset. In this paper we propose to overcome this problem
by using a fitness prediction technique: use subsets of the original training
set to conduct the training process and use its results as an approximation of
specimen's fitness. We discuss the feasibility of this approach in context of
the desired fitness predictor features and analyze whether subsets obtained in
an evolutionary process can be used to estimate the fitness of the network
topology. Finally we draw conclusions from our experiments and outline plans
for future work.
","[{""version"":""v1"",""created"":""Sat, 30 Dec 2017 11:40:50 GMT""}]","2018-01-03"
"1801.00120","Nakahiro Yoshida","David Nualart and Nakahiro Yoshida","Asymptotic expansion of Skorohod integrals",,,,,"math.PR","http://arxiv.org/licenses/nonexclusive-distrib/1.0/","  Asymptotic expansion of the distribution of a perturbation $Z_n$ of a
Skorohod integral jointly with a reference variable $X_n$ is derived. We
introduce a second-order interpolation formula in frequency domain to expand a
characteristic functional and combine it with the scheme developed in the
martingale expansion. The second-order interpolation and Fourier inversion give
asymptotic expansion of the expectation $E[f(Z_n,X_n)]$ for differentiable
functions $f$ and also measurable functions $f$. In the latter case, the
interpolation method connects the two non-degeneracies of variables for finite
$n$ and $\infty$. Random symbols are used for expressing the asymptotic
expansion formula. Quasi tangent, quasi torsion and modified quasi torsion are
introduced in this paper. We identify these random symbols for a certain
quadratic form of a fractional Brownian motion and for a quadratic from of a
fractional Brownian motion with random weights. For a quadratic form of a
Brownian motion with random weights, we observe that our formula reproduces the
formula originally obtained by the martingale expansion.
","[{""version"":""v1"",""created"":""Sat, 30 Dec 2017 11:51:24 GMT""}]","2018-01-03"
"1801.00121","Ming Zeng","S. M. Riazul Islam, Ming Zeng, Octavia A. Dobre and Kyung-Sup Kwak","Resource Allocation for Downlink NOMA Systems: Key Techniques and Open
  Issues","5G, NOMA, Resource allocation, User pairing, Power allocation","Wireless Communications Magazine (WCM) 2018",,,"cs.IT math.IT","http://arxiv.org/licenses/nonexclusive-distrib/1.0/","  This article presents advances in resource allocation (RA) for downlink
non-orthogonal multiple access (NOMA) systems, focusing on user pairing (UP)
and power allocation (PA) algorithms. The former pairs the users to obtain the
high capacity gain by exploiting the channel gain difference between the users,
while the later allocates power to users in each cluster to balance system
throughput and user fairness. Additionally, the article introduces the concept
of cluster fairness and proposes the divideand- next largest difference-based
UP algorithm to distribute the capacity gain among the NOMA clusters in a
controlled manner. Furthermore, performance comparison between multiple-input
multiple-output NOMA (MIMO-NOMA) and MIMO-OMA is conducted when users have
pre-defined quality of service. Simulation results are presented, which
validate the advantages of NOMA over OMA. Finally, the article provides avenues
for further research on RA for downlink NOMA.
","[{""version"":""v1"",""created"":""Sat, 30 Dec 2017 12:01:50 GMT""}]","2018-01-04"
"1801.00122","Jens Boos","Jens Boos and Valeri P. Frolov","Principal Killing strings in higher-dimensional Kerr-NUT-(A)dS
  spacetimes","14 pages, 1 figure, matches the published version","Phys. Rev. D 97, 084015 (2018)","10.1103/PhysRevD.97.084015","Alberta-Thy-14-17","gr-qc hep-ph","http://arxiv.org/licenses/nonexclusive-distrib/1.0/","  We construct special solutions of the Nambu-Goto equations for stationary
strings in a general Kerr-NUT-(A)dS spacetime in any number of dimensions. This
construction is based on the existence of explicit and hidden symmetries
generated by the principal tensor which exists for these metrics. The
characteristic property of these string configurations, which we call
""principal Killing strings,"" is that they are stretched out from ""infinity"" to
the horizon of the Kerr-NUT-(A)dS black hole and remain regular at the latter.
We also demonstrate that principal Killing strings extract angular momentum
from higher-dimensional rotating black holes and interpret this as the action
of an asymptotic torque.
","[{""version"":""v1"",""created"":""Sat, 30 Dec 2017 12:04:25 GMT""},{""version"":""v2"",""created"":""Thu, 5 Apr 2018 22:39:59 GMT""}]","2018-04-18"
"1801.00123","Xiaomeng Xu","Xiaomeng Xu","Frobenius manifolds and quantum groups","25 pages",,,,"math-ph math.CA math.MP math.QA math.SG","http://arxiv.org/licenses/nonexclusive-distrib/1.0/","  We introduce isomonodromy Knizhnik-Zamolodchikov (KZ) connections with
respect to the quantum Stokes matrices, and prove that the classical limit of
the KZ type connections gives rise to the Dubrovin connections of semisimple
Frobenius manifolds and flat F-manifolds.
","[{""version"":""v1"",""created"":""Sat, 30 Dec 2017 12:07:51 GMT""},{""version"":""v2"",""created"":""Sun, 5 Jul 2020 09:25:10 GMT""}]","2020-07-07"
