"1712.10305","Misha Stephanov","M. Stephanov and Y. Yin","Hydro+: hydrodynamics with parametric slowing down and fluctuations near
  the critical point","46 pages, 5 figures","Phys. Rev. D 98, 036006 (2018)","10.1103/PhysRevD.98.036006","MIT-CTP/4969","nucl-th hep-th","http://arxiv.org/licenses/nonexclusive-distrib/1.0/","  The search for the QCD critical point in heavy-ion collision experiments
requires dynamical simulations of the bulk evolution of QCD matter as well as
of fluctuations. We consider two essential ingredients of such a simulation: a
generic extension of hydrodynamics by a_parametrically_ slow mode or modes
(""Hydro+"") and a description of fluctuations out of equilibrium. By combining
the two ingredients we are able to describe the bulk evolution and the
fluctutations within the same framework. Critical slowing down means that
equilibration of fluctuations could be as slow as hydrodynamic evolution and
thus fluctuations could significantly deviate from equilibrium near the
critical point. We generalize hydrodynamics to partial-equilibrium conditions
where the state of the system is characterized by the off-equilibrium magnitude
of fluctuations in addition to the usual hydrodynamic variables -- conserved
densities. We find that the key element of the new formalism -- the extended
entropy taking into account the off-equilibrium fluctuations -- is remarkably
similar to the 2PI action in quantum field theory. We show how the new Hydro+
formalism reproduces two major effects of critical fluctuations on the bulk
evolution: the strong frequency dependence of the anomalously large bulk
viscosity as well as the stiffening of the equation of state with increasing
frequency or wave-number. While the agreement with known results confirms its
validity, the fact that Hydro+ achieves this within a local and deterministic
framework gives it significant advantages for dynamical simulations.
","[{""version"":""v1"",""created"":""Fri, 29 Dec 2017 18:44:16 GMT""}]","2018-08-15"
"1712.10306","Anne Ersbak Bang Nielsen","Dillip K. Nandy, N. S. Srivatsa, Anne E. B. Nielsen","Local Hamiltonians for one-dimensional critical models","18 pages, 7 figures, 7 tables, v3: accepted version","J. Stat. Mech. (2018) 063107","10.1088/1742-5468/aac913",,"quant-ph cond-mat.str-el","http://arxiv.org/licenses/nonexclusive-distrib/1.0/","  Conformal field theory has turned out to be a powerful tool to derive
interesting lattice models with analytical ground states. Here, we investigate
a class of critical, one-dimensional lattice models of fermions and hardcore
bosons related to the Laughlin states. The Hamiltonians of the exact models
involve interactions over long distances that are difficult to realize
experimentally. This motivates us to study the properties of models with the
same type of interactions, but now only between nearest and possibly
next-nearest neighbor sites. Based on computations of wavefunction overlaps,
entanglement entropies, and two-site correlation functions for systems of up to
32 sites, we find that the ground state is close to the ground state of the
exact model. There is also a high overlap per site between the lowest excited
states for the local and the exact models, although the energies of the
low-lying excited states are modified to some extent for the system sizes
considered. We also briefly discuss possibilities for realizing the local
models in ultracold atoms in optical lattices.
","[{""version"":""v1"",""created"":""Fri, 29 Dec 2017 18:44:52 GMT""},{""version"":""v2"",""created"":""Sat, 3 Mar 2018 21:47:23 GMT""},{""version"":""v3"",""created"":""Thu, 27 Jun 2019 09:07:18 GMT""}]","2019-06-28"
"1712.10307","Burglind Joricke","Burlind Joricke","Fundamental Groups, 3-Braids, and Effective Estimates of Invariants","56 pages, 7 figures",,,,"math.GT math.CV","http://arxiv.org/licenses/nonexclusive-distrib/1.0/","  We define invariants of braids rather than invariants of conjugacy classes of
braids. For any pure three-braid we give effective upper and lower bounds for
these invariants. This is done in terms of a natural syllable decomposition of
the word representing the image of the braid in the braid group modulo its
center. The bounds differ by a multiplicative constant not depending on the
word. Respective bounds are given for all three-braids. We also obtain
effective upper and lower bounds for the entropy of pure three-braids in these
terms. The proof leads to the study of the extremal length of classes of curves
representing elements of the fundamental group of the twice punctured complex
plane.
","[{""version"":""v1"",""created"":""Fri, 29 Dec 2017 18:45:05 GMT""},{""version"":""v2"",""created"":""Thu, 9 May 2019 15:15:34 GMT""}]","2019-05-10"
"1712.10308","Sang-Hyun Oh","In-Ho Lee, Luis Martin-Moreno, Daniel A. Mohr, Kaveh Khaliji, Tony
  Low, Sang-Hyun Oh","Anisotropic Acoustic Plasmons in Black Phosphorus",,"ACS Photonics 5, 2208-2216 (2018)","10.1021/acsphotonics.8b00062",,"cond-mat.mes-hall physics.optics","http://arxiv.org/licenses/nonexclusive-distrib/1.0/","  Recently, it was demonstrated that a graphene/dielectric/metal configuration
can support acoustic plasmons, which exhibit extreme plasmon confinement an
order of magnitude higher than that of conventional graphene plasmons. Here, we
investigate acoustic plasmons supported in a monolayer and multilayers of black
phosphorus (BP) placed just a few nanometers above a conducting plate. In the
presence of a conducting plate, the acoustic plasmon dispersion for the
armchair direction is found to exhibit the characteristic linear scaling in the
mid- and far-infrared regime while it largely deviates from that in the long
wavelength limit and near-infrared regime. For the zigzag direction, such
scaling behavior is not evident due to relatively tighter plasmon confinement.
Further, we demonstrate a new design for an acoustic plasmon resonator that
exhibits higher plasmon confinement and resonance efficiency than BP ribbon
resonators in the mid-infrared and longer wavelength regime. Theoretical
framework and new resonator design studied here provide a practical route
toward the experimental verification of the acoustic plasmons in BP and open up
the possibility to develop novel plasmonic and optoelectronic devices that can
leverage its strong in-plane anisotropy and thickness-dependent band gap.
","[{""version"":""v1"",""created"":""Fri, 29 Dec 2017 18:48:18 GMT""}]","2018-06-22"
"1712.10309","Victor Thompson Vt","Victor Thompson","Methods for Detecting Paraphrase Plagiarism",,,,,"cs.IR cs.CL","http://arxiv.org/licenses/nonexclusive-distrib/1.0/","  Paraphrase plagiarism is one of the difficult challenges facing plagiarism
detection systems. Paraphrasing occur when texts are lexically or syntactically
altered to look different, but retain their original meaning. Most plagiarism
detection systems (many of which are commercial based) are designed to detect
word co-occurrences and light modifications, but are unable to detect severe
semantic and structural alterations such as what is seen in many academic
documents. Hence many paraphrase plagiarism cases go undetected. In this paper,
we approached the problem of paraphrase plagiarism by proposing methods for
detecting the most common techniques (phenomena) used in paraphrasing texts
(namely; lexical substitution, insertion/deletion and word and phrase
reordering), and combined the methods into a paraphrase detection model. We
evaluated our proposed methods and model on collections containing paraphrase
texts. Experimental results show significant improvement in performance when
the methods were combined (the proposed model) as opposed to running them
individually. The results also show that the proposed paraphrase detection
model outperformed a standard baseline (based on greedy string tilling), and
previous studies.
","[{""version"":""v1"",""created"":""Fri, 29 Dec 2017 18:53:12 GMT""}]","2018-01-01"
"1712.10310","Francisco Javier Torres de Lizaur","Francisco Torres de Lizaur","Geometric structures in the nodal sets of eigenfunctions of the Dirac
  operator","21 pages",,,,"math.DG math.AP math.SP","http://arxiv.org/licenses/nonexclusive-distrib/1.0/","  We show that, in round spheres of dimension $n\geq3$, for any given
collection of codimension 2 smooth submanifolds
$\mathfrak{S}:=\{\Sigma_1,...,\Sigma_N\}$ of arbitrarily complicated topology
($N$ being the complex dimension of the spinor bundle), there is always an
eigenfunction $\psi=(\psi_1,...,\psi_N)$ of the Dirac operator such that each
submanifold $\Sigma_a$, modulo ambient diffeomorphism, is a structurally stable
nodal set of the spinor component $\psi_a$. The result holds for any choice of
trivialization of the spinor bundle. The emergence of these structures takes
place at small scales and sufficiently high energies.
","[{""version"":""v1"",""created"":""Fri, 29 Dec 2017 18:53:15 GMT""}]","2018-01-01"
"1712.10311","Alexander Vikman","Alexander Vikman","Superconducting Dark Matter","11 pages",,,,"astro-ph.CO","http://arxiv.org/licenses/nonexclusive-distrib/1.0/","  We extend recently proposed mimetic dark matter (DM) and dust of dark energy
(DE) models to a U(1)-charged gauged scalar field. This extension yields a mass
to the photon via the Higgs mechanism. The square of this photon mass is
proportional to the DM energy density. Thus dense DM environments can screen
the dark vector force. There is a substantial freedom in this gauged extension
of the irrotational fluid-like DM. This freedom enables one to model the
classical London equation of superconductivity or to obtain the photon mass
which remains constant during the matter-dominated \'epoque.
","[{""version"":""v1"",""created"":""Fri, 29 Dec 2017 18:54:06 GMT""}]","2018-01-01"
"1712.10313","Ying-Hsuan Lin","Chi-Ming Chang, Martin Fluder, Ying-Hsuan Lin, Yifan Wang","Romans Supergravity from Five-Dimensional Holograms","57 pages, 4 figures, 6 tables; v2: references added",,"10.1007/JHEP05(2018)039","CALT-TH 2017-058, PUPT-2545","hep-th","http://arxiv.org/licenses/nonexclusive-distrib/1.0/","  We study five-dimensional superconformal field theories and their holographic
dual, matter-coupled Romans supergravity. On the one hand, some recently
derived formulae allow us to extract the central charges from deformations of
the supersymmetric five-sphere partition function, whose large N expansion can
be computed using matrix model techniques. On the other hand, the conformal and
flavor central charges can be extracted from the six-dimensional supergravity
action, by carefully analyzing its embedding into type I' string theory. The
results match on the two sides of the holographic duality. Our results also
provide analytic evidence for the symmetry enhancement in five-dimensional
superconformal field theories.
","[{""version"":""v1"",""created"":""Fri, 29 Dec 2017 18:58:33 GMT""},{""version"":""v2"",""created"":""Mon, 22 Jan 2018 06:11:50 GMT""}]","2018-06-13"
"1712.10314","Moskov Amaryan","M.C. Kunkel,32, 18 M.J. Amaryan,32, I.I. Strakovsky,16 J. Ritman,3, 18
  G.R. Goldstein,43 K.P. Adhikari,28 S Adhikari,13 H. Avakian,39 J. Ball,7 I.
  Balossino,19 L. Barion,19 M. Battaglieri,21 V. Batourine,39, 27 I.
  Bedlinskiy,25 A.S. Biselli,11, 5 S. Boiarinov,39 W.J. Briscoe,16 W.K.
  Brooks,40, 39 S. Bueltmann,32 V.D. Burkert,39 F. Cao,9 D.S. Carman,39 A.
  Celentano,21 G. Charles,32 T. Chetry,31 G. Ciullo,19, 12 L. Clark,42 P. L.
  Cole,17 M. Contalbrigo,19 O. Cortes,17 V. Crede,14 A. DAngelo,22, 35 N.
  Dashyan,47 R. De Vita,21 E. De Sanctis,20 P.V. Degtyarenko,39 M. Defurne,7 A.
  Deur,39 C. Djalali,37 M. Dugger,2 R. Dupre,24 H. Egiyan,39 A. El Alaoui,40 L.
  El Fassi,28 L. Elouadrhiri,39 P. Eugenio,14 G. Fedotov,31 R. Fersch,8, 46 A.
  Filippi,23 A. Fradi,24 G. Gavalian,39, 29 Y. Ghandilyan,47 S. Ghosh,10 G.P.
  Gilfoyle,34 K.L. Giovanetti,26 F.X. Girod,39 D.I. Glazier,42 W. Gohn,9, E.
  Golovatch,36 R.W. Gothe,37 K.A. Griffioen,46 L. Guo,13, 39 M. Guidal,24 K.
  Hafidi,1 H. Hakobyan,40, 47 N. Harrison,39 M. Hattawy,1 K. Hicks,31 M.
  Holtrop,29 C.E. Hyde,32 D.G. Ireland,42 B.S. Ishkhanov,36 E.L. Isupov,36 D.
  Jenkins,44 K. Joo,9 M.L. Kabir,28 D. Keller,45 G. Khachatryan,47 M.
  Khachatryan,32 M. Khandaker,30, A. Kim,9 W. Kim,27 A. Klein,32 F. Klein,6, 16
  V. Kubarovsky,39 S.E. Kuhn,32 J.M. Laget,39, 7 L. Lanza,22, 35 P. Lenisa,19
  D. Lersch,18 K. Livingston,42 I .J .D. MacGregor,42 N. Markov,9 G. Mbianda,32
  B. McKinnon,42 T. Mineeva,40, 9 V. Mokeev,39, 36 R.A. Montgomery,42 A
  Movsisyan,19 C. Munoz Camacho,24 P. Nadel-Turonski,39 S. Niccolai,24 G.
  Niculescu,26 M. Osipenko,21 A.I. Ostrovidov,14 M. Paolone,38 K. Park,39, 37
  E. Pasyuk,39 D. Payette,32 W. Phelps,13, 16 O. Pogorelko,25 J. Poudel,32 J.W.
  Price,4 S. Procureur,7 Y. Prok,32, 45 D. Protopopescu,42 M. Ripani,21 B.G.
  Ritchie,2 A. Rizzo,22, 35 G. Rosner,42 A. Roy,10 F. Sabatie,7 C. Salgado,30
  S. Schadmand,18 R.A. Schumacher,5 Y.G. Sharabian,39 Iu. Skorodumina,37, 36
  D.G. Ireland,42 D. Sokhan,42 D.I. Sober,6 N. Sparveris,38 S. Strauch,37, 16
  M. Taiuti,21, 15 J.A. Tan,27 M. Ungaro,39, 33 H. Voskanyan,47 E. Voutier,24
  D.P. Watts,41 L. Weinstein,32 X. Wei,39 D.P. Weygand,8 N. Zachariou,41 J.
  Zhang,45 and Z.W. Zhao32 (The CLAS Collaboration)","Exclusive photoproduction of $\pi^0$ up to large values of Mandelstam
  variables $s, t$ and $u$ with CLAS","7 pages, 6 figures","Phys. Rev. C 98, 015207 (2018)","10.1103/PhysRevC.98.015207",,"hep-ex hep-ph nucl-ex nucl-th","http://arxiv.org/licenses/nonexclusive-distrib/1.0/","  Exclusive photoproduction cross sections have been measured for the process
$\gamma p \rightarrow p\pi^0(e^+e^-(\gamma))$ with the Dalitz decay final state
using tagged photon energies in the range of $E_{\gamma} = 1.275-5.425$ GeV.
The complete angular distribution of the final state $\pi^0$, for the entire
photon energy range up to large values of $t$ and $u$, has been measured for
the first time. The data obtained show that the cross section $d\sigma/dt$, at
mid to large angles, decreases with energy as $s^{-6.89\pm 0.26} $. This is in
agreement with the perturbative QCD quark counting rule prediction of $s^{-7}
$. Paradoxically, the size of angular distribution of measured cross sections
is greatly underestimated by the QCD based Generalized Parton Distribution
mechanism at highest available invariant energy $s=11$ GeV$^2$. At the same
time, the Regge exchange based models for $\pi^0$ photoproduction are more
consistent with experimental data.
","[{""version"":""v1"",""created"":""Fri, 29 Dec 2017 18:59:04 GMT""}]","2018-08-01"
"1712.10315","Markus P\""ossel","Markus P\""ossel","The expanding universe: an introduction","107 pages, 33 figures. Extended notes for a lecture held as part of
  the WE Heraeus Summer School ""Astronomy from Four Perspectives: The Dark
  Universe"" at Haus der Astronomie, Heidelberg, on 28 August 2017",,,,"gr-qc","http://arxiv.org/licenses/nonexclusive-distrib/1.0/","  An introduction to the physics and mathematics of the expanding universe,
using no more than high-school level / undergraduate mathematics. Covered are
the basics of scale factor expansion, the dynamics of the expanding universe,
various distance concepts and the generalized redshift-luminosity relation,
among other topics.
","[{""version"":""v1"",""created"":""Fri, 29 Dec 2017 18:59:33 GMT""}]","2018-01-01"
"1712.10316","Yuho Sakatani","Yuho Sakatani, Shozo Uehara","Exceptional M-brane sigma models and $\eta$-symbols","55 pages; v2: references added, minor improvements; v3:
  clarifications added, to appear in PTEP; v4: typos corrected","PTEP (2018) 033B05","10.1093/ptep/pty021",,"hep-th","http://arxiv.org/licenses/nonexclusive-distrib/1.0/","  We develop the M-brane actions proposed in arXiv:1607.04265 by using
$\eta$-symbols determined in arXiv:1708.06342. Introducing $\eta$-forms that
are defined with the $\eta$-symbols, we present U-duality-covariant M-brane
actions which describe the known brane worldvolume theories for M$p$-branes
with $p=0,2,5$. We show that the self-duality relation known in the double
sigma model is naturally generalized to M-branes. In particular, for an
M5-brane, the self-duality relation is nontrivially realized, where the Hodge
star operator is defined with the familiar M5-brane metric while the
$\eta$-form contains the self-dual 3-form field strength. The action for a
Kaluza-Klein monopole is also partially reproduced. Moreover, we explain how to
treat type IIB branes in our general formalism. As a demonstration, we
reproduce the known action for a $(p,q)$-string.
","[{""version"":""v1"",""created"":""Fri, 29 Dec 2017 18:59:33 GMT""},{""version"":""v2"",""created"":""Tue, 9 Jan 2018 18:50:02 GMT""},{""version"":""v3"",""created"":""Mon, 5 Feb 2018 07:40:07 GMT""},{""version"":""v4"",""created"":""Thu, 8 Mar 2018 15:12:51 GMT""}]","2018-03-29"
"1712.10317","Bin Ren Mr.","B\=in R\'en, Laurent Pueyo, Guangtun Ben Zhu, John Debes, Gaspard
  Duch\^ene","Non-negative Matrix Factorization: Robust Extraction of Extended
  Structures","22 pages, 1 table, 12 figures, ApJ published. Updated reference and
  figure, fixed typos",,"10.3847/1538-4357/aaa1f2",,"astro-ph.IM astro-ph.EP cs.LG","http://arxiv.org/licenses/nonexclusive-distrib/1.0/","  We apply the vectorized Non-negative Matrix Factorization (NMF) method to
post-processing of direct imaging data for exoplanetary systems such as
circumstellar disks. NMF is an iterative approach, which first creates a
non-orthogonal and non-negative basis of components using given reference
images, then models a target with the components. The constructed model is then
rescaled with a factor to compensate for the contribution from a disk. We
compare NMF with existing methods (classical reference differential imaging
method, and the Karhunen-Lo\`eve image projection algorithm) using synthetic
circumstellar disks, and demonstrate the superiority of NMF: with no need for
prior selection of references, NMF can detect fainter circumstellar disks,
better preserve low order disk morphology, and does not require forward
modeling. As an application to a well-known disk example, we process the
archival Hubble Space Telescope (HST) STIS coronagraphic observations of
HD~181327 with different methods and compare them. NMF is able to extract some
circumstellar material inside the primary ring for the first time. In the
appendix, we mathematically investigate the stability of NMF components during
iteration, and the linearity of NMF modeling.
","[{""version"":""v1"",""created"":""Fri, 29 Dec 2017 19:00:00 GMT""},{""version"":""v2"",""created"":""Fri, 12 Jan 2018 01:01:38 GMT""}]","2018-03-20"
"1712.10320","Irina Rozgacheva","I. K. Rozgacheva, A. A. Agapov","Is there a need for dark matter in galaxies?","10 pages","Rozgacheva, I.K. & Agapov, A.A. Astron. Rep. (2018) 62: 551","10.1134/S106377291809007X",,"astro-ph.GA","http://arxiv.org/licenses/nonexclusive-distrib/1.0/","  We present arguments indicating that galaxies and their clusters should be
considered as open developing systems. Galaxies interact with the intergalactic
medium and are not in a virial equilibrium (which is determined by the gravity
and rotation). In this case, the conventional interpretation of the rotation
curves of galaxy outer regions outside the visible stellar disk (i.e. the
presence of high mass dark matter haloes) may be erroneous. If there is an
accretion of the intergalactic medium in these regions, then the orbital
velocities of neutral hydrogen clouds are determined not only by the
gravitation of the mass inside their orbits. Galaxy clusters accrete the
material (intergalactic gas and galaxies) from filaments of the large-scale
structure, at the intersections of which they are located. Only their central
regions can approach the virial equilibrium. Therefore, the high velocities of
galaxies and the high temperatures of the intergalactic gas in a cluster do not
necessarily indicate the presence of a large mass of dark matter in the
cluster.
","[{""version"":""v1"",""created"":""Fri, 29 Dec 2017 22:21:26 GMT""},{""version"":""v2"",""created"":""Tue, 24 Apr 2018 15:04:28 GMT""}]","2018-12-10"
"1801.00006","R. Wagner-Kaiser","R. Wagner-Kaiser, Dougal Mackey, Ata Sarajedini, Roger E. Cohen, Doug
  Geisler, Soung-Chul Yang, Aaron J. Grocholski, Jeffrey D. Cummings","Exploring the nature and synchronicity of early cluster formation in the
  Large Magellanic Cloud: III. Horizontal Branch Morphology","Accepted 2017 November 22. Received 2017 October 31; in original form
  2017 August 5. 9 pages, 7 figures, 3 tables",,"10.1093/mnras/stx3061",,"astro-ph.GA astro-ph.SR","http://arxiv.org/licenses/nonexclusive-distrib/1.0/","  We leverage new high-quality data from Hubble Space Telescope program
GO-14164 to explore the variation in horizontal branch morphology among
globular clusters in the Large Magellanic Cloud (LMC). Our new observations
lead to photometry with a precision commensurate with that available for the
Galactic globular cluster population. Our analysis indicates that, once
metallicity is accounted for, clusters in the LMC largely share similar
horizontal branch morphologies regardless of their location within the system.
Furthermore, the LMC clusters possess, on average, slightly redder morphologies
than most of the inner halo Galactic population; we find, instead, that their
characteristics tend to be more similar to those exhibited by clusters in the
outer Galactic halo. Our results are consistent with previous studies showing a
correlation between horizontal branch morphology and age.
","[{""version"":""v1"",""created"":""Fri, 29 Dec 2017 17:14:09 GMT""}]","2018-01-10"
"1801.00007","Yunshan Jiang","Yunshan Jiang, Bahram Jalali","Optical Companding",,,,,"physics.optics","http://arxiv.org/licenses/nonexclusive-distrib/1.0/","  We introduce a new nonlinear analog optical computing concept that compresses
the signal's dynamic range and realizes non-uniform quantization that reshapes
and improves the signal-to-noise ratio in the digital domain.
","[{""version"":""v1"",""created"":""Fri, 29 Dec 2017 18:20:13 GMT""}]","2018-01-03"
"1801.00008","Haitao Li","Hai Tao Li and Ivan Vitev","Inverting the mass hierarchy of jet quenching effects with prompt
  $b$-jet substructure","7 pages, 5 figures, matches published version",,"10.1016/j.physletb.2019.04.052",,"hep-ph hep-ex","http://arxiv.org/licenses/nonexclusive-distrib/1.0/","  The mass of heavy quarks, such as charm and bottom, plays an important role
in the formation of parton showers. This effect is apparently not well
understood when parton showers evolve in a strongly interacting quark-gluon
plasma. We propose a new experimental measurement in relativistic heavy ion
collisions, based on a two-prong subjet structure inside a reconstructed heavy
flavor jet, which can place stringent constraints on the mass dependence of
in-medium splitting functions. We identify the region of jet transverse momenta
where parton mass effects are leading and predict a unique reversal of the mass
hierarchy of jet quenching effects in heavy ion relative to proton collisions.
Namely, the momentum sharing distribution of prompt $b$-tagged jets is more
strongly modified in comparison to the one for light jets. Our work is useful
in guiding experimental efforts at the Large Hadron Collider and the
Relativistic Heavy Ion Collider in the near future.
","[{""version"":""v1"",""created"":""Fri, 29 Dec 2017 19:00:00 GMT""},{""version"":""v2"",""created"":""Mon, 6 May 2019 17:16:55 GMT""}]","2019-05-07"
"1801.00009","Hong Lu","Wei-Jian Geng, Shou-Long Li, H. Lu and Hao Wei","Godel Metrics with Chronology Protection in Horndeski Gravities","Latex, 11 pages, references added",,"10.1016/j.physletb.2018.02.075",,"gr-qc hep-th","http://arxiv.org/licenses/nonexclusive-distrib/1.0/","  G\""odel universe, one of the most interesting exact solutions predicted by
General Relativity, describes a homogeneous rotating universe containing naked
closed time-like curves (CTCs). It was shown that such CTCs are the consequence
of the null energy condition in General Relativity. In this paper, we show that
the G\""odel-type metrics with chronology protection can emerge in
Einstein-Horndeski gravity. We construct such exact solutions also in
Einstein-Horndeski-Maxwell and Einstein-Horndeski-Proca theories.
","[{""version"":""v1"",""created"":""Fri, 29 Dec 2017 19:00:02 GMT""},{""version"":""v2"",""created"":""Tue, 9 Jan 2018 15:18:06 GMT""}]","2018-03-14"
