"1801.00051","Pelin Guven Geredeli","George Avalos and Pelin G. Geredeli","Stability Analysis of Coupled Structural Acoustics PDE Models under
  Thermal Effects and with no Additional Dissipation",,,,,"math.AP","http://arxiv.org/licenses/nonexclusive-distrib/1.0/","  In this study we consider a coupled system of partial differential equations
(PDE's) which describes a certain structural acoustics interaction. One
component of this PDE system is a wave equation, which serves to model the
interior acoustic wave medium within a given three dimensional chamber $%
\Omega $. This acoustic wave equation is coupled on a boundary interface ($%
\Gamma _{0}$) to a two dimensional system of thermoelasticity: this
thermoelastic PDE comprises a structural beam or plate equation, which governs
the vibrations of flexible wall portion $\Gamma _{0}$ of the chamber $\Omega $;
the elastic dynamics is coupled to a heat equation which also evolves on
$\Gamma _{0}$, and which imparts a thermal damping onto the entire structural
acoustic system. As we said, the interaction between the wave and thermoelastic
PDE components takes place on the boundary interface $% \Gamma _{0}$, and
involves coupling boundary terms which are above the level of finite energy. We
analyze the stability properties of this coupled structural acoustics PDE
model, in the absence of \ any additive feedback dissipation on the hard walls
$\Gamma _{1}$ of the boundary $\partial \Omega $. Under a certain geometric
assumption on $\Gamma _{1}$, an assumption which has appeared in the literature
in conection with structural acoustic flow, and which allows for the invocation
of a recently derived microlocal boundary trace estimate, we show that
classical solutions of this thermally damped structural acoustics PDE decay
uniformly to zero, with a rational rate of decay.
","[{""version"":""v1"",""created"":""Fri, 29 Dec 2017 22:24:59 GMT""}]","2018-01-03"
"1801.00052","Jacob Haqq-Misra","Jacob Haqq-Misra, Sanjoy Som, Brendan Mullan, Rafael Loureiro, Edward
  Schwieterman, Lauren Seyler, Haritina Mogosanu, Adam Frank, Eric Wolf, Duncan
  Forgan, Charles Cockell, Woodruff Sullivan","The Astrobiology of the Anthropocene","A white paper on ""Astrobiology Science Strategy"" submitted to the NAS",,,,"astro-ph.EP astro-ph.IM physics.pop-ph physics.soc-ph","http://creativecommons.org/licenses/by-nc-sa/4.0/","  Human influence on the biosphere has been evident at least since the
development of widespread agriculture, and some stratigraphers have suggested
that the activities of modern civilization indicate a geological epoch
transition. The study of the anthropocene as a geological epoch, and its
implication for the future of energy-intensive civilizations, is an emerging
transdisciplinary field in which astrobiology can play a leading role.
Habitability research of Earth, Mars, and exoplanets examines extreme cases
relevant for understanding climate change as a planetary process.
Energy-intensive civilizations will also face thermodynamic limits to growth,
which provides an important constraint for estimating the longevity of human
civilization and guiding the search for extraterrestrial intelligence. We
recommend that missions concepts such as LUVOIR, HabEx, and OST be pursued in
order to make significant progress toward understanding the future evolution of
life on our planet and the possible evolution of technological,
energy-intensive life elsewhere in the universe.
","[{""version"":""v1"",""created"":""Fri, 29 Dec 2017 22:42:18 GMT""},{""version"":""v2"",""created"":""Sun, 7 Jan 2018 00:01:57 GMT""}]","2018-01-09"
"1801.00053","Philippe Malbos","Kenji Iohara and Philippe Malbos","From analytical mechanical problems to rewriting theory through M. Janet","Lecture note of the Kobe-Lyon summer school 2015",,,,"math.HO math.AC","http://arxiv.org/licenses/nonexclusive-distrib/1.0/","  This note surveys the historical background of the Gr\""obner basis theory for
D-modules and linear rewriting theory. The objective is to present a deep
interaction of these two fields largely developed in algebra throughout the
twentieth century. We recall the work of M. Janet on the algebraic analysis on
linear partial differential systems that leads to the notion of involutive
division. We present some generalizations of the division introduced by M.
Janet and their relations with Gr\""obner basis theory.
","[{""version"":""v1"",""created"":""Fri, 29 Dec 2017 22:49:02 GMT""},{""version"":""v2"",""created"":""Sat, 9 Jun 2018 20:52:21 GMT""},{""version"":""v3"",""created"":""Tue, 8 Jan 2019 20:21:15 GMT""}]","2019-01-10"
"1801.00054","Kaiyang Zhou","Kaiyang Zhou, Yu Qiao, Tao Xiang","Deep Reinforcement Learning for Unsupervised Video Summarization with
  Diversity-Representativeness Reward","AAAI 2018",,,,"cs.CV","http://arxiv.org/licenses/nonexclusive-distrib/1.0/","  Video summarization aims to facilitate large-scale video browsing by
producing short, concise summaries that are diverse and representative of
original videos. In this paper, we formulate video summarization as a
sequential decision-making process and develop a deep summarization network
(DSN) to summarize videos. DSN predicts for each video frame a probability,
which indicates how likely a frame is selected, and then takes actions based on
the probability distributions to select frames, forming video summaries. To
train our DSN, we propose an end-to-end, reinforcement learning-based
framework, where we design a novel reward function that jointly accounts for
diversity and representativeness of generated summaries and does not rely on
labels or user interactions at all. During training, the reward function judges
how diverse and representative the generated summaries are, while DSN strives
for earning higher rewards by learning to produce more diverse and more
representative summaries. Since labels are not required, our method can be
fully unsupervised. Extensive experiments on two benchmark datasets show that
our unsupervised method not only outperforms other state-of-the-art
unsupervised methods, but also is comparable to or even superior than most of
published supervised approaches.
","[{""version"":""v1"",""created"":""Fri, 29 Dec 2017 22:51:36 GMT""},{""version"":""v2"",""created"":""Sun, 4 Feb 2018 02:30:24 GMT""},{""version"":""v3"",""created"":""Tue, 13 Feb 2018 19:34:43 GMT""}]","2018-02-15"
"1801.00055","Enver Sangineto","Aliaksandr Siarohin, Enver Sangineto, Stephane Lathuiliere, Nicu Sebe","Deformable GANs for Pose-based Human Image Generation","CVPR 2018 version",,,,"cs.CV","http://arxiv.org/licenses/nonexclusive-distrib/1.0/","  In this paper we address the problem of generating person images conditioned
on a given pose. Specifically, given an image of a person and a target pose, we
synthesize a new image of that person in the novel pose. In order to deal with
pixel-to-pixel misalignments caused by the pose differences, we introduce
deformable skip connections in the generator of our Generative Adversarial
Network. Moreover, a nearest-neighbour loss is proposed instead of the common
L1 and L2 losses in order to match the details of the generated image with the
target image. We test our approach using photos of persons in different poses
and we compare our method with previous work in this area showing
state-of-the-art results in two benchmarks. Our method can be applied to the
wider field of deformable object generation, provided that the pose of the
articulated object can be extracted using a keypoint detector.
","[{""version"":""v1"",""created"":""Fri, 29 Dec 2017 22:58:31 GMT""},{""version"":""v2"",""created"":""Fri, 6 Apr 2018 16:19:17 GMT""}]","2018-04-09"
"1801.00056","Boris Belousov","Boris Belousov, Jan Peters","f-Divergence constrained policy improvement",,,,,"cs.LG cs.AI stat.ML","http://arxiv.org/licenses/nonexclusive-distrib/1.0/","  To ensure stability of learning, state-of-the-art generalized policy
iteration algorithms augment the policy improvement step with a trust region
constraint bounding the information loss. The size of the trust region is
commonly determined by the Kullback-Leibler (KL) divergence, which not only
captures the notion of distance well but also yields closed-form solutions. In
this paper, we consider a more general class of f-divergences and derive the
corresponding policy update rules. The generic solution is expressed through
the derivative of the convex conjugate function to f and includes the KL
solution as a special case. Within the class of f-divergences, we further focus
on a one-parameter family of $\alpha$-divergences to study effects of the
choice of divergence on policy improvement. Previously known as well as new
policy updates emerge for different values of $\alpha$. We show that every type
of policy update comes with a compatible policy evaluation resulting from the
chosen f-divergence. Interestingly, the mean-squared Bellman error minimization
is closely related to policy evaluation with the Pearson $\chi^2$-divergence
penalty, while the KL divergence results in the soft-max policy update and a
log-sum-exp critic. We carry out asymptotic analysis of the solutions for
different values of $\alpha$ and demonstrate the effects of using different
divergence functions on a multi-armed bandit problem and on common standard
reinforcement learning problems.
","[{""version"":""v1"",""created"":""Fri, 29 Dec 2017 23:07:26 GMT""},{""version"":""v2"",""created"":""Wed, 4 Apr 2018 11:36:12 GMT""}]","2018-04-05"
"1801.00057","Gabriel Zapata","Gabriel Zapata","Preservation of Trees by semidirect Products",,,,,"math.GR","http://arxiv.org/licenses/nonexclusive-distrib/1.0/","  We show that the semidirect product of a group $C$ by $A*_D B$ is isomorphic
to the free product of $A\rtimes C$ and $B\rtimes C$ amalgamated at $D\rtimes
C$, where $A$, $B$ and $C$ are arbitrary groups. Moreover, we apply this
theorem to prove that any group $G$ that acts without inversion on a tree $T$
that possesses a segment $\Gamma$ for its quotient graph, such that, if the
stabilizers of the vertex set $\{\,P,Q\,\}$ and edge $y$ of a lift of $\,
\Gamma$ in $T$ are of the form $G_{P}\!\rtimes H$, $G_{Q}\!\rtimes H$ and
$G_{y}\! \rtimes H$, then $G$ is isomorphic to the semidirect product of $H$ by
$(\,G_P \,*_{G_y} \,G_Q \,)$.
  Using our results we conclude with a non-standard verification of the
isomorphism between $GL_2(\mathbb{Z})$ and the free product of the dihedral
groups $D_4$ and $D_6$ amalgamated at their Klein-four group.
","[{""version"":""v1"",""created"":""Fri, 29 Dec 2017 23:09:02 GMT""}]","2018-01-03"
"1801.00058","Delfim F. M. Torres","Anibal Galindro, Delfim F. M. Torres","A simple mathematical model for unemployment: a case study in Portugal
  with optimal control","This is a preprint of a paper whose final and definite form will
  appear in 'Statistics, Optimization and Information Computing' (see
  [http://www.IAPress.org]). Submitted 27-Oct-2017; revised 19-Dec-2017;
  accepted 29-Dec-2017","Stat. Optim. Inf. Comput. 6 (2018), no. 1, 116--129","10.19139/soic.v6i1.470",,"math.OC q-fin.GN","http://arxiv.org/licenses/nonexclusive-distrib/1.0/","  We propose a simple mathematical model for unemployment. Despite its
simpleness, we claim that the model is more realistic and useful than recent
models available in the literature. A case study with real data from Portugal
supports our claim. An optimal control problem is formulated and solved, which
provides some non-trivial and interesting conclusions.
","[{""version"":""v1"",""created"":""Fri, 29 Dec 2017 23:10:26 GMT""}]","2018-02-27"
"1801.00059","Kyu Han","Kyu J. Han, Akshay Chandrashekaran, Jungsuk Kim, Ian Lane","The CAPIO 2017 Conversational Speech Recognition System","8 page, 3 figures, 8 tables; extra experimental results added",,,,"cs.CL","http://arxiv.org/licenses/nonexclusive-distrib/1.0/","  In this paper we show how we have achieved the state-of-the-art performance
on the industry-standard NIST 2000 Hub5 English evaluation set. We explore
densely connected LSTMs, inspired by the densely connected convolutional
networks recently introduced for image classification tasks. We also propose an
acoustic model adaptation scheme that simply averages the parameters of a seed
neural network acoustic model and its adapted version. This method was applied
with the CallHome training corpus and improved individual system performances
by on average 6.1% (relative) against the CallHome portion of the evaluation
set with no performance loss on the Switchboard portion. With RNN-LM rescoring
and lattice combination on the 5 systems trained across three different phone
sets, our 2017 speech recognition system has obtained 5.0% and 9.1% on
Switchboard and CallHome, respectively, both of which are the best word error
rates reported thus far. According to IBM in their latest work to compare human
and machine transcriptions, our reported Switchboard word error rate can be
considered to surpass the human parity (5.1%) of transcribing conversational
telephone speech.
","[{""version"":""v1"",""created"":""Fri, 29 Dec 2017 23:31:05 GMT""},{""version"":""v2"",""created"":""Tue, 10 Apr 2018 00:17:37 GMT""}]","2018-04-11"
"1801.00060","Matthias Lienert","Matthias Lienert","Direct interaction along light cones at the quantum level","Author's Accepted Manuscript, 31 pages, 1 figure","J. Phys. A: Math. Theor. 51 435302 (2018)","10.1088/1751-8121/aae0c4",,"quant-ph hep-th math-ph math.MP","http://arxiv.org/licenses/nonexclusive-distrib/1.0/","  Here, we point out that interactions with time delay can be described at the
quantum level using a multi-time wave function $\psi(x_1,...,x_N)$, i.e., a
wave function depending on one spacetime variable $x_i = (t_i,\mathbf{x}_i)$
per particle. In particular, such a wave function makes it possible to
implement direct interaction along light cones (not mediated by fields), as in
the Wheeler-Feynman formulation of electrodynamics. Our results are as follows.
(1) We derive a covariant two-particle integral equation and discuss it in
detail. (2) It is shown how this integral equation (or equivalently, a system
of two integro-differential equations) can be understood as defining the time
evolution of $\psi$ in a consistent way. (3) We demonstrate that the equation
has strong analogies with Wheeler-Feynman electrodynamics and therefore
suggests a possible new quantization of that theory. (4) We propose two natural
ways how the two-particle equation can be extended to $N$ particles. It is
shown that exactly one of them leads to the usual Schr\""odinger equation with
Coulomb-type pair potentials if time delay effects are neglected.
","[{""version"":""v1"",""created"":""Fri, 29 Dec 2017 23:32:29 GMT""},{""version"":""v2"",""created"":""Mon, 9 Apr 2018 22:09:43 GMT""},{""version"":""v3"",""created"":""Mon, 8 Oct 2018 07:41:54 GMT""}]","2018-10-09"
"1801.00061","Jose Eduardo Novoa Ilic","Jos\'e Novoa, Juan Pablo Escudero, Josu\'e Fredes, Jorge Wuth, Rodrigo
  Mahu and N\'estor Becerra Yoma","Multichannel Robot Speech Recognition Database: MChRSR",,,,,"cs.HC cs.RO","http://creativecommons.org/licenses/by-nc-sa/4.0/","  In real human robot interaction (HRI) scenarios, speech recognition
represents a major challenge due to robot noise, background noise and
time-varying acoustic channel. This document describes the procedure used to
obtain the Multichannel Robot Speech Recognition Database (MChRSR). It is
composed of 12 hours of multichannel evaluation data recorded in a real mobile
HRI scenario. This database was recorded with a PR2 robot performing different
translational and azimuthal movements. Accordingly, 16 evaluation sets were
obtained re-recording the clean set of the Aurora 4 database in different
movement conditions.
","[{""version"":""v1"",""created"":""Sat, 30 Dec 2017 00:01:08 GMT""}]","2018-01-03"
"1801.00062","Jo\~ao Sacramento","Jo\~ao Sacramento and Rui Ponte Costa and Yoshua Bengio and Walter
  Senn","Dendritic error backpropagation in deep cortical microcircuits","27 pages, 5 figures, 10 pages supplementary information",,,,"q-bio.NC cs.LG cs.NE","http://arxiv.org/licenses/nonexclusive-distrib/1.0/","  Animal behaviour depends on learning to associate sensory stimuli with the
desired motor command. Understanding how the brain orchestrates the necessary
synaptic modifications across different brain areas has remained a longstanding
puzzle. Here, we introduce a multi-area neuronal network model in which
synaptic plasticity continuously adapts the network towards a global desired
output. In this model synaptic learning is driven by a local dendritic
prediction error that arises from a failure to predict the top-down input given
the bottom-up activities. Such errors occur at apical dendrites of pyramidal
neurons where both long-range excitatory feedback and local inhibitory
predictions are integrated. When local inhibition fails to match excitatory
feedback an error occurs which triggers plasticity at bottom-up synapses at
basal dendrites of the same pyramidal neurons. We demonstrate the learning
capabilities of the model in a number of tasks and show that it approximates
the classical error backpropagation algorithm. Finally, complementing this
cortical circuit with a disinhibitory mechanism enables attention-like stimulus
denoising and generation. Our framework makes several experimental predictions
on the function of dendritic integration and cortical microcircuits, is
consistent with recent observations of cross-area learning, and suggests a
biological implementation of deep learning.
","[{""version"":""v1"",""created"":""Sat, 30 Dec 2017 00:16:56 GMT""}]","2018-01-03"
"1801.00063","Patrick Peter","Patrick Peter (IAP, France), Filipe de O. Salles (CBPF, Brazil) and
  Ilya L. Shapiro (ICE, Juiz de Fora, Brazil and Tomsk, Russia)","On the ghost-induced instability on de Sitter background","12 pages, 9 figures","Phys. Rev. D 97, 064044 (2018)","10.1103/PhysRevD.97.064044",,"gr-qc hep-th","http://arxiv.org/licenses/nonexclusive-distrib/1.0/","  It is known that the perturbative instability of tensor excitations in higher
derivative gravity may not take place if the initial frequency of the
gravitational waves are below the Planck threshold. One can assume that this is
a natural requirement if the cosmological background is sufficiently mild,
since in this case the situation is qualitatively close to the free
gravitational wave in flat space. Here, we explore the opposite situation and
consider the effect of a very far from Minkowski radiation-dominated or de
Sitter cosmological background with a large Hubble rate, e.g., typical of an
inflationary period. It turns out that, then, for initial Planckian or even
trans-Planckian frequencies, the instability is rapidly suppressed by the very
fast expansion of the universe.
","[{""version"":""v1"",""created"":""Sat, 30 Dec 2017 00:39:52 GMT""},{""version"":""v2"",""created"":""Wed, 3 Jan 2018 14:09:09 GMT""}]","2018-04-04"
"1801.00064","Ryui Kaneko","Mario Bijelic, Ryui Kaneko, Claudius Gros, Roser Valent\'i","Suppression of topological Mott-Hubbard phases by multiple charge orders
  in the honeycomb extended Hubbard model","9 pages, 12 figures","Phys. Rev. B 97, 125142 (2018)","10.1103/PhysRevB.97.125142",,"cond-mat.str-el","http://arxiv.org/licenses/nonexclusive-distrib/1.0/","  We investigate the competition between charge-density-wave (CDW) states and a
Coulomb interaction-driven topological Mott insulator (TMI) in the honeycomb
extended Hubbard model. For the spinful model with on-site ($U$) and
next-nearest-neighbor ($V_2$) Coulomb interactions at half filling, we find two
peculiar six-sublattice charge-density-wave insulating states by using
variational Monte Carlo simulations as well as the Hartree-Fock approximation.
We observe that conventional ordered states always win with respect to the TMI.
The ground state is given in the large-$V_2$ region by a CDW characterized by a
220200 (001122) charge configuration for smaller (larger) $U$, where 0, 1, and
2 denote essentially empty, singly occupied, and doubly occupied sites. Within
the 001122-type CDW phase, we find a magnetic transition driven by an emergent
coupled-dimer antiferromagnet on an effective square lattice of singly occupied
sites. Possible realizations of the found states are discussed.
","[{""version"":""v1"",""created"":""Sat, 30 Dec 2017 01:00:22 GMT""},{""version"":""v2"",""created"":""Wed, 4 Apr 2018 08:17:13 GMT""}]","2018-04-05"
"1801.00065","Alvaro Ulloa Cerna","Alvaro Ulloa, Anna Basile, Gregory J. Wehner, Linyuan Jing, Marylyn D.
  Ritchie, Brett Beaulieu-Jones, Christopher M. Haggerty, Brandon K. Fornwalt","An Unsupervised Homogenization Pipeline for Clustering Similar Patients
  using Electronic Health Record Data","conference",,,,"q-bio.QM","http://arxiv.org/licenses/nonexclusive-distrib/1.0/","  Electronic health records (EHR) contain a large variety of information on the
clinical history of patients such as vital signs, demographics, diagnostic
codes and imaging data. The enormous potential for discovery in this rich
dataset is hampered by its complexity and heterogeneity.
  We present the first study to assess unsupervised homogenization pipelines
designed for EHR clustering. To identify the optimal pipeline, we tested
accuracy on simulated data with varying amounts of redundancy, heterogeneity,
and missingness. We identified two optimal pipelines: 1) Multiple Imputation by
Chained Equations (MICE) combined with Local Linear Embedding; and 2) MICE,
Z-scoring, and Deep Autoencoders.
","[{""version"":""v1"",""created"":""Sat, 30 Dec 2017 01:06:14 GMT""},{""version"":""v2"",""created"":""Wed, 21 Mar 2018 14:46:41 GMT""}]","2018-03-22"
"1801.00066","Sambarta Dasgupta","Sambarta Dasgupta and Umesh Vaidya","Normally hyperbolic surfaces based finite-time transient stability
  monitoring of power system dynamics",,,,,"math.OC math.DS","http://arxiv.org/licenses/nonexclusive-distrib/1.0/","  In this paper, we develop a methodology for finite time rotor angle stability
analysis using the theory of normal hyperbolic surfaces. The proposed method
would bring new insights to the existing techniques, which are based on
asymptotic analysis. For the finite time analysis we have adopted the Theory of
normally hyperbolic surfaces. We have connected the repulsion rates of the
normally hyperbolic surfaces, to the finite time stability. Also, we have
characterized the region of stability over finite time window. The parallels
have been drawn with the existing tools for asymptotic analysis. Also, we have
proposed a model free method for online stability monitoring.
","[{""version"":""v1"",""created"":""Sat, 30 Dec 2017 01:07:02 GMT""}]","2018-01-03"
"1801.00067","Akio Inoue","Akio K. Inoue (Osaka Sangyo U.), Kenji Hasegawa (Nagoya U.), Tomoaki
  Ishiyama (Chiba U.), Hidenobu Yajima (Tohoku U.), Ikkoh Shimizu (Osaka U.),
  Masayuki Umemura (Tsukuba U.), Akira Konno (U. Tokyo), Yuichi Harikane (U.
  Tokyo), Takatoshi Shibuya (U. Tokyo), Masami Ouchi (U. Tokyo), Kazuhiro
  Shimasaku (U. Tokyo), Yoshiaki Ono (U. Tokyo), Haruka Kusakabe (U. Tokyo),
  Ryo Higuchi (U. Tokyo), Chien-Hsiu Lee (NAOJ)","SILVERRUSH. VI. A simulation of Ly$\alpha$ emitters in the reionization
  epoch and a comparison with Subaru Hyper Suprime-Cam survey early data","PASJ in press, 30 pages, 20 figures",,"10.1093/pasj/psy048",,"astro-ph.GA","http://arxiv.org/licenses/nonexclusive-distrib/1.0/","  The survey of Lyman $\alpha$ emitters (LAEs) with Subaru Hyper Suprime-Cam,
called SILVERRUSH (Ouchi et al.), is producing massive data of LAEs at
$z\gtrsim6$. Here we present LAE simulations to compare the SILVERRUSH data. In
162$^3$ comoving Mpc$^3$ boxes, where numerical radiative transfer calculations
of reionization were performed, LAEs have been modeled with physically
motivated analytic recipes as a function of halo mass. We have examined $2^3$
models depending on the presence or absence of dispersion of halo Ly$\alpha$
emissivity, dispersion of the halo Ly$\alpha$ optical depth, $\tau_\alpha$, and
halo mass dependence of $\tau_\alpha$. The unique free parameter in our model,
a pivot value of $\tau_\alpha$, is calibrated so as to reproduce the $z=5.7$
Ly$\alpha$ luminosity function (LF). We compare our model predictions with
Ly$\alpha$ LFs at $z=6.6$ and $7.3$, LAE angular auto-correlation functions
(ACFs) at $z=5.7$ and $6.6$, and LAE fractions in Lyman break galaxies at
$5<z<7$. The Ly$\alpha$ LFs and ACFs are reproduced by multiple models, but the
LAE fraction turns out to be the most critical test. The dispersion of
$\tau_\alpha$ and the halo mass dependence of $\tau_\alpha$ are essential to
explain all observations reasonably. Therefore, a simple model of one-to-one
correspondence between halo mass and Ly$\alpha$ luminosity with a constant
Ly$\alpha$ escape fraction has been ruled out. Based on our best model, we
present a formula to estimate the intergalactic neutral hydrogen fraction,
$x_{\rm HI}$, from the observed Ly$\alpha$ luminosity density at $z\gtrsim6$.
We finally obtain $x_{\rm HI}=0.5_{-0.3}^{+0.1}$ as a volume-average at
$z=7.3$.
","[{""version"":""v1"",""created"":""Sat, 30 Dec 2017 01:30:00 GMT""},{""version"":""v2"",""created"":""Tue, 3 Apr 2018 07:20:17 GMT""}]","2018-05-23"
