"1702.06035","Randy Davila","Randy Davila and Michael A. Henning","On the Total Forcing Number of a Graph",,,,,"math.CO","http://arxiv.org/licenses/nonexclusive-distrib/1.0/","  Let $G$ be a simple and finite graph without isolated vertices. In this paper
we study forcing sets (zero forcing sets) which induce a subgraph of $G$
without isolated vertices. Such a set is called a total forcing set, introduced
and first studied by Davila \cite{Davila}. The minimum cardinality of a total
forcing set in $G$ is the total forcing number of $G$, denoted $F_t(G)$. We
study basic properties of $F_t(G)$, relate $F_t(G)$ to various domination
parameters, and establish $NP$-completeness of the associated decision problem
for $F_t(G)$. We also prove that if $G$ is a connected graph of order $n \ge 3$
and maximum degree $\Delta$, then $F_t(G) \le ( \frac{\Delta}{\Delta +1} ) n$,
with equality if and only if $G$ is a complete graph $K_{\Delta + 1}$.
","[{""version"":""v1"",""created"":""Mon, 20 Feb 2017 16:00:10 GMT""},{""version"":""v2"",""created"":""Wed, 22 Feb 2017 17:09:54 GMT""},{""version"":""v3"",""created"":""Mon, 27 Feb 2017 16:02:25 GMT""}]","2017-02-28"
"1702.06036","Laura Castell\'o Gomar","Laura Castell\'o Gomar, Daniel Mart\'in de Blas, Guillermo A. Mena
  Marug\'an, and Javier Olmedo","Hybrid loop quantum cosmology and predictions for the cosmic microwave
  background","34 pages, 23 figures, 1 table; v2: revised and minor improvements
  included","Phys. Rev. D 96, 103528 (2017)","10.1103/PhysRevD.96.103528","IGC-17|2-1","gr-qc","http://arxiv.org/licenses/nonexclusive-distrib/1.0/","  We investigate the consequences of the hybrid quantization approach for
primordial perturbations in loop quantum cosmology, obtaining predictions for
the cosmic microwave background and comparing them with data collected by the
Planck mission. In this work, we complete previous studies about the scalar
perturbations and incorporate tensor modes. We compute their power spectrum for
a variety of vacuum states. We then analyze the tensor-to-scalar ratio and the
consistency relation between this quantity and the spectral index of the tensor
power spectrum. We also compute the temperature-temperature, electric-electric,
temperature-electric, and magnetic-magnetic correlation functions. Finally, we
discuss the effects of the quantum geometry in these correlation functions and
confront them with observations.
","[{""version"":""v1"",""created"":""Mon, 20 Feb 2017 16:01:19 GMT""},{""version"":""v2"",""created"":""Tue, 30 May 2017 10:00:23 GMT""}]","2017-11-29"
"1702.06037","Laurent Berger","Laurent Berger","Nonarchimedean dynamical systems and formal groups","9 pages. v3 : revised following referee's report",,,,"math.NT","http://arxiv.org/licenses/nonexclusive-distrib/1.0/","  We prove two theorems that confirm an observation of Lubin concerning
families of $p$-adic power series that commute under composition: under certain
conditions, there is a formal group such that the power series in the family
are either endomorphisms of this group, or semi-conjugate to endomorphisms of
this group.
","[{""version"":""v1"",""created"":""Mon, 20 Feb 2017 16:02:24 GMT""},{""version"":""v2"",""created"":""Mon, 27 Nov 2017 13:10:36 GMT""},{""version"":""v3"",""created"":""Fri, 7 Sep 2018 07:20:25 GMT""}]","2018-09-10"
"1702.06038","Albrecht Jander","Pratim Chowdhury (Oregon State University), Albrecht Jander (Oregon
  State University) and Pallavi Dhagat (Oregon State University)","Parametric pumping of spin waves by acoustic waves",,,,,"cond-mat.mes-hall","http://arxiv.org/licenses/nonexclusive-distrib/1.0/","  The linear and nonlinear interactions between spin waves (magnons) and
acoustic waves (phonons) in magnetostrictive materials provide an exciting
opportunity for realizing novel microwave signal processing devices and
spintronic circuits. Here we demonstrate the parametric pumping of spin waves
by acoustic waves, the possibility of which has long been theoretically
anticipated but never experimentally realized. Spin waves propagating in a thin
film of yttrium iron garnet (YIG), a magnetostrictive ferrimagnet with low spin
and acoustic wave damping, are pumped using an acoustic resonator driven at
frequencies near twice the spin wave frequency. The observation of a
counter-propagating idler wave and a distinct pump threshold that increases
quadratically with frequency non-degeneracy are evidence of a nonlinear
parametric pumping process consistent with classical theory. This demonstration
of acoustic parametric pumping lays the groundwork for developing new
spintronic and microwave signal processing devices based on amplification and
manipulation of spin waves by efficient, spatially localized acoustic
transducers.
","[{""version"":""v1"",""created"":""Mon, 20 Feb 2017 16:03:28 GMT""}]","2017-02-21"
"1702.06039","Dirk Lamoen","Masahiko Matsubara, Rolando Saniz, Bart Partoens and Dirk Lamoen","Doping anatase TiO2 with group V-b and VI-b transition metal atoms: a
  hybrid functional first-principles study",,"Physical Chemistry Chemical Physics 19, 1945 (2017)","10.1039/C6CP06882K",,"cond-mat.mtrl-sci","http://arxiv.org/licenses/nonexclusive-distrib/1.0/","  We investigate the role of transition metal atoms of group V-b (V, Nb, and
Ta) and VI-b (Cr, Mo, and W) as n- or p-type dopants in anatase TiO2 using
thermodynamic principles and density functional theory with the
Heyd-Scuseria-Ernzerhof HSE06 hybrid functional. The HSE06 functional provides
a realistic value for the band gap, which ensures a correct classification of
dopants as shallow or deep donors or acceptors. Defect formation energies and
thermodynamic transition levels are calculated taking into account the
constraints imposed by the stability of TiO2 and the solubility limit of the
impurities. Nb, Ta, W and Mo are identified as shallow donors. Although W
provides two electrons, Nb and Ta show a considerably lower formation energy,
in particular under O-poor conditions. Mo donates in principle one electron,
but under specific conditions can turn into a double donor. V impurities are
deep donors and Cr shows up as an amphoteric defect, thereby acting as an
electron trapping center in n-type TiO2 especially under O-rich conditions. A
comparison with the available experimental data yields excellent agreement.
","[{""version"":""v1"",""created"":""Mon, 20 Feb 2017 16:04:43 GMT""}]","2017-04-05"
"1702.06040","Sandra Etoka","S. Etoka, E. Gerard, A.M.S. Richards, D. Engels, J. Brand, T. Le
  Bertre","Recurring OH Flares towards o Ceti: I. location and structure of the
  1990s' and 2010s' events","Preprint, 16 pages, 17 figures, 2 tables, accepted for publication in
  MNRAS (20 February, 2017)",,"10.1093/mnras/stx448",,"astro-ph.SR","http://arxiv.org/licenses/nonexclusive-distrib/1.0/","  We present the analysis of the onset of the new 2010s' OH flaring event
detected in the OH ground-state main line at 1665~MHz towards o Ceti and
compare its characteristics with those of the 1990s' flaring event. This is
based on a series of complementary single-dish and interferometric observations
both in OH and H2O obtained with the Nancay Radio telescope (NRT), the Medicina
and Effelsberg Telescopes, the European VLBI Network (EVN), and
(e)Multi-Element Radio Linked Interferometer Network ((e)MERLIN). We compare
the overall characteristics of o Ceti's flaring events with those which have
been observed towards other thin-shell Miras, and explore the implication of
these events with respect to the standard OH circumstellar-envelope model. The
role of binarity in the specific characteristics of o Ceti's flaring events is
also investigated. The flaring regions are found to be less than ~400$ +/- 40
mas (i.e., ~40 +/- 4$ AU) either side of o Ceti, with seemingly no preferential
location with respect to the direction to the companion Mira B. Contrary to the
usual expectation that the OH maser zone is located outside the H2O maser zone,
the coincidence of the H2O and OH maser velocities suggests that both emissions
arise at similar distances from the star. The OH flaring characteristics of
Mira are similar to those observed in various Mira variables before, supporting
the earlier results that the regions where the transient OH maser emission
occurs are different from the standard OH maser zone.
","[{""version"":""v1"",""created"":""Mon, 20 Feb 2017 16:06:08 GMT""}]","2017-04-19"
"1702.06041","Rory Brittain","Rory A. Brittain, Nick S. Jones and Thomas E. Ouldridge","What we learn from the learning rate","12 pages, 9 figures. Revised due to referees' comments. Extra comment
  on equation 7, terminology of 'information affinity' used, additional
  explanation in sections III.B. and IV., order of figures 5(a) and 5(b)
  reversed, typos corrected","J. Stat. Mech. (2017) 063502","10.1088/1742-5468/aa71d4",,"cond-mat.stat-mech q-bio.MN","http://arxiv.org/licenses/nonexclusive-distrib/1.0/","  The learning rate is an information-theoretical quantity for bipartite Markov
chains describing two coupled subsystems. It is defined as the rate at which
transitions in the downstream subsystem tend to increase the mutual information
between the two subsystems, and is bounded by the dissipation arising from
these transitions. Its physical interpretation, however, is unclear, although
it has been used as a metric for the sensing performance of the downstream
subsystem. In this paper, we explore the behaviour of the learning rate for a
number of simple model systems, establishing when and how its behaviour is
distinct from the instantaneous mutual information between subsystems. In the
simplest case, the two are almost equivalent. In more complex steady-state
systems, the mutual information and the learning rate behave qualitatively
distinctly, with the learning rate clearly now reflecting the rate at which the
downstream system must update its information in response to changes in the
upstream system. It is not clear whether this quantity is the most natural
measure for sensor performance, and, indeed, we provide an example in which
optimising the learning rate over a region of parameter space of the downstream
system yields an apparently sub-optimal sensor.
","[{""version"":""v1"",""created"":""Mon, 20 Feb 2017 16:08:09 GMT""},{""version"":""v2"",""created"":""Mon, 3 Jul 2017 14:57:35 GMT""}]","2017-07-04"
"1702.06042","Paolo Andrea Erdman","Paolo Andrea Erdman, Francesco Mazza, Riccardo Bosisio, Giuliano
  Benenti, Rosario Fazio and Fabio Taddei","Thermoelectric properties of an interacting quantum dot-based heat
  engine","30 pages, 15 figures. Published version","Phys. Rev. B 95, 245432 (2017)","10.1103/PhysRevB.95.245432",,"cond-mat.mes-hall","http://arxiv.org/licenses/nonexclusive-distrib/1.0/","  We study the thermoelectric properties and heat-to-work conversion
performance of an interacting, multi-level quantum dot (QD) weakly coupled to
electronic reservoirs. We focus on the sequential tunneling regime. The
dynamics of the charge in the QD is studied by means of master equations for
the probabilities of occupation. From here we compute the charge and heat
currents in the linear response regime. Assuming a generic multi-terminal
setup, and for low temperatures (quantum limit), we obtain analytical
expressions for the transport coefficients which account for the interplay
between interactions (charging energy) and level quantization. In the case of
systems with two and three terminals we derive formulas for the power factor Q
and the figure of merit ZT for a QD-based heat engine, identifying optimal
working conditions which maximize output power and efficiency of heat-to-work
conversion. Beyond the linear response we concentrate on the two-terminal
setup. We first study the thermoelectric non-linear coefficients assessing the
consequences of large temperature and voltage biases, focusing on the breakdown
of the Onsager reciprocal relation between thermopower and Peltier coefficient.
We then investigate the conditions which optimize the performance of a heat
engine, finding that in the quantum limit output power and efficiency at
maximum power can almost be simultaneously maximized by choosing appropriate
values of electrochemical potential and bias voltage. At last we study how
energy level degeneracy can increase the output power.
","[{""version"":""v1"",""created"":""Mon, 20 Feb 2017 16:08:14 GMT""},{""version"":""v2"",""created"":""Wed, 28 Jun 2017 08:54:02 GMT""}]","2017-06-29"
"1702.06043","Levon Haykazyan","Levon Haykazyan","Groups with Locally Modular Homogeneous Pregeometries are Commutative",,,,,"math.LO math.CO math.GR","http://arxiv.org/licenses/nonexclusive-distrib/1.0/","  It is well known that strongly minimal groups are commutative. Whether this
is true for various generalisations of strong minimality has been asked in
several different settings (see Hyttinen [2002], Maesono [2007], Pillay and
Tanovi\'c [2011]). In this note we show that the answer is positive for groups
with locally modular homogeneous pregeometries.
","[{""version"":""v1"",""created"":""Mon, 20 Feb 2017 16:12:48 GMT""},{""version"":""v2"",""created"":""Thu, 13 Apr 2017 17:39:48 GMT""}]","2017-04-14"
"1702.06044","Anass Bouisaghouane","Anass Bouisaghouane","The Kontsevich tetrahedral flow in 2D: a toy model","6 pages, 3 figures",,,,"math.DG math-ph math.AP math.MP","http://arxiv.org/licenses/nonexclusive-distrib/1.0/","  In the paper ""Formality conjecture"" (1996) Kontsevich designed a universal
flow $\dot{\mathcal{P}}=\mathcal{Q}_{a:b}(\mathcal{P})=a\Gamma_{1}+b\Gamma_{2}$
on the spaces of Poisson structures $\mathcal{P}$ on all affine manifolds of
dimension $n \geqslant 2$. We prove a claim from $\textit{loc. cit.}$ stating
that if $n=2$, the flow $\mathcal{Q}_{1:0}=\Gamma_{1}(\mathcal{P})$ is
Poisson-cohomology trivial: $\Gamma_{1}(\mathcal{P})$ is the Schouten bracket
of $\mathcal{P}$ with $\mathcal{X}$, for some vector field $\mathcal{X}$; we
examine the structure of the space of solutions $\mathcal{X}$. Both the
construction of differential polynomials $\Gamma_{1}(\mathcal{P})$ and
$\Gamma_{2}(\mathcal{P})$ and the technique to study them remain valid in
higher dimensions $n \geqslant 3$, but neither the trivializing vector field
$\mathcal{X}$ nor the setting $b:=0$ survive at $n\geqslant 3$, where the
balance is $a:b=1:6$.
","[{""version"":""v1"",""created"":""Mon, 20 Feb 2017 16:13:04 GMT""}]","2017-02-21"
"1702.06045","Haris Celik","Haris Celik, Ki Won Sung","Joint Transmission with Dummy Symbols for Dynamic TDD in Ultra-Dense
  Deployments",,,,,"cs.IT math.IT","http://arxiv.org/licenses/nonexclusive-distrib/1.0/","  Dynamic time-division duplexing (TDD) is considered a promising solution to
deal with fast-varying traffic often found in ultra-densely deployed networks.
At the same time, it generates more interference which may degrade the
performance of some user equipment (UE). When base station (BS) utilization is
low, some BSs may not have an UE to serve. Rather than going into sleep mode,
the idle BSs can help nearby UEs using joint transmission. To deal with
BS-to-BS interference, we propose using joint transmission with dummy symbols
where uplink BSs serving uplink UEs participate in the precoding. Since BSs are
not aware of the uplink symbols beforehand, any symbols with zero power can be
transmitted instead to null the BS-to-BS interference. Numerical results show
significant performance gains for uplink and downlink at low and medium
utilization. By varying the number of participating uplink BSs in the
precoding, we also show that it is possible to successfully trade performance
in the two directions.
","[{""version"":""v1"",""created"":""Mon, 20 Feb 2017 16:13:08 GMT""},{""version"":""v2"",""created"":""Thu, 27 Apr 2017 09:15:10 GMT""}]","2017-04-28"
"1702.06046","Jos\'e A. Caballero","J. A. Caballero","A TGAS/Gaia DR1 parallactic distance to the sigma Orionis cluster","Astronomische Nachrichten, accepted",,"10.1002/asna.201713312",,"astro-ph.SR","http://arxiv.org/licenses/nonexclusive-distrib/1.0/","  With the new Tycho-Gaia Astrometric Solution, I derive a new parallactic
distance to the young sigma Orionis open cluster, which is a cornerstone region
for studying the formation and evolution of stars and substellar objects from
tens of solar masses to a few Jupiter masses. I started with the list of the 46
brightest cluster stars of Caballero (2007). After identifying the 24 TGAS
stars in the 30 arcmin-radius survey area and accounting for 11 FGKM-type
dwarfs and giants in the fore- and background, I got a list of 13 cluster
members and candidates with new parallaxes. Of them, I discarded five cluster
member candidates with questionable features of youth and/or discordant
parallaxes and proper motions, including a distant Herbig Ae/Be star, and
proceeded with the remaining eight stars. The sigma Orionis mean heliocentric
distance is d =360^{+44}_{-35} pc, which is consistent with a contemporaneous
interferometric determination that concludes a two-decade dispute on the
cluster distance. As a by-product, the re-classification of those five cluster
member candidates, now interlopers, shows a manifest deficit of cluster stars
between 1.2 and 2.1 Msol, which leaves the door open to new astrometric
membership analyses with the next Gaia data releases.
","[{""version"":""v1"",""created"":""Mon, 20 Feb 2017 16:14:31 GMT""}]","2017-07-26"
"1702.06047","Hojoo Lee","Hojoo Lee","Minimal surfaces in ${\mathbb{R}}^{4}$ foliated by conic sections and
  parabolic rotations of holomorphic null curves in ${\mathbb{C}}^{4}$","Comments welcome",,,,"math.DG","http://arxiv.org/licenses/nonexclusive-distrib/1.0/","  Using the complex parabolic rotations of holomorphic null curves in
${\mathbb{C}}^{4}$, we transform minimal surfaces in Euclidean space
${\mathbb{R}}^{3} \subset {\mathbb{R}}^{4}$ to a family of degenerate minimal
surfaces in Euclidean space ${\mathbb{R}}^{4}$. Applying our deformation to
holomorphic null curves in ${\mathbb{C}}^{3} \subset {\mathbb{C}}^{4}$ induced
by helicoids in ${\mathbb{R}}^{3}$, we discover new minimal surfaces in
${\mathbb{R}}^{4}$ foliated by conic sections with eccentricity grater than
$1$: hyperbolas or straight lines. Applying our deformation to holomorphic null
curves in ${\mathbb{C}}^{3}$ induced by catenoids in ${\mathbb{R}}^{3}$, we can
rediscover the Hoffman-Osserman catenoids in ${\mathbb{R}}^{4}$ foliated by
conic sections with eccentricity smaller than $1$: ellipses or circles. We
prove the existence of minimal surfaces in ${\mathbb{R}}^{4}$ foliated by
ellipses, which converge to circles at infinity. We construct minimal surfaces
in ${\mathbb{R}}^{4}$ foliated by parabolas: conic sections which have
eccentricity $1$.
","[{""version"":""v1"",""created"":""Mon, 20 Feb 2017 16:15:45 GMT""}]","2017-02-21"
"1702.06048","Jan Gutowski","J. B. Gutowski and G. Papadopoulos","On supersymmetric AdS6 solutions in 10 and 11 dimensions","26 pages, latex",,"10.1007/JHEP12(2017)009","DMUS--MP--17/04","hep-th","http://arxiv.org/licenses/nonexclusive-distrib/1.0/","  We prove a non-existence theorem for smooth, supersymmetric, warped AdS6
solutions with connected, compact without boundary internal space in D=11 and
(massive) IIA supergravities. In IIB supergravity we show that if such AdS6
solutions exist, then the NSNS and RR 3-form fluxes must be linearly
independent and certain spinor bi-linears must be appropriately restricted.
Moreover we demonstrate that the internal space admits an so(3) action which
leaves all the fields invariant and for smooth solutions the principal orbits
must have co-dimension two. We also describe the topology and geometry of
internal spaces that admit such a so(3) action and show that there are no
solutions for which the internal space has topology F * S^2, where F is an
oriented surface.
","[{""version"":""v1"",""created"":""Mon, 20 Feb 2017 16:18:34 GMT""}]","2018-01-17"
"1702.06049","Nicolas Lerner","Gilles Godefroy and Nicolas Lerner","Some natural subspaces and quotient spaces of $L^1$","13 pages",,,,"math.FA","http://arxiv.org/licenses/nonexclusive-distrib/1.0/","  We show that the space $\text{Lip}_0(\mathbb R^n)$ is the dual space of
$L^{1}({\mathbb R}^{n}; {\mathbb R}^{n})/N$ where $N$ is the subspace of
$L^{1}({\mathbb R}^{n}; {\mathbb R}^{n})$ consisting of vector fields whose
divergence vanishes. We prove that although the quotient space $L^{1}({\mathbb
R}^{n}; {\mathbb R}^{n})/N$ is weakly sequentially complete, the subspace $N$
is not nicely placed - in other words, its unit ball is not closed for the
topology $\tau_m$ of local convergence in measure. We prove that if $\Omega$ is
a bounded open star-shaped subset of $\mathbb {R}^n$ and $X$ is a closed
subspace of $L^1(\Omega)$ consisting of continuous functions, then the unit
ball of $X$ is compact for the compact-open topology on $\Omega$. It follows in
particular that such spaces $X$, when they have Grothendieck's approximation
property, have unconditional finite-dimensional decompositions and are
isomorphic to weak*-closed subspaces of $l^1$. Numerous examples are provided
where such results apply.
","[{""version"":""v1"",""created"":""Mon, 20 Feb 2017 16:19:07 GMT""}]","2017-02-21"
"1702.06050","Christian Ufrecht","Christian Ufrecht, Matthias Meister, Albert Roura, Wolfgang P.
  Schleich","Comprehensive classification for Bose-Fermi mixtures",,"New J. Phys. 19, 085001 (2017)","10.1088/1367-2630/aa7814",,"cond-mat.quant-gas","http://arxiv.org/licenses/nonexclusive-distrib/1.0/","  We present analytical studies of a boson-fermion mixture at zero temperature
with spin-polarized fermions. Using the Thomas-Fermi approximation for bosons
and the local-density approximation for fermions, we find a large variety of
different density shapes. In the case of continuous density, we obtain analytic
conditions for each configuration for attractive as well as repulsive
boson-fermion interaction. Furthermore, we analytically show that all the
scenarios we describe are minima of the grand-canonical energy functional.
Finally, we provide a full classification of all possible ground states in the
interpenetrative regime. Our results also apply to binary mixtures of bosons.
","[{""version"":""v1"",""created"":""Mon, 20 Feb 2017 16:22:50 GMT""}]","2018-03-14"
"1702.06051","Craig Lent","Enrique P. Blair, Geza Toth, and Craig S. Lent","Entanglement loss in molecular quantum-dot qubits due to interaction
  with the environment","14 pages, 3 figures","Journal of Physics: Condensed Matter 30, 195602 (2018)","10.1088/1361-648X/aab98d",,"quant-ph","http://arxiv.org/licenses/nonexclusive-distrib/1.0/","  We study quantum entanglement loss due to environmental interaction in a
condensed matter system with a complex geometry relevant to recent proposals
for computing with single electrons at the nanoscale. We consider a system
consisting of two qubits, each realized by an electron in a double quantum dot,
which are initially in an entangled Bell state. The qubits are widely separated
and each interacts with its own environment. The environment for each is
modeled by surrounding double quantum dots placed at random positions with
random orientations. We calculate the unitary evolution of the joint system and
environment. The global state remains pure throughout. We examine the time
dependence of the expectation value of the bipartite Clauser-Horne-Shimony-Holt
(CHSH) and Brukner-Paunkovi\'c-Rudolph-Vedral (BPRV) Bell operators and explore
the emergence of correlations consistent with local realism. Though the details
of this transition depend on the specific environmental geometry, we show how
the results can be mapped on to a universal behavior with appropriate scaling.
We determine the relevant disentanglement times based on realistic physical
parameters for molecular double-dots.
","[{""version"":""v1"",""created"":""Mon, 20 Feb 2017 16:26:27 GMT""},{""version"":""v2"",""created"":""Thu, 23 Mar 2017 14:30:22 GMT""},{""version"":""v3"",""created"":""Wed, 2 May 2018 20:50:36 GMT""}]","2018-05-04"
"1702.06052","Andre Fuzfa","A. F\""uzfa","Electromagnetic Gravitational Waves Antennas for Directional Emission
  and Reception","35 pages, 16 figures",,,"Patents PCT/EP2018/086758 ; PCT/EP2018/086760","gr-qc","http://arxiv.org/licenses/nonexclusive-distrib/1.0/","  A successful experiment combining emission and reception of gravitational
waves (GWs) would constitute a premiere of gravity control. However, such
experiments manipulating gravity would require to compactly store large amounts
of energy while using ultra-sensitive detection techniques and hence can be
expected to be very difficult to realise. In this paper, we first propose new
designs of electromagnetic (EM) generators allowing directional emission of
GWs. They are based on the resonant amplification of GWs occuring when EM
standing waves couple to an external static magnetic field. The interplay
between the EM polarizations, the orientation of the boosting magnetic field
and the emitted GW polarizations is studied, as well as the gravitational
radiation patterns of the different generators. Then, we develop a new GW
directional detection method based on magnetic energy storage. Three possible
applications are presented: (i) indirect detection of GW emission by
high-accuracy monitoring of the energy loss in the generators ; (ii) direct
detection of an incoming plane GW with a high-field magnet and (iii) GW
emission-reception experiments. Although current technology allows reaching
detection thresholds in these experiments, their practical realisation would
still need to overcome several key technical challenges.
","[{""version"":""v1"",""created"":""Mon, 20 Feb 2017 16:28:00 GMT""},{""version"":""v2"",""created"":""Tue, 9 Jan 2018 13:04:51 GMT""},{""version"":""v3"",""created"":""Fri, 23 Nov 2018 07:48:46 GMT""}]","2021-08-24"
