"1702.06142","Daniel Ranard","Jordan S. Cotler, Geoffrey R. Penington, Daniel H. Ranard","Locality from the Spectrum","40 pages, 2 figures","Commun. Math. Phys. (2019) 368: 1267","10.1007/s00220-019-03376-w",,"quant-ph hep-th math-ph math.MP","http://arxiv.org/licenses/nonexclusive-distrib/1.0/","  Essential to the description of a quantum system are its local degrees of
freedom, which enable the interpretation of subsystems and dynamics in the
Hilbert space. While a choice of local tensor factorization of the Hilbert
space is often implicit in the writing of a Hamiltonian or Lagrangian, the
identification of local tensor factors is not intrinsic to the Hilbert space
itself. Instead, the only basis-invariant data of a Hamiltonian is its
spectrum, which does not manifestly determine the local structure. This
ambiguity is highlighted by the existence of dualities, in which the same
energy spectrum may describe two systems with very different local degrees of
freedom. We argue that in fact, the energy spectrum alone almost always encodes
a unique description of local degrees of freedom when such a description
exists, allowing one to explicitly identify local subsystems and how they
interact. As a consequence, we can almost always write a Hamiltonian in its
local presentation given only its spectrum. In special cases, multiple dual
local descriptions can be extracted from a given spectrum, but generically the
local description is unique.
","[{""version"":""v1"",""created"":""Mon, 20 Feb 2017 19:03:47 GMT""},{""version"":""v2"",""created"":""Thu, 9 Nov 2017 10:40:51 GMT""}]","2019-07-10"
"1702.06143","Marcel Pawlowski","Marcel S. Pawlowski, J\""org Dabringhausen, Benoit Famaey, Hector
  Flores, Francois Hammer, Gerhard Hensler, Rodrigo A. Ibata, Pavel Kroupa,
  Geraint F. Lewis, Noam I. Libeskind, Stacy S. McGaugh, David Merritt, Mathieu
  Puech, Yanbin Yang","Considerations on how to investigate planes of satellite galaxies","8 pages, 3 figures. Accepted for publication in Astronomische
  Nachrichten / Astronomical Notes",,"10.1002/asna.201713366",,"astro-ph.GA astro-ph.CO","http://arxiv.org/licenses/nonexclusive-distrib/1.0/","  The existence of a spatially thin, kinematically coherent Disk of Satellites
(DoS) around the Milky Way (MW), is a problem that often garners vivacious
debate in the literature or at scientific meetings. One of the most recent
incarnations of this wrangle occurred with two papers by Maji et al, who argued
that these structures ""maybe a misinterpretation of the data"". These claims are
in stark contrast to previous works. Motivated by this and other recent
publications on this problem, we discuss necessary considerations to make,
observational effects to consider, and pitfalls to avoid when investigating
satellite galaxy planes such as the MW's DoS. In particular, we emphasize that
conclusions need to have a statistical basis including a determination of the
significance of satellite alignments, observational biases must not be ignored,
and measurement errors (e.g. for proper motions) need to be considered. We
discuss general problems faced by attempts to determine the dynamical stability
of the DoS via orbit integrations of MW satellite galaxies, and demonstrate
that to interpret simulations, it is helpful to compare them with a null case
of isotropically distributed satellite positions and velocities. Based on these
criteria, we find that the conclusions of Maji et al. do not hold up to
scrutiny, and that their hydrodynamic cosmological simulation of a single host
shows no evidence for a significant kinematic coherence among the simulated
satellite galaxies, in contrast to the observed MW system.
","[{""version"":""v1"",""created"":""Mon, 20 Feb 2017 19:04:41 GMT""},{""version"":""v2"",""created"":""Tue, 29 Aug 2017 18:31:29 GMT""}]","2017-11-08"
"1702.06144","Uri Erez","Ran Hadad, Uri Erez, and Yaming Yu","An Inequality for the Correlation of Two Functions Operating on
  Symmetric Bivariate Normal Variables",,,,,"cs.IT math.IT","http://arxiv.org/licenses/nonexclusive-distrib/1.0/","  An inequality is derived for the correlation of two univariate functions
operating on symmetric bivariate normal random variables. The inequality is a
simple consequence of the Cauchy-Schwarz inequality.
","[{""version"":""v1"",""created"":""Mon, 20 Feb 2017 19:11:10 GMT""}]","2017-02-22"
"1702.06145","Farinaldo Queiroz","Miguel D. Campos, Farinaldo S. Queiroz, Carlos E. Yaguna, Christoph
  Weniger","Search for right-handed neutrinos from dark matter annihilation with
  gamma-rays","19 pages, 7 figures. It matches the version published in JCAP",,"10.1088/1475-7516/2017/07/016",,"hep-ph astro-ph.HE","http://arxiv.org/licenses/nonexclusive-distrib/1.0/","  Several extensions of the Standard Model contain right-handed (sterile)
neutrinos in the GeV-TeV mass range. Due to their mixing with the active
neutrinos, they may give rise to novel effects in cosmology, neutrino physics,
and collider searches. In addition, right-handed neutrinos can also appear as
final states from dark matter annihilations, with important implications for
dark matter indirect detection searches. In this paper, we use current data
from the Fermi Large Area Telescope (6-year observation of dwarf spheroidal
galaxies) and H.E.S.S. (10-year observation of the Galactic center) to
constrain the annihilation of dark matter into right-handed neutrinos. We
consider right-handed neutrino with masses between 10 GeV and 1 TeV, including
both two-body and three-body decays, to derive bounds on the dark matter
annihilation rate, $\langle \sigma v\rangle$, as a function of the dark matter
mass. Our results show, in particular, that the thermal dark matter
annihilation cross section, $3\times 10^{-26}\, {\rm cm^3 s^{-1}} $, into
right-handed neutrinos is excluded for dark matter masses smaller than $200$
GeV.
","[{""version"":""v1"",""created"":""Mon, 20 Feb 2017 19:13:14 GMT""},{""version"":""v2"",""created"":""Fri, 13 Oct 2017 10:25:21 GMT""}]","2017-10-16"
"1702.06146","Vir Bulchandani","Vir B. Bulchandani, Romain Vasseur, Christoph Karrasch, Joel E. Moore","Bethe-Boltzmann Hydrodynamics and Spin Transport in the XXZ Chain","11+4 pages, published version","Phys. Rev. B 97, 045407 (2018)","10.1103/PhysRevB.97.045407",,"cond-mat.stat-mech cond-mat.str-el math-ph math.MP quant-ph","http://arxiv.org/licenses/nonexclusive-distrib/1.0/","  Quantum integrable systems, such as the interacting Bose gas in one dimension
and the XXZ quantum spin chain, have an extensive number of local conserved
quantities that endow them with exotic thermalization and transport properties.
We discuss recently introduced hydrodynamic approaches for such integrable
systems from the viewpoint of kinetic theory and extend the previous works by
proposing a numerical scheme to solve the hydrodynamic equations for finite
times and arbitrary locally equilibrated initial conditions. We then discuss
how such methods can be applied to describe non-equilibrium steady states
involving ballistic heat and spin currents. In particular, we show that the
spin Drude weight in the XXZ chain, previously accessible only by rigorous
techniques of limited scope or controversial thermodynamic Bethe ansatz
arguments, may be evaluated from hydrodynamics in very good agreement with
density-matrix renormalization group calculations.
","[{""version"":""v1"",""created"":""Mon, 20 Feb 2017 19:15:51 GMT""},{""version"":""v2"",""created"":""Mon, 13 Mar 2017 17:00:11 GMT""},{""version"":""v3"",""created"":""Fri, 25 Aug 2017 05:59:25 GMT""},{""version"":""v4"",""created"":""Tue, 20 Feb 2018 06:08:07 GMT""}]","2018-02-21"
"1702.06147","Miguel Montero","Miguel Montero, Angel M. Uranga, Irene Valenzuela","A Chern-Simons Pandemic","60 pages, 2 figures",,"10.1007/JHEP07(2017)123","IFT-UAM/CSIC-17-012, MPP-2017-26","hep-th","http://arxiv.org/licenses/nonexclusive-distrib/1.0/","  In this paper we study the consistency of generalized global symmetries in
theories of quantum gravity, in particular string theory. Such global
symmetries arise in theories with $(p+1)$-form gauge fields, and for spacetime
dimension $d\leq p+3$ there are obstructions to their breaking even by quantum
effects of charged objects. In 4d theories with a 2-form gauge field (or with
an axion scalar), these fields endow Schwarzschild black holes with quantum
hair, a global charge leading to usual trouble with remnants. We describe
precise mechanisms, and examples from string compactifications and holographic
pairs, in which these problems are evaded by either gauging or breaking the
global symmetry, via (suitable versions of) Stuckelberg or Kaloper-Sorbo
couplings. We argue that even in the absence of such couplings, the generic
solution in string theory is the breaking of the global symmetries by cubic
Chern-Simons terms involving different antisymmetric tensor fields. We
conjecture that any theory with (standard or higher-degree antisymmetric
tensor) gauge fields is in the Swampland unless its effective action includes
such Chern-Simons terms. This conjecture implies that many familiar theories,
like QED (even including the charged particles required by the Weak Gravity
Conjecture) or $\mathcal{N}=8$ supergravity in four dimensions, are
inconsistent in quantum gravity unless they are completed by these Chern-Simons
terms.
","[{""version"":""v1"",""created"":""Mon, 20 Feb 2017 19:16:07 GMT""}]","2017-09-13"
"1702.06148","Philip Hopkins","Philip F Hopkins (Caltech), Andrew Wetzel (Davis), Dusan Keres (UCSD),
  Claude-Andre Faucher-Giguere (Northwestern), Eliot Quataert (Berkeley),
  Michael Boylan-Kolchin (Austin), Norman Murray (CITA), Christopher C. Hayward
  (Flatiron), Shea Garrison-Kimmel (Caltech), Cameron Hummels (Caltech), Robert
  Feldmann (Zurich), Paul Torrey (MIT), Xiangcheng Ma (Caltech), Daniel
  Angles-Alcazar (Northwestern), Kung-Yi Su (Caltech), Matthew Orr (Caltech),
  Denise Schmitz (Caltech), Ivanna Escala (Caltech), Robyn Sanderson (Caltech),
  Michael Y. Grudic (Caltech), Zachary Hafen (Northwestern), Ji-Hoon Kim
  (Stanford), Alex Fitts (Austin), James S. Bullock (Irvine), Coral Wheeler
  (Caltech), T.K. Chan (UCSD), Oliver D. Elbert (Irvine), Desika Narananan
  (Florida)","FIRE-2 Simulations: Physics versus Numerics in Galaxy Formation","64 pages, 40 figures. Simulation animations and visualizations
  available at http://www.tapir.caltech.edu/~phopkins/Site/animations and
  http://fire.northwestern.edu . Paper includes complete FIRE algorithms and
  public ICs (http://www.tapir.caltech.edu/~phopkins/publicICs). Updated to
  match published version","MNRAS, 2018, 480, 800","10.1093/mnras/sty1690",,"astro-ph.GA astro-ph.CO astro-ph.IM","http://arxiv.org/licenses/nonexclusive-distrib/1.0/","  The Feedback In Realistic Environments (FIRE) project explores feedback in
cosmological galaxy formation simulations. Previous FIRE simulations used an
identical source code (FIRE-1) for consistency. Motivated by the development of
more accurate numerics - including hydrodynamic solvers, gravitational
softening, and supernova coupling algorithms - and exploration of new physics
(e.g. magnetic fields), we introduce FIRE-2, an updated numerical
implementation of FIRE physics for the GIZMO code. We run a suite of
simulations and compare against FIRE-1: overall, FIRE-2 improvements do not
qualitatively change galaxy-scale properties. We pursue an extensive study of
numerics versus physics. Details of the star-formation algorithm, cooling
physics, and chemistry have weak effects, provided that we include metal-line
cooling and star formation occurs at higher-than-mean densities. We present new
resolution criteria for high-resolution galaxy simulations. Most galaxy-scale
properties are robust to numerics we test, provided: (1) Toomre masses are
resolved; (2) feedback coupling ensures conservation, and (3) individual
supernovae are time-resolved. Stellar masses and profiles are most robust to
resolution, followed by metal abundances and morphologies, followed by
properties of winds and circum-galactic media (CGM). Central (~kpc) mass
concentrations in massive (L*) galaxies are sensitive to numerics (via
trapping/recycling of winds in hot halos). Multiple feedback mechanisms play
key roles: supernovae regulate stellar masses/winds; stellar mass-loss fuels
late star formation; radiative feedback suppresses accretion onto dwarfs and
instantaneous star formation in disks. We provide all initial conditions and
numerical algorithms used.
","[{""version"":""v1"",""created"":""Mon, 20 Feb 2017 19:17:16 GMT""},{""version"":""v2"",""created"":""Sun, 11 Nov 2018 05:04:08 GMT""}]","2018-11-13"
"1702.06149","Alexandra Truebenbach","Alexandra Truebenbach, Jeremy Darling","The Invisible AGN Catalogue: A Mid-Infrared - Radio Selection Method for
  Optically-Faint Active Galactic Nuclei","13 pages, 8 figures",,"10.1093/mnras/stx456",,"astro-ph.GA astro-ph.CO","http://arxiv.org/licenses/nonexclusive-distrib/1.0/","  A large fraction of active galactic nuclei (AGN) are ""invisible"" in extant
optical surveys due to either distance or dust-obscuration. The existence of
this large population of dust-obscured, infrared-bright AGN is predicted by
models of galaxy - supermassive black hole coevolution and is required to
explain the observed X-ray and infrared backgrounds. Recently, infrared
colour-cuts with WISE have identified a portion of this missing population.
However, as the host galaxy brightness relative to that of the AGN increases,
it becomes increasingly difficult to differentiate between infrared emission
originating from the AGN and from its host galaxy. As a solution, we have
developed a new method to select obscured AGN using their 20 cm continuum
emission to identify the objects as AGN. We created the resulting Invisible AGN
Catalogue by selecting objects that are detected in AllWISE (mid-IR) and FIRST
(20 cm), but are not detected in SDSS (optical) or 2MASS (near-IR), producing a
final catalogue of 46,258 objects. 30 per cent of the objects are selected by
existing selection methods, while the remaining 70 per cent represent a
potential previously-unidentified population of candidate AGN that are missed
by mid-infrared colour cuts. Additionally, by relying on a radio continuum
detection, this technique is efficient at detecting radio-loud AGN at z > 0.29,
regardless of their level of dust obscuration or their host galaxy's relative
brightness.
","[{""version"":""v1"",""created"":""Mon, 20 Feb 2017 19:20:25 GMT""}]","2017-04-12"
"1702.06150","David Callan","David Callan","Bijections for Dyck paths with all peak heights of the same parity","4 pages, includes simpler description of bijections suggested by
  Jordan Tirrell",,,,"math.CO","http://arxiv.org/licenses/nonexclusive-distrib/1.0/","  We show bijectively that Dyck paths with all peaks at odd height are counted
by the Motzkin numbers and Dyck paths with all peaks at even height are counted
by the Riordan numbers.
","[{""version"":""v1"",""created"":""Mon, 20 Feb 2017 19:21:51 GMT""},{""version"":""v2"",""created"":""Sat, 25 Feb 2017 09:20:05 GMT""}]","2017-02-28"
"1702.06151","Tal Yarkoni","Quinten McNamara, Alejandro de la Vega, and Tal Yarkoni","Developing a comprehensive framework for multimodal feature extraction",,,,,"cs.CV cs.IR cs.LG cs.MM","http://arxiv.org/licenses/nonexclusive-distrib/1.0/","  Feature extraction is a critical component of many applied data science
workflows. In recent years, rapid advances in artificial intelligence and
machine learning have led to an explosion of feature extraction tools and
services that allow data scientists to cheaply and effectively annotate their
data along a vast array of dimensions---ranging from detecting faces in images
to analyzing the sentiment expressed in coherent text. Unfortunately, the
proliferation of powerful feature extraction services has been mirrored by a
corresponding expansion in the number of distinct interfaces to feature
extraction services. In a world where nearly every new service has its own API,
documentation, and/or client library, data scientists who need to combine
diverse features obtained from multiple sources are often forced to write and
maintain ever more elaborate feature extraction pipelines. To address this
challenge, we introduce a new open-source framework for comprehensive
multimodal feature extraction. Pliers is an open-source Python package that
supports standardized annotation of diverse data types (video, images, audio,
and text), and is expressly with both ease-of-use and extensibility in mind.
Users can apply a wide range of pre-existing feature extraction tools to their
data in just a few lines of Python code, and can also easily add their own
custom extractors by writing modular classes. A graph-based API enables rapid
development of complex feature extraction pipelines that output results in a
single, standardized format. We describe the package's architecture, detail its
major advantages over previous feature extraction toolboxes, and use a sample
application to a large functional MRI dataset to illustrate how pliers can
significantly reduce the time and effort required to construct sophisticated
feature extraction workflows while increasing code clarity and maintainability.
","[{""version"":""v1"",""created"":""Mon, 20 Feb 2017 19:22:21 GMT""}]","2017-02-22"
"1702.06152","Muddassar Hussain","Muddassar Hussain and Nicolo Michelusi","Throughput Optimal Beam Alignment in Millimeter Wave Networks",,,,,"cs.IT math.IT","http://arxiv.org/licenses/nonexclusive-distrib/1.0/","  Millimeter wave communications rely on narrow-beam transmissions to cope with
the strong signal attenuation at these frequencies, thus demanding precise beam
alignment between transmitter and receiver. The communication overhead incurred
to achieve beam alignment may become a severe impairment in mobile networks.
This paper addresses the problem of optimizing beam alignment acquisition, with
the goal of maximizing throughput. Specifically, the algorithm jointly
determines the portion of time devoted to beam alignment acquisition, as well
as, within this portion of time, the optimal beam search parameters, using the
framework of Markov decision processes. It is proved that a bisection search
algorithm is optimal, and that it outperforms exhaustive and iterative search
algorithms proposed in the literature. The duration of the beam alignment phase
is optimized so as to maximize the overall throughput. The numerical results
show that the throughput, optimized with respect to the duration of the beam
alignment phase, achievable under the exhaustive algorithm is 88.3% lower than
that achievable under the bisection algorithm. Similarly, the throughput
achievable by the iterative search algorithm for a division factor of 4 and 8
is, respectively, 12.8% and 36.4% lower than that achievable by the bisection
algorithm.
","[{""version"":""v1"",""created"":""Mon, 20 Feb 2017 19:34:27 GMT""}]","2017-02-22"
"1702.06155","Martin Scholtz","Norman G\""urlebeck, Martin Scholtz","The Meissner effect for weakly isolated horizons","7 pages, 4 figures","Phys.Rev.D 95 (2017) 064010","10.1103/PhysRevD.95.064010",,"gr-qc","http://arxiv.org/licenses/nonexclusive-distrib/1.0/","  Black holes are important astrophysical objects describing an end state of
stellar evolution, which are observed frequently. There are theoretical
predictions that Kerr black holes with high spins expel magnetic fields.
However, Kerr black holes are pure vacuum solutions, which do not include
accretion disks, and additionally previous investigations are mainly limited to
weak magnetic fields. We prove for the first time in full general relativity
that generic rapidly spinning black holes including those deformed by accretion
disks still expel even strong magnetic fields. Analogously to a similar
property of superconductors, this is called Meissner effect.
","[{""version"":""v1"",""created"":""Mon, 20 Feb 2017 19:48:33 GMT""}]","2017-03-13"
"1702.06156","Chase Dowling","Chase Dowling, Tanner Fiez, Lillian Ratliff, Baosen Zhang","How Much Urban Traffic is Searching for Parking? Simulating Curbside
  Parking as a Network of Finite Capacity Queues","Updated May 11, 2018 (fixed formatting errors)",,,,"cs.CY","http://arxiv.org/licenses/nonexclusive-distrib/1.0/","  With the increasing availability of transaction data collected by digital
parking meters, paid curbside parking can be advantageously modeled as a
network of interdependent queues. In this article we introduce methods for
analyzing a special class of networks of finite capacity queues, where tasks
arrive from an exogenous source, join the queue if there is an available server
or are rejected and move to another queue in search of service according to the
network topology. Such networks can be useful for modeling curbside parking
since queues in the network perform the same function and drivers searching for
an available server are under combinatorial constraints and jockeying is not
instantaneous. Further, we provide a motivating example for such networks of
finite capacity queues in the context of drivers searching for parking in the
neighborhood of Belltown in Seattle, Washington, USA. Lastly, since the
stationary distribution of such networks used to model parking are difficult to
satisfactorily characterize, we also introduce a simulation tool for the
purpose of testing the assumptions made to estimate interesting performance
metrics. Our results suggest that a Markovian relaxation of the problem when
solving for the mean rate metrics is comparable to deterministic service times
reflective of a driver's tendency to park for the maximum allowable time.
","[{""version"":""v1"",""created"":""Mon, 20 Feb 2017 19:56:58 GMT""},{""version"":""v2"",""created"":""Tue, 20 Feb 2018 22:22:19 GMT""},{""version"":""v3"",""created"":""Fri, 11 May 2018 21:05:15 GMT""}]","2018-05-15"
"1702.06159","Changchang Liu","Changchang Liu and Supriyo Chakraborty and Prateek Mittal","DEEProtect: Enabling Inference-based Access Control on Mobile Sensing
  Applications",,,,,"cs.CR","http://arxiv.org/licenses/nonexclusive-distrib/1.0/","  Personal sensory data is used by context-aware mobile applications to provide
utility. However, the same data can also be used by an adversary to make
sensitive inferences about a user thereby violating her privacy.
  We present DEEProtect, a framework that enables a novel form of inference
control, in which mobile apps with access to sensor data are limited (provably)
in their ability to make inferences about user's sensitive data and behavior.
DEEProtect adopts a two-layered privacy strategy. First, it leverages novel
autoencoder techniques to perform data minimization and limits the amount of
information being shared; the learning network is used to derive a compact
representation of sensor data consisting only of features relevant to
authorized utility-providing inferences. Second, DEEProtect obfuscates the
previously learnt features, thereby providing an additional layer of protection
against sensitive inferences. Our framework supports both conventional as well
as a novel relaxed notion of local differential privacy that enhances utility.
Through theoretical analysis and extensive experiments using real-world
datasets, we demonstrate that when compared to existing approaches DEEProtect
provides provable privacy guarantees with up to 8x improvement in utility.
Finally, DEEProtect shares obfuscated but raw sensor data reconstructed from
the perturbed features, thus requiring no changes to the existing app
interfaces.
","[{""version"":""v1"",""created"":""Mon, 20 Feb 2017 20:05:18 GMT""},{""version"":""v2"",""created"":""Thu, 16 Nov 2017 19:26:03 GMT""}]","2017-11-20"
"1702.06160","Zhuo Chen","Zhuo Chen, Adam Frank, Eric G. Blackman, Jason Nordhaus and Jonathan
  Carroll-Nellenback","Mass Transfer and Disc Formation in AGB Binary Systems","14 pages, 31 figures and 4 tables. accepted by MNRAS",,"10.1093/mnras/stx680",,"astro-ph.SR","http://arxiv.org/licenses/nonexclusive-distrib/1.0/","  We investigate mass transfer and the formation of disc in binary systems
using a combination of numerical simulations and theory. We consider six models
distinguished by binary separation, secondary mass and outflow mechanisms. Each
system consists of an asymptotic-giant-branch (AGB) star and an accreting
secondary. The AGB star loses its mass via a wind. In one of our six models,
the AGB star incurs a short period of outburst. In all cases, the secondary
accretes part of the ejected mass and also influences the mass-loss rate of the
AGB star. The ejected mass may remain gravitationally bound to the binary
system and form a circumbinary disk, or contribute to an accretion disk around
the secondary. In other cases, the ejecta will escape the binary system. The
accretion rate on to the secondary changes non-linearly with binary separation.
In our closest binary simulations, our models exemplify the wind Roche lobe
overflow while in our wide binary cases, the mass transfer exhibits Bondi-Hoyle
accretion. The morphologies of the outflows in the binary systems are varied.
The variety may provide clues to how the late AGB phase influences planetary
nebulae shaping. We employ the adaptive-mesh-refinement code ASTROBEAR for our
simulations and include ray-tracing, radiation transfer, cooling and dust
formation. To attain the highest computational efficiency and the most stable
results, all simulations are run in the corotating frame.
","[{""version"":""v1"",""created"":""Mon, 20 Feb 2017 20:05:20 GMT""},{""version"":""v2"",""created"":""Thu, 16 Mar 2017 16:16:28 GMT""},{""version"":""v3"",""created"":""Sun, 26 Mar 2017 16:59:13 GMT""},{""version"":""v4"",""created"":""Thu, 13 Apr 2017 18:54:36 GMT""}]","2017-04-17"
