"1702.06335","Nitinder Mohan","Nitinder Mohan and Jussi Kangasharju","Edge-Fog Cloud: A Distributed Cloud for Internet of Things Computations","Published in IEEE 2nd Conference on Cloudification of Internet of
  Things (CIoT) - 2016, Paris, France",,,,"cs.DC","http://arxiv.org/licenses/nonexclusive-distrib/1.0/","  Internet of Things typically involves a significant number of smart sensors
sensing information from the environment and sharing it to a cloud service for
processing. Various architectural abstractions, such as Fog and Edge computing,
have been proposed to localize some of the processing near the sensors and away
from the central cloud servers. In this paper, we propose Edge-Fog Cloud which
distributes task processing on the participating cloud resources in the
network. We develop the Least Processing Cost First (LPCF) method for assigning
the processing tasks to nodes which provide the optimal processing time and
near optimal networking costs. We evaluate LPCF in a variety of scenarios and
demonstrate its effectiveness in finding the processing task assignments.
","[{""version"":""v1"",""created"":""Tue, 21 Feb 2017 11:32:34 GMT""},{""version"":""v2"",""created"":""Tue, 7 Mar 2017 10:39:51 GMT""}]","2017-03-08"
"1702.06336","Miroslav Vodol\'an","Miroslav Vodol\'an, Rudolf Kadlec, Jan Kleindienst","Hybrid Dialog State Tracker with ASR Features","Accepted to EACL 2017",,,,"cs.CL","http://arxiv.org/licenses/nonexclusive-distrib/1.0/","  This paper presents a hybrid dialog state tracker enhanced by trainable
Spoken Language Understanding (SLU) for slot-filling dialog systems. Our
architecture is inspired by previously proposed neural-network-based
belief-tracking systems. In addition, we extended some parts of our modular
architecture with differentiable rules to allow end-to-end training. We
hypothesize that these rules allow our tracker to generalize better than pure
machine-learning based systems. For evaluation, we used the Dialog State
Tracking Challenge (DSTC) 2 dataset - a popular belief tracking testbed with
dialogs from restaurant information system. To our knowledge, our hybrid
tracker sets a new state-of-the-art result in three out of four categories
within the DSTC2.
","[{""version"":""v1"",""created"":""Tue, 21 Feb 2017 11:34:14 GMT""}]","2017-02-22"
"1702.06337","Branislav Nikolic","Branislav Nikolic","Treating the Einstein-Hilbert action as a higher derivative Lagrangian:
  revealing the missing information about conformal non-invariance","8 pages, Contribution to the DICE2016 Proceedings",,"10.1088/1742-6596/880/1/012027",,"gr-qc","http://arxiv.org/licenses/nonexclusive-distrib/1.0/","  The Hamiltonian formulation of conformally invariant Weyl-squared higher
derivative theory teaches us that conformal symmetry is expressed through
particular first class constraints related to the absence of the three-metric
determinant and the trace of the extrinsic curvature from the theory. Any term
depending on them which is added to this theory breaks conformal invariance and
turns these constraints into second class ones. Such second class constraints
are missing in the standard canonical formulation of the conformally
non-invariant Einstein-Hilbert theory. It is demonstrated that such constraints
do appear if the theory is treated as a higher derivative one --- if the
extrinsic curvature is promoted to an independent variable, the apparently
missing information about conformal behavior is revealed.
","[{""version"":""v1"",""created"":""Tue, 21 Feb 2017 11:35:40 GMT""}]","2017-09-13"
"1702.06338","Alexander Kirillov","K. M. Belotsky, A. A. Kirillov, N. O. Nazarova, S. G. Rubin","Reionization effect enhancement due to primordial black holes","6 pages, 6 figures. Accepted for publication in International Journal
  of Modern Physics D","International Journal of Modern Physics D 26 (2017) 1750102","10.1142/S0218271817501024",,"astro-ph.CO","http://arxiv.org/licenses/nonexclusive-distrib/1.0/","  Primordial black holes (PBH) could account for variety of phenomena like dark
matter, reionization of the Universe, early quasars, coalescence of black holes
registered through gravitational waves recently. Each phenomenon relates to PBH
of a specific mass range. PBH mass spectra varies in a wide range depending on
specific model. Earlier we have shown that PBH with monochromatic mass
distribution around $5\times 10^{16}$ g value allow to re-ionize the Universe
moderately. Here we show that reionization effect and contribution to dark
matter can be simultaneously enhanced with more natural extended mass
distribution in the range around the same mass value.
","[{""version"":""v1"",""created"":""Tue, 21 Feb 2017 11:38:11 GMT""}]","2017-04-12"
"1702.06339","Laia Amor\'os","Laia Amor\'os","Images of Galois representations in mod $p$ Hecke algebras",,,,,"math.NT","http://arxiv.org/licenses/nonexclusive-distrib/1.0/","  Let $(\mathbb{T}_f,\mathfrak{m}_f)$ denote the mod $p$ local Hecke algebra
attached to a normalised Hecke eigenform $f$, which is a commutative algebra
over some finite field $\mathbb{F}_q$ of characteristic $p$ and with residue
field $\mathbb{F}_q$. By a result of Carayol we know that, if the residual
Galois representation
$\overline{\rho}_f:G_\mathbb{Q}\rightarrow\mathrm{GL}_2(\mathbb{F}_q)$ is
absolutely irreducible, then one can attach to this algebra a Galois
representation $\rho_f:G_\mathbb{Q}\rightarrow\mathrm{GL}_2(\mathbb{T}_f)$ that
is a lift of $\overline{\rho}_f$. We will show how one can determine the image
of $\rho_f$ under the assumptions that $(i)$ the image of the residual
representation contains $\mathrm{SL}_2(\mathbb{F}_q)$, $(ii)$ that
$\mathfrak{m}_f^2=0$ and $(iii)$ that the coefficient ring is generated by the
traces. As an application we will see that the methods that we use allow us to
deduce the existence of certain $p$-elementary abelian extensions of big
non-solvable number fields.
","[{""version"":""v1"",""created"":""Tue, 21 Feb 2017 11:38:20 GMT""},{""version"":""v2"",""created"":""Tue, 30 Jul 2019 13:03:06 GMT""},{""version"":""v3"",""created"":""Mon, 5 Oct 2020 13:43:15 GMT""}]","2020-10-06"
"1702.06340","Alexander Barabash S.","A.S. Barabash","Brief review of double beta decay experiments","6 pages, talk at The 2nd International Conference on Particle Physics
  and Astrophysics, 10-14 October 2016, Moscow, Russia",,,,"nucl-ex","http://arxiv.org/licenses/nonexclusive-distrib/1.0/","  Best present experimental achievements in double beta decay are presented.
Possible progress in this field in the near and far future is discussed.
","[{""version"":""v1"",""created"":""Tue, 21 Feb 2017 11:50:50 GMT""}]","2017-02-22"
"1702.06341","Gergely Neu","Gergely Neu and Vicen\c{c} G\'omez","Fast rates for online learning in Linearly Solvable Markov Decision
  Processes",,,,,"cs.LG math.OC stat.ML","http://arxiv.org/licenses/nonexclusive-distrib/1.0/","  We study the problem of online learning in a class of Markov decision
processes known as linearly solvable MDPs. In the stationary version of this
problem, a learner interacts with its environment by directly controlling the
state transitions, attempting to balance a fixed state-dependent cost and a
certain smooth cost penalizing extreme control inputs. In the current paper, we
consider an online setting where the state costs may change arbitrarily between
consecutive rounds, and the learner only observes the costs at the end of each
respective round. We are interested in constructing algorithms for the learner
that guarantee small regret against the best stationary control policy chosen
in full knowledge of the cost sequence. Our main result is showing that the
smoothness of the control cost enables the simple algorithm of following the
leader to achieve a regret of order $\log^2 T$ after $T$ rounds, vastly
improving on the best known regret bound of order $T^{3/4}$ for this setting.
","[{""version"":""v1"",""created"":""Tue, 21 Feb 2017 11:56:33 GMT""},{""version"":""v2"",""created"":""Tue, 6 Jun 2017 11:01:30 GMT""}]","2017-06-07"
"1702.06342","Peter Csermely","Peter Csermely","Network support of talented people",,"Gifted Child Quarterly 61 (3): 194-201, 2017","10.1177/0016986217701832",,"physics.soc-ph cs.CY cs.SI nlin.AO q-bio.NC","http://arxiv.org/licenses/nonexclusive-distrib/1.0/","  Network support is a key success factor for talented people. As an example,
the Hungarian Talent Support Network involves close to 1500 Talent Points and
more than 200,000 people. This network started the Hungarian Templeton Program
identifying and helping 315 exceptional cognitive talents. This network is a
part of the European Talent Support Network initiated by the European Council
for High Ability involving more than 300 organizations in over 30 countries in
Europe and extending in other continents. These networks are giving good
examples that talented people often occupy a central, but highly dynamic
position in social networks. The involvement of such 'creative nodes' in
network-related decision making processes is vital, especially in novel
environmental challenges. Such adaptive/learning responses characterize a large
variety of complex systems from proteins, through brains to society. It is
crucial for talent support programs to use these networking and learning
processes to increase their efficiency further.
","[{""version"":""v1"",""created"":""Tue, 21 Feb 2017 11:57:31 GMT""},{""version"":""v2"",""created"":""Sat, 15 Apr 2017 10:24:05 GMT""}]","2017-07-11"
"1702.06343","Satoshi Egi","Satoshi Egi","Scalar and Tensor Parameters for Importing Tensor Index Notation
  including Einstein Summation Notation","Scheme and Functional Programming Workshop 2017",,,,"cs.PL cs.MS","http://arxiv.org/licenses/nonexclusive-distrib/1.0/","  In this paper, we propose a method for importing tensor index notation,
including Einstein summation notation, into functional programming. This method
involves introducing two types of parameters, i.e, scalar and tensor
parameters, and simplified tensor index rules that do not handle expressions
that are valid only for the Cartesian coordinate system, in which the index can
move up and down freely. An example of such an expression is ""c = A_i B_i"". As
an ordinary function, when a tensor parameter obtains a tensor as an argument,
the function treats the tensor argument as a whole. In contrast, when a scalar
parameter obtains a tensor as an argument, the function is applied to each
component of the tensor. In this paper, we show that introducing these two
types of parameters and our simplified index rules enables us to apply
arbitrary user-defined functions to tensor arguments using index notation
including Einstein summation notation without requiring an additional
description to enable each function to handle tensors.
","[{""version"":""v1"",""created"":""Tue, 21 Feb 2017 12:05:59 GMT""},{""version"":""v2"",""created"":""Wed, 22 Feb 2017 12:03:34 GMT""},{""version"":""v3"",""created"":""Thu, 30 Mar 2017 09:26:02 GMT""},{""version"":""v4"",""created"":""Tue, 9 May 2017 01:30:28 GMT""},{""version"":""v5"",""created"":""Mon, 24 Jul 2017 07:34:39 GMT""},{""version"":""v6"",""created"":""Tue, 8 Aug 2017 00:35:19 GMT""}]","2018-08-31"
"1702.06344","Hirley Alves","Onel L. Alcaraz L\'opez, Hirley Alves, Richard Demo Souza and Evelio
  Mart\'in Garc\'ia Fern\'andez","Ultra-Reliable Short-Packet Communications with Wireless Energy Transfer","In press - IEEE SPL",,,,"cs.IT math.IT","http://arxiv.org/licenses/nonexclusive-distrib/1.0/","  We analyze and optimize a wireless system with energy transfer in the
downlink and information transfer in the uplink, under quasi-static Nakagami-m
fading. We consider ultra-reliable communication scenarios representative of
the fifth-generation of wireless systems, with strict error and latency
requirements. The error probability and delay are investigated, and an
approximation for the former is given and validated through simulations. The
numerical results demonstrate that there are optimum numbers of channels uses
for both energy and information transfer for a given message length.
","[{""version"":""v1"",""created"":""Tue, 21 Feb 2017 12:07:41 GMT""}]","2017-02-22"
"1702.06345","Matheus Lazo Lazo","A. G. O. Goulart, M. J. Lazo, J. M. S. Suarez, D. M. Moreira","Fractional derivative models for atmospheric dispersion of pollutants","accepted for publication in Physica A",,"10.1016/j.physa.2017.02.022",,"physics.ao-ph","http://arxiv.org/licenses/nonexclusive-distrib/1.0/","  In the present work, we investigate the potential of fractional derivatives
to model atmospheric dispersion of pollutants. We propose simple fractional
differential equation models for the steady state spatial distribution of
concentration of a non-reactive pollutant in Planetary Boundary Layer. We solve
these models and we compare the solutions with a real experiment. We found that
the fractional derivative models perform far better than the traditional
Gaussian model and even better than models found in the literature where it is
considered that the diffusion coefficient is a function of the position in
order to deal with the anomalous diffusion.
","[{""version"":""v1"",""created"":""Tue, 21 Feb 2017 12:08:22 GMT""}]","2017-02-22"
"1702.06346","Andrew Goodwin","Peter M. M. Thygesen, Callum A. Young, Edward O. R. Beake, Fabio Denis
  Romero, Leigh D. Connor, Thomas E. Proffen, Anthony E. Phillips, Matthew G.
  Tucker, Michael A. Hayward, David A. Keen, Andrew L. Goodwin","Local structure study of the orbital order/disorder transition in
  LaMnO$_3$","14 pages, 8 figures, 3 tables","Phys. Rev. B 95, 174107 (2017)","10.1103/PhysRevB.95.174107",,"cond-mat.mtrl-sci","http://arxiv.org/licenses/nonexclusive-distrib/1.0/","  We use a combination of neutron and X-ray total scattering measurements
together with pair distribution function (PDF) analysis to characterise the
variation in local structure across the orbital order--disorder transition in
LaMnO$_3$. Our experimental data are inconsistent with a conventional
order--disorder description of the transition, and reflect instead the
existence of a discontinuous change in local structure between ordered and
disordered states. Within the orbital-ordered regime, the neutron and X-ray
PDFs are best described by a local structure model with the same local orbital
arrangements as those observed in the average (long-range) crystal structure.
We show that a variety of meaningfully-different local orbital arrangement
models can give fits of comparable quality to the experimental PDFs collected
within the disordered regime; nevertheless, our data show a subtle but
consistent preference for the anisotropic Potts model proposed in \emph{Phys
Rev.\ B} {\bf 79}, 174106 (2009). The key implications of this model are
electronic and magnetic isotropy together with the loss of local inversion
symmetry at the Mn site. We conclude with a critical assessment of the
interpretation of PDF measurements when characterising local symmetry breaking
in functional materials.
","[{""version"":""v1"",""created"":""Tue, 21 Feb 2017 12:08:50 GMT""}]","2017-06-07"
"1702.06347","Jinfeng Yi","Jinfeng Yi, Cho-Jui Hsieh, Kush Varshney, Lijun Zhang, Yao Li","Scalable Demand-Aware Recommendation",,,,,"cs.LG","http://arxiv.org/licenses/nonexclusive-distrib/1.0/","  Recommendation for e-commerce with a mix of durable and nondurable goods has
characteristics that distinguish it from the well-studied media recommendation
problem. The demand for items is a combined effect of form utility and time
utility, i.e., a product must both be intrinsically appealing to a consumer and
the time must be right for purchase. In particular for durable goods, time
utility is a function of inter-purchase duration within product category
because consumers are unlikely to purchase two items in the same category in
close temporal succession. Moreover, purchase data, in contrast to ratings
data, is implicit with non-purchases not necessarily indicating dislike.
Together, these issues give rise to the positive-unlabeled demand-aware
recommendation problem that we pose via joint low-rank tensor completion and
product category inter-purchase duration vector estimation. We further relax
this problem and propose a highly scalable alternating minimization approach
with which we can solve problems with millions of users and millions of items
in a single thread. We also show superior prediction accuracies on multiple
real-world data sets.
","[{""version"":""v1"",""created"":""Tue, 21 Feb 2017 12:10:28 GMT""},{""version"":""v2"",""created"":""Tue, 23 May 2017 04:05:35 GMT""},{""version"":""v3"",""created"":""Sun, 26 Nov 2017 10:06:57 GMT""}]","2017-11-28"
"1702.06348","Tajron Juri\'c dr. sc.","Tajron Juri\'c, Timoth\'e Poulain, Jean-Christophe Wallet","Involutive representations of coordinate algebras and quantum spaces","29 pages, several paragraphs added, published in JHEP","JHEP 07 (2017) 116","10.1007/JHEP07(2017)116",,"hep-th math-ph math.MP","http://arxiv.org/licenses/nonexclusive-distrib/1.0/","  We show that $\frak{su}(2)$ Lie algebras of coordinate operators related to
quantum spaces with $\frak{su}(2)$ noncommutativity can be conveniently
represented by $SO(3)$-covariant poly-differential involutive representations.
We show that the quantized plane waves obtained from the quantization map
action on the usual exponential functions are determined by polar decomposition
of operators combined with constraint stemming from the Wigner theorem for
$SU(2)$. Selecting a subfamily of $^*$-representations, we show that the
resulting star-product is equivalent to the Kontsevich product for the Poisson
manifold dual to the finite dimensional Lie algebra $\mathfrak{su}(2)$. We
discuss the results, indicating a way to extend the construction to any
semi-simple non simply connected Lie group and present noncommutative scalar
field theories which are free from perturbative UV/IR mixing.
","[{""version"":""v1"",""created"":""Tue, 21 Feb 2017 12:18:14 GMT""},{""version"":""v2"",""created"":""Fri, 18 Aug 2017 12:37:14 GMT""}]","2017-08-22"
"1702.06349","Franca Manghi","Franca Manghi, Matteo Puviani and Francesco Lenzini","Time evolution of Floquet states in graphene",,,,,"cond-mat.mes-hall","http://arxiv.org/licenses/nonexclusive-distrib/1.0/","  Based on a solution of the Floquet Hamiltonian we have studied the
time-evolution of electronic states in graphene nanoribbons driven out of
equilibrium by time-dependent electromagnetic fields in different regimes of
intensity, polarization and frequency. We show that the time-dependent band
structure contains many unconventional features that are not captured by
considering the Floquet eigenvalues alone. By analyzing the evolution in time
of the state population we have identified regimes for the emergence of
time-dependent edge states responsible of charge oscillations across the
ribbon.
","[{""version"":""v1"",""created"":""Tue, 21 Feb 2017 12:21:39 GMT""}]","2017-02-22"
"1702.06350","Xiao-Dong Zhang Prof.","Dongmei Chen, Zhibing Chen, Xiao-Dong Zhang","Spectral radius of uniform hypergraphs and degree sequences","10 pages",,,,"math.CO","http://arxiv.org/licenses/nonexclusive-distrib/1.0/","  In this paper, we present several upper bounds for the adjacency and signless
Laplacian spectral radii of uniform hypergraphs in terms of degree sequences.
","[{""version"":""v1"",""created"":""Tue, 21 Feb 2017 12:23:00 GMT""}]","2017-02-22"
"1702.06351","Yonghui Zhang","Yonghui Zhang, Zengxia Mei, Shujuan Cui, Huili Liang, Yaoping Liu and
  Xiaolong Du","Flexible Transparent Field-Effect Diodes Fabricated at Low-Temperature
  with All Oxide Materials","12 pages,4 figures, already published in scientific journal-Advanced
  Electronics Material","Adv. Electron. Mater. 2, 1500486 (2016)","10.1002/aelm.201500486",,"cond-mat.mtrl-sci","http://arxiv.org/licenses/nonexclusive-distrib/1.0/","  Flexible fully transparent diodes with high rectification ratio of 5 e 8 are
fabricated with all oxide materials at low temperature. The devices are
optically transparent in visible spectra range and electrically robust while
mechanically bending. Distinguished from other diodes, these diodes utilize
diode-connected thin-film transistor architecture and follow field-effect
principles.
","[{""version"":""v1"",""created"":""Tue, 21 Feb 2017 12:26:21 GMT""}]","2017-02-22"
"1702.06352","Oskar Sultanov","Oskar Sultanov","Capture into parametric autoresonance in the presence of noise","9 pages, 3 figures",,,,"math-ph math.DS math.MP","http://arxiv.org/licenses/nonexclusive-distrib/1.0/","  System of differential equations describing the initial stage of the capture
of oscillatory systems into the parametric autoresonance is considered. Of
special interest are solutions whose amplitude increases without bound with
time. The possibility of capture the system into the autoresonance is related
with the stability of such solutions. We study the stability of autoresonant
solutions with respect to persistent perturbations of white noise type, and we
show that under certain conditions on the intensity of the noise, the capture
into parametric autoresonance is preserved with probability tending to one.
","[{""version"":""v1"",""created"":""Tue, 21 Feb 2017 12:28:13 GMT""}]","2017-02-22"
"1702.06353","Marco Stratmann","D. de Florian, M. Epele, R. J. Hernandez-Pinto, R. Sassot, M.
  Stratmann","Parton-to-Kaon Fragmentation Revisited","14 pages, 10 eps figures. arXiv admin note: substantial text overlap
  with arXiv:1410.6027","Phys. Rev. D 95, 094019 (2017)","10.1103/PhysRevD.95.094019",,"hep-ph","http://arxiv.org/licenses/nonexclusive-distrib/1.0/","  We revisit the global QCD analysis of parton-to-kaon fragmentation functions
at next-to-leading order accuracy using the latest experimental information on
single-inclusive kaon production in electron-positron annihilation,
lepton-nucleon deep-inelastic scattering, and proton-proton collisions. An
excellent description of all data sets is achieved, and the remaining
uncertainties in parton-to-kaon fragmentation functions are estimated and
discussed based on the Hessian method. Extensive comparisons to the results
from our previous global analysis are made.
","[{""version"":""v1"",""created"":""Tue, 21 Feb 2017 12:29:46 GMT""}]","2017-05-31"
"1702.06354","Makoto Yamada","Makoto Yamada, Song Liu, Samuel Kaski","Interpreting Outliers: Localized Logistic Regression for Density Ratio
  Estimation",,,,,"stat.ML cs.LG","http://arxiv.org/licenses/nonexclusive-distrib/1.0/","  We propose an inlier-based outlier detection method capable of both
identifying the outliers and explaining why they are outliers, by identifying
the outlier-specific features. Specifically, we employ an inlier-based outlier
detection criterion, which uses the ratio of inlier and test probability
densities as a measure of plausibility of being an outlier. For estimating the
density ratio function, we propose a localized logistic regression algorithm.
Thanks to the locality of the model, variable selection can be
outlier-specific, and will help interpret why points are outliers in a
high-dimensional space. Through synthetic experiments, we show that the
proposed algorithm can successfully detect the important features for outliers.
Moreover, we show that the proposed algorithm tends to outperform existing
algorithms in benchmark datasets.
","[{""version"":""v1"",""created"":""Tue, 21 Feb 2017 12:37:35 GMT""}]","2017-02-22"
"1702.06355","Kai Kang","Kai Kang, Hongsheng Li, Tong Xiao, Wanli Ouyang, Junjie Yan, Xihui
  Liu, Xiaogang Wang","Object Detection in Videos with Tubelet Proposal Networks","CVPR 2017",,"10.1109/CVPR.2017.101",,"cs.CV","http://creativecommons.org/licenses/by-nc-sa/4.0/","  Object detection in videos has drawn increasing attention recently with the
introduction of the large-scale ImageNet VID dataset. Different from object
detection in static images, temporal information in videos is vital for object
detection. To fully utilize temporal information, state-of-the-art methods are
based on spatiotemporal tubelets, which are essentially sequences of associated
bounding boxes across time. However, the existing methods have major
limitations in generating tubelets in terms of quality and efficiency.
Motion-based methods are able to obtain dense tubelets efficiently, but the
lengths are generally only several frames, which is not optimal for
incorporating long-term temporal information. Appearance-based methods, usually
involving generic object tracking, could generate long tubelets, but are
usually computationally expensive. In this work, we propose a framework for
object detection in videos, which consists of a novel tubelet proposal network
to efficiently generate spatiotemporal proposals, and a Long Short-term Memory
(LSTM) network that incorporates temporal information from tubelet proposals
for achieving high object detection accuracy in videos. Experiments on the
large-scale ImageNet VID dataset demonstrate the effectiveness of the proposed
framework for object detection in videos.
","[{""version"":""v1"",""created"":""Tue, 21 Feb 2017 12:38:11 GMT""},{""version"":""v2"",""created"":""Mon, 10 Apr 2017 08:39:06 GMT""}]","2018-01-10"
