"1702.06242","Shuro Izumi","Shuro Izumi, Masahiro Takeoka, Kentaro Wakui, Mikio Fujiwara, Kazuhiro
  Ema, and Masahide Sasaki","Projective measurement onto arbitrary superposition of coherent state
  bases",,"Sci. Rep. 4, 2999 (2018)","10.1038/s41598-018-21092-8",,"quant-ph","http://arxiv.org/licenses/nonexclusive-distrib/1.0/","  One of the peculiar features in quantum mechanics is that a superposition of
macroscopically distinct states can exits. In optical system, this is
highlighted by a superposition of coherent states (SCS), i.e. a superposition
of classical states. Recently this highly nontrivial quantum state and its
variant have been demonstrated experimentally. Here we demonstrate the
superposition of coherent states in quantum measurement which is also a key
concept in quantum mechanics. More precisely, we propose and implement a
projection measurement onto the arbitrary superposition of the SCS bases in
optical system. The measurement operators are reconstructed experimentally by a
novel quantum detector tomography protocol. Our device is realized by combining
the displacement operation and photon counting, well established technologies,
and thus has implications in various optical quantum information processing
applications.
","[{""version"":""v1"",""created"":""Tue, 21 Feb 2017 02:28:26 GMT""},{""version"":""v2"",""created"":""Thu, 15 Feb 2018 12:08:40 GMT""}]","2018-02-19"
"1702.06243","Oliver Braunling","Oliver Braunling","Torsion homology growth beyond asymptotics",,,,,"math.GT math.NT","http://arxiv.org/licenses/nonexclusive-distrib/1.0/","  We show that (under mild assumptions) the generating function of log homology
torsion of a knot exterior has a meromorphic continuation to the entire complex
plane. As corollaries, this gives new proofs of (a) the Silver-Williams
asymptotic, (b) Fried's theorem on reconstructing the Alexander polynomial (c)
Gordon's theorem on periodic homology. Our results generalize to other rank 1
growth phenomena, e.g. Reidemeister-Franz torsion growth for higher-dimensional
knots. We also analyze the exceptional cases where the meromorphic continuation
does not exist.
","[{""version"":""v1"",""created"":""Tue, 21 Feb 2017 02:30:20 GMT""}]","2017-02-22"
"1702.06244","Leandro Tavares","Claudianor O. Alves, Abdelkrim Moussaoui, Leandro da S. Tavares","An elliptic system with logarithmic nonlinearity",,,,,"math.AP","http://arxiv.org/licenses/nonexclusive-distrib/1.0/","  In the present paper we study the existence of solutions for some classes of
singular systems involving the p(x) and q(x) Laplacian operators. The approach
is based on bifurcation theory and subsupersolution method for systems of
quasilinear equations involving singular terms.
","[{""version"":""v1"",""created"":""Tue, 21 Feb 2017 02:44:12 GMT""}]","2017-02-22"
"1702.06245","Chong-Xing Yue","Chong-Xing Yue, Lu Ma, Ya-bing Zuo and Yu-chen Guo","Pair production of the Elementary Goldstone Higgs boson at the LHC","15 pages, 5 figures. Published version",,"10.1088/1674-1137/41/10/103102",,"hep-ph","http://arxiv.org/licenses/nonexclusive-distrib/1.0/","  The Elementary Goldstone Higgs (EGH) model is a perturbative extension of the
standard model (SM), which identifies the EGH boson as the observed Higgs
boson. In this paper, we study pair production of the EGH boson via gluon
fusion at the LHC and find that the resonant contribution of the heavy scalar
is very small and the SM-like triangle diagram contribution is strongly
suppressed. The total production cross section mainly comes from the box
diagram contribution and its value can be significantly enhanced with respect
to the SM prediction.
","[{""version"":""v1"",""created"":""Tue, 21 Feb 2017 02:48:56 GMT""},{""version"":""v2"",""created"":""Thu, 13 Apr 2017 23:53:28 GMT""},{""version"":""v3"",""created"":""Sun, 9 Jul 2017 03:15:17 GMT""},{""version"":""v4"",""created"":""Tue, 1 Aug 2017 00:02:40 GMT""}]","2017-10-25"
"1702.06246","Nitish Prajapati","Ayub Khan, Dinesh Khattar, Nitish Prajapati","Predictive Control of Rabinovich System","5 pages, 5 figures","Journal of Nonlinear Systems and Applications, Volume 5, Issue 3
  (2016)",,,"math.DS","http://arxiv.org/licenses/nonexclusive-distrib/1.0/","  The chaos control problem of continuous time Rabinovich chaotic system is
addressed. An instantaneous control input has been designed using predictive
control principle to guarantee the convergence of the chaotic trajectory
towards an unstable equilibrium point. Numerical simulations are presented to
verify all the theoretical analyses. Computational and analytical results are
in excellent agreement.
","[{""version"":""v1"",""created"":""Tue, 21 Feb 2017 02:52:18 GMT""}]","2017-02-22"
"1702.06247","Han Xiao Almighty","Han Xiao, Lian Meng","SAR: Semantic Analysis for Recommendation","Submitting to IJCAI-2018",,,,"cs.IR cs.LG","http://arxiv.org/licenses/nonexclusive-distrib/1.0/","  Recommendation system is a common demand in daily life and matrix completion
is a widely adopted technique for this task. However, most matrix completion
methods lack semantic interpretation and usually result in weak-semantic
recommendations. To this end, this paper proposes a $S$emantic $A$nalysis
approach for $R$ecommendation systems $(SAR)$, which applies a two-level
hierarchical generative process that assigns semantic properties and categories
for user and item. $SAR$ learns semantic representations of users/items merely
from user ratings on items, which offers a new path to recommendation by
semantic matching with the learned representations. Extensive experiments
demonstrate $SAR$ outperforms other state-of-the-art baselines substantially.
","[{""version"":""v1"",""created"":""Tue, 21 Feb 2017 03:09:10 GMT""},{""version"":""v2"",""created"":""Tue, 13 Jun 2017 02:20:47 GMT""},{""version"":""v3"",""created"":""Sat, 2 Dec 2017 11:29:58 GMT""},{""version"":""v4"",""created"":""Sat, 16 Dec 2017 11:18:33 GMT""}]","2017-12-19"
"1702.06248","Bettina Heim","Bettina Heim, Ethan W. Brown, Dave Wecker, Matthias Troyer","Designing Adiabatic Quantum Optimization: A Case Study for the Traveling
  Salesman Problem",,,,,"quant-ph","http://arxiv.org/licenses/nonexclusive-distrib/1.0/","  With progress in quantum technology more sophisticated quantum annealing
devices are becoming available. While they offer new possibilities for solving
optimization problems, their true potential is still an open question. As the
optimal design of adiabatic algorithms plays an important role in their
assessment, we illustrate the aspects and challenges to consider when
implementing optimization problems on quantum annealing hardware based on the
example of the traveling salesman problem (TSP). We demonstrate that tunneling
between local minima can be exponentially suppressed if the quantum dynamics
are not carefully tailored to the problem. Furthermore we show that inequality
constraints, in particular, present a major hurdle for the implementation on
analog quantum annealers. We finally argue that programmable digital quantum
annealers can overcome many of these obstacles and can - once large enough
quantum computers exist - provide an interesting route to using quantum
annealing on a large class of problems.
","[{""version"":""v1"",""created"":""Tue, 21 Feb 2017 03:10:05 GMT""}]","2017-02-22"
"1702.06249","Steven Turnbull","Steven Martin Turnbull, Dion R.J. O'Neale, Fr\'ed\'erique
  Vanholsbeeck, S. Earl Irving, Thomas Lumley","A Leaky Pipe Dream? A Study of Gender Differences in Undergraduate
  Physics",,,,,"physics.ed-ph","http://arxiv.org/licenses/nonexclusive-distrib/1.0/","  Students face diverse pathways as they journey through undergraduate study.
The analysis of student course records can untangle common patterns in course
progression, and identify group trends in student outcomes. The current work
examines the relationship between gender and undergraduate physics study, using
course records from over nine thousand students who enrolled in physics at the
University of Auckland, spanning a six year period.
  Physics students' demographic and course records were analyzed to find out
whether there were gender differences in subject selection, course performance,
and confidence. Subsequent to taking a first year physics course, female
students were more likely to take further courses in life science subjects,
while male students were more likely to take physical science subjects. In
first year courses, gender differences were not present among highly
academically prepared students, for whom school type (single-sex or
coeducational) was a better predictor of course outcome. However, of those
students who were less academically prepared in their first year, male students
tended to outperform female students. Female students were also more likely to
take an introductory physics course before an advancing course, compared to
male students, after controlling for academic preparation. Science capital, a
concept related to Pierre Bourdieu's notions of capital and habitus, was
employed as an interpretive research framework. Habitus, the system of
dispositions one uses to interpret the world, is largely influenced by the
socio-cultural context in which an individual builds their identity. The
following study explains how an interaction between science capital and an
individual's habitus may lead to gender disparities in student outcomes in the
field of physics.
","[{""version"":""v1"",""created"":""Tue, 21 Feb 2017 03:10:50 GMT""},{""version"":""v2"",""created"":""Fri, 17 Mar 2017 00:33:04 GMT""},{""version"":""v3"",""created"":""Mon, 19 Jun 2017 01:24:08 GMT""}]","2017-06-20"
"1702.06250","Chandramouli Kamanchi","K. Chandramouli, K. J. Prabuchandran, D. Sai Koti Reddy, and Shalabh
  Bhatnagar","Generalized Deterministic Perturbations For Stochastic Gradient Search","Accepted in Control and Decision Conference",,,,"cs.SY","http://arxiv.org/licenses/nonexclusive-distrib/1.0/","  Stochastic optimization (SO) considers the problem of optimizing an objective
function in the presence of noise. Most of the solution techniques in SO
estimate gradients from the noise corrupted observations of the objective and
adjust parameters of the objective along the direction of the estimated
gradients to obtain locally optimal solutions. Two prominent algorithms in SO
namely Random Direction Kiefer-Wolfowitz (RDKW) and Simultaneous Perturbation
Stochastic Approximation (SPSA) obtain noisy gradient estimate by randomly
perturbing all the parameters simultaneously. This forces the search direction
to be random in these algorithms and causes them to suffer additional noise on
top of the noise incurred from the samples of the objective. Owing to this
additional noise, the idea of using deterministic perturbations instead of
random perturbations for gradient estimation has also been studied. Two
specific constructions of the deterministic perturbation sequence using
lexicographical ordering and Hadamard matrices have been explored and
encouraging results have been reported in the literature. In this paper, we
characterize the class of deterministic perturbation sequences that can be
utilized in the RDKW algorithm. This class expands the set of known
deterministic perturbation sequences available in the literature. Using our
characterization we propose a construction of a deterministic perturbation
sequence that has the least possible cycle length among all deterministic
perturbations. Through simulations we illustrate the performance gain of the
proposed deterministic perturbation sequence in the RDKW algorithm over the
Hadamard and the random perturbation counterparts. We establish the convergence
of the RDKW algorithm for the generalized class of deterministic perturbations.
","[{""version"":""v1"",""created"":""Tue, 21 Feb 2017 03:12:00 GMT""},{""version"":""v2"",""created"":""Wed, 15 Mar 2017 11:01:31 GMT""},{""version"":""v3"",""created"":""Sun, 15 Jul 2018 06:59:58 GMT""},{""version"":""v4"",""created"":""Sat, 21 Jul 2018 13:17:29 GMT""},{""version"":""v5"",""created"":""Thu, 2 Aug 2018 12:40:53 GMT""}]","2018-08-03"
"1702.06251","Jing Wu","Jing Wu, Kaitlyn Casimo, David J. Caldwell, Rajesh P.N. Rao, Jeffrey
  G. Ojemann","Electrocorticographic Dynamics Predict Visually Guided Motor Imagery of
  Grasp Shaping","4 pages, 6 figures, accepted to IEEE NER 2017 (8th International IEEE
  EMBS Conference on Neural Engineering)",,,,"q-bio.NC cs.HC","http://arxiv.org/licenses/nonexclusive-distrib/1.0/","  Identification of intended movement type and movement phase of hand grasp
shaping are critical features for the control of volitional neuroprosthetics.
We demonstrate that neural dynamics during visually-guided imagined grasp
shaping can encode intended movement. We apply Procrustes analysis and LASSO
regression to achieve 72% accuracy (chance = 25%) in distinguishing between
visually-guided imagined grasp trajectories. Further, we can predict the stage
of grasp shaping in the form of elapsed time from start of trial (R2=0.4). Our
approach contributes to more accurate single-trial decoding of higher-level
movement goals and the phase of grasping movements in individuals not trained
with brain-computer interfaces. We also find that the overall time-varying
trajectory structure of imagined movements tend to be consistent within
individuals, and that transient trajectory deviations within trials return to
the task-dependent trajectory mean. These overall findings may contribute to
the further understanding of the cortical dynamics of human motor imagery.
","[{""version"":""v1"",""created"":""Tue, 21 Feb 2017 03:19:37 GMT""}]","2017-02-22"
"1702.06252","Rebecca Tramel","Rebecca Tramel, Bingyu Xia","Bridgeland stability conditions on surfaces with curves of negative
  self-intersection","33 pages",,,,"math.AG","http://arxiv.org/licenses/nonexclusive-distrib/1.0/","  Let $X$ be a smooth complex projective variety. In 2002, Bridgeland defined a
notion of stability for the objects in $D^b(X)$, the bounded derived category
of coherent sheaves on $X$, which generalized the notion of slope stability for
vector bundles on curves. There are many nice connections between stability
conditions on $X$ and the geometry of the variety.
  We construct new stability conditions for surfaces containing a curve $C$
whose self-intersection is negative. We show that these stability conditions
lie on a wall of the geometric chamber of ${\rm Stab}(X)$, the stability
manifold of $X$. We then construct the moduli space $M_{\sigma}(\mathcal{O}_X)$
of $\sigma$-semistable objects of class $[\mathcal{O}_X]$ in $K_0(X)$ after
wall-crossing.
","[{""version"":""v1"",""created"":""Tue, 21 Feb 2017 03:22:42 GMT""},{""version"":""v2"",""created"":""Mon, 27 Aug 2018 14:47:05 GMT""}]","2018-08-28"
"1702.06253","Zhengxing Chen","Zhengxing Chen, Yizhou Sun, Magy Seif El-nasr, Truong-Huy D. Nguyen","Player Skill Decomposition in Multiplayer Online Battle Arenas","2016 Meaningful Play Conference",,,,"cs.SI cs.AI cs.HC cs.MA","http://arxiv.org/licenses/nonexclusive-distrib/1.0/","  Successful analysis of player skills in video games has important impacts on
the process of enhancing player experience without undermining their continuous
skill development. Moreover, player skill analysis becomes more intriguing in
team-based video games because such form of study can help discover useful
factors in effective team formation. In this paper, we consider the problem of
skill decomposition in MOBA (MultiPlayer Online Battle Arena) games, with the
goal to understand what player skill factors are essential for the outcome of a
game match. To understand the construct of MOBA player skills, we utilize
various skill-based predictive models to decompose player skills into
interpretative parts, the impact of which are assessed in statistical terms. We
apply this analysis approach on two widely known MOBAs, namely League of
Legends (LoL) and Defense of the Ancients 2 (DOTA2). The finding is that base
skills of in-game avatars, base skills of players, and players'
champion-specific skills are three prominent skill components influencing LoL's
match outcomes, while those of DOTA2 are mainly impacted by in-game avatars'
base skills but not much by the other two.
","[{""version"":""v1"",""created"":""Tue, 21 Feb 2017 03:41:49 GMT""}]","2018-06-27"
"1702.06254","Jie Tao","Jie Tao, Wei Zhang, Chao Lu","Global linear convergent algorithm to compute the minimum volume
  enclosing ellipsoid","34 pages, 4 figures, 2 tables",,,,"math.OC","http://arxiv.org/licenses/nonexclusive-distrib/1.0/","  The minimum volume enclosing ellipsoid (MVEE) problem is an optimization
problem in the basis of many practical problems. This paper describes some new
properties of this model and proposes a first-order oracle algorithm, the
Adjusted Coordinate Descent (ACD) algorithm, to address the MVEE problem. The
ACD algorithm is globally linear convergent and has an overwhelming advantage
over the other algorithms in cases where the dimension of the data is large.
Moreover, as a byproduct of the convergence property of the ACD algorithm, we
prove the global linear convergence of the Frank-Wolfe type algorithm
(illustrated by the case of Wolfe-Atwood's algorithm), which supports the
conjecture of Todd. Furthermore, we provide a new interpretation for the means
of choosing the coordinate axis of the Frank-Wolfe type algorithm from the
perspective of the smoothness of the coordinate axis, i.e., the algorithm
chooses the coordinate axis with the worst smoothness at each iteration. This
finding connects the first-order oracle algorithm and the linear optimization
oracle algorithm on the MVEE problem. The numerical tests support our
theoretical results.
","[{""version"":""v1"",""created"":""Tue, 21 Feb 2017 03:46:24 GMT""},{""version"":""v2"",""created"":""Mon, 2 Apr 2018 07:49:23 GMT""}]","2018-04-03"
"1702.06255","Yoji Nakamura","Yoji Nakamura","A mathematical model for gene evolution after whole genome duplication","A total of 12 pages with 2 tables and 4 figures",,,,"q-bio.PE","http://arxiv.org/licenses/nonexclusive-distrib/1.0/","  Whole genome duplication (WGD) is one of the most important events in the
molecular evolution of organisms. In fish species, a WGD is considered to have
occurred in the ancestral lineage of teleosts. Recent comprehensive ortholog
comparisons among teleost genomes have provided useful data and insights into
the fate of redundant genes generated by WGD. Based on these data, a
mathematical model is proposed to explain the evolutionary scenario of genes
after WGD. The model is parameterized taking into account an equilibrium
between i) rapid loss of either of the duplicate genes and ii) moderate
functional differentiation of each of duplicate genes, both of which are
followed by slow gene loss under purifying selection. This model predicts that,
in the teleost lineage, a maximum of about 3000 gene pairs may have
differentiated functionally during 90 million years after WGD. Thus, the
present study provides a possibility that the whole impact of WGD can be
quantitatively assessed according to the model parameters, before details of
genomic structural changes or functional differentiation are investigated. If
the equilibrium model is valid not only for teleosts but also for other
lineages that have undergone WGDs, correlations between the assessment indices
and evolutionarily significant events, such as the diversification of species
or the occurrence of novel phenotypes, could be tested and compared among those
lineages.
","[{""version"":""v1"",""created"":""Tue, 21 Feb 2017 04:02:40 GMT""}]","2017-02-22"
"1702.06256","Guohui Lin","Yao Xu, Yong Chen, Guohui Lin, Tian Liu, Taibo Luo and Peng Zhang","A $(1.4 + \epsilon)$-approximation algorithm for the $2$-Max-Duo problem","14 pages, 10 figures; an extended abstract appears in Proceedings of
  the 28th International Symposium on Algorithms and Computation (ISAAC 2017).
  LIPICS 92, Article No. 66, pp. 66:1--66:12",,,,"cs.DS","http://arxiv.org/licenses/nonexclusive-distrib/1.0/","  The maximum duo-preservation string mapping (Max-Duo) problem is the
complement of the well studied minimum common string partition (MCSP) problem,
both of which have applications in many fields including text compression and
bioinformatics. $k$-Max-Duo is the restricted version of Max-Duo, where every
letter of the alphabet occurs at most $k$ times in each of the strings, which
is readily reduced into the well known maximum independent set (MIS) problem on
a graph of maximum degree $\Delta \le 6(k-1)$. In particular, $2$-Max-Duo can
then be approximated arbitrarily close to $1.8$ using the state-of-the-art
approximation algorithm for the MIS problem. $2$-Max-Duo was proved APX-hard
and very recently a $(1.6 + \epsilon)$-approximation was claimed, for any
$\epsilon > 0$. In this paper, we present a vertex-degree reduction technique,
based on which, we show that $2$-Max-Duo can be approximated arbitrarily close
to $1.4$.
","[{""version"":""v1"",""created"":""Tue, 21 Feb 2017 04:06:15 GMT""},{""version"":""v2"",""created"":""Tue, 5 Sep 2017 22:04:04 GMT""}]","2017-09-07"
"1702.06257","Soravit Changpinyo","Soravit Changpinyo, Mark Sandler, Andrey Zhmoginov","The Power of Sparsity in Convolutional Neural Networks",,,,,"cs.CV","http://arxiv.org/licenses/nonexclusive-distrib/1.0/","  Deep convolutional networks are well-known for their high computational and
memory demands. Given limited resources, how does one design a network that
balances its size, training time, and prediction accuracy? A surprisingly
effective approach to trade accuracy for size and speed is to simply reduce the
number of channels in each convolutional layer by a fixed fraction and retrain
the network. In many cases this leads to significantly smaller networks with
only minimal changes to accuracy. In this paper, we take a step further by
empirically examining a strategy for deactivating connections between filters
in convolutional layers in a way that allows us to harvest savings both in
run-time and memory for many network architectures. More specifically, we
generalize 2D convolution to use a channel-wise sparse connection structure and
show that this leads to significantly better results than the baseline approach
for large networks including VGG and Inception V3.
","[{""version"":""v1"",""created"":""Tue, 21 Feb 2017 04:10:31 GMT""}]","2017-02-22"
"1702.06258","Anjan Barman","Sucheta Mondal, Samiran Choudhury, Neha Jha, Arnab Ganguly, Jaivardhan
  Sinha and Anjan Barman","All-optical Detection of Spin Hall Angle in W/CoFeB/SiO2
  Heterostructures by Varying Tungsten Layer Thickness","5 figures","Phys. Rev. B 96, 054414 (2017)","10.1103/PhysRevB.96.054414",,"cond-mat.mtrl-sci","http://arxiv.org/licenses/nonexclusive-distrib/1.0/","  The development of advanced spintronics devices hinges on the efficient
generation and utilization of pure spin current. In materials with large
spin-orbit coupling, the spin Hall effect may convert charge current to pure
spin current and a large conversion efficiency, which is quantified by spin
Hall angle (SHA), is desirable for the realization of miniaturized and energy
efficient spintronic devices. Here, we report a giant SHA in beta-tungsten
(\b{eta}-W) thin films in Sub/W(t)/Co20Fe60B20(3 nm)/SiO2(2 nm)
heterostructures with variable W thickness. We employed an all-optical
time-resolved magneto-optical Kerr effect microscope for an unambiguous
determination of SHA using the principle of modulation of Gilbert damping of
the adjacent ferromagnetic layer by the spin-orbit torque from the W layer. A
non-monotonic variation of SHA with W layer thickness (t) is observed with a
maximum of about 0.4 at about t = 3 nm, followed by a sudden reduction to a
very low value at t = 6 nm. This variation of SHA with W-thickness correlates
well with the thickness dependent structural phase transition and resistivity
variation of W above the spin diffusion length of W, while below this length
the interfacial electronic effect at W/CoFeB influences the estimation of SHA.
","[{""version"":""v1"",""created"":""Tue, 21 Feb 2017 04:27:31 GMT""}]","2017-08-16"
