"1702.06763","Ji Gao","Ji Gao, Beilun Wang, Zeming Lin, Weilin Xu, Yanjun Qi","DeepCloak: Masking Deep Neural Network Models for Robustness Against
  Adversarial Samples","adversarial samples, deep neural network",,,,"cs.LG cs.AI cs.CR","http://arxiv.org/licenses/nonexclusive-distrib/1.0/","  Recent studies have shown that deep neural networks (DNN) are vulnerable to
adversarial samples: maliciously-perturbed samples crafted to yield incorrect
model outputs. Such attacks can severely undermine DNN systems, particularly in
security-sensitive settings. It was observed that an adversary could easily
generate adversarial samples by making a small perturbation on irrelevant
feature dimensions that are unnecessary for the current classification task. To
overcome this problem, we introduce a defensive mechanism called DeepCloak. By
identifying and removing unnecessary features in a DNN model, DeepCloak limits
the capacity an attacker can use generating adversarial samples and therefore
increase the robustness against such inputs. Comparing with other defensive
approaches, DeepCloak is easy to implement and computationally efficient.
Experimental results show that DeepCloak can increase the performance of
state-of-the-art DNN models against adversarial samples.
","[{""version"":""v1"",""created"":""Wed, 22 Feb 2017 11:48:35 GMT""},{""version"":""v2"",""created"":""Wed, 1 Mar 2017 05:55:00 GMT""},{""version"":""v3"",""created"":""Thu, 2 Mar 2017 16:42:12 GMT""},{""version"":""v4"",""created"":""Wed, 8 Mar 2017 17:18:19 GMT""},{""version"":""v5"",""created"":""Fri, 10 Mar 2017 00:02:04 GMT""},{""version"":""v6"",""created"":""Tue, 21 Mar 2017 16:26:33 GMT""},{""version"":""v7"",""created"":""Sat, 25 Mar 2017 22:16:05 GMT""},{""version"":""v8"",""created"":""Mon, 17 Apr 2017 21:54:30 GMT""}]","2017-04-28"
"1702.06764","Pepe Vila","Pepe Vila and Boris K\""opf","Loophole: Timing Attacks on Shared Event Loops in Chrome","Original publication in the Proceedings of the 26th Annual USENIX
  Security Symposium (USENIX Security 2017).
  https://www.usenix.org/conference/usenixsecurity17/technical-sessions/presentation/vila",,,,"cs.CR","http://arxiv.org/licenses/nonexclusive-distrib/1.0/","  Event-driven programming (EDP) is the prevalent paradigm for graphical user
interfaces, web clients, and it is rapidly gaining importance for server-side
and network programming. Central components of EDP are {\em event loops}, which
act as FIFO queues that are used by processes to store and dispatch messages
received from other processes.
  In this paper we demonstrate that shared event loops are vulnerable to
side-channel attacks, where a spy process monitors the loop usage pattern of
other processes by enqueueing events and measuring the time it takes for them
to be dispatched. Specifically, we exhibit attacks against the two central
event loops in Google's Chrome web browser: that of the I/O thread of the host
process, which multiplexes all network events and user actions, and that of the
main thread of the renderer processes, which handles rendering and Javascript
tasks.
  For each of these loops, we show how the usage pattern can be monitored with
high resolution and low overhead, and how this can be abused for malicious
purposes, such as web page identification, user behavior detection, and covert
communication.
","[{""version"":""v1"",""created"":""Wed, 22 Feb 2017 11:55:01 GMT""},{""version"":""v2"",""created"":""Wed, 28 Jun 2017 15:10:50 GMT""}]","2017-06-29"
"1702.06765","Pepijn Moerman","Pepijn G. Moerman, Henrique W. Moyses, Ernest B. van der Wee, David G.
  Grier, Alfons van Blaaderen, Willem K. Kegel, Jan Groenewold and Jasna Brujic","Phoretic Interactions Between Active Droplets","5 pages, 4 figures","Phys. Rev. E 96, 032607 (2017)","10.1103/PhysRevE.96.032607",,"cond-mat.soft","http://arxiv.org/licenses/nonexclusive-distrib/1.0/","  Concentration gradients play a critical role in embryogenesis, bacterial
locomotion, as well as the motility of active particles. Particles develop
concentration profiles around them by dissolution, adsorption, or the
reactivity of surface species. These gradients change the surface energy of the
particles, driving both their self-propulsion and governing their interactions.
Here we uncover a regime in which solute-gradients mediate interactions between
slowly dissolving droplets without causing autophoresis. This decoupling allows
us to directly measure the steady-state, repulsive force, which scales with
interparticle distance as $F\sim {1/r^{2}}$. Our results show that the process
is diffusion rather than reaction rate limited, and the theoretical model
captures the dependence of the interactions on droplet size and solute
concentration, using a single fit parameter, $l=16\pm 3$~nm, which corresponds
to the lengthscale of a swollen micelle. Our results shed light on the
out-of-equilibrium behavior of particles with surface reactivity.
","[{""version"":""v1"",""created"":""Wed, 22 Feb 2017 11:57:32 GMT""}]","2017-09-20"
"1702.06766","Shao-Jiang Wang","Rong-Gen Cai, Misao Sasaki, Shao-Jiang Wang","Action growth of charged black holes with a single horizon","v1, 19 pages, 1 figure, v2, 23 pages, 1 figure, final version to
  match the published version","Phys. Rev. D 95, 124002 (2017)","10.1103/PhysRevD.95.124002","YITP-17-13","gr-qc hep-th","http://arxiv.org/licenses/nonexclusive-distrib/1.0/","  According to the conjecture ""complexity equals action,"" the complexity of a
holographic state is equal to the action of a Wheeler-DeWitt (WDW) patch of
black holes in anti-de Sitter space. In this paper we calculate the action
growth of charged black holes with a single horizon, paying attention to the
contribution from a spacelike singularity inside the horizon. We consider two
kinds of such charged black holes: one is a charged dilaton black hole, and the
other is a Born-Infeld black hole with $\beta^2 Q^2<1/4$. In both cases,
although an electric charge appears in the black hole solutions, the inner
horizon is absent, instead a spacelike singularity appears inside the horizon.
We find that the action growth of the WDW patch of the charged black hole is
finite and satisfies the Lloyd bound. As a check, we also calculate the action
growth of a charged black hole with a phantom Maxwell field. In this case,
although the contributions from the bulk integral and the spacelike singularity
are individually divergent, these two divergences just cancel each other and a
finite action growth is obtained. But in this case, the Lloyd bound is violated
as expected.
","[{""version"":""v1"",""created"":""Wed, 22 Feb 2017 12:06:20 GMT""},{""version"":""v2"",""created"":""Sun, 4 Jun 2017 14:31:30 GMT""}]","2017-06-07"
"1702.06767","Jiasong Wu","Jiasong Wu, Shijie Qiu, Youyong Kong, Yang Chen, Lotfi Senhadji,
  Huazhong Shu","MomentsNet: a simple learning-free method for binary image recognition","5 pages, 4 figures, 2 tables",,,,"cs.CV","http://arxiv.org/licenses/nonexclusive-distrib/1.0/","  In this paper, we propose a new simple and learning-free deep learning
network named MomentsNet, whose convolution layer, nonlinear processing layer
and pooling layer are constructed by Moments kernels, binary hashing and
block-wise histogram, respectively. Twelve typical moments (including
geometrical moment, Zernike moment, Tchebichef moment, etc.) are used to
construct the MomentsNet whose recognition performance for binary image is
studied. The results reveal that MomentsNet has better recognition performance
than its corresponding moments in almost all cases and ZernikeNet achieves the
best recognition performance among MomentsNet constructed by twelve moments.
ZernikeNet also shows better recognition performance on binary image database
than that of PCANet, which is a learning-based deep learning network.
","[{""version"":""v1"",""created"":""Wed, 22 Feb 2017 12:08:09 GMT""}]","2017-02-23"
"1702.06768","Weishan Zhu","Weishan Zhu, Long-Long Feng","Evolution of mass and velocity filed in comic web: comparison between
  baryonic and dark matter","28pages, 24 figures, accepted for publication in The Astrophysical
  Journal","ApJ, 2017, 838, 21","10.3847/1538-4357/aa61f9",,"astro-ph.CO","http://arxiv.org/licenses/nonexclusive-distrib/1.0/","  We investigate the evolution of cosmic web since $z=5$ in grid based
cosmological hydrodynamical simulations, focusing on the mass and velocity
field of both baryonic and cold dark matter. The tidal tensor of density is
used as the main method for web identification, with $\lambda_{th}=0.2-1.2$.
The evolution trends in baryonic and dark matter are similar, while moderate
differences are observed. Sheets appeared early and their large scale pattern
may have been set up by $z=3$. In term of mass, filaments superseded sheets as
the primary collapsing structures at $z\sim2-3$. Tenuous filaments assembled
with each other to form prominent ones at $z<~2$. In accordance with the
construction of the frame of sheets, the cosmic divergence velocity, $v_{div}$,
had been well developed above 2-3 Mpc by z=3. Afterwards, curl velocity,
$v_{curl}$, grown dramatically along with the rising of filaments, become
comparable to $v_{div}$, for $<2-3 Mpc$ at $z=0$. The scaling of $v_{curl}$ can
be described by the hierarchical turbulence model. The alignment between
vorticity and eigenvectors of shear tensor in baryonic matter field resembles
dark matter, and is even moderately stronger between $\vec{\omega}$ and
$\vec{e}_1$, and $\vec{e}_3$. Compared with dark matter, mildly less baryonic
matter is found residing in filaments and clusters, and its vorticity has been
developed more significantly below $2-3 Mpc$. These differences may be
underestimated due to the limited resolution and lack of star formation in our
simulation. The impact of the change of dominant structures in over-dense
regions at $z\sim2-3$ on galaxy formation and evolution is shortly discussed.
","[{""version"":""v1"",""created"":""Wed, 22 Feb 2017 12:11:44 GMT""}]","2017-09-05"
"1702.06769","Christian Rubio-Montiel PhD","Gabriela Araujo-Pardo, Gy\""orgy Kiss, Christian Rubio-Montiel and
  Adri\'an V\'azquez-\'Avila","On line colorings of finite projective spaces","20 pages, 1 figure","Graphs and Combinatorics-2021","10.1007/s00373-021-02288-8",,"math.CO","http://arxiv.org/licenses/nonexclusive-distrib/1.0/","  In this paper, we prove lower and upper bounds on the achromatic and the
pseudoachromatic indices of the $n$-dimensional finite projective space of
order $q$.
","[{""version"":""v1"",""created"":""Wed, 22 Feb 2017 12:14:13 GMT""},{""version"":""v2"",""created"":""Mon, 28 May 2018 21:21:39 GMT""},{""version"":""v3"",""created"":""Thu, 28 Jan 2021 14:16:17 GMT""}]","2022-01-21"
"1702.06770","Luciano Pandolfi","Luciano Pandolfi","Identification of a space varying coefficient of a linear viscoelastic
  string of Maxwell-Boltzman type",,,,,"math.OC cs.SY","http://arxiv.org/licenses/nonexclusive-distrib/1.0/","  In this paper we solve the problem of the identification of a coefficient
which appears in the model of a distributed system with persistent memory
encountered in linear viscoelasticity (and in diffusion processes with memory).
The additional data used in the identification are subsumed in the input output
map from the deformation to the traction on the boundary. We extend a dynamical
approach to identification introduced by Belishev in the case of purely elastic
(memoryless) bodies and based on a special equation due to Blagoveshchenskii.
So, in particular, we extend Blagoveshchenskii equation to our class of systems
with persistent memory.
","[{""version"":""v1"",""created"":""Wed, 22 Feb 2017 12:18:55 GMT""}]","2017-02-23"
"1702.06771","Soumen Roy","Soumen Roy, Anand S. Sengupta, Nilay Thakor","Hybrid geometric-random template placement algorithm for gravitational
  wave searches from compact binary coalescences","Typo error is fixed in the expression of $\theta_{3s}$ in equation
  (7)","Phys. Rev. D 95, 104045 (2017)","10.1103/PhysRevD.95.104045","LIGO-P1700021","gr-qc","http://arxiv.org/licenses/nonexclusive-distrib/1.0/","  Astrophysical compact binary systems consisting of neutron stars and
blackholes are an important class of gravitational wave (GW) sources for
advanced LIGO detectors. Accurate theoretical waveform models from the
inspiral, merger and ringdown phases of such systems, are used to filter
detector data under the template based matched filtering paradigm. An efficient
grid over the parameter space at a fixed minimal match has a direct impact on
the overall time taken by these searches. We present a new hybrid
geometric-random template placement algorithm for signals described by two
masses and one spin magnitude parameters. Such template banks could potentially
be used in GW searches from binary neutron stars and neutron star-blackhole
systems. The template placement is robust and is able to automatically
accommodate curvature and boundary effects with no fine tuning. We also compare
these banks against vanilla-stochastic template banks and show that while both
are equally efficient in the fitting-factor sense, the bank sizes are $\sim 25
\%$ larger in the stochastic method. Further, we show that the generation of
the proposed hybrid banks can be sped-up by nearly an order of magnitude over
the stochastic bank. Generic issues related to optimal implementation are
discussed in detail. These improvements are expected to directly reduce the
computational cost of gravitational wave searches.
","[{""version"":""v1"",""created"":""Wed, 22 Feb 2017 12:22:07 GMT""},{""version"":""v2"",""created"":""Mon, 5 Jun 2017 19:20:33 GMT""},{""version"":""v3"",""created"":""Sun, 12 Nov 2017 10:29:49 GMT""}]","2017-11-15"
"1702.06772","Peruru Subrahmanya Swamy","Peruru Subrahmanya Swamy, Venkata Pavan Kumar Bellam, Radha Krishna
  Ganti and Krishna Jagannathan","Efficient CSMA using Regional Free Energy Approximations","Submitted to IEEE Transactions on Mobile Computing",,,,"cs.NI cs.IT math.IT","http://arxiv.org/licenses/nonexclusive-distrib/1.0/","  CSMA (Carrier Sense Multiple Access) algorithms based on Gibbs sampling can
achieve throughput optimality if certain parameters called the fugacities are
appropriately chosen. However, the problem of computing these fugacities is
NP-hard. In this work, we derive estimates of the fugacities by using a
framework called the regional free energy approximations. In particular, we
derive explicit expressions for approximate fugacities corresponding to any
feasible service rate vector. We further prove that our approximate fugacities
are exact for the class of chordal graphs. A distinguishing feature of our work
is that the regional approximations that we propose are tailored to conflict
graphs with small cycles, which is a typical characteristic of wireless
networks. Numerical results indicate that the fugacities obtained by the
proposed method are quite accurate and significantly outperform the existing
Bethe approximation based techniques.
","[{""version"":""v1"",""created"":""Wed, 22 Feb 2017 12:26:46 GMT""}]","2017-02-23"
"1702.06773","Jeremie Bec","J\'er\'emie Bec, Fran\c{c}ois Laenen, Stefano Musacchio","Dusty turbulence","4 pages, 3 figures",,,,"physics.flu-dyn","http://arxiv.org/licenses/nonexclusive-distrib/1.0/","  The feedback forces exerted by particles suspended in a turbulent flow is
shown to lead to a new scaling law for velocity fluctuations associated to a
power-spectra $\propto k^{-2}$. The mechanism at play relies on a direct
transfer of kinetic energy to small scales through Kelvin--Helmholtz
instabilities occurring in regions of high particle density contrast. This
finding is confirmed by two-dimensional direct numerical simulations.
","[{""version"":""v1"",""created"":""Wed, 22 Feb 2017 12:28:26 GMT""}]","2017-02-23"
"1702.06774","Manjunath Bhat","Manjunath Bhat and Antony Prakash Monteiro and K. B. Vijaya Kumar","Properties of bottomonium in a relativistic quark model","10 pages. arXiv admin note: text overlap with arXiv:1608.05782",,,,"hep-ph","http://creativecommons.org/licenses/by/4.0/","  The mass spectrum of $b\bar{b}$ states has been obtained using the
phenomenological relativistic quark model (RQM). The Hamiltonian used in the
investigation has confinement potential and confined one gluon exchange
potential (COGEP). In the frame work of RQM a study of M1 and E1 radiative
decays of $b\bar{b}$ states have been made. The weak decay widths in the
spectator quark approximation have been estimated. An overall agreement is
obtained with the experimental masses and decay widths.
","[{""version"":""v1"",""created"":""Wed, 22 Feb 2017 12:34:14 GMT""},{""version"":""v2"",""created"":""Wed, 19 Apr 2017 05:38:38 GMT""}]","2017-04-20"
"1702.06775","Mark Andrea de Cataldo","Mark Andrea de Cataldo","Decomposition theorem for semi-simples",,"Journal of Singularities Volume 14 (2016), 194-197",,,"math.AG","http://arxiv.org/licenses/nonexclusive-distrib/1.0/","  We use standard constructions in algebraic geometry and homological algebra
to extend the decomposition and hard Lefschetz theorems of T. Mochizuki and C.
Sabbah so that they remains valid without the quasi-projectivity assumptions.
","[{""version"":""v1"",""created"":""Wed, 22 Feb 2017 12:34:37 GMT""}]","2017-02-23"
"1702.06776","Kailash Budhathoki","Kailash Budhathoki and Jilles Vreeken","Causal Inference by Stochastic Complexity",,,,,"cs.LG cs.AI","http://arxiv.org/licenses/nonexclusive-distrib/1.0/","  The algorithmic Markov condition states that the most likely causal direction
between two random variables X and Y can be identified as that direction with
the lowest Kolmogorov complexity. Due to the halting problem, however, this
notion is not computable.
  We hence propose to do causal inference by stochastic complexity. That is, we
propose to approximate Kolmogorov complexity via the Minimum Description Length
(MDL) principle, using a score that is mini-max optimal with regard to the
model class under consideration. This means that even in an adversarial
setting, such as when the true distribution is not in this class, we still
obtain the optimal encoding for the data relative to the class.
  We instantiate this framework, which we call CISC, for pairs of univariate
discrete variables, using the class of multinomial distributions. Experiments
show that CISC is highly accurate on synthetic, benchmark, as well as
real-world data, outperforming the state of the art by a margin, and scales
extremely well with regard to sample and domain sizes.
","[{""version"":""v1"",""created"":""Wed, 22 Feb 2017 12:36:21 GMT""}]","2017-02-23"
"1702.06777","David Sanchez","Gonzalo Donoso, David Sanchez","Dialectometric analysis of language variation in Twitter","10 pages, 7 figures, 1 table. Accepted to VarDial 2017","Proceedings of the Fourth Workshop on NLP for Similar Languages,
  Varieties and Dialects (VarDial), pp. 16-25, 2017","10.18653/v1/W17-1202",,"cs.CL cs.IR cs.SI physics.soc-ph","http://arxiv.org/licenses/nonexclusive-distrib/1.0/","  In the last few years, microblogging platforms such as Twitter have given
rise to a deluge of textual data that can be used for the analysis of informal
communication between millions of individuals. In this work, we propose an
information-theoretic approach to geographic language variation using a corpus
based on Twitter. We test our models with tens of concepts and their associated
keywords detected in Spanish tweets geolocated in Spain. We employ
dialectometric measures (cosine similarity and Jensen-Shannon divergence) to
quantify the linguistic distance on the lexical level between cells created in
a uniform grid over the map. This can be done for a single concept or in the
general case taking into account an average of the considered variants. The
latter permits an analysis of the dialects that naturally emerge from the data.
Interestingly, our results reveal the existence of two dialect macrovarieties.
The first group includes a region-specific speech spoken in small towns and
rural areas whereas the second cluster encompasses cities that tend to use a
more uniform variety. Since the results obtained with the two different metrics
qualitatively agree, our work suggests that social media corpora can be
efficiently used for dialectometric analyses.
","[{""version"":""v1"",""created"":""Wed, 22 Feb 2017 12:42:06 GMT""}]","2021-11-17"
"1702.06778","Ladislav \v{S}amaj","Ladislav \v{S}amaj","Finite-Size Effects in Non-Neutral Two-Dimensional Coulomb Fluids","14 pages","J. Stat. Phys. 168 (2017) 434-446","10.1007/s10955-017-1808-9",,"cond-mat.stat-mech","http://arxiv.org/licenses/nonexclusive-distrib/1.0/","  Thermodynamic potential of a neutral two-dimensional (2D) Cou\-lomb fluid,
confined to a large domain with a smooth boundary, exhibits at any (inverse)
temperature $\beta$ a logarithmic finite-size correction term whose universal
prefactor depends only on the Euler number of the domain and the conformal
anomaly number $c=-1$. A minimal free boson conformal field theory, which is
equivalent to the 2D symmetric two-component plasma of elementary $\pm e$
charges at coupling constant $\Gamma=\beta e^2$, was studied in the past. It
was shown that creating a non-neutrality by spreading out a charge $Q e$ at
infinity modifies the anomaly number to $c(Q,\Gamma) = - 1 + 3\Gamma Q^2$.
Here, we study the effect of non-neutrality on the finite-size expansion of the
free energy for another Coulomb fluid, namely the 2D one-component plasma
(jellium) composed of identical pointlike $e$-charges in a homogeneous
background surface charge density. For the disk geometry of the confining
domain we find that the non-neutrality induces the same change of the anomaly
number in the finite-size expansion. We derive this result first at the
free-fermion coupling $\Gamma\equiv\beta e^2=2$ and then, by using a mapping of
the 2D one-component plasma onto an anticommuting field theory formulated on a
chain, for an arbitrary coupling constant.
","[{""version"":""v1"",""created"":""Wed, 22 Feb 2017 12:47:30 GMT""}]","2017-10-12"
"1702.06779","Giovanni La Mura","Giovanni La Mura, Giovanni Busetto, Stefano Ciroi, Piero Rafanelli,
  Marco Berton, Enrico Congiu, Valentina Cracco, Michele Frezzato","Relativistic plasmas in AGN jets - From synchrotron radiation to
  $\gamma$-ray emission","11 pages, 5 figures (3 in color), proceedings of the XXVIII School on
  Physics of Ionized Gases (SPIG), accepted for publication on the European
  Journal of Physics D",,"10.1140/epjd/e2017-70745-2",,"astro-ph.HE","http://arxiv.org/licenses/nonexclusive-distrib/1.0/","  Relativistic jets of plasma are a key ingredient of many types of Active
Galactic Nuclei (AGN). Today we know that AGNs are powered by the accretion of
inter stellar material into the gravitational field of a Super Massive Black
Hole and that this process can release as much power as a whole galaxy, like
the Milky Way, from a region that is comparable to the Solar System in size.
Depending on the properties of the central energy source, a large fraction of
this power can be involved in the acceleration of magnetized plasmas at
relativistic speeds, to form large scale jets. The presence of jets affects the
spectrum of AGNs through the emission of synchrotron radiation and Inverse
Compton scattering of low energy photons, thus leading to a prominent
non-thermal spectrum, some times extending from radio frequencies all the way
up to $\gamma$-ray energies. Here we review some characteristic processes of
radiation emission in AGN jets, which lead to the emission of photons in the
radio, optical, X-ray and $\gamma$-ray bands, and we present the results of a
spectroscopic campaign of optical counterparts. We discuss our observations and
their connection with $\gamma$-ray properties in a scenario that traces the
role of relativistic jets in different classes of AGNs, detected both in the
local as well as in the remote Universe.
","[{""version"":""v1"",""created"":""Wed, 22 Feb 2017 12:49:45 GMT""}]","2017-05-24"
"1702.06780","Jung-Chun Kao","Kuo-Yi Chen, Jung-Chun Kao, Si-An Ciou, and Shih-Han Lin","Joint Spectrum Reuse and Power Control for Multi-Sharing
  Device-to-Device Communication",,,,,"cs.NI","http://arxiv.org/licenses/nonexclusive-distrib/1.0/","  Compared to current mobile networks, next-generation mobile networks are
expected to support higher numbers of simultaneously connected devices and to
achieve higher system spectrum efficiency and lower power consumption. To
achieve these goals, we study the multi-sharing device-to-device (D2D)
communication, which allows any cellular user equipment to share its radio
resource with multiple D2D devices. We jointly consider resource block reuse
and power control and then develop the MISS algorithm. Simulation results show
that MISS performs very well in terms of transmission power consumption, system
throughput, and the number of permitted D2D devices.
","[{""version"":""v1"",""created"":""Wed, 22 Feb 2017 12:50:13 GMT""}]","2017-02-23"
