"1702.06554","Jason Gross","Kyle D. Wesson, Jason N. Gross, Todd E. Humphreys, Brian L. Evans","GNSS Signal Authentication via Power and Distortion Monitoring",,"IEEE Transactions on Aerospace and Electronic Systems, vol. 54,
  no. 2, Apr. 2018, pp. 739-754","10.1109/TAES.2017.2765258",,"cs.CR","http://arxiv.org/licenses/nonexclusive-distrib/1.0/","  We propose a simple low-cost technique that enables civil Global Positioning
System (GPS) receivers and other civil global navigation satellite system
(GNSS) receivers to reliably detect carry-off spoofing and jamming. The
technique, which we call the Power-Distortion detector, classifies received
signals as interference-free, multipath-afflicted, spoofed, or jammed according
to observations of received power and correlation function distortion. It does
not depend on external hardware or a network connection and can be readily
implemented on many receivers via a firmware update. Crucially, the detector
can with high probability distinguish low-power spoofing from ordinary
multipath. In testing against over 25 high-quality empirical data sets yielding
over 900,000 separate detection tests, the detector correctly alarms on all
malicious spoofing or jamming attacks while maintaining a <0.6% single-channel
false alarm rate.
","[{""version"":""v1"",""created"":""Tue, 21 Feb 2017 19:18:46 GMT""},{""version"":""v2"",""created"":""Tue, 18 Jul 2017 18:04:01 GMT""},{""version"":""v3"",""created"":""Tue, 17 Oct 2017 12:51:05 GMT""},{""version"":""v4"",""created"":""Fri, 27 Mar 2020 03:39:43 GMT""}]","2020-03-30"
"1702.06555","Kazimierz Borkowski","K. J. Borkowski, P. Gwynne, S. P. Reynolds, D. A. Green, U. Hwang, R.
  Petre, R. Willett","Asymmetric Expansion of the Youngest Galactic Supernova Remnant G1.9+0.3","7 pages, 4 figures, 1 regular table, 1 DbF table for Figure 3, ApJ
  Letters in press",,"10.3847/2041-8213/aa618c",,"astro-ph.HE","http://arxiv.org/licenses/nonexclusive-distrib/1.0/","  The youngest Galactic supernova remnant (SNR) G1.9+0.3, produced by a
(probable) SN Ia that exploded $\sim 1900$ CE, is strongly asymmetric at radio
wavelengths, much brighter in the north, but bilaterally symmetric in X-rays.
We present the results of X-ray expansion measurements that illuminate the
origin of the radio asymmetry. We confirm the mean expansion rate (2011 to
2015) of 0.58% per year, but large spatial variations are present. Using the
nonparametric ""Demons"" method, we measure the velocity field throughout the
entire SNR, finding that motions vary by a factor of 5, from 0.09"" to 0.44"" per
year. The slowest shocks are at the outer boundary of the bright northern radio
rim, with velocities $v_s$ as low as 3,600 km/s (for an assumed distance of 8.5
kpc), much less than $v_s = 12,000 - 13,000$ km/s along the X-ray-bright major
axis. Such strong deceleration of the northern blast wave most likely arises
from the collision of SN ejecta with a much denser than average ambient medium
there. This asymmetric ambient medium naturally explains the radio asymmetry.
In several locations, significant morphological changes and strongly nonradial
motions are apparent. The spatially-integrated X-ray flux continues to increase
with time. Based on Chandra observations spanning 8.3 years, we measure its
increase at 1.3% +/- 0.8% per year. The SN ejecta are likely colliding with the
asymmetric circumstellar medium ejected by the SN progenitor prior to its
explosion.
","[{""version"":""v1"",""created"":""Tue, 21 Feb 2017 19:19:32 GMT""}]","2017-03-08"
"1702.06556","Sam Sanders","Dag Normann and Sam Sanders","Computability Theory, Nonstandard Analysis, and their connections","43 pages, 1 figure, to appear in Journal of Symbolic Logic","J. symb. log. 84 (2019) 1422-1465","10.1017/jsl.2019.69",,"math.LO","http://arxiv.org/licenses/nonexclusive-distrib/1.0/","  We investigate the connections between computability theory and Nonstandard
Analysis. In particular, we investigate the two following topics and show that
they are intimately related.
  (T.1) A basic property of Cantor space $2^{\mathbb{N}}$ is Heine-Borel
compactness: For any open cover of $2^{\mathbb{N}}$, there is a finite
sub-cover. A natural question is: How hard is it to compute such a finite
sub-cover? We make this precise by analyzing the complexity of functionals that
given any $g:2^{\mathbb{N}}\rightarrow \mathbb{N}$, output a finite sequence
$\langle f_0 , \dots, f_n\rangle $ in $2^{\mathbb{N}}$ such that the
neighbourhoods defined from $\bar{f_i}g(f_i)$ for $i\leq n$ form a cover of
Cantor space.
  (T.2) A basic property of Cantor space in Nonstandard Analysis is Abraham
Robinson's nonstandard compactness, i.e. that every binary sequence is
`infinitely close' to a standard binary sequence. We analyze the strength of
this nonstandard compactness property of Cantor space, compared to the other
axioms of Nonstandard Analysis and usual mathematics.
  The study of (T.1) gives rise to exotic objects in computability theory,
while (T.2) leads to surprising results in Reverse Mathematics. We stress that
(T.1) and (T.2) are highly intertwined and that our study of these topics is
`holistic' in nature: results in computability theory give rise to results in
Nonstandard Analysis and vice versa.
","[{""version"":""v1"",""created"":""Tue, 21 Feb 2017 19:21:01 GMT""},{""version"":""v2"",""created"":""Thu, 4 May 2017 08:32:27 GMT""},{""version"":""v3"",""created"":""Thu, 19 Sep 2019 02:22:38 GMT""}]","2020-02-19"
"1702.06557","Ding Zhao","Ding Zhao, Wenshuo Wang, David J. LeBlanc","Evaluation of A Semi-Autonomous Lane Departure Correction System Using
  Naturalistic Driving Data","arXiv admin note: text overlap with arXiv:1702.05779",,,,"cs.SY","http://arxiv.org/licenses/nonexclusive-distrib/1.0/","  Evaluating the effectiveness and benefits of driver assistance systems is
essential for improving the system performance. In this paper, we propose an
efficient evaluation method for a semi-autonomous lane departure correction
system. To achieve this, we apply a bounded Gaussian mixture model to describe
drivers' stochastic lane departure behavior learned from naturalistic driving
data, which can regenerate departure behaviors to evaluate the lane departure
correction system. In the stochastic lane departure model, we conduct a
dimension reduction to reduce the computation cost. Finally, to show the
advantages of our proposed evaluation approach, we compare steering systems
with and without lane departure assistance based on the stochastic lane
departure model. The simulation results show that the proposed method can
effectively evaluate the lane departure correction system.
","[{""version"":""v1"",""created"":""Tue, 21 Feb 2017 19:23:47 GMT""}]","2017-02-23"
"1702.06558","Ignazio Scimemi","Daniel Gutierrez-Reyes, Ignazio Scimemi, Alexey A. Vladimirov","Twist-2 matching of transverse momentum dependent distributions","7 pages; In v2 we correct a sign typo. Conclusions are unchanged",,"10.1016/j.physletb.2017.03.031",,"hep-ph hep-ex nucl-ex nucl-th","http://arxiv.org/licenses/nonexclusive-distrib/1.0/","  We systematically study the large-$q_T$ (or small-$b$) matching of transverse
momentum dependent (TMD) distributions to the twist-2 integrated parton
distributions. Performing operator product expansion for a generic TMD operator
at the next-to-leading order (NLO) we found the complete set of TMD
distributions that match twist-2. These are unpolarized, helicity,
transversity, pretzelosity and linearly polarized gluon distributions. The NLO
matching coefficients for these distributions are presented. The pretzelosity
matching coefficient is zero at the presented order, however, it is evident
that it is non-zero in the following orders. This result offers a natural
explanation of the small value of pretzelosity found in phenomenological fits.
We also demonstrate that the cancellation of rapidity divergences by the
leading order soft factor imposes the necessary requirement on the Lorentz
structure of TMD operators, which is supported only by the TMD distributions of
leading dynamical twist. Additionally, this requirement puts restrictions on
the $\gamma_5$-definition in the dimensional regularization.
","[{""version"":""v1"",""created"":""Tue, 21 Feb 2017 19:26:05 GMT""},{""version"":""v2"",""created"":""Mon, 14 Aug 2017 11:51:25 GMT""}]","2017-08-15"
"1702.06559","Mark Woodward","Mark Woodward and Chelsea Finn","Active One-shot Learning","NIPS 2016, Deep Reinforcement Learning Workshop, Barcelona, Spain.
  See https://cs.stanford.edu/~woodward/ for the poster and a short video
  description of the paper",,,,"cs.LG","http://arxiv.org/licenses/nonexclusive-distrib/1.0/","  Recent advances in one-shot learning have produced models that can learn from
a handful of labeled examples, for passive classification and regression tasks.
This paper combines reinforcement learning with one-shot learning, allowing the
model to decide, during classification, which examples are worth labeling. We
introduce a classification task in which a stream of images are presented and,
on each time step, a decision must be made to either predict a label or pay to
receive the correct label. We present a recurrent neural network based
action-value function, and demonstrate its ability to learn how and when to
request labels. Through the choice of reward function, the model can achieve a
higher prediction accuracy than a similar model on a purely supervised task, or
trade prediction accuracy for fewer label requests.
","[{""version"":""v1"",""created"":""Tue, 21 Feb 2017 19:31:46 GMT""}]","2017-02-23"
"1702.06560","Scott Engle","Scott G. Engle, Edward F. Guinan, Dr. Graham M. Harper, Prof. Manfred
  Cuntz, Dr. Nancy R. Evans, Dr. Hilding Neilson and Dr. Diaa E. Fawzy","The Secret Lives of Cepheids: $\delta$ Cep -- the Prototype of a New
  Class of Pulsating X-ray Variable Stars","16 pages, 3 figures, 2 tables, accepted for publication in the
  Astrophysical Journal","ApJ, 838 (2017), 67","10.3847/1538-4357/aa6159",,"astro-ph.SR","http://arxiv.org/licenses/nonexclusive-distrib/1.0/","  From our Secret Lives of Cepheids program, the prototype Classical Cepheid,
$\delta$ Cep, is found to be an X-ray source with periodic pulsation-modulated
X-ray variations. This finding complements our earlier reported phase-dependent
FUV--UV emissions of the star that increase $\sim$10--20 times with highest
fluxes at $\sim0.90-0.95\phi$, just prior to maximum brightness. Previously,
$\delta$ Cep was found as potentially X-ray variable, using XMM-Newton
observations (Engle et al. 2014). Additional phase-constrained data were
secured with Chandra near X-ray emission peak, to determine if the emission and
variability were pulsation-phase-specific to $\delta$ Cep and not transient or
due to a possible coronally-active, cool companion. The Chandra data were
combined with prior XMM-Newton observations, and very closely match the
previously observed X-ray behavior. From the combined dataset, a
$\sim$4$\times$ increase in X-ray flux is measured, reaching a peak $L_X$ = 1.7
$\times$ 10$^{29}$ erg s$^{-1}$ near 0.45$\phi$. The precise X-ray flux phasing
with the star's pulsation indicates that the emissions arise from the Cepheid
and not a companion. However, it is puzzling that maximum X-ray flux occurs
$\sim$0.5$\phi$ ($\sim$3 days) later than the FUV--UV maximum. There are
several other potential Cepheid X-ray detections with properties similar to
$\delta$ Cep, and comparable X-ray variability is indicated for two other
Cepheids: $\beta$ Dor and V473 Lyr. X-ray generating mechanisms in $\delta$ Cep
and other Cepheids are discussed. If additional Cepheids are confirmed to show
phased X-ray variations, then $\delta$ Cep will be the prototype of new class
of pulsation-induced X-ray variables.
","[{""version"":""v1"",""created"":""Tue, 21 Feb 2017 19:44:20 GMT""}]","2017-03-27"
"1702.06561","Igor Ovchinnikov V.","Igor V. Ovchinnikov and Massimiliano Di Ventra","Chaos or Order?","6 pages","Modern Physics Letters. B 33, 1950287 (2019)","10.1142/S0217984919502877",,"nlin.CD math-ph math.AP math.DS math.MP","http://arxiv.org/licenses/nonexclusive-distrib/1.0/","  What is chaos? Despite several decades of research on this ubiquitous and
fundamental phenomenon there is yet no agreed-upon answer to this question.
Recently, it was realized that all stochastic and deterministic differential
equations, describing all natural and engineered dynamical systems, possess a
topological supersymmetry. It was then suggested that its spontaneous breakdown
could be interpreted as the stochastic generalization of deterministic chaos.
This conclusion stems from the fact that such phenomenon encompasses features
that are traditionally associated with chaotic dynamics such as
non-integrability, positive topological entropy, sensitivity to initial
conditions, and the Poincare-Bendixson theorem. Here, we strengthen and
complete this picture by showing that the hallmarks of set-theoretic chaos --
topological transitivity/mixing and dense periodic orbits -- can also be
attributed to the spontaneous breakdown of topological supersymmetry. We also
demonstrate that these features, which highlight the noisy character of chaotic
dynamics, do not actually admit a stochastic generalization. We therefore
conclude that spontaneous topological symmetry breaking can be considered as
the most general definition of continuous-time dynamical chaos. Contrary to the
common perception and semantics of the word ""chaos"", this phenomenon should
then be truly interpreted as the low-symmetry, or ordered phase of the
dynamical systems that manifest it. Since the long-range order in this case is
temporal, we then suggest the word ""chronotaxis"" as a better representation of
this phenomenon.
","[{""version"":""v1"",""created"":""Tue, 21 Feb 2017 19:47:06 GMT""},{""version"":""v2"",""created"":""Fri, 3 Mar 2017 00:32:50 GMT""}]","2019-09-10"
"1702.06562","Alex Klotz","Riccardo Antonelli, Alexander R. Klotz","Relativistic minimization with constraints: A smooth trip to Alpha
  Centauri","5 Pages, 3 figures. Comment on: Anderson, D., Mats Desaix, and R.
  Nyqvist. ""The least uncomfortable journey from A to B."" American Journal of
  Physics 84.9 (2016): 690-695",,,,"physics.class-ph gr-qc","http://arxiv.org/licenses/nonexclusive-distrib/1.0/","  We consider the relativistic generalization of the problem of the ""least
uncomfortable"" linear trajectory from point A to point B. The traditional
problem minimizes the time-integrated squared acceleration (termed the
""discomfort""), and there is a universal solution for all distances and
durations. This universality fails when the maximum speed of the trajectory
becomes relativistic, and we consider the more general case of minimizing the
squared proper acceleration over a proper time. The least uncomfortable
relativistic trajectory has a rapidity that evolves like the motion of a
particle in a hyperbolic sine potential, agreeing with the classical solution
at low velocities. We consider the special case of a hypothetical trip to Alpha
Centauri, and compare the minimal-discomfort trajectory to one with uniform
Earth-like acceleration.
","[{""version"":""v1"",""created"":""Tue, 21 Feb 2017 19:53:16 GMT""}]","2017-02-23"
"1702.06563","Nuria Fagella","Nuria Fagella and Linda Keen","Stable components in the parameter plane of transcendental functions of
  finite type","41 pages, 13 figures","Journal of Geometric Analysis (2020)","10.1007/s12220-020-00458-3",,"math.DS","http://creativecommons.org/licenses/by/4.0/","  We study the parameter planes of certain one-dimensional, dynamically-defined
slices of holomorphic families of entire and meromorphic transcendental maps of
finite type. Our planes are defined by constraining the orbits of all but one
of the singular values, and leaving free one asymptotic value. We study the
structure of the regions of parameters, which we call {\em shell components},
for which the free asymptotic value tends to an attracting cycle of
non-constant multiplier. The exponential and the tangent families are examples
that have been studied in detail, and the hyperbolic components in those
parameter planes are shell components. Our results apply to slices of both
entire and meromorphic maps. We prove that shell components are simply
connected, have a locally connected boundary and have no center, i.e., no
parameter value for which the cycle is superattracting. Instead, there is a
unique parameter in the boundary, the {\em virtual center}, which plays the
same role. For entire slices, the virtual center is always at infinity, while
for meromorphic ones it maybe finite or infinite. In the dynamical plane we
prove, among other results, that the basins of attraction which contain only
one asymptotic value and no critical points are simply connected. Our dynamical
plane results apply without the restriction of finite type.
","[{""version"":""v1"",""created"":""Tue, 21 Feb 2017 19:54:01 GMT""},{""version"":""v2"",""created"":""Thu, 8 Mar 2018 16:02:00 GMT""},{""version"":""v3"",""created"":""Sun, 25 Nov 2018 16:56:03 GMT""},{""version"":""v4"",""created"":""Mon, 2 Dec 2019 17:19:14 GMT""},{""version"":""v5"",""created"":""Tue, 10 Nov 2020 16:47:59 GMT""}]","2020-11-11"
"1702.06564","Esaias J Janse van Rensburg","AJ Guttmann, EJ Janse van Rensburg, I Jensen and SG Whittington","Polygons pulled from an adsorbing surface",,,"10.1088/1751-8121/aaa3b9",,"cond-mat.stat-mech","http://arxiv.org/licenses/nonexclusive-distrib/1.0/","  We consider self-avoiding lattice polygons, in the hypercubic lattice, as a
model of a ring polymer adsorbed at a surface and either being desorbed by the
action of a force, or pushed towards the surface. We show that, when there is
no interaction with the surface, then the response of the polygon to the
applied force is identical (in the thermodynamic limit) for two ways in which
we apply the force. When the polygon is attracted to the surface then, when the
dimension is at least 3, we have a complete characterization of the critical
force--temperature curve in terms of the behaviour, (a) when there is no force,
and, (b) when there is no surface interaction. For the 2-dimensional case we
have upper and lower bounds on the free energy. We use both Monte Carlo and
exact enumeration and series analysis methods to investigate the form of the
phase diagram in two dimensions. We find evidence for the existence of a
\emph{mixed phase} where the free energy depends on the strength of the
interaction with the adsorbing line and on the applied force.
","[{""version"":""v1"",""created"":""Tue, 21 Feb 2017 19:57:45 GMT""},{""version"":""v2"",""created"":""Fri, 29 Sep 2017 12:59:18 GMT""},{""version"":""v3"",""created"":""Fri, 15 Dec 2017 15:29:58 GMT""}]","2018-02-14"
"1702.06565","Priyanka Rupasinghe","P.M. Rupasinghe, N. B. Vilas, Eli Hoenig, B.-Y. Wang and P.K. Majumder","Measurement of hyperfine splittings and isotope shifts in the $8p$
  excited states of $^{205}$Tl and $^{203}$Tl using two-step laser spectroscopy","arXiv admin note: text overlap with arXiv:1310.7216",,,,"physics.atom-ph","http://arxiv.org/licenses/nonexclusive-distrib/1.0/","  A two-step, two-color laser spectroscopy technique has been used to measure
the hyperfine splittings of the $8p$ excited states in $^{203}$Tl and
$^{205}$Tl, as well as the $7s - 8p$ transition isotope shifts. For the case of
the $8p_{3/2}$ state, our results show a hyperfine anomaly consistent with our
recent measurements of other hyperfine splittings, and in disagreement with
older results for this state. Our measurement of the $8p_{1/2}$ isotope shift
is also in disagreement with earlier work. In this series of experiments, a UV
laser was locked to the first-step transition and directed through a heated
vapor cell, while a second spatially overlapping red laser was scanned across
the two second-step transitions. To facilitate accurate frequency calibration,
radio-frequency modulation of the second-step laser was used to create
sidebands in the Doppler-free absorption spectrum.
","[{""version"":""v1"",""created"":""Tue, 21 Feb 2017 20:02:57 GMT""},{""version"":""v2"",""created"":""Wed, 28 Jun 2017 19:46:50 GMT""}]","2017-07-03"
"1702.06566","Martino Poggio","M. Poggio and B. E. Herzog","Force-detected Nuclear Magnetic Resonance","Review to appear in in the book ""Micro and Nano Scale NMR:
  Technologies and Systems"", ed. Jens Anders and Jan G. Korvink, ISBN
  978-3-527-34056-9, Wiley-VCH, Weinheim, 2017; 31 pages, 22 figures","Micro and Nano Scale NMR: Technologies and Systems, J. Anders and
  J. Korvink, Eds., Wiley (2017), pp. 381-420","10.1002/9783527697281.ch13",,"cond-mat.mes-hall","http://arxiv.org/licenses/nonexclusive-distrib/1.0/","  The drive to improve the sensitivity of nuclear magnetic resonance (NMR) to
smaller and smaller sample volumes has led to the development of a variety of
techniques distinct from conventional inductive detection. In this chapter, we
focus on the technique of force-detected NMR as one of the most successful in
yielding sensitivity improvements. We review the rationale for the technique,
its basic principles, and give a brief history of its most important results.
We then cover in greater detail its application in the first demonstration of
three-dimensional (3D) nuclear magnetic resonance imaging (MRI) with
nanometer-scale resolution. Next we present recent developments and likely
paths for improvement. Finally, the technique and its potential are discussed
in the context of competing and complementary technologies.
","[{""version"":""v1"",""created"":""Tue, 21 Feb 2017 20:07:03 GMT""}]","2021-10-26"
"1702.06570","Denise Duarte Scarpa Magalhaes Alves","Denise Duarte, Sokol Ndreca and Wecsley O. Prates","Inference for Stochastically Contaminated Variable Length Markov Chains",,,,,"stat.ME","http://arxiv.org/licenses/nonexclusive-distrib/1.0/","  In this paper, we present a methodology to estimate the parameters of
stochastically contaminated models under two contamination regimes. In both
regimes, we assume that the original process is a variable length Markov chain
that is contaminated by a random noise. In the first regime we consider that
the random noise is added to the original source and in the second regime, the
random noise is multiplied by the original source. Given a contaminated sample
of these models, the original process is hidden. Then we propose a two steps
estimator for the parameters of these models, that is, the probability
transitions and the noise parameter, and prove its consistency. The first step
is an adaptation of the Baum-Welch algorithm for Hidden Markov Models. This
step provides an estimate of a complete order $k$ Markov chain, where $k$ is
bigger than the order of the variable length Markov chain if it has finite
order and is a constant depending on the sample size if the hidden process has
infinite order. In the second estimation step, we propose a bootstrap Bayesian
Information Criterion, given a sample of the Markov chain estimated in the
first step, to obtain the variable length time dependence structure associated
with the hidden process. We present a simulation study showing that our
methodology is able to accurately recover the parameters of the models for a
reasonable interval of random noises.
","[{""version"":""v1"",""created"":""Tue, 21 Feb 2017 20:23:35 GMT""}]","2017-02-23"
"1702.06571","Ryan Rawl","Ryan Rawl, Minseong Lee, Eun Sang Choi, Guang Li, Kuan-Wen Chen, Ryan
  Baumbach, Clarina R. dela Cruz, Jie Ma, and Haidong Zhou","Magnetic Properties of New Triangular Lattice Magnets
  A${_4}$B'B${_2}$O$_{12}$","10 pages, 10 figures","Phys. Rev. B 95, 174438 (2017)","10.1103/PhysRevB.95.174438",,"cond-mat.mtrl-sci","http://arxiv.org/licenses/nonexclusive-distrib/1.0/","  The geometrically frustrated two dimensional triangular lattice magnets
A${_4}$B'B${_2}$O$_{12}$ (A = Ba, Sr, La; B' = Co, Ni, Mn; B = W, Re) have been
studied by x-ray diffraction, AC and DC susceptibilities, powder neutron
diffraction, and specific heat measurements. The results reveal that (i) the
samples containing Co$^{2+}$ (effective spin-1/2) and Ni$^{2+}$ (spin-1) ions
with small spin numbers exhibit ferromagnetic (FM) ordering while the sample
containing Mn$^{2+}$ (spin-5/2) ions with a large spin number exhibits
antiferromagnetic (AFM) ordering. We ascribe these spin number manipulated
ground states to the competition between the AFM B'-O-O-B' and FM B'-O-B-O-B'
superexchange interactions; (ii) the chemical pressure introduced into the Co
containing samples through the replacement of different size ions on the A site
finely tunes the FM ordering temperature of the system. We attribute this
effect to the modification of the FM interaction strength induced by the change
of the O-B-O angle through chemical pressure.
","[{""version"":""v1"",""created"":""Tue, 21 Feb 2017 20:32:48 GMT""}]","2017-05-31"
