"1702.06669","Yongxiang Xia","Li Rui, Xia Yongxiang, Tse K Chi","Optimal Resource Allocation with Node and Link Capacity Constraints in
  Complex Networks","Accepted by IEEE ISCAS2017",,,,"physics.soc-ph cs.NI","http://arxiv.org/licenses/nonexclusive-distrib/1.0/","  With the tremendous increase of the Internet traffic, achieving the best
performance with limited resources is becoming an extremely urgent problem. In
order to address this concern, in this paper, we build an optimization problem
which aims to maximize the total utility of traffic flows with the capacity
constraint of nodes and links in the network. Based on Duality Theory, we
propose an iterative algorithm which adjusts the rates of traffic flows and
capacity of nodes and links simultaneously to maximize the total utility.
Simulation results show that our algorithm performs better than the NUP
algorithm on BA and ER network models, which has shown to get the best
performance so far. Since our research combines the topology information with
capacity constraint, it may give some insights for resource allocation in real
communication networks.
","[{""version"":""v1"",""created"":""Wed, 22 Feb 2017 04:23:27 GMT""}]","2017-02-23"
"1702.06670","Igor Pikovski","Igor Pikovski, Magdalena Zych, Fabio Costa, \v{C}aslav Brukner","Comment on ""Quantum mechanics for non-inertial observers""","2 pages",,,,"quant-ph gr-qc","http://arxiv.org/licenses/nonexclusive-distrib/1.0/","  In a recent paper (arXiv:1701.04298 [quant-ph]) Toro\v{s}, Gro{\ss}ardt and
Bassi claim that the potential necessary to support a composite particle in a
gravitational field must necessarily cancel the relativistic coupling between
internal and external degrees of freedom. As such a coupling is responsible for
the gravitational redshift measured in numerous experiments, the above
statement is clearly incorrect. We identify the simple mistake in the paper
responsible for the incorrect claim.
","[{""version"":""v1"",""created"":""Wed, 22 Feb 2017 04:28:33 GMT""}]","2017-02-23"
"1702.06671","Juhi-Lian Julian Ting","Julian Juhi-Lian Ting","Non-reciprocal Light-harvesting Nanoantennae Made by Nature","9 pages, 2 figures, 1 table, 100 references cited","Journal of Applied Physics (2019)","10.1063/1.5082606",,"physics.bio-ph cond-mat.mes-hall q-bio.BM quant-ph","http://arxiv.org/licenses/nonexclusive-distrib/1.0/","  Most of our current understanding of mechanisms of photosynthesis comes from
spectroscopy. However, classical definition of radio-antenna can be extended to
optical regime to discuss the function of light-harvesting antennae. Further to
our previously proposed model of a loop antenna we provide several more
physical explanations on considering the non-reciprocal properties of the light
harvesters of bacteria. We explained the function of the non-heme iron at the
reaction center, and presented reasons for each module of the light harvester
being composed of one carotenoid, two short $\alpha$-helical polypeptides and
three bacteriochlorophylls; we explained also the toroidal shape of the light
harvester, the upper bound of the characteristic length of the light harvester,
the functional role played by the long-lasting spectrometric signal observed,
and the photon anti-bunching observed. Based on these analyses, two mechanisms
might be used by radiation-durable bacteria, {\it Deinococcus radiodurans}; and
the non-reciprocity of an archaeon, {\it Haloquadratum walsbyi}, are analyzed.
The physical lessons involved are useful for designing artificial light
harvesters, optical sensors, wireless power chargers, passive super-Planckian
heat radiators, photocatalytic hydrogen generators, and radiation protective
cloaks. In particular it can predict what kind of particles should be used to
separate sunlight into a photovoltaically and thermally useful range to enhance
the efficiency of solar cells.
","[{""version"":""v1"",""created"":""Wed, 22 Feb 2017 04:28:40 GMT""},{""version"":""v2"",""created"":""Mon, 27 Nov 2017 00:09:46 GMT""},{""version"":""v3"",""created"":""Mon, 8 Jan 2018 08:26:59 GMT""},{""version"":""v4"",""created"":""Sun, 24 Mar 2019 08:37:45 GMT""}]","2019-04-09"
"1702.06672","Aida Nematzadeh","Aida Nematzadeh and Barend Beekhuizen and Shanshan Huang and Suzanne
  Stevenson","Calculating Probabilities Simplifies Word Learning",,,,,"cs.CL","http://arxiv.org/licenses/nonexclusive-distrib/1.0/","  Children can use the statistical regularities of their environment to learn
word meanings, a mechanism known as cross-situational learning. We take a
computational approach to investigate how the information present during each
observation in a cross-situational framework can affect the overall acquisition
of word meanings. We do so by formulating various in-the-moment learning
mechanisms that are sensitive to different statistics of the environment, such
as counts and conditional probabilities. Each mechanism introduces a unique
source of competition or mutual exclusivity bias to the model; the mechanism
that maximally uses the model's knowledge of word meanings performs the best.
Moreover, the gap between this mechanism and others is amplified in more
challenging learning scenarios, such as learning from few examples.
","[{""version"":""v1"",""created"":""Wed, 22 Feb 2017 04:30:09 GMT""}]","2017-02-23"
"1702.06673","Rahmtin Rotabi","Rahmtin Rotabi, Krishna Kamath, Jon Kleinberg, Aneesh Sharma","Cascades: A view from Audience",,,"10.1145/3038912.3052647",,"cs.SI","http://arxiv.org/licenses/nonexclusive-distrib/1.0/","  Cascades on online networks have been a popular subject of study in the past
decade, and there is a considerable literature on phenomena such as diffusion
mechanisms, virality, cascade prediction, and peer network effects. However, a
basic question has received comparatively little attention: how desirable are
cascades on a social media platform from the point of view of users? While
versions of this question have been considered from the perspective of the
producers of cascades, any answer to this question must also take into account
the effect of cascades on their audience. In this work, we seek to fill this
gap by providing a consumer perspective of cascade.
  Users on online networks play the dual role of producers and consumers.
First, we perform an empirical study of the interaction of Twitter users with
retweet cascades. We measure how often users observe retweets in their home
timeline, and observe a phenomenon that we term the ""Impressions Paradox"": the
share of impressions for cascades of size k decays much slower than frequency
of cascades of size k. Thus, the audience for cascades can be quite large even
for rare large cascades. We also measure audience engagement with retweet
cascades in comparison to non-retweeted content. Our results show that cascades
often rival or exceed organic content in engagement received per impression.
This result is perhaps surprising in that consumers didn't opt in to see tweets
from these authors. Furthermore, although cascading content is widely popular,
one would expect it to eventually reach parts of the audience that may not be
interested in the content. Motivated by our findings, we posit a theoretical
model that focuses on the effect of cascades on the audience. Our results on
this model highlight the balance between retweeting as a high-quality content
selection mechanism and the role of network users in filtering irrelevant
content.
","[{""version"":""v1"",""created"":""Wed, 22 Feb 2017 04:31:45 GMT""},{""version"":""v2"",""created"":""Thu, 23 Feb 2017 20:56:57 GMT""},{""version"":""v3"",""created"":""Sun, 26 Mar 2017 23:58:55 GMT""}]","2017-03-28"
"1702.06674","Yun Cao","Yun Cao, Zhiming Zhou, Weinan Zhang, Yong Yu","Unsupervised Diverse Colorization via Generative Adversarial Networks",,,,,"cs.CV cs.AI","http://creativecommons.org/licenses/by/4.0/","  Colorization of grayscale images has been a hot topic in computer vision.
Previous research mainly focuses on producing a colored image to match the
original one. However, since many colors share the same gray value, an input
grayscale image could be diversely colored while maintaining its reality. In
this paper, we design a novel solution for unsupervised diverse colorization.
Specifically, we leverage conditional generative adversarial networks to model
the distribution of real-world item colors, in which we develop a fully
convolutional generator with multi-layer noise to enhance diversity, with
multi-layer condition concatenation to maintain reality, and with stride 1 to
keep spatial information. With such a novel network architecture, the model
yields highly competitive performance on the open LSUN bedroom dataset. The
Turing test of 80 humans further indicates our generated color schemes are
highly convincible.
","[{""version"":""v1"",""created"":""Wed, 22 Feb 2017 04:34:31 GMT""},{""version"":""v2"",""created"":""Sat, 1 Jul 2017 10:57:03 GMT""}]","2017-07-04"
"1702.06675","Ekaterina Vylomova","Ekaterina Vylomova, Ryan Cotterell, Timothy Baldwin and Trevor Cohn","Context-Aware Prediction of Derivational Word-forms",,,,,"cs.CL","http://arxiv.org/licenses/nonexclusive-distrib/1.0/","  Derivational morphology is a fundamental and complex characteristic of
language. In this paper we propose the new task of predicting the derivational
form of a given base-form lemma that is appropriate for a given context. We
present an encoder--decoder style neural network to produce a derived form
character-by-character, based on its corresponding character-level
representation of the base form and the context. We demonstrate that our model
is able to generate valid context-sensitive derivations from known base forms,
but is less accurate under a lexicon agnostic setting.
","[{""version"":""v1"",""created"":""Wed, 22 Feb 2017 04:50:23 GMT""}]","2017-02-23"
"1702.06676","Nicholas Guttenberg","Nicholas Guttenberg, Yen Yu, Ryota Kanai","Counterfactual Control for Free from Generative Models","6 pages, 5 figures",,,,"cs.LG stat.ML","http://arxiv.org/licenses/nonexclusive-distrib/1.0/","  We introduce a method by which a generative model learning the joint
distribution between actions and future states can be used to automatically
infer a control scheme for any desired reward function, which may be altered on
the fly without retraining the model. In this method, the problem of action
selection is reduced to one of gradient descent on the latent space of the
generative model, with the model itself providing the means of evaluating
outcomes and finding the gradient, much like how the reward network in Deep
Q-Networks (DQN) provides gradient information for the action generator. Unlike
DQN or Actor-Critic, which are conditional models for a specific reward, using
a generative model of the full joint distribution permits the reward to be
changed on the fly. In addition, the generated futures can be inspected to gain
insight in to what the network 'thinks' will happen, and to what went wrong
when the outcomes deviate from prediction.
","[{""version"":""v1"",""created"":""Wed, 22 Feb 2017 04:50:47 GMT""},{""version"":""v2"",""created"":""Thu, 9 Mar 2017 06:35:45 GMT""}]","2017-03-10"
"1702.06677","George Berry","George Berry and Sean J. Taylor","Discussion quality diffuses in the digital public square","10 pages, 6 figures, 2 tables",,,,"cs.CY cs.CL cs.SI","http://arxiv.org/licenses/nonexclusive-distrib/1.0/","  Studies of online social influence have demonstrated that friends have
important effects on many types of behavior in a wide variety of settings.
However, we know much less about how influence works among relative strangers
in digital public squares, despite important conversations happening in such
spaces. We present the results of a study on large public Facebook pages where
we randomly used two different methods--most recent and social feedback--to
order comments on posts. We find that the social feedback condition results in
higher quality viewed comments and response comments. After measuring the
average quality of comments written by users before the study, we find that
social feedback has a positive effect on response quality for both low and high
quality commenters. We draw on a theoretical framework of social norms to
explain this empirical result. In order to examine the influence mechanism
further, we measure the similarity between comments viewed and written during
the study, finding that similarity increases for the highest quality
contributors under the social feedback condition. This suggests that, in
addition to norms, some individuals may respond with increased relevance to
high-quality comments.
","[{""version"":""v1"",""created"":""Wed, 22 Feb 2017 04:54:43 GMT""}]","2017-02-23"
"1702.06678","Shinya Akagawa","Shinya Akagawa","Vanishing theorems of $L^2$-cohomology groups on Hessian manifolds",,,,,"math.DG","http://arxiv.org/licenses/nonexclusive-distrib/1.0/","  We show vanishing theorems of $L^2$-cohomology groups of Kodaira-Nakano type
on complete Hessian manifolds. We obtain further vanishing theorems of
$L^2$-cohomology groups $L^2H^{p,q}(\Omega)$ on a regular convex cone $\Omega$
with the Cheng-Yau metric for $p>q$.
","[{""version"":""v1"",""created"":""Wed, 22 Feb 2017 04:58:11 GMT""}]","2017-02-23"
"1702.06679","Sunando Patra","Zaineb Calcuttawala, Anirban Kundu, Soumitra Nandi, Sunando Kumar
  Patra","Optimal observable analysis for the decay $b \to s$ plus missing energy","14 pages, 9 captioned figures","Eur. Phys. J. C (2017) 77: 650","10.1140/epjc/s10052-017-5227-5",,"hep-ph hep-ex","http://arxiv.org/licenses/nonexclusive-distrib/1.0/","  The decay $b\to s\nu\bar\nu$ has been a neglected sibling of $b\to
s\ell^+\ell^-$ because neutrinos pass undetected and hence the process offers
less number of observables. We show how the decay $b\to s~+$~invisible(s) can
shed light, even with a limited number of observables, on possible new physics
beyond the Standard Model and also show, quantitatively, the reach of future
$B$ factories like SuperBelle to uncover such new physics. Depending on the
operator structure of new physics, different channels may act as the best
possible probe. We show, using the Optimal Observable technique, how almost the
entire parameter space allowed till now can successfully be probed at a high
luminosity $B$ factory.
","[{""version"":""v1"",""created"":""Wed, 22 Feb 2017 05:11:56 GMT""}]","2017-09-28"
"1702.06680","Teng Zhang","Teng Zhang, Kanzhi Wu, Jingwei Song, Shoudong Huang and Gamini
  Dissanayake","Convergence and Consistency Analysis for A 3D Invariant-EKF SLAM",,"IEEE Robotics and Automation Letters (Volume: 2, Issue: 2, April
  2017)",,,"cs.RO","http://arxiv.org/licenses/nonexclusive-distrib/1.0/","  In this paper, we investigate the convergence and consistency properties of
an Invariant-Extended Kalman Filter (RI-EKF) based Simultaneous Localization
and Mapping (SLAM) algorithm. Basic convergence properties of this algorithm
are proven. These proofs do not require the restrictive assumption that the
Jacobians of the motion and observation models need to be evaluated at the
ground truth. It is also shown that the output of RI-EKF is invariant under any
stochastic rigid body transformation in contrast to $\mathbb{SO}(3)$ based EKF
SLAM algorithm ($\mathbb{SO}(3)$-EKF) that is only invariant under
deterministic rigid body transformation. Implications of these invariance
properties on the consistency of the estimator are also discussed. Monte Carlo
simulation results demonstrate that RI-EKF outperforms $\mathbb{SO}(3)$-EKF,
Robocentric-EKF and the ""First Estimates Jacobian"" EKF, for 3D point feature
based SLAM.
","[{""version"":""v1"",""created"":""Wed, 22 Feb 2017 05:29:35 GMT""}]","2017-02-23"
"1702.06681","Jong-Hak Woo","Jong-Hak Woo, Donghoon Son, and Hyun-Jin Bae","Delayed or no feedback? - Gas outflows in Type 2 AGNs. III","ApJ in press, very minor revision",,"10.3847/1538-4357/aa6894",,"astro-ph.GA","http://arxiv.org/licenses/nonexclusive-distrib/1.0/","  We present gas kinematics based on the [OIII] $\lambda$5007 line and their
connection to galaxy gravitational potential, active galactic nucleus (AGN)
energetics, and star formation, using a large sample of ~110,000 AGNs and
star-forming (SF) galaxies at z<0.3. Gas and stellar velocity dispersions are
comparable to each other in SF galaxies, indicating that the ionized gas
kinematics can be accounted by the gravitational potential of host galaxies. In
contrast, AGNs clearly show non-gravitational kinematics, which is comparable
to or stronger than the virial motion caused by the gravitational potential.
The [OIII] velocity-velocity dispersion (VVD) diagram dramatically expands
toward high values as a function of AGN luminosity, implying that the outflows
are AGN-driven, while SF galaxies do not show such a trend. We find that the
fraction of AGNs with a signature of outflow kinematics, steeply increases with
AGN luminosity and Eddington ratio. In particular, the majority of luminous
AGNs presents strong non-gravitational kinematics in the [OIII] profile. AGNs
with strong outflow signatures show on average similar specific star formation
rate (SSFR) to that of starforming galaxies. In contrast, AGNs with weak or no
outflows have an order of magnitude lower SSFR, suggesting that AGNs with
current strong outflows do now show any negative AGN feedback and that it may
take the order of a dynamical time to impact on star formation over galactic
scales.
","[{""version"":""v1"",""created"":""Wed, 22 Feb 2017 05:29:36 GMT""},{""version"":""v2"",""created"":""Thu, 23 Mar 2017 03:41:59 GMT""}]","2017-05-03"
"1702.06682","Smritijit Sen","Smritijit Sen and Haranath Ghosh","Stoner factors of doped 122 Fe-based superconductors: First principles
  results","Accepted in Computational Material Science","Computational Material Science 2017",,,"cond-mat.mtrl-sci cond-mat.supr-con","http://arxiv.org/licenses/nonexclusive-distrib/1.0/","  A comprehensive study on the evolution of Stoner factor with doping
concentration for various doped 122 systems (like BaFe$_2$As$_2$,
SrFe$_2$As$_2$) of Fe-based superconductors is presented. Our first principles
electronic structure calculations reveal that for Co/Ru (electron or
iso-electronic) doping at Fe sites or P doping at As sites result in a
reduction of Stoner factor with increasing doping concentration. On the
contrary, in case of Na/K (hole) doping at the Ba sites, Stoner factor is
enhanced for higher doping concentrations. This may be considered as an
indicator of elevation of ""magnetic fluctuation"" in these systems. We find that
the Stoner factor uniquely follows the variation of the pnictide height
z$_{As}$/Fe-As bond length with various kinds of doping. Our calculated Fermi
surfaces explicate the diversities in the behaviour of Stoner factors for
various doped 122 systems ; larger degree of Fermi surface nesting, larger the
value of Stoner factor and vice versa.
","[{""version"":""v1"",""created"":""Wed, 22 Feb 2017 06:17:36 GMT""}]","2017-02-23"
"1702.06683","Timnit Gebru","Timnit Gebru, Jonathan Krause, Yilun Wang, Duyun Chen, Jia Deng, Erez
  Lieberman Aiden, Li Fei-Fei","Using Deep Learning and Google Street View to Estimate the Demographic
  Makeup of the US","41 pages including supplementary material. Under review at PNAS",,"10.1073/pnas.1700035114",,"cs.CV","http://arxiv.org/licenses/nonexclusive-distrib/1.0/","  The United States spends more than $1B each year on initiatives such as the
American Community Survey (ACS), a labor-intensive door-to-door study that
measures statistics relating to race, gender, education, occupation,
unemployment, and other demographic factors. Although a comprehensive source of
data, the lag between demographic changes and their appearance in the ACS can
exceed half a decade. As digital imagery becomes ubiquitous and machine vision
techniques improve, automated data analysis may provide a cheaper and faster
alternative. Here, we present a method that determines socioeconomic trends
from 50 million images of street scenes, gathered in 200 American cities by
Google Street View cars. Using deep learning-based computer vision techniques,
we determined the make, model, and year of all motor vehicles encountered in
particular neighborhoods. Data from this census of motor vehicles, which
enumerated 22M automobiles in total (8% of all automobiles in the US), was used
to accurately estimate income, race, education, and voting patterns, with
single-precinct resolution. (The average US precinct contains approximately
1000 people.) The resulting associations are surprisingly simple and powerful.
For instance, if the number of sedans encountered during a 15-minute drive
through a city is higher than the number of pickup trucks, the city is likely
to vote for a Democrat during the next Presidential election (88% chance);
otherwise, it is likely to vote Republican (82%). Our results suggest that
automated systems for monitoring demographic trends may effectively complement
labor-intensive approaches, with the potential to detect trends with fine
spatial resolution, in close to real time.
","[{""version"":""v1"",""created"":""Wed, 22 Feb 2017 06:20:13 GMT""},{""version"":""v2"",""created"":""Thu, 2 Mar 2017 05:11:11 GMT""}]","2022-06-08"
"1702.06684","Amritanshu Prasad","N. Karimilla Bi, Amritanshu Prasad and P. Giftson Santhosh","Residues modulo powers of two in the Young-Fibonacci lattice","9 pages, 3 figures",,,,"math.CO math.NT","http://arxiv.org/licenses/nonexclusive-distrib/1.0/","  We study the subgraph of the Young-Fibonacci graph induced by elements with
odd $f$-statistic (the $f$-statistic of an element $w$ of a differential graded
poset is the number of saturated chains from the minimal element of the poset
to $w$). We show that this subgraph is a binary tree. Moreover, the odd
residues of the $f$-statistics in a row of this tree equidistibute modulo any
power two. This is equivalent to a purely number theoretic result about the
equidistribution of residues modulo powers of two among the products of
distinct odd numbers less than a fixed number.
","[{""version"":""v1"",""created"":""Wed, 22 Feb 2017 06:29:10 GMT""}]","2017-02-23"
"1702.06685","Moh. Adhib Ulil Absor","Moh. Adhib Ulil Absor, Iman Santosa, Harsojo, Kamsul Abraha, Hiroki
  Kotaka, Fumiyuki Ishii, Mineo Saito","Polarity tuning of spin-orbit-induced spin splitting in two-dimensional
  transition metal dichalcogenides semiconductors","5 Figures","Journal of Applied Physics 122, 153905 (2017)","10.1063/1.5008475",,"cond-mat.str-el","http://arxiv.org/licenses/nonexclusive-distrib/1.0/","  The established spin splitting in monolayer (ML) of transition metal
dichalcogenides (TMDs) that is caused by inversion symmetry breaking is
dictated by mirror symmetry operations to exhibit fully out-of-plane direction
of spin polarization. Through first-principles density functional theory
calculations, we show that polarity-induced mirror symmetry breaking leads to
new sizable spin splitting having in-plane spin polarization. These splittings
are effectively controlled by tuning the polarity using biaxial strain.
Furthermore, the admixtures of the out-of-plane and in-plane spin-polarized
states in the strained polar systems are identified, which is expected to
influence the spin relaxation through the Dyakonov-Perel mechanism. Our study
clarified that the polarity-induced mirror symmetry breaking plays an important
role in controlling the spin splitting and spin relaxation in the TMDs ML,
which is useful for designing future spintronic devices.
","[{""version"":""v1"",""created"":""Wed, 22 Feb 2017 06:29:38 GMT""},{""version"":""v2"",""created"":""Sat, 29 Apr 2017 14:34:07 GMT""}]","2017-10-24"
"1702.06686","Arijit Dey","Pabitra Barik, Arijit Dey, BN Suhas","Intersection Poincare polynomial for Nagaraj-Seshadri moduli space",,,,,"math.AG","http://arxiv.org/licenses/nonexclusive-distrib/1.0/","  We compute Betti numbers of both the components of the moduli space of rank 2
semi-stable torsion-free sheaves with fixed determinant over a reducible nodal
curve with two smooth components intersecting at a node. We also compute the
intersection Betti numbers of the moduli space.
","[{""version"":""v1"",""created"":""Wed, 22 Feb 2017 06:44:24 GMT""}]","2017-02-23"
"1702.06687","Kacper Oreszczuk","Kacper Oreszczuk, Mateusz Goryca, Wojciech Pacuski, Tomasz
  Smole\'nski, Micha{\l} Nawrocki, Piotr Kossacki","Origin of luminescence quenching in structures containing CdSe/ZnSe
  quantum dots with a few Mn$^{2+}$ ions",,"Phys. Rev. B 96, 205436 (2017)","10.1103/PhysRevB.96.205436",,"cond-mat.mes-hall","http://arxiv.org/licenses/nonexclusive-distrib/1.0/","  We present a detailed spectroscopic study of the photoluminescence quenching
in an epitaxial structures containing CdSe/ZnSe quantum dots doped with low
concentration of Mn$^{2+}$ ions. Our time-resolved and time-integrated
experiments reveal the origin of the quenching observed in
macro-photoluminescence studies of ensembles of such dots. We show that
incorporation of even a few ions to an individual dot does not quench its
luminescence effectively, although some fingerprints of expected spin-dependent
quenching are visible. At the same time, the presence of Mn$^{2+}$ ions in the
sample significantly affects the luminescence intensity of the wetting layer,
resulting in a quenching of the global luminescence from studied structure. On
the other hand, the luminescence decay dynamics is found to be independent of
the presence of Mn$^{2+}$ ions, which suggests that the observed quenching
occurs for the excited excitonic states.
","[{""version"":""v1"",""created"":""Wed, 22 Feb 2017 06:44:25 GMT""},{""version"":""v2"",""created"":""Thu, 9 Nov 2017 11:44:46 GMT""}]","2017-12-06"
