"1704.00074","Verena K\""afer","Verena K\""afer (Universit\""at Stuttgart, Germany), Daniel Kulesz
  (Institute for Software Technology, University of Stuttgart, Germany), Stefan
  Wagner (University of Stuttgart, Germany)","What Is the Best Way For Developers to Learn New Software Tools? An
  Empirical Comparison Between a Text and a Video Tutorial",,"The Art, Science, and Engineering of Programming, 2017, Vol. 1,
  Issue 2, Article 17","10.22152/programming-journal.org/2017/1/17",,"cs.SE","http://arxiv.org/licenses/nonexclusive-distrib/1.0/","  The better developers can learn software tools, the faster they can start
using them and the more efficiently they can later work with them. Tutorials
are supposed to help here. While in the early days of computing, mostly text
tutorials were available, nowadays software developers can choose among a huge
number of tutorials for almost any popular software tool. However, only little
research was conducted to understand how text tutorials differ from other
tutorials, which tutorial types are preferred and, especially, which tutorial
types yield the best learning experience in terms of efficiency and
effectiveness, especially for programmers. To evaluate these questions, we
converted an existing video tutorial for a novel software tool into a
content-equivalent text tutorial. We then conducted an experiment in three
groups where 42 undergraduate students from a software engineering course were
commissioned to operate the software tool after using a tutorial: the first
group was provided only with the video tutorial, the second group only with the
text tutorial and the third group with both. In this context, the differences
in terms of efficiency were almost negligible: We could observe that
participants using only the text tutorial completed the tutorial faster than
the participants with the video tutorial. However, the participants using only
the video tutorial applied the learned content faster, achieving roughly the
same bottom line performance. We also found that if both tutorial types are
offered, participants prefer video tutorials for learning new content but text
tutorials for looking up ""missed"" information. We mainly gathered our data
through questionnaires and screen recordings and analyzed it with suitable
statistical hypotheses tests. The data is available at [12]. Since producing
tutorials requires effort, knowing with which type of tutorial learnability can
be increased to which extent has an immense practical relevance. We conclude
that in contexts similar to ours, while it would be ideal if software tool
makers would offer both tutorial types, it seems more efficient to produce only
text tutorials instead of a passive video tutorial - provided you manage to
motivate your learners to use them.
","[{""version"":""v1"",""created"":""Fri, 31 Mar 2017 22:24:16 GMT""}]","2017-04-04"
"1704.00075","Jasper van Wezel","Ana Silva, Jans Henke, and Jasper van Wezel","Elemental chalcogens as a minimal model for chiral charge and orbital
  order",,"Phys. Rev. B 97, 045151 (2018)","10.1103/PhysRevB.97.045151",,"cond-mat.str-el cond-mat.mtrl-sci","http://arxiv.org/licenses/nonexclusive-distrib/1.0/","  Helices of increased electron density can spontaneously form in materials
containing multiple, interacting density waves. Although a macroscopic order
parameter theory describing this behaviour has been proposed and experimentally
tested, a detailed microscopic understanding of spiral electronic order in any
particular material is still lacking. Here, we present the elemental chalcogens
Selenium and Tellurium as model materials for the development of chiral charge
and orbital order. We formulate minimal models capturing the formation of
spiral structures both in terms of a macroscopic Landau theory and a
microscopic Hamiltonian. Both reproduce the known chiral crystal structure and
are consistent with its observed thermal evolution and behaviour under applied
pressure. The combination of microscopic and macroscopic frameworks allows us
to distil the essential ingredients in the emergence of helical charge order,
and may serve as a guide to understanding spontaneous chirality both in other
specific materials and throughout materials classes.
","[{""version"":""v1"",""created"":""Fri, 31 Mar 2017 22:27:03 GMT""}]","2018-02-07"
"1704.00076","C\'eline L\'evy-Leduc","M. Perrot-Dock\`es, C. L\'evy-Leduc, J. Chiquet, L. Sansonnet, M.
  Br\'eg\`ere, M.-P. \'Etienne, S. Robin and G. Genta-Jouve","A multivariate variable selection approach for analyzing LC-MS
  metabolomics data",,,,,"stat.AP","http://arxiv.org/licenses/nonexclusive-distrib/1.0/","  Omic data are characterized by the presence of strong dependence structures
that result either from data acquisition or from some underlying biological
processes. In metabolomics, for instance, data resulting from Liquid
Chromatography-Mass Spectrometry (LC-MS) -- a technique which gives access to a
large coverage of metabolites -- exhibit such patterns. These data sets are
typically used to find the metabolites characterizing a phenotype of interest
associated with the samples. However, applying some statistical procedures that
do not adjust the variable selection step to the dependence pattern may result
in a loss of power and the selection of spurious variables. The goal of this
paper is to propose a variable selection procedure in the multivariate linear
model that accounts for the dependence structure of the multiple outputs which
may lead in the LC-MS framework to the selection of more relevant metabolites.
We propose a novel Lasso-based approach in the multivariate framework of the
general linear model taking into account the dependence structure by using
various modelings of the covariance matrix of the residuals. Our numerical
experiments show that including the estimation of the covariance matrix of the
residuals in the Lasso criterion dramatically improves the variable selection
performance. Our approach is also successfully applied to a LC-MS data set made
of African copals samples for which it is able to provide a small list of
metabolites without altering the phenotype discrimination. Our methodology is
implemented in the R package MultiVarSel which is available from the CRAN
(Comprehensive R Archive Network).
","[{""version"":""v1"",""created"":""Fri, 31 Mar 2017 22:29:59 GMT""}]","2017-04-04"
"1704.00077","Hieu Le","Hieu Le, Vu Nguyen, Chen-Ping Yu, Dimitris Samaras","Geodesic Distance Histogram Feature for Video Segmentation",,,"10.1007/978-3-319-54181-5_18",,"cs.CV","http://arxiv.org/licenses/nonexclusive-distrib/1.0/","  This paper proposes a geodesic-distance-based feature that encodes global
information for improved video segmentation algorithms. The feature is a joint
histogram of intensity and geodesic distances, where the geodesic distances are
computed as the shortest paths between superpixels via their boundaries. We
also incorporate adaptive voting weights and spatial pyramid configurations to
include spatial information into the geodesic histogram feature and show that
this further improves results. The feature is generic and can be used as part
of various algorithms. In experiments, we test the geodesic histogram feature
by incorporating it into two existing video segmentation frameworks. This leads
to significantly better performance in 3D video segmentation benchmarks on two
datasets.
","[{""version"":""v1"",""created"":""Fri, 31 Mar 2017 22:39:32 GMT""}]","2017-04-04"
"1704.00078","Lucas Lolli Savi","Lucas Lolli Savi","Reconsidering the horizon problem",,,,,"gr-qc","http://creativecommons.org/licenses/by-nc-sa/4.0/","  It is argued that the spatial homogeneity of the early universe need not be
explained as having evolved from a previous inhomogeneous state. Rather, a
homogeneous cosmic initial condition follows from the Second Law of
Thermodynamics applied to gravitating systems.
","[{""version"":""v1"",""created"":""Fri, 31 Mar 2017 22:42:09 GMT""},{""version"":""v2"",""created"":""Fri, 25 May 2018 21:12:33 GMT""},{""version"":""v3"",""created"":""Tue, 19 Jun 2018 20:55:19 GMT""}]","2018-06-21"
"1704.00079","Kevin Yu","Kevin Yu, Ashish Kumar Budhiraja, and Pratap Tokekar","Algorithms for Routing of Unmanned Aerial Vehicles with Mobile
  Recharging Stations","7 pages, 14 figures, ICRA2018 under review",,,,"cs.RO cs.MA","http://arxiv.org/licenses/nonexclusive-distrib/1.0/","  We study the problem of planning a tour for an energy-limited Unmanned Aerial
Vehicle (UAV) to visit a set of sites in the least amount of time. We envision
scenarios where the UAV can be recharged along the way either by landing on
stationary recharging stations or on Unmanned Ground Vehicles (UGVs) acting as
mobile recharging stations. This leads to a new variant of the Traveling
Salesperson Problem (TSP) with mobile recharging stations. We present an
algorithm that finds not only the order in which to visit the sites but also
when and where to land on the charging stations to recharge. Our algorithm
plans tours for the UGVs as well as determines best locations to place
stationary charging stations. While the problems we study are NP-Hard, we
present a practical solution using Generalized TSP that finds the optimal
solution. If the UGVs are slower, the algorithm also finds the minimum number
of UGVs required to support the UAV mission such that the UAV is not required
to wait for the UGV. Our simulation results show that the running time is
acceptable for reasonably sized instances in practice.
","[{""version"":""v1"",""created"":""Fri, 31 Mar 2017 22:46:26 GMT""},{""version"":""v2"",""created"":""Mon, 3 Jul 2017 18:47:55 GMT""},{""version"":""v3"",""created"":""Mon, 18 Sep 2017 18:37:00 GMT""}]","2017-09-20"
"1704.00080","Wenjian Hu","Wenjian Hu, Rajiv R.P. Singh, Richard T. Scalettar","Discovering Phases, Phase Transitions and Crossovers through
  Unsupervised Machine Learning: A critical examination","14 pages, 14 figures","Phys. Rev. E 95, 062122 (2017)","10.1103/PhysRevE.95.062122",,"cond-mat.stat-mech","http://arxiv.org/licenses/nonexclusive-distrib/1.0/","  We apply unsupervised machine learning techniques, mainly principal component
analysis (PCA), to compare and contrast the phase behavior and phase
transitions in several classical spin models - the square and
triangular-lattice Ising models, the Blume-Capel model, a highly degenerate
biquadratic-exchange spin-one Ising (BSI) model, and the 2D XY model, and
examine critically what machine learning is teaching us. We find that
quantified principal components from PCA not only allow exploration of
different phases and symmetry-breaking, but can distinguish phase transition
types and locate critical points. We show that the corresponding weight vectors
have a clear physical interpretation, which is particularly interesting in the
frustrated models such as the triangular antiferromagnet, where they can point
to incipient orders. Unlike the other well-studied models, the properties of
the BSI model are less well known. Using both PCA and conventional Monte Carlo
analysis, we demonstrate that the BSI model shows an absence of phase
transition and macroscopic ground-state degeneracy. The failure to capture the
`charge' correlations (vorticity) in the BSI model (XY model) from raw spin
configurations points to some of the limitations of PCA. Finally, we employ a
nonlinear unsupervised machine learning procedure, the `antoencoder method',
and demonstrate that it too can be trained to capture phase transitions and
critical points.
","[{""version"":""v1"",""created"":""Fri, 31 Mar 2017 22:51:30 GMT""},{""version"":""v2"",""created"":""Tue, 23 May 2017 19:18:28 GMT""}]","2017-06-23"
"1704.00081","Mohammad Ghomi","Mohammad Ghomi","Torsion of locally convex curves","10 pages, 4 figures; Minor revisions; Accepted for publication in
  Proc. Amer. Math. Soc",,,,"math.DG","http://arxiv.org/licenses/nonexclusive-distrib/1.0/","  We show that the torsion of any simple closed curve $\Gamma$ in Euclidean
3-space changes sign at least $4$ times provided that it is star-shaped and
locally convex with respect to a point $o$ in the interior of its convex hull.
The latter condition means that through each point $p$ of $\Gamma$ there passes
a plane $H$, not containing $o$, such that a neighborhood of $p$ in $\Gamma$
lies on the same side of $H$ as does $o$. This generalizes the four vertex
theorem of Sedykh for convex space curves. Following Thorbergsson and Umehara,
we reduce the proof to the result of Segre on inflections of spherical curves,
which is also known as Arnold's tennis ball theorem.
","[{""version"":""v1"",""created"":""Fri, 31 Mar 2017 23:11:06 GMT""},{""version"":""v2"",""created"":""Fri, 14 Apr 2017 12:21:13 GMT""},{""version"":""v3"",""created"":""Mon, 21 May 2018 04:12:08 GMT""},{""version"":""v4"",""created"":""Sun, 2 Sep 2018 18:00:52 GMT""}]","2018-09-05"
"1704.00082","Yanhong Annie Liu","Yanhong A. Liu, Saksham Chand, Scott D. Stoller","Moderately Complex Paxos Made Simple: High-Level Executable
  Specification of Distributed Algorithms",,"PPDP 2019: Proceedings of the 21st International Symposium on
  Principles and Practice of Declarative Programming. October 2019. Article No.
  15. Pages 1-15. ACM Press","10.1145/3354166.3354180",,"cs.DC cs.PL","http://arxiv.org/licenses/nonexclusive-distrib/1.0/","  This paper describes the application of a high-level language and method in
developing simpler specifications of more complex variants of the Paxos
algorithm for distributed consensus. The specifications are for Multi-Paxos
with preemption, replicated state machine, and reconfiguration and optimized
with state reduction and failure detection. The language is DistAlgo. The key
is to express complex control flows and synchronization conditions precisely at
a high level, using nondeterministic waits and message-history queries. We
obtain complete executable specifications that are almost completely
declarative---updating only a number for the protocol round besides the sets of
messages sent and received.
  We show the following results: 1.English and pseudocode descriptions of
distributed algorithms can be captured completely and precisely at a high
level, without adding, removing, or reformulating algorithm details to fit
lower-level, more abstract, or less direct languages. 2.We created higher-level
control flows and synchronization conditions than all previous specifications,
and obtained specifications that are much simpler and smaller, even matching or
smaller than abstract specifications that omit many algorithm details. 3.The
simpler specifications led us to easily discover useless replies, unnecessary
delays, and liveness violations (if messages can be lost) in previous published
specifications, by just following the simplified algorithm flows. 4.The
resulting specifications can be executed directly, and we can express
optimizations cleanly, yielding drastic performance improvement over naive
execution and facilitating a general method for merging processes. 5.We
systematically translated the resulting specifications into TLA+ and developed
machine-checked safety proofs, which also allowed us to detect and fix a subtle
safety violation in an earlier unpublished specification.
","[{""version"":""v1"",""created"":""Fri, 31 Mar 2017 23:22:40 GMT""},{""version"":""v2"",""created"":""Sun, 23 Jul 2017 13:13:00 GMT""},{""version"":""v3"",""created"":""Thu, 31 Jan 2019 14:17:37 GMT""},{""version"":""v4"",""created"":""Mon, 12 Aug 2019 06:12:40 GMT""}]","2020-12-25"
"1704.00083","Kourosh Meshgi","Kourosh Meshgi, Maryam Sadat Mirzaei, Shigeyuki Oba, Shin Ishii","Efficient Asymmetric Co-Tracking using Uncertainty Sampling","Submitted to IEEE ICSIPA'2017",,,,"cs.CV","http://arxiv.org/licenses/nonexclusive-distrib/1.0/","  Adaptive tracking-by-detection approaches are popular for tracking arbitrary
objects. They treat the tracking problem as a classification task and use
online learning techniques to update the object model. However, these
approaches are heavily invested in the efficiency and effectiveness of their
detectors. Evaluating a massive number of samples for each frame (e.g.,
obtained by a sliding window) forces the detector to trade the accuracy in
favor of speed. Furthermore, misclassification of borderline samples in the
detector introduce accumulating errors in tracking. In this study, we propose a
co-tracking based on the efficient cooperation of two detectors: a rapid
adaptive exemplar-based detector and another more sophisticated but slower
detector with a long-term memory. The sampling labeling and co-learning of the
detectors are conducted by an uncertainty sampling unit, which improves the
speed and accuracy of the system. We also introduce a budgeting mechanism which
prevents the unbounded growth in the number of examples in the first detector
to maintain its rapid response. Experiments demonstrate the efficiency and
effectiveness of the proposed tracker against its baselines and its superior
performance against state-of-the-art trackers on various benchmark videos.
","[{""version"":""v1"",""created"":""Fri, 31 Mar 2017 23:28:20 GMT""}]","2017-04-04"
"1704.00084","Mario Tindaro Migliorino","Mario Tindaro Migliorino, Carlo Scalo","Universal Scaling of Acoustic and Thermoacoustic Waves in Compressible
  Fluids",,,,,"physics.flu-dyn","http://arxiv.org/licenses/nonexclusive-distrib/1.0/","  We have derived the set of reference scaling parameters yielding collapse of
isentropic acoustic and thermoacoustic (or heat-release-induced) waves across
different pure compressible fluids with an assigned equation of state. The
resulting reference pressure and velocity are consistent with classic acoustic
scaling. The reference temperature and heat release rate need to be expressed
in terms of the isobaric thermal expansion coefficient $\alpha^*_{p_0}$ to
ensure collapse of all thermo-fluid-dynamic fluctuations across all fluids. The
proposed scaling is extended to non-isentropic waves and verified against data
from highly-resolved one-dimensional Navier-Stokes simulations. Conditions
tested include freely propagating isentropic acoustic waves and thermoacoustic
compression waves up to shock strength of 4.27, for six different supercritical
fluids in states ranging from compressible liquid to near-ideal gas, and
spanning seven orders of magnitude of imposed heat release rate.
","[{""version"":""v1"",""created"":""Fri, 31 Mar 2017 23:32:03 GMT""},{""version"":""v2"",""created"":""Thu, 13 Apr 2017 23:28:41 GMT""},{""version"":""v3"",""created"":""Wed, 30 Aug 2017 15:09:13 GMT""}]","2017-08-31"
"1704.00085","Cheng Peng","Cheng Peng and Volkan Isler","View Selection with Geometric Uncertainty Modeling",,,,,"cs.CV","http://arxiv.org/licenses/nonexclusive-distrib/1.0/","  Estimating positions of world points from features observed in images is a
key problem in 3D reconstruction, image mosaicking,simultaneous localization
and mapping and structure from motion. We consider a special instance in which
there is a dominant ground plane $\mathcal{G}$ viewed from a parallel viewing
plane $\mathcal{S}$ above it. Such instances commonly arise, for example, in
aerial photography. Consider a world point $g \in \mathcal{G}$ and its worst
case reconstruction uncertainty $\varepsilon(g,\mathcal{S})$ obtained by
merging \emph{all} possible views of $g$ chosen from $\mathcal{S}$. We first
show that one can pick two views $s_p$ and $s_q$ such that the uncertainty
$\varepsilon(g,\{s_p,s_q\})$ obtained using only these two views is almost as
good as (i.e. within a small constant factor of) $\varepsilon(g,\mathcal{S})$.
Next, we extend the result to the entire ground plane $\mathcal{G}$ and show
that one can pick a small subset of $\mathcal{S'} \subseteq \mathcal{S}$ (which
grows only linearly with the area of $\mathcal{G}$) and still obtain a constant
factor approximation, for every point $g \in \mathcal{G}$, to the minimum worst
case estimate obtained by merging all views in $\mathcal{S}$. Finally, we
present a multi-resolution view selection method which extends our techniques
to non-planar scenes. We show that the method can produce rich and accurate
dense reconstructions with a small number of views. Our results provide a view
selection mechanism with provable performance guarantees which can drastically
increase the speed of scene reconstruction algorithms. In addition to
theoretical results, we demonstrate their effectiveness in an application where
aerial imagery is used for monitoring farms and orchards.
","[{""version"":""v1"",""created"":""Fri, 31 Mar 2017 23:33:06 GMT""},{""version"":""v2"",""created"":""Sun, 25 Feb 2018 23:46:34 GMT""}]","2018-02-27"
"1704.00086","Michael Shara","Michael M. Shara, Krystian Ilkiewicz, Joanna Mikolajewska, Ashley
  Pagnotta, Michael F. Bode, Lisa A. Crause, Katarzyna Drozd, Jacqueline K.
  Faherty, Irma Fuentes-Morales, Jonathan E. Grindlay, Anthony F. J. Moffat,
  Linda Schmidtobreick, F. Richard Stephenson, Claus Tappert, David Zurek","Nova Scorpius 1437 A.D. is now a dwarf nova, age-dated by its proper
  motion","30 pages, 7 Figures",,"10.1038/nature23644",,"astro-ph.SR","http://arxiv.org/licenses/nonexclusive-distrib/1.0/","  Here we report the recovery of the binary underlying the classical nova of 11
March 1437 A.D. whose age is independently confirmed by proper motion-dating,
and show that in the 20th century it exhibits dwarf nova eruptions. The four
oldest recovered classical novae are now all dwarf novae. Taken together they
strongly suggest that mass transfer rates decrease by an order of magnitude or
more in the centuries after a classical nova event, greatly slowing the
evolution, and lengthening the lifetimes of these explosive binary stars.
","[{""version"":""v1"",""created"":""Fri, 31 Mar 2017 23:38:57 GMT""}]","2019-04-03"
"1704.00087","Diego Ayala","Diego A. Ayala, Charles R. Doering, Thilo M. Simon","Maximum palinstrophy amplification in the two-dimensional Navier-Stokes
  equations",,,"10.1017/jfm.2017.874",,"physics.flu-dyn math-ph math.MP","http://arxiv.org/licenses/nonexclusive-distrib/1.0/","  We derive and assess the sharpness of analytic upper bounds for the
instantaneous growth rate and finite-time amplification of palinstrophy in
solutions of the two-dimensional incompressible Navier-Stokes equations. A
family of optimal solenoidal fields parametrized by initial values for the
Reynolds number $\textrm{Re}$ and palinstrophy $\mathcal{P}$ which maximize
$d\mathcal{P}/dt$ is constructed by numerically solving suitable optimization
problems for a wide range of $\textrm{Re}$ and $\mathcal{P}$, providing
numerical evidence for the sharpness of the analytic estimate $d\mathcal{P}/dt
\leq \left(a + b\sqrt{\ln\textrm{Re}+c} \, \right) \mathcal{P}^{3/2}$ with
respect to both $\textrm{Re}$ and $\mathcal{P}$. This family of instantaneously
optimal fields is then used as initial data in fully resolved direct numerical
simulations and the time evolution of different relevant norms is carefully
monitored as the palinstrophy is transiently amplified before decaying. The
peak values of the palinstrophy produced by these initial data, i.e., $\sup_{t
> 0} \mathcal{P} (t)$, are observed to scale with the magnitude of the initial
palinstrophy $\mathcal{P}(0)$ in accord with the corresponding $\textit{a
priori}$ estimate. Implications of these findings for the question of
finite-time singularity formation in the three-dimensional incompressible
Navier-Stokes equation are discussed.
","[{""version"":""v1"",""created"":""Sat, 1 Apr 2017 00:24:20 GMT""}]","2018-02-14"
"1704.00088","Delfim F. M. Torres","Simao P. S. Santos, Natalia Martins, Delfim F. M. Torres","Noether currents for higher-order variational problems of Herglotz type
  with time delay","This is a preprint of a paper whose final and definite form is with
  'Discrete and Continuous Dynamical Systems -- Series S' (DCDS-S), ISSN
  1937-1632 (print), ISSN 1937-1179 (online), available at
  [https://www.aimsciences.org/journals/home.jsp?journalID=15]. Paper Submitted
  01-Oct-2016; Revised 01 and 21 March-2017; Accepted 31-March-2017","Discrete Contin. Dyn. Syst. Ser. S 11 (2018), no. 1, 91--102","10.3934/dcdss.2018006",,"math.OC math-ph math.MP","http://arxiv.org/licenses/nonexclusive-distrib/1.0/","  We study, from an optimal control perspective, Noether currents for
higher-order problems of Herglotz type with time delay. Main result provides
new Noether currents for such generalized variational problems, which are
particularly useful in the search of extremals. The proof is based on the idea
of rewriting the higher-order delayed generalized variational problem as a
first-order optimal control problem without time delays.
","[{""version"":""v1"",""created"":""Sat, 1 Apr 2017 00:31:31 GMT""}]","2017-10-12"
"1704.00089","Kiran Luecke","Kiran Luecke","Character Formulas from Matrix Factorizations","improved exposition, details added, minor errors fixed",,,,"math.RT","http://arxiv.org/licenses/nonexclusive-distrib/1.0/","  In this paper I present a new and unified method of proving character
formulas for discrete series representations of connected Lie groups by
applying a Chern character-type construction to the matrix factorizations of
[FT] and [FHT3]. In the case of a compact group I recover the Kirillov formula,
thereby exhibiting the work of [FT] as a categorification of the Kirillov
correspondence. In the case of a real semisimple group I recover the Rossman
character formula with only a minimal amount of analysis. The appeal of this
method is that it relies almost entirely on highest-weight theory, which is a
far more ubiquitous phenomenon than the varied techniques that were previously
used to prove such formulas.
","[{""version"":""v1"",""created"":""Sat, 1 Apr 2017 00:38:14 GMT""},{""version"":""v2"",""created"":""Thu, 22 Sep 2022 02:59:22 GMT""}]","2022-09-23"
