"1704.00147","Xiaoping Xie","Binjie Li, Xiaoping Xie","Regularity of solutions to time fractional diffusion equations",,,,,"math.AP","http://arxiv.org/licenses/nonexclusive-distrib/1.0/","  We derive some regularity estimates of the solution to a time fractional
diffusion equation, that are useful for numerical analysis, and partially
unravel the singularity structure of the solution with respect to the time
variable.
","[{""version"":""v1"",""created"":""Sat, 1 Apr 2017 09:24:10 GMT""}]","2017-04-04"
"1704.00148","Khuong An Nguyen","Khuong An Nguyen, Chris Watkins, Zhiyuan Luo","Co-location Epidemic Tracking on London Public Transports Using Low
  Power Mobile Magnetometer",,,,,"cs.CY cs.SI","http://arxiv.org/licenses/nonexclusive-distrib/1.0/","  The public transports provide an ideal means to enable contagious diseases
transmission. This paper introduces a novel idea to detect co-location of
people in such environment using just the ubiquitous geomagnetic field sensor
on the smart phone. Essentially, given that all passengers must share the same
journey between at least two consecutive stations, we have a long window to
match the user trajectory. Our idea was assessed over a painstakingly survey of
over 150 kilometres of travelling distance, covering different parts of London,
using the overground trains, the underground tubes and the buses.
","[{""version"":""v1"",""created"":""Sat, 1 Apr 2017 09:26:02 GMT""}]","2017-04-04"
"1704.00149","Voicu Popescu","Voicu Popescu, Peter Kratzer, Sebastian Wimmer, and Hubert Ebert","Native defects in the Co$_2$Ti$Z$ ($Z=$ Si, Ge, Sn) full Heusler alloys:
  formation and influence on the thermoelectric properties",,"Phys. Rev. B 96, 054443 (2017)","10.1103/PhysRevB.96.054443",,"cond-mat.mtrl-sci","http://arxiv.org/licenses/nonexclusive-distrib/1.0/","  We have performed first-principles investigations on the native defects in
the full Heusler alloys Co$_2$Ti$Z$ ($Z$ one of the group IV elements Si, Ge,
Sn), determining their formation energies and how they influence the transport
properties. We find that Co vacancies (Vc) in all compounds and the
Ti$_\text{Sn}$ anti-site exhibit negative formation energies. The smallest
positive values occur for Co in excess on anti-sites (Co$_Z$ or Co$_\text{Ti}$)
and for Ti$_Z$. The most abundant native defects were modeled as dilute alloys,
treated with the coherent potential approximation in combination with the
multiple-scattering theory Green function approach. The self-consistent
potentials determined this way were used to calculate the residual resistivity
via the Kubo-Greenwood formula and, based on its energy dependence, the Seebeck
coefficient of the systems. The latter is shown to depend significantly on the
type of defect, leading to variations that are related to subtle, spin-orbit
coupling induced, changes in the electronic structure above the half-metallic
gap. Two of the systems, Vc$_\text{Co}$ and Co$_Z$, are found to exhibit a
negative Seebeck coefficient. This observation, together with their low
formation energy, offers an explanation for the experimentally observed
negative Seebeck coefficient of the Co$_2$Ti$Z$ compounds as being due to
unintentionally created native defects.
","[{""version"":""v1"",""created"":""Sat, 1 Apr 2017 10:22:24 GMT""},{""version"":""v2"",""created"":""Wed, 5 Jul 2017 07:40:32 GMT""}]","2017-09-06"
"1704.00150","Alessandro Olgiati","Alessandro Michelangeli, Alessandro Olgiati","Gross-Pitaevskii non-linear dynamics for pseudo-spinor condensates","Corrected typos, updated bibliography","Journal of Nonlinear Mathematical Physics, 24(3), 426-464 (2017)",,,"math-ph math.MP","http://arxiv.org/licenses/nonexclusive-distrib/1.0/","  We derive the equations for the non-linear effective dynamics of a so called
pseudo-spinor Bose-Einstein condensate, which emerges from the linear many-body
Schr\""odinger equation at the leading order in the number of particles. The
considered system is a three-dimensional diluted gas of identical bosons with
spin, possibly confined in space, and coupled with an external time-dependent
magnetic field; particles also interact among themselves through a short-scale
repulsive interaction. The limit of infinitely many particles is monitored in
the physically relevant Gross-Pitaevskii scaling. In our main theorem, if at
time zero the system is in a phase of complete condensation (at the level of
the reduced one-body marginal) and with energy per particle fixed by the
Gross-Pitaevskii functional, then such conditions persist also at later times,
with the one-body orbital of the condensate evolving according to a system of
non-linear cubic Schr\""odinger equations coupled among themselves through
linear (Rabi) terms. The proof relies on an adaptation to the spinor setting of
Pickl's projection counting method developed for the scalar case. Quantitative
rates of convergence are available, but not made explicit because evidently
non-optimal. In order to substantiate the formalism and the assumptions made in
the main theorem, in an introductory section we review the mathematical
formalisation of modern typical experiments with pseudo-spinor condensates.
","[{""version"":""v1"",""created"":""Sat, 1 Apr 2017 10:22:57 GMT""},{""version"":""v2"",""created"":""Wed, 18 Oct 2017 07:40:56 GMT""}]","2017-10-19"
"1704.00151","Carlo Sanna","Paolo Leonetti and Carlo Sanna","On the greatest common divisor of $n$ and the $n$th Fibonacci number",,"Rocky Mountain Journal of Mathematics 48 (2018), 1191-1199","10.1216/RMJ-2018-48-4-1191",,"math.NT","http://arxiv.org/licenses/nonexclusive-distrib/1.0/","  Let $\mathcal{A}$ be the set of all integers of the form $\gcd(n, F_n)$,
where $n$ is a positive integer and $F_n$ denotes the $n$th Fibonacci number.
We prove that $\#\left(\mathcal{A} \cap [1, x]\right) \gg x / \log x$ for all
$x \geq 2$, and that $\mathcal{A}$ has zero asymptotic density. Our proofs rely
on a recent result of Cubre and Rouse which gives, for each positive integer
$n$, an explicit formula for the density of primes $p$ such that $n$ divides
the rank of appearance of $p$, that is, the smallest positive integer $k$ such
that $p$ divides $F_k$.
","[{""version"":""v1"",""created"":""Sat, 1 Apr 2017 10:26:51 GMT""},{""version"":""v2"",""created"":""Tue, 11 Apr 2017 08:58:09 GMT""}]","2020-12-15"
"1704.00152","Antonio Macchia","Davide Bolognini, Antonio Macchia, Francesco Strazzanti","Binomial edge ideals of bipartite graphs",,,,,"math.AC math.CO","http://arxiv.org/licenses/nonexclusive-distrib/1.0/","  We classify the bipartite graphs $G$ whose binomial edge ideal $J_G$ is
Cohen-Macaulay. The connected components of such graphs can be obtained by
gluing a finite number of basic blocks with two operations. In this context we
prove the converse of a well-known result due to Hartshorne, showing that the
Cohen-Macaulayness of these ideals is equivalent to the connectedness of their
dual graphs. We study interesting properties also for non-bipartite graphs and
in the unmixed case, constructing classes of bipartite graphs with $J_G$
unmixed and not Cohen-Macaulay.
","[{""version"":""v1"",""created"":""Sat, 1 Apr 2017 10:50:21 GMT""},{""version"":""v2"",""created"":""Sat, 6 May 2017 16:21:12 GMT""}]","2017-05-09"
"1704.00153","Bogdan Ichim","Winfried Bruns, Bogdan Ichim, Christof S\""oger","Computations of volumes and Ehrhart series in four candidates elections","Several typos corrected, Remark 4 added",,,,"math.CO math.MG","http://arxiv.org/licenses/nonexclusive-distrib/1.0/","  We describe several experimental results obtained in four candidates social
choice elections. These include the Condorcet and Borda paradoxes, as well as
the Condorcet efficiency of plurality voting with runoff. The computations are
done by Normaliz. It finds precise probabilities as volumes of polytopes and
counting functions encoded as Ehrhart series of polytopes.
","[{""version"":""v1"",""created"":""Sat, 1 Apr 2017 11:06:17 GMT""},{""version"":""v2"",""created"":""Tue, 4 Apr 2017 16:58:29 GMT""},{""version"":""v3"",""created"":""Mon, 17 Apr 2017 10:02:53 GMT""}]","2017-04-18"
"1704.00154","Philippe Di Francesco","Philippe Di Francesco and Rinat Kedem","(t,q) Q-systems, DAHA and quantum toroidal algebras via generalized
  Macdonald operators","57 pages, references added, inclusion of central charges",,,,"math-ph math.CO math.MP math.RT","http://arxiv.org/licenses/nonexclusive-distrib/1.0/","  We introduce difference operators on the space of symmetric functions which
are a natural generalization of the $(q,t)$-Macdonald operators. In the
$t\to\infty$ limit, they satisfy the $A_{N-1}$ quantum $Q$-system. We identify
the elements in the spherical $A_{N-1}$ DAHA which are represented by these
operators, as well as within the quantum toroidal algebra of $gl_1$ and the
elliptic Hall algebra. We present a plethystic, or bosonic, formulation of the
generating functions for the generalized Macdonald operators, which we relate
to recent work of Bergeron et al. Finally we derive constant term identities
for the current that allow to interpret them in terms of shuffle products. In
particular we obtain in the $t\to\infty$ limit a shuffle presentation of the
quantum $Q$-system relations.
","[{""version"":""v1"",""created"":""Sat, 1 Apr 2017 11:32:33 GMT""},{""version"":""v2"",""created"":""Thu, 6 Jul 2017 13:43:39 GMT""}]","2017-07-07"
"1704.00155","Fuminobu Takahashi","Ryuji Daido, Fuminobu Takahashi","The sign of the dipole-dipole potential by axion exchange","8 pages, 1 figure. v2: a reference added, matches version published
  in PLB",,"10.1016/j.physletb.2017.06.027","TU-1041, IPMU17-0042","hep-ph astro-ph.CO hep-ex hep-th","http://arxiv.org/licenses/nonexclusive-distrib/1.0/","  We calculate a dipole-dipole potential between fermions mediated by a light
pseudoscalar, axion, paying a particular attention to the overall sign. While
the sign of the potential is physical and important for experiments to discover
or constrain the axion coupling to fermions, there is often a sign error in the
literature. The purpose of this short note is to clarify the sign issue of the
axion-mediated dipole-dipole potential. As a by-product, we find a sign change
of the dipole-dipole potenital due to the different spin of the mediating
particle.
","[{""version"":""v1"",""created"":""Sat, 1 Apr 2017 11:33:05 GMT""},{""version"":""v2"",""created"":""Tue, 26 Dec 2017 00:49:03 GMT""}]","2017-12-27"
"1704.00156","Joeran Beel","Joeran Beel, Siddharth Dinesh","Real-World Recommender Systems for Academia: The Pain and Gain in
  Building, Operating, and Researching them [Long Version]","This article is a long version of the article published in the
  Proceedings of the 5th International Workshop on Bibliometric-enhanced
  Information Retrieval (BIR)",,,,"cs.IR","http://arxiv.org/licenses/nonexclusive-distrib/1.0/","  Research on recommender systems is a challenging task, as is building and
operating such systems. Major challenges include non-reproducible research
results, dealing with noisy data, and answering many questions such as how many
recommendations to display, how often, and, of course, how to generate
recommendations most effectively. In the past six years, we built three
research-article recommender systems for digital libraries and reference
managers, and conducted research on these systems. In this paper, we share some
experiences we made during that time. Among others, we discuss the required
skills to build recommender systems, and why the literature provides little
help in identifying promising recommendation approaches. We explain the
challenge in creating a randomization engine to run A/B tests, and how low data
quality impacts the calculation of bibliometrics. We further discuss why
several of our experiments delivered disappointing results, and provide
statistics on how many researchers showed interest in our recommendation
dataset.
","[{""version"":""v1"",""created"":""Sat, 1 Apr 2017 11:36:26 GMT""}]","2017-04-04"
"1704.00157","Viviane Baladi","Viviane Baladi","Characteristic functions as bounded multipliers on anisotropic spaces","Amended after comments from the referee and M. J\'ez\'equel, January
  10, 2018",,,,"math.DS math.FA nlin.CD","http://arxiv.org/licenses/nonexclusive-distrib/1.0/","  We show that characteristic functions of domains with boundaries transversal
to stable cones are bounded multipliers on a recently introduced scale
$U^{t,s}_p$ of anisotropic Banach spaces, under the conditions -1+1/p<s<-t<0
and -(r-1)+t<s, with 1<p<infty. (Amended after comments from the referee and M.
J\'ez\'equel, January 10, 2018)
","[{""version"":""v1"",""created"":""Sat, 1 Apr 2017 11:46:19 GMT""},{""version"":""v2"",""created"":""Thu, 11 Jan 2018 12:51:15 GMT""}]","2018-01-12"
"1704.00158","Ozsel Kilinc","Ozsel Kilinc, Ismail Uysal","Clustering-based Source-aware Assessment of True Robustness for Learning
  Models","Submitted to UAI 2017",,,,"cs.LG","http://arxiv.org/licenses/nonexclusive-distrib/1.0/","  We introduce a novel validation framework to measure the true robustness of
learning models for real-world applications by creating source-inclusive and
source-exclusive partitions in a dataset via clustering. We develop a
robustness metric derived from source-aware lower and upper bounds of model
accuracy even when data source labels are not readily available. We clearly
demonstrate that even on a well-explored dataset like MNIST, challenging
training scenarios can be constructed under the proposed assessment framework
for two separate yet equally important applications: i) more rigorous learning
model comparison and ii) dataset adequacy evaluation. In addition, our findings
not only promise a more complete identification of trade-offs between model
complexity, accuracy and robustness but can also help researchers optimize
their efforts in data collection by identifying the less robust and more
challenging class labels.
","[{""version"":""v1"",""created"":""Sat, 1 Apr 2017 11:58:24 GMT""}]","2017-04-04"
"1704.00159","Xiao Sun","Xiao Sun, Jiaxiang Shang, Shuang Liang, Yichen Wei","Compositional Human Pose Regression","Accepted by International Conference on Computer Vision (ICCV) 2017",,,,"cs.CV","http://arxiv.org/licenses/nonexclusive-distrib/1.0/","  Regression based methods are not performing as well as detection based
methods for human pose estimation. A central problem is that the structural
information in the pose is not well exploited in the previous regression
methods. In this work, we propose a structure-aware regression approach. It
adopts a reparameterized pose representation using bones instead of joints. It
exploits the joint connection structure to define a compositional loss function
that encodes the long range interactions in the pose. It is simple, effective,
and general for both 2D and 3D pose estimation in a unified setting.
Comprehensive evaluation validates the effectiveness of our approach. It
significantly advances the state-of-the-art on Human3.6M and is competitive
with state-of-the-art results on MPII.
","[{""version"":""v1"",""created"":""Sat, 1 Apr 2017 11:59:41 GMT""},{""version"":""v2"",""created"":""Mon, 31 Jul 2017 03:03:11 GMT""},{""version"":""v3"",""created"":""Wed, 2 Aug 2017 03:31:39 GMT""}]","2017-08-03"
"1704.00160","Bryan Quaife","Alan E. Lindsay, Bryan Quaife, and Laura Wendelberger","A boundary integral equation method for mode elimination and vibration
  confinement in thin plates with clamped points","21 pages, 13 figures",,,,"math.NA","http://arxiv.org/licenses/nonexclusive-distrib/1.0/","  We consider the bi-Laplacian eigenvalue problem for the modes of vibration of
a thin elastic plate with a discrete set of clamped points. A high-order
boundary integral equation method is developed for efficient numerical
determination of these modes in the presence of multiple localized defects for
a wide range of two-dimensional geometries. The defects result in
eigenfunctions with a weak singularity that is resolved by decomposing the
solution as a superposition of Green's functions plus a smooth regular part.
This method is applied to a variety of regular and irregular domains and two
key phenomena are observed. First, careful placement of clamping points can
entirely eliminate particular eigenvalues and suggests a strategy for
manipulating the vibrational characteristics of rigid bodies so that
undesirable frequencies are removed. Second, clamping of the plate can result
in partitioning of the domain so that vibrational modes are largely confined to
certain spatial regions. This numerical method gives a precision tool for
tuning the vibrational characteristics of thin elastic plates.
","[{""version"":""v1"",""created"":""Sat, 1 Apr 2017 12:03:51 GMT""}]","2017-04-04"
"1704.00161","Guillaume Beutier","G. Beutier, S. P. Collins, O. V. Dimitrova, V. E. Dmitrienko, M.I.
  Katsnelson, Y.O. Kvashnin, A.I. Lichtenstein, V. V. Mazurenko, G. Nisbet, E.
  N. Ovchinnikova, D. Pincini","Band filling control of the Dzyaloshinskii-Moriya interaction in weakly
  ferromagnetic insulators",,"Phys. Rev. Lett. 119, 167201 (2017)","10.1103/PhysRevLett.119.167201",,"cond-mat.str-el","http://arxiv.org/licenses/nonexclusive-distrib/1.0/","  We observe and explain theoretically a dramatic evolution of the
Dzyaloshinskii-Moriya interaction in the series of isostructural weak
ferromagnets, MnCO$_3$, FeBO$_3$, CoCO$_3$ and NiCO$_3$. The sign of the
interaction is encoded in the phase of x-ray magnetic diffraction amplitude,
observed through interference with resonant quadrupole scattering. We find very
good quantitative agreement with first-principles electronic structure
calculations, reproducing both sign and magnitude through the series, and
propose a simplified `toy model' to explain the change in sign with 3 d shell
filling. The model gives a clue for qualitative understanding of the evolution
of the DMI in Mott and charge transfer insulators.
","[{""version"":""v1"",""created"":""Sat, 1 Apr 2017 12:08:58 GMT""},{""version"":""v2"",""created"":""Fri, 5 May 2017 14:16:54 GMT""}]","2017-10-25"
"1704.00162","Lucian Harland-Lang","L. A. Harland-Lang, A. D. Martin, R. Nathvani, R. S. Thorne","MMHT PDFs: updates and outlook","13 pages, 8 figures. To appear in the proceedings of the XXIII Cracow
  Epiphany Conference",,"10.5506/APhysPolB.48.1011",,"hep-ph","http://arxiv.org/licenses/nonexclusive-distrib/1.0/","  We present the latest results of studies within the MMHT PDF framework. We
discuss the impact of the most recent ATLAS 7 TeV jet data, demonstrating that
while a good fit can be achieved for individual jet rapidity bins, it is not
possible to achieve a good description of the data when all bins are fitted. We
examine the role that the experimental correlated systematic uncertainties play
in this, and demonstrate that by simply decorrelating no more than two sources
of error between rapidity bins a remarkably improved description of the data
can be achieved. We then study the impact of NNLO corrections, showing that a
mild decrease in the fit quality is produced. We also present the results of
including new LHC $W$, $Z$, $W+c$ and $t\overline{t}$ data on the MMHT14 PDF
set, showing that a marked decrease in the $s+\overline{s}$ uncertainty is in
particular achieved. Finally, some discussion of the latest work towards the
inclusion of the photon PDF within the MMHT framework is presented.
","[{""version"":""v1"",""created"":""Sat, 1 Apr 2017 12:41:15 GMT""},{""version"":""v2"",""created"":""Thu, 11 May 2017 16:19:17 GMT""}]","2017-08-02"
"1704.00163","Guanding Yu","Jinke Ren and Guanding Yu and Yunlong Cai and Yinghui He","Latency Optimization for Resource Allocation in Mobile-Edge Computation
  Offloading","Submitted for Journal Publication",,,,"cs.IT math.IT","http://arxiv.org/licenses/nonexclusive-distrib/1.0/","  By offloading intensive computation tasks to the edge cloud located at the
cellular base stations, mobile-edge computation offloading (MECO) has been
regarded as a promising means to accomplish the ambitious millisecond-scale
end-to-end latency requirement of the fifth-generation networks. In this paper,
we investigate the latency-minimization problem in a multi-user time-division
multiple access MECO system with joint communication and computation resource
allocation. Three different computation models are studied, i.e., local
compression, edge cloud compression, and partial compression offloading. First,
closed-form expressions of optimal resource allocation and minimum system delay
for both local and edge cloud compression models are derived. Then, for the
partial compression offloading model, we formulate a piecewise optimization
problem and prove that the optimal data segmentation strategy has a piecewise
structure. Based on this result, an optimal joint communication and computation
resource allocation algorithm is developed. To gain more insights, we also
analyze a specific scenario where communication resource is adequate while
computation resource is limited. In this special case, the closed-form solution
of the piecewise optimization problem can be derived. Our proposed algorithms
are finally verified by numerical results, which show that the novel partial
compression offloading model can significantly reduce the end-to-end latency.
","[{""version"":""v1"",""created"":""Sat, 1 Apr 2017 12:45:17 GMT""}]","2017-04-04"
"1704.00164","Duco van Straten","Duco van Straten","Calabi--Yau Operators","This paper of expository character is an extended written version of
  a talk given at the conference ""Uniformization, Riemann-Hilbert
  Correspondence, Calabi-Yau Manifolds, and Picard-Fuchs Equations"" held
  13.-18.07.2015 at the Mittag-Leffler Institute which was organised by L. Ji
  and S.-T. Yau and will appear in the conference proceedings",,,,"math.AG","http://arxiv.org/licenses/nonexclusive-distrib/1.0/","  Motivated by mirror symmetry of one-parameter models, an interesting class of
Fuchsian differential operators can be singled out, the so-called Calabi--Yau
operators, introduced by Almkvist and Zudilin. They conjecturally determine
$Sp(4)$-local systems that underly a $\mathbb{Q}$-VHS with Hodge numbers \[h^{3
0}=h^{2 1}=h^{1 2}=h^{0 3}=1\] and in the best cases they make their appearance
as Picard--Fuchs operators of families of Calabi--Yau threefolds with
$h^{12}=1$ and encode the numbers of rational curves on a mirror manifold with
$h^{11}=1$. We review some of the striking properties of this rich class of
operators.
","[{""version"":""v1"",""created"":""Sat, 1 Apr 2017 12:48:57 GMT""}]","2017-04-04"
"1704.00165","Ruslan Sharipov","Ruslan Sharipov","On Walter Wyss's no perfect cuboid paper","AmSTeX, 44 pages, amsppt style",,,,"math.NT","http://arxiv.org/licenses/nonexclusive-distrib/1.0/","  The perfect cuboid problem is an old famous unsolved problem in mathematics
concerning the existence or non-existence of a rectangular parallelepiped whose
edges, face diagonals, and space diagonal are of integer lengths. Recently
Walter Wyss has published a paper [arXiv:1506.02215] claiming a solution of
this problem. The purpose of this paper is to check out Walter Wyss's result.
","[{""version"":""v1"",""created"":""Sat, 1 Apr 2017 12:50:29 GMT""}]","2017-04-04"
"1704.00166","Minghui Zhao","Minghui Zhao","Geometric realizations of Lusztig's symmetries on the whole quantum
  groups","19 pages",,,,"math.RT math.QA","http://arxiv.org/licenses/nonexclusive-distrib/1.0/","  In this paper, we shall study the structure of the Grothendieck group of the
category consisting of Lusztig's perverse sheaves and give a decomposition
theorem of it. By using this decomposition theorem and the geometric
realizations of Lusztig's symmetries on the positive part of a quantum group,
we shall give geometric realizations of Lusztig's symmetries on the whole
quantum group.
","[{""version"":""v1"",""created"":""Sat, 1 Apr 2017 13:17:33 GMT""}]","2017-04-04"
"1704.00167","Alexey Nenashev","A. V. Nenashev, J. O. Oelerich, A. V. Dvurechenskii, F. Gebhard, and
  S. D. Baranovskii","Fundamental characteristic length scale for the field dependence of
  hopping charge transport in disordered organic semiconductors","7 pages, 4 figures","Phys. Rev. B 96, 035204 (2017)","10.1103/PhysRevB.96.035204",,"cond-mat.mes-hall cond-mat.dis-nn","http://arxiv.org/licenses/nonexclusive-distrib/1.0/","  Using analytical arguments and computer simulations we show that the
dependence of the hopping carrier mobility on the electric field
$\mu(F)/\mu(0)$ in a system of random sites is determined by the localization
length $a$, and not by the concentration of sites $N$. This result is in
drastic contrast to what is usually assumed in the literature for a theoretical
description of experimental data and for device modeling, where $N^{-1/3}$ is
considered as the decisive length scale for $\mu(F)$. We show that although the
limiting value $\mu(F \rightarrow 0)$ is determined by the ratio $N^{-1/3}/a$,
the dependence $\mu(F)/\mu(0)$ is sensitive to the magnitude of $a$, and not to
$N^{-1/3}$. Furthermore, our numerical and analytical results prove that the
effective temperature responsible for the combined effect of the electric field
$F$ and the real temperature $T$ on the hopping transport via spatially random
sites can contain the electric field only in the combination $eFa$.
","[{""version"":""v1"",""created"":""Sat, 1 Apr 2017 13:23:58 GMT""},{""version"":""v2"",""created"":""Mon, 24 Jul 2017 11:33:03 GMT""}]","2017-07-25"
