"1704.07129","Spandana Gella","Spandana Gella, Frank Keller","An Analysis of Action Recognition Datasets for Language and Vision Tasks","To appear in Proceedings of ACL 2017, 8 pages",,,,"cs.CL cs.CV","http://arxiv.org/licenses/nonexclusive-distrib/1.0/","  A large amount of recent research has focused on tasks that combine language
and vision, resulting in a proliferation of datasets and methods. One such task
is action recognition, whose applications include image annotation, scene
under- standing and image retrieval. In this survey, we categorize the existing
ap- proaches based on how they conceptualize this problem and provide a
detailed review of existing datasets, highlighting their di- versity as well as
advantages and disad- vantages. We focus on recently devel- oped datasets which
link visual informa- tion with linguistic resources and provide a fine-grained
syntactic and semantic anal- ysis of actions in images.
","[{""version"":""v1"",""created"":""Mon, 24 Apr 2017 10:38:23 GMT""}]","2017-04-25"
"1704.07130","He He","He He and Anusha Balakrishnan and Mihail Eric and Percy Liang","Learning Symmetric Collaborative Dialogue Agents with Dynamic Knowledge
  Graph Embeddings","ACL 2017",,,,"cs.CL","http://arxiv.org/licenses/nonexclusive-distrib/1.0/","  We study a symmetric collaborative dialogue setting in which two agents, each
with private knowledge, must strategically communicate to achieve a common
goal. The open-ended dialogue state in this setting poses new challenges for
existing dialogue systems. We collected a dataset of 11K human-human dialogues,
which exhibits interesting lexical, semantic, and strategic elements. To model
both structured knowledge and unstructured language, we propose a neural model
with dynamic knowledge graph embeddings that evolve as the dialogue progresses.
Automatic and human evaluations show that our model is both more effective at
achieving the goal and more human-like than baseline neural and rule-based
models.
","[{""version"":""v1"",""created"":""Mon, 24 Apr 2017 10:38:24 GMT""}]","2017-04-25"
"1704.07131","Ryan Garland","R. Garland, P. L. Dufton, C. J. Evans, P. A. Crowther, I.D. Howarth,
  A. de Koter, S. E. de Mink, N.J. Grin, N. Langer, D. J. Lennon, C. M. McEvoy,
  H. Sana, F.R.N. Schneider, S. S\'imon D\'iaz, W. D. Taylor, A. Thompson, J.
  S. Vink","The VLT-FLAMES Tarantula Survey XXVII. Physical parameters of B-type
  main-sequence binary systems in the Tarantula nebula","14 pages, 5 figures",,"10.1051/0004-6361/201629982",,"astro-ph.SR","http://arxiv.org/licenses/nonexclusive-distrib/1.0/","  A spectroscopic analysis has been undertaken for the B-type multiple systems
(excluding those with supergiant primaries) in the VLT-FLAMES Tarantula Survey
(VFTS). Projected rotational velocities, $v$sin$i$, for the primaries have been
estimated using a Fourier Transform technique and confirmed by fitting
rotationally broadened profiles. A subset of 33 systems with $v$sin$i$$\leq$ 80
km/s have been analysed using a TLUSTY grid of model atmospheres to estimate
stellar parameters and surface abundances for the primaries. The effects of a
potential flux contribution from an unseen secondary have also been considered.
For 20 targets it was possible to reliably estimate their effective
temperatures (T$_{eff}$) but for the other 13 objects it was only possible to
provide a constraint of 20,000$\leq$T$_{eff}$$\leq$26,000 K -- the other
parameters estimated for these targets will be consequently less reliable. The
estimated stellar properties are compared with evolutionary models and are
generally consistent with their membership of 30 Doradus, while the nature of
the secondaries of 3 SB2 system is discussed. A comparison with a sample of
single stars with $v$sin$i$$\leq$ 80 km/s obtained from the VFTS and analysed
with the same techniques implies that the atmospheric parameters and nitrogen
abundances of the two samples are similar. However, the binary sample may have
a lack of primaries with significant nitrogen enhancements, which would be
consistent with them having low rotational velocities and having effectively
evolved as single stars without significant rotational mixing. This result,
which may be actually a consequence of the limitations of the pathfinder
investigation presented in this paper, should be considered as a motivation for
spectroscopic abundance analysis of large samples of binary stars, with high
quality observational data.
","[{""version"":""v1"",""created"":""Mon, 24 Apr 2017 10:42:24 GMT""}]","2017-07-26"
"1704.07132","Andrey Kotov","V.V. Braguta, M.I. Katsnelson and A.Yu. Kotov","Lattice field theory simulations of Dirac semimetals","11 pages, 5 figures, 2 tables, typo in Eq. (20) corrected, Appendix
  added",,"10.1016/j.aop.2018.02.016",,"cond-mat.str-el cond-mat.mes-hall hep-lat","http://arxiv.org/licenses/nonexclusive-distrib/1.0/","  In this paper the observed Dirac semimetals Na$_3$Bi and Cd$_3$As$_2$ are
studied within lattice simulation. We formulate lattice field theory with
rooted staggered fermions on anisotropic lattice. It is shown that in the limit
of zero temporal lattice spacing this theory reproduces low energy effective
theory of Dirac semimetals. Using this lattice theory we study the phase
diagram of Dirac semimetals in the plane effective coupling constant--Fermi
velocity anisotropy. Within the formulated theory the results are practically
volume independent in contrast with our previous study. Our results confirm our
previous finding that within the Dirac model with bare Coulomb interaction both
Na$_3$Bi and Cd$_3$As$_2$ lie deep in the insulator phase.
","[{""version"":""v1"",""created"":""Mon, 24 Apr 2017 10:42:32 GMT""},{""version"":""v2"",""created"":""Tue, 13 Jun 2017 12:25:30 GMT""}]","2018-04-04"
"1704.07133","Stephan Holzer","Stephan Holzer and Nancy Lynch","Beeping a Maximal Independent Set Fast","Full version of a brief announcement with the same title that
  appeared at the 30th International Symposium on Distributed Computing (DISC),
  Paris, France, September 2016. 17 pages",,,,"cs.DC","http://arxiv.org/licenses/nonexclusive-distrib/1.0/","  We adapt a recent algorithm by Ghaffari [SODA'16] for computing a Maximal
Independent Set in the LOCAL model, so that it works in the significantly
weaker BEEP model. For networks with maximum degree $\Delta$, our algorithm
terminates locally within time $O((\log \Delta + \log (1/\epsilon)) \cdot
\log(1/\epsilon))$, with probability at least $1 - \epsilon$. The key idea of
the modification is to replace explicit messages about transmission
probabilities with estimates based on the number of received messages.
  After the successful introduction (and implicit use) of local analysis, e.g.,
by Barenboim et al. [JACM'16], Chung et al. [PODC'14], Ghaffari [SODA'16], and
Halldorsson et al. [PODC'15], we study this concept in the BEEP model for the
first time.
  By doing so, we improve over local bounds that are implicitly derived from
previous work (that uses traditional global analysis) on computing a Maximal
Independent Set in the \beep model for a large range of values of the parameter
$\Delta$. At the same time, we show that our algorithm in the \beep model only
needs to pay a $\log(1/\epsilon)$ factor in the runtime compared to the best
known MIS algorithm in the much more powerful \local model. We demonstrate that
this overhead is negligible, as communication via beeps can be implemented
using significantly less resources than communication in the LOCAL model. In
particular, when looking at implementing these models, one round of the \local
model needs at least $O(\Delta)$ time units, while one round in the BEEP model
needs $O(\log\Delta)$ time units, an improvement that diminishes the loss of a
$\log(1/\epsilon)$ factor in most settings.
","[{""version"":""v1"",""created"":""Mon, 24 Apr 2017 10:42:37 GMT""}]","2017-04-25"
"1704.07134","Efthimios Skordas","E. S. Skordas","Non-uniform scaling of the magnetic field variations before the $M_w$9.0
  Tohoku earthquake in 2011","16 pages, 4 figures",,,,"physics.geo-ph","http://arxiv.org/licenses/nonexclusive-distrib/1.0/","  Applying Detrended Fluctuation Analysis (DFA) to the geomagnetic data
recorded at three measuring stations in Japan, Rong et al. in 2012 reported
that anomalous magnetic field variations were identified well before the
occurrence of the disastrous Tohoku $M_w$9.0 earthquake that occurred on 11
March 2011 in Japan exhibiting increased ""non-uniform"" scaling behavior. Here,
we provide an explanation for the appearance of this increase of ""non-uniform""
scaling on the following grounds: These magnetic field variations are the ones
that accompany the electric field variations termed Seismic Electric Signals
(SES) activity which have been repeatedly reported that precede major
earthquakes. DFA as well as multifractal DFA reveal that the latter electric
field variations exhibit scaling behavior as shown by analyzing SES activities
observed before major earthquakes in Greece. Hence, when these variations are
superimposed on a background of pseudosinusoidal trend, their long range
correlation properties -quantified by DFA- are affected resulting in an
increase of the ""non-uniform"" scaling behavior. The same is expected to hold
for the former magnetic field variations.
","[{""version"":""v1"",""created"":""Mon, 24 Apr 2017 10:45:40 GMT""}]","2017-04-25"
"1704.07135","Takao Komatsu","Hajime Kaneko and Takao Komatsu","Bernoulli-Carlitz and Cauchy-Carlitz numbers with Stirling-Carlitz
  numbers","This paper has been published in RIMS K\^oky\^uroku Bessatsu B72
  (2018),23-35",,,,"math.NT","http://arxiv.org/licenses/nonexclusive-distrib/1.0/","  Recently, the Cauchy-Carlitz number was defined as the counterpart of the
Bernoulli-Carlitz number. Both numbers can be expressed explicitly in terms of
so-called Stirling-Carlitz numbers. In this paper, we study the second analogue
of Stirling-Carlitz numbers and give some general formulae, including Bernoulli
and Cauchy numbers in formal power series with complex coefficients, and
Bernoulli-Carlitz and Cauchy-Carlitz numbers in function fields. We also give
some applications of Hasse-Teichm\""uller derivative to hypergeometric Bernoulli
and Cauchy numbers in terms of associated Stirling numbers.
","[{""version"":""v1"",""created"":""Mon, 24 Apr 2017 10:46:58 GMT""},{""version"":""v2"",""created"":""Fri, 4 Jan 2019 09:20:00 GMT""}]","2019-01-07"
"1704.07136","Efthimios Skordas","E. S Skordas, N. V. Sarlis","On the anomalous {changes of seismicity and} geomagnetic field prior to
  the 2011 $M_w$ 9.0 Tohoku earthquake","5 pages, 1 figure",,,,"physics.geo-ph","http://arxiv.org/licenses/nonexclusive-distrib/1.0/","  Xu et al. [J. Asian Earth Sci. {\bf 77}, 59-65 (2013)] It has just been
reported that approximately 2 months prior to the $M_w$9.0 Tohoku earthquake
that occurred in Japan on 11 March 2011 anomalous variations of the geomagnetic
field have been observed in the vertical component at a measuring station about
135 km from the epicenter for about 10 days (4 to 14 January 2011). Here, we
show that this observation is in striking agreement with independent recent
results obtained from natural time analysis of seismicity in Japan. In
particular, this analysis has revealed that an unprecedented minimum of the
order parameter fluctuations of seismicity was observed around 5 January 2011,
thus pointing to the initiation at that date of a strong precursory Seismic
Electric Signals activity accompanied by the anomalous geomagnetic field
variations. Starting from this date, natural time analysis of the subsequent
seismicity indicates that a strong mainshock was expected in a few days to one
week after 08:40 LT on 10 March 2011.
","[{""version"":""v1"",""created"":""Mon, 24 Apr 2017 10:50:39 GMT""}]","2017-04-25"
"1704.07137","Kieran Flatt","Kieran Flatt, Stephen M. Barnett, Sarah Croke","Sequential measurements: Busch-Gleason theorem and its applications","27 pages, 3 figures",,,,"quant-ph","http://arxiv.org/licenses/nonexclusive-distrib/1.0/","  Probabilities enter quantum mechanics via Born's rule, the uniqueness of
which was proven by Gleason. Busch subsequently relaxed the assumptions of this
proof, expanding its domain of applicability in the process. Extending this
work to sequential measurement processes is the aim of this paper. Given only a
simple set of postulates, a probability measure is derived utilising the
concept of Liouville space and the most general permissible quantum channel
arises in the same manner. Super-Liouville space is constructed and a Bayesian
interpretation of this object is provided. An important application of the new
method is demonstrated, providing an axiomatic derivation of important results
of the BB84 protocol in quantum cryptography.
","[{""version"":""v1"",""created"":""Mon, 24 Apr 2017 10:51:40 GMT""}]","2017-04-25"
"1704.07138","Chris Hokamp","Chris Hokamp and Qun Liu","Lexically Constrained Decoding for Sequence Generation Using Grid Beam
  Search","Accepted as a long paper at ACL 2017",,,,"cs.CL","http://arxiv.org/licenses/nonexclusive-distrib/1.0/","  We present Grid Beam Search (GBS), an algorithm which extends beam search to
allow the inclusion of pre-specified lexical constraints. The algorithm can be
used with any model that generates a sequence $ \mathbf{\hat{y}} =
\{y_{0}\ldots y_{T}\} $, by maximizing $ p(\mathbf{y} | \mathbf{x}) =
\prod\limits_{t}p(y_{t} | \mathbf{x}; \{y_{0} \ldots y_{t-1}\}) $. Lexical
constraints take the form of phrases or words that must be present in the
output sequence. This is a very general way to incorporate additional knowledge
into a model's output without requiring any modification of the model
parameters or training data. We demonstrate the feasibility and flexibility of
Lexically Constrained Decoding by conducting experiments on Neural
Interactive-Predictive Translation, as well as Domain Adaptation for Neural
Machine Translation. Experiments show that GBS can provide large improvements
in translation quality in interactive scenarios, and that, even without any
user input, GBS can be used to achieve significant gains in performance in
domain adaptation scenarios.
","[{""version"":""v1"",""created"":""Mon, 24 Apr 2017 10:55:20 GMT""},{""version"":""v2"",""created"":""Tue, 2 May 2017 13:52:08 GMT""}]","2017-05-03"
"1704.07139","Mieczys{\l}aw K{\l}opotek","Mieczys{\l}aw A. K{\l}opotek","An Aposteriorical Clusterability Criterion for $k$-Means++ and
  Simplicity of Clustering","58 pages","SN Computer Science 1(2): 80 (2020), ISSN: 2662-995X (Print)
  2661-8907","10.1007/s42979-020-0079-8",,"cs.LG","http://arxiv.org/licenses/nonexclusive-distrib/1.0/","  We define the notion of a well-clusterable data set combining the point of
view of the objective of $k$-means clustering algorithm (minimising the centric
spread of data elements) and common sense (clusters shall be separated by
gaps). We identify conditions under which the optimum of $k$-means objective
coincides with a clustering under which the data is separated by predefined
gaps.
  We investigate two cases: when the whole clusters are separated by some gap
and when only the cores of the clusters meet some separation condition.
  We overcome a major obstacle in using clusterability criteria due to the fact
that known approaches to clusterability checking had the disadvantage that they
are related to the optimal clustering which is NP hard to identify.
  Compared to other approaches to clusterability, the novelty consists in the
possibility of an a posteriori (after running $k$-means) check if the data set
is well-clusterable or not. As the $k$-means algorithm applied for this purpose
has polynomial complexity so does therefore the appropriate check.
Additionally, if $k$-means++ fails to identify a clustering that meets
clusterability criteria, with high probability the data is not
well-clusterable.
","[{""version"":""v1"",""created"":""Mon, 24 Apr 2017 10:55:41 GMT""},{""version"":""v2"",""created"":""Sat, 30 Jun 2018 20:05:14 GMT""}]","2020-04-07"
"1704.07140","Valeriy Levenshtam Doctor of Science","P. V. Babich, V. B. Levenshtam","Recovery of a fast oscillating free term in the wave equation by
  asymptotics of the solution","23 pages, in Russian",,,,"math.AP","http://arxiv.org/licenses/nonexclusive-distrib/1.0/","  Three problems about recovery of a high-frequency free term in the
one-dimension wave equation with homogeneous initial-boundary conditions by
some information about partial asymptotics of its solution have been solved. It
is shoun, that the free term can be completely recovered from a specific data
about incomplete (three-terms) asymptotics of the solution. Before formulation
of the each problem about recovery of free term, construction and justification
of the asymptotics of the solution of original initial-boundary problem are
given.
","[{""version"":""v1"",""created"":""Mon, 24 Apr 2017 10:58:24 GMT""},{""version"":""v2"",""created"":""Wed, 17 May 2017 13:03:10 GMT""},{""version"":""v3"",""created"":""Tue, 21 Apr 2020 14:30:09 GMT""}]","2020-04-22"
"1704.07141","Caitlin Bucj Prof","Caitlin E Buck and Miguel Juarez","Bayesian radiocarbon modelling for beginners",,,,,"stat.AP","http://arxiv.org/licenses/nonexclusive-distrib/1.0/","  Due to freely available, tailored software, Bayesian statistics is fast
becoming the dominant paradigm in archaeological chronology construction. Such
software provides users with powerful tools for Bayesian inference for
chronological models with little need to undertake formal study of statistical
modelling or computer programming. This runs the risk that it is reduced to the
status of a black-box which is not sensible given the power and complexity of
the modelling tools it implements. In this paper we seek to offer intuitive
insight to ensure that readers from the archaeological research community who
use Bayesian chronological modelling software will be better able to make well
educated choices about the tools and techniques they adopt. Our hope is that
they will then be both better informed about their own research designs and
better prepared to offer constructively critical assessments of the modelling
undertaken by others.
","[{""version"":""v1"",""created"":""Mon, 24 Apr 2017 10:58:41 GMT""}]","2017-04-25"
"1704.07142","Shu Zhang","Shu Zhang, Hui Yu, Ting Wang, Junyu Dong and Honghai Liu","Dense 3D Facial Reconstruction from a Single Depth Image in
  Unconstrained Environment",,,,,"cs.CV","http://creativecommons.org/licenses/by/4.0/","  With the increasing demands of applications in virtual reality such as 3D
films, virtual Human-Machine Interactions and virtual agents, the analysis of
3D human face analysis is considered to be more and more important as a
fundamental step for those virtual reality tasks. Due to information provided
by an additional dimension, 3D facial reconstruction enables aforementioned
tasks to be achieved with higher accuracy than those based on 2D facial
analysis. The denser the 3D facial model is, the more information it could
provide. However, most existing dense 3D facial reconstruction methods require
complicated processing and high system cost. To this end, this paper presents a
novel method that simplifies the process of dense 3D facial reconstruction by
employing only one frame of depth data obtained with an off-the-shelf RGB-D
sensor. The experiments showed competitive results with real world data.
","[{""version"":""v1"",""created"":""Mon, 24 Apr 2017 10:58:47 GMT""}]","2017-04-25"
"1704.07143","C S Yadav Dr.","M. K. Hooda and C. S. Yadav","Electronic properties and the nature of metal-insulator transition in
  NdNiO3 prepared at ambient oxygen pressure","6 Pages, 6 Figures","Physica B, 491 (2016) 31-36","10.1016/j.physb.2016.03.014",,"cond-mat.str-el cond-mat.mtrl-sci","http://arxiv.org/licenses/nonexclusive-distrib/1.0/","  We report the electronic properties of the NdNiO3, prepared at the ambient
oxygen pressure condition. The metal-insulator transition temperature is
observed at 192 K, but the low temperature state is found to be less insulating
compared to the NdNiO3 prepared at high oxygen pressure. The electric
resistivity, Seebeck coefficient and thermal conductivity of the compound show
large hysteresis below the metal-insulator transition. The large value of the
effective mass (m* ~ 8me) in the metallic state indicate the narrow character
of the 3d band. The electric conduction at low temperatures (T = 2 - 20 K) is
governed by the variable range hopping of the charge carriers.
","[{""version"":""v1"",""created"":""Mon, 24 Apr 2017 11:02:57 GMT""}]","2017-04-25"
"1704.07144","Tam\'as Makai","Mihyun Kang, Christoph Koch and Tam\'as Makai","Bootstrap percolation in random $k$-uniform hypergraphs","Extended abstract presented at the European Conference on
  Combinatorics, Graph Theory and Applications 2015","Electronic Notes in Discrete Mathematics 49 (2015) 595-601","10.1016/j.endm.2015.06.081",,"math.CO math.PR","http://arxiv.org/licenses/nonexclusive-distrib/1.0/","  We investigate bootstrap percolation with infection threshold $r> 1$ on the
binomial $k$-uniform random hypergraph $H_k(n,p)$ in the regime $n^{-1}\ll
n^{k-2}p \ll n^{-1/r}$, when the initial set of infected vertices is chosen
uniformly at random from all sets of given size. We establish a threshold such
that if there are less vertices in the initial set of infected vertices, then
whp only a few additional vertices become infected, while if the initial set of
infected vertices exceeds the threshold then whp almost every vertex becomes
infected. In addition, for $k=2$, we show that the probability of failure
decreases exponentially.
","[{""version"":""v1"",""created"":""Mon, 24 Apr 2017 11:03:43 GMT""}]","2017-04-25"
"1704.07145","Chang-Ryeol Lee","Chang-Ryeol Lee and Kuk-Jin Yoon","Exploiting Feature Confidence for Forward Motion Estimation","7 pages, 9 figures",,,,"cs.RO","http://arxiv.org/licenses/nonexclusive-distrib/1.0/","  Visual-Inertial Odometry (VIO) utilizes an Inertial Measurement Unit (IMU) to
overcome the limitations of Visual Odometry (VO). However, the VIO for vehicles
in large-scale outdoor environments still has some difficulties in estimating
forward motion with distant features. To solve these difficulties, we propose a
robust VIO method based on the analysis of feature confidence in forward motion
estimation using an IMU. We first formulate the VIO problem by using effective
trifocal tensor geometry. Then, we infer the feature confidence by using the
motion information obtained from an IMU and incorporate the confidence into the
Bayesian estimation framework. Experimental results on the public KITTI dataset
show that the proposed VIO outperforms the baseline VIO, and it also
demonstrates the effectiveness of the proposed feature confidence analysis and
confidence-incorporated egomotion estimation framework.
","[{""version"":""v1"",""created"":""Mon, 24 Apr 2017 11:06:43 GMT""},{""version"":""v2"",""created"":""Fri, 16 Jun 2017 04:04:53 GMT""},{""version"":""v3"",""created"":""Sun, 13 Aug 2017 13:09:24 GMT""}]","2017-08-15"
"1704.07146","Ella Rabinovich","Ella Rabinovich, Noam Ordan, Shuly Wintner","Found in Translation: Reconstructing Phylogenetic Language Trees from
  Translations","ACL2017, 11 pages",,,,"cs.CL","http://arxiv.org/licenses/nonexclusive-distrib/1.0/","  Translation has played an important role in trade, law, commerce, politics,
and literature for thousands of years. Translators have always tried to be
invisible; ideal translations should look as if they were written originally in
the target language. We show that traces of the source language remain in the
translation product to the extent that it is possible to uncover the history of
the source language by looking only at the translation. Specifically, we
automatically reconstruct phylogenetic language trees from monolingual texts
(translated from several source languages). The signal of the source language
is so powerful that it is retained even after two phases of translation. This
strongly indicates that source language interference is the most dominant
characteristic of translated texts, overshadowing the more subtle signals of
universal properties of translation.
","[{""version"":""v1"",""created"":""Mon, 24 Apr 2017 11:14:20 GMT""}]","2017-04-25"
"1704.07147","Yuki Fujimoto","Yuki Fujimoto and Toru Ohira","A Neural Network model with Bidirectional Whitening","16pages","In: Rutkowski L., Scherer R., Korytkowski M., Pedrycz W.,
  Tadeusiewicz R., Zurada J. (eds) Artificial Intelligence and Soft Computing.
  ICAISC 2018. Lecture Notes in Computer Science, vol 10841. Springer, Cham","10.1007/978-3-319-91253-0_5",,"stat.ML cs.LG","http://arxiv.org/licenses/nonexclusive-distrib/1.0/","  We present here a new model and algorithm which performs an efficient Natural
gradient descent for Multilayer Perceptrons. Natural gradient descent was
originally proposed from a point of view of information geometry, and it
performs the steepest descent updates on manifolds in a Riemannian space. In
particular, we extend an approach taken by the ""Whitened neural networks""
model. We make the whitening process not only in feed-forward direction as in
the original model, but also in the back-propagation phase. Its efficacy is
shown by an application of this ""Bidirectional whitened neural networks"" model
to a handwritten character recognition data (MNIST data).
","[{""version"":""v1"",""created"":""Mon, 24 Apr 2017 11:18:58 GMT""}]","2018-07-11"
