"1704.07209","Marc Sedjro","Diogo Gomes, Levon Nurbekyan, and Marc Sedjro","Conservation laws arising in the study of forward-forward Mean-Field
  Games",,,,,"math.AP","http://arxiv.org/licenses/nonexclusive-distrib/1.0/","  We consider forward-forward Mean Field Game (MFG) models that arise in
numerical approximations of stationary MFGs. First, we establish a link between
these models and a class of hyperbolic conservation laws as well as certain
nonlinear wave equations. Second, we investigate existence and long-time
behavior of solutions for such models.
","[{""version"":""v1"",""created"":""Mon, 24 Apr 2017 13:29:22 GMT""}]","2017-04-25"
"1704.07210","Joshua Zahl","Nets Hawk Katz and Joshua Zahl","An improved bound on the Hausdorff dimension of Besicovitch sets in
  $\mathbb{R}^3$","65 pages, 11 figures. v3: Incorporates referee suggestions",,,,"math.CA","http://arxiv.org/licenses/nonexclusive-distrib/1.0/","  We prove that any Besicovitch set in $\mathbb{R}^3$ must have Hausdorff
dimension at least $5/2+\epsilon_0$ for some small constant $\epsilon_0>0$.
This follows from a more general result about the volume of unions of tubes
that satisfy the Wolff axioms. Our proof grapples with a new ""almost counter
example"" to the Kakeya conjecture, which we call the $SL_2$ example; this
object resembles a Besicovitch set that has Minkowski dimension 3 but Hausdorff
dimension $5/2$. We believe this example may be an interesting object for
future study.
","[{""version"":""v1"",""created"":""Mon, 24 Apr 2017 13:30:06 GMT""},{""version"":""v2"",""created"":""Sun, 17 Sep 2017 04:08:54 GMT""},{""version"":""v3"",""created"":""Mon, 21 May 2018 20:23:00 GMT""}]","2018-05-23"
"1704.07211","Aindri\'u Conroy Mr.","Aindri\'u Conroy","Infinite Derivative Gravity: A Ghost and Singularity-free Theory","PhD Thesis, April 2017, Lancaster University Physics Department, 146
  pages, 5 figures",,,,"gr-qc hep-th","http://arxiv.org/licenses/nonexclusive-distrib/1.0/","  The objective of this thesis is to present a viable extension of general
relativity free from cosmological singularities. A viable cosmology, in this
sense, is one that is free from ghosts, tachyons or exotic matter, while
staying true to the theoretical foundations of General Relativity such as
general covariance, as well as observed phenomenon such as the accelerated
expansion of the universe and inflationary behaviour at later times. To this
end, an infinite derivative extension of relativity is introduced, with the
gravitational action derived and the non-linear field equations calculated,
before being linearised around both Minkowski space and de Sitter space. The
theory is then constrained so as to avoid ghosts and tachyons by appealing to
the modified propagator, which is also derived. Finally, the Raychaudhuri
Equation is employed in order to describe the ghost-free, defocusing behaviour
around both Minkowski and de Sitter spacetimes, in the linearised regime.
","[{""version"":""v1"",""created"":""Mon, 24 Apr 2017 13:30:19 GMT""}]","2017-04-25"
"1704.07212","Ismail Aydogdu","Ismail Aydogdu","The Structure of One Weight Linear and Cyclic Codes Over Z2^r x
  (Z2+uZ2)^s",,,,,"cs.IT math.IT","http://arxiv.org/licenses/nonexclusive-distrib/1.0/","  Inspired by the Z2Z4-additive codes, linear codes over Z2^r x(Z2+uZ2)^s have
been introduced by Aydogdu et al. more recently. Although these family of codes
are similar to each other, linear codes over Z2^r x(Z2+uZ2)^s have some
advantages compared to Z2Z4-additive codes. A code is called constant
weight(one weight) if all the codewords have the same weight. It is well known
that constant weight or one weight codes have many important applications. In
this paper, we study the structure of one weight Z2Z2[u]-linear and cyclic
codes. We classify these type of one weight codes and also give some
illustrative examples.
","[{""version"":""v1"",""created"":""Mon, 24 Apr 2017 13:32:02 GMT""}]","2017-04-25"
"1704.07213","Yunhyung Cho","Yunhyung Cho, Yoosik Kim, and Yong-Geun Oh","Lagrangian fibers of Gelfand-Cetlin systems","84pages, lots of figures",,,,"math.SG","http://arxiv.org/licenses/nonexclusive-distrib/1.0/","  Motivated by the study of Nishinou-Nohara-Ueda on the Floer thoery of
Gelfand-Cetlin systems over complex partial flag manifolds, we provide a
complete description of the topology of Gelfand-Cetlin fibers. We prove that
all fibers are \emph{smooth} isotropic submanifolds and give a complete
description of the fiber to be Lagrangian in terms of combinatorics of
Gelfand-Cetlin polytope. Then we study (non-)displaceability of Lagrangian
fibers. After a few combinatorial and numercal tests for the displaceability,
using the bulk-deformation of Floer cohomology by Schubert cycles, we prove
that every full flag manifold $\mathcal{F}(n)$ ($n \geq 3$) with a monotone
Kirillov-Kostant-Souriau symplectic form carries a continuum of
non-displaceable Lagrangian tori which degenerates to a non-torus fiber in the
Hausdorff limit. In particular, the Lagrangian $S^3$-fiber in $\mathcal{F}(3)$
is non-displaceable the question of which was raised by Nohara-Ueda who
computed its Floer cohomology to be vanishing.
","[{""version"":""v1"",""created"":""Mon, 24 Apr 2017 13:33:42 GMT""},{""version"":""v2"",""created"":""Tue, 23 Jan 2018 13:53:47 GMT""}]","2018-01-24"
"1704.07214","Luca Izzo","L. Izzo, M. Della Valle, F. Matteucci, D. Romano, L. Pasquini, L.
  Vanzi, A. Jordan, J. M. Fernandez, P. Bluhm, R. Brahm, N. Espinoza, R.
  Williams","The nova V1369 Cen -- a short review","8 pages, 5 figures, 2 tables. To appear in the proceedings of the
  conference ""The Golden Age of Cataclysmic Variables and Related Objects -
  III"" held in Palermo, Italy, 7-12 September 2015",,,,"astro-ph.SR astro-ph.GA","http://arxiv.org/licenses/nonexclusive-distrib/1.0/","  We briefly present the spectroscopic evolution of the recent outburst of the
classical nova V1369 Cen, and the presence of a narrow absorption line
identified as due to the resonance of neutral lithium at 6708 \AA. We also
discuss the consequences for the chemical evolution of lithium in the Galaxy.
","[{""version"":""v1"",""created"":""Mon, 24 Apr 2017 13:34:00 GMT""}]","2017-04-25"
"1704.07215","Tuomas Orponen","David Bate and Tuomas Orponen","On the conformal dimension of product measures","27 pages. v2: incorporated minor referee comments. To appear in Proc.
  LMS","Proc. London Math. Soc. 117, Issue 2 (2018), 277-302","10.1112/plms.12130",,"math.CA math.MG","http://arxiv.org/licenses/nonexclusive-distrib/1.0/","  Given a compact set $E \subset \mathbb{R}^{d - 1}$, $d \geq 1$, write $K_{E}
:= [0,1] \times E \subset \mathbb{R}^{d}$. A theorem of C. Bishop and J. Tyson
states that any set of the form $K_{E}$ is minimal for conformal dimension: if
$(X,d)$ is a metric space and $f \colon K_{E} \to (X,d)$ is a quasisymmetric
homeomorphism, then $$\dim_{\mathrm{H}} f(K_{E}) \geq \dim_{\mathrm{H}}
K_{E}.$$ We prove that the measure-theoretic analogue of the result is not
true. For any $d \geq 2$ and $0 \leq s < d - 1$, there exist compact sets $E
\subset \mathbb{R}^{d - 1}$ with $0 < \mathcal{H}^{s}(E) < \infty$ such that
the conformal dimension of $\nu$, the restriction of the $(1 + s)$-dimensional
Hausdorff measure on $K_{E}$, is zero. More precisely, for any $\epsilon > 0$,
there exists a quasisymmetric embedding $F \colon K_{E} \to \mathbb{R}^{d}$
such that $\dim_{\mathrm{H}} F_{\sharp}\nu < \epsilon$.
","[{""version"":""v1"",""created"":""Mon, 24 Apr 2017 13:34:38 GMT""},{""version"":""v2"",""created"":""Mon, 12 Feb 2018 13:50:48 GMT""}]","2018-08-10"
"1704.07216","Helen Treharne","Jorden Whitefield and Liqun Chen and Frank Kargl and Andrew Paverd and
  Steve Schneider and Helen Treharne and Stephan Wesemeyer","Formal Analysis of V2X Revocation Protocols","16 pages, 4 figures",,,,"cs.CR","http://arxiv.org/licenses/nonexclusive-distrib/1.0/","  Research on vehicular networking (V2X) security has produced a range of
security mechanisms and protocols tailored for this domain, addressing both
security and privacy. Typically, the security analysis of these proposals has
largely been informal. However, formal analysis can be used to expose flaws and
ultimately provide a higher level of assurance in the protocols.
  This paper focusses on the formal analysis of a particular element of
security mechanisms for V2X found in many proposals: the revocation of
malicious or misbehaving vehicles from the V2X system by invalidating their
credentials. This revocation needs to be performed in an unlinkable way for
vehicle privacy even in the context of vehicles regularly changing their
pseudonyms. The REWIRE scheme by Forster et al. and its subschemes BASIC and
RTOKEN aim to solve this challenge by means of cryptographic solutions and
trusted hardware.
  Formal analysis using the TAMARIN prover identifies two flaws with some of
the functional correctness and authentication properties in these schemes. We
then propose Obscure Token (OTOKEN), an extension of REWIRE to enable
revocation in a privacy preserving manner. Our approach addresses the
functional and authentication properties by introducing an additional key-pair,
which offers a stronger and verifiable guarantee of successful revocation of
vehicles without resolving the long-term identity. Moreover OTOKEN is the first
V2X revocation protocol to be co-designed with a formal model.
","[{""version"":""v1"",""created"":""Mon, 24 Apr 2017 13:34:39 GMT""},{""version"":""v2"",""created"":""Sun, 6 Aug 2017 12:46:40 GMT""}]","2017-08-08"
"1704.07217","Xiaohu Ge","Shikuan Li, Zipeng Li, Xiaohu Ge, Jing Zhang, Minho Jo","Multi-hop Links Quality Analysis of 5G Enabled Vehicular Networks","6 pages, 5 figures, reject by IEEE Globecom2017, re-submitted to
  WCSP2017",,,,"cs.NI","http://creativecommons.org/licenses/by/4.0/","  With the emerging of the fifth generation (5G) mobile communication systems,
millimeter wave transmissions are believed to be a promising solution for
vehicular networks, especially in vehicle to vehicle (V2V) communications. In
millimeter wave V2V communications, different vehicular networking services
have different quality requirements for V2V multi-hop links. To evaluate the
quality of different V2V wireless links, a new link quality indicator is
proposed in this paper considering requirements of the real-time and the
reliability in V2V multi-hop links. Moreover, different weight factors are
configured to reflect the different requirements of different types of services
on real-time and reliability in the new quality indicator. Based on the
proposed link quality indicator, the relationship between V2V link quality and
one-hop communication distance under different vehicle densities is analyzed in
this paper. Simulation results indicate that the link quality is improved with
the increasing of vehicle density and there exists an optimal one-hop
communication distance for the link quality when the vehicle density is fixed.
","[{""version"":""v1"",""created"":""Mon, 24 Apr 2017 13:35:31 GMT""},{""version"":""v2"",""created"":""Wed, 2 Aug 2017 02:31:38 GMT""}]","2017-08-03"
"1704.07218","Matthias Ludewig","Matthias Ludewig","The Trace and the Mass of subcritical GJMS Operators","To appear in Differential Geometry and Applications","Differential Geometry and its Applications Volume 56, February
  2018, Pages 95-109","10.1016/j.difgeo.2017.11.005",,"math.DG math.AP","http://arxiv.org/licenses/nonexclusive-distrib/1.0/","  Let $L_g$ be the subcritical GJMS operator on an even-dimensional compact
manifold $(X, g)$ and consider the zeta-regularized trace
$\mathrm{Tr}_\zeta(L_g^{-1})$ of its inverse. We show that if $\ker L_g = 0$,
then the supremum of this quantity, taken over all metrics $g$ of fixed volume
in the conformal class, is always greater than or equal to the corresponding
quantity on the standard sphere. Moreover, we show that in the case that it is
strictly larger, the supremum is attained by a metric of constant mass. Using
positive mass theorems, we give some geometric conditions for this to happen.
","[{""version"":""v1"",""created"":""Mon, 24 Apr 2017 13:36:24 GMT""},{""version"":""v2"",""created"":""Wed, 26 Apr 2017 14:51:50 GMT""},{""version"":""v3"",""created"":""Fri, 26 May 2017 11:41:41 GMT""},{""version"":""v4"",""created"":""Fri, 17 Nov 2017 13:43:05 GMT""}]","2022-01-19"
"1704.07219","Alantha Newman","Ararat Harutyunyan, Tien-Nam Le, Alantha Newman, and St\'ephan
  Thomass\'e","Coloring dense digraphs","27 pages, 0 figure",,,,"math.CO","http://arxiv.org/licenses/nonexclusive-distrib/1.0/","  The chromatic number of a digraph $D$ is the minimum number of acyclic
subgraphs covering the vertex set of $D$. A tournament $H$ is a hero if every
$H$-free tournament $T$ has chromatic number bounded by a function of $H$.
Inspired by the celebrated Erd\H{o}s--Hajnal conjecture, Berger et al. fully
characterized the class of heroes in 2013. We extend this framework to dense
digraphs: A digraph $H$ is a superhero if every $H$-free digraph $D$ has
chromatic number bounded by a function of $H$ and $\alpha(D)$, the independence
number of the underlying graph of $D$. We prove here that a digraph is a
superhero if and only if it is a hero, and hence characterize all superheroes.
This answers a question of Aboulker, Charbit and Naserasr.
","[{""version"":""v1"",""created"":""Mon, 24 Apr 2017 13:36:27 GMT""},{""version"":""v2"",""created"":""Wed, 23 Oct 2019 11:54:33 GMT""}]","2019-10-24"
"1704.07220","Martijn Cohen","Martijn A. Cohen, Mingyun Yuan, Bas W. A. de Jong, Ewout Beukers, Sal
  J. Bosman, Gary A. Steele","A split-cavity design for the incorporation of a DC bias in a 3D
  microwave cavity",,,"10.1063/1.4981884",,"cond-mat.mes-hall","http://arxiv.org/licenses/nonexclusive-distrib/1.0/","  We report on a technique for applying a DC bias in a 3D microwave cavity. We
achieve this by isolating the two halves of the cavity with a dielectric and
directly using them as DC electrodes. As a proof of concept, we embed a
variable capacitance diode in the cavity and tune the resonant frequency with a
DC voltage, demonstrating the incorporation of a DC bias into the 3D cavity
with no measurable change in its quality factor at room temperature. We also
characterize the architecture at millikelvin temperatures and show that the
split cavity design maintains a quality factor $Q_\text{i} \sim 8.8 \times
10^5$, making it promising for future quantum applications.
","[{""version"":""v1"",""created"":""Mon, 24 Apr 2017 13:41:10 GMT""}]","2017-05-24"
"1704.07221","Elena Kochkina","Elena Kochkina, Maria Liakata, Isabelle Augenstein","Turing at SemEval-2017 Task 8: Sequential Approach to Rumour Stance
  Classification with Branch-LSTM","SemEval 2017 RumourEval: Determining rumour veracity and support for
  rumours (SemEval 2017 Task 8, Subtask A)",,,,"cs.CL cs.AI","http://arxiv.org/licenses/nonexclusive-distrib/1.0/","  This paper describes team Turing's submission to SemEval 2017 RumourEval:
Determining rumour veracity and support for rumours (SemEval 2017 Task 8,
Subtask A). Subtask A addresses the challenge of rumour stance classification,
which involves identifying the attitude of Twitter users towards the
truthfulness of the rumour they are discussing. Stance classification is
considered to be an important step towards rumour verification, therefore
performing well in this task is expected to be useful in debunking false
rumours. In this work we classify a set of Twitter posts discussing rumours
into either supporting, denying, questioning or commenting on the underlying
rumours. We propose a LSTM-based sequential model that, through modelling the
conversational structure of tweets, which achieves an accuracy of 0.784 on the
RumourEval test set outperforming all other systems in Subtask A.
","[{""version"":""v1"",""created"":""Mon, 24 Apr 2017 13:41:25 GMT""}]","2017-04-25"
"1704.07222","Yaojing Zhang","Yaojing Zhang, Liang Wang, Zhenzhou Cheng, and Hon Ki Tsang","Forward stimulated Brillouin scattering in silicon microring resonators",,"Appl. Phys. Lett. 111 (2017) 041104","10.1063/1.4996367",,"physics.optics","http://arxiv.org/licenses/nonexclusive-distrib/1.0/","  Stimulated Brillouin scattering (SBS) has been demonstrated in silicon
waveguides in recent years. However, due to the weak interaction between
photons and acoustic phonons in these waveguides, long interaction length is
typically necessary. Here, we experimentally show that forward stimulated
Brillouin scattering in a short interaction length of a 20 um radius silicon
microring resonator could give 1.2 dB peak gain at only 10mW coupled pump
power. The experimental results demonstrate that both optical and acoustic
modes can have efficient interaction in a short interaction length. The
observed Brillouin gain varies with coupled pump power in good agreement with
theoretical prediction. The work shows the potential of SBS in silicon for
moving the demonstrated fiber SBS applications to the integrated silicon
photonics platform.
","[{""version"":""v1"",""created"":""Mon, 24 Apr 2017 13:42:01 GMT""}]","2017-08-02"
"1704.07223","Jack Fitzsimons","Jack Fitzsimons, Diego Granziol, Kurt Cutajar, Michael Osborne,
  Maurizio Filippone, Stephen Roberts","Entropic Trace Estimates for Log Determinants","16 pages, 4 figures, 2 tables, 2 algorithms",,,,"cs.NA cs.IT math.IT stat.CO stat.ML","http://arxiv.org/licenses/nonexclusive-distrib/1.0/","  The scalable calculation of matrix determinants has been a bottleneck to the
widespread application of many machine learning methods such as determinantal
point processes, Gaussian processes, generalised Markov random fields, graph
models and many others. In this work, we estimate log determinants under the
framework of maximum entropy, given information in the form of moment
constraints from stochastic trace estimation. The estimates demonstrate a
significant improvement on state-of-the-art alternative methods, as shown on a
wide variety of UFL sparse matrices. By taking the example of a general Markov
random field, we also demonstrate how this approach can significantly
accelerate inference in large-scale learning methods involving the log
determinant.
","[{""version"":""v1"",""created"":""Mon, 24 Apr 2017 13:45:21 GMT""}]","2017-04-25"
"1704.07226","Marc Serra-Garcia","Marc Serra-Garcia, Miguel Moler\'on, Chiara Daraio","Tunable, synchronized frequency down-conversion in magnetic lattices
  with defects",,,"10.1098/rsta.2017.0137",,"physics.app-ph","http://arxiv.org/licenses/nonexclusive-distrib/1.0/","  We study frequency conversion in nonlinear mechanical lattices, focusing on a
chain of magnets as a model system. We show that by inserting mass defects at
suitable locations, we can introduce localized vibrational modes that
nonlinearly couple to extended lattice modes. The nonlinear interaction
introduces an energy transfer from the high-frequency localized modes to a
low-frequency extended mode. This system is capable of autonomously converting
energy between highly tunable input and output frequencies, which need not be
related by integer harmonic or subharmonic ratios. It is also capable of
obtaining energy from multiple sources at different frequencies with a tunable
output phase, due to the defect synchronization provided by the extended mode.
Our lattice is a purely mechanical analog of an opto-mechanical system, where
the localized modes play the role of the electromagnetic field, and the
extended mode plays the role of the mechanical degree of freedom.
","[{""version"":""v1"",""created"":""Mon, 24 Apr 2017 13:47:43 GMT""}]","2018-08-15"
"1704.07227","Anna Isaeva","Florian Pielnhofer, Tatiana V. Menshchikova, Igor P. Rusinov,
  Alexander Zeugner, Irina Yu. Sklyadneva, Rolf Heid, Klaus-Peter Bohnen, Pavlo
  Golub, Alexey I. Baranov, Eugeni V. Chulkov, Arno Pfitzner, Michael Ruckd,
  and Anna Isaeva","Designing 3D topological insulators by 2D-Xene (X = Ge, Sn) sheet
  functionalization in the GaGeTe-type structures","J. Mater. Chem. C, 2017, Accepted Manuscript",,"10.1039/C7TC00390K",,"cond-mat.mtrl-sci","http://arxiv.org/licenses/nonexclusive-distrib/1.0/","  State-of-the-art theoretical studies anticipate a 2D Dirac system in the
""heavy"" analogues of graphene, free-standing buckled honeycomb-like Xenes (X =
Si, Ge, Sn, Pb, etc.). Herewith a structurally and electronically resembling 2D
sheet, which can be regarded as Xene functionalized by covalent interactions
within a 3D periodic structure, is predicted to constitute a 3D strong
topological insulator with Z2 = 1;(111) (primitive cell, rhombohedral setting)
in the structural family of layered AXTe (A = Ga, In; X = Ge, Sn) bulk
materials. The host structure GaGeTe is a long-known bulk semiconductor; the
""heavy"", isostructural analogues InSnTe and GaSnTe are predicted to be
dynamically stable. Spin-orbit interaction in InSnTe opens a small topological
band gap with inverted gap edges that are mainly composed of the In-5s and
Te-5p states. Our simulations classify GaSnTe as a semimetal with topological
properties, whereas the verdict for GaGeTe is not conclusive and urges further
experimental verification. AXTe family structures can be regarded as stacks of
2D layered cut-outs from a zincblende-type lattice and are composed by elements
that are broadly used in modern semiconductor devices; hence they represent an
accessible, attractive alternative for applications in spintronics. The layered
nature of AXTe should facilitate exfoliation of its hextuple layers and
manufacture of heterostuctures.
","[{""version"":""v1"",""created"":""Mon, 24 Apr 2017 13:48:44 GMT""}]","2017-04-25"
"1704.07228","Kiran Koshy Thekumparampil","Sahand Negahban and Sewoong Oh and Kiran K. Thekumparampil and Jiaming
  Xu","Learning from Comparisons and Choices","77 pages, 12 figures; added new experiments and references. arXiv
  admin note: substantial text overlap with arXiv:1506.07947",,,,"stat.ML cs.LG","http://arxiv.org/licenses/nonexclusive-distrib/1.0/","  When tracking user-specific online activities, each user's preference is
revealed in the form of choices and comparisons. For example, a user's purchase
history is a record of her choices, i.e. which item was chosen among a subset
of offerings. A user's preferences can be observed either explicitly as in
movie ratings or implicitly as in viewing times of news articles. Given such
individualized ordinal data in the form of comparisons and choices, we address
the problem of collaboratively learning representations of the users and the
items. The learned features can be used to predict a user's preference of an
unseen item to be used in recommendation systems. This also allows one to
compute similarities among users and items to be used for categorization and
search. Motivated by the empirical successes of the MultiNomial Logit (MNL)
model in marketing and transportation, and also more recent successes in word
embedding and crowdsourced image embedding, we pose this problem as learning
the MNL model parameters that best explain the data. We propose a convex
relaxation for learning the MNL model, and show that it is minimax optimal up
to a logarithmic factor by comparing its performance to a fundamental lower
bound. This characterizes the minimax sample complexity of the problem, and
proves that the proposed estimator cannot be improved upon other than by a
logarithmic factor. Further, the analysis identifies how the accuracy depends
on the topology of sampling via the spectrum of the sampling graph. This
provides a guideline for designing surveys when one can choose which items are
to be compared. This is accompanied by numerical simulations on synthetic and
real data sets, confirming our theoretical predictions.
","[{""version"":""v1"",""created"":""Mon, 24 Apr 2017 13:49:14 GMT""},{""version"":""v2"",""created"":""Sun, 30 Dec 2018 10:26:16 GMT""}]","2019-01-01"
"1704.07229","Zhiqiang Tan","Zhiqiang Tan, Cun-Hui Zhang","Penalized Estimation in Additive Regression with High-Dimensional Data",,,,,"math.ST stat.TH","http://arxiv.org/licenses/nonexclusive-distrib/1.0/","  Additive regression provides an extension of linear regression by modeling
the signal of a response as a sum of functions of covariates of relatively low
complexity. We study penalized estimation in high-dimensional nonparametric
additive regression where functional semi-norms are used to induce smoothness
of component functions and the empirical $L_2$ norm is used to induce sparsity.
The functional semi-norms can be of Sobolev or bounded variation types and are
allowed to be different amongst individual component functions. We establish
new oracle inequalities for the predictive performance of such methods under
three simple technical conditions: a sub-gaussian condition on the noise, a
compatibility condition on the design and the functional classes under
consideration, and an entropy condition on the functional classes. For random
designs, the sample compatibility condition can be replaced by its population
version under an additional condition to ensure suitable convergence of
empirical norms. In homogeneous settings where the complexities of the
component functions are of the same order, our results provide a spectrum of
explicit convergence rates, from the so-called slow rate without requiring the
compatibility condition to the fast rate under the hard sparsity or certain
$L_q$ sparsity to allow many small components in the true regression function.
These results significantly broadens and sharpens existing ones in the
literature.
","[{""version"":""v1"",""created"":""Mon, 24 Apr 2017 13:50:11 GMT""}]","2017-04-25"
