"1704.07035","Kohei Motegi","Kohei Motegi","Elliptic supersymmetric integrable model and multivariable elliptic
  functions","27 pages, 9 figures","Prog. Theor. Exp. Phys. 2017, 123A01","10.1093/ptep/ptx159",,"math-ph hep-th math.MP nlin.SI","http://arxiv.org/licenses/nonexclusive-distrib/1.0/","  We investigate the elliptic integrable model introduced by Deguchi and
Martin, which is an elliptic extension of the Perk-Schultz model. We introduce
and study a class of partition functions of the elliptic model by using the
Izergin-Korepin analysis. We show that the partition functions are expressed as
a product of elliptic factors and elliptic Schur-type symmetric functions. This
result resembles the recent works by number theorists in which the
correspondence between the partition functions of trigonometric models and the
product of the deformed Vandermonde determinant and Schur functions were
established.
","[{""version"":""v1"",""created"":""Mon, 24 Apr 2017 04:19:18 GMT""},{""version"":""v2"",""created"":""Wed, 25 Oct 2017 08:08:10 GMT""}]","2017-12-27"
"1704.07036","Robert J Chapman","Robert J. Chapman, Akib Karim, Zixin Huang, Steven T. Flammia, Marco
  Tomamichel and Alberto Peruzzo","Beating the Classical Limits of Information Transmission using a Quantum
  Decoder",,"Phys. Rev. A 97, 012315 (2018)","10.1103/PhysRevA.97.012315",,"quant-ph","http://arxiv.org/licenses/nonexclusive-distrib/1.0/","  Encoding schemes and error-correcting codes are widely used in information
technology to improve the reliability of data transmission over real-world
communication channels. Quantum information protocols can further enhance the
performance in data transmission by encoding a message in quantum states,
however, most proposals to date have focused on the regime of a large number of
uses of the noisy channel, which is unfeasible with current quantum technology.
We experimentally demonstrate quantum enhanced communication over an amplitude
damping noisy channel with only two uses of the channel per bit and a single
entangling gate at the decoder. By simulating the channel using a photonic
interferometric setup, we experimentally increase the reliability of
transmitting a data bit by greater than 20% for a certain damping range over
classically sending the message twice. We show how our methodology can be
extended to larger systems by simulating the transmission of a single bit with
up to eight uses of the channel and a two-bit message with three uses of the
channel, predicting a quantum enhancement in all cases.
","[{""version"":""v1"",""created"":""Mon, 24 Apr 2017 04:23:26 GMT""},{""version"":""v2"",""created"":""Wed, 7 Feb 2018 01:46:30 GMT""}]","2018-02-08"
"1704.07037","Haijun Zhang","H. Zhang, S. Huang, C. Jiang, K. Long, V. C. M. Leung, and H. Vincent
  Poor","Energy Efficient User Association and Power Allocation in Millimeter
  Wave Based Ultra Dense Networks with Energy Harvesting Base Stations","to appear, IEEE Journal on Selected Areas in Communications, 2017",,,,"cs.IT math.IT","http://arxiv.org/licenses/nonexclusive-distrib/1.0/","  Millimeter wave (mmWave) communication technologies have recently emerged as
an attractive solution to meet the exponentially increasing demand on mobile
data traffic. Moreover, ultra dense networks (UDNs) combined with mmWave
technology are expected to increase both energy efficiency and spectral
efficiency. In this paper, user association and power allocation in mmWave
based UDNs is considered with attention to load balance constraints, energy
harvesting by base stations, user quality of service requirements, energy
efficiency, and cross-tier interference limits. The joint user association and
power optimization problem is modeled as a mixed-integer programming problem,
which is then transformed into a convex optimization problem by relaxing the
user association indicator and solved by Lagrangian dual decomposition. An
iterative gradient user association and power allocation algorithm is proposed
and shown to converge rapidly to an optimal point. The complexity of the
proposed algorithm is analyzed and the effectiveness of the proposed scheme
compared with existing methods is verified by simulations.
","[{""version"":""v1"",""created"":""Mon, 24 Apr 2017 04:33:57 GMT""}]","2017-04-25"
"1704.07038","Haijun Zhang","H. Zhang, N. Liu, X. Chu, K. Long, A. Aghvami, and V. C. M. Leung","Network Slicing Based 5G and Future Mobile Networks: Mobility, Resource
  Management, and Challenges","to appear in IEEE Communications Magazine",,,,"cs.IT math.IT","http://arxiv.org/licenses/nonexclusive-distrib/1.0/","  The fifth-generation (5G) networks are expected to be able to satisfy users'
different quality-of-service (QoS) requirements. Network slicing is a promising
technology for 5G networks to provide services tailored for users' specific QoS
demands. Driven by the increased massive wireless data traffic from different
application scenarios, efficient resource allocation schemes should be
exploited to improve the flexibility of network resource allocation and
capacity of 5G networks based on network slicing. Due to the diversity of 5G
application scenarios, new mobility management schemes are greatly needed to
guarantee seamless handover in network slicing based 5G systems. In this
article, we introduce a logical architecture for network slicing based 5G
systems, and present a scheme for managing mobility between different access
networks, as well as a joint power and subchannel allocation scheme in
spectrum-sharing two-tier systems based on network slicing, where both the
co-tier interference and cross-tier interference are taken into account.
Simulation results demonstrate that the proposed resource allocation scheme can
flexibly allocate network resources between different slices in 5G systems.
Finally, several open issues and challenges in network slicing based 5G
networks are discussed, including network reconstruction, network slicing
management and cooperation with other 5G technologies.
","[{""version"":""v1"",""created"":""Mon, 24 Apr 2017 04:34:19 GMT""}]","2017-04-25"
"1704.07039","Sami Assaf","Sami Assaf","Dual equivalence graphs II: Transformations on locally Schur positive
  graphs","34 pages, 43 figures. arXiv admin note: text overlap with
  arXiv:1005.3759",,,,"math.CO","http://arxiv.org/licenses/nonexclusive-distrib/1.0/","  Dual equivalence graphs are a powerful tool in symmetric function theory that
provide a general framework for proving that a given quasisymmetric function is
symmetric and Schur positive. In this paper, we study a larger family of graphs
that includes dual equivalence graphs and define maps that, in certain cases,
transform graphs in this larger family into dual equivalence graphs. This
allows us to broaden the applications of dual equivalence graphs and points the
way toward a broader theory that could solve many important, long-standing
Schur positivity problems.
","[{""version"":""v1"",""created"":""Mon, 24 Apr 2017 04:43:57 GMT""}]","2017-04-25"
"1704.07040","Daniel Eck","Daniel J. Eck","Bootstrapping for multivariate linear regression models",,,,,"math.ST stat.ME stat.TH","http://arxiv.org/licenses/nonexclusive-distrib/1.0/","  The multivariate linear regression model is an important tool for
investigating relationships between several response variables and several
predictor variables. The primary interest is in inference about the unknown
regression coefficient matrix. We propose multivariate bootstrap techniques as
a means for making inferences about the unknown regression coefficient matrix.
These bootstrapping techniques are extensions of those developed in Freedman
(1981), which are only appropriate for univariate responses. Extensions to the
multivariate linear regression model are made without proof. We formalize this
extension and prove its validity. A real data example and two simulated data
examples which offer some finite sample verification of our theoretical results
are provided.
","[{""version"":""v1"",""created"":""Mon, 24 Apr 2017 04:55:16 GMT""},{""version"":""v2"",""created"":""Tue, 12 Sep 2017 16:11:19 GMT""}]","2017-09-13"
"1704.07041","Stefano Vidussi","Stefan Friedl, Stefano Vidussi","Virtual algebraic fibrations of K\""ahler groups","Substantial revision, including a change of title to better reflect
  the content. To appear in Nagoya Math. J",,"10.1017/nmj.2019.32",,"math.GT math.AG math.GR","http://arxiv.org/licenses/nonexclusive-distrib/1.0/","  This paper stems from the observation (arising from work of T. Delzant) that
""most"" K\""ahler groups virtually algebraically fiber, i.e. admit a finite index
subgroup that maps onto $\Bbb{Z}$ with finitely generated kernel. For the
remaining ones, the Albanese dimension of all finite index subgroups is at most
one, i.e. they have virtual Albanese dimension $va(G) \leq 1$. We show that the
existence of algebraic fibrations has implications in the study of coherence
and higher BNSR invariants of the fundamental group of aspherical K\""ahler
surfaces. The class of K\""ahler groups with $va(G) \leq 1$ includes virtual
surface groups. Further examples exist; nonetheless they exhibit a strong
relation with surface groups. In fact, we show that the Green--Lazarsfeld sets
of groups with $va(G) = 1$ (virtually) coincide with those of surface groups,
and furthermore that the only virtually RFRS groups with $va(G) = 1$ are
virtually surface groups.
","[{""version"":""v1"",""created"":""Mon, 24 Apr 2017 05:03:41 GMT""},{""version"":""v2"",""created"":""Tue, 26 Nov 2019 01:07:03 GMT""}]","2020-02-19"
"1704.07042","Yunus Zeytuncu","Zeljko Cuckovic, Sonmez Sahutoglu, Yunus E. Zeytuncu","A local weighted Axler-Zheng theorem in $\mathbb{C}^n$","Minor editorial changes, to appear in Pacific J. Math","Pacific J. Math. 294 (2018), no. 1, 89-106","10.2140/pjm.2018.294.89",,"math.CV math.FA","http://arxiv.org/licenses/nonexclusive-distrib/1.0/","  The well-known Axler-Zheng theorem characterizes compactness of finite sums
of finite products of Toeplitz operators on the unit disk in terms of the
Berezin transform of these operators. Subsequently this theorem was generalized
to other domains and appeared in different forms, including domains in
$\mathbb{C}^n$ on which the $\overline{\partial}$-Neumann operator $N$ is
compact. In this work we remove the assumption on $N$, and we study weighted
Bergman spaces on smooth bounded pseudoconvex domains. We prove a local version
of the Axler-Zheng theorem characterizing compactness of Toeplitz operators in
the algebra generated by symbols continuous up to the boundary in terms of the
behavior of the Berezin transform at strongly pseudoconvex points. We employ a
Forelli-Rudin type inflation method to handle the weights.
","[{""version"":""v1"",""created"":""Mon, 24 Apr 2017 05:06:41 GMT""},{""version"":""v2"",""created"":""Tue, 26 Sep 2017 00:04:14 GMT""},{""version"":""v3"",""created"":""Fri, 24 Nov 2017 15:28:58 GMT""}]","2021-03-30"
"1704.07043","Xing-Qiu Chen","Jiangxu Li, Hui Ma, Shaobo Feng, Sami Ullah, Ronghan Li, Junhua Dong,
  Dianzhong Li, Yiyi Li, Xing-Qiu Chen","Topological nodal line states and a potential catalyst of hydrogen
  evolution in the TiSi family","8 pages, 5 figures","Science China Materials, 61, 23, (2018)","10.1007/s40843-017-9178-4",,"cond-mat.mtrl-sci","http://arxiv.org/licenses/nonexclusive-distrib/1.0/","  Topological nodal line (DNL) semimetals, formed by a closed loop of the
inverted bands in the bulk, result in the nearly flat drumhead-like surface
states with a high electronic density near the Fermi level. The high catalytic
active sites associated with the high electronic densities, the good carrier
mobility, and the proper thermodynamic stabilities with $\Delta
G_{H^*}$$\approx$0 are currently the prerequisites to seek the alternative
candidates to precious platinum for catalyzing electrochemical hydrogen (HER)
production from water. Within this context, it is natural to consider whether
or not the DNLs are a good candidate for the HER because its non-trivial
surface states provide a robust platform to activate possibly chemical
reactions. Here, through first-principles calculations we reported on a new DNL
TiSi-type family with a closed Dirac nodal line consisting of the linear band
crossings in the $k_y$ = 0 plane. The hydrogen adsorption on the (010) and
(110) surfaces yields the $\Delta G_{H^*}$ to be almost zero. The topological
charge carries have been revealed to participate in this HER. The results are
highlighting that TiSi not only is a promising catalyst for the HER but also
paves a new routine to design topological quantum catalyst utilizing the
topological DNL-induced surface bands as active sites, rather than edge sites-,
vacancy-, dopant-, strain-, or heterostructure-created active sites.
","[{""version"":""v1"",""created"":""Mon, 24 Apr 2017 05:19:16 GMT""}]","2018-02-28"
"1704.07044","Soham Bhattacharyya","Soham Bhattacharyya (1), S. Shankaranarayanan (1) ((1) IISER-TVM)","Quasinormal modes as a distinguisher between general relativity and f(R)
  gravity","9 pages, 2 figures, version as accepted in Physical Review D","Phys. Rev. D 96, 064044 (2017)","10.1103/PhysRevD.96.064044",,"gr-qc astro-ph.CO hep-th","http://arxiv.org/licenses/nonexclusive-distrib/1.0/","  Quasi-Normal Modes (QNM) or ringdown phase of gravitational waves provide
critical information about the structure of compact objects like Black Holes.
Thus, QNMs can be a tool to test General Relativity (GR) and possible
deviations from it. In the case of GR, it is known for a long time that a
relation between two types of Black Hole perturbations: scalar (Zerilli) and
vector (Regge-Wheeler), leads to an equal share of emitted gravitational
energy. With the direct detection of Gravitational waves, it is now natural to
ask: whether the same relation (between scalar and vector perturbations) holds
for modified gravity theories? If not, whether one can use this as a way to
probe deviations from General Relativity. As a first step, we show explicitly
that the above relation between Regge-Wheeler and Zerilli breaks down for a
general f (R) model, and hence the two perturbations do not share equal amounts
of emitted gravitational energy. We discuss the implication of this imbalance
on observations and the no-hair conjecture.
","[{""version"":""v1"",""created"":""Mon, 24 Apr 2017 05:23:42 GMT""},{""version"":""v2"",""created"":""Wed, 30 Aug 2017 14:31:28 GMT""}]","2017-10-04"
"1704.07045","Mahender Singh","Valeriy G. Bardakov, Mikhail V. Neshchadim and Mahender Singh","Automorphisms of pure braid Groups","17 pp","Monatshefte fuer Mathematik 187 (2018), 1--19","10.1007/s00605-017-1073-7",,"math.GR math.GT","http://arxiv.org/licenses/nonexclusive-distrib/1.0/","  In this paper, we investigate the structure of the automorphism groups of
pure braid groups. We prove that, for $n>3$, $\Aut(P_n)$ is generated by the
subgroup $\Aut_c(P_n)$ of central automorphisms of $P_n$, the subgroup
$\Aut(B_n)$ of restrictions of automorphisms of $B_n$ on $P_n$ and one extra
automorphism $w_n$. We also investigate the lifting and extension problem for
automorphisms of some well-known exact sequences arising from braid groups, and
prove that that answers are negative in most cases. Specifically, we prove that
no non-trivial central automorphism of $P_n$ can be extended to an automorphism
of $B_n$.
","[{""version"":""v1"",""created"":""Mon, 24 Apr 2017 05:30:17 GMT""}]","2021-07-19"
"1704.07046","Shuangxi Zhang Mr","Shuangxi Zhang","Guiding-center kinetic model based on the assumption of homogeneous
  distribution over gyrophase",,,,,"physics.plasm-ph","http://arxiv.org/licenses/nonexclusive-distrib/1.0/","  The purpose of this paper is to develop a simplified model as the modeling of
the magnetized plasmas. The starting point is an assumption that the
distribution of the ensemble of charged particles in the same species is
homogeneous over gyrophase. The particles in this ensemble are located at the
same guiding-cneter position $(\mathbf{X},\mu,U)$. Then, a fundamental
Lagrangian differential 1-form is developed. It contains all particles in the
magnetized plasma system as well as the Coulomb pair force between particles
instead of field-particle interaction used in conventional gyrokinetic models.
By transforming the Lagrangian 1-form to the new one on guiding-center
coordinate with the ensemble summation over gyrophase, the new fundamental
1-form is naturally independent of gyrophase of each particle based on the
homogeneous distribution over gyrophase, and it determines the dynamics of all
particles on the new coordinates. By using a coarse-grained scheme, this new
1-form can be modeled by the guiding-center kinetic model.
","[{""version"":""v1"",""created"":""Mon, 24 Apr 2017 05:36:18 GMT""},{""version"":""v2"",""created"":""Fri, 5 May 2017 01:31:56 GMT""},{""version"":""v3"",""created"":""Mon, 15 May 2017 05:01:30 GMT""},{""version"":""v4"",""created"":""Wed, 17 May 2017 05:30:19 GMT""},{""version"":""v5"",""created"":""Sun, 23 Jul 2017 13:31:40 GMT""}]","2017-07-25"
"1704.07047","Deng Cai","Deng Cai, Hai Zhao, Zhisong Zhang, Yuan Xin, Yongjian Wu, Feiyue Huang","Fast and Accurate Neural Word Segmentation for Chinese","To appear in ACL2017",,,,"cs.CL","http://arxiv.org/licenses/nonexclusive-distrib/1.0/","  Neural models with minimal feature engineering have achieved competitive
performance against traditional methods for the task of Chinese word
segmentation. However, both training and working procedures of the current
neural models are computationally inefficient. This paper presents a greedy
neural word segmenter with balanced word and character embedding inputs to
alleviate the existing drawbacks. Our segmenter is truly end-to-end, capable of
performing segmentation much faster and even more accurate than
state-of-the-art neural models on Chinese benchmark datasets.
","[{""version"":""v1"",""created"":""Mon, 24 Apr 2017 05:50:29 GMT""}]","2017-04-25"
"1704.07048","Sabyasachi Chakraborty","Sabyasachi Chakraborty, Saurabh Niyogi, K. Sridhar","Constraining compressed versions of MUED and MSSM using soft tracks at
  the LHC","26 pages, 7 figures. Minor modifications in the text, references
  added, accepted for publication in JHEP",,"10.1007/JHEP07(2017)105",,"hep-ph","http://arxiv.org/licenses/nonexclusive-distrib/1.0/","  A compressed spectrum is an anticipated hideout for many beyond standard
model scenarios. Such a spectrum naturally arises in the minimal universal
extra dimension framework and also in supersymmetric scenarios. Low $p_T$
leptons and jets are characteristic features of such situations. Hence, a
monojet with $\not E_T$ has been the conventional signal at the Large Hadron
Collider (LHC). However, we stress that inclusion of $p_T$-binned track
observables from such soft objects provide very efficient discrimination of new
physics signals against various SM backgrounds. We consider two benchmark
points each for minimal universal extra dimension (MUED) and minimal
supersymmetric standard model (MSSM) scenarios. We perform a detailed cut-based
and multivariate analysis (MVA) to show that the new physics parameter space
can be probed in the ongoing run of LHC at 13 TeV center-of-mass energy with an
integrated luminosity $\sim$ 20-50 fb$^{-1}$. When studied in conjunction with
the dark matter relic density constraint assuming standard cosmology, we find
that compressed MUED (with $\Lambda R=2$) can be already excluded from the
existing data. Also, MVA turns out to be a better technique than regular
cut-based analysis since tracks provide uncorrelated observables which would
extract more information from an event.
","[{""version"":""v1"",""created"":""Mon, 24 Apr 2017 05:54:26 GMT""},{""version"":""v2"",""created"":""Wed, 19 Jul 2017 16:28:11 GMT""}]","2017-09-13"
"1704.07049","ByeoungDo Kim","ByeoungDo Kim, Chang Mook Kang, Seung Hi Lee, Hyunmin Chae, Jaekyum
  Kim, Chung Choo Chung, and Jun Won Choi","Probabilistic Vehicle Trajectory Prediction over Occupancy Grid Map via
  Recurrent Neural Network",,,,,"cs.LG","http://arxiv.org/licenses/nonexclusive-distrib/1.0/","  In this paper, we propose an efficient vehicle trajectory prediction
framework based on recurrent neural network. Basically, the characteristic of
the vehicle's trajectory is different from that of regular moving objects since
it is affected by various latent factors including road structure, traffic
rules, and driver's intention. Previous state of the art approaches use
sophisticated vehicle behavior model describing these factors and derive the
complex trajectory prediction algorithm, which requires a system designer to
conduct intensive model optimization for practical use. Our approach is
data-driven and simple to use in that it learns complex behavior of the
vehicles from the massive amount of trajectory data through deep neural network
model. The proposed trajectory prediction method employs the recurrent neural
network called long short-term memory (LSTM) to analyze the temporal behavior
and predict the future coordinate of the surrounding vehicles. The proposed
scheme feeds the sequence of vehicles' coordinates obtained from sensor
measurements to the LSTM and produces the probabilistic information on the
future location of the vehicles over occupancy grid map. The experiments
conducted using the data collected from highway driving show that the proposed
method can produce reasonably good estimate of future trajectory.
","[{""version"":""v1"",""created"":""Mon, 24 Apr 2017 05:58:33 GMT""},{""version"":""v2"",""created"":""Fri, 1 Sep 2017 03:04:26 GMT""}]","2017-09-04"
"1704.07050","Michael Bloodgood","Michael Bloodgood and Benjamin Strauss","Using Global Constraints and Reranking to Improve Cognates Detection","10 pages, 6 figures, 6 tables; published in the Proceedings of the
  55th Annual Meeting of the Association for Computational Linguistics, pages
  1983-1992, Vancouver, Canada, July 2017","In Proceedings of the 55th Annual Meeting of the Association for
  Computational Linguistics, pages 1983-1992, Vancouver, Canada, July 2017.
  Association for Computational Linguistics","10.18653/v1/P17-1181",,"cs.CL cs.LG stat.ML","http://arxiv.org/licenses/nonexclusive-distrib/1.0/","  Global constraints and reranking have not been used in cognates detection
research to date. We propose methods for using global constraints by performing
rescoring of the score matrices produced by state of the art cognates detection
systems. Using global constraints to perform rescoring is complementary to
state of the art methods for performing cognates detection and results in
significant performance improvements beyond current state of the art
performance on publicly available datasets with different language pairs and
various conditions such as different levels of baseline state of the art
performance and different data size conditions, including with more realistic
large data size conditions than have been evaluated with in the past.
","[{""version"":""v1"",""created"":""Mon, 24 Apr 2017 06:04:50 GMT""},{""version"":""v2"",""created"":""Sat, 19 Aug 2017 20:19:58 GMT""}]","2017-08-22"
"1704.07051","Huicheng Yin","Daoyin He, Ingo Witt and Huicheng Yin","On semilinear Tricomi equations with critical exponents or in two space
  dimensions","28 pages",,,,"math.AP","http://arxiv.org/licenses/nonexclusive-distrib/1.0/","  This paper is a complement of our recent works on the semilinear Tricomi
equations in [8] and[9].
","[{""version"":""v1"",""created"":""Mon, 24 Apr 2017 06:17:11 GMT""}]","2017-04-25"
"1704.07052","Meysam Alishahi","Roya Abyazi Sani and Meysam Alishahi","A new lower bound for the chromatic number of general Kneser hypergraphs","Accepted for publication in European Journal of Combinatorics",,"10.1016/j.ejc.2018.03.007",,"math.CO math.AT","http://creativecommons.org/licenses/by-nc-sa/4.0/","  A general Kneser hypergraph ${\rm KG}^r(\mathcal{H})$ is an $r$-uniform
hypergraph that somehow encodes the edge intersections of a ground hypergraph
$\mathcal{H}$. The colorability defect of $\mathcal{H}$ is a combinatorial
parameter providing a lower bound for the chromatic number of ${\rm
KG}^r(\mathcal{H})$ which is addressed in a series of works by Dol'nikov
[Sibirskii Matematicheskii Zhurnal, 1988}], K\v{r}\'{\i}\v{z} [Transaction of
the American Mathematical Society, 1992], and Ziegler~[Inventiones
Mathematicae, 2002]. In this paper, we define a new combinatorial parameter,
the equitable colorability defect of hypergraphs, which provides some common
improvements of these works. Roughly speaking, we propose a new lower bound for
the chromatic number of general Kneser hypergraphs which substantially improves
Ziegler's lower bound. It is always as good as Ziegler's lower bound and we
provide several families of hypergraphs for which the difference between these
two lower bounds is arbitrary large. This specializes to a substantial
improvement of the Dol'nikov-K\v{r}\'{\i}\v{z} lower bound for the chromatic
number of general Kneser hypergraphs as well. Furthermore, we prove a result
ensuring the existence of a colorful subhypergraph in any proper coloring of
general Kneser hypergraphs which strengthens Meunier's result [The Electronic
Journal of Combinatorics, 2014].
","[{""version"":""v1"",""created"":""Mon, 24 Apr 2017 06:23:14 GMT""},{""version"":""v2"",""created"":""Fri, 6 Apr 2018 12:01:47 GMT""}]","2018-04-09"
