"1704.06945","Diego Perez Liebana Dr.","Kamolwan Kunanusont and Simon M. Lucas and Diego Perez-Liebana","General Video Game AI: Learning from Screen Capture","Proceedings of the IEEE Conference on Evolutionary Computation 2017",,,,"cs.AI","http://arxiv.org/licenses/nonexclusive-distrib/1.0/","  General Video Game Artificial Intelligence is a general game playing
framework for Artificial General Intelligence research in the video-games
domain. In this paper, we propose for the first time a screen capture learning
agent for General Video Game AI framework. A Deep Q-Network algorithm was
applied and improved to develop an agent capable of learning to play different
games in the framework. After testing this algorithm using various games of
different categories and difficulty levels, the results suggest that our
proposed screen capture learning agent has the potential to learn many
different games using only a single learning algorithm.
","[{""version"":""v1"",""created"":""Sun, 23 Apr 2017 16:08:06 GMT""}]","2017-04-25"
"1704.06946","Szil\'ard L\'aszl\'o Ph.D.","Szil\'ard L\'aszl\'o","A Primal-Dual Approach of Weak Vector Equilibrium Problems","20 pages",,,,"math.FA","http://arxiv.org/licenses/nonexclusive-distrib/1.0/","  In this paper we provide some new sufficient conditions that ensure the
existence of the solution of a weak vector equilibrium problem in Hausdorff
topological vector spaces ordered by a cone. Further, we introduce a dual
problem and we provide conditions that assure the solution set of the original
problem and its dual coincide. We show that many known problems from the
literature can be treated in our primal-dual model. We provide several
coercivity conditions in order to obtain solution existence of the primal-dual
problems without compactness assumption. We pay a special attention to the case
when the base space is a reflexive Banach space. We apply the results obtained
to perturbed vector equilibrium problems.
","[{""version"":""v1"",""created"":""Sun, 23 Apr 2017 16:18:16 GMT""}]","2017-04-25"
"1704.06947","Prabhat Kc","Prabhat KC, K. Aditya Mohan, Charudatta Phatak, Charles Bouman, Marc
  De Graef","3D Reconstruction of the Magnetic Vector Potential using Model Based
  Iterative Reconstruction","28 pages, 14 figures, submitted to Ultramicroscopy",,,,"stat.CO cond-mat.mes-hall cond-mat.mtrl-sci physics.comp-ph","http://arxiv.org/licenses/nonexclusive-distrib/1.0/","  Lorentz Transmission Electron Microscopy (TEM) observations of magnetic
nanoparticles contain information on the magnetic and electrostatic potentials.
Vector Field Electron Tomography (VFET) can be used to reconstruct
electromagnetic potentials of the nanoparticles from their corresponding LTEM
images. The VFET approach is based on the conventional filtered back projection
approach to tomographic reconstructions and the availability of an incomplete
set of measurements due to experimental limitations means that the
reconstructed vector fields exhibit significant artifacts. In this paper, we
outline a model-based iterative reconstruction (MBIR) algorithm to reconstruct
the magnetic vector potential of magnetic nanoparticles. We combine a forward
model for image formation in TEM experiments with a prior model to formulate
the tomographic problem as a maximum a-posteriori probability estimation
problem (MAP). The MAP cost function is minimized iteratively to determine the
vector potential. A comparative reconstruction study of simulated as well as
experimental data sets show that the MBIR approach yields quantifiably better
reconstructions than the VFET approach.
","[{""version"":""v1"",""created"":""Sun, 23 Apr 2017 16:23:33 GMT""}]","2017-04-28"
"1704.06948","Hugo Raguet","Hugo Raguet","A Note on the Forward-Douglas--Rachford Splitting for Monotone Inclusion
  and Convex Optimization","new version correct typos and author's GitHub repository",,,,"math.OC","http://arxiv.org/licenses/nonexclusive-distrib/1.0/","  We shed light on the structure of the ""three-operator"" version of the
forward-Douglas--Rachford splitting algorithm for finding a zero of a sum of
maximally monotone operators $A + B + C$, where $B$ is cocoercive, involving
only the computation of $B$ and of the resolvent of $A$ and of $C$, separately.
We show that it is a straightforward extension of a fixed-point algorithm
proposed by us as a generalization of the forward-backward splitting algorithm,
initially designed for finding a zero of a sum of an arbitrary number of
maximally monotone operators $\sum_{i=1}^n A_i + B$, where $B$ is cocoercive,
involving only the computation of $B$ and of the resolvent of each $A_i$
separately. We argue that, the former is the ""true"" forward-Douglas--Rachford
splitting algorithm, in contrast to the initial use of this designation in the
literature. Then, we highlight the extension to an arbitrary number of
maximally monotone operators in the splitting, $\sum_{i=1}^{n} A_i + B + C$, in
a formulation admitting preconditioning operators. We finally demonstate
experimentally its interest in the context of nonsmooth convex optimization.
","[{""version"":""v1"",""created"":""Sun, 23 Apr 2017 16:32:40 GMT""},{""version"":""v2"",""created"":""Sun, 11 Feb 2018 17:42:55 GMT""},{""version"":""v3"",""created"":""Fri, 27 Apr 2018 10:45:05 GMT""}]","2018-05-02"
"1704.06949","Yifeng Liu","Yifeng Liu","Monodromy map for tropical Dolbeault cohomology","24 pages, minor revision",,,,"math.AG","http://arxiv.org/licenses/nonexclusive-distrib/1.0/","  We define monodromy maps for tropical Dolbeault cohomology of algebraic
varieties over non-Archimedean fields. We propose a conjecture of Hodge
isomorphisms via monodromy maps, and provide some evidence.
","[{""version"":""v1"",""created"":""Sun, 23 Apr 2017 17:09:36 GMT""},{""version"":""v2"",""created"":""Thu, 27 Apr 2017 14:54:10 GMT""}]","2017-04-28"
"1704.06950","Lance Littlejohn Dr.","Lance Littlejohn, Richard Wellman","Self-Adjoint Operators in Extended Hilbert Spaces $H\oplus W$: An
  Application of the General GKN-EM Theorem","32 pages",,,,"math.FA","http://arxiv.org/licenses/nonexclusive-distrib/1.0/","  We construct self-adjoint operators in the direct sum of a complex Hilbert
space $H$ and a finite dimensional complex inner product space $W$. The
operator theory developed in this paper for the Hilbert space $H\oplus W$ is
originally motivated by some fourth-order differential operators, studied by
Everitt and others, having orthogonal polynomial eigenfunctions. Generated by a
closed symmetric operator $T_{0}$ in $H$ with equal and finite deficiency
indices and its adjoint $T_{1}$, we define \textit{families} of minimal
operators $\{\widehat{T}_{0}\}$ and maximal operators $\{\widehat{T}_{1}\}$ in
the extended space $H\oplus W$ and establish, using a recent theory of complex
symplectic geometry, developed by Everitt and Markus, a characterization of
self-adjoint extensions of $\{\widehat{T}_{0}\}$ when the dimension of the
extension space $W$ is not greater than the deficiency index of $T_{0}$. A
generalization of the classical Glazman-Krein-Naimark (GKN) Theorem - called
the GKN-EM Theorem to acknowledge the work of Everitt and Markus - is key to
finding these self-adjoint extensions in $H\oplus W.$ We consider several
examples to illustrate our results.
","[{""version"":""v1"",""created"":""Sun, 23 Apr 2017 17:09:39 GMT""}]","2017-04-25"
"1704.06951","Bin Wu","Bin Wu, Xin Hao, Liu Zhao","Time evolving fluid from Vaidya spacetime","14 pages","Phys. Rev. D 96, 046010 (2017)","10.1103/PhysRevD.96.046010",,"gr-qc","http://arxiv.org/licenses/nonexclusive-distrib/1.0/","  A time evolving fluid system is constructed on a timelike boundary
hypersurface at finite cutoff in Vaidya spacetime. The approach used to
construct the fluid equations is a direct extension of the ordinary
Gravity/Fluid correspondence under the constrained fluctuation obeying Petrov
type I conditions. The explicit relationships between the time dependent
fluctuation modes and the fluid quantities such as density, velocity field and
kinematic viscosity parameters are established, and the resulting fluid system
is governed by a system of a sourced continuity equation and a compressible
Navier-Stokes equation with non-trivial time evolution.
","[{""version"":""v1"",""created"":""Sun, 23 Apr 2017 17:25:46 GMT""}]","2017-08-23"
"1704.06952","Peter B{\o}ggild Peter B{\o}ggild","Peter B{\o}ggild, Jose M. Caridad, Christoph Stampfer, Gaetano
  Galogero, Nick Papior, Mads Brandbyge","A Two-dimensional Dirac fermion microscope","34 pages; 14 pages; 6 figures; Supplementary information",,"10.1038/ncomms15783",,"cond-mat.mes-hall","http://arxiv.org/licenses/nonexclusive-distrib/1.0/","  The electron microscope has been a powerful, highly versatile workhorse in
the fields of material and surface science, micro and nanotechnology, biology
and geology, for nearly 80 years. The advent of two-dimensional materials opens
new possibilities for realising an analogy to electron microscopy in the solid
state. Here we provide a perspective view on how a two-dimensional (2D) Dirac
fermion-based microscope can be realistically implemented and operated, using
graphene as a vacuum chamber for ballistic electrons. We use semiclassical
simulations to propose concrete architectures and design rules of 2D electron
guns, deflectors, tunable lenses and various detectors. The simulations show
how simple objects can be imaged with well-controlled and collimated in-plane
beams consisting of relativistic charge carriers. Finally, we discuss the
potential of such microscopes for investigating edges, terminations and
defects, as well as interfaces, including external nanoscale structures such as
adsorbed molecules, nanoparticles or quantum dots.
","[{""version"":""v1"",""created"":""Sun, 23 Apr 2017 17:34:42 GMT""}]","2017-08-02"
"1704.06953","Siim Tolk","S. Tolk (on behalf of the LHCb collaboration)","Rare B and strange decays",,,,,"hep-ex","http://arxiv.org/licenses/nonexclusive-distrib/1.0/","  Several deviations from the Standard Model predictions have been recently
observed in the decays mediated by $b \rightarrow s l^+ l^-$ transitions. These
could be pointing towards new vector-current contributions or could be
explained by underestimated charm-loop effects. New results from an LHCb Run 1
$B^+\rightarrow K^+ \mu^+ \mu^- $ analysis that includes the decays via
intermediate charm- resonances are discussed. Also, new results from the fully
leptonic rare modes searches are presented. This includes the latest Run 1 and
Run 2 $B^0_{(s)} \rightarrow \mu^+ \mu^-$ analysis from LHCb where the $B^0_{s}
\rightarrow \mu^+ \mu^-$ candidates are used to determine the effective
lifetime of the $B^0_{s} \rightarrow \mu^+ \mu^-$ decays - a pioneering result
that in the future will solve the current ambiguity in the (pseudo-)scalar
contributions.
","[{""version"":""v1"",""created"":""Sun, 23 Apr 2017 17:35:52 GMT""}]","2017-04-25"
"1704.06954","Judith A. Irwin","R. N. Henriksen","Steady Galactic Dynamos and Observational Consequences I: Halo Magnetic
  Fields","32 pages (double-spaced), 9 figures",,,,"astro-ph.GA","http://arxiv.org/licenses/nonexclusive-distrib/1.0/","  We study the global consequences in the halos of spiral galaxies of the
steady, axially symmetric, mean field dynamo. We use the classical theory but
add the possibility of using the velocity field components as parameters in
addition to the helicity and diffusivity. The analysis is based on the simplest
version of the theory and uses scale-invariant solutions. The velocity field
(subject to restrictions) is a scale invariant field in a `pattern' frame, in
place of a full dynamical theory. The `pattern frame' of reference may either
be the systemic frame or some rigidly rotating spiral pattern frame. One type
of solution for the magnetic field yields off-axis, spirally wound, magnetic
field lines. These predict sign changes in the Faraday screen rotation measure
in every quadrant of the halo of an edge-on galaxy. Such rotation measure
oscillations have been observed in the CHANG-ES survey.
","[{""version"":""v1"",""created"":""Sun, 23 Apr 2017 17:46:24 GMT""},{""version"":""v2"",""created"":""Mon, 19 Jun 2017 22:34:41 GMT""}]","2017-06-21"
"1704.06955","Elton Yechao Zhu","Elton Yechao Zhu, Quntao Zhuang, Peter W. Shor","Superadditivity of the Classical Capacity with Limited Entanglement
  Assistance","13 pages","Phys. Rev. Lett. 119, 040503 (2017)","10.1103/PhysRevLett.119.040503","MIT-CTP/4895","quant-ph cs.IT math.IT","http://arxiv.org/licenses/nonexclusive-distrib/1.0/","  Finding the optimal encoding strategies can be challenging for communication
using quantum channels, as classical and quantum capacities may be
superadditive. Entanglement assistance can often simplify this task, as the
entanglement-assisted classical capacity for any channel is additive, making
entanglement across channel uses unnecessary. If the entanglement assistance is
limited, the picture is much more unclear. Suppose the classical capacity is
superadditive, then the classical capacity with limited entanglement assistance
could retain superadditivity by continuity arguments. If the classical capacity
is additive, it is unknown if superadditivity can still be developed with
limited entanglement assistance. We show this is possible, by providing an
example. We construct a channel for which, the classical capacity is additive,
but that with limited entanglement assistance can be superadditive. This shows
entanglement plays a weird role in communication and we still understand very
little about it.
","[{""version"":""v1"",""created"":""Sun, 23 Apr 2017 17:58:00 GMT""},{""version"":""v2"",""created"":""Fri, 28 Jul 2017 18:12:28 GMT""}]","2017-08-01"
"1704.06956","Sida Wang","Sida I. Wang and Samuel Ginn and Percy Liang and Christoper D. Manning","Naturalizing a Programming Language via Interactive Learning","10 pages, ACL2017",,,,"cs.CL cs.AI cs.HC cs.LG","http://arxiv.org/licenses/nonexclusive-distrib/1.0/","  Our goal is to create a convenient natural language interface for performing
well-specified but complex actions such as analyzing data, manipulating text,
and querying databases. However, existing natural language interfaces for such
tasks are quite primitive compared to the power one wields with a programming
language. To bridge this gap, we start with a core programming language and
allow users to ""naturalize"" the core language incrementally by defining
alternative, more natural syntax and increasingly complex concepts in terms of
compositions of simpler ones. In a voxel world, we show that a community of
users can simultaneously teach a common system a diverse language and use it to
build hundreds of complex voxel structures. Over the course of three days,
these users went from using only the core language to using the naturalized
language in 85.9\% of the last 10K utterances.
","[{""version"":""v1"",""created"":""Sun, 23 Apr 2017 18:13:10 GMT""}]","2017-04-25"
"1704.06957","Yu-Wei Fan","Yu-Wei Fan","Entropy of an autoequivalence on Calabi-Yau manifolds","10 pages. Comments are welcome!","MRL, Vol. 25, No. 2 (2018), pp. 509-519",,,"math.AG math.DS","http://arxiv.org/licenses/nonexclusive-distrib/1.0/","  We prove that the categorical entropy of the autoequivalence
$T_{\mathcal{O}}\circ(-\otimes\mathcal{O}(-1))$ on a Calabi-Yau manifold is the
unique positive real number $\lambda$ satisfying $$ \sum_{k\geq
1}\frac{\chi(\mathcal{O}(k))}{e^{k\lambda}}=e^{(d-1)t}. $$ We then use this
result to construct the first counterexamples of a conjecture on categorical
entropy by Kikuta and Takahashi.
","[{""version"":""v1"",""created"":""Sun, 23 Apr 2017 18:24:50 GMT""},{""version"":""v2"",""created"":""Mon, 12 Nov 2018 15:58:03 GMT""}]","2018-11-13"
"1704.06958","Judith A. Irwin","R. N. Henriksen","Magnetic Spiral Arms in Galaxy Halos","44 double-spaced pages, 10 figures plus 1 appendix figure, accepted
  to MNRAS",,"10.1093/mnras/stx1169",,"astro-ph.GA","http://arxiv.org/licenses/nonexclusive-distrib/1.0/","  We seek the conditions for a {\it steady} mean field galactic dynamo. The
parameter set is reduced to those appearing in the $\alpha^2$ and
$\alpha/\omega$ dynamo, namely velocity amplitudes, and the ratio of sub-scale
helicity to diffusivity. The parameters can be allowed to vary on conical
spirals. We analyze the mean field dynamo equations in terms of scale invariant
logarithmic spiral modes and special exact solutions. Compatible scale
invariant gravitational spiral arms are introduced and illustrated in an
appendix, but the detailed dynamical interaction with the magnetic field is
left for another work. As a result of planar magnetic spirals `lifting' into
the halo, multiple sign changes in average rotation measures forming a regular
pattern on each side of the galactic minor axis, are predicted. Such changes
have recently been detected in the CHANG-ES survey.
","[{""version"":""v1"",""created"":""Sun, 23 Apr 2017 18:34:16 GMT""},{""version"":""v2"",""created"":""Fri, 12 May 2017 22:43:14 GMT""}]","2017-06-28"
"1704.06959","David Serantes","David Serantes, Roy Chantrell, Helena Gavil\'an, Mar\'ia del Puerto
  Morales, Oksana Chubykalo-Fesenko, Daniel Baldomir, and Akira Satoh","Anisotropic magnetic nanoparticles for biomedicine: bridging frequency
  separated AC-field controlled domains of actuation","26 pages, 6 figures",,"10.1039/C8CP02768D",,"cond-mat.mes-hall cond-mat.mtrl-sci","http://arxiv.org/licenses/nonexclusive-distrib/1.0/","  Magnetic nanoparticles constitute potential nanomedicine tools based on the
possibility to obtain different responses triggered by safe remote stimulus.
However, such richness can be detrimental if the different performances are not
accurately differentiated (and controlled). An example of this is the
reorientation of magnetic nanoparticles under the influence of AC fields, which
can be exploited for either magneto-mechanical actuation (MMA) at low
frequencies (tens of Hz); or heat release at large ones (MHz range). While it
is clear that Brownian rotation is responsible for MMA, its heating role in the
high-frequency regime is not clear. In this work we aim to shed light on this
issue, which needs to be well understood for applications in magnetic fluid
hyperthermia (MFH) or heat triggered drug release. Using a Brownian dynamics
(BD) simulation technique, we have theoretically investigated the contribution
of Brownian reversal in disk-shape particles (to enhance the viscous
interaction with the environment) over a wide range of frequencies. Our results
predict essentially negligible hysteresis losses both in the high- and
low-frequency domains, with completely different implications: highly efficient
MMA, but negligible MFH performance. Importantly, complementary micromagnetic
simulations indicate that the large magnetic torque assumption of the BD
simulations is supported by hexagonal-shape disks, up to field amplitudes of
the order of 100 Oe. Larger fields would lead to N\'eel reversal which,
noteworthy, predicts significant heating performance. The possibility of
switching between the MMA and MFH response by changing the amplitude of the AC
field, together with their distinct optimal conditions (large magnetic torque
for MMF; large heating for MFH), points to such hexagonal nanodisks as
promising nanomedicine agents with double mechanical and heating
functionalities.
","[{""version"":""v1"",""created"":""Sun, 23 Apr 2017 18:41:30 GMT""}]","2018-12-26"
"1704.06960","Jacob Andreas","Jacob Andreas, Anca Dragan, Dan Klein","Translating Neuralese","Fixes typos and cleans ups some model presentation details",,,,"cs.CL cs.NE","http://arxiv.org/licenses/nonexclusive-distrib/1.0/","  Several approaches have recently been proposed for learning decentralized
deep multiagent policies that coordinate via a differentiable communication
channel. While these policies are effective for many tasks, interpretation of
their induced communication strategies has remained a challenge. Here we
propose to interpret agents' messages by translating them. Unlike in typical
machine translation problems, we have no parallel data to learn from. Instead
we develop a translation model based on the insight that agent messages and
natural language strings mean the same thing if they induce the same belief
about the world in a listener. We present theoretical guarantees and empirical
evidence that our approach preserves both the semantics and pragmatics of
messages by ensuring that players communicating through a translation layer do
not suffer a substantial loss in reward relative to players with a common
language.
","[{""version"":""v1"",""created"":""Sun, 23 Apr 2017 18:46:42 GMT""},{""version"":""v2"",""created"":""Mon, 25 Sep 2017 21:28:48 GMT""},{""version"":""v3"",""created"":""Thu, 28 Sep 2017 15:10:24 GMT""},{""version"":""v4"",""created"":""Sat, 6 Jan 2018 15:29:58 GMT""},{""version"":""v5"",""created"":""Sat, 22 Dec 2018 19:13:26 GMT""}]","2018-12-27"
"1704.06961","Olesia Zavarzina","Olesia Zavarzina","Non-expansive bijections between unit balls of Banach spaces (A
  technical version with some boring proofs included)",,"Ann. Funct. Anal. 9, no. 2 (2018), 271-281","10.1215/20088752-2017-0050",,"math.FA","http://arxiv.org/licenses/nonexclusive-distrib/1.0/","  It is known that if $M$ is a finite-dimensional Banach space, or a strictly
convex space, or the space $\ell_1$, then every non-expansive bijection $F: B_M
\to B_M$ is an isometry. We extend these results to non-expansive bijections
$F: B_E \to B_M$ between unit balls of two different Banach spaces. Namely, if
$E$ is an arbitrary Banach space and $M$ is finite-dimensional or strictly
convex, or the space $\ell_1$ then every non-expansive bijection $F: B_E \to
B_M$ is an isometry.
","[{""version"":""v1"",""created"":""Sun, 23 Apr 2017 18:54:40 GMT""},{""version"":""v2"",""created"":""Wed, 26 Apr 2017 18:59:27 GMT""},{""version"":""v3"",""created"":""Fri, 13 Jul 2018 07:01:18 GMT""}]","2018-07-16"
"1704.06962","Austin Collins","Austin Collins and Yury Polyanskiy","Coherent multiple-antenna block-fading channels at finite blocklength",,,,,"cs.IT math.IT","http://arxiv.org/licenses/nonexclusive-distrib/1.0/","  In this paper we consider a channel model that is often used to describe the
mobile wireless scenario: multiple-antenna additive white Gaussian noise
channels subject to random (fading) gain with full channel state information at
the receiver. Dynamics of the fading process are approximated by a
piecewise-constant process (frequency non-selective isotropic block fading).
This work addresses the finite blocklength fundamental limits of this channel
model. Specifically, we give a formula for the channel dispersion -- a quantity
governing the delay required to achieve capacity. Multiplicative nature of the
fading disturbance leads to a number of interesting technical difficulties that
required us to enhance traditional methods for finding channel dispersion.
Alas, one difficulty remains: the converse (impossibility) part of our result
holds under an extra constraint on the growth of the peak-power with
blocklength.
  Our results demonstrate, for example, that while capacities of $n_t\times
n_r$ and $n_r \times n_t$ antenna configurations coincide (under fixed received
power), the coding delay can be quite sensitive to this switch. For example, at
the received SNR of $20$ dB the $16\times 100$ system achieves capacity with
codes of length (delay) which is only $60\%$ of the length required for the
$100\times 16$ system. Another interesting implication is that for the MISO
channel, the dispersion-optimal coding schemes require employing orthogonal
designs such as Alamouti's scheme -- a surprising observation considering the
fact that Alamouti's scheme was designed for reducing demodulation errors, not
improving coding rate. Finding these dispersion-optimal coding schemes
naturally gives a criteria for producing orthogonal design-like inputs in
dimensions where orthogonal designs do not exist.
","[{""version"":""v1"",""created"":""Sun, 23 Apr 2017 19:01:59 GMT""},{""version"":""v2"",""created"":""Wed, 16 May 2018 18:44:12 GMT""},{""version"":""v3"",""created"":""Thu, 24 May 2018 21:33:05 GMT""},{""version"":""v4"",""created"":""Tue, 26 Jun 2018 22:55:04 GMT""}]","2018-06-28"
"1704.06963","Marat Akhmet","Marat Akhmet, Mehmet Onur Fen","Unpredictable sequences and Poincar\'e chaos","10 pages, 3 figures",,,,"nlin.CD math.DS","http://arxiv.org/licenses/nonexclusive-distrib/1.0/","  To make research of chaos more friendly with discrete equations, we introduce
the concept of an unpredictable sequence as a specific unpredictable function
on the set of integers. It is convenient to be verified as a solution of a
discrete equation. This is rigorously proved in this paper for quasilinear
systems, and we demonstrate the result numerically for linear systems in the
critical case with respect to the stability of the origin. The completed
research contributes to the theory of chaos as well as to the theory of
discrete equations, considering unpredictable solutions.
","[{""version"":""v1"",""created"":""Sun, 23 Apr 2017 19:02:03 GMT""}]","2017-04-25"
