"1705.00285","Zhiyu Yang","Songwen Xiao, Suet Tao Tang, and Z. Yang","Tunable Extremely Asymmetric Acoustic Metasurfaces Made by Coupled
  Membrane Resonators",,,,,"physics.app-ph","http://arxiv.org/licenses/nonexclusive-distrib/1.0/","  We report the experimental demonstration of tunable asymmetric acoustic
metasurfaces with extreme contrast, made by two decorated membrane resonators
(DMRs) coupled via a sealed air column. The front side of the metasurface is
impedance matched to air and perfectly absorbing, while the backside is hard
and totally reflecting. When a suitable DC voltage is applied to the backside
DMR with proper electrodes, the surface impedance of the back side of the
metasurfaces can be tuned from one extreme to the other, such that the backside
becomes impedance matched to air and totally absorbing, while the front side
becomes perfectly reflecting. The metasurface also exhibits high transmission
contrast around two frequencies. The tunability of the reflection is over 23 dB
at 388 Hz, and that of the transmission is over 33 dB at 240 Hz and 590 Hz with
600 V of applied voltage. We further demonstrate one-side impedance matched
metasurface with tunable working frequency 324.2 Hz to 335 Hz and reflection
contrast over 31 dB.
","[{""version"":""v1"",""created"":""Sun, 30 Apr 2017 08:36:44 GMT""},{""version"":""v2"",""created"":""Fri, 26 May 2017 03:32:09 GMT""}]","2017-05-29"
"1705.00286","Deog Ki Hong","Deog Ki Hong, Jong-Wan Lee, Biagio Lucini, Maurizio Piai, Davide
  Vadacchino","Casimir scaling and Yang-Mills glueballs","11 pages, 3 figures;v2 minor corrections, references added;version to
  appear in PLB",,"10.1016/j.physletb.2017.10.050","PNUTP-17/A04","hep-th hep-lat hep-ph","http://arxiv.org/licenses/nonexclusive-distrib/1.0/","  We conjecture that in Yang-Mills theories the ratio between the ground-state
glueball mass squared and the string tension is proportional to the ratio of
the eigenvalues of quadratic Casimir operators in the adjoint and the
fundamental representations. The proportionality constant depends on the
dimension of the space-time only, and is henceforth universal. We argue that
this universality, which is supported by available lattice results, is a direct
consequence of area-law confinement. In order to explain this universal
behaviour, we provide three analytical arguments, based respectively on a
Bethe-Salpeter analysis, on the saturation of the scale anomaly by the lightest
scalar glueball and on QCD sum rules, commenting on the underlying assumptions
that they entail and on their physical implications.
","[{""version"":""v1"",""created"":""Sun, 30 Apr 2017 08:41:38 GMT""},{""version"":""v2"",""created"":""Fri, 12 May 2017 12:17:33 GMT""},{""version"":""v3"",""created"":""Mon, 23 Oct 2017 02:28:01 GMT""}]","2017-11-22"
"1705.00287","Attila Jo\'o","Attila Jo\'o","Countable Menger theorem with finitary matroid constraints on the
  ingoing edges",,,,,"math.CO","http://arxiv.org/licenses/nonexclusive-distrib/1.0/","  We present a strengthening of the countable Menger theorem (edge version) of
R. Aharoni. Let $ D=(V,A) $ be a countable digraph with $ s\neq t\in V $ and
let $\mathcal{M}=\bigoplus_{v\in V}\mathcal{M}_v $ be a matroid on $ A $ where
$ \mathcal{M}_v $ is a finitary matroid on the ingoing edges of $ v $. We show
that there is a system of edge-disjoint $ s \rightarrow t $ paths $ \mathcal{P}
$ such that the united edge set of the paths is $ \mathcal{M} $-independent,
and there is a $ C \subseteq A $ consists of one edge from each element of $
\mathcal{P} $ for which $ \mathsf{span}_{\mathcal{M}}(C) $ covers all the $
s\rightarrow t $ paths in $ D $.
","[{""version"":""v1"",""created"":""Sun, 30 Apr 2017 09:19:58 GMT""}]","2017-05-02"
"1705.00288","Mohsen Shadmehri","Fazeleh Khajenabi, Kimia Kazrani, Mohsen Shadmehri","An analytical model for the evolution of the protoplanetary discs","9 pages, accepted for publication in ApJ",,,,"astro-ph.EP astro-ph.GA","http://arxiv.org/licenses/nonexclusive-distrib/1.0/","  We obtain a new set of analytical solutions for the evolution of a
self-gravitating accretion disc by holding the Toomre parameter close to its
threshold, and obtaining the stress parameter from the cooling rate. In
agreement with the previous numerical solutions, furthermore, the accretion
rate is assumed to be independent of the disc radius. Extreme situations where
the entire disc is either optically thick or optically thin are studied
independently and the obtained solutions can be used for exploring the early or
the final phases of a protoplanetary disc evolution. Our solutions exhibit
decay of the accretion rate as a power-law function of the age of the system
with the exponent -0.75 and -1.04 for optically thick and thin cases,
respectively. Our calculations permit us to explore evolution of the snow line
analytically. Location of the snow line in the optically thick regime evolves
as a power-law function of time with the exponent -0.16, however, when the disc
is optically thin, location of the snow line as a function of time with the
exponent -0.7 has a stronger dependence on time. It means that in an optically
thin disc inward migration of the snow line is faster than an optically thick
disc.
","[{""version"":""v1"",""created"":""Sun, 30 Apr 2017 09:21:07 GMT""}]","2017-05-02"
"1705.00289","Faustino Prieto","Jos\'e Mar\'ia Sarabia, Emilio G\'omez-D\'eniz, Faustino Prieto,
  Vanesa Jord\'a","Aggregation of Dependent Risks in Mixtures of Exponential Distributions
  and Extensions","This is a preprint (34 pages)",,,,"stat.ME","http://arxiv.org/licenses/nonexclusive-distrib/1.0/","  The distribution of the sum of dependent risks is a crucial aspect in
actuarial sciences, risk management and in many branches of applied
probability. In this paper, we obtain analytic expressions for the probability
density function (pdf) and the cumulative distribution function (cdf) of
aggregated risks, modeled according to a mixture of exponential distributions.
We first review the properties of the multivariate mixture of exponential
distributions, to then obtain the analytical formulation for the pdf and the
cdf for the aggregated distribution. We study in detail some specific families
with Pareto (Sarabia et al, 2016), Gamma, Weibull and inverse Gaussian mixture
of exponentials (Whitmore and Lee, 1991) claims. We also discuss briefly the
computation of risk measures, formulas for the ruin probability (Albrecher et
al., 2011) and the collective risk model. An extension of the basic model based
on mixtures of gamma distributions is proposed, which is one of the suggested
directions for future research.
","[{""version"":""v1"",""created"":""Sun, 30 Apr 2017 09:30:52 GMT""}]","2017-05-02"
"1705.00290","A V Sreejith","A. Baskar, A. V. Sreejith, R. S. Thinniyam","Modulo quantifiers over functional vocabularies extending addition","There are many errors",,,,"cs.LO","http://arxiv.org/licenses/nonexclusive-distrib/1.0/","  We show that first order logic (FO) and first order logic extended with
modulo counting quantifiers (FOMOD) over purely functional vocabularies which
extend addition, satisfy the Crane beach property (CBP) if the logic satisfies
a normal form (called positional normal form). This not only shows why logics
over the addition vocabulary have the CBP but also gives new CBP results, for
example for the vocabulary which extends addition with the exponentiation
function. The above results can also be viewed from the perspective of circuit
complexity. Showing the existence of regular languages not definable in
FOMOD[<, +, *] is equivalent to the separation of the circuit complexity
classes ACC0 and NC1 . Our theorem shows that a weaker logic , namely,
FOMOD[<,+,2^x] cannot define all regular languages.
","[{""version"":""v1"",""created"":""Sun, 30 Apr 2017 09:34:26 GMT""},{""version"":""v2"",""created"":""Tue, 2 May 2017 05:55:18 GMT""},{""version"":""v3"",""created"":""Wed, 14 Jun 2017 07:50:57 GMT""},{""version"":""v4"",""created"":""Thu, 15 Jun 2017 03:22:55 GMT""},{""version"":""v5"",""created"":""Mon, 31 Dec 2018 04:49:43 GMT""},{""version"":""v6"",""created"":""Sat, 3 Jul 2021 16:48:11 GMT""}]","2021-07-06"
"1705.00291","Athanasios Kapoyannis","A. S. Kapoyannis, A. D. Panagiotou","Particle states of Lattice QCD","21 pages, 18 figures","Eur. Phys. J. C (2017) 77:736","10.1140/epjc/s10052-017-5265-z",,"hep-ph hep-lat","http://arxiv.org/licenses/nonexclusive-distrib/1.0/","  We determine the degeneracy factor and the average particle mass of particles
that produce the Lattice QCD pressure and specific entropy at zero baryon
chemical potential. The number of states of the gluons and the quarks are found
to converge above $T=$230 MeV to almost constant values, close to the number of
states of an ideal Quark-Gluon Phase, while their assigned masses retain high
values. The number of states and the average mass of a system containing quarks
in interaction with gluons are found to decrease steeply with increase of
temperature between $T \sim 150$ and 160 MeV, a region contained within the
region of the chiral transition. The minimum value of the number of states
within this temperature interval indicates that the states are of hadronic
nature.
","[{""version"":""v1"",""created"":""Sun, 30 Apr 2017 09:39:48 GMT""},{""version"":""v2"",""created"":""Tue, 5 Dec 2017 22:50:41 GMT""}]","2017-12-07"
"1705.00292","Pablo Bueno","Nikolay Bobev, Pablo Bueno and Yannick Vreys","Comments on Squashed-sphere Partition Functions","40 pages, 7 figures, 1 table; v2: additional comments and
  clarifications added, updated bibliography","JHEP 1707 (2017) 093","10.1007/JHEP07(2017)093",,"hep-th gr-qc","http://arxiv.org/licenses/nonexclusive-distrib/1.0/","  We study the partition function of odd-dimensional conformal field theories
placed on spheres with a squashed metric. We establish that the round sphere
provides a local extremum for the free energy which, in general, is not a
global extremum. In addition, we show that the leading quadratic correction to
the free energy around this extremum is proportional to the coefficient, $C_T$,
determining the two-point function of the energy-momentum tensor in the CFT.
For three-dimensional CFTs, we compute explicitly this proportionality constant
for a class of squashing deformations which preserve an $SU(2)\times U(1)$
isometry group on the sphere. In addition, we evaluate the free energy as a
function of the squashing parameter for theories of free bosons, free fermions,
as well as CFTs holographically dual to Einstein gravity with a negative
cosmological constant. We observe that, after suitable normalization, the
dependence of the free energy on the squashing parameter for all these theories
is nearly universal for a large region of parameter space and is well
approximated by a simple quadratic function arising from holography. We
generalize our results to five-dimensional CFTs and, in this context, we also
study theories holographically dual to six-dimensional Gauss-Bonnet gravity.
","[{""version"":""v1"",""created"":""Sun, 30 Apr 2017 09:46:45 GMT""},{""version"":""v2"",""created"":""Wed, 17 May 2017 07:43:41 GMT""}]","2017-07-21"
"1705.00293","Mike Winkler","Mike Winkler, Peter Dinkelacker, Stefan Vogel","On the existence of 4-regular matchstick graphs","11 pages, 7 figures, 3 tables, 22 matchstick graphs",,,,"math.CO","http://arxiv.org/licenses/nonexclusive-distrib/1.0/","  A matchstick graph is a planar unit-distance graph. That is a graph drawn
with straight edges in the plane such that the edges have unit length, and
non-adjacent edges do not intersect. We call a matchstick graph 4-regular if
every vertex has only degree 4. Examples of 4-regular matchstick graphs with
less than 63 vertices are only known for 52, 54, 57 and 60 vertices. It is
shown that for all number of vertices $\geq63$ at least one example of a
4-regular matchstick graph exists.
","[{""version"":""v1"",""created"":""Sun, 30 Apr 2017 10:00:05 GMT""},{""version"":""v2"",""created"":""Fri, 30 Jun 2017 07:41:07 GMT""},{""version"":""v3"",""created"":""Sun, 10 Oct 2021 12:10:40 GMT""}]","2021-10-12"
"1705.00294","Jichang Zhao","Zhenkun Zhou, Ke Xu and Jichang Zhao","Tales of Emotion and Stock in China: Volatility, Causality and
  Prediction","This an extended version our conference paper titled ""Can online
  emotions predict the stock market in China?"" in WISE 2016 [arXiv:1604.07529]",,,,"cs.CY cs.SI","http://arxiv.org/licenses/nonexclusive-distrib/1.0/","  How the online social media, like Twitter or its variant Weibo, interacts
with the stock market and whether it can be a convincing proxy to predict the
stock market have been debated for years, especially for China. As the
traditional theory in behavioral finance states, the individual emotions can
influence decision-makings of investors, it is reasonable to further explore
these controversial topics systematically from the perspective of online
emotions, which are richly carried by massive tweets in social media. Through
thorough studies on over 10 million stock-relevant tweets and 3 million
investors from Weibo, it is revealed that inexperienced investors with high
emotional volatility are more sensible to the market fluctuations than the
experienced or institutional ones, and their dominant occupation also indicates
that the Chinese market might be more emotional as compared to its western
counterparts. Then both correlation analysis and causality test demonstrate
that five attributes of the stock market in China can be competently predicted
by various online emotions, like disgust, joy, sadness and fear. Specifically,
the presented prediction model significantly outperforms the baseline model,
including the one taking purely financial time series as input features, on
predicting five attributes of the stock market under the $K$-means
discretization. We also employ this prediction model in the scenario of
realistic online application and its performance is further testified.
","[{""version"":""v1"",""created"":""Sun, 30 Apr 2017 10:31:09 GMT""}]","2017-05-02"
"1705.00295","Vincent Bouchiat","Farida Veliev, Dipankar Kalita, Antoine Bourrier, Tiphaine Belloir,
  Anne Brian\c{c}on-Marjollet, Mireille Albrieux, Vincent Bouchiat and C\'ecile
  Delacour","Sensing ion channels in neuronal networks with graphene transistors","31 pages , 5 figures + Supplementary Info",,,,"cond-mat.mes-hall","http://arxiv.org/licenses/nonexclusive-distrib/1.0/","  Graphene, the atomically-thin honeycomb carbon lattice, is a highly
conducting 2D material whose exposed electronic structure offers an ideal
platform for sensing. Its biocompatible, flexible, and chemically inert nature
associated to the lack of dangling bonds, offers novel perspectives for direct
interfacing with bioelements. When combined with its exceptional electronic and
optical properties, graphene becomes a very promising material for
bioelectronics. Among the successful bio-integrations of graphene, the
detection of ionic currents through artificial membrane channels and
extracellular action potentials in electrogenic cells have paved the road for
the high spatial resolution and wide-field imaging of neuronal activity.
However, various issues including the low signals amplitude, confinement and
stochasticity of neuronal signals associated to the complex architecture and
interconnectivity of neural networks should be still overcome. Recently, grain
boundaries found in CVD graphene were shown to drastically increase the
sensitivity of graphene transistors providing nanoscale sensing sites. Here we
demonstrate the ability of liquid-gated graphene field effect transistors
(G-FET) on which hippocampal neurons are grown for real-time detection of
single ion channels activity. Dependence upon drugs and reference potential
gating is presented and is found compatible with the nanoscale coupling of a
few ion channels to graphene grain boundaries.
","[{""version"":""v1"",""created"":""Sun, 30 Apr 2017 10:31:25 GMT""},{""version"":""v2"",""created"":""Mon, 8 May 2017 20:49:04 GMT""},{""version"":""v3"",""created"":""Mon, 17 Jun 2019 13:31:08 GMT""}]","2019-06-18"
"1705.00296","Eduardo Garc\'ia-Portugu\'es","Eduardo Garc\'ia-Portugu\'es, Michael S{\o}rensen, Kanti V. Mardia,
  Thomas Hamelryck","Langevin diffusions on the torus: estimation and applications","29 pages, 8 figures, 5 tables","Statistics and Computing, 29:1-22, 2019","10.1007/s11222-017-9790-2",,"stat.ME","http://creativecommons.org/licenses/by-nc-sa/4.0/","  We introduce stochastic models for continuous-time evolution of angles and
develop their estimation. We focus on studying Langevin diffusions with
stationary distributions equal to well-known distributions from directional
statistics, since such diffusions can be regarded as toroidal analogues of the
Ornstein-Uhlenbeck process. Their likelihood function is a product of
transition densities with no analytical expression, but that can be calculated
by solving the Fokker-Planck equation numerically through adequate schemes. We
propose three approximate likelihoods that are computationally tractable: (i) a
likelihood based on the stationary distribution; (ii) toroidal adaptations of
the Euler and Shoji-Ozaki pseudo-likelihoods; (iii) a likelihood based on a
specific approximation to the transition density of the wrapped normal process.
A simulation study compares, in dimensions one and two, the approximate
transition densities to the exact ones, and investigates the empirical
performance of the approximate likelihoods. Finally, two diffusions are used to
model the evolution of the backbone angles of the protein G (PDB identifier
1GB1) during a molecular dynamics simulation. The software package sdetorus
implements the estimation methods and applications presented in the paper.
","[{""version"":""v1"",""created"":""Sun, 30 Apr 2017 11:04:13 GMT""},{""version"":""v2"",""created"":""Sun, 21 May 2017 22:38:56 GMT""},{""version"":""v3"",""created"":""Wed, 29 Apr 2020 11:03:03 GMT""},{""version"":""v4"",""created"":""Mon, 21 Sep 2020 09:43:12 GMT""}]","2020-09-22"
"1705.00297","Jia-An Lu","Jia-An Lu","On the difference between Poincar\'e and Lorentz gravity","11 pages","Gen. Relativ. Gravit. 49, 138 (2017)","10.1007/s10714-017-2296-6",,"gr-qc","http://arxiv.org/licenses/nonexclusive-distrib/1.0/","  The Poincar\'e invariance of GR is usually interpreted as Lorentz invariance
plus diffeomorphism invariance. In this paper, by introducing the local
inertial coordinates (LIC), it is shown that a theory with Lorentz and
diffeomorphism invariance is not necessarily Poincar\'e invariant. Actually,
the energy-momentum conservation is violated there. On the other hand, with the
help of the LIC, the Poincar\'e invariance is reinterpreted as an internal
symmetry. In this formalism, the conservation law is derived, which has not
been sufficiently explored before.
","[{""version"":""v1"",""created"":""Sun, 30 Apr 2017 11:05:48 GMT""},{""version"":""v2"",""created"":""Thu, 19 Oct 2017 01:51:41 GMT""}]","2017-10-25"
"1705.00298","Giorgio Gubbiotti","Giorgio Gubbiotti and Christian Scimiterna","Reconstructing a Lattice Equation: a Non-Autonomous Approach to the
  Hietarinta Equation","In order that the manuscript be reasonably self contained, we have
  used some introductory material from our paper arXiv:1704.05805 to provide
  background for the presentation made here","SIGMA 14 (2018), 004, 21 pages","10.3842/SIGMA.2018.004",,"nlin.SI","http://creativecommons.org/licenses/by-sa/4.0/","  In this paper we construct a non-autonomous version of the Hietarinta
equation [Hietarinta J., J. Phys. A: Math. Gen. 37 (2004), L67-L73] and study
its integrability properties. We show that this equation possess linear growth
of the degrees of iterates, generalized symmetries depending on arbitrary
functions, and that it is Darboux integrable. We use the first integrals to
provide a general solution of this equation. In particular we show that this
equation is a sub-case of the non-autonomous $Q_{\rm V}$ equation, and we
provide a non-autonomous M\""obius transformation to another equation found in
[Hietarinta J., J. Nonlinear Math. Phys. 12 (2005), suppl. 2, 223-230] and
appearing also in Boll's classification [Boll R., Ph.D. Thesis, Technische
Universit\""at Berlin, 2012].
","[{""version"":""v1"",""created"":""Sun, 30 Apr 2017 11:06:30 GMT""},{""version"":""v2"",""created"":""Tue, 9 Jan 2018 06:33:24 GMT""}]","2019-03-22"
"1705.00299","Scott McCue","Shakti N. Menon, Cameron L. Hall, Scott W. McCue, D.L. Sean McElwain","A model for one-dimensional morphoelasticity and its application to
  fibroblast-populated collagen lattices","Accepted by Biomechanics and Modeling in Mechanobiology",,"10.1007/s10237-017-0917-3",,"physics.bio-ph q-bio.TO","http://arxiv.org/licenses/nonexclusive-distrib/1.0/","  The mechanical behaviour of solid biological tissues has long been described
using models based on classical continuum mechanics. However, the classical
continuum theories of elasticity and viscoelasticity cannot easily capture the
continual remodelling and associated structural changes of biological tissues.
Furthermore, models drawn from plasticity theory are difficult to apply and
interpret in this context, where there is no equivalent of a yield stress or
flow rule. In this work, we describe a novel one-dimensional mathematical model
of tissue remodelling based on the multiplicative decomposition of the
deformation gradient. We express the mechanical effects of remodelling as an
evolution equation for the 'effective strain', a measure of the difference
between the current state and a hypothetical mechanically-relaxed state of the
tissue. This morphoelastic model combines the simplicity and interpretability
of classical viscoelastic models with the versatility of plasticity theory. A
novel feature of our model is that while most models describe growth as a
continuous quantity, here we begin with discrete cells and develop a continuum
representation of lattice remodelling based on an appropriate limit of the
behaviour of discrete cells. To demonstrate the utility of our approach, we use
this framework to capture qualitative aspects of the continual remodelling
observed in fibroblast-populated collagen lattices, in particular its
contraction and its subsequent sudden re-expansion when remodelling is
interrupted.
","[{""version"":""v1"",""created"":""Sun, 30 Apr 2017 11:33:19 GMT""}]","2017-05-16"
"1705.00300","Vladimir Osipov Dr.","Vladimir Al. Osipov, Tonu Pullerits","Accumulation effects in modulation spectroscopy with high repetition
  rate pulses: recursive solution of optical Bloch equations","10 pages, 5 figures","Phys. Rev. A 96, 043841 (2017)","10.1103/PhysRevA.96.043841",,"physics.optics","http://arxiv.org/licenses/nonexclusive-distrib/1.0/","  Application of the phase modulated pulsed light for advance spectroscopic
measurements is the area of growing interest. The phase modulation of the light
causes modulation of the signal. Separation of the spectral components of the
modulations allows to distinguish the contributions of various interaction
pathways. The lasers with high repetition rate used in such experiments can
lead to appearance of the accumulation effects, which become especially
pronounced in systems with long-living excited states. Recently it was shown,
that such accumulation effects can be used to evaluate parameters of the
dynamical processes in the material. In this work we demonstrate that the
accumulation effects are also important in the quantum characteristics
measurements provided by modulation spectroscopy. In particular, we consider a
model of quantum two-level system driven by a train of phase-modulated light
pulses, organised in analogy with the 2D spectroscopy experiments. We evaluate
the harmonics' amplitudes in the fluorescent signal and calculate corrections
appearing from the accumulation effects. We show that the corrections can be
significant and have to be taken into account at analysis of experimental data.
","[{""version"":""v1"",""created"":""Sun, 30 Apr 2017 11:42:48 GMT""},{""version"":""v2"",""created"":""Wed, 21 Jun 2017 21:13:48 GMT""}]","2017-10-25"
"1705.00301","Marei Algarni Mr.","Marei Algarni and Ganesh Sundaramoorthi","SurfCut: Surfaces of Minimal Paths From Topological Structures",,,,,"cs.CV","http://arxiv.org/licenses/nonexclusive-distrib/1.0/","  We present SurfCut, an algorithm for extracting a smooth, simple surface with
an unknown 3D curve boundary from a noisy 3D image and a seed point. Our method
is built on the novel observation that certain ridge curves of a function
defined on a front propagated using the Fast Marching algorithm lie on the
surface. Our method extracts and cuts these ridges to form the surface
boundary. Our surface extraction algorithm is built on the novel observation
that the surface lies in a valley of the distance from Fast Marching. We show
that the resulting surface is a collection of minimal paths. Using the
framework of cubical complexes and Morse theory, we design algorithms to
extract these critical structures robustly. Experiments on three 3D datasets
show the robustness of our method, and that it achieves higher accuracy with
lower computational cost than state-of-the-art.
","[{""version"":""v1"",""created"":""Sun, 30 Apr 2017 11:56:51 GMT""}]","2017-05-02"
