"1705.00244","Francesco Caravelli","Francesco Caravelli","Locality of interactions for planar memristive circuits","5.5 pages double column, 4 figures; clarified discussion and
  corrected typos respect to published version","Phys. Rev. E 96, 052206 (2017)","10.1103/PhysRevE.96.052206",,"nlin.AO cond-mat.mes-hall physics.app-ph","http://arxiv.org/licenses/nonexclusive-distrib/1.0/","  Memristors are nonlinear passive circuit elements which can be thought as
time varying resistances. When connected in a complex circuit these exhibit
very exotic behavior, typical of disordered systems, such as a universal slow
relaxation for intricated circuit topologies, and strong dependence on the
initial conditions. Being memristive components part of a circuit, non-local
effects due to the Kirchhoff constraints are present. In the formalism
developed recently for a fairly general class of memristive circuits the
constraints are contained in a projection operator. We provide exact results
regarding the fall-off of the elements with the Hamming distance on the
circuit, thus elucidating an insofar elusive and open question regarding the
non-local effects in crossbar arrays, currently being considered for on-chip
machine learning.
","[{""version"":""v1"",""created"":""Sat, 29 Apr 2017 22:18:49 GMT""},{""version"":""v2"",""created"":""Thu, 29 Jun 2017 15:20:49 GMT""},{""version"":""v3"",""created"":""Thu, 6 Jul 2017 06:36:29 GMT""},{""version"":""v4"",""created"":""Wed, 20 Dec 2017 22:18:54 GMT""}]","2017-12-22"
"1705.00245","David P. Blecher","David P. Blecher and Zhenhua Wang","Jordan operator algebras: Basic theory","35 pages. Corrected final version. To appear Math Nachrichten. Some
  of this material was described in an OTOA2016 Conference workshop lecture in
  ISIBANG Bangalore, December 2016. We thank the organizers of that conference
  for the invitation and support",,,,"math.OA math-ph math.FA math.MP","http://arxiv.org/licenses/nonexclusive-distrib/1.0/","  Jordan operator algebras are norm-closed spaces of operators on a Hilbert
space which are closed under the Jordan product. The discovery of the present
paper is that there exists a huge and tractable theory of possibly
nonselfadjoint Jordan operator algebras; they are far more similar to
associative operator algebras than was suspected. We initiate the theory of
such algebras.
","[{""version"":""v1"",""created"":""Sat, 29 Apr 2017 22:24:48 GMT""},{""version"":""v2"",""created"":""Tue, 19 Sep 2017 18:48:53 GMT""},{""version"":""v3"",""created"":""Mon, 18 Dec 2017 22:32:36 GMT""}]","2017-12-20"
"1705.00246","Xiaonu Xiong","Xiaonu Xiong, Thomas Luu, Ulf-G. Mei{\ss}ner","Quasi-Parton Distribution Function in Lattice Perturbation Theory","25 pages, 10 figures",,,,"hep-ph hep-lat","http://arxiv.org/licenses/nonexclusive-distrib/1.0/","  Large momentum effective field theory provides a new direction for lattice
QCD calculations of hadronic structure functions, such as parton distribution
functions (PDFs), meson distribution amplitudes, and so on, directly with
$x$-dependence. In the framework of Lattice Perturbation Theory (LPT), we
compute the one-loop quark-in-quark quasi-PDF with the na\""ive fermion action
($\tilde{q}^{\mathrm{nv}}$) and quasi-PDF with Wilson-Clover action
($\tilde{q}^{\mathrm{WC}}$) and show that $\tilde{q}^{\mathrm{nv}}$ reduces to
the continuum quasi-PDF in the continuum limit. We point out, however, that the
continuum limit and massless quark limit do not commute. We find that the
condition to recover the same collinear divergence that the quasi-PDF has in
continuum QCD is $aP_3^2\approx m$ and $m\ll P_3$, while the condition to fully
recover the continuum quasi-PDF is $aP_{3}^{2}\ll m\ll P_{3}$, where $P_3$ is
the momentum in the direction of the quark's motion (longitudinal direction).
These two conditions are based on perturbation calculations and should not be
applied to non-perturbative calculations because the non-perturbative effects
cure the collinear divergence. The correction to the quasi-PDF using the
na\""ive fermion action is due to the Wilson term and can be viewed as an
$\mathcal{O}\left(a^{1}\right)$ correction. For nonzero $r$, the
$\mathcal{O}\left(a^{1}\right)$ corrections are subsequently mixed with the
quasi-PDF using the na\""ive fermion action.
","[{""version"":""v1"",""created"":""Sat, 29 Apr 2017 22:27:47 GMT""},{""version"":""v2"",""created"":""Tue, 2 May 2017 22:27:50 GMT""},{""version"":""v3"",""created"":""Thu, 11 May 2017 12:42:09 GMT""},{""version"":""v4"",""created"":""Mon, 26 Jun 2017 21:12:51 GMT""},{""version"":""v5"",""created"":""Sun, 3 Dec 2017 21:59:40 GMT""},{""version"":""v6"",""created"":""Wed, 1 Aug 2018 21:11:14 GMT""}]","2018-08-03"
"1705.00247","Aldo Rosado Fernandes Neto","A. R. Fernandes Nt. and L. F. Santos","An Analytical Solution for the Wigner-Boltzmann Transport Equation in
  the Relaxation Time Approximation","14 pages, 1 figure",,,,"cond-mat.stat-mech","http://arxiv.org/licenses/nonexclusive-distrib/1.0/","  The quantum version of the Boltzmann transport equation (Wigner-Boltzmann
equation) is a quite useful tool to investigate the effects of energy
dissipation in quantum systems. Numerical approaches uses to be employed in
order to stablish a suitable solution. In this paper, an analytical solution is
shown to exist when the constant relaxation time approximation is considered.
The formalism presented here is capable to avoid some unphysical features early
reported in literature for the conventional boundary condition scheme.
","[{""version"":""v1"",""created"":""Sat, 29 Apr 2017 22:49:56 GMT""},{""version"":""v2"",""created"":""Mon, 18 Sep 2017 17:47:20 GMT""}]","2017-09-19"
"1705.00248","Rigoberto Hernandez","Matthias Feldmaier, Andrej Junginger, J\""org Main, G\""unter Wunner,
  and Rigoberto Hernandez","Obtaining time-dependent multi-dimensional dividing surfaces using
  Lagrangian descriptors","55 pages, 4 figures, 66 references","Chemical Physics Letters 687, 194-199 (2017)","10.1016/j.cplett.2017.09.008",,"physics.chem-ph nlin.CD","http://arxiv.org/licenses/nonexclusive-distrib/1.0/","  Dynamics between reactants and products are often mediated by a
rate-determining barrier and an associated dividing surface leading to the
transition state theory rate. This framework is challenged when the barrier is
time-dependent because its motion can give rise to recrossings across the fixed
dividing surface. A non-recrossing time-dependent dividing surface can
nevertheless be attached to the TS trajectory resulting in recrossing-free
dynamics. We extend the formalism---constructed using Lagrangian
Descriptors---to systems with additional bath degrees of freedom. The
propagation of reactant ensembles provides a numerical demonstration that our
dividing surface is recrossing-free and leads to exact TST rates.
","[{""version"":""v1"",""created"":""Sat, 29 Apr 2017 22:52:36 GMT""},{""version"":""v2"",""created"":""Fri, 6 Oct 2017 13:33:59 GMT""}]","2017-10-09"
"1705.00249","Kai Wu","Kai Wu, Yingchao Huang, Dong Li","Unimem: Runtime Data Management on Non-Volatile Memory-based
  Heterogeneous Main Memory","11 pages",,,,"cs.DC","http://creativecommons.org/licenses/by/4.0/","  Non-volatile memory (NVM) provides a scalable and power-efficient solution to
replace DRAM as main memory. However, because of relatively high latency and
low bandwidth of NVM, NVM is often paired with DRAM to build a heterogeneous
memory system (HMS). As a result, data objects of the application must be
carefully placed to NVM and DRAM for best performance. In this paper, we
introduce a lightweight runtime solution that automatically and transparently
manage data placement on HMS without the requirement of hardware modifications
and disruptive change to applications. Leveraging online profiling and
performance models, the runtime characterizes memory access patterns associated
with data objects, and minimizes unnecessary data movement. Our runtime
solution effectively bridges the performance gap between NVM and DRAM. We
demonstrate that using NVM to replace the majority of DRAM can be a feasible
solution for future HPC systems with the assistance of a software-based data
management.
","[{""version"":""v1"",""created"":""Sat, 29 Apr 2017 23:19:28 GMT""},{""version"":""v2"",""created"":""Tue, 2 May 2017 01:34:11 GMT""}]","2017-05-03"
"1705.00250","Rigoberto Hernandez","Andrej Junginger, Lennart Duvenbeck, Matthias Feldmaier, J\""org Main,
  G\""unter Wunner, Rigoberto Hernandez","Chemical dynamics between wells across a time-dependent barrier:
  Self-similarity in the Lagrangian descriptor and reactive basins","7 pages, 6 figures, 50 references","J. Chem. Phys. 147, 064101 (2017)","10.1063/1.4997379",,"physics.chem-ph nlin.CD","http://arxiv.org/licenses/nonexclusive-distrib/1.0/","  In chemical or physical reaction dynamics, it is essential to distinguish
precisely between reactants and products for all time. This task is especially
demanding in time-dependent or driven systems because therein the dividing
surface (DS) between these states often exhibits a nontrivial time-dependence.
The so-called transition state (TS) trajectory has been seen to define a DS
which is free of recrossings in a large number of one-dimensional reactions
across time-dependent barriers, and, thus, allows one to determine exact
reaction rates. A fundamental challenge to applying this method is the
construction of the TS trajectory itself. The minimization of Lagrangian
descriptors (LDs) provides a general and powerful scheme to obtain that
trajectory even when perturbation theory fails. Both approaches encounter
possible breakdowns when the overall potential is bounded, admitting the
possibility of returns to the barrier long after trajectories have reached the
product or reactant wells. Such global dynamics cannot be captured by
perturbation theory. Meanwhile, in the LD-DS approach, it leads to the
emergence of additional local minima which make it difficult to extract the
optimal branch associated with the desired TS trajectory. In this work, we
illustrate this behavior for a time-dependent double-well potential revealing a
self-similar structure of the LD, and we demonstrate how the reflections and
side-minima can be addressed by an appropriate modification of the LD
associated with the direct rate across the barrier.
","[{""version"":""v1"",""created"":""Sat, 29 Apr 2017 23:23:13 GMT""},{""version"":""v2"",""created"":""Wed, 3 May 2017 14:07:22 GMT""},{""version"":""v3"",""created"":""Mon, 24 Jul 2017 15:12:55 GMT""}]","2017-08-10"
"1705.00251","Lei Shu","Lei Shu, Hu Xu, Bing Liu","Lifelong Learning CRF for Supervised Aspect Extraction","Accepted at ACL 2017. arXiv admin note: text overlap with
  arXiv:1612.07940",,,,"cs.CL","http://arxiv.org/licenses/nonexclusive-distrib/1.0/","  This paper makes a focused contribution to supervised aspect extraction. It
shows that if the system has performed aspect extraction from many past domains
and retained their results as knowledge, Conditional Random Fields (CRF) can
leverage this knowledge in a lifelong learning manner to extract in a new
domain markedly better than the traditional CRF without using this prior
knowledge. The key innovation is that even after CRF training, the model can
still improve its extraction with experiences in its applications.
","[{""version"":""v1"",""created"":""Sat, 29 Apr 2017 23:33:13 GMT""}]","2017-05-02"
"1705.00252","Jon A. Wellner","Nilanjana Laha and Jon A. Wellner","Bi-$s^*$-concave distributions","30 pages, 11 figures",,,,"math.ST stat.TH","http://arxiv.org/licenses/nonexclusive-distrib/1.0/","  We introduce a new shape-constrained class of distribution functions on R,
the bi-$s^*$-concave class. In parallel to results of D\""umbgen, Kolesnyk, and
Wilke (2017) for what they called the class of bi-log-concave distribution
functions, we show that every s-concave density f has a bi-$s^*$-concave
distribution function $F$ and that every bi-$s^*$-concave distribution function
satisfies $\gamma (F) \le 1/(1+s)$ where finiteness of $$ \gamma (F) \equiv
\sup_{x} F(x) (1-F(x)) \frac{| f' (x)|}{f^2 (x)}, $$ the Cs\""org\H{o} -
R\'ev\'esz constant of F, plays an important role in the theory of quantile
processes on $R$.
","[{""version"":""v1"",""created"":""Sat, 29 Apr 2017 23:35:14 GMT""},{""version"":""v2"",""created"":""Wed, 10 May 2017 22:47:31 GMT""}]","2017-05-12"
"1705.00253","Yanan Sui","Yanan Sui, Vincent Zhuang, Joel W. Burdick, Yisong Yue","Multi-dueling Bandits with Dependent Arms",,,,,"cs.LG","http://arxiv.org/licenses/nonexclusive-distrib/1.0/","  The dueling bandits problem is an online learning framework for learning from
pairwise preference feedback, and is particularly well-suited for modeling
settings that elicit subjective or implicit human feedback. In this paper, we
study the problem of multi-dueling bandits with dependent arms, which extends
the original dueling bandits setting by simultaneously dueling multiple arms as
well as modeling dependencies between arms. These extensions capture key
characteristics found in many real-world applications, and allow for the
opportunity to develop significantly more efficient algorithms than were
possible in the original setting. We propose the \selfsparring algorithm, which
reduces the multi-dueling bandits problem to a conventional bandit setting that
can be solved using a stochastic bandit algorithm such as Thompson Sampling,
and can naturally model dependencies using a Gaussian process prior. We present
a no-regret analysis for multi-dueling setting, and demonstrate the
effectiveness of our algorithm empirically on a wide range of simulation
settings.
","[{""version"":""v1"",""created"":""Sat, 29 Apr 2017 23:47:52 GMT""}]","2017-05-02"
"1705.00254","Qi-Feng Liang","Qi-Feng Liang, Jian Zhou, Rui Yu, Xi Wang and Hongming Weng","Interaction-driven Quantum Anomalous Hall Effect in Halogenated Hematite
  Nanosheets",,"Phys. Rev. B 96, 205412 (2017)","10.1103/PhysRevB.96.205412",,"cond-mat.mes-hall","http://arxiv.org/licenses/nonexclusive-distrib/1.0/","  Based on first-principle calculations and $k\cdot p$ model analysis, we show
that the quantum anomalous Hall (QAH) insulating phase can be realized in the
functionalized hematite (or $\alpha$-Fe$_2$O$_3$) nanosheet and the obtained
topological gap can be as large as $\sim$300 meV. The driving force of the
topological phase is the strong interactions of localized Fe 3$d$ electrons
operating on the quadratic band crossing point of the non-interacting band
structures. Such interaction driven QAH insulator is different from the single
particle band topology mechanism in experimentally realized QAH insulator, the
magnetic ion doped topological insulator film. Depending on the thickness of
the nanosheet, topological insulating state with helical-like or chiral edge
states can be realized. Our work provides a realization of the
interaction-driven QAH insulating state in a realistic material.
","[{""version"":""v1"",""created"":""Sat, 29 Apr 2017 23:52:27 GMT""}]","2017-11-15"
"1705.00255","Elena Karulina","E. S. Karulina","The extrema of the first eigenvalue of the Sturm--Liouville problem with
  third-type boundary conditions","in Russian",,,,"math.CA","http://arxiv.org/licenses/nonexclusive-distrib/1.0/","  We get the infima and suprema of the first eigenvalue of the problem $y'' +
qy + \lambda y = 0$, $y'(0) - k_0^2 y(0) = y'(1) + k_1^2 y(1) = 0$, where $q$
belongs to the set of nonnegative summable functions on [0,1] such that
$\int_0^1 q^\gamma dx = 1$, where $\gamma \in R\setminus \{0\}$.
","[{""version"":""v1"",""created"":""Sun, 30 Apr 2017 00:11:56 GMT""}]","2017-05-02"
"1705.00256","Joaqu\'in Moraga","Joaqu\'in Moraga","Bounding singular surfaces via Chern numbers","Minor changes from the first version",,,,"math.AG","http://arxiv.org/licenses/nonexclusive-distrib/1.0/","  We prove the existence of a bound on the number of steps of the minimal model
program for singular surfaces in terms of discrepancies and top Chern numbers.
As an application, we prove that given $R\in\mathbb{R}$ and $\epsilon\in
(0,1)$, the class $\mathcal{F}(R,\epsilon)$ of $2$-dimensional pairs $(X,D)$ of
general type with $\epsilon$-klt singularities, $D$ with standard coefficients,
and $4c_2(X,D)-c_1^2(X,D)\leq R$, forms a bounded family.
","[{""version"":""v1"",""created"":""Sun, 30 Apr 2017 00:12:26 GMT""},{""version"":""v2"",""created"":""Mon, 23 Oct 2017 16:01:50 GMT""},{""version"":""v3"",""created"":""Tue, 27 Feb 2018 23:28:51 GMT""},{""version"":""v4"",""created"":""Mon, 12 Mar 2018 17:25:50 GMT""}]","2018-03-13"
"1705.00257","Xiang-Feng Zhou","Xin-Ling He, Xiao-Ji Weng, Yue Zhang, Zhisheng Zhao, Zhenhai Wang, Bo
  Xu, Artem R. Oganov, Yongjun Tian, Xiang-Feng Zhou, Hui-Tian Wang","Two-dimensional boron on Pb (110) surface","6 pages, 5 figures",,,,"cond-mat.mtrl-sci","http://arxiv.org/licenses/nonexclusive-distrib/1.0/","  We simulate boron on Pb(110) surface by using ab initio evolutionary
methodology. Interestingly, the two-dimensional (2D) Dirac Pmmn boron can be
formed because of good lattice matching. Unexpectedly, by increasing the
thickness of 2D boron, a three-bonded graphene-like structure (P2_1/c boron)
was revealed to possess double anisotropic Dirac cones. It is 20 meV/atom lower
in energy than the Pmmn structure, indicating the most stable 2D boron with
particular Dirac cones. The puckered structure of P2_1/c boron results in the
peculiar Dirac cones, as well as substantial mechanical anisotropy. The
calculated Young's modulus is 320 GPa.nm along zigzag direction, which is
comparable with graphene.
","[{""version"":""v1"",""created"":""Sun, 30 Apr 2017 00:27:29 GMT""}]","2017-05-02"
"1705.00258","Fang Han","Fang Han and Christopher L. Magee","Testing the science/technology relationship by analysis of patent
  citations of scientific papers after decomposition of both science and
  technology","32 pages, 6 figures, 7 tables, the paper was presented at the 16th
  ISS conference",,,,"cs.DL physics.soc-ph","http://arxiv.org/licenses/nonexclusive-distrib/1.0/","  The relationship of scientific knowledge development to technological
development is widely recognized as one of the most important and complex
aspects of technological evolution. This paper adds to our understanding of the
relationship through use of a more rigorous structure for differentiating among
technologies based upon technological domains (defined as consisting of the
artifacts over time that fulfill a specific generic function using a specific
body of technical knowledge).
","[{""version"":""v1"",""created"":""Sun, 30 Apr 2017 00:56:15 GMT""}]","2017-05-02"
"1705.00259","Takaaki Monnai","Takaaki Monnai","Quasi adiabatic dynamics of energy eigenstates for solvable quantum
  system at finite temperature","5pages, 2figures",,"10.1088/1742-5468/aa85ac",,"cond-mat.stat-mech","http://arxiv.org/licenses/nonexclusive-distrib/1.0/","  It is a fundamental problem to characterize the nonequilibrium processes. For
a slowly moving one-dimensional potential, we explore the quasi adiabatic
dynamics of the initial energy eigenstates for a confined quantum system
interacting with a large reservoir. For concreteness, we investigate a dragged
harmonic oscillator linearly interacting with an assembly of harmonic
oscillators, and explore the deviation from adiabatic processes by rigorously
calculating the so-called persistent amplitude. In this way, we also show that
the phase of the persistent amplitudes are common both for the ground and
excited states.
","[{""version"":""v1"",""created"":""Sun, 30 Apr 2017 01:15:01 GMT""}]","2017-10-11"
"1705.00260","Lifeng Zhao","Jiaxi Huang, Youde Wang and Lifeng Zhao","Equivariant Schr\""odinger maps from two dimensional hyperbolic space",,,,,"math.AP","http://arxiv.org/licenses/nonexclusive-distrib/1.0/","  In this article, we consider the equivariant Schr\""odinger map from $\Bbb
H^2$ to $\Bbb S^2$ which converges to the north pole of $\Bbb S^2$ at the
origin and spatial infinity of the hyperbolic space. If the energy of the data
is less than $4\pi$, we show that the local existence of Schr\""odinger map.
Furthermore, if the energy of the data sufficiently small, we prove the
solutions are global in time.
","[{""version"":""v1"",""created"":""Sun, 30 Apr 2017 01:17:56 GMT""}]","2017-05-02"
"1705.00261","Tigran Hakobyan","Tigran Hakobyan, Minh Chieu Tran","Algebraically Closed Fields with a Generic Multiplicative Character","36 pages",,,,"math.LO","http://arxiv.org/licenses/nonexclusive-distrib/1.0/","  We study the model theory of the $2$-sorted structure $(\mathbb{F},
\mathbb{C};\chi)$, where $\mathbb{F}$ is an algebraic closure of a finite field
of characteristic $p$, $\mathbb{C}$ is the field of complex numbers and $\chi:
\mathbb{F} \to \mathbb{C}$ is an injective, multiplication preserving map. We
obtain an axiomatization $\mathrm{ACFC}_p$ of
$\mathrm{Th}(\mathbb{F},\mathbb{C};\chi)$ in a suitable language $L$, classify
the models of $\mathrm{ACFC}_p$ up to isomorphism, prove a modified model
companion result, give various descriptions of definable sets inside a model of
$\mathrm{ACFC}_p$, and deduce that $\mathrm{ACFC}_p$ is $\omega$-stable and has
definability of Morley rank in families.
","[{""version"":""v1"",""created"":""Sun, 30 Apr 2017 01:38:52 GMT""}]","2017-05-02"
"1705.00262","Charilaos Tsagkarakis Dr.","N.G.Antoniou, F.K.Diakonos, X.N.Maintas and C.E.Tsagkarakis","Condensation of Lee-Yang zeros in scalar field theory","6 pages,4 figures","Phys. Rev. E 95, 052145 (2017)","10.1103/PhysRevE.95.052145",,"hep-th cond-mat.stat-mech","http://arxiv.org/licenses/nonexclusive-distrib/1.0/","  We show that, at the critical temperature, there is a class of Lee-Yang zeros
of the partition function in a general scalar field theory, which location
scales with the size of the system with a characteristic exponent expressed in
terms of the isothermal critical exponent $\delta$. In the thermodynamic limit
the zeros belonging to this class condense to the critical point {\zeta}=1 on
the real axis in the complex fugacity plane while the complementary set of
zeros (with Re {\zeta} < 1) covers uniformly the unit circle. Although the
aforementioned class degenerates to a single point for an infinite system, when
the size is finite it dominates in the partition function and determines the
self-similar structure (fractal geometry, scaling laws) of the critical system.
This property opens up the perspective to formulate finite-size scaling theory
in effective QCD, near the chiral critical point, in terms of the location of
Lee-Yang zeros.
","[{""version"":""v1"",""created"":""Sun, 30 Apr 2017 01:51:01 GMT""}]","2017-06-07"
"1705.00263","Fred Jegerlehner","Fred Jegerlehner","Muon g-2 Theory: the Hadronic Part","17 pages, 26 figures",,"10.1051/epjconf/201816600022","DESY 17-058, HU-EP-17/12","hep-ph","http://arxiv.org/licenses/nonexclusive-distrib/1.0/","  I present a status report of the hadronic vacuum polarization effects for the
muon $g-2$, to be considered as an update of [1]. The update concerns recent
new inclusive $R$ measurements from KEDR in the energy range 1.84 to 3.72 GeV.
For the leading order contributions I find $a_\mu^{\mathrm{had}(1)}=(688.07\pm
4.14)[688.77\pm3.38]\times 10^{-10}$ based on $e^+e^-$data [incl. $\tau$ data],
$a_\mu^{\mathrm{had}(2)}= (-9.93\pm 0.07) \times 10^{-10}$ (NLO) and
$a_\mu^{\mathrm{had}(3)}= (1.22\pm 0.01) \times 10^{-10}$ (NNLO). Collecting
recent progress in the hadronic light-by-light scattering I adopt
$\pi^0,\eta,\eta'$ [$95 \pm 12$] + axial--vector [$8 \pm ~3$] + scalar [$-6\pm
~1$] + $\pi,K$ loops [$-20\pm 5$] + quark loops [$22\pm ~4$] + tensor [$1\pm
~0$] + NLO [$3\pm ~2$] which yields $
a^{(6)}_\mu(\mathrm{lbl},\mathrm{had})=(103 \pm 29) \times 10^{-11}.$ With
these updates I find $a_\mu^{\rm exp}-a_\mu^{\rm the}=(31.3\pm 7.7)\times
10^{-10}$ a 4.1 $\sigma$ deviation. Recent lattice QCD results and future
prospects to improve hadronic contributions are discussed.
","[{""version"":""v1"",""created"":""Sun, 30 Apr 2017 02:30:23 GMT""}]","2018-02-14"
"1705.00264","Yingchao Huang","Yingchao Huang, Kai Wu, Dong Li","High Performance Data Persistence in Non-Volatile Memory for Resilient
  High Performance Computing",,,,,"cs.DC","http://arxiv.org/licenses/nonexclusive-distrib/1.0/","  Resilience is a major design goal for HPC. Checkpoint is the most common
method to enable resilient HPC. Checkpoint periodically saves critical data
objects to non-volatile storage to enable data persistence. However, using
checkpoint, we face dilemmas between resilience, recomputation and checkpoint
cost. The reason that accounts for the dilemmas is the cost of data copying
inherent in checkpoint. In this paper we explore how to build resilient HPC
with non-volatile memory (NVM) as main memory and address the dilemmas. We
introduce a variety of optimization techniques that leverage high performance
and non-volatility of NVM to enable high performance data persistence for data
objects in applications. With NVM we avoid data copying; we optimize cache
flushing needed to ensure consistency between caches and NVM. We demonstrate
that using NVM is feasible to establish data persistence frequently with small
overhead (4.4% on average) to achieve highly resilient HPC and minimize
recomputation.
","[{""version"":""v1"",""created"":""Sun, 30 Apr 2017 03:24:14 GMT""},{""version"":""v2"",""created"":""Tue, 2 May 2017 01:02:33 GMT""}]","2017-05-03"
