"1705.00302","Tim Austin","Tim Austin","Measure concentration and the weak Pinsker property","139p [v2:] Improvements for clarity and generality. Many typos fixed.
  Some terminology simplified, removed, or made more standard; notation
  adjusted accordingly. Old Conjecture C is now Theorem C. Old Part II now
  split into Parts II and III. Several e.g.s added to Part I, and several
  consequences and open problems to the end of Part III. [v3 and 4:] Small
  corrections following ref report","This is a pre-print of an article published in Publ.math.IHES
  (2018). The final authenticated version is available online at:
  https://doi.org/10.1007/s10240-018-0098-3","10.1007/s10240-018-0098-3",,"math.DS math.MG math.PR","http://arxiv.org/licenses/nonexclusive-distrib/1.0/","  Let $(X,\mu)$ be a standard probability space. An automorphism $T$ of
$(X,\mu)$ has the weak Pinsker property if for every $\varepsilon > 0$ it has a
splitting into a direct product of a Bernoulli shift and an automorphism of
entropy less than $\varepsilon$. This property was introduced by Thouvenot, who
asked whether it holds for all ergodic automorphisms.
  This paper proves that it does. The proof actually gives a more general
result. Firstly, it gives a relative version: any factor map from one ergodic
automorphism to another can be enlarged by arbitrarily little entropy to become
relatively Bernoulli. Secondly, using some facts about relative orbit
equivalence, the analogous result holds for all free and ergodic
measure-preserving actions of a countable amenable group.
  The key to this work is a new result about measure concentration. Suppose now
that $\mu$ is a probability measure on a finite product space $A^n$, and endow
this space with its Hamming metric. We prove that $\mu$ may be represented as a
mixture of other measures in which (i) most of the weight in the mixture is on
measures that exhibit a strong kind of concentration, and (ii) the number of
summands is bounded in terms of the difference between the Shannon entropy of
$\mu$ and the combined Shannon entropies of its marginals.
","[{""version"":""v1"",""created"":""Sun, 30 Apr 2017 11:59:39 GMT""},{""version"":""v2"",""created"":""Mon, 16 Oct 2017 19:11:54 GMT""},{""version"":""v3"",""created"":""Thu, 1 Feb 2018 20:43:08 GMT""},{""version"":""v4"",""created"":""Fri, 16 Feb 2018 05:06:58 GMT""}]","2018-02-19"
"1705.00303","Beishui Liao","Beishui Liao and Leendert van der Torre","Defense semantics of argumentation: encoding reasons for accepting
  arguments","14 pages, first submitted on April 30, 2017; 16 pages, revised in
  terms of the comments from MIREL2017 on August 03, 2017",,,,"cs.AI","http://arxiv.org/licenses/nonexclusive-distrib/1.0/","  In this paper we show how the defense relation among abstract arguments can
be used to encode the reasons for accepting arguments. After introducing a
novel notion of defenses and defense graphs, we propose a defense semantics
together with a new notion of defense equivalence of argument graphs, and
compare defense equivalence with standard equivalence and strong equivalence,
respectively. Then, based on defense semantics, we define two kinds of reasons
for accepting arguments, i.e., direct reasons and root reasons, and a notion of
root equivalence of argument graphs. Finally, we show how the notion of root
equivalence can be used in argumentation summarization.
","[{""version"":""v1"",""created"":""Sun, 30 Apr 2017 12:06:28 GMT""},{""version"":""v2"",""created"":""Wed, 2 Aug 2017 15:46:21 GMT""}]","2017-08-03"
"1705.00304","Xiaofeng Xu","X. Z. Xing, C. Q. Xu, N. Zhou, B. Li, Jinglei Zhang, Z. X. Shi, and
  Xiaofeng Xu","Large linear magnetoresistance in a transition-metal stannide
  $\beta$-RhSn$_4$","4 pages, 4 figures","Appl. Phys. Lett. 109, 122403 (2016)","10.1063/1.4963073",,"cond-mat.str-el cond-mat.mtrl-sci","http://arxiv.org/licenses/nonexclusive-distrib/1.0/","  Materials exhibiting large magnetoresistance may not only be of fundamental
research interest, but also can lead to wide-ranging applications in magnetic
sensors and switches. Here we demonstrate a large linear-in-field
magnetoresistance, $\Delta \rho/\rho$ reaching as high as $\sim$600$\%$ at 2 K
under a 9 Tesla field, in the tetragonal phase of a transiton-metal stannide
$\beta$-RhSn$_4$. Detailed analyses show that its magnetic responses are
overall inconsistent with the classical model based on the multiple electron
scattering by mobility fluctuations in an inhomogenous conductor, but rather in
line with the quantum effects due to the presence of Dirac-like dispersions in
the electronic structure. Our results may help guiding the future quest for
quantum magnetoresistive materials into the family of stannides, similar to the
role played by PtSn$_4$ with topological node arcs.
","[{""version"":""v1"",""created"":""Sun, 30 Apr 2017 12:23:30 GMT""}]","2017-05-10"
"1705.00305","Arkady Tseytlin","M. Beccaria and A.A. Tseytlin","$C_T$ for higher derivative conformal fields and anomalies of (1,0)
  superconformal 6d theories","30 pages. v2: minor corrections and refs added; v3: new section 6
  with independent confirmation of the main result for anomalies of higher
  derivative vector multiplet and new appendix C",,"10.1007/JHEP06(2017)002","Imperial-TP-AT-2017-05, NSF-KITP-17-061","hep-th","http://arxiv.org/licenses/nonexclusive-distrib/1.0/","  In arXiv:1510.02685 we proposed linear relations between the Weyl anomaly
$c_1, c_2, c_3$ coefficients and the 4 coefficients in the chiral anomaly
polynomial for (1,0) superconformal 6d theories. These relations were
determined up to one free parameter $\xi$ and its value was then conjectured
using some additional assumptions. A different value for $\xi$ was recently
suggested in arXiv:1702.03518 using a different method. Here we confirm that
this latter value is indeed the correct one by providing an additional data
point: the Weyl anomaly coefficient $c_3$ for the higher derivative (1,0)
superconformal 6d vector multiplet. This multiplet contains the 4-derivative
conformal gauge vector, 3-derivative fermion and 2-derivative scalar. We find
the corresponding value of $c_3$ which is proportional to the coefficient $C_T$
in the 2-point function of stress tensor using its relation to the first
derivative of the Renyi entropy or the second derivative of the free energy on
the product of thermal circle and 5d hyperbolic space. We present some general
results of computation of the Renyi entropy and $C_T$ from the partition
function on $S^1 \times \mathbb H^{d-1}$ for higher derivative conformal
scalars, spinors and vectors in even dimensions. We also give an independent
derivation of the conformal anomaly coefficients of the higher derivative
vector multiplet from the Seeley-DeWitt coefficients on an Einstein background.
","[{""version"":""v1"",""created"":""Sun, 30 Apr 2017 12:32:50 GMT""},{""version"":""v2"",""created"":""Thu, 4 May 2017 13:13:07 GMT""},{""version"":""v3"",""created"":""Mon, 8 May 2017 16:30:04 GMT""}]","2017-06-28"
"1705.00306","Masashi Yokoyama","Masashi Yokoyama (for the Hyper-Kamiokande Proto-collaboration)","The Hyper-Kamiokande Experiment","Talk presented at NuPhys2016 (London, 12-14 December 2016). 9 pages,
  LaTeX, 5 figures",,,"NuPhys2016-Yokoyama","hep-ex hep-ph physics.ins-det","http://arxiv.org/licenses/nonexclusive-distrib/1.0/","  Hyper-Kamiokande (HK) is a next generation large water Cherenkov detector to
be built in Japan, based on the highly successful Super-Kamiokande detector. HK
will offer a broad science program such as neutrino oscillation studies, proton
decay searches, and neutrino astrophysics with unprecedented sensitivities.
This paper describes the overview and physics potential of HK.
","[{""version"":""v1"",""created"":""Sun, 30 Apr 2017 12:34:09 GMT""}]","2019-08-14"
"1705.00307","Jaeyong Rho","Jaeyong Rho, Takuya Azumi, Mayo Nakagawa, Kenya Sato, Nobuhiko Nishio","Scheduling Parallel and Distributed Processing for Automotive Data
  Stream Management System","Accepted for publication at Journal of Parallel and Distributed
  Computing (Elsevier) 2017","J. Parallel Distrib. Comput. 109: 286-300 (2017)","10.1016/j.jpdc.2017.06.012",,"cs.DC","http://arxiv.org/licenses/nonexclusive-distrib/1.0/","  In this paper, to analyze end-to-end timing behavior in heterogeneous
processor and network environments accurately, we adopt a heterogeneous
selection value on communication contention (HSV_CC) algorithm, which can
synchronize tasks and messages simultaneously, for stream processing
distribution. In order to adapt HSV_CC to automotive data stream management
system (DSMSs), one must address three issues: (i) previous task and message
schedules might lead to less efficient resource usages; (ii) the conventional
method to determine the task scheduling order may not be best suited to deal
with stream processing graphs, and; (iii) there is a need to be able to
schedule tasks with time-varying computational requirements efficiently. To
address (i), we propose the heterogeneous value with load balancing and
communication contention (HVLB_CC) (A) algorithm, which considers load
balancing in addition to the parameters considered by the HSV_CC algorithm. We
propose HVLB_CC (B) to address issue (ii). HVLB_CC (B) can deal with stream
processing task graphs and more various directed acyclic graphs to prevent
assigning a higher priority to successor tasks. In addition, to address issue
(iii), we propose HVLB_CC_IC. To schedule tasks more efficiently with various
computation times, HVLB_CC_IC utilizes schedule holes left in processors. These
idle time slots can be used for the execution of an optional part to generate
more precise data results by applying imprecise computation models.
Experimental results demonstrate that the proposed algorithms improve minimum
schedule length, accuracy, and load balancing significantly compared to the
HSV_CC algorithm. In addition, the proposed HVLB_CC (B) algorithm can schedule
more varied task graphs without reducing performance, and, using imprecise
computation models, HVLB_CC_IC yields higher precision data than HVLB_CC
without imprecise computation models.
","[{""version"":""v1"",""created"":""Sun, 30 Apr 2017 12:39:38 GMT""},{""version"":""v2"",""created"":""Sun, 18 Jun 2017 06:09:29 GMT""}]","2017-09-12"
"1705.00308","Tadahisa Nara","Yasutsugu Fujita and Tadahisa Nara","The Mordell-Weil bases for the elliptic curve of the form
  $\boldsymbol{y^2=x^3-m^2x+n^2}$","A version with codes",,,,"math.NT","http://arxiv.org/licenses/nonexclusive-distrib/1.0/","  Let $E_{m,n}$ be an elliptic curve over $\mathbb{Q}$ of the form
$y^2=x^3-m^2x+n^2$, where $m$ and $n$ are positive integers. Brown and Myers
showed that the curve $E_{1,n}$ has rank at least two for all $n$. In the
present paper, we specify the two points which can be extended to a basis for
$E_{1,n}(\mathbb{Q})$ under certain conditions described explicitly. Moreover,
we verify a similar result for the curve $E_{m,1}$, which, however, gives a
basis for the rank three part of $E_{m,1}(\mathbb{Q})$.
","[{""version"":""v1"",""created"":""Sun, 30 Apr 2017 12:49:05 GMT""}]","2017-05-02"
"1705.00309","Arsenii Titov","J. T. Penedo, S. T. Petcov, A. V. Titov","Neutrino Mixing and Leptonic CP Violation from $S_4$ Flavour and
  Generalised CP Symmetries","56 pages, includes 16 figures and 8 tables; the discussion on the
  possibility to discriminate experimentally between the different cases
  extended and a new related figure added; the discussion of neutrinoless
  double beta decay extended; references added; typos corrected; matches
  version published in JHEP","JHEP 12 (2017) 022","10.1007/JHEP12(2017)022","SISSA 20/2017/FISI, IPMU17-0057","hep-ph","http://arxiv.org/licenses/nonexclusive-distrib/1.0/","  We consider a class of models of neutrino mixing with $S_4$ lepton flavour
symmetry combined with a generalised CP symmetry, which are broken to residual
$Z_2$ and $Z_2 \times H^\nu_{\rm CP}$ symmetries in the charged lepton and
neutrino sectors, respectively, $H^\nu_{\rm CP}$ being a remnant CP symmetry of
the neutrino Majorana mass term. In this set-up the neutrino mixing angles and
CP violation (CPV) phases of the neutrino mixing matrix depend on three real
parameters - two angles and a phase. We classify all phenomenologically viable
mixing patterns and derive predictions for the Dirac and Majorana CPV phases.
Further, we use the results obtained on the neutrino mixing angles and leptonic
CPV phases to derive predictions for the effective Majorana mass in
neutrinoless double beta decay.
","[{""version"":""v1"",""created"":""Sun, 30 Apr 2017 12:50:57 GMT""},{""version"":""v2"",""created"":""Wed, 6 Dec 2017 16:12:06 GMT""}]","2017-12-07"
"1705.00310","Antonio Soares de Castro","M.G. Garcia, A.S. de Castro, P. Alberto, L.B. Castro","Solutions of the three-dimensional radial Dirac equation from the
  Schr\""odinger equation with one-dimensional Morse potential","arXiv admin note: text overlap with arXiv:1703.00578",,,,"hep-th math-ph math.MP quant-ph","http://arxiv.org/licenses/nonexclusive-distrib/1.0/","  New exact analytical bound-state solutions of the radial Dirac equation in
3+1 dimensions for two sets of couplings and radial potential functions are
obtained via mapping onto the nonrelativistic bound-state solutions of the
one-dimensional generalized Morse potential. The eigenfunctions are expressed
in terms of generalized Laguerre polynomials, and the eigenenergies are
expressed in terms of solutions of equations that can be transformed into
polynomial equations. Several analytical results found in the literature,
including the Dirac oscillator, are obtained as particular cases of this
unified approach.
","[{""version"":""v1"",""created"":""Sun, 30 Apr 2017 13:06:48 GMT""}]","2017-05-03"
"1705.00311","Bal\'azs Csik\'os","Bal\'azs Csik\'os, M\'arton Horv\'ath","Harmonic Manifolds and Tubes","14 pages, grant numbers are updated",,,,"math.DG","http://arxiv.org/licenses/nonexclusive-distrib/1.0/","  The authors showed in a preceding paper that in a connected locally harmonic
manifold, the volume of a tube of small radius about a regularly parameterized
simple arc depends only on the length of the arc and the radius. In this paper,
we show that this property characterizes harmonic manifolds even if it is
assumed only for tubes about geodesic segments. As a consequence, we obtain
similar characterizations of harmonic manifolds in terms of the total mean
curvature and the total scalar curvature of tubular hypersurfaces about curves.
We find simple formulae expressing the volume, total mean curvature, and total
scalar curvature of tubular hypersurfaces about a curve in a harmonic manifold
as a function of the volume density function.
","[{""version"":""v1"",""created"":""Sun, 30 Apr 2017 13:13:18 GMT""},{""version"":""v2"",""created"":""Sun, 23 Jul 2017 08:21:38 GMT""}]","2017-07-25"
"1705.00312","Jie-Cheng Lin","Y.T. Chen, J.C. Lin, J.T. Chen, K.N. Chu, K. Huang, S. Koirala, J.J.
  Liau, F.H. Lin, K.P. Lin, J.G. Shiu, M.Z. Wang","Calibration and Irradiation Study of the BGO Background Monitor for the
  BEAST II Experiment",,,"10.1088/1748-0221/12/10/P10012",,"physics.ins-det","http://arxiv.org/licenses/nonexclusive-distrib/1.0/","  Beam commissioning of the SuperKEKB collider began in 2016. The Beam Exorcism
for A STable experiment II (BEAST II) project is particularly designed to
measure the beam backgrounds around the interaction point of the SuperKEKB
collider for the Belle II experiment. We develop a system using bismuth
germanium oxide (BGO) crystals with optical fibers connecting to a multianode
photomultiplier tube (MAPMT) and a field-programmable gate array (FPGA)
embedded readout board for monitoring the real-time beam backgrounds in BEAST
II. The overall radiation sensitivity of this system is estimated to be
$(2.20\pm0.26)\times10^{-12}$ Gy/ADU (analog-to-digital unit) with the standard
10 m fibers for transmission and the MAPMT operating at 700 V. Our $\gamma$-ray
irradiation study of the BGO system shows that the exposure of BGO crystals to
$^{60}$Co $\gamma$-ray doses of 1 krad has led to immediate light output
reductions of 25--40%, and the light outputs further drop by 30--45% after the
crystals receive doses of 2--4 krad. Our findings agree with those of the
previous studies on the radiation hard (RH) BGO crystals grown by the low
thermal gradient Czochralski (LTG Cz) technology. The absolute dose from the
BGO system is also consistent with the simulation, and is estimated to be about
1.18 times the equivalent dose. These results prove that the BGO system is able
to monitor the background dose rate in real time under extreme high radiation
conditions. This study concludes that the BGO system is reliable for the beam
background study in BEAST II.
","[{""version"":""v1"",""created"":""Sun, 30 Apr 2017 13:16:54 GMT""},{""version"":""v2"",""created"":""Wed, 23 Aug 2017 01:26:11 GMT""},{""version"":""v3"",""created"":""Thu, 24 Aug 2017 02:49:53 GMT""},{""version"":""v4"",""created"":""Sun, 3 Sep 2017 15:06:42 GMT""},{""version"":""v5"",""created"":""Tue, 5 Sep 2017 16:20:19 GMT""},{""version"":""v6"",""created"":""Mon, 25 Sep 2017 20:08:07 GMT""},{""version"":""v7"",""created"":""Sun, 1 Oct 2017 06:35:50 GMT""}]","2017-11-22"
"1705.00313","Zhizhang Wang","Daguang Chen, Haizhong Li and Zhizhang Wang","Starshaped compact hypersurfaces with prescirbed Weingarten curvature in
  warped product manifolds",,,,,"math.AP math.DG","http://arxiv.org/licenses/nonexclusive-distrib/1.0/","  Given a compact Riemannian manifold $M$, we consider a warped product $\bar M
= I \times_h M$ where $I$ is an open interval in $\Bbb R$. For a positive
function $\psi$ defined on $\bar M$, we generalized the arguments in
\cite{GRW2015} and \cite{RW16}, to obtain the curvature estimates for Hessian
equations $\sigma_k(\kappa)=\psi(V,\nu(V))$. We also obtain some existence
results for the starshaped compact hypersurface $\Sigma$ satisfying the above
equation with various assumptions.
","[{""version"":""v1"",""created"":""Sun, 30 Apr 2017 13:29:35 GMT""}]","2017-05-02"
"1705.00314","Hongfei Fu","Krishnendu Chatterjee, Hongfei Fu, Aniket Murhekar","Automated Recurrence Analysis for Almost-Linear Expected-Runtime Bounds","41 pages, Full Version to CAV 2017",,,,"cs.PL cs.DS","http://arxiv.org/licenses/nonexclusive-distrib/1.0/","  We consider the problem of developing automated techniques for solving
recurrence relations to aid the expected-runtime analysis of programs. Several
classical textbook algorithms have quite efficient expected-runtime complexity,
whereas the corresponding worst-case bounds are either inefficient (e.g.,
QUICK-SORT), or completely ineffective (e.g., COUPON-COLLECTOR). Since the main
focus of expected-runtime analysis is to obtain efficient bounds, we consider
bounds that are either logarithmic, linear, or almost-linear ($\mathcal{O}(\log
n)$, $\mathcal{O}(n)$, $\mathcal{O}(n\cdot\log n)$, respectively, where n
represents the input size). Our main contribution is an efficient (simple
linear-time algorithm) sound approach for deriving such expected-runtime bounds
for the analysis of recurrence relations induced by randomized algorithms. Our
approach can infer the asymptotically optimal expected-runtime bounds for
recurrences of classical randomized algorithms, including RANDOMIZED-SEARCH,
QUICK-SORT, QUICK-SELECT, COUPONCOLLECTOR, where the worst-case bounds are
either inefficient (such as linear as compared to logarithmic of
expected-runtime, or quadratic as compared to linear or almost-linear of
expected-runtime), or ineffective. We have implemented our approach, and the
experimental results show that we obtain the bounds efficiently for the
recurrences of various classical algorithms.
","[{""version"":""v1"",""created"":""Sun, 30 Apr 2017 13:30:01 GMT""}]","2017-05-02"
"1705.00315","Lior Kornblum","Dana Cohen-Azarzar, Maria Baskin, Lior Kornblum","Band offsets at amorphous-crystalline $Al_2O_3-SrTiO_3$ oxide interfaces","14 pages, 6 figures (including Supplementary Material). Accepted to
  JAP",,"10.1063/1.5030119",,"cond-mat.mtrl-sci","http://arxiv.org/licenses/nonexclusive-distrib/1.0/","  2D electron gases (2DEGs) formed at oxide interfaces provide a rich testbed
for fundamental physics and device applications. While the discussion of the
physical origins of this phenomenon continues, the recent discovery of oxide
2DEGs at non-epitaxial interfaces between amorphous and crystalline oxides
provides useful insight onto this debate. Furthermore, using amorphous oxides
offers a low-cost route towards realizing 2DEGs for device applications. In
this work, the band offsets of a simple model system of amorphous-crystalline
oxide interface are investigated. The model system consists of amorphous
$Al_2O_3$ grown on single-crystalline (001) $SrTiO_3$. X-ray photoelectron
spectroscopy is employed to study the chemical states, band gap and band
offsets at the interface. The density of ionic defects near the interface is
found to be below the detection limit, and the interface is found to be
insulating. Analysis of the relative band structure yields significant
interfacial barriers, exceeding 1.05 eV for holes and 2.0 eV for electrons. The
barrier for holes is considerably larger than what is known for related
materials systems, outlining the promise of using amorphous $Al_2O_3$ as an
effective and simple insulator, an important building block for oxide-based
field effect devices.
","[{""version"":""v1"",""created"":""Sun, 30 Apr 2017 13:37:42 GMT""},{""version"":""v2"",""created"":""Sun, 27 May 2018 19:03:31 GMT""}]","2018-08-01"
"1705.00316","Hui Su","Xiaoyu Shen, Hui Su, Yanran Li, Wenjie Li, Shuzi Niu, Yang Zhao, Akiko
  Aizawa and Guoping Long","A Conditional Variational Framework for Dialog Generation","Accepted by ACL2017",,,,"cs.CL","http://arxiv.org/licenses/nonexclusive-distrib/1.0/","  Deep latent variable models have been shown to facilitate the response
generation for open-domain dialog systems. However, these latent variables are
highly randomized, leading to uncontrollable generated responses. In this
paper, we propose a framework allowing conditional response generation based on
specific attributes. These attributes can be either manually assigned or
automatically detected. Moreover, the dialog states for both speakers are
modeled separately in order to reflect personal features. We validate this
framework on two different scenarios, where the attribute refers to genericness
and sentiment states respectively. The experiment result testified the
potential of our model, where meaningful responses can be generated in
accordance with the specified attributes.
","[{""version"":""v1"",""created"":""Sun, 30 Apr 2017 13:52:49 GMT""},{""version"":""v2"",""created"":""Fri, 26 May 2017 08:08:53 GMT""},{""version"":""v3"",""created"":""Wed, 31 May 2017 19:58:49 GMT""},{""version"":""v4"",""created"":""Thu, 6 Jul 2017 09:03:45 GMT""}]","2017-07-07"
"1705.00317","Hongfei Fu","Krishnendu Chatterjee, Hongfei Fu, Amir Kafshdar Goharshady","Non-polynomial Worst-Case Analysis of Recursive Programs","54 Pages, Full Version to CAV 2017",,,,"cs.PL","http://arxiv.org/licenses/nonexclusive-distrib/1.0/","  We study the problem of developing efficient approaches for proving
worst-case bounds of non-deterministic recursive programs. Ranking functions
are sound and complete for proving termination and worst-case bounds of
nonrecursive programs. First, we apply ranking functions to recursion,
resulting in measure functions. We show that measure functions provide a sound
and complete approach to prove worst-case bounds of non-deterministic recursive
programs. Our second contribution is the synthesis of measure functions in
nonpolynomial forms. We show that non-polynomial measure functions with
logarithm and exponentiation can be synthesized through abstraction of
logarithmic or exponentiation terms, Farkas' Lemma, and Handelman's Theorem
using linear programming. While previous methods obtain worst-case polynomial
bounds, our approach can synthesize bounds of the form $\mathcal{O}(n\log n)$
as well as $\mathcal{O}(n^r)$ where $r$ is not an integer. We present
experimental results to demonstrate that our approach can obtain efficiently
worst-case bounds of classical recursive algorithms such as (i) Merge-Sort, the
divide-and-conquer algorithm for the Closest-Pair problem, where we obtain
$\mathcal{O}(n \log n)$ worst-case bound, and (ii) Karatsuba's algorithm for
polynomial multiplication and Strassen's algorithm for matrix multiplication,
where we obtain $\mathcal{O}(n^r)$ bound such that $r$ is not an integer and
close to the best-known bounds for the respective algorithms.
","[{""version"":""v1"",""created"":""Sun, 30 Apr 2017 14:09:14 GMT""}]","2017-05-02"
