"1703.07400","Elena Giorgi","Elena Giorgi","On the local extension of Killing vector fields in electrovacuum
  spacetimes","20 pages. Version accepted for publication in Ann. Henri Poincar\'e.
  arXiv admin note: text overlap with arXiv:1108.3575 by other authors",,"10.1007/s00023-019-00811-5",,"gr-qc math.DG","http://arxiv.org/licenses/nonexclusive-distrib/1.0/","  We revisit the problem of extension of a Killing vector field in a spacetime
which is solution to the Einstein-Maxwell equation. This extension has been
proved to be unique in the case of a Killing vector field which is normal to a
bifurcate horizon by Yu. Here we generalize the extension of the vector field
to a strong null convex domain in an electrovacuum spacetime, inspired by the
same technique used by Ionescu-Klainerman in the setting of Ricci flat
manifolds. We also prove a result concerning non-extendibility: we show that
one can find local, stationary electrovacuum extension of a Kerr-Newman
solution in a full neighborhood of a point of the horizon (that is not on the
bifurcation sphere) which admits no extension of the Hawking vector field. This
generalizes the construction by Ionescu-Klainerman to the electrovacuum case.
","[{""version"":""v1"",""created"":""Tue, 21 Mar 2017 19:38:00 GMT""},{""version"":""v2"",""created"":""Thu, 23 May 2019 23:01:18 GMT""}]","2019-05-28"
"1703.07401","Evgeny Ivanko","Evgeny Ivanko","Big-data approach in abundance estimation of non-identifiable animals
  with camera-traps at the spots of attraction","4 figures",,,,"q-bio.QM","http://arxiv.org/licenses/nonexclusive-distrib/1.0/","  Camera-traps is a relatively new but already popular instrument in the
estimation of abundance of non-identifiable animals. Although camera-traps are
convenient in application, there remain both theoretical complications such as
spatial autocorrelation or false negative problem and practical difficulties,
for example, laborious random sampling. In the article we propose an
alternative way to bypass the mentioned problems.
  In the proposed approach, the raw video information collected from the
camera-traps situated at the spots of natural attraction is turned into the
frequency of visits, and the latter is transformed into the desired abundance
estimate. The key for such a transformation is the application of the
correction coefficients, computed for each particular observation environment
using the Bayesian approach and the massive database (DB) of observations under
various conditions.
  The main result of the article is a new method of census based on video-data
from camera-traps at the spots of natural attraction and information from a
special community-driven database.
  The proposed method is based on automated video-capturing at a moderate
number of easy to reach spots, so in the long term many laborious census works
may be conducted easier, cheaper and cause less disturbance for the wild life.
Information post-processing is strictly formalized, which leaves little chance
for subjective alterations. However, the method heavily relies on the volume
and quality of the DB, which in its turn heavily relies on the efforts of the
community. There is realistic hope that the community of zoologists and
environment specialists could create and maintain a DB similar to the proposed
one. Such a rich DB of visits might benefit not only censuses, but also many
behavioral studies.
","[{""version"":""v1"",""created"":""Tue, 21 Mar 2017 19:39:09 GMT""}]","2017-03-23"
"1703.07402","Nicolai Wojke","Nicolai Wojke and Alex Bewley and Dietrich Paulus","Simple Online and Realtime Tracking with a Deep Association Metric","5 pages, 1 figure",,,,"cs.CV","http://arxiv.org/licenses/nonexclusive-distrib/1.0/","  Simple Online and Realtime Tracking (SORT) is a pragmatic approach to
multiple object tracking with a focus on simple, effective algorithms. In this
paper, we integrate appearance information to improve the performance of SORT.
Due to this extension we are able to track objects through longer periods of
occlusions, effectively reducing the number of identity switches. In spirit of
the original framework we place much of the computational complexity into an
offline pre-training stage where we learn a deep association metric on a
large-scale person re-identification dataset. During online application, we
establish measurement-to-track associations using nearest neighbor queries in
visual appearance space. Experimental evaluation shows that our extensions
reduce the number of identity switches by 45%, achieving overall competitive
performance at high frame rates.
","[{""version"":""v1"",""created"":""Tue, 21 Mar 2017 19:40:25 GMT""}]","2017-03-23"
"1703.07403","Kevin Moerman","Andr\'e M.J. Sprengers, Matthan W.A. Caan, Kevin M. Moerman, Aart J.
  Nederveen, Rolf M.J.N. Lamerichs, Jaap Stoker","A scale space based algorithm for automated segmentation of single shot
  tagged MRI of shearing deformation",,"Magnetic Resonance Materials in Physics, Biology and Medicine,
  April 2013, Volume 26, Issue 2, pp 229-238","10.1007/s10334-012-0332-9",,"physics.med-ph","http://arxiv.org/licenses/nonexclusive-distrib/1.0/","  Object This study proposes a scale space based algorithm for automated
segmentation of single-shot tagged images of modest SNR. Furthermore the
algorithm was designed for analysis of discontinuous or shearing types of
motion, i.e. segmentation of broken tag patterns.
  Materials and methods The proposed algorithm utilizes non-linear scale space
for automatic segmentation of single-shot tagged images. The algorithm's
ability to automatically segment tagged shearing motion was evaluated in a
numerical simulation and in vivo. A typical shearing deformation was simulated
in a Shepp-Logan phantom allowing for quantitative evaluation of the
algorithm's success rate as a function of both SNR and the amount of
deformation. For a qualitative in vivo evaluation tagged images showing
deformations in the calf muscles and eye movement in a healthy volunteer were
acquired.
  Results Both the numerical simulation and the in vivo tagged data
demonstrated the algorithm's ability for automated segmentation of single-shot
tagged MR provided that SNR of the images is above 10 and the amount of
deformation does not exceed the tag spacing. The latter constraint can be met
by adjusting the tag delay or the tag spacing.
  Conclusion The scale space based algorithm for automatic segmentation of
single-shot tagged MR enables the application of tagged MR to complex
(shearing) deformation and the processing of datasets with relatively low SNR.
","[{""version"":""v1"",""created"":""Tue, 21 Mar 2017 19:41:27 GMT""}]","2017-03-23"
"1703.07404","Sylvain Lavau","Sylvain Lavau","Lie $\infty$-algebroids and singular foliations","PhD Thesis, 100 pages, 8 figures",,,,"math.DG","http://arxiv.org/licenses/nonexclusive-distrib/1.0/","  A singular (or Hermann) foliation on a smooth manifold $M$ can be seen as a
subsheaf of the sheaf $\mathfrak{X}$ of vector fields on $M$. We show that if
this singular foliation admits a resolution (in the sense of sheaves)
consisting of sections of a graded vector bundle of finite type, then one can
lift the Lie bracket of vector fields to a Lie $\infty$-algebroid structure on
this resolution, that we call a universal Lie $\infty$-algebroid associated to
the foliation. The name is justified because it is isomorphic (up to homotopy)
to any other Lie $\infty$-algebroid structure built on any other resolution of
the given singular foliation.
","[{""version"":""v1"",""created"":""Tue, 21 Mar 2017 19:43:58 GMT""},{""version"":""v2"",""created"":""Thu, 13 Apr 2017 08:41:52 GMT""},{""version"":""v3"",""created"":""Sat, 19 Aug 2017 08:13:44 GMT""},{""version"":""v4"",""created"":""Sun, 17 Sep 2017 00:46:03 GMT""},{""version"":""v5"",""created"":""Thu, 19 Jul 2018 13:58:23 GMT""}]","2018-07-20"
"1703.07405","Georgios Rigas","Georgios Rigas, Lucas Esclapez and Luca Magri","Symmetry breaking in a 3D bluff-body wake","10 pages","Proceedings of the Summer Program, Center for Turbulence Research,
  Stanford University, 2016",,,"physics.flu-dyn","http://arxiv.org/licenses/nonexclusive-distrib/1.0/","  The dynamics of a three-dimensional axisymmetric bluff-body wake are examined
at low Reynolds regimes where transitions take place through spatio-temporal
symmetry breaking. A linear stability analysis is employed to identify the
critical Reynolds number associated with symmetry breaking, and the associated
eigenmodes, known as global modes. The analysis shows that the axisymmetric
stable base flow breaks the rotational symmetry through a pitchfork $m=1$
bifurcation, in agreement with previously reported results for axisymmetric
wakes. Above this threshold, the stable base flow is steady and
three-dimensional with planar symmetry. A three-dimensional global stability
analysis around the steady reflectionally symmetric base flow, assuming no
homogeneous directions, predicts accurately the Hopf bifurcation threshold,
which leads to asymmetric vortex shedding. DNS simulations validate the
stability results and characterize the flow topology during the early chaotic
regime.
","[{""version"":""v1"",""created"":""Tue, 21 Mar 2017 19:44:51 GMT""}]","2017-03-23"
"1703.07406","Andrey Nikolaev","Andrey Nikolaev and Alexander Ushakov","Subset sum problem in polycyclic groups","11 pages. To appear in Journal of Symbolic Computation",,,,"math.GR cs.CC math.CO","http://arxiv.org/licenses/nonexclusive-distrib/1.0/","  We consider a group-theoretic analogue of the classic subset sum problem. It
is known that every virtually nilpotent group has polynomial time decidable
subset sum problem. In this paper we use subgroup distortion to show that every
polycyclic non-virtually-nilpotent group has NP-complete subset sum problem.
","[{""version"":""v1"",""created"":""Tue, 21 Mar 2017 19:48:23 GMT""}]","2017-03-23"
"1703.07407","Sihem Jaziri s.j","Haitham Zahra, A\""ida Hichri, Sihem Jaziri","Comparative study of the binding energy in a thin and ultra-thin
  organic-inorganic perovskite within dielectric mismatches effects","18 pages, 5 figures",,"10.1063/1.4989838",,"cond-mat.mes-hall","http://arxiv.org/licenses/nonexclusive-distrib/1.0/","  The multi-quantum well (MQW) organic-inorganic perovskite offer an approach
of tuning the exciton binding energy based on the well-barrier dielectric
mismatch effect, which called the image charge effect. The exfoliation from MQW
organic-inorganic perovskite forms a twodimensional (2D) nano-sheet. As with
other 2D materials, like graphene or transition metal dichalcogenides (TMDs),
the ultra-thin perovskites layers are highly sensitive to the dielectric
environment. We investigate the ultrathin crystalline 2D van-der-Waals (vdW)
layers of organic-inorganic perovskite crystals close to a surface of the
substrate. We show that binding exciton energy is strongly influenced by the
surrounding dielectric environment. We find that the Keldysh model somehow
estimates the strong dependence of the exciton binding energies on
environmental screening. We compare our binding energies results with
experimental results in the (C6H13NH3)2PbI4 perovskite, and we estimate the
binding energy values of (C4H9NH3)2PbBr4.
","[{""version"":""v1"",""created"":""Tue, 21 Mar 2017 19:51:48 GMT""}]","2017-08-02"
"1703.07408","Irina Kovalenko","Irina D. Kovalenko, Radu S. Stoica and Nikolay V. Emelyanov","Maximum a posteriori estimation through simulated annealing for binary
  asteroid orbit determination","Accepted for publication in Monthly Notices of the Royal Astronomical
  Society","Monthly Notices of the Royal Astronomical Society 471(4) (2017)
  4637-4647","10.1093/mnras/stx1899",,"astro-ph.IM astro-ph.EP stat.AP","http://arxiv.org/licenses/nonexclusive-distrib/1.0/","  This paper considers a new method for the binary asteroid orbit determination
problem. The method is based on the Bayesian approach with a global
optimisation algorithm. The orbital parameters to be determined are modelled
through an a posteriori distribution made of a priori and likelihood terms. The
first term constrains the parameters space and it allows the introduction of
available knowledge about the orbit. The second term is based on given
observations and it allows us to use and compare different observational error
models. Once the a posteriori model is built, the estimator of the orbital
parameters is computed using a global optimisation procedure: the simulated
annealing algorithm. The maximum a posteriori (MAP) techniques are verified
using simulated and real data. The obtained results validate the proposed
method. The new approach guarantees independence of the initial parameters
estimation and theoretical convergence towards the global optimisation
solution. It is particularly useful in these situations, whenever a good
initial orbit estimation is difficult to get, whenever observations are not
well-sampled, and whenever the statistical behaviour of the observational
errors cannot be stated Gaussian like.
","[{""version"":""v1"",""created"":""Tue, 21 Mar 2017 19:53:59 GMT""},{""version"":""v2"",""created"":""Wed, 7 Jun 2017 12:10:08 GMT""},{""version"":""v3"",""created"":""Sat, 29 Jul 2017 13:38:23 GMT""},{""version"":""v4"",""created"":""Tue, 1 Aug 2017 16:56:38 GMT""}]","2017-08-31"
"1703.07409","Nicholas Watkins","Nicholas J. Watkins, Cameron Nowzari, and George J. Pappas","Inference, Prediction, and Control of Networked Epidemics","6 pages, 2 figures",,,,"math.OC","http://arxiv.org/licenses/nonexclusive-distrib/1.0/","  We develop a feedback control method for networked epidemic spreading
processes. In contrast to most prior works which consider mean field, open-loop
control schemes, the present work develops a novel framework for feedback
control of epidemic processes which leverages incomplete observations of the
stochastic epidemic process in order to control the exact dynamics of the
epidemic outbreak. We develop an observation model for the epidemic process,
and demonstrate that if the set of observed nodes is sufficiently well
structured, then the random variables which denote the process' infections are
conditionally independent given the observations. We then leverage the attained
conditional independence property to construct tractable mechanisms for the
inference and prediction of the process state, avoiding the need to use mean
field approximations or combinatorial representations. We conclude by
formulating a one-step lookahead controller for the discrete-time
Susceptible-Infected-Susceptible (SIS) epidemic process which leverages the
developed Bayesian inference and prediction mechanisms, and causes the epidemic
to die out at a chosen rate.
","[{""version"":""v1"",""created"":""Tue, 21 Mar 2017 19:56:27 GMT""}]","2017-03-23"
"1703.07410","Stephanie LaMassa","Stephanie M. LaMassa, Tahir Yaqoob, Roy Kilgard","Insight Into ""Changing-Look"" AGN Mrk 1018 from the Fe K$\alpha$ Line:
  The Reprocessing Gas Has Yet to Fully Respond to the Fading of the AGN","6 pages emulateapj style, 4 Figures, 2 Tables; accepted for
  publication in ApJ",,"10.3847/1538-4357/aa68df",,"astro-ph.HE astro-ph.GA","http://arxiv.org/licenses/nonexclusive-distrib/1.0/","  Mrk 1018 is a ""changing-look"" AGN whose optical spectrum transitioned from a
Type 1.9 to Type 1 between 1979 and 1984 and back to a Type 1.9 in 2015. This
latest transition was accompanied by a decrease in X-ray flux. We analyze the
Chandra spectra from 2010 and 2016 and NuSTAR spectra from 2016, carefully
treating pile-up in the Chandra spectrum from 2010 and self-consistently
modeling absorption, reflection, and Fe K$\alpha$ line emission in the X-ray
spectra from 2016. We demonstrate that while the 2-10 keV X-ray flux decreased
by an order of magnitude (1.46$^{+0.10}_{-0.13} \times 10^{-11}$ erg s$^{-1}$
cm$^{-2}$ to 1.31$^{+0.09}_{-0.04} \times 10^{-12}$ erg s$^{-1}$ cm$^{-2}$),
the Fe K$\alpha$ equivalent width (EW) increased from 0.18$^{+0.17}_{-0.12}$ to
0.61$^{+0.27}_{-0.25}$ keV, due to a depressed AGN continuum. We jointly fit
the Chandra and NuSTAR spectra from 2016 using the physically-motivated MYTorus
model, finding that the torus orientation is consistent with a face-on
geometry, and lines of sight intersecting the torus are ruled out. While we
measure no line-of-sight absorption, we measure a column density of $N_{\rm H}$
= 5.38$^{+14}_{-4.0} \times 10^{22}$ cm$^{-2}$ for gas out of the line-of-sight
which reprocesses the X-ray emission. We find a high relative normalization
between the Compton scattered emission and transmitted continuum, indicative of
time lags between the primary X-ray source and reprocessing gas. We predict
that the Fe K$\alpha$ line will respond to the decrease in AGN flux, which
would manifest as a decrease in the Fe K$\alpha$ EW.
","[{""version"":""v1"",""created"":""Tue, 21 Mar 2017 20:00:00 GMT""}]","2017-05-03"
"1703.07411","Antoine Bret","Antoine Bret, Asaf Pe'er, Lorenzo Sironi, Aleksander Sadowski, Ramesh
  Narayan","Kinetic inhibition of MHD-shocks in the vicinity of a parallel magnetic
  field","To appear in Journal of Plasma Physics",,"10.1017/S0022377817000290",,"physics.plasm-ph astro-ph.HE astro-ph.SR physics.space-ph","http://arxiv.org/licenses/nonexclusive-distrib/1.0/","  According to magnetohydrodynamics (MHD), the encounter of two collisional
magnetized plasmas at high velocity gives rise to shock waves. Investigations
conducted so far have found that the same conclusion still holds in the case of
collisionless plasmas. For the case of a flow-aligned field, MHD stipulates
that the field and the fluid are disconnected, so that the shock produced is
independent of the field. We present a violation of this MHD prediction when
considering the encounter of two cold pair plasmas along a flow-aligned
magnetic field. As the guiding magnetic field grows, isotropization is
progressively suppressed, resulting in a strong influence of the field on the
resulting structure. A micro-physics analysis allows to understand the
mechanisms at work. Particle-in-cell simulations also support our conclusions
and show that the results are not restricted to a strictly parallel field.
","[{""version"":""v1"",""created"":""Tue, 21 Mar 2017 20:00:02 GMT""},{""version"":""v2"",""created"":""Fri, 12 May 2017 14:31:35 GMT""}]","2017-05-24"
"1703.07412","Vinicius Zampronio Pedroso M. S.","V. Zampronio and S. A. Vitiello","Estimated values of the kinetic energy for liquid $^3$He","10 pages and 3 figure","Phys. Rev. B 99, 045145 (2019)","10.1103/PhysRevB.99.045145",,"cond-mat.quant-gas","http://arxiv.org/licenses/nonexclusive-distrib/1.0/","  The kinetic energy is estimated for the ground-state of liquid $^3$He at
equilibrium density. The obtained value for this quantity, $10.16\pm0.05$
K/atom at density $0.0163~\mbox{\AA}$, is in agreement with most of the
experimental data found in the literature. This result resolves a long-standing
controversy between experimental and theoretical values of this quantity. The
variational path integral method, an ""exact"" quantum Monte Carlo method
extended for fermionic systems, is applied in the calculations. The results
obtained are subjected only to the restrictions imposed by a chosen nodal
structure without any further approximation, even for quantities that do not
commute with the Hamiltonian. The required fixed-node approximation entails an
implementation that allows a more effective estimation of the quantities of
interest. Total and potential energies together with the radial distribution
function are also computed.
","[{""version"":""v1"",""created"":""Tue, 21 Mar 2017 20:12:00 GMT""},{""version"":""v2"",""created"":""Tue, 24 Apr 2018 16:21:49 GMT""},{""version"":""v3"",""created"":""Wed, 25 Apr 2018 17:20:11 GMT""}]","2019-01-30"
"1703.07413","Felipe Nobili","Felipe Nobili","Partially Hyperbolic Sets with a Dynamically Minimal Invariant
  Lamination",,,,,"math.DS","http://arxiv.org/licenses/nonexclusive-distrib/1.0/","  We study partially hyperbolic sets of C1-diffeomorphisms. For these sets
there are defined the strong stable and strong unstable laminations. A
lamination is called dynamically minimal when the orbit of each leaf intersects
the set densely. We prove that partially hyperbolic sets having a dynamically
minimal lamination have empty interior. We also study the Lebesgue measure and
the spectral decomposition of these sets. These results can be ap- plied to
C1-generic/robustly transitive attractors with one-dimensional center bundle.
","[{""version"":""v1"",""created"":""Tue, 21 Mar 2017 20:17:14 GMT""}]","2017-03-23"
"1703.07414","Jorge Rocha","Pedro Aniceto and Jorge V. Rocha","Dynamical black holes in low-energy string theory","1+24 pages + appendices, 6 figures; v2: minor corrections, added
  reference, matches published version","J. High Energ. Phys. (2017) 2017: 35","10.1007/JHEP05(2017)035",,"hep-th gr-qc","http://arxiv.org/licenses/nonexclusive-distrib/1.0/","  We investigate time-dependent spherically symmetric solutions of the
four-dimensional Einstein-Maxwell-axion-dilaton system, with the dilaton
coupling that occurs in low-energy effective heterotic string theory. A class
of dilaton-electrovacuum radiating solutions with a trivial axion, previously
found by G\""uven and Y\""or\""uk, is re-derived in a simpler manner and its
causal structure is clarified. It is shown that such dynamical spacetimes
featuring apparent horizons do not possess a regular light-like past null
infinity or future null infinity, depending on whether they are radiating or
accreting. These solutions are then extended in two ways. First we consider a
Vaidya-like generalisation, which introduces a null dust source. Such
spacetimes are used to test the status of cosmic censorship in the context of
low-energy string theory. We prove that - within this family of solutions -
regular black holes cannot evolve into naked singularities by accreting null
dust, unless standard energy conditions are violated. Secondly, we employ
S-duality to derive new time-dependent dyon solutions with a nontrivial axion
turned on. Although they share the same causal structure as their
Einstein-Maxwell-dilaton counterparts, these solutions possess both electric
and magnetic charges.
","[{""version"":""v1"",""created"":""Tue, 21 Mar 2017 20:17:39 GMT""},{""version"":""v2"",""created"":""Tue, 16 May 2017 09:40:00 GMT""}]","2017-05-17"
"1703.07415","Sebabrata Mukherjee Dr","Sebabrata Mukherjee and Robert R. Thomson","Observation of robust flat-band localization in driven photonic rhombic
  lattices","5 pages, 7 figures","Optics Letters, 42 (12), 2243, 2017","10.1364/OL.42.002243",,"physics.optics cond-mat.mes-hall quant-ph","http://arxiv.org/licenses/nonexclusive-distrib/1.0/","  We demonstrate that a flat-band state in a quasi-one-dimensional rhombic
lattice is robust in the presence of external drivings along the lattice axis.
The lattice was formed by periodic arrays of evanescently coupled optical
waveguides, and the external drivings were realized by modulating the paths of
the waveguides. We excited a superposition of flat-band eigenmodes at the input
and observed that this state does not diffract in the presence of static as
well as high-frequency sinusoidal drivings. This robust localization is due to
destructive interference of the analogous wavefunction and is associated with
the symmetry in the lattice geometry. We then excited the dispersive bands and
observed Bloch oscillations and coherent destruction of tunneling.
{\textcopyright} 2017 Optical Society of America.
","[{""version"":""v1"",""created"":""Tue, 21 Mar 2017 20:20:30 GMT""},{""version"":""v2"",""created"":""Fri, 28 Apr 2017 19:40:23 GMT""},{""version"":""v3"",""created"":""Mon, 15 May 2017 17:00:44 GMT""}]","2017-06-06"
