"1703.07508","Chinedum Osuji","Yekaterina Rokhlenko, Pawe{\l} W. Majewski, Steven R. Larson, Padma
  Gopalan, Kevin G. Yager, Chinedum O. Osuji","The Implications of Grain Size Variation in Magnetic Field Alignment of
  Block Copolymer Blends","14 pages, 11 figures",,,,"cond-mat.soft","http://arxiv.org/licenses/nonexclusive-distrib/1.0/","  Recent experiments have highlighted the intrinsic magnetic anisotropy in
coil-coil diblock copolymers, specifically in poly(styrene-b-4-vinylpyridine)
(PS-b-P4VP), that enables magnetic field alignment at field strengths of a few
tesla. We consider here the alignment response of two low molecular weight (MW)
lamallae-forming PS-b-P4VP systems. Cooling across the disorder-order
transition temperature ($\mathrm{T_{odt}}$) results in strong alignment for the
higher MW sample (5.5K), whereas little alignment is discernible for the lower
MW system (3.6K). This disparity under otherwise identical conditions of field
strength and cooling rate suggests that different average grain sizes are
produced during slow cooling of these materials, with larger grains formed in
the higher MW material. Blending the block copolymers results in homogeneous
samples which display $\mathrm{T_{odt}}$, d-spacings and grain sizes that are
intermediate between the two neat diblocks. Similarly, the alignment quality
displays a smooth variation with the concentration of the higher MW diblock in
the blends and the size of grains likewise interpolates between limits set by
the neat diblocks, with a factor of 3.5X difference in the grain size observed
in high vs low MW neat diblocks. These results highlight the importance of
grain growth kinetics in dictating the field response in block copolymers and
suggests an unconventional route for the manipulation of such kinetics.
","[{""version"":""v1"",""created"":""Wed, 22 Mar 2017 03:37:15 GMT""}]","2017-03-23"
"1703.07509","Kumar S. Gupta","Siddhartha Sen and Kumar S. Gupta","Emergence of Coherent Nanoscale Structures in Carbon Nantotubes","Latex file, 6 pages",,,,"cond-mat.mes-hall","http://arxiv.org/licenses/nonexclusive-distrib/1.0/","  Recently unusual properties of water in single-walled carbon nanotubes (CNT)
with diameters ranging from 1.05 nm to 1.52 nm were observed. It was found that
water in the CNT remains in an ice-like phase even when the temperature ranges
between 105 - 151 C and 87 - 117 C for CNTs with diameters 1.05 nm and 1.06 nm
respectively. Apart from the high freezing points, the solid-liquid phase
transition temperature was found to be strongly sensitive to the CNT diameter.
In this paper we show that water in such CNT's can admit coherent nanoscale
structures provided certain conditions are met. The formation of such coherent
structures allows for high values of solid-liquid phase transition temperatures
that are in qualitative agreement with the empirical data. The model also
predicts that the phase transition temperature scales inversely with the square
of the effective radius available for the water flow within the CNT. This is
consistent with the observed sensitive dependence of the solid-liquid phase
transition temperature on the CNT diameter.
","[{""version"":""v1"",""created"":""Wed, 22 Mar 2017 03:53:28 GMT""}]","2017-03-23"
"1703.07510","Rashmi Uniyal","Rashmi Uniyal, Hemwati Nandan K. D. Purohit","Null Geodesics and Observables around Kerr-Sen Black Hole",,"Class.Quant.Grav. 35 (2018) no.2, 025003","10.1088/1361-6382/aa9ad9",,"gr-qc","http://arxiv.org/licenses/nonexclusive-distrib/1.0/","  We investigate the geodesic motion in the background of Kerr-Sen Black Hole
arising in the heterotic string theory. The nature of effective potential is
discussed in radial as well as latitudinal direction. A special class of
spherical photon orbits is obtained along with the expression for the turning
point for radial photons. Dependence of photon motion within this class of
solution is discussed explicitly in view of the different Black Hole
parameters. We have discussed the allowed regions for geodesic motion of
massless test particles around Kerr- Sen Black Hole in more generalised way by
including non-equatorial motion of the photons into the account. The conditions
for different types of possible orbits are discussed with specific parameter
values along with the corresponding orbit structure. No terminating orbits are
possible for photons due to non-zero Black Hole charge. Observables on the
angular plane (viz. bending of light and perihelion precession for massive test
particles) are analysed as special cases. We have also calculated the rotation
and mass parameters for Kerr-Sen Black Hole in terms of the red/blue shifts of
the photons in circular and equatorial orbits emitted by the massive test
particles which represent stars or other probable sources of photons.
","[{""version"":""v1"",""created"":""Wed, 22 Mar 2017 04:19:20 GMT""}]","2018-01-30"
"1703.07511","Fujun Luan","Fujun Luan, Sylvain Paris, Eli Shechtman, Kavita Bala","Deep Photo Style Transfer",,,,,"cs.CV","http://arxiv.org/licenses/nonexclusive-distrib/1.0/","  This paper introduces a deep-learning approach to photographic style transfer
that handles a large variety of image content while faithfully transferring the
reference style. Our approach builds upon the recent work on painterly transfer
that separates style from the content of an image by considering different
layers of a neural network. However, as is, this approach is not suitable for
photorealistic style transfer. Even when both the input and reference images
are photographs, the output still exhibits distortions reminiscent of a
painting. Our contribution is to constrain the transformation from the input to
the output to be locally affine in colorspace, and to express this constraint
as a custom fully differentiable energy term. We show that this approach
successfully suppresses distortion and yields satisfying photorealistic style
transfers in a broad variety of scenarios, including transfer of the time of
day, weather, season, and artistic edits.
","[{""version"":""v1"",""created"":""Wed, 22 Mar 2017 04:21:41 GMT""},{""version"":""v2"",""created"":""Sat, 8 Apr 2017 07:57:03 GMT""},{""version"":""v3"",""created"":""Tue, 11 Apr 2017 03:53:28 GMT""}]","2017-04-12"
"1703.07512","Martin Frankland","Hans-Joachim Baues, Martin Frankland","Eilenberg-MacLane mapping algebras and higher distributivity up to
  homotopy","v3: Minor changes. Final version","New York J. Math. 23 (2017), 1539-1580",,,"math.AT","http://arxiv.org/licenses/nonexclusive-distrib/1.0/","  Primary cohomology operations, i.e., elements of the Steenrod algebra, are
given by homotopy classes of maps between Eilenberg--MacLane spectra. Such maps
(before taking homotopy classes) form the topological version of the Steenrod
algebra. Composition of such maps is strictly linear in one variable and linear
up to coherent homotopy in the other variable. To describe this structure, we
introduce a hierarchy of higher distributivity laws, and prove that the
topological Steenrod algebra satisfies all of them. We show that the higher
distributivity laws are homotopy invariant in a suitable sense. As an
application of $2$-distributivity, we provide a new construction of a
derivation of degree $-2$ of the mod $2$ Steenrod algebra.
","[{""version"":""v1"",""created"":""Wed, 22 Mar 2017 04:23:10 GMT""},{""version"":""v2"",""created"":""Tue, 19 Sep 2017 23:18:08 GMT""},{""version"":""v3"",""created"":""Sat, 28 Oct 2017 18:49:53 GMT""}]","2017-10-31"
"1703.07513","Leonardo dos Santos Pinheiro","Leonardo dos Santos Pinheiro and Flavio Codeco COelho","An Agent-based Model of Contagion in Financial Networks",,,,,"q-fin.CP q-fin.GN","http://arxiv.org/licenses/nonexclusive-distrib/1.0/","  This work develops an agent-based model for the study of how the leverage
through the use of repurchase agreements can function as a mechanism for the
propagation and amplification of financial shocks in a financial system. Based
on the analysis of financial intermediaries in the repo and interbank lending
markets during the 2007-08 financial crisis we develop a model that can be used
to simulate the dynamics of financial contagion.
","[{""version"":""v1"",""created"":""Wed, 22 Mar 2017 04:24:52 GMT""}]","2017-03-23"
"1703.07514","Simon Niklaus","Simon Niklaus and Long Mai and Feng Liu","Video Frame Interpolation via Adaptive Convolution","CVPR 2017, http://graphics.cs.pdx.edu/project/adaconv",,,,"cs.CV","http://arxiv.org/licenses/nonexclusive-distrib/1.0/","  Video frame interpolation typically involves two steps: motion estimation and
pixel synthesis. Such a two-step approach heavily depends on the quality of
motion estimation. This paper presents a robust video frame interpolation
method that combines these two steps into a single process. Specifically, our
method considers pixel synthesis for the interpolated frame as local
convolution over two input frames. The convolution kernel captures both the
local motion between the input frames and the coefficients for pixel synthesis.
Our method employs a deep fully convolutional neural network to estimate a
spatially-adaptive convolution kernel for each pixel. This deep neural network
can be directly trained end to end using widely available video data without
any difficult-to-obtain ground-truth data like optical flow. Our experiments
show that the formulation of video interpolation as a single convolution
process allows our method to gracefully handle challenges like occlusion, blur,
and abrupt brightness change and enables high-quality video frame
interpolation.
","[{""version"":""v1"",""created"":""Wed, 22 Mar 2017 04:31:38 GMT""}]","2017-03-23"
"1703.07515","Kab-Jin Kim","Kab-Jin Kim, Se Kwon Kim, Takayuki Tono, Se-Hyeok Oh, Takaya Okuno,
  Woo Seung Ham, Yuushou Hirata, Sanghoon Kim, Gyoungchoon Go, Yaroslav
  Tserkovnyak, Arata Tsukamoto, Takahiro Moriyama, Kyung-Jin Lee, and Teruo Ono","Fast domain wall motion induced by antiferromagnetic spin dynamics at
  the angular momentum compensation temperature of ferrimagnets",,,"10.1038/nmat4990",,"cond-mat.mtrl-sci","http://arxiv.org/licenses/nonexclusive-distrib/1.0/","  Antiferromagnetic spintronics is an emerging research field which aims to
utilize antiferromagnets as core elements in spintronic devices. A central
motivation toward this direction is that antiferromagnetic spin dynamics is
expected to be much faster than ferromagnetic counterpart because
antiferromagnets have higher resonance frequencies than ferromagnets. Recent
theories indeed predicted faster dynamics of antiferromagnetic domain walls
(DWs) than ferromagnetic DWs. However, experimental investigations of
antiferromagnetic spin dynamics have remained unexplored mainly because of the
immunity of antiferromagnets to magnetic fields. Furthermore, this immunity
makes field-driven antiferromagnetic DW motion impossible despite rich physics
of field-driven DW dynamics as proven in ferromagnetic DW studies. Here we show
that fast field-driven antiferromagnetic spin dynamics is realized in
ferrimagnets at the angular momentum compensation point TA. Using rare-earth
3d-transition metal ferrimagnetic compounds where net magnetic moment is
nonzero at TA, the field-driven DW mobility remarkably enhances up to 20 km/sT.
The collective coordinate approach generalized for ferrimagnets and atomistic
spin model simulations show that this remarkable enhancement is a consequence
of antiferromagnetic spin dynamics at TA. Our finding allows us to investigate
the physics of antiferromagnetic spin dynamics and highlights the importance of
tuning of the angular momentum compensation point of ferrimagnets, which could
be a key towards ferrimagnetic spintronics.
","[{""version"":""v1"",""created"":""Wed, 22 Mar 2017 04:31:40 GMT""}]","2018-01-17"
"1703.07516","Changho Keem","Changho Keem and Yun-Hwan Kim","Irreducibility of the Hilbert scheme of smooth curves in $\Bbb P^4$ of
  degree $g+2$ and genus $g$","Any critical comments are welcome",,,,"math.AG","http://arxiv.org/licenses/nonexclusive-distrib/1.0/","  We denote by $\mathcal{H}_{d,g,r}$ the Hilbert scheme of smooth curves, which
is the union of components whose general point corresponds to a smooth
irreducible and non-degenerate curve of degree $d$ and genus $g$ in $\PP^r$. In
this note, we show that any non-empty $\mathcal{H}_{g+2,g,4}$ is irreducible
without any restriction on the genus $g$. Our result augments the
irreducibility result obtained earlier by Hristo Iliev(2006), in which several
low genus $g\le 10$ cases have been left untreated.
","[{""version"":""v1"",""created"":""Wed, 22 Mar 2017 04:35:35 GMT""}]","2017-03-23"
"1703.07517","Edward Chen","Edward H. Chen, Hannah A. Clevenson, Kerry A. Johnson, Linh M. Pham,
  Dirk R. Englund, Philip R. Hemmer, Danielle A. Braje","High-sensitivity, spin-based electrometry with an ensemble of
  nitrogen-vacancy centers in diamond","8 pages, 7 figures","Phys. Rev. A 95, 053417 (2017)","10.1103/PhysRevA.95.053417",,"physics.optics cond-mat.mes-hall","http://arxiv.org/licenses/nonexclusive-distrib/1.0/","  We demonstrate a spin-based, all-dielectric electrometer based on an ensemble
of nitrogen-vacancy (NV$^-$) defects in diamond. An applied electric field
causes energy level shifts symmetrically away from the NV$^-$'s degenerate
triplet states via the Stark effect; this symmetry provides immunity to
temperature fluctuations allowing for shot-noise-limited detection. Using an
ensemble of NV$^-$s, we demonstrate shot-noise limited sensitivities
approaching 1 V/cm/$\sqrt{\text{Hz}}$ under ambient conditions, at low
frequencies ($<$10 Hz), and over a large dynamic range (20 dB). A theoretical
model for the ensemble of NV$^-$s fits well with measurements of the
ground-state electric susceptibility parameter, $\langle k_\perp\rangle$.
Implications of spin-based, dielectric sensors for micron-scale electric-field
sensing are discussed.
","[{""version"":""v1"",""created"":""Wed, 22 Mar 2017 04:36:43 GMT""}]","2017-05-31"
"1703.07518","Onur Varol","Onur Varol, Emilio Ferrara, Filippo Menczer, Alessandro Flammini","Early Detection of Promoted Campaigns on Social Media","29 pages, 9 figures, 3 tables",,,,"cs.SI","http://arxiv.org/licenses/nonexclusive-distrib/1.0/","  Social media expose millions of users every day to information campaigns ---
some emerging organically from grassroots activity, others sustained by
advertising or other coordinated efforts. These campaigns contribute to the
shaping of collective opinions. While most information campaigns are benign,
some may be deployed for nefarious purposes. It is therefore important to be
able to detect whether a meme is being artificially promoted at the very moment
it becomes wildly popular. This problem has important social implications and
poses numerous technical challenges. As a first step, here we focus on
discriminating between trending memes that are either organic or promoted by
means of advertisement. The classification is not trivial: ads cause bursts of
attention that can be easily mistaken for those of organic trends. We designed
a machine learning framework to classify memes that have been labeled as
trending on Twitter.After trending, we can rely on a large volume of activity
data. Early detection, occurring immediately at trending time, is a more
challenging problem due to the minimal volume of activity data that is
available prior to trending.Our supervised learning framework exploits hundreds
of time-varying features to capture changing network and diffusion patterns,
content and sentiment information, timing signals, and user meta-data. We
explore different methods for encoding feature time series. Using millions of
tweets containing trending hashtags, we achieve 75% AUC score for early
detection, increasing to above 95% after trending. We evaluate the robustness
of the algorithms by introducing random temporal shifts on the trend time
series. Feature selection analysis reveals that content cues provide
consistently useful signals; user features are more informative for early
detection, while network and timing features are more helpful once more data is
available.
","[{""version"":""v1"",""created"":""Wed, 22 Mar 2017 04:37:39 GMT""}]","2017-03-23"
"1703.07519","Guo-Jun Qi","Guo-Jun Qi, Wei Liu, Charu Aggarwal, Thomas Huang","Joint Intermodal and Intramodal Label Transfers for Extremely Rare or
  Unseen Classes","The paper has been accepted by IEEE Transactions on Pattern Analysis
  and Machine Intelligence. It will apear in a future issue",,,,"cs.CV","http://arxiv.org/licenses/nonexclusive-distrib/1.0/","  In this paper, we present a label transfer model from texts to images for
image classification tasks. The problem of image classification is often much
more challenging than text classification. On one hand, labeled text data is
more widely available than the labeled images for classification tasks. On the
other hand, text data tends to have natural semantic interpretability, and they
are often more directly related to class labels. On the contrary, the image
features are not directly related to concepts inherent in class labels. One of
our goals in this paper is to develop a model for revealing the functional
relationships between text and image features as to directly transfer
intermodal and intramodal labels to annotate the images. This is implemented by
learning a transfer function as a bridge to propagate the labels between two
multimodal spaces. However, the intermodal label transfers could be undermined
by blindly transferring the labels of noisy texts to annotate images. To
mitigate this problem, we present an intramodal label transfer process, which
complements the intermodal label transfer by transferring the image labels
instead when relevant text is absent from the source corpus. In addition, we
generalize the inter-modal label transfer to zero-shot learning scenario where
there are only text examples available to label unseen classes of images
without any positive image examples. We evaluate our algorithm on an image
classification task and show the effectiveness with respect to the other
compared algorithms.
","[{""version"":""v1"",""created"":""Wed, 22 Mar 2017 04:40:51 GMT""}]","2017-03-23"
"1703.07520","Kimon Fountoulakis","Danqing Zhang, Kimon Fountoulakis, Junyu Cao, Michael Mahoney and
  Alexei Pozdnoukhov","Social Discrete Choice Models",,,,,"cs.SI physics.soc-ph","http://arxiv.org/licenses/nonexclusive-distrib/1.0/","  Human decision making underlies data generating process in multiple
application areas, and models explaining and predicting choices made by
individuals are in high demand. Discrete choice models are widely studied in
economics and computational social sciences. As digital social networking
facilitates information flow and spread of influence between individuals, new
advances in modeling are needed to incorporate social information into these
models in addition to characteristic features affecting individual choices. In
this paper, we propose two novel models with scalable training algorithms:
local logistics graph regularization (LLGR) and latent class graph
regularization (LCGR) models. We add social regularization to represent
similarity between friends, and we introduce latent classes to account for
possible preference discrepancies between different social groups. Training of
the LLGR model is performed using alternating direction method of multipliers
(ADMM), and training of the LCGR model is performed using a specialized Monte
Carlo expectation maximization (MCEM) algorithm. Scalability to large graphs is
achieved by parallelizing computation in both the expectation and the
maximization steps. The LCGR model is the first latent class classification
model that incorporates social relationships among individuals represented by a
given graph. To evaluate our two models, we consider three classes of data to
illustrate a typical large-scale use case in internet and social media
applications. We experiment on synthetic datasets to empirically explain when
the proposed model is better than vanilla classification models that do not
exploit graph structure. We also experiment on real-world data, including both
small scale and large scale real-world datasets, to demonstrate on which types
of datasets our model can be expected to outperform state-of-the-art models.
","[{""version"":""v1"",""created"":""Wed, 22 Mar 2017 04:45:49 GMT""},{""version"":""v2"",""created"":""Thu, 2 Nov 2017 22:39:06 GMT""}]","2017-11-06"
"1703.07521","Srijita Kundu","Anurag Anshu, Naresh B. Goud, Rahul Jain, Srijita Kundu and Priyanka
  Mukhopadhyay","Lifting randomized query complexity to randomized communication
  complexity","We withdraw this paper due to an incorrigible error in the main proof",,,,"cs.CC quant-ph","http://arxiv.org/licenses/nonexclusive-distrib/1.0/","  We show that for a relation $f\subseteq \{0,1\}^n\times \mathcal{O}$ and a
function $g:\{0,1\}^{m}\times \{0,1\}^{m} \rightarrow \{0,1\}$ (with $m= O(\log
n)$), $$\mathrm{R}_{1/3}(f\circ g^n) = \Omega\left(\mathrm{R}_{1/3}(f) \cdot
\left(\log\frac{1}{\mathrm{disc}(M_g)} - O(\log n)\right)\right),$$ where
$f\circ g^n$ represents the composition of $f$ and $g^n$, $M_g$ is the sign
matrix for $g$, $\mathrm{disc}(M_g)$ is the discrepancy of $M_g$ under the
uniform distribution and $\mathrm{R}_{1/3}(f)$ ($\mathrm{R}_{1/3}(f\circ g^n)$)
denotes the randomized query complexity of $f$ (randomized communication
complexity of $f\circ g^n$) with worst case error $\frac{1}{3}$.
  In particular, this implies that for a relation $f\subseteq \{0,1\}^n\times
\mathcal{O}$, $$\mathrm{R}_{1/3}(f\circ \mathrm{IP}_m^n) =
\Omega\left(\mathrm{R}_{1/3}(f) \cdot m\right),$$ where
$\mathrm{IP}_m:\{0,1\}^m\times \{0,1\}^m\rightarrow \{0,1\}$ is the Inner
Product (modulo $2$) function and $m= O(\log(n))$.
","[{""version"":""v1"",""created"":""Wed, 22 Mar 2017 04:45:51 GMT""},{""version"":""v2"",""created"":""Tue, 11 Apr 2017 11:30:39 GMT""},{""version"":""v3"",""created"":""Sat, 1 Jul 2017 11:12:27 GMT""},{""version"":""v4"",""created"":""Wed, 12 Jul 2017 11:37:04 GMT""},{""version"":""v5"",""created"":""Sun, 21 Jan 2018 04:59:06 GMT""}]","2018-01-23"
"1703.07522","Sung-Sik Lee","Qi Hu and Sung-Sik Lee","Non-local Geometry inside Lifshitz Horizon","20 pages","J. High Energ. Phys. (2017) 2017: 56","10.1007/JHEP07(2017)056",,"hep-th cond-mat.str-el","http://arxiv.org/licenses/nonexclusive-distrib/1.0/","  Based on the quantum renormalization group, we derive the bulk geometry that
emerges in the holographic dual of the fermionic U(N) vector model at a nonzero
charge density. The obstruction that prohibits the metallic state from being
smoothly deformable to the direct product state under the renormalization group
flow gives rise to a horizon at a finite radial coordinate in the bulk. The
region outside the horizon is described by the Lifshitz geometry with a
higher-spin hair determined by microscopic details of the boundary theory. On
the other hand, the interior of the horizon is not described by any Riemannian
manifold, as it exhibits an algebraic non-locality. The non-local structure
inside the horizon carries the information on the shape of the filled Fermi
sea.
","[{""version"":""v1"",""created"":""Wed, 22 Mar 2017 04:46:30 GMT""}]","2017-07-18"
"1703.07523","QiKui Zhu","Qikui Zhu and Bo Du and Baris Turkbey and Peter L . Choyke and Pingkun
  Yan","Deeply-Supervised CNN for Prostate Segmentation","Due to a crucial sign error in equation 1",,,,"cs.CV","http://arxiv.org/licenses/nonexclusive-distrib/1.0/","  Prostate segmentation from Magnetic Resonance (MR) images plays an important
role in image guided interven- tion. However, the lack of clear boundary
specifically at the apex and base, and huge variation of shape and texture
between the images from different patients make the task very challenging. To
overcome these problems, in this paper, we propose a deeply supervised
convolutional neural network (CNN) utilizing the convolutional information to
accurately segment the prostate from MR images. The proposed model can
effectively detect the prostate region with additional deeply supervised layers
compared with other approaches. Since some information will be abandoned after
convolution, it is necessary to pass the features extracted from early stages
to later stages. The experimental results show that significant segmentation
accuracy improvement has been achieved by our proposed method compared to other
reported approaches.
","[{""version"":""v1"",""created"":""Wed, 22 Mar 2017 04:48:36 GMT""},{""version"":""v2"",""created"":""Thu, 23 Mar 2017 13:56:01 GMT""},{""version"":""v3"",""created"":""Tue, 28 Mar 2017 13:12:39 GMT""}]","2017-03-29"
