"1703.07616","Karoline Disser","Karoline Disser","Global existence, uniqueness and stability for nonlinear dissipative
  bulk-interface interaction systems","21 pages",,,,"math.AP","http://arxiv.org/licenses/nonexclusive-distrib/1.0/","  We show global well-posedness and exponential stability of equilibria for a
general class of nonlinear dissipative bulk-interface systems. They correspond
to thermodynamically consistent gradient structure models of bulk-interface
interaction. The setting includes nonlinear slow and fast diffusion in the bulk
and nonlinear coupled diffusion on the interface. Additional driving mechanisms
can be included and non-smooth geometries and coefficients are admissible, to
some extent. An important application are volume-surface reaction-diffusion
systems with nonlinear coupled diffusion.
","[{""version"":""v1"",""created"":""Wed, 22 Mar 2017 12:15:20 GMT""},{""version"":""v2"",""created"":""Fri, 3 Jan 2020 10:03:09 GMT""}]","2020-01-06"
"1703.07617","Jun Sun","Yuanzhen Ji, Jun Sun, Anisoara Nica, Zbigniew Jerzak, Gregor
  Hackenbroich, Christof Fetzer","Quality-Driven Disorder Handling for M-way Sliding Window Stream Joins","12 pages, 11 figures, IEEE ICDE 2016",,"10.1109/ICDE.2016.7498265",,"cs.DB","http://arxiv.org/licenses/nonexclusive-distrib/1.0/","  Sliding window join is one of the most important operators for stream
applications. To produce high quality join results, a stream processing system
must deal with the ubiquitous disorder within input streams which is caused by
network delay, asynchronous source clocks, etc. Disorder handling involves an
inevitable tradeoff between the latency and the quality of produced join
results. To meet different requirements of stream applications, it is desirable
to provide a user-configurable result-latency vs. result-quality tradeoff.
Existing disorder handling approaches either do not provide such
configurability, or support only user-specified latency constraints.
  In this work, we advocate the idea of quality-driven disorder handling, and
propose a buffer-based disorder handling approach for sliding window joins,
which minimizes sizes of input-sorting buffers, thus the result latency, while
respecting user-specified result-quality requirements. The core of our approach
is an analytical model which directly captures the relationship between sizes
of input buffers and the produced result quality. Our approach is generic. It
supports m-way sliding window joins with arbitrary join conditions. Experiments
on real-world and synthetic datasets show that, compared to the state of the
art, our approach can reduce the result latency incurred by disorder handling
by up to 95% while providing the same level of result quality.
","[{""version"":""v1"",""created"":""Wed, 22 Mar 2017 12:27:21 GMT""}]","2017-03-23"
"1703.07618","Henk Don","Michiel de Bondt, Henk Don and Hans Zantema","DFAs and PFAs with Long Shortest Synchronizing Word Length","16 pages, 2 figures source code added",,,,"math.CO cs.FL","http://arxiv.org/licenses/nonexclusive-distrib/1.0/","  It was conjectured by \v{C}ern\'y in 1964, that a synchronizing DFA on $n$
states always has a shortest synchronizing word of length at most $(n-1)^2$,
and he gave a sequence of DFAs for which this bound is reached. Until now a
full analysis of all DFAs reaching this bound was only given for $n \leq 4$,
and with bounds on the number of symbols for $n \leq 10$. Here we give the full
analysis for $n \leq 6$, without bounds on the number of symbols.
  For PFAs the bound is much higher. For $n \leq 6$ we do a similar analysis as
for DFAs and find the maximal shortest synchronizing word lengths, exceeding
$(n-1)^2$ for $n =4,5,6$. For arbitrary n we give a construction of a PFA on
three symbols with exponential shortest synchronizing word length, giving
significantly better bounds than earlier exponential constructions. We give a
transformation of this PFA to a PFA on two symbols keeping exponential shortest
synchronizing word length, yielding a better bound than applying a similar
known transformation.
","[{""version"":""v1"",""created"":""Wed, 22 Mar 2017 12:28:34 GMT""},{""version"":""v2"",""created"":""Fri, 24 Mar 2017 08:43:59 GMT""},{""version"":""v3"",""created"":""Fri, 16 Jun 2017 15:49:45 GMT""}]","2017-06-19"
"1703.07619","Adnan Aijaz","Adnan Aijaz","Comments on ""CRB-RPL: A Receiver-based Routing Protocol for
  Communications in Cognitive Radio Enabled Smart Grid""",,,,,"cs.NI","http://arxiv.org/licenses/nonexclusive-distrib/1.0/","  A recent paper by Yang et al. [1] proposed CRB-RPL as a new RPL-based routing
protocol for communications in cognitive radio (CR) enabled smart grid.
Essentially, CRB-RPL adopts the operation of CRB-MAC, which is a medium access
control (MAC) protocol for cognitive machine-to-machine (M2M) communications,
and depicts it as a network layer enhancement. CRB-RPL suffers from a number of
technical flaws in terms of protocol operation and analytical aspects. The main
objective of this paper is to highlight these technical flaws of CRB-RPL and
provide corrections to analytical modeling.
","[{""version"":""v1"",""created"":""Wed, 22 Mar 2017 12:29:26 GMT""}]","2017-03-23"
"1703.07620","Thomas Prince","Thomas Prince","The Tropical Superpotential For $\mathbb{P}^2$","28 pages, 15 figures. Substantially revised with considerably more
  detailed arguments and several new figures",,,,"math.AG math.CO","http://arxiv.org/licenses/nonexclusive-distrib/1.0/","  We present an extended worked example of the computation of the tropical
superpotential considered by Carl--Pumperla--Siebert. In particular we consider
an affine manifold associated to the complement of a non-singular genus one
plane curve, and calculate the wall and chamber decomposition determined by the
Gross--Siebert algorithm. Using the results of Carl--Pumperla--Siebert we
determine the tropical superpotential, via broken line counts, in every chamber
of this decomposition. The superpotential defines a Laurent polynomial in every
chamber, which we demonstrate to be identical to the Laurent polynomials
predicted by Coates--Corti--Galkin--Golyshev--Kaspzryk to be mirror to
$\mathbb{P}^2$.
","[{""version"":""v1"",""created"":""Wed, 22 Mar 2017 12:30:22 GMT""},{""version"":""v2"",""created"":""Wed, 6 Feb 2019 16:54:33 GMT""}]","2019-02-07"
"1703.07621","Nadezhda Kukharchyk","Nadezhda Kukharchyk, Dmitriy Sholokhov, Stella L. Korableva, Alexey A.
  Kalachev and Pavel A. Bushev","Optical coherence of $^{166}$Er:$^{7}$LiYF$_4$ crystal below 1 Kelvin","6 pages, 6 figures",,"10.1088/1367-2630/aaa7e4",,"physics.optics","http://arxiv.org/licenses/nonexclusive-distrib/1.0/","  We explore spin dynamics of isotopically purified $^{166}$Er:$^{7}$LiYF$_4$
crystal below 1 Kelvin and at weak magnetic fields $<$0.3 T. Crystals grown in
our lab demonstrate record-narrow inhomogeneous optical broadening down to
16~MHz. Solid state atomic ensembles with such narrow linewidths are very
attractive for the implementation of off-resonant Raman quantum memory and for
the interfacing of superconducting quantum circuits and telecom C-band optical
photons. Both applications require low magnetic field of $\sim10$ mT. However,
at conventional experimental temperatures $T>1.5$ K and time scales of $\mu$s,
spin coherence of Er:LYF crystal appears only at magnetic fields above 1 Tesla.
In the present work, we demonstrate spin coherence of Er:LYF crystals at the
field range compatible with ZEFOZ transitions of $^{167}$Er isotope and with
working conditions of superconducting quantum circuits.
","[{""version"":""v1"",""created"":""Wed, 22 Mar 2017 12:30:55 GMT""},{""version"":""v2"",""created"":""Fri, 10 Nov 2017 15:29:39 GMT""}]","2018-03-14"
"1703.07622","Manh Hong Duong","Manh Hong Duong and Hoang Minh Tran","On the fundamental solution and a variational formulation of a
  degenerate diffusion of Kolmogorov type","31 pages","DCDS-A, 38(7): 3407-3438, 2018","10.3934/dcds.2018146",,"math.AP math-ph math.FA math.MP math.PR","http://arxiv.org/licenses/nonexclusive-distrib/1.0/","  In this paper, we construct the fundamental solution to a degenerate
diffusion of Kolmogorov type and develop a time-discrete variational scheme for
its adjoint equation. The so-called mean squared derivative cost function plays
a crucial role occurring in both the fundamental solution and the variational
scheme. The latter is implemented by minimizing a free energy functional with
respect to the Kantorovich optimal transport cost functional associated with
the mean squared derivative cost. We establish the convergence of the scheme to
the solution of the adjoint equation generalizing previously known results for
the Fokker-Planck equation and the Kramers equation.
","[{""version"":""v1"",""created"":""Wed, 22 Mar 2017 12:42:41 GMT""},{""version"":""v2"",""created"":""Thu, 3 May 2018 07:59:38 GMT""}]","2018-05-04"
"1703.07623","Yuki Hirao","Y. Hirao, A. Udalski, T. Sumi, D.P. Bennett, I.A. Bond, N.J.
  Rattenbury, D. Suzuki, N. Koshimoto, F. Abe, Y. Asakura, R.K. Barry, A.
  Bhattacharya, M. Donachie, P. Evans, A. Fukui, Y. Itow, M.C.A. Li, C.H. Ling,
  K. Masuda, Y. Matsubara, T. Matsuo, Y. Muraki, M. Nagakane, K. Ohnishi, To.
  Saito, A. Sharan, H. Shibai, D.J. Sullivan, P.J. Tristram, T. Yamada, T.
  Yamada, A. Yonehara, R. Poleski, J. Skowron, P. Mr\'oz, M.K. Szyma\'nski, S.
  Koz{\l}owski, P. Pietrukowicz, I. Soszy\'nski, \L. Wyrzykowski, K. Ulaczyk","OGLE-2013-BLG-1761Lb: A Massive Planet Around an M/K Dwarf","22pages, 7figures, 2tables, submitted to AAS Journals",,"10.3847/1538-3881/aa73da",,"astro-ph.EP","http://arxiv.org/licenses/nonexclusive-distrib/1.0/","  We report the discovery and the analysis of the planetary microlensing event,
OGLE-2013-BLG-1761. There are some degenerate solutions in this event because
the planetary anomaly is only sparsely sampled. But the detailed light curve
analysis ruled out all stellar binary models and shows that the lens to be a
planetary system. There is the so-called close/wide degeneracy in the solutions
with the planet/host mass ratio of $q \sim (7.5 \pm 1.5) \times 10^{-3}$ and $q
\sim (9.3 \pm 2.9) \times 10^{-3}$ with the projected separation in Einstein
radius units of $s = 0.95$ (close) and $s = 1.19$ (wide), respectively. The
microlens parallax effect is not detected but the finite source effect is
detected. Our Bayesian analysis indicates that the lens system is located at
$D_{\rm L}=6.9_{-1.2}^{+1.0} \ {\rm kpc}$ away from us and the host star is an
M/K-dwarf with the mass of $M_{\rm L}=0.33_{-0.18}^{+0.32} \ M_{\odot}$ orbited
by a super-Jupiter mass planet with the mass of $m_{\rm P}=2.8_{-1.5}^{+2.5} \
M_{\rm Jup}$ at the projected separation of $a_{\perp}=1.8_{-0.5}^{+0.5} \ {\rm
AU}$. The preference of the large lens distance in the Bayesian analysis is due
to the relatively large observed source star radius. The distance and other
physical parameters can be constrained by the future high resolution imaging by
ground large telescopes or HST. If the estimated lens distance is correct, this
planet provides another sample for testing the claimed deficit of planets in
the Galactic bulge.
","[{""version"":""v1"",""created"":""Wed, 22 Mar 2017 12:44:52 GMT""}]","2017-06-21"
"1703.07624","Junzo Watanabe","Junzo Watanabe and Michiel de Bondt","On the theory of Gordan-Noether on homogeneous forms with zero Hessian
  (Improved version)",,,,,"math.AC","http://arxiv.org/licenses/nonexclusive-distrib/1.0/","  We give a detailed proof for Gordan-Noether's results in ""Ueber die
algebraischen Formen, deren Hesse'sche Determinante identisch verschwindet""
published in 1876 in Mathematische Annahlen. C. Lossen has written a paper in a
similar direction as the present paper, but did not provide a proof for every
result. In our paper, every result is proved. Furthermore, our paper is
independent of Lossen's paper and includes a considerable number of new
observations.
  An earlier version of this paper has been printed in Proceedings of the
School of Science of Tokai University, Vol.49, Mar. 2014. In this version, a
serious error has been corrected and some new results have been added.
","[{""version"":""v1"",""created"":""Wed, 22 Mar 2017 12:49:19 GMT""},{""version"":""v2"",""created"":""Sun, 31 Mar 2019 22:13:30 GMT""},{""version"":""v3"",""created"":""Fri, 27 Sep 2019 12:25:51 GMT""}]","2019-09-30"
"1703.07625","Joris Gu\'erin","Joris Gu\'erin, Olivier Gibaru, St\'ephane Thiery and Eric Nyiri","Clustering for Different Scales of Measurement - the Gap-Ratio Weighted
  K-means Algorithm","13 pages, 6 figures, 2 tables. This paper is under the review process
  for AIAP 2017",,,,"cs.LG cs.DS stat.ML","http://arxiv.org/licenses/nonexclusive-distrib/1.0/","  This paper describes a method for clustering data that are spread out over
large regions and which dimensions are on different scales of measurement. Such
an algorithm was developed to implement a robotics application consisting in
sorting and storing objects in an unsupervised way. The toy dataset used to
validate such application consists of Lego bricks of different shapes and
colors. The uncontrolled lighting conditions together with the use of RGB color
features, respectively involve data with a large spread and different levels of
measurement between data dimensions. To overcome the combination of these two
characteristics in the data, we have developed a new weighted K-means
algorithm, called gap-ratio K-means, which consists in weighting each dimension
of the feature space before running the K-means algorithm. The weight
associated with a feature is proportional to the ratio of the biggest gap
between two consecutive data points, and the average of all the other gaps.
This method is compared with two other variants of K-means on the Lego bricks
clustering problem as well as two other common classification datasets.
","[{""version"":""v1"",""created"":""Wed, 22 Mar 2017 12:50:15 GMT""}]","2017-03-23"
"1703.07626","Przemyslaw Lenkiewicz","Przemyslaw Lenkiewicz, P. Chris Broekema, Bernard Metzler","Energy-Efficient Data Transfers in Radio Astronomy with Software UDP
  RDMA","Preprint submitted to Future Generation Computer Systems, 15 pages",,"10.1016/j.future.2017.03.027",,"cs.NI","http://arxiv.org/licenses/nonexclusive-distrib/1.0/","  Modern radio astronomy relies on very large amounts of data that need to be
transferred between various parts of astronomical instruments, over distances
that are often in the range of tens or hundreds of kilometres. The Square
Kilometre Array (SKA) will be the world's largest radio telescope, data rates
between its components will exceed Terabits per second. This will impose a huge
challenge on its data transport system, especially with regard to power
consumption. High-speed data transfers using modern off-the-shelf hardware may
impose a significant load on the receiving system with respect to CPU and DRAM
usage. The SKA has a strict energy budget which demands a new, custom-designed
data transport solution. In this paper we present SoftiWARP UDP, an unreliable
datagram-based Remote Direct Memory Access (RDMA) protocol, which can
significantly increase the energy-efficiency of high-speed data transfers for
radio astronomy. We have implemented a fully functional software prototype of
such a protocol, supporting RDMA Read and Write operations and zero-copy
capabilities. We present measurements of power consumption and achieved
bandwidth and investigate the behaviour of all examined protocols when
subjected to packet loss.
","[{""version"":""v1"",""created"":""Wed, 22 Mar 2017 12:51:05 GMT""}]","2018-05-01"
"1703.07627","Victor Mikhalev","M. Chauvin, M. Friis, M. Jackson, T. Kawano, M. Kiss, V. Mikhalev, N.
  Ohashi, T. Stana, H. Takahashi, M. Pearce","Calibration and performance studies of the balloon-borne hard X-ray
  polarimeter PoGO+","Accepted for publication in Nuclear Inst. and Methods in Physics
  Research, A",,"10.1016/j.nima.2017.03.027",,"astro-ph.IM","http://arxiv.org/licenses/nonexclusive-distrib/1.0/","  Polarimetric observations of celestial sources in the hard X-ray band stand
to provide new information on emission mechanisms and source geometries. PoGO+
is a Compton scattering polarimeter (20-150 keV) optimised for the observation
of the Crab (pulsar and wind nebula) and Cygnus X-1 (black hole binary), from a
stratospheric balloon-borne platform launched from the Esrange Space Centre in
summer 2016. Prior to flight, the response of the polarimeter has been studied
with polarised and unpolarised X-rays allowing a Geant4-based simulation model
to be validated. The expected modulation factor for Crab observations is found
to be $M_{\mathrm{Crab}}=(41.75\pm0.85)\%$, resulting in an expected Minimum
Detectable Polarisation (MDP) of $7.3\%$ for a 7 day flight. This will allow a
measurement of the Crab polarisation parameters with at least $5\sigma$
statistical significance assuming a polarisation fraction $\sim20\%$ $-$ a
significant improvement over the PoGOLite Pathfinder mission which flew in 2013
and from which the PoGO+ design is developed.
","[{""version"":""v1"",""created"":""Wed, 22 Mar 2017 12:55:34 GMT""}]","2017-03-23"
"1703.07628","Nikolay Arsenyev","N. N. Arsenyev, A. P. Severyukhin, V. V. Voronov, Nguyen Van Giai","Influence of complex configurations on properties of pygmy dipole
  resonance in neutron-rich Ca isotopes","11 pages, 10 figures","Phys. Rev. C 95, 054312 (2017)","10.1103/PhysRevC.95.054312",,"nucl-th","http://arxiv.org/licenses/nonexclusive-distrib/1.0/","  Starting from the quasiparticle random phase approximation based on the
Skyrme interaction SLy5, we study the effects of phonon-phonon coupling~(PPC)
on the low-energy electric dipole response in $^{40-58}$Ca. Using the same set
of parameters we describe available experimental data for $^{40,44,48}$Ca and
give prediction for $^{50-58}$Ca. The inclusion of the PPC results in the
formation of low-energy $1^-$ states. There is an impact of the PPC effect on
low-energy $E1$~strength of $^{40,44,48}$Ca. The PPC effect on the electric
dipole polarizability is discussed. We predict a strong increase of the summed
$E1$~strength below 10MeV, with increasing neutron number from $^{48}$Ca till
$^{58}$Ca.
","[{""version"":""v1"",""created"":""Wed, 22 Mar 2017 13:00:42 GMT""}]","2017-05-23"
"1703.07629","Gaurav Gupta","Gaurav Kumar Gupta and Tanmoy Das","Quantum spin Hall density wave insulator of correlated fermions","8 pages, 4 figures","Phys. Rev. B 95, 161109 (2017)","10.1103/PhysRevB.95.161109","Physical Review B (Vol.95, No.16)","cond-mat.mes-hall cond-mat.str-el","http://arxiv.org/licenses/nonexclusive-distrib/1.0/","  We present the theory of a new type of topological quantum order which is
driven by the spin-orbit density wave order parameter, and distinguished by
$Z_2$ topological invariant. We show that when two oppositely polarized chiral
bands [resulting from the Rashba-type spin-orbit coupling $\alpha_k$, $k$ is
crystal momentum] are significantly nested by a special wavevector ${\bf
Q}\sim(\pi,0)/(0,\pi)$, it induces a spatially modulated inversion of the
chirality ($\alpha_{k+Q}=\alpha_k^*$) between different sublattices. The
resulting quantum order parameters break translational symmetry, but preserve
time-reversal symmetry. It is inherently associated with a $Z_2$-topological
invariant along each density wave propagation direction. Hence it gives a weak
topological insulator in two dimensions, with even number of spin-polarized
boundary states. This phase is analogous to the quantum spin-Hall state, except
here the time-reversal polarization is spatially modulated, and thus it is
dubbed quantum spin-Hall density wave (QSHDW) state. This order parameter can
be realized or engineered in quantum wires, or quasi-2D systems, by tuning the
spin-orbit couping strength and chemical potential to achieve the special
nesting condition.
","[{""version"":""v1"",""created"":""Wed, 22 Mar 2017 13:01:51 GMT""}]","2017-04-26"
"1703.07630","Jorge Cayao","Jorge Cayao","Hybrid superconductor-semiconductor nanowire junctions as useful
  platforms to study Majorana bound states","PhD thesis, May 2016, UAM & ICMM-CSIC, 258 pages, 100 figures",,,,"cond-mat.mes-hall","http://arxiv.org/licenses/nonexclusive-distrib/1.0/","  One of the most promising platforms for one-dimensional topological
superconductivity is based on semiconducting nanowires with strong spin-orbit
coupling (SOC), where s-wave superconductivity is induced by proximity effect
and an external Zeeman field drives the system into the topological
superconducting phase with Majorana bound states (MBSs) at the end of the wire.
During last years this idea has led to a great number of important experiments
in hybrid superconductor-semiconductor systems, where the main signature is an
emergent zero-bias peak (ZBP) in the differential conductance as the Zeeman
field is increased.
  This thesis focuses on the study of hybrid superconductor-semiconductor
junctions made of semiconducting nanowires with Rashba SOC. We emphasise the
importance of employing hybrids superconductor-semiconductor nanowire junctions
towards the unambiguously detection of MBSs beyond zero-bias anomalies.
","[{""version"":""v1"",""created"":""Wed, 22 Mar 2017 13:02:03 GMT""}]","2017-03-23"
"1703.07631","Christine Berkesch","Christine Berkesch, Daniel Erman, and Gregory G. Smith","Virtual Resolutions for a Product of Projective Spaces","22 pages, 1 figure","Algebraic Geometry, 7 (2020) no. 4, 460-481","10.14231/AG-2020-013",,"math.AC math.AG","http://arxiv.org/licenses/nonexclusive-distrib/1.0/","  Syzygies capture intricate geometric properties of a subvariety in projective
space. However, when the ambient space is a product of projective spaces or a
more general smooth projective toric variety, minimal free resolutions over the
Cox ring are too long and contain many geometrically superfluous summands. In
this paper, we construct some much shorter free complexes that better encode
the geometry.
","[{""version"":""v1"",""created"":""Wed, 22 Mar 2017 13:06:01 GMT""},{""version"":""v2"",""created"":""Thu, 5 Dec 2019 21:04:15 GMT""}]","2020-08-21"
"1703.07632","Filip Misev","Filip Misev","On families of fibred knots with equal Seifert forms",,"CAG 29 (2021), no. 2, 465-482","10.4310/CAG.2021.v29.n2.a6",,"math.GT","http://arxiv.org/licenses/nonexclusive-distrib/1.0/","  For every genus $g\geq 2$, we construct an infinite family of strongly
quasipositive fibred knots having the same Seifert form as the torus knot
$T(2,2g+1)$. In particular, their signatures and four-genera are maximal and
their homological monodromies (hence their Alexander module structures) agree.
On the other hand, the geometric stretching factors are pairwise distinct and
the knots are pairwise not ribbon concordant.
","[{""version"":""v1"",""created"":""Wed, 22 Mar 2017 13:06:19 GMT""}]","2021-05-27"
"1703.07634","Tomoki Ozawa","Tomoki Ozawa, Alberto Amo, Jacqueline Bloch, Iacopo Carusotto","Klein tunneling in driven-dissipative photonic graphene","11 pages, 8 figures","Phys. Rev. A 96, 013813 (2017)","10.1103/PhysRevA.96.013813",,"physics.optics cond-mat.mes-hall","http://arxiv.org/licenses/nonexclusive-distrib/1.0/","  We theoretically investigate Klein tunneling processes in photonic artificial
graphene. Klein tunneling is a phenomenon in which a particle with Dirac
dispersion going through a potential step shows a characteristic angle- and
energy-dependent transmission. We consider a generic photonic system consisting
of a honeycomb-shaped array of sites with losses, illuminated by coherent
monochromatic light. We show how the transmission and reflection coefficients
can be obtained from the steady-state field profile of the driven-dissipative
system. Despite the presence of photonic losses, we recover the main scattering
features predicted by the general theory of Klein tunneling. Signatures of
negative refraction and the orientation dependence of the intervalley
scattering are also highlighted. Our results will stimulate the experimental
study of intricate transport phenomena using driven-dissipative photonic
simulators.
","[{""version"":""v1"",""created"":""Wed, 22 Mar 2017 13:11:01 GMT""},{""version"":""v2"",""created"":""Thu, 20 Jul 2017 07:33:05 GMT""}]","2017-07-21"
"1703.07635","Francisco Soto-Eguibar","Jorge A. Anaya-Contreras, Arturo Z\'u\~niga-Segundo, Francisco
  Soto-Eguibar, H. Moya-Cessa","Multiphoton processes by conditional measurements in the atom-field
  interaction","6 pages, 5 figures",,,,"quant-ph physics.optics","http://arxiv.org/licenses/nonexclusive-distrib/1.0/","  We show that it is possible to add or subtract many photons from a cavity
field by interacting it resonantly with a two-level atom. The atom, after
entangling with the field inside the cavity and exiting it, may be measured in
one of the Schmidt states, producing a multiphoton process (in the sense that
can add or annihilate more photons than a single transition allows), i.e.,
adding or subtracting several photons from the cavity field.
","[{""version"":""v1"",""created"":""Wed, 22 Mar 2017 13:16:09 GMT""}]","2017-03-23"
