"1703.09010","Colin Wilson","Richard Ghail, Colin Wilson, Thomas Widemann, Lorenzo Bruzzone,
  Caroline Dumoulin, J\""orn Helbert, Robbie Herrick, Emmanuel Marcq, Philippa
  Mason, Pascal Rosenblatt, Ann Carine Vandaele, Louis-Jerome Burtz","EnVision: understanding why our most Earth-like neighbour is so
  different","ES M5 mission proposal",,,,"astro-ph.EP","http://arxiv.org/licenses/nonexclusive-distrib/1.0/","  This document is the EnVision Venus orbiter proposal, submitted in October
2016 in response to ESA's M5 call for Medium-size missions for its Science
Programme, for launch in 2029.
  Why are the terrestrial planets so different? Venus should be the most
Earth-like of all our planetary neighbours: its size, bulk composition and
distance from the Sun are very similar to those of Earth. Its original
atmosphere was probably similar to that of early Earth, with abundant water
that would have been liquid under the young sun's fainter output. Even today,
with its global cloud cover, the surface of Venus receives less solar energy
than does Earth, so why did a moderate climate ensue here but a catastrophic
runaway greenhouse on Venus? How and why did it all go wrong for Venus? What
lessons can be learned about the life story of terrestrial planets in general,
in this era of discovery of Earth-like exoplanets? Were the radically different
evolutionary paths of Earth and Venus driven solely by distance from the Sun,
or do internal dynamics, geological activity, volcanic outgassing and
weathering also play an important part?
  Following the primarily atmospheric focus of Venus Express, we propose a new
Venus orbiter named EnVision, to focus on Venus' geology and geochemical
cycles, seeking evidence for present and past activity. The payload comprises a
state-of-the-art S-band radar which will be able to return imagery at spatial
resolutions of 1 - 30 m, and capable of measuring cm-scale deformation; this is
complemented by subsurface radar, IR and UV spectrometers to map volcanic
gases, and by geodetic investigations.
","[{""version"":""v1"",""created"":""Mon, 27 Mar 2017 11:10:25 GMT""}]","2017-03-28"
"1703.09011","John Haslegrave","Agelos Georgakopoulos, John Haslegrave","Percolation on an infinitely generated group","23 pages","Combinator. Probab. Comp. 29 (2020) 587-615","10.1017/S096354832000005X",,"math.PR math.CO","http://arxiv.org/licenses/nonexclusive-distrib/1.0/","  We give an example of a long range Bernoulli percolation process on a group
non-quasi-isometric with $\mathbb{Z}$, in which clusters are almost surely
finite for all values of the parameter. This random graph admits diverse
equivalent definitions, and we study their ramifications. We also study its
expected size and point out certain phase transitions.
","[{""version"":""v1"",""created"":""Mon, 27 Mar 2017 11:13:27 GMT""},{""version"":""v2"",""created"":""Fri, 11 Aug 2017 15:22:06 GMT""},{""version"":""v3"",""created"":""Thu, 28 Jun 2018 10:57:51 GMT""},{""version"":""v4"",""created"":""Fri, 18 Oct 2019 15:50:11 GMT""}]","2020-08-12"
"1703.09012","Jan Kuratko","Jan Ku\v{r}\'atko","Factorization of Saddle-point Matrices in Dynamical Systems
  Optimization---Reusing Pivots",,,,,"math.OC","http://arxiv.org/licenses/nonexclusive-distrib/1.0/","  In this paper we consider the application of direct methods for solving a
sequence of saddle-point systems. Our goal is to design a method that reuses
information from one factorization and applies it to the next one. In more
detail, when we compute the pivoted $LDL^T$ factorization we speed up
computation by reusing already computed pivots and permutations. We develop our
method in the frame of dynamical systems optimization. Experiments show that
the method improves efficiency over Bunch-Parlett while delivering the same
results.
","[{""version"":""v1"",""created"":""Mon, 27 Mar 2017 11:13:35 GMT""},{""version"":""v2"",""created"":""Mon, 18 Sep 2017 12:51:05 GMT""}]","2017-09-19"
"1703.09013","Christina Niklaus","Christina Niklaus, Bernhard Bermeitinger, Siegfried Handschuh, Andr\'e
  Freitas","A Sentence Simplification System for Improving Relation Extraction","26th International Conference on Computational Linguistics (COLING
  2016)",,,,"cs.CL","http://creativecommons.org/licenses/by/4.0/","  In this demo paper, we present a text simplification approach that is
directed at improving the performance of state-of-the-art Open Relation
Extraction (RE) systems. As syntactically complex sentences often pose a
challenge for current Open RE approaches, we have developed a simplification
framework that performs a pre-processing step by taking a single sentence as
input and using a set of syntactic-based transformation rules to create a
textual input that is easier to process for subsequently applied Open RE
systems.
","[{""version"":""v1"",""created"":""Mon, 27 Mar 2017 11:15:58 GMT""}]","2017-03-28"
"1703.09014","Eran Bouchbinder","Jacques Zylberg, Edan Lerner, Yohai Bar-Sinai and Eran Bouchbinder","Local thermal energy as a structural indicator in glasses","8 pages, 4 figures + Supporting Information, shorter title, minor
  textual changes","PNAS 114, 7289 (2017)","10.1073/pnas.1704403114",,"cond-mat.soft cond-mat.mtrl-sci cond-mat.stat-mech","http://arxiv.org/licenses/nonexclusive-distrib/1.0/","  Identifying heterogeneous structures in glasses --- such as localized soft
spots --- and understanding structure-dynamics relations in these systems
remain major scientific challenges. Here we derive an exact expression for the
local thermal energy of interacting particles (the mean local potential energy
change due to thermal fluctuations) in glassy systems by a systematic
low-temperature expansion. We show that the local thermal energy can attain
anomalously large values, inversely related to the degree of softness of
localized structures in a glass, determined by a coupling between internal
stresses --- an intrinsic signature of glassy frustration ---, anharmonicity
and low-frequency vibrational modes. These anomalously large values follow a
fat-tailed distribution, with a universal exponent related to the recently
observed universal $\omega^4$ density of states of quasi-localized
low-frequency vibrational modes. When the spatial thermal energy field --- a
`softness field' --- is considered, this power-law tail manifests itself by
highly localized spots which are significantly softer than their surroundings.
These soft spots are shown to be susceptible to plastic rearrangements under
external driving forces, having predictive powers that surpass those of the
normal-modes-based approach. These results offer a general,
system/model-independent, physical-observable-based approach to identify
structural properties of quiescent glasses and to relate them to glassy
dynamics.
","[{""version"":""v1"",""created"":""Mon, 27 Mar 2017 11:16:48 GMT""},{""version"":""v2"",""created"":""Thu, 27 Jul 2017 19:52:12 GMT""}]","2017-08-16"
"1703.09015","David Simmons","Ryan Broderick, Lior Fishman, and David Simmons","Quantitative results using variants of Schmidt's game: Dimension bounds,
  arithmetic progressions, and more",,,,,"math.MG math.NT","http://arxiv.org/licenses/nonexclusive-distrib/1.0/","  Schmidt's game is generally used to deduce qualitative information about the
Hausdorff dimensions of fractal sets and their intersections. However, one can
also ask about quantitative versions of the properties of winning sets. In this
paper we show that such quantitative information has applications to various
questions including:
  * What is the maximal length of an arithmetic progression on the ""middle
$\epsilon$"" Cantor set?
  * What is the smallest $n$ such that there is some element of the ternary
Cantor set whose continued fraction partial quotients are all $\leq n$?
  * What is the Hausdorff dimension of the set of $\epsilon$-badly approximable
numbers on the Cantor set?
  We show that a variant of Schmidt's game known as the $potential$ $game$ is
capable of providing better bounds on the answers to these questions than the
classical Schmidt's game. We also use the potential game to provide a new proof
of an important lemma in the classical proof of the existence of Hall's Ray.
","[{""version"":""v1"",""created"":""Mon, 27 Mar 2017 11:20:57 GMT""},{""version"":""v2"",""created"":""Mon, 3 Apr 2017 10:59:19 GMT""},{""version"":""v3"",""created"":""Fri, 15 Sep 2017 11:31:54 GMT""}]","2017-09-18"
"1703.09016","Stefan K\""uchemann","Stefan K\""uchemann and Robert Maa{\ss}","Gamma relaxation in bulk metallic glasses","15 pages including supplementary material, 4 figures (main text) and
  3 additional figures (supplementary material)",,,,"cond-mat.mtrl-sci cond-mat.dis-nn","http://arxiv.org/licenses/nonexclusive-distrib/1.0/","  Studying the primary {\alpha}- and secondary {\beta}-relaxation process has
contributed significantly to the understanding of the structure and rheology of
metallic glasses. In this letter, we report on a third relaxation mechanism
indicated by a maximum in the loss modulus at low temperatures, which we term
{\gamma}-relaxation. Contrary to the {\alpha}- and {\beta}-relaxation
mechanisms, this irreversible, low energy excitation causes a macroscopic
rejuvenation, which we assign to non-affine atomic rearrangements in the matrix
that are driven by thermal stresses during cooling. Observed in three different
glassy alloys, the low temperature relaxation is identified as a general
process in metallic glasses.
","[{""version"":""v1"",""created"":""Mon, 27 Mar 2017 11:24:55 GMT""}]","2017-03-28"
"1703.09017","Ulisse Munari","U. Munari, F.-J. Hambsch and A. Frigo","Photometric evolution of seven recent novae and the double component
  characterizing the lightcurve of those emitting in gamma rays","MNRAS, 18 pages, 17 figures, 3 tables (1 electronic)",,"10.1093/mnras/stx1116",,"astro-ph.SR","http://arxiv.org/licenses/nonexclusive-distrib/1.0/","  The BVI lightcurves of seven recent novae have been extensively mapped with
daily robotic observations from Atacama (Chile). They are V1534 Sco, V1535 Sco,
V2949 Oph, V3661 Oph, MASTER OT J010603.18-744715.8, TCP J1734475-240942 and
ASASSN-16ma. Five belong to the Bulge, one to SMC and another is a Galactic
disk object. The two program novae detected in gamma-rays by Fermi-LAT (TCP
J1734475-240942 and ASASSN-16ma) are Bulge objects with unevolved companions.
They distinguish themselves in showing a double-component optical lightcurve.
The first component to develop is the fireball from freely-expanding,
ballistic-launched ejecta with the time of passage through maximum which is
strongly dependent on wavelength (~1 day delay between B and I bands). The
second component, emerging simultaneously with the nova detection in
gamma-rays, evolves at a slower pace, its optical brightness being proportional
to the gamma-ray flux, and its passage through maximum not dependent on
wavelength. The fact that gamma-rays are detected at peak flux level differing
by 4x from novae at the distance of the Bulge seems to suggest that gamma-ray
emission is not a widespread property of normal novae. We discuss the
advantages offered by high-quality photometric observations collected with only
one telescope (as opposed to data provided by a number of different
instruments), and observe the effects of: wavelength dependence of a fireball
expansion, recombination in the flashed wind of a giant companion, subtle
presence of hiccups, super-soft X-ray emission on and off. Four program novae
(V2949 Oph, V3661 Oph, TCP J18102829-2729590, and ASASSN-16ma) are found to
have normal dwarf companions, while V1534 Sco contains an M3III giant, V1535
Sco a K-type giant, and MASTER OT J010603.18-744715.8 a sub-giant.
","[{""version"":""v1"",""created"":""Mon, 27 Mar 2017 11:28:31 GMT""}]","2017-06-28"
"1703.09018","Jeremy Faupin","J\'er\'emy Faupin and J\""urg Fr\""ohlich","Asymptotic completeness in dissipative scattering theory","48 pages",,,,"math-ph math.MP","http://arxiv.org/licenses/nonexclusive-distrib/1.0/","  We consider an abstract pseudo-Hamiltonian for the nuclear optical model,
given by a dissipative operator of the form $H = H_V - i C^* C$, where $H_V =
H_0 + V$ is self-adjoint and $C$ is a bounded operator. We study the wave
operators associated to $H$ and $H_0$. We prove that they are asymptotically
complete if and only if $H$ does not have spectral singularities on the real
axis. For Schr\""odinger operators, the spectral singularities correspond to
real resonances.
","[{""version"":""v1"",""created"":""Mon, 27 Mar 2017 11:37:41 GMT""}]","2017-03-28"
"1703.09019","Matteo Conforti","Gang Xu, Matteo Conforti, Alexandre Kudlinski, Arnaud Mussot, Stefano
  Trillo","Dispersive dam-break flow of a photon fluid",,"Phys. Rev. Lett. 118, 254101 (2017)","10.1103/PhysRevLett.118.254101",,"physics.optics nlin.PS nlin.SI physics.flu-dyn","http://arxiv.org/licenses/nonexclusive-distrib/1.0/","  We investigate the temporal photonic analogue of the dam-break phenomenon for
shallow water by exploiting a fiber optics setup. We clearly observe the decay
of the step-like input (photonic dam) into a pair of oppositely propagating
rarefaction wave and dispersive shock wave. Our results show evidence for a
critical transition of the dispersive shock into a self-cavitating state. The
detailed observation of the cavitating state dynamics allows for a fully
quantitative test of the Whitham modulation theory applied to the universal
defocusing nonlinear Schroedinger equation.
","[{""version"":""v1"",""created"":""Mon, 27 Mar 2017 11:46:48 GMT""},{""version"":""v2"",""created"":""Tue, 28 Mar 2017 12:33:24 GMT""}]","2017-06-28"
"1703.09020","Ryusuke Jinno","Ryusuke Jinno and Kunio Kaneta","Hillclimbing inflation","5 pages, 3 figures","Phys. Rev. D 96, 043518 (2017)","10.1103/PhysRevD.96.043518","CTPU-17-11","hep-ph gr-qc hep-th","http://arxiv.org/licenses/nonexclusive-distrib/1.0/","  We propose a new class of inflationary models in which inflation takes place
while the inflaton is climbing up a potential hill due to a coupling to
gravity. We study their attractor behavior, and investigate its relation with
known attractors. We also discuss a possible realization of this type of models
with the natural inflation, and show that the inflationary predictions come
well within the region consistent with the observation of the cosmic microwave
background.
","[{""version"":""v1"",""created"":""Mon, 27 Mar 2017 11:49:41 GMT""},{""version"":""v2"",""created"":""Fri, 14 Apr 2017 02:40:30 GMT""},{""version"":""v3"",""created"":""Wed, 21 Jun 2017 08:26:16 GMT""}]","2017-08-30"
"1703.09021","Vladislav Pantuev","V.S. Pantuev","Corona effect in AA collisions at LHC","Published version, 4 pages, 5 figures. Only on-line abstract changed
  by adding notation ""parton binding energy""",,"10.1134/S0021364017100022",,"hep-ph nucl-ex nucl-th","http://arxiv.org/licenses/nonexclusive-distrib/1.0/","  Following our earlier finding based on RHIC data on the dominant jet
production from nucleus corona region, we reconsider this effect in
nucleus-nucleus collisions at LHC energy. Our hypothesis was based on
experimental data, which raised the idea of a finite formation time for the
produced medium. At RHIC energy and in low density corona region this time
reaches about 2 fm/c. All observed high p_t particles are produced in the
corona region and have a chance to escape during this 2 fm/c. After that, the
formed high density matter absorbs all jets. Following this hypothesis, the
nuclear modification factor R_{AA} should be independent on particle momentum
and be flat versus p_t. At the same time, we describe the finite azimuthal
anisotropy of high p_t particles, v_2. A separate prediction held that, at LHC
energy, the formation time in the corona region should be two times smaller,
about 1 fm/c. New data at LHC show that R_{AA} is not flat and is rising with
p_t. We add to our original hypothesis an assumption that a fast parton
traversing the produced medium loses the fixed portion of its energy. A shift
of about 7 GeV (I would call it as a parton binding energy) from the original
power law p^{-6} production cross section in pp explains well all the observed
R_{AA} dependencies. The shift of about 7 GeV is also valid at RHIC energy,
where the cross section follows a power law with about p^{-8} and this shift
explains a very slow rise of R_{AA} seen for neutral pions with p_t above 15
GeV/c. We also show that the observed at LHC dependence of v_2 at high p_t and
our previous predictions agree.
","[{""version"":""v1"",""created"":""Mon, 27 Mar 2017 11:53:33 GMT""},{""version"":""v2"",""created"":""Fri, 21 Apr 2017 08:43:31 GMT""},{""version"":""v3"",""created"":""Thu, 28 Sep 2017 21:08:14 GMT""}]","2017-10-02"
"1703.09022","A.I. Romanov","V.G. Ksenzov and A.I. Romanov","Zero Points of Chiral Condensate","5 pages",,,,"hep-ph","http://arxiv.org/licenses/nonexclusive-distrib/1.0/","  We investigate a model with a massless fermion and a massive scalar field
with the Yukawa interaction between these two fields. The model possess a
discrete symmetry. The chiral condensate is calculated in one-loop
approximation in $(1+1)$-dimensional spacetime. It was shown that the chiral
condensate vanishes at two different values of the coupling constant. At the
first of them there is a phase transition in which the discrete symmetry is
restored. At the second zero of the chiral condensate it takes place a phase
transition which distinguishes the positive $\mu^2$ from the negative $\mu^2$,
where $\mu^2$ is an effective mass of the scalar field.
","[{""version"":""v1"",""created"":""Mon, 27 Mar 2017 11:58:46 GMT""}]","2017-03-28"
"1703.09023","Huan Li","Liren Shan, Huan Li, Zhongzhi Zhang","Domination number and minimum dominating sets in pseudofractal
  scale-free web and Sierpi\'nski graph",,,"10.1016/j.tcs.2017.03.009",,"cs.SI cs.DM","http://arxiv.org/licenses/nonexclusive-distrib/1.0/","  The minimum dominating set (MDS) problem is a fundamental subject of
theoretical computer science, and has found vast applications in different
areas, including sensor networks, protein interaction networks, and structural
controllability. However, the determination of the size of a MDS and the number
of all MDSs in a general network is NP-hard, and it thus makes sense to seek
particular graphs for which the MDS problem can be solved analytically. In this
paper, we study the MDS problem in the pseudofractal scale-free web and the
Sierpi\'nski graph, which have the same number of vertices and edges. For both
networks, we determine explicitly the domination number, as well as the number
of distinct MDSs. We show that the pseudofractal scale-free web has a unique
MDS, and its domination number is only half of that for the Sierpi\'nski graph,
which has many MDSs. We argue that the scale-free topology is responsible for
the difference of the size and number of MDSs between the two studied graphs,
which in turn indicates that power-law degree distribution plays an important
role in the MDS problem and its applications in scale-free networks.
","[{""version"":""v1"",""created"":""Mon, 27 Mar 2017 12:09:50 GMT""}]","2017-03-28"
"1703.09024","Peter Newstead","H. Lange and P. E. Newstead","Higher rank BN-theory for curves of genus 6","Final version to appear in Internat. J. Math.; some typos corrected",,,,"math.AG","http://arxiv.org/licenses/nonexclusive-distrib/1.0/","  Higher rank Brill-Noether theory for genus 6 is especially interesting as,
even in the general case, some unexpected phenomena arise which are absent in
lower genus. Moreover, it is the first case for which there exist curves of
Clifford dimension greater than 1 (smooth plane quintics). In all cases, we
obtain new upper bounds for non-emptiness of Brill-Noether loci and construct
many examples which approach these upper bounds more closely than those that
are well known. Some of our examples of non-empty Brill-Noether loci have
negative Brill-Noether numbers.
","[{""version"":""v1"",""created"":""Mon, 27 Mar 2017 12:10:01 GMT""},{""version"":""v2"",""created"":""Tue, 16 Jan 2018 18:47:28 GMT""},{""version"":""v3"",""created"":""Mon, 5 Feb 2018 16:02:29 GMT""}]","2018-02-06"
"1703.09025","Jian-Jhih Kuo","Jian-Jhih Kuo, Shan-Hsiang Shen, Ming-Hong Yang, De-Nian Yang,
  Ming-Jer Tsai and Wen-Tsuen Chen","Service Overlay Forest Embedding for Software-Defined Cloud Networks","Technical Report",,,,"cs.NI","http://arxiv.org/licenses/nonexclusive-distrib/1.0/","  Network Function Virtualization (NFV) on Software-Defined Networks (SDN) can
effectively optimize the allocation of Virtual Network Functions (VNFs) and the
routing of network flows simultaneously. Nevertheless, most previous studies on
NFV focus on unicast service chains and thereby are not scalable to support a
large number of destinations in multicast. On the other hand, the allocation of
VNFs has not been supported in the current SDN multicast routing algorithms. In
this paper, therefore, we make the first attempt to tackle a new challenging
problem for finding a service forest with multiple service trees, where each
tree contains multiple VNFs required by each destination. Specifically, we
formulate a new optimization, named Service Overlay Forest (SOF), to minimize
the total cost of all allocated VNFs and all multicast trees in the forest. We
design a new $3\rho_{ST}$-approximation algorithm to solve the problem, where
$\rho_{ST}$ denotes the best approximation ratio of the Steiner Tree problem,
and the distributed implementation of the algorithm is also presented.
Simulation results on real networks for data centers manifest that the proposed
algorithm outperforms the existing ones by over 25%. Moreover, the
implementation of an experimental SDN with HP OpenFlow switches indicates that
SOF can significantly improve the QoE of the Youtube service.
","[{""version"":""v1"",""created"":""Mon, 27 Mar 2017 12:12:55 GMT""}]","2017-03-28"
"1703.09026","Davide Moltisanti","Davide Moltisanti, Michael Wray, Walterio Mayol-Cuevas, Dima Damen","Trespassing the Boundaries: Labeling Temporal Bounds for Object
  Interactions in Egocentric Video","ICCV 2017",,,,"cs.CV","http://arxiv.org/licenses/nonexclusive-distrib/1.0/","  Manual annotations of temporal bounds for object interactions (i.e. start and
end times) are typical training input to recognition, localization and
detection algorithms. For three publicly available egocentric datasets, we
uncover inconsistencies in ground truth temporal bounds within and across
annotators and datasets. We systematically assess the robustness of
state-of-the-art approaches to changes in labeled temporal bounds, for object
interaction recognition. As boundaries are trespassed, a drop of up to 10% is
observed for both Improved Dense Trajectories and Two-Stream Convolutional
Neural Network.
  We demonstrate that such disagreement stems from a limited understanding of
the distinct phases of an action, and propose annotating based on the Rubicon
Boundaries, inspired by a similarly named cognitive model, for consistent
temporal bounds of object interactions. Evaluated on a public dataset, we
report a 4% increase in overall accuracy, and an increase in accuracy for 55%
of classes when Rubicon Boundaries are used for temporal annotations.
","[{""version"":""v1"",""created"":""Mon, 27 Mar 2017 12:14:07 GMT""},{""version"":""v2"",""created"":""Wed, 26 Jul 2017 14:13:23 GMT""}]","2017-07-27"
"1703.09027","Irina Pettersson","Irina Pettersson","Two-scale convergence in thin domains with locally periodic rapidly
  oscillating boundary","13 pages, 1 figure",,,,"math.AP","http://arxiv.org/licenses/nonexclusive-distrib/1.0/","  The aim of this paper is to adapt the notion of two-scale convergence in
$L^p$ to the case of a measure converging to a singular one. We present a
specific case when a thin cylinder with locally periodic rapidly oscillating
boundary shrinks to a segment, and the corresponding measure charging the
cylinder converges to a one-dimensional Lebegues measure of an interval. The
method is then applied to the asymptotic analysis of linear elliptic operators
with locally periodic coefficients in a thin cylinder with locally periodic
rapidly varying thickness.
","[{""version"":""v1"",""created"":""Mon, 27 Mar 2017 12:16:51 GMT""}]","2017-03-28"
