"1703.09090","Zhi Liu","Gene Cheung and Zhi Liu and Zhiyou Ma and Jack Z. G. Tan","Multi-Stream Switching for Interactive Virtual Reality Video Streaming","6 pages, 4 figures",,,,"cs.MM cs.NI","http://arxiv.org/licenses/nonexclusive-distrib/1.0/","  Virtual reality (VR) video provides an immersive 360 viewing experience to a
user wearing a head-mounted display: as the user rotates his head,
correspondingly different fields-of-view (FoV) of the 360 video are rendered
for observation. Transmitting the entire 360 video in high quality over
bandwidth-constrained networks from server to client for real-time playback is
challenging. In this paper we propose a multi-stream switching framework for VR
video streaming: the server pre-encodes a set of VR video streams covering
different view ranges that account for server-client round trip time (RTT)
delay, and during streaming the server transmits and switches streams according
to a user's detected head rotation angle. For a given RTT, we formulate an
optimization to seek multiple VR streams of different view ranges and the
head-angle-to-stream mapping function simultaneously, in order to minimize the
expected distortion subject to bandwidth and storage constraints. We propose an
alternating algorithm that, at each iteration, computes the optimal streams
while keeping the mapping function fixed and vice versa. Experiments show that
for the same bandwidth, our multi-stream switching scheme outperforms a
non-switching single-stream approach by up to 2.9dB in PSNR.
","[{""version"":""v1"",""created"":""Mon, 27 Mar 2017 14:09:12 GMT""}]","2017-03-28"
"1703.09091","Mats Andersson","Mats Andersson","Global Koppelman formulas on (singular) projective varieties",,,,,"math.CV","http://arxiv.org/licenses/nonexclusive-distrib/1.0/","  Let $i\colon X\to \Pk^N$ be a projective manifold of dimension $n$ embedded
in projective space $\Pk^N$, and let $L$ be the pull-back to $X$ of the line
bundle $\Ok_{\Pk^N}(1)$. We construct global explicit Koppelman formulas on $X$
for smooth $(0,*)$-forms with values in $L^s$ for any $s$. %The formulas are
intrinsic on $X$. The same construction works for singular, even non-reduced,
$X$ of pure dimension, if the sheaves of smooth forms are replaced by suitable
sheaves $\A_X^*$ of $(0,*)$-currents with mild singularities at $X_{sing}$. In
particular, if $s\ge \reg X -1$, where $\reg X$ is the Castelnuovo-Mumford
regularity, we get an explicit %%% representation of the well-known vanishing
of $H^{0,q}(X, L^{s-q})$, $q\ge 1$. Also some other applications are indicated.
","[{""version"":""v1"",""created"":""Mon, 27 Mar 2017 14:12:23 GMT""},{""version"":""v2"",""created"":""Sat, 16 Jun 2018 06:05:52 GMT""}]","2018-06-19"
"1703.09092","Stefaan Vaes","Arnaud Brothier, Tobe Deprez and Stefaan Vaes","Rigidity for von Neumann algebras given by locally compact groups and
  their crossed products","v2: minor changes, final version, to appear in Communications in
  Mathematical Physics","Communications in Mathematical Physics 361 (2018), 81-125","10.1007/s00220-018-3091-2",,"math.OA math.DS math.GR","http://arxiv.org/licenses/nonexclusive-distrib/1.0/","  We prove the first rigidity and classification theorems for crossed product
von Neumann algebras given by actions of non-discrete, locally compact groups.
We prove that for arbitrary free probability measure preserving actions of
connected simple Lie groups of real rank one, the crossed product has a unique
Cartan subalgebra up to unitary conjugacy. We then deduce a W* strong rigidity
theorem for irreducible actions of products of such groups. More generally, our
results hold for products of locally compact groups that are nonamenable,
weakly amenable and that belong to Ozawa's class S.
","[{""version"":""v1"",""created"":""Mon, 27 Mar 2017 14:14:35 GMT""},{""version"":""v2"",""created"":""Wed, 6 Dec 2017 09:34:45 GMT""}]","2018-07-20"
"1703.09093","Theodora Ioannidou","M. Agaoglou, E.G. Charalampidis, T.A. Ioannidou and P.G. Kevrekidis","Discrete BPS Skyrmions","15 pages, 7 figures",,"10.1063/1.5000905",,"hep-th nlin.PS","http://arxiv.org/licenses/nonexclusive-distrib/1.0/","  A discrete analogue of the extended Bogomolny-Prasad-Sommerfeld (BPS) Skyrme
model that admits time-dependent solutions is presented. Using the spacing h of
adjacent lattice nodes as a parameter, we identify the spatial profile of the
solution and the continuation of the relevant branch of solutions over the
lattice spacing for different values of the potential (free) parameter
{\alpha}. In particular, we explore the dynamics and stability of the obtained
solutions, finding that, while they generally seem to be prone to
instabilities, for suitable values of the lattice spacing and for sufficiently
large value of {\alpha}, they may be long-lived in direct numerical
simulations.
","[{""version"":""v1"",""created"":""Mon, 27 Mar 2017 14:15:46 GMT""}]","2017-10-11"
"1703.09094","Yuzhu Han","Yuzhu Han and Qingwei Li","Threshold results for the existence of global and blow-up solutions to
  Kirchhoff equations with arbitrary initial energy",,,,,"math.AP","http://arxiv.org/licenses/nonexclusive-distrib/1.0/","  In this paper we will apply the modified potential well method and
variational method to the study of the long time behaviors of solutions to a
class of parabolic equation of Kirchhoff type. Global existence and blow up in
finite time of solutions will be obtained for arbitrary initial energy. To be a
little more precise, we will give a threshold result for the solutions to exist
globally or to blow up in finite time when the initial energy is subcritical
and critical, respectively. The decay rate of the $L^2(\Omega)$ norm is also
obtained for global solutions in these cases. Moreover, some sufficient
conditions for the existence of global and blow-up solutions are also derived
when the initial energy is supercritical.
","[{""version"":""v1"",""created"":""Mon, 27 Mar 2017 14:16:09 GMT""}]","2017-03-28"
"1703.09095","Angel Paredes","Alvaro Navarrete, Angel Paredes, Jose R. Salgueiro and Humberto
  Michinel","Spatial solitons in thermo-optical media from the nonlinear
  Schrodinger-Poisson equation and dark matter analogues","13 pages, 11 figures","Physical Review A 95, 013844 (2017)","10.1103/PhysRevA.95.013844",,"physics.optics astro-ph.GA nlin.PS","http://arxiv.org/licenses/nonexclusive-distrib/1.0/","  We analyze theoretically the Schrodinger-Poisson equation in two transverse
dimensions in the presence of a Kerr term. The model describes the nonlinear
propagation of optical beams in thermooptical media and can be regarded as an
analogue system for a self-gravitating self-interacting wave. We compute
numerically the family of radially symmetric ground state bright stationary
solutions for focusing and defocusing local nonlinearity, keeping in both cases
a focusing nonlocal nonlinearity. We also analyze excited states and
oscillations induced by fixing the temperature at the borders of the material.
We provide simulations of soliton interactions, drawing analogies with the
dynamics of galactic cores in the scalar field dark matter scenario.
","[{""version"":""v1"",""created"":""Mon, 27 Mar 2017 14:18:09 GMT""}]","2017-03-28"
"1703.09096","Maxim Rakhuba","Maxim Rakhuba, Ivan Oseledets","Jacobi-Davidson method on low-rank matrix manifolds","18 pages, 7 figures",,,,"math.NA","http://arxiv.org/licenses/nonexclusive-distrib/1.0/","  In this work we generalize the Jacobi-Davidson method to the case when
eigenvector can be reshaped into a low-rank matrix. In this setting the
proposed method inherits advantages of the original Jacobi-Davidson method, has
lower complexity and requires less storage. We also introduce low-rank version
of the Rayleigh quotient iteration which naturally arises in the
Jacobi-Davidson method.
","[{""version"":""v1"",""created"":""Mon, 27 Mar 2017 14:20:15 GMT""}]","2017-03-28"
"1703.09097","Ian Morris","Ian D. Morris","An explicit formula for the pressure of box-like affine iterated
  function systems","Modified Example 1 so as to include a calculation of the Hausdorff
  dimension",,,,"math.MG math.DS","http://arxiv.org/licenses/nonexclusive-distrib/1.0/","  In this article we investigate the pressure function and affinity dimension
for iterated function systems associated to the ""box-like"" self-affine fractals
investigated by D.-J. Feng, Y. Wang and J.M. Fraser. Combining previous results
of V. Yu. Protasov, A. K\""aenm\""aki and the author we obtain an explicit
formula for the pressure function which makes it straightforward to compute the
affinity dimension of box-like self-affine sets. We also prove a variant of
this formula which allows the computation of a modified singular value pressure
function defined by J.M. Fraser. We give some explicit examples where the
Hausdorff and packing dimensions of a box-like self-affine fractal may be
easily computed.
","[{""version"":""v1"",""created"":""Mon, 27 Mar 2017 14:21:31 GMT""},{""version"":""v2"",""created"":""Wed, 29 Mar 2017 21:11:47 GMT""}]","2017-03-31"
"1703.09098","Pierluigi Vellucci","Pierluigi Vellucci and Mattia Zanella","Microscopic modeling and analysis of collective decision making:
  equality bias leads suboptimal solutions",,,"10.1007/s11565-017-0280-4",,"physics.soc-ph nlin.AO","http://arxiv.org/licenses/nonexclusive-distrib/1.0/","  We discuss a novel microscopic model for collective decision-making
interacting multi-agent systems. In particular we are interested in modeling a
well known phenomena in the experimental literature called equality bias, where
agents tend to behave in the same way as if they were as good, or as bad, as
their partner. We analyze the introduced problem and we prove the suboptimality
of the collective decision-making in the presence of equality bias. Numerical
experiments are addressed in the last section.
","[{""version"":""v1"",""created"":""Mon, 27 Mar 2017 14:23:22 GMT""}]","2017-04-18"
"1703.09099","Rudra Prakash Malik","S. Kumar, B. K. Kureel, R. P. Malik","Nilpotent (Anti-)BRST and (Anti-)co-BRST Symmetries in 2D non-Abelian
  Gauge Theory: Some Novel Observations","LaTeX file, 27 pages, minor changes in the text, journal reference
  given","Int. J. Mod. Phys. A 36 (2021) 2150212 (29 pages)","10.1142/S0217751X21502122",,"hep-th","http://creativecommons.org/licenses/by/4.0/","  We discuss the nilpotent Becchi-Rouet-Stora-Tyutin (BRST), anti-BRST and
(anti-)co-BRST symmetry transformations and derive their corresponding
conserved charges in the case of a two (1+1)-dimensional (2D) self-interacting
non-Abelian gauge theory (without any interaction with matter fields). We point
out a set of novel features that emerge out in the BRST and co-BRST analysis of
the above 2D gauge theory. The algebraic structures of the symmetry operators
(and corresponding conserved charges) and their relationship with the
cohomological operators of differential geometry are established, too. To be
more precise, we demonstrate the existence of a single Lagrangian density that
respects the continuous symmetries which obey proper algebraic structure of the
cohomological operators of differential geometry. In literature, such
observations have been made for the coupled (but equivalent) Lagrangian
densities of the 4D non-Abelian gauge theory. We lay emphasis on the existence
and properties of the Curci-Ferrari (CF) type restrictions in the context of
(anti-)BRST and (anti-)co-BRST symmetry transformations and pinpoint their key
differences and similarities. All the observations, connected with the
(anti-)co-BRST symmetries, are completely novel.
","[{""version"":""v1"",""created"":""Mon, 27 Mar 2017 14:25:31 GMT""},{""version"":""v2"",""created"":""Thu, 20 Jul 2017 13:41:36 GMT""},{""version"":""v3"",""created"":""Mon, 27 Sep 2021 11:50:41 GMT""},{""version"":""v4"",""created"":""Sat, 30 Oct 2021 11:52:03 GMT""}]","2021-11-02"
"1703.09100","Jordi Pic\'o-Cort\'es","Jordi Pic\'o-Cort\'es, Fernando Dom\'inguez and Gloria Platero","Signatures of a 4$\pi$-periodic supercurrent in the voltage response of
  capacitively shunted topological Josephson junctions","12 pages, 7 figures",,"10.1103/PhysRevB.96.125438",,"cond-mat.mes-hall cond-mat.supr-con","http://arxiv.org/licenses/nonexclusive-distrib/1.0/","  We investigate theoretical aspects of the detection of Majorana bound states
in Josephson junctions using the semiclassical RCSJ model of junction dynamics.
The influence of a 4$\pi$-periodic supercurrent contribution can be detected
through its effect on the width of the Shapiro steps and the Fourier spectrum
of the voltage signal. We explain how the inclusion of a capacitance term
results in a strong quenching of the odd steps when the junction is
underdamped, and hence may be used to effectively detect Majorana bound states.
Furthermore, in presence of capacitance the first and third steps are quenched
to a different degree, as observed experimentally. We examine the emission
spectrum of phase-locked solutions, showing that the presence of
period-doubling may difficult the measurement of the 4$\pi$-periodic
contribution from the Fourier spectrum. Finally, we study the voltage response
in the quasiperiodic regime and indicate how the Fourier spectra and the
first-return maps in this regime reflect the change of periodicity in the
supercurrent.
","[{""version"":""v1"",""created"":""Mon, 27 Mar 2017 14:25:35 GMT""},{""version"":""v2"",""created"":""Tue, 28 Mar 2017 14:08:20 GMT""}]","2017-10-06"
"1703.09101","Mohamad Darwich","Mohamad Darwich","On the $L^{2}$-critical nonlinear Schrodinger equation with an
  inhomogeneous damping term","We give in this note some results on the inhomogeneous nonlinear
  schrodinger equation",,,,"math.AP","http://arxiv.org/licenses/nonexclusive-distrib/1.0/","  We consider the $L^2$-critical nonlinear Schrodinger equation with an
inhomogeneous damping term. We prove that there exists an initial data such
that the corresponding solution is global in $H^1(R^d)$ and we give the minimal
time of the blow up for some initial data.
","[{""version"":""v1"",""created"":""Mon, 27 Mar 2017 14:26:30 GMT""}]","2017-03-28"
"1703.09102","Juliana Xavier","Juan Alonso, Nancy Guelman, Cristobal Rivas and Juliana Xavier","One some planar Baumslag-Solitar actions","28 pages, 2 figures",,,,"math.DS","http://arxiv.org/licenses/nonexclusive-distrib/1.0/","  Let $BS(1,n)= \langle a,b : a b a ^{-1} = b ^n\rangle$ be the solvable
Baumslag-Solitar group for $n \geq 2$. We study representations of $BS(1, n)$
on the plane by orientation preserving homeomorphisms, assuming that $a$ acts
as a linear map and $b$ as a map with bounded displacement. We find that the
possibilities for a faithful action depend greatly on the Jordan canonical form
of the map $h$ defined by the action of $a$. In case $h$ is diagonalizable over
$\mathbb R$, we shall give examples or prove rigidity theorems depending on the
eigenvalues. We also show some rigidity in the cases where $h$ is elliptic or
parabolic. Then we give applications to the actions of $BS(1, n)$ by
homeomorphisms of the torus.
","[{""version"":""v1"",""created"":""Mon, 27 Mar 2017 14:29:04 GMT""},{""version"":""v2"",""created"":""Thu, 17 Mar 2022 22:15:15 GMT""}]","2022-03-21"
"1703.09103","Mohammad Reza Khosravi","Mohammad Reza Khosravi, Mohammad Kazem Moghimi","Theoretical Evaluation of Li et al.'s Approach for Improving a Binary
  Watermark-Based Scheme in Remote Sensing Data Communications",,"Majlesi Journal of Telecommunication Devices, 5, 4, 151-153 (2016)",,,"cs.MM","http://creativecommons.org/licenses/by/4.0/","  This letter is about a principal weakness of the published article by Li et
al. in 2014. It seems that the mentioned work has a terrible conceptual mistake
while presenting its theoretical approach. In fact, the work has tried to
design a new attack and its effective solution for a basic watermarking
algorithm by Zhu et al. published in 2013, however in practice, we show the Li
et al.'s approach is not correct to obtain the aim. For disproof of the
incorrect approach, we only apply a numerical example as the counterexample of
the Li et al.'s approach.
","[{""version"":""v1"",""created"":""Mon, 27 Mar 2017 14:29:15 GMT""}]","2017-03-28"
"1703.09104","Delfim F. M. Torres","Dina Tavares, Ricardo Almeida, Delfim F. M. Torres","Fractional Herglotz variational problems of variable order","This is a preprint of a paper whose final and definite form is with
  'Discrete and Continuous Dynamical Systems -- Series S' (DCDS-S), ISSN
  1937-1632 (print), ISSN 1937-1179 (online), available at
  [https://www.aimsciences.org/journals/home.jsp?journalID=15]. Paper Submitted
  30-July-2016; Revised 03-Feb-2017; Accepted 27-March-2017","Discrete Contin. Dyn. Syst. Ser. S 11 (2018), no. 1, 143--154","10.3934/dcdss.2018009",,"math.OC","http://arxiv.org/licenses/nonexclusive-distrib/1.0/","  We study fractional variational problems of Herglotz type of variable order.
Necessary optimality conditions, described by fractional differential equations
depending on a combined Caputo fractional derivative of variable order, are
proved. Two different cases are considered: the fundamental problem, with one
independent variable, and the general case, with several independent variables.
We end with some illustrative examples of the results of the paper.
","[{""version"":""v1"",""created"":""Mon, 27 Mar 2017 14:29:19 GMT""}]","2017-10-12"
"1703.09105","Badreddine Mansouri Dr","Badreddine Mansouri, Mostapha abd el ouahab Saouli","Reflected solutions of Anticipated Backward Doubly SDEs driven by
  Teugels Martingales",,,,,"math.PR","http://arxiv.org/licenses/nonexclusive-distrib/1.0/","  We deal with reflected solutions of anticipated backward doubly stochastic
differential equations (RABDSDEs) driven by Teugels martingales associated with
L\'evy process under a Lipschitz generator where the coefficients of these
BDSDEs depend on the future and present value of the solution $\left(
Y,Z\right) $. Also we study the existence of a solution for anticipated BDSDEs.
","[{""version"":""v1"",""created"":""Mon, 27 Mar 2017 14:29:51 GMT""}]","2017-03-28"
"1703.09106","Maximilian Kessel","M. Kessel (1), J. Hajer (1), G. Karczewski (2), C. Schumacher (1), C.
  Br\""une (1), H. Buhmann (1) and L. W. Molenkamp (1) ((1) Physikalisches
  Institut (EP3), Universit\""at W\""urzburg, Germany, (2) Institute of Physics,
  PAS, Warsaw, Poland)","CdTe-HgTe core-shell nanowire growth controlled by RHEED",,"Phys. Rev. Materials 1, 023401 (2017)","10.1103/PhysRevMaterials.1.023401",,"cond-mat.mtrl-sci","http://arxiv.org/licenses/nonexclusive-distrib/1.0/","  We present results on the growth of CdTe-HgTe core-shell nanowires, a
realization of a quasi one-dimensional heterostructure of the topological
insulator HgTe. The growth is a two step process consisting of the growth of
single crystalline zinc blende CdTe nanowires with the vapor-liquid-solid
method and the overgrowth of these wires with HgTe such that a closed shell is
formed around the CdTe core structure. The CdTe wire growth is monitored by
RHEED allowing us to infer information on the crystal properties from the
electron diffraction pattern. This information is used to find and control the
optimal growth temperature. High quality single crystal CdTe nanowires grow
with a preferred orientation. For the growth of the conductive HgTe shell
structure we find that the supplied Hg:Te ratio is the crucial parameter to
facilitate growth on all surface facets.
","[{""version"":""v1"",""created"":""Mon, 27 Mar 2017 14:33:45 GMT""}]","2017-07-12"
"1703.09107","Lorena Saavedra","Alberto Cabada and Lorena Saavedra","Constant sign solution for simply supported beam equation with
  non-homogeneous boundary conditions","18 pages",,,,"math.CA","http://arxiv.org/licenses/nonexclusive-distrib/1.0/","  The aim of this paper is to study the following fourth-order operator:
  T[p,c]\,u(t)\equiv u^{(4)}(t)-p\,u""(t)+c(t)\,u(t)\,,\quad t\in I\equiv
[a,b]\,, coupled with the non-homogeneous simply supported beam boundary
conditions: u(a)=u(b)=0\,,\quad u""(a)=d_1\leq0\,,\ u""(b)=d_2\leq 0\,.
  First, we prove a result which makes an equivalence between the strongly
inverse positive (negative) character of this operator with the previously
introduced boundary conditions and with the homogeneous boundary conditions,
given by: T[p,c]\,u(t)=h(t)(\geq0)\,, u(a)=u(b)=u""(a)=u""(b)=0\,, Once that we
have done that, we prove several results where the strongly inverse positive
(negative) character of $T[p,c]$ it is ensured. Finally, there are shown a
couple of result which say that under the hypothesis that $h>0$, we can affirm
that the problem for the homogeneous boundary conditions has a unique constant
sign solution.
","[{""version"":""v1"",""created"":""Mon, 27 Mar 2017 14:34:43 GMT""}]","2017-03-28"
"1703.09108","Joeran Beel","Joeran Beel and Akiko Aizawa and Corinna Breitinger and Bela Gipp","Mr. DLib: Recommendations-as-a-Service (RaaS) for Academia","Accepted for publication at the JCDL conference 2017",,,,"cs.IR cs.DL","http://arxiv.org/licenses/nonexclusive-distrib/1.0/","  Only few digital libraries and reference managers offer recommender systems,
although such systems could assist users facing information overload. In this
paper, we introduce Mr. DLib's recommendations-as-a-service, which allows third
parties to easily integrate a recommender system into their products. We
explain the recommender approaches implemented in Mr. DLib (content-based
filtering among others), and present details on 57 million recommendations,
which Mr. DLib delivered to its partner GESIS Sowiport. Finally, we outline our
plans for future development, including integration into JabRef, establishing a
living lab, and providing personalized recommendations.
","[{""version"":""v1"",""created"":""Mon, 27 Mar 2017 14:35:37 GMT""},{""version"":""v2"",""created"":""Thu, 20 Apr 2017 09:50:03 GMT""}]","2018-08-21"
"1703.09109","Joeran Beel","Joeran Beel","Towards Effective Research-Paper Recommender Systems and User Modeling
  based on Mind Maps","PhD Thesis, Otto-von-Guericke University Magdeburg, Germany",,,,"cs.IR","http://arxiv.org/licenses/nonexclusive-distrib/1.0/","  While user-modeling and recommender systems successfully utilize items like
emails, news, and movies, they widely neglect mind-maps as a source for user
modeling. We consider this a serious shortcoming since we assume user modeling
based on mind maps to be equally effective as user modeling based on other
items. Hence, millions of mind-mapping users could benefit from user-modeling
applications such as recommender systems. The objective of this doctoral thesis
is to develop an effective user-modeling approach based on mind maps. To
achieve this objective, we integrate a recommender system in our mind-mapping
and reference-management software Docear. The recommender system builds user
models based on the mind maps, and recommends research papers based on the user
models. As part of our research, we identify several variables relating to
mind-map-based user modeling, and evaluate the variables' impact on
user-modeling effectiveness with an offline evaluation, a user study, and an
online evaluation based on 430,893 recommendations displayed to 4,700 users. We
find, among others, that the number of analyzed nodes, modification time,
visibility of nodes, relations between nodes, and number of children and
siblings of a node affect the effectiveness of user modeling. When all
variables are combined in a favorable way, this novel approach achieves
click-through rates of 7.20%, which is nearly twice as effective as the best
baseline. In addition, we show that user modeling based on mind maps performs
about as well as user modeling based on other items, namely the research
articles users downloaded or cited. Our findings let us to conclude that user
modeling based on mind maps is a promising research field, and that developers
of mind-mapping applications should integrate recommender systems into their
applications. Such systems could create additional value for millions of
mind-mapping users.
","[{""version"":""v1"",""created"":""Mon, 27 Mar 2017 14:35:58 GMT""}]","2017-03-28"
