"1703.08926","Roman Shendrik","R. Shendrik, A. Myasnikova, A. Shalaev, A. Bogdanov, E. Kaneva, A.
  Rusakov, and A. Vasilkovskyi","Optical and structural properties of $\mathrm{Eu^{2+}}$ doped BaBrI and
  BaClI crystals","28 pages, 10 figures",,"10.1016/j.jlumin.2017.07.059",,"cond-mat.mtrl-sci","http://arxiv.org/licenses/nonexclusive-distrib/1.0/","  The work is necessitated by search for new materials to detect ionizing
radiation. The rare-earth ions doped with ternary alkali earth-halide systems
are promising scintillators showing high efficiency and energy resolution. Some
aspects of crystal growth and data on the structural and luminescence
properties of BaBrI and BaClI doped with low concentrations of
$\mathrm{Eu^{2+}}$ ions are reported. The crystals are grown by the vertical
Bridgman method in sealed quartz ampoule. New crystallography data for BaClI
single crystal obtained by single crystal X-ray diffraction method are
presented in this paper. Emission, excitation and optical absorption spectra as
well as luminescence decay kinetics are studied under excitation by X-ray,
vacuum ultraviolet and ultraviolet radiation. The energies of the first 4f-5d
transition in $\mathrm{Eu^{2+}}$ and band gap of the crystals have been
obtained. We have calculated the electronic band structure of the crystals
using density functional theory as implemented in the \latin{Ab Initio}.
Calculated band gap energies are in accord with the experimental estimates. The
energy of gaps between the occupied Eu$^{2+}$ 4f level and the valence band top
are predicted. In addition, positions of lanthanide energy levels in relation
to valence band have been constructed using the chemical shift model.
","[{""version"":""v1"",""created"":""Mon, 27 Mar 2017 04:38:34 GMT""}]","2017-08-01"
"1703.08927","Mao Zeng","Zvi Bern, Michael Enciso, Julio Parra-Martinez, Mao Zeng","Manifesting enhanced cancellations in supergravity: integrands versus
  integrals","28 pages, 5 figures","JHEP 05 (2017) 137","10.1007/JHEP05(2017)137",,"hep-th","http://arxiv.org/licenses/nonexclusive-distrib/1.0/","  Examples of ""enhanced ultraviolet cancellations"" with no known
standard-symmetry explanation have been found in a variety of supergravity
theories. By examining one- and two-loop examples in four- and five-dimensional
half-maximal supergravity, we argue that enhanced cancellations in general
cannot be exhibited prior to integration. In light of this, we explore
reorganizations of integrands into parts that are manifestly finite and parts
that have poor power counting but integrate to zero due to integral identities.
At two loops we find that in the large loop-momentum limit the required
integral identities follow from Lorentz and SL(2) relabeling symmetry. We carry
out a nontrivial check at four loops showing that the identities generated in
this way are a complete set. We propose that at $L$ loops the combination of
Lorentz and SL($L$) symmetry is sufficient for displaying enhanced
cancellations when they happen, whenever the theory is known to be ultraviolet
finite up to $(L-1)$ loops.
","[{""version"":""v1"",""created"":""Mon, 27 Mar 2017 04:40:23 GMT""}]","2017-08-25"
"1703.08928","Erel Segal-Halevi","Erel Segal-Halevi and Bal\'azs Sziklai","Resource-monotonicity and Population-monotonicity in Connected
  Cake-cutting","Submitted version. arXiv admin note: substantial text overlap with
  arXiv:1510.05229",,,,"cs.GT","http://arxiv.org/licenses/nonexclusive-distrib/1.0/","  In the classic cake-cutting problem (Steinhaus, 1948), a heterogeneous
resource has to be divided among n agents with different valuations in a
proportional way --- giving each agent a piece with a value of at least 1/n of
the total. In many applications, such as dividing a land-estate or a
time-interval, it is also important that the pieces are connected. We propose
two additional requirements: resource-monotonicity (RM) and
population-monotonicity (PM). When either the cake or the set of agents changes
and the cake is re-divided using the same rule, the utility of all remaining
agents must change in the same direction.
  Classic cake-cutting protocols are neither RM nor PM. Moreover, we prove that
no Pareto-optimal proportional division rule can be either RM or PM. Motivated
by this negative result, we search for division rules that are
weakly-Pareto-optimal --- no other division is strictly better for all agents.
  We present two such rules. The relative-equitable rule, which assigns the
maximum possible relative value equal for all agents, is proportional and PM.
The so-called rightmost-mark rule, which is an improved version of the Cut and
Choose protocol, is proportional and RM for two agents.
","[{""version"":""v1"",""created"":""Mon, 27 Mar 2017 04:46:58 GMT""},{""version"":""v2"",""created"":""Thu, 6 Apr 2017 11:33:18 GMT""},{""version"":""v3"",""created"":""Thu, 1 Jun 2017 01:48:06 GMT""}]","2017-06-05"
"1703.08929","Jos\'e Antonio Vallejo","Misael Avenda\~no-Camacho, Jos\'e A. Vallejo, Yury Vorobiev","A perturbation theory approach to the stability of the Pais-Uhlenbeck
  oscillator","2 Figures. Second version. Updated bibliography and added some
  comments about previous works in the field","Journal of Mathematical Physics 58, 093501 (2017)","10.1063/1.5000382",,"math-ph gr-qc hep-th math.MP","http://arxiv.org/licenses/nonexclusive-distrib/1.0/","  We present a detailed analysis of the orbital stability of the Pais-Uhlenbeck
oscillator, using Lie-Deprit series and Hamiltonian normal form theories. In
particular, we explicitly describe the reduced phase space for this Hamiltonian
system and give a proof for the existence of stable orbits for a certain class
of self-interaction, found numerically in previous works, by using singular
symplectic reduction.
","[{""version"":""v1"",""created"":""Mon, 27 Mar 2017 04:51:17 GMT""},{""version"":""v2"",""created"":""Mon, 15 May 2017 18:18:42 GMT""}]","2018-05-11"
"1703.08930","Sarath Sreedharan","Tathagata Chakraborti, Sarath Sreedharan, Anagha Kulkarni and Subbarao
  Kambhampati","Alternative Modes of Interaction in Proximal Human-in-the-Loop Operation
  of Robots",,,,,"cs.RO cs.HC","http://arxiv.org/licenses/nonexclusive-distrib/1.0/","  Ambiguity and noise in natural language instructions create a significant
barrier towards adopting autonomous systems into safety critical workflows
involving humans and machines. In this paper, we propose to build on recent
advances in electrophysiological monitoring methods and augmented reality
technologies, to develop alternative modes of communication between humans and
robots involved in large-scale proximal collaborative tasks. We will first
introduce augmented reality techniques for projecting a robot's intentions to
its human teammate, who can interact with these cues to engage in real-time
collaborative plan execution with the robot. We will then look at how
electroencephalographic (EEG) feedback can be used to monitor human response to
both discrete events, as well as longer term affective states while execution
of a plan. These signals can be used by a learning agent, a.k.a an affective
robot, to modify its policy. We will present an end-to-end system capable of
demonstrating these modalities of interaction. We hope that the proposed system
will inspire research in augmenting human-robot interactions with alternative
forms of communications in the interests of safety, productivity, and fluency
of teaming, particularly in engineered settings such as the factory floor or
the assembly line in the manufacturing industry where the use of such wearables
can be enforced.
","[{""version"":""v1"",""created"":""Mon, 27 Mar 2017 05:08:02 GMT""}]","2017-03-28"
"1703.08931","Jakub Radoszewski","Micha{\l} Adamczyk, Mai Alzamel, Panagiotis Charalampopoulos, Costas
  S. Iliopoulos, and Jakub Radoszewski","Palindromic Decompositions with Gaps and Errors","accepted to CSR 2017",,,,"cs.DS","http://arxiv.org/licenses/nonexclusive-distrib/1.0/","  Identifying palindromes in sequences has been an interesting line of research
in combinatorics on words and also in computational biology, after the
discovery of the relation of palindromes in the DNA sequence with the HIV
virus. Efficient algorithms for the factorization of sequences into palindromes
and maximal palindromes have been devised in recent years. We extend these
studies by allowing gaps in decompositions and errors in palindromes, and also
imposing a lower bound to the length of acceptable palindromes.
  We first present an algorithm for obtaining a palindromic decomposition of a
string of length n with the minimal total gap length in time O(n log n * g) and
space O(n g), where g is the number of allowed gaps in the decomposition. We
then consider a decomposition of the string in maximal \delta-palindromes (i.e.
palindromes with \delta errors under the edit or Hamming distance) and g
allowed gaps. We present an algorithm to obtain such a decomposition with the
minimal total gap length in time O(n (g + \delta)) and space O(n g).
","[{""version"":""v1"",""created"":""Mon, 27 Mar 2017 05:09:06 GMT""}]","2017-03-28"
"1703.08932","Luc Dessart","Luc Dessart, D.John Hillier, Sung-Chul Yoon, Roni Waldman, Eli Livne","Radiative-transfer models for explosions from rotating and non-rotating
  single WC stars. Implications for SN1998bw and LGRB/SNe","Submitted to A&A",,"10.1051/0004-6361/201730873",,"astro-ph.SR astro-ph.HE","http://arxiv.org/licenses/nonexclusive-distrib/1.0/","  Using 1-D non-Local-Thermodynamic-Equilibrium time-dependent
radiative-transfer simulations, we study the ejecta properties required to
match the early and late-time photometric and spectroscopic properties of
supernovae (SNe) associated with long-duration gamma-ray bursts (LGRBs). To
match the short rise time, narrow light curve peak, and extremely broad
spectral lines of SN1998bw requires a model with <3Msun ejecta but a high
explosion energy of a few 1e52erg and 0.5Msun of Ni56. However the relatively
high luminosity, the presence of narrow spectral lines of intermediate mass
elements, and the low ionization at the nebular stage are matched with a more
standard C-rich Wolf-Rayet (WR) star explosion, with an ejecta of >10Msun, an
explosion energy >1e51erg, and only 0.1Msun of Ni56. As the two models are
mutually exclusive, the breaking of spherical symmetry is essential to match
the early/late photometric/spectroscopic properties of SN1998bw. This
conclusion confirms the notion that the ejecta of SN1998bw is aspherical on
large scales. More generally, with asphericity, the energetics and Ni56 mass of
LGRB/SNe are reduced and their ejecta mass is increased, favoring a massive
fast-rotating Wolf-Rayet star progenitor. Contrary to persisting claims in
favor of the proto-magnetar model for LGRB/SNe, such progenitor/ejecta
properties are compatible with collapsar formation. Ejecta properties of
LGRB/SNe inferred from 1D radiative-transfer modeling are fundamentally flawed.
","[{""version"":""v1"",""created"":""Mon, 27 Mar 2017 05:10:19 GMT""}]","2017-07-19"
"1703.08933","Quang N. Tran","Quang N. Tran, Ba-Ngu Vo, Dinh Phung, Ba-Tuong Vo, and Thuong Nguyen","Multiple Instance Learning with the Optimal Sub-Pattern Assignment
  Metric",,,,,"cs.LG","http://arxiv.org/licenses/nonexclusive-distrib/1.0/","  Multiple instance data are sets or multi-sets of unordered elements. Using
metrics or distances for sets, we propose an approach to several multiple
instance learning tasks, such as clustering (unsupervised learning),
classification (supervised learning), and novelty detection (semi-supervised
learning). In particular, we introduce the Optimal Sub-Pattern Assignment
metric to multiple instance learning so as to provide versatile design choices.
Numerical experiments on both simulated and real data are presented to
illustrate the versatility of the proposed solution.
","[{""version"":""v1"",""created"":""Mon, 27 Mar 2017 05:23:32 GMT""}]","2017-03-28"
"1703.08934","Shizuo Kaji","Adrien Faur\'e, Shizuo Kaji","A circuit-preserving mapping from multilevel to Boolean dynamics",,,,,"q-bio.MN math.CO","http://arxiv.org/licenses/nonexclusive-distrib/1.0/","  Many discrete models of biological networks rely exclusively on Boolean
variables and many tools and theorems are available for analysis of strictly
Boolean models. However, multilevel variables are often required to account for
threshold effects, in which knowledge of the Boolean case does not generalise
straightforwardly. This motivated the development of conversion methods for
multilevel to Boolean models. In particular, Van Ham's method has been shown to
yield a one-to-one, neighbour and regulation preserving dynamics, making it the
de facto standard approach to the problem. However, Van Ham's method has
several drawbacks: most notably, it introduces vast regions of ""non-admissible""
states that have no counterpart in the multilevel, original model. This raises
special difficulties for the analysis of interaction between variables and
circuit functionality, which is believed to be central to the understanding of
dynamic properties of logical models. Here, we propose a new multilevel to
Boolean conversion method, with software implementation. Contrary to Van Ham's,
our method doesn't yield a one-to-one transposition of multilevel trajectories,
however, it maps each and every Boolean state to a specific multilevel state,
thus getting rid of the non-admissible regions and, at the expense of
(apparently) more complicated, ""parallel"" trajectories. One of the prominent
features of our method is that it preserves dynamics and interaction of
variables in a certain manner. As a demonstration of the usability of our
method, we apply it to construct a new Boolean counter-example to the
well-known conjecture that a local negative circuit is necessary to generate
sustained oscillations. This result illustrates the general relevance of our
method for the study of multilevel logical models.
","[{""version"":""v1"",""created"":""Mon, 27 Mar 2017 05:25:22 GMT""},{""version"":""v2"",""created"":""Mon, 8 May 2017 07:07:49 GMT""}]","2017-05-09"
"1703.08935","Xiaohu Zhang","Xiaohu Zhang, Kevin Tomsovic, Aleksandar Dimitrovski","Security Constrained Multi-Stage Transmission Expansion Planning
  Considering a Continuously Variable Series Reactor","Accepted by IEEE Transactions on Power Systems",,"10.1109/TPWRS.2017.2671786",,"math.OC","http://arxiv.org/licenses/nonexclusive-distrib/1.0/","  This paper introduces a Continuously Variable Series Reactor (CVSR) to the
transmission expansion planning (TEP) problem. The CVSR is a FACTS-like device
which has the capability of controlling the overall impedance of the
transmission line. However, the cost of the CVSR is about one tenth of a
similar rated FACTS device which potentially allows large numbers of devices to
be installed. The multi-stage TEP with the CVSR considering the $N-1$ security
constraints is formulated as a mixed integer linear programming model. The
nonlinear part of the power flow introduced by the variable reactance is
linearized by a reformulation technique. To reduce the computational burden for
a practical large scale system, a decomposition approach is proposed. The
detailed simulation results on the IEEE 24-bus and a more practical Polish
2383-bus system demonstrate the effectiveness of the approach. Moreover, the
appropriately allocated CVSRs add flexibility to the TEP problem and allow
reduced planning costs. Although the proposed decomposition approach cannot
guarantee global optimality, a high level picture of how the network can be
planned reliably and economically considering CVSR is achieved.
","[{""version"":""v1"",""created"":""Mon, 27 Mar 2017 05:31:50 GMT""}]","2017-03-28"
"1703.08936","Valentin Bura","Valentin Bura and Tim French and Mark Reynolds","Timed Automata with Polynomial Delay and their Expressiveness","possibly incorrect, or unsubstantiated results and claims",,,,"cs.LO","http://arxiv.org/licenses/nonexclusive-distrib/1.0/","  We consider previous models of Timed, Probabilistic and Stochastic Timed
Automata, we introduce our model of Timed Automata with Polynomial Delay and we
characterize the expressiveness of these models relative to each other.
","[{""version"":""v1"",""created"":""Mon, 27 Mar 2017 05:37:08 GMT""},{""version"":""v2"",""created"":""Sun, 17 Mar 2019 17:25:58 GMT""}]","2019-03-19"
"1703.08937","Tor Lattimore","Tor Lattimore","A Scale Free Algorithm for Stochastic Bandits with Bounded Kurtosis","14 pages",,,,"stat.ML","http://arxiv.org/licenses/nonexclusive-distrib/1.0/","  Existing strategies for finite-armed stochastic bandits mostly depend on a
parameter of scale that must be known in advance. Sometimes this is in the form
of a bound on the payoffs, or the knowledge of a variance or subgaussian
parameter. The notable exceptions are the analysis of Gaussian bandits with
unknown mean and variance by Cowan and Katehakis [2015] and of uniform
distributions with unknown support [Cowan and Katehakis, 2015]. The results
derived in these specialised cases are generalised here to the non-parametric
setup, where the learner knows only a bound on the kurtosis of the noise, which
is a scale free measure of the extremity of outliers.
","[{""version"":""v1"",""created"":""Mon, 27 Mar 2017 05:41:03 GMT""}]","2017-03-28"
"1703.08938","Yiqi Zhang","Yiqi Zhang, Yaroslav V. Kartashov, Feng Li, Zhaoyang Zhang, Yanpeng
  Zhang, Milivoj R. Beli\'c, and Min Xiao","Edge states in dynamical superlattices","9 pages, 6 figures","ACS Photonics, 4, 2250-2256(2017)","10.1021/acsphotonics.7b00448",,"physics.optics","http://arxiv.org/licenses/nonexclusive-distrib/1.0/","  We address edge states and rich localization regimes available in the
one-dimensional (1D) dynamically modulated superlattices, both theoretically
and numerically. In contrast to conventional lattices with straight waveguides,
the quasi-energy band of infinite modulated superlattice is periodic not only
in the transverse Bloch momentum, but it also changes periodically with
increase of the coupling strength between waveguides. Due to collapse of
quasi-energy bands dynamical superlattices admit known dynamical localization
effect. If, however, such a lattice is truncated, periodic longitudinal
modulation leads to appearance of specific edge states that exist within
certain periodically spaced intervals of coupling constants. We discuss unusual
transport properties of such truncated superlattices and illustrate different
excitation regimes and enhanced robustness of edge states in them, that is
associated with topology of the quasi-energy band.
","[{""version"":""v1"",""created"":""Mon, 27 Mar 2017 05:44:29 GMT""},{""version"":""v2"",""created"":""Wed, 12 Apr 2017 05:20:58 GMT""}]","2017-09-25"
"1703.08939","Shigehiro Sakata","Shigehiro Sakata and Yuta Wakasugi","Movement of time-delayed hot spots in Euclidean space for special
  initial states","29 pages",,,,"math.AP","http://arxiv.org/licenses/nonexclusive-distrib/1.0/","  We consider the Cauchy problem for the damped wave equation under the initial
state that the sum of an initial position and an initial velocity vanishes.
When the initial position is non-zero, non-negative and compactly supported, we
study the large time behavior of the spatial null, critical, maximum and
minimum sets of the solution. The spatial null set becomes a smooth
hyper-surface homeomorphic to a sphere after a large enough time. The spatial
critical set has at least three points after a large enough time. The set of
spatial maximum points escapes from the convex hull of the support of the
initial position. The set of spatial minimum points consists of one point after
a large time, and the unique spatial minimum point converges to the centroid of
the initial position at time infinity.
","[{""version"":""v1"",""created"":""Mon, 27 Mar 2017 05:47:49 GMT""}]","2017-03-28"
"1703.08940","Oren Weimann","Karl Bringmann, Pawe{\l} Gawrychowski, Shay Mozes, Oren Weimann","Tree Edit Distance Cannot be Computed in Strongly Subcubic Time (unless
  APSP can)",,,,,"cs.DS","http://arxiv.org/licenses/nonexclusive-distrib/1.0/","  The edit distance between two rooted ordered trees with $n$ nodes labeled
from an alphabet~$\Sigma$ is the minimum cost of transforming one tree into the
other by a sequence of elementary operations consisting of deleting and
relabeling existing nodes, as well as inserting new nodes. Tree edit distance
is a well known generalization of string edit distance. The fastest known
algorithm for tree edit distance runs in cubic $O(n^3)$ time and is based on a
similar dynamic programming solution as string edit distance. In this paper we
show that a truly subcubic $O(n^{3-\varepsilon})$ time algorithm for tree edit
distance is unlikely: For $|\Sigma| = \Omega(n)$, a truly subcubic algorithm
for tree edit distance implies a truly subcubic algorithm for the all pairs
shortest paths problem. For $|\Sigma| = O(1)$, a truly subcubic algorithm for
tree edit distance implies an $O(n^{k-\varepsilon})$ algorithm for finding a
maximum weight $k$-clique.
  Thus, while in terms of upper bounds string edit distance and tree edit
distance are highly related, in terms of lower bounds string edit distance
exhibits the hardness of the strong exponential time hypothesis [Backurs, Indyk
STOC'15] whereas tree edit distance exhibits the hardness of all pairs shortest
paths. Our result provides a matching conditional lower bound for one of the
last remaining classic dynamic programming problems.
","[{""version"":""v1"",""created"":""Mon, 27 Mar 2017 05:48:36 GMT""}]","2017-03-28"
"1703.08941","Tong-Xing Zheng","Tong-Xing Zheng, Hui-Ming Wang, Jinhong Yuan, Zhu Han, Moon Ho Lee","Physical Layer Security in Wireless Ad Hoc Networks Under A Hybrid
  Full-/Half-Duplex Receiver Deployment Strategy","Journal paper, double-column 12 pages, 9 figures, accepted by IEEE
  Transactions on Wireless Communications, 2017",,,,"cs.IT math.IT","http://arxiv.org/licenses/nonexclusive-distrib/1.0/","  This paper studies physical layer security in a wireless ad hoc network with
numerous legitimate transmitter-receiver pairs and eavesdroppers. A hybrid
full-/half-duplex receiver deployment strategy is proposed to secure legitimate
transmissions, by letting a fraction of legitimate receivers work in the
full-duplex (FD) mode sending jamming signals to confuse eavesdroppers upon
their information receptions, and letting the other receivers work in the
half-duplex mode just receiving their desired signals. The objective of this
paper is to choose properly the fraction of FD receivers for achieving the
optimal network security performance. Both accurate expressions and tractable
approximations for the connection outage probability and the secrecy outage
probability of an arbitrary legitimate link are derived, based on which the
area secure link number, network-wide secrecy throughput and network-wide
secrecy energy efficiency are optimized respectively. Various insights into the
optimal fraction are further developed and its closed-form expressions are also
derived under perfect self-interference cancellation or in a dense network. It
is concluded that the fraction of FD receivers triggers a non-trivial trade-off
between reliability and secrecy, and the proposed strategy can significantly
enhance the network security performance.
","[{""version"":""v1"",""created"":""Mon, 27 Mar 2017 05:52:28 GMT""}]","2017-03-28"
"1703.08942","Stefano Scopel","Paolo Gondolo (Utah U.), Stefano Scopel (Sogang U.)","Halo-independent determination of the unmodulated WIMP signal in DAMA:
  the isotropic case","34 pages, 11 figures. Discussion extended, one figure added. Factor
  of two corrected in all amplitudes. DAMA exposure changed from 13 to 14
  cycles. Updated to published version",,"10.1088/1475-7516/2017/09/032",,"hep-ph astro-ph.CO","http://arxiv.org/licenses/nonexclusive-distrib/1.0/","  We present a halo-independent determination of the unmodulated signal
corresponding to the DAMA modulation if interpreted as due to dark matter
weakly interacting massive particles (WIMPs). First we show how a modulated
signal gives information on the WIMP velocity distribution function in the
Galactic rest frame, from which the unmodulated signal descends. Then we
perform a mathematically-sound profile likelihood analysis in which we profile
the likelihood over a continuum of nuisance parameters (namely, the WIMP
velocity distribution). As a first application of the method, which is very
general and valid for any class of velocity distributions, we restrict the
analysis to velocity distributions that are isotropic in the Galactic frame. In
this way we obtain halo-independent maximum-likelihood estimates and confidence
intervals for the DAMA unmodulated signal. We find that the estimated
unmodulated signal is in line with expectations for a WIMP-induced modulation
and is compatible with the DAMA background+signal rate. Specifically, for the
isotropic case we find that the modulated amplitude ranges between a few
percent and about 25% of the unmodulated amplitude, depending on the WIMP mass.
","[{""version"":""v1"",""created"":""Mon, 27 Mar 2017 05:54:11 GMT""},{""version"":""v2"",""created"":""Tue, 26 Sep 2017 04:49:14 GMT""}]","2017-09-27"
