"1711.04024","Miklos Z. Racz","Yuval Peres, Miklos Z. Racz, Allan Sly, Izabella Stuhl","How fragile are information cascades?","19 pages; v2: minor changes",,,,"math.PR cs.GT cs.SI econ.EM","http://arxiv.org/licenses/nonexclusive-distrib/1.0/","  It is well known that sequential decision making may lead to information
cascades. That is, when agents make decisions based on their private
information, as well as observing the actions of those before them, then it
might be rational to ignore their private signal and imitate the action of
previous individuals. If the individuals are choosing between a right and a
wrong state, and the initial actions are wrong, then the whole cascade will be
wrong. This issue is due to the fact that cascades can be based on very little
information.
  We show that if agents occasionally disregard the actions of others and base
their action only on their private information, then wrong cascades can be
avoided. Moreover, we study the optimal asymptotic rate at which the error
probability at time $t$ can go to zero. The optimal policy is for the player at
time $t$ to follow their private information with probability $p_{t} = c/t$,
leading to a learning rate of $c'/t$, where the constants $c$ and $c'$ are
explicit.
","[{""version"":""v1"",""created"":""Fri, 10 Nov 2017 21:49:22 GMT""},{""version"":""v2"",""created"":""Wed, 21 Feb 2018 18:43:37 GMT""}]","2018-02-22"
"1711.04026","Valerio Faraoni","Dilek K. Ciftci and Valerio Faraoni","Perfect fluid solutions of Brans-Dicke and f(R)cosmology","Appendix added for completeness, explanation added in the text,
  bibliography expanded, figures upgraded for better resolution. Matches
  version accepted in Annals of Physics",,"10.1016/j.aop.2018.02.002",,"gr-qc astro-ph.CO","http://arxiv.org/licenses/nonexclusive-distrib/1.0/","  Brans-Dicke cosmology with an (inverse) power-law potential is revisited in
the light of modern quintessence and inflation models. A simple ansatz relating
scale factor and scalar field recovers most of the known solutions and
generates new ones. A phase space interpretation of the ansatz is provided and
these universes are mapped into solutions of f(R) cosmology.
","[{""version"":""v1"",""created"":""Fri, 10 Nov 2017 21:55:17 GMT""},{""version"":""v2"",""created"":""Tue, 27 Feb 2018 18:01:05 GMT""}]","2018-04-04"
"1711.04027","Nikolaos Efremidis","Nikolaos K. Efremidis","Spatiotemporal diffraction-free pulsed beams in free-space of the Airy
  and Bessel type",,,"10.1364/OL.42.005038",,"physics.optics","http://arxiv.org/licenses/nonexclusive-distrib/1.0/","  We investigate the dynamics of spatiotemporal optical waves with one
transverse dimension that are obtained as the intersections of the dispersion
cone with a plane. We show that, by appropriate spectral excitations, the three
different types of conic sections (elliptic, parabolic, and hyperbolic) can
lead to optical waves of the Bessel, Airy, and modified Bessel type,
respectively. We find closed form solutions that accurately describe the wave
dynamics and unveil their fundamental properties.
","[{""version"":""v1"",""created"":""Fri, 10 Nov 2017 21:56:47 GMT""}]","2018-02-14"
"1711.04028","George W. Patrick","George W. Patrick","The vector field of a rolling rigid body","Added semi-symplectic reduction. Will be published as e-print only. 8
  pages",,,,"math-ph math.DS math.MP physics.class-ph","http://creativecommons.org/licenses/by/4.0/","  Nonholonomic systems are variational models commonly used for mechanical
systems with ideal no-slip constraints. This note provides a
differential-geometric derivation of the nonholonomic equations of motion for
an arbitrary rigid body rolling on an arbitrary surface, via the
semi-symplectic formalism, and in terms of shape operators (a.k.a. Weingarten
maps). By a semi-symplectic reduction, the well-known differential equations in
the case where the surface is a horizontal plane are shown to be
semi-symplectic.
","[{""version"":""v1"",""created"":""Fri, 10 Nov 2017 21:59:26 GMT""},{""version"":""v2"",""created"":""Tue, 5 Dec 2017 17:43:56 GMT""},{""version"":""v3"",""created"":""Sat, 17 Feb 2018 17:50:06 GMT""}]","2018-02-20"
"1711.04029","Oran Sharon","Oran Sharon, Yaron Alpert","Optimizing TCP Goodput and Delay in next generation IEEE 802.11 (ax)
  devices","37 pages, 9 figures",,,,"cs.NI","http://creativecommons.org/publicdomain/zero/1.0/","  In this paper we suggest three scheduling strategies for the IEEE 802.11ax
transmis- sion of DL unidirectional TCP data from the Access Point to stations.
Two strategies are based on the Single User operation mode and one is based on
the Multi User operation mode, using Multi User Multiple-Input-Multiple-Output
(MU-MIMO) and OFDMA. We measure the Goodput of the system as a function of the
time intervals over which these Goodputs are received in all three strategies.
For up to 8 stations the MU strategy outperforms the SU. For 16 and 32 stations
it is not clear whether MU outperforms SU or vice versa. For 64 stations the SU
strategies outperform the MU significantly. We also checked the influence of
the Delayed Acks feature on the received Goodputs and found that this feature
has significance only when the TCP data segments are relatively short.
","[{""version"":""v1"",""created"":""Fri, 10 Nov 2017 22:00:11 GMT""}]","2017-11-15"
"1711.04032","Marko Samara","Philip Kilanowski, Peter March, Marko Samara","Convergence of the Freely Rotating Chain to the Kratky-Porod Model of
  Semi-flexible Polymers","21 pages; 2 figures",,,,"math.PR","http://arxiv.org/licenses/nonexclusive-distrib/1.0/","  The freely rotating chain is one of the classic discrete models of a polymer
in dilute solution. It consists of a broken line of N straight segments of
fixed length such that the angle between adjacent segments is constant and the
N-1 torsional angles are independent, identically distributed, uniform random
variables. We provide a rigorous proof of a folklore result in the chemical
physics literature stating that under an appropriate scaling, as N tends to
infinity, the freely rotating chain converges to a random curve defined by the
property that its derivative with respect to arclength is a brownian motion on
the unit sphere. This is the Kratky-Porod model of semi-flexible polymers. We
also investigate limits of the model when a stiffness parameter, called the
persistence length, tends to zero or infinity. The main idea is to introduce
orthogonal frames adapted to the polymer and to express conformational changes
in the polymer in terms of stochastic equations for the rotation of these
frames.
","[{""version"":""v1"",""created"":""Fri, 10 Nov 2017 22:12:33 GMT""}]","2017-11-15"
"1711.04033","Richard Kapolnai","Richard Kapolnai, Gabor Domokos, Imre Szeberenyi","On the smallest parallel quadrangulation with minimum degree 3",,"WAIT Workshop on the Advances of Information Technology (2015),
  41-43",,,"math.CO","http://arxiv.org/licenses/nonexclusive-distrib/1.0/","  The identity of the smallest quadrangulation with minimum degree 3 also
containing parallel edges is unknown. However, it has already been determined
that its order (the number of vertices) is between 11 and 14. This paper
narrows this domain by showing that the order is at least 12.
","[{""version"":""v1"",""created"":""Fri, 10 Nov 2017 22:14:08 GMT""}]","2017-11-21"
"1711.04034","Victor Dodonov","V. V. Dodonov","Coherent states in a magnetic field and their generalizations","21 pages, 162references. This is a chapter for the book of
  proceedings of the CIRM workshop (November 2016) ""Coherent States and their
  Applications: A Contemporary Panorama"", to be published by Springer",,,,"quant-ph","http://arxiv.org/licenses/nonexclusive-distrib/1.0/","  This is a brief review of various families of coherent and squeezed states
(and their generalizations) for a charged particle in a magnetic field, that
have been constructed for the past 50 years. Although the main attention is
paid to the Gaussian states, various families of non-Gaussian states are also
discussed, and the list of relevant references is provided.
","[{""version"":""v1"",""created"":""Fri, 10 Nov 2017 22:16:24 GMT""}]","2017-11-15"
"1711.04035","Simon Masnou","Elie Bretin, Alexandre Danescu, Jos\'e Penuelas, Simon Masnou","Multiphase mean curvature flows with high mobility contrasts: a
  phase-field approach, with applications to nanowires",,,"10.1016/j.jcp.2018.02.051",,"math.OC","http://arxiv.org/licenses/nonexclusive-distrib/1.0/","  The structure of many multiphase systems is governed by an energy that
penalizes the area of interfaces between phases weighted by surface tension
coefficients. However, interface evolution laws depend also on interface
mobility coefficients. Having in mind some applications where highly contrasted
or even degenerate mobilities are involved, for which classical phase field
models are inapplicable, we propose a new effective phase field approach to
approximate multiphase mean curvature flows with mobilities. The key aspect of
our model is to incorporate the mobilities not in the phase field energy (which
is conventionally the case) but in the metric which determines the gradient
flow. We show the consistency of such approach by a formal analysis of the
sharp interface limit. We also propose an efficient numerical scheme which
allows us to illustrate the advantages of the model on various examples, as the
wetting of droplets on solid surfaces or the simulation of nanowires growth
generated by the so-called vapor-liquid-solid method.
","[{""version"":""v1"",""created"":""Fri, 10 Nov 2017 22:27:33 GMT""}]","2018-05-09"
"1711.04036","Daniel Lopez-Martinez","Daniel Lopez-Martinez, Ognjen Rudovic, Rosalind Picard","Physiological and behavioral profiling for nociceptive pain estimation
  using personalized multitask learning","NIPS Machine Learning for Health 2017",,,,"cs.AI cs.HC","http://arxiv.org/licenses/nonexclusive-distrib/1.0/","  Pain is a subjective experience commonly measured through patient's self
report. While there exist numerous situations in which automatic pain
estimation methods may be preferred, inter-subject variability in physiological
and behavioral pain responses has hindered the development of such methods. In
this work, we address this problem by introducing a novel personalized
multitask machine learning method for pain estimation based on individual
physiological and behavioral pain response profiles, and show its advantages in
a dataset containing multimodal responses to nociceptive heat pain.
","[{""version"":""v1"",""created"":""Fri, 10 Nov 2017 22:36:27 GMT""}]","2017-11-15"
"1711.04037","Victor Dodonov","V. V. Dodonov","Variance uncertainty relations without covariances for three and four
  observables","6 pages, submitted to PRA","Phys. Rev. A 97, 022105 (2018)","10.1103/PhysRevA.97.022105",,"quant-ph","http://arxiv.org/licenses/nonexclusive-distrib/1.0/","  New sum and product uncertainty relations, containing variances of three or
four observables, but not containing explicitly their covariances, are derived.
One of consequences is the new inequality, giving a nonzero lower bound for the
product of two variances in the case of zero mean value of the commutator
between the related operators. Moreover, explicit examples show that in some
cases this new bound can be better than the known Robertson--Schr\""odinger one.
","[{""version"":""v1"",""created"":""Fri, 10 Nov 2017 22:36:29 GMT""}]","2018-02-14"
"1711.04038","Pietro Longhi","Dongmin Gang, Pietro Longhi and Masahito Yamazaki","S duality and Framed BPS States via BPS Graphs","34 pp, plus appendix","Adv. Theor. Math. Phys. 23, 1361-1410 (2019)","10.4310/ATMP.2019.v23.n5.a4","UUITP-42/17, IPMU-17-0152","hep-th","http://arxiv.org/licenses/nonexclusive-distrib/1.0/","  We study a realization of S dualities of four-dimensional $\mathcal{N}=2$
class $\mathcal{S}$ theories based on BPS graphs. S duality transformations of
the UV curve are explicitly expressed as a sequence of topological transitions
of the graph, and translated into cluster transformations of the algebra
associated to the dual BPS quiver. Our construction applies to generic class
$\mathcal{S}$ theories, including those with non-maximal flavor symmetry,
generalizing previous results based on higher triangulations. We study the the
action of S duality on UV line operators, and show that it matches precisely
with the mapping class group, by a careful analysis of framed wall-crossing. We
comment on the implications of our results for the computation of
three-manifold invariants via cluster partition functions.
","[{""version"":""v1"",""created"":""Fri, 10 Nov 2017 22:46:28 GMT""}]","2020-02-26"
"1711.04039","Tanvi Pradeep Gujarati","Tanvi P Gujarati, Yukai Wu and Luming Duan","Intrinsic Retrieval Efficiency for Quantum Memory: A Three Dimensional
  Theory of Light Interaction with an Atomic Ensemble","16 pages, 12 figures","Phys. Rev. A 97, 033826 (2018)","10.1103/PhysRevA.97.033826",,"quant-ph","http://arxiv.org/licenses/nonexclusive-distrib/1.0/","  Duan-Lukin-Cirac-Zoller (DLCZ) quantum repeater protocol, which was proposed
to realize long distance quantum communication, requires usage of quantum
memories. Atomic ensembles interacting with optical beams based on off-resonant
Raman scattering serve as convenient on-demand quantum memories. Here, a
complete free space, three-dimensional theory of the associated read and write
process for this quantum memory is worked out with the aim of understanding
intrinsic retrieval efficiency. We develop a formalism to calculate the
transverse mode structure for the signal and the idler photons and use the
formalism to study the intrinsic retrieval efficiency under various
configurations. The effects of atomic density fluctuations and atomic motion
are incorporated by numerically simulating this system for a range of realistic
experimental parameters. We obtain results that describe the variation in the
intrinsic retrieval efficiency as a function of the memory storage time for
skewed beam configuration at a finite temperature, which provides valuable
information for optimization of the retrieval efficiency in experiments.
","[{""version"":""v1"",""created"":""Fri, 10 Nov 2017 22:52:41 GMT""}]","2018-03-21"
"1711.04040","Shushman Choudhury","Shushman Choudhury, Oren Salzman, Sanjiban Choudhury, Christopher M.
  Dellin and Siddhartha S. Srinivasa","Anytime Motion Planning on Large Dense Roadmaps with Expensive Edge
  Evaluations",,,,,"cs.RO","http://arxiv.org/licenses/nonexclusive-distrib/1.0/","  We propose an algorithmic framework for efficient anytime motion planning on
large dense geometric roadmaps, in domains where collision checks and therefore
edge evaluations are computationally expensive. A large dense roadmap (graph)
can typically ensure the existence of high quality solutions for most
motion-planning problems, but the size of the roadmap, particularly in
high-dimensional spaces, makes existing search-based planning algorithms
computationally expensive. We deal with the challenges of expensive search and
collision checking in two ways. First, we frame the problem of anytime motion
planning on roadmaps as searching for the shortest path over a sequence of
subgraphs of the entire roadmap graph, generated by some densification
strategy. This lets us achieve bounded sub-optimality with bounded worst-case
planning effort. Second, for searching each subgraph, we develop an anytime
planning algorithm which uses a belief model to compute the collision
probability of unknown configurations and searches for paths that are
Pareto-optimal in path length and collision probability. This algorithm is
efficient with respect to collision checks as it searches for successively
shorter paths. We theoretically analyze both our ideas and evaluate them
individually on high-dimensional motion-planning problems. Finally, we apply
both of these ideas together in our algorithmic framework for anytime motion
planning, and show that it outperforms BIT* on high-dimensional hypercube
problems.
","[{""version"":""v1"",""created"":""Fri, 10 Nov 2017 23:05:59 GMT""}]","2017-11-15"
"1711.04041","Zbigniew Palmowski","Z. Palmowski and M. Vlasiou","Speed of convergence to the quasi-stationary distribution for L\'evy
  input fluid queues",,,,,"math.PR","http://arxiv.org/licenses/nonexclusive-distrib/1.0/","  In this note we prove that the speed of convergence of the workload of a
L\'evy-driven queue to the quasi-stationary distribution is of order $1/t$. We
identify also the Laplace transform of the measure giving this speed and
provide some examples.
","[{""version"":""v1"",""created"":""Fri, 10 Nov 2017 23:11:07 GMT""}]","2017-11-15"
"1711.04042","Juan Felipe Carmona","Juan Felipe Carmona, Kevin D\'avila, Alf Onshuus and Rafael Zamora","A fixed-point theorem for definably amenable groups",,,,,"math.LO","http://arxiv.org/licenses/nonexclusive-distrib/1.0/","  We prove an analogue of the fixed-point theorem for the case of definably
amenable groups.
","[{""version"":""v1"",""created"":""Fri, 10 Nov 2017 23:30:46 GMT""}]","2017-11-15"
"1711.04043","Victor Garcia Satorras","Victor Garcia, Joan Bruna","Few-Shot Learning with Graph Neural Networks",,,,,"stat.ML cs.LG","http://arxiv.org/licenses/nonexclusive-distrib/1.0/","  We propose to study the problem of few-shot learning with the prism of
inference on a partially observed graphical model, constructed from a
collection of input images whose label can be either observed or not. By
assimilating generic message-passing inference algorithms with their
neural-network counterparts, we define a graph neural network architecture that
generalizes several of the recently proposed few-shot learning models. Besides
providing improved numerical performance, our framework is easily extended to
variants of few-shot learning, such as semi-supervised or active learning,
demonstrating the ability of graph-based models to operate well on 'relational'
tasks.
","[{""version"":""v1"",""created"":""Fri, 10 Nov 2017 23:32:47 GMT""},{""version"":""v2"",""created"":""Mon, 29 Jan 2018 12:13:06 GMT""},{""version"":""v3"",""created"":""Tue, 20 Feb 2018 16:52:36 GMT""}]","2018-02-21"
"1711.04044","Sahil Garg","Sahil Garg and Aram Galstyan and Greg Ver Steeg and Irina Rish and
  Guillermo Cecchi and Shuyang Gao","Kernelized Hashcode Representations for Relation Extraction","To appear in the proceedings of conference, AAAI-19",,,,"cs.CL cs.IR cs.LG","http://arxiv.org/licenses/nonexclusive-distrib/1.0/","  Kernel methods have produced state-of-the-art results for a number of NLP
tasks such as relation extraction, but suffer from poor scalability due to the
high cost of computing kernel similarities between natural language structures.
A recently proposed technique, kernelized locality-sensitive hashing (KLSH),
can significantly reduce the computational cost, but is only applicable to
classifiers operating on kNN graphs. Here we propose to use random subspaces of
KLSH codes for efficiently constructing an explicit representation of NLP
structures suitable for general classification methods. Further, we propose an
approach for optimizing the KLSH model for classification problems by
maximizing an approximation of mutual information between the KLSH codes
(feature vectors) and the class labels. We evaluate the proposed approach on
biomedical relation extraction datasets, and observe significant and robust
improvements in accuracy w.r.t. state-of-the-art classifiers, along with
drastic (orders-of-magnitude) speedup compared to conventional kernel methods.
","[{""version"":""v1"",""created"":""Fri, 10 Nov 2017 23:42:42 GMT""},{""version"":""v2"",""created"":""Thu, 1 Feb 2018 23:10:27 GMT""},{""version"":""v3"",""created"":""Fri, 17 Aug 2018 16:28:56 GMT""},{""version"":""v4"",""created"":""Wed, 31 Oct 2018 22:48:42 GMT""},{""version"":""v5"",""created"":""Mon, 3 Dec 2018 17:17:25 GMT""},{""version"":""v6"",""created"":""Mon, 25 Feb 2019 04:10:53 GMT""},{""version"":""v7"",""created"":""Mon, 20 May 2019 22:01:52 GMT""}]","2019-05-22"
"1711.04045","Scott Barenfeld","Scott A. Barenfeld, John M. Carpenter, Anneila I. Sargent, Andrea
  Isella, Luca Ricci","Measurement of Circumstellar Disk Sizes in the Upper Scorpius OB
  Association with ALMA","15 pages of text, 7 figures, 3 tables. Accepted in ApJ",,"10.3847/1538-4357/aa989d",,"astro-ph.SR astro-ph.GA","http://arxiv.org/licenses/nonexclusive-distrib/1.0/","  We present detailed modeling of the spatial distributions of gas and dust in
57 circumstellar disks in the Upper Scorpius OB Association observed with ALMA
at sub-millimeter wavelengths. We fit power-law models to the dust surface
density and CO $J$ = 3-2 surface brightness to measure the radial extent of
dust and gas in these disks. We found that these disks are extremely compact:
the 25 highest signal-to-noise disks have a median dust outer radius of 21 au,
assuming an $R^{-1}$ dust surface density profile. Our lack of CO detections in
the majority of our sample is consistent with these small disk sizes assuming
the dust and CO share the same spatial distribution. Of seven disks in our
sample with well-constrained dust and CO radii, four appear to be more extended
in CO, although this may simply be due to higher optical depth of the CO.
Comparison of the Upper Sco results with recent analyses of disks in Taurus,
Ophiuchus, and Lupus suggests that the dust disks in Upper Sco may be $\sim3$
times smaller in size than their younger counterparts, although we caution that
a more uniform analysis of the data across all regions is needed. We discuss
the implications of these results for disk evolution.
","[{""version"":""v1"",""created"":""Fri, 10 Nov 2017 23:58:29 GMT""}]","2017-12-27"
"1711.04046","Kunfeng Lyu","Wen Han Chiu, Sze Ching Leung, Tao Liu, Kun-Feng Lyu, Lian-Tao Wang","Probing 6D Operators at Future $e^-e^+$ Colliders",,"JHEP 1805 (2018) 081","10.1007/JHEP05(2018)081",,"hep-ph","http://arxiv.org/licenses/nonexclusive-distrib/1.0/","  We explore the sensitivities at future $e^-e^+$ colliders to probe a set of
six-dimensional operators which can modify the SM predictions on Higgs physics
and electroweak precision measurements. We consider the case in which the
operators are turned on simultaneously. Such an analysis yields a
""conservative"" interpretation on the collider sensitivities, complementary to
the ""optimistic"" scenario where the operators are individually probed. After a
detail analysis at CEPC in both ""conservative"" and ""optimistic"" scenarios, we
also considered the sensitivities for FCC-ee and ILC. As an illustration of the
potential of constraining new physics models, we applied sensitivity analysis
to two benchmarks: holographic composite Higgs model and littlest Higgs model.
","[{""version"":""v1"",""created"":""Sat, 11 Nov 2017 00:15:40 GMT""},{""version"":""v2"",""created"":""Tue, 12 Jun 2018 08:05:15 GMT""}]","2018-06-13"
"1711.04047","Lei Wang","Melih Engin, Lei Wang, Luping Zhou, Xinwang Liu","DeepKSPD: Learning Kernel-matrix-based SPD Representation for
  Fine-grained Image Recognition",,,,,"cs.CV","http://arxiv.org/licenses/nonexclusive-distrib/1.0/","  Being symmetric positive-definite (SPD), covariance matrix has traditionally
been used to represent a set of local descriptors in visual recognition. Recent
study shows that kernel matrix can give considerably better representation by
modelling the nonlinearity in the local descriptor set. Nevertheless, neither
the descriptors nor the kernel matrix is deeply learned. Worse, they are
considered separately, hindering the pursuit of an optimal SPD representation.
This work proposes a deep network that jointly learns local descriptors,
kernel-matrix-based SPD representation, and the classifier via an end-to-end
training process. We derive the derivatives for the mapping from a local
descriptor set to the SPD representation to carry out backpropagation. Also, we
exploit the Daleckii-Krein formula in operator theory to give a concise and
unified result on differentiating SPD matrix functions, including the matrix
logarithm to handle the Riemannian geometry of kernel matrix. Experiments not
only show the superiority of kernel-matrix-based SPD representation with deep
local descriptors, but also verify the advantage of the proposed deep network
in pursuing better SPD representations for fine-grained image recognition
tasks.
","[{""version"":""v1"",""created"":""Sat, 11 Nov 2017 00:41:32 GMT""}]","2017-11-15"
"1711.04048","Mostafa El-Khamy","Haoyu Ren, Mostafa El-Khamy, and Jungwon Lee","CT-SRCNN: Cascade Trained and Trimmed Deep Convolutional Neural Networks
  for Image Super Resolution","Accepted to IEEE Winter Conf. on Applications of Computer Vision
  (WACV) 2018, Lake Tahoe, USA",,,,"cs.CV","http://arxiv.org/licenses/nonexclusive-distrib/1.0/","  We propose methodologies to train highly accurate and efficient deep
convolutional neural networks (CNNs) for image super resolution (SR). A cascade
training approach to deep learning is proposed to improve the accuracy of the
neural networks while gradually increasing the number of network layers. Next,
we explore how to improve the SR efficiency by making the network slimmer. Two
methodologies, the one-shot trimming and the cascade trimming, are proposed.
With the cascade trimming, the network's size is gradually reduced layer by
layer, without significant loss on its discriminative ability. Experiments on
benchmark image datasets show that our proposed SR network achieves the
state-of-the-art super resolution accuracy, while being more than 4 times
faster compared to existing deep super resolution networks.
","[{""version"":""v1"",""created"":""Sat, 11 Nov 2017 00:55:57 GMT""}]","2017-11-15"
