"1711.03900","Shuang Wu","St\'ephane Ouvry, Stephan Wagner and Shuang Wu","Hofstadter point spectrum trace and the Almost Mathieu operator","17 pages, 2 figures",,"10.1063/1.5020147",,"math-ph math.MP","http://arxiv.org/licenses/nonexclusive-distrib/1.0/","  We consider point spectrum traces in the Hofstadter model. We show how to
recover the full quantum Hofstadter trace by integrating these point spectrum
traces with the appropriate free density of states on the lattice. This
construction is then generalized to the almost Mathieu operator and its n-th
moments which can be expressed in terms of generalized Kreft coefficients.
","[{""version"":""v1"",""created"":""Fri, 10 Nov 2017 16:06:49 GMT""}]","2018-08-01"
"1711.03901","Donal O'Connell","Andr\'es Luna, Isobel Nicholson, Donal O'Connell and Chris D. White","Inelastic Black Hole Scattering from Charged Scalar Amplitudes","28 pages, 6 figures",,"10.1007/JHEP03(2018)044","Edinburgh 2017/25, QMUL-PH-17-25","hep-th gr-qc hep-ph","http://arxiv.org/licenses/nonexclusive-distrib/1.0/","  We explain how the lowest-order classical gravitational radiation produced
during the inelastic scattering of two Schwarzschild black holes in General
Relativity can be obtained from a tree scattering amplitude in gauge theory
coupled to scalar fields. The gauge calculation is related to gravity through
the double copy. We remove unwanted scalar forces which can occur in the double
copy by introducing a massless scalar in the gauge theory, which is treated as
a ghost in the link to gravity. We hope these methods are a step towards a
direct application of the double copy at higher orders in classical
perturbation theory, with the potential to greatly streamline gravity
calculations for phenomenological applications.
","[{""version"":""v1"",""created"":""Fri, 10 Nov 2017 16:09:58 GMT""}]","2018-04-04"
"1711.03902","Tarek Richard Besold","Tarek R. Besold, Artur d'Avila Garcez, Sebastian Bader, Howard Bowman,
  Pedro Domingos, Pascal Hitzler, Kai-Uwe Kuehnberger, Luis C. Lamb, Daniel
  Lowd, Priscila Machado Vieira Lima, Leo de Penning, Gadi Pinkas, Hoifung
  Poon, Gerson Zaverucha","Neural-Symbolic Learning and Reasoning: A Survey and Interpretation","58 pages, work in progress",,,,"cs.AI","http://arxiv.org/licenses/nonexclusive-distrib/1.0/","  The study and understanding of human behaviour is relevant to computer
science, artificial intelligence, neural computation, cognitive science,
philosophy, psychology, and several other areas. Presupposing cognition as
basis of behaviour, among the most prominent tools in the modelling of
behaviour are computational-logic systems, connectionist models of cognition,
and models of uncertainty. Recent studies in cognitive science, artificial
intelligence, and psychology have produced a number of cognitive models of
reasoning, learning, and language that are underpinned by computation. In
addition, efforts in computer science research have led to the development of
cognitive computational systems integrating machine learning and automated
reasoning. Such systems have shown promise in a range of applications,
including computational biology, fault diagnosis, training and assessment in
simulators, and software verification. This joint survey reviews the personal
ideas and views of several researchers on neural-symbolic learning and
reasoning. The article is organised in three parts: Firstly, we frame the scope
and goals of neural-symbolic computation and have a look at the theoretical
foundations. We then proceed to describe the realisations of neural-symbolic
computation, systems, and applications. Finally we present the challenges
facing the area and avenues for further research.
","[{""version"":""v1"",""created"":""Fri, 10 Nov 2017 16:14:22 GMT""}]","2017-11-13"
"1711.03903","J. M. Drummond","F.Aprile, J.M.Drummond, P.Heslop, H.Paul","Loop corrections for Kaluza-Klein AdS amplitudes","37 pages. One ancillary file containing data on the correlators",,"10.1007/JHEP05(2018)056",,"hep-th","http://arxiv.org/licenses/nonexclusive-distrib/1.0/","  Recently we conjectured the four-point amplitude of graviton multiplets in
${\rm AdS}_5 \times {\rm S}^5$ at one loop by exploiting the operator product
expansion of $\mathcal{N}=4$ super Yang-Mills theory. Here we give the first
extension of those results to include Kaluza-Klein modes, obtaining the
amplitude for two graviton multiplets and two states of the first KK mode. Our
method again relies on resolving the large N degeneracy among a family of long
double-trace operators, for which we obtain explicit formulas for the leading
anomalous dimensions. Having constructed the one-loop amplitude we are able to
obtain a formula for the one-loop corrections to the anomalous dimensions of
all twist five double-trace operators.
","[{""version"":""v1"",""created"":""Fri, 10 Nov 2017 16:17:18 GMT""}]","2018-06-13"
"1711.03904","Victor See","V. See, M. Jardine, A. A. Vidotto, J.-F. Donati, S. Boro Saikia, R.
  Fares, C. P. Folsom, S. V. Jeffers, S. C. Marsden, J. Morin, P. Petit and the
  BCool Collaboration","The open flux evolution of a solar-mass star on the main sequence","12 pages, 7 figures, accepted to MNRAS",,"10.1093/mnras/stx2599",,"astro-ph.SR","http://arxiv.org/licenses/nonexclusive-distrib/1.0/","  Magnetic activity is known to be correlated to the rotation period for
moderately active main sequence solar-like stars. In turn, the stellar rotation
period evolves as a result of magnetised stellar winds that carry away angular
momentum. Understanding the interplay between magnetic activity and stellar
rotation is therefore a central task for stellar astrophysics. Angular momentum
evolution models typically employ spin-down torques that are formulated in
terms of the surface magnetic field strength. However, these formulations fail
to account for the magnetic field geometry, unlike those that are expressed in
terms of the open flux, i.e. the magnetic flux along which stellar winds flow.
  In this work, we model the angular momentum evolution of main sequence
solar-mass stars using a torque law formulated in terms of the open flux. This
is done using a potential field source surface model in conjunction with the
Zeeman-Doppler magnetograms of a sample of roughly solar-mass stars. We explore
how the open flux of these stars varies with stellar rotation and choice of
source surface radii. We also explore the effect of field geometry by using two
methods of determining the open flux. The first method only accounts for the
dipole component while the second accounts for the full set of spherical
harmonics available in the Zeeman-Doppler magnetogram. We find only a small
difference between the two methods, demonstrating that the open flux, and
indeed the spin-down, of main sequence solar-mass stars is likely dominated by
the dipolar component of the magnetic field.
","[{""version"":""v1"",""created"":""Fri, 10 Nov 2017 16:20:22 GMT""}]","2017-12-13"
"1711.03905","Jayaraman J. Thiagarajan","Huan Song, Deepta Rajan, Jayaraman J. Thiagarajan and Andreas Spanias","Attend and Diagnose: Clinical Time Series Analysis using Attention
  Models","AAAI 2018",,,,"stat.ML cs.LG","http://arxiv.org/licenses/nonexclusive-distrib/1.0/","  With widespread adoption of electronic health records, there is an increased
emphasis for predictive models that can effectively deal with clinical
time-series data. Powered by Recurrent Neural Network (RNN) architectures with
Long Short-Term Memory (LSTM) units, deep neural networks have achieved
state-of-the-art results in several clinical prediction tasks. Despite the
success of RNNs, its sequential nature prohibits parallelized computing, thus
making it inefficient particularly when processing long sequences. Recently,
architectures which are based solely on attention mechanisms have shown
remarkable success in transduction tasks in NLP, while being computationally
superior. In this paper, for the first time, we utilize attention models for
clinical time-series modeling, thereby dispensing recurrence entirely. We
develop the \textit{SAnD} (Simply Attend and Diagnose) architecture, which
employs a masked, self-attention mechanism, and uses positional encoding and
dense interpolation strategies for incorporating temporal order. Furthermore,
we develop a multi-task variant of \textit{SAnD} to jointly infer models with
multiple diagnosis tasks. Using the recent MIMIC-III benchmark datasets, we
demonstrate that the proposed approach achieves state-of-the-art performance in
all tasks, outperforming LSTM models and classical baselines with
hand-engineered features.
","[{""version"":""v1"",""created"":""Fri, 10 Nov 2017 16:26:14 GMT""},{""version"":""v2"",""created"":""Sun, 19 Nov 2017 21:19:12 GMT""}]","2018-07-17"
"1711.03906","Amr Alanwar","Amr Alanwar, Henrique Ferraz, Kevin Hsieh, Rohit Thazhath, Paul
  Martin, Joao Hespanha, Mani Srivastava","D-SLATS: Distributed Simultaneous Localization and Time Synchronization",,,"10.1145/3084041.3084049",,"cs.LG cs.DC cs.NI cs.RO cs.SY","http://arxiv.org/licenses/nonexclusive-distrib/1.0/","  Through the last decade, we have witnessed a surge of Internet of Things
(IoT) devices, and with that a greater need to choreograph their actions across
both time and space. Although these two problems, namely time synchronization
and localization, share many aspects in common, they are traditionally treated
separately or combined on centralized approaches that results in an ineffcient
use of resources, or in solutions that are not scalable in terms of the number
of IoT devices. Therefore, we propose D-SLATS, a framework comprised of three
different and independent algorithms to jointly solve time synchronization and
localization problems in a distributed fashion. The First two algorithms are
based mainly on the distributed Extended Kalman Filter (EKF) whereas the third
one uses optimization techniques. No fusion center is required, and the devices
only communicate with their neighbors. The proposed methods are evaluated on
custom Ultra-Wideband communication Testbed and a quadrotor, representing a
network of both static and mobile nodes. Our algorithms achieve up to three
microseconds time synchronization accuracy and 30 cm localization error.
","[{""version"":""v1"",""created"":""Fri, 10 Nov 2017 16:26:29 GMT""}]","2017-11-13"
"1711.03907","Mathieu Jeannin","Mathieu Jeannin, Thibault Cr\'emel, Teppo H\""ayrynen, Niels Gregersen,
  Edith Bellet-Amalric, Gilles Nogues and Kuntheak Kheng","Enhanced Photon Extraction from a Nanowire Quantum Dot Using a Bottom-Up
  Photonic Shell",,"Physical Review Applied 8, 054022 (2017)","10.1103/PhysRevApplied.8.054022",,"physics.optics cond-mat.mes-hall","http://arxiv.org/licenses/nonexclusive-distrib/1.0/","  Semiconductor nanowires offer the possibility to grow high-quality
quantum-dot heterostructures, and, in particular, CdSe quantum dots inserted in
ZnSe nanowires have demonstrated the ability to emit single photons up to room
temperature. In this paper, we demonstrate a bottom-up approach to fabricate a
photonic fiberlike structure around such nanowire quantum dots by depositing an
oxide shell using atomic-layer deposition. Simulations suggest that the
intensity collected in our NA = 0.6 microscope objective can be increased by a
factor 7 with respect to the bare nanowire case. Combining
microphotoluminescence, decay time measurements, and numerical simulations, we
obtain a fourfold increase in the collected photoluminescence from the quantum
dot. We show that this improvement is due to an increase of the quantum-dot
emission rate and a redirection of the emitted light. Our ex situ fabrication
technique allows a precise and reproducible fabrication on a large scale. Its
improved extraction efficiency is compared to state-of-the-art top-down
devices.
","[{""version"":""v1"",""created"":""Fri, 10 Nov 2017 16:28:02 GMT""}]","2017-11-13"
"1711.03908","Vishesh Karwa","Vishesh Karwa and Salil Vadhan","Finite Sample Differentially Private Confidence Intervals","Presented at TPDP 2017 and a shorter version to appear at ITCS 2018",,,,"cs.CR math.ST stat.TH","http://arxiv.org/licenses/nonexclusive-distrib/1.0/","  We study the problem of estimating finite sample confidence intervals of the
mean of a normal population under the constraint of differential privacy. We
consider both the known and unknown variance cases and construct differentially
private algorithms to estimate confidence intervals. Crucially, our algorithms
guarantee a finite sample coverage, as opposed to an asymptotic coverage.
Unlike most previous differentially private algorithms, we do not require the
domain of the samples to be bounded. We also prove lower bounds on the expected
size of any differentially private confidence set showing that our the
parameters are optimal up to polylogarithmic factors.
","[{""version"":""v1"",""created"":""Fri, 10 Nov 2017 16:30:36 GMT""}]","2017-11-13"
"1711.03909","Ana B. De Felipe","Ana B. de Felipe","Topology of Spaces of Valuations and Geometry of Singularities","31 pages",,"10.1090/tran/7441",,"math.AG","http://arxiv.org/licenses/nonexclusive-distrib/1.0/","  Given an algebraic variety X defined over an algebraically closed field, we
study the space RZ(X,x) consisting of all the valuations of the function field
of X which are centered in a closed point x of X. We concentrate on its
homeomorphism type. We prove that, when x is a regular point, this
homeomorphism type only depends on the dimension of X. If x is a singular point
of a normal surface, we show that it only depends on the dual graph of a good
resolution of (X,x) up to some precise equivalence. This is done by studying
the relation between RZ(X,x) and the normalized non-Archimedean link of x in X
coming from the point of view of Berkovich geometry. We prove that their
behavior is the same.
","[{""version"":""v1"",""created"":""Fri, 10 Nov 2017 16:31:09 GMT""}]","2017-11-13"
"1711.03910","Zhao Chen Mr.","Zhao Chen, Liuguo Yin and Jianhua Lu","LDPC-Based Code Hopping for Gaussian Wiretap Channel With Limited
  Feedback",,,,,"cs.IT math.IT","http://arxiv.org/licenses/nonexclusive-distrib/1.0/","  This paper presents a scheme named code hopping (CodeHop) for gaussian
wiretap channels based on nonsystematic low-density parity-check (LDPC) codes.
Different from traditional communications, in the CodeHop scheme, the
legitimate receiver (Bob) rapidly switches the parity-check matrix upon each
correctly received source message block. Given an authenticated public feedback
channel, the transmitter's (Alice) parity-check matrix can also be synchronized
with the receiver's. As a result, once an eavesdropper (Eve) erroneously
decodes a message block, she may not be able to follow the update of subsequent
parity-check matrices. Thus, the average BER of Eve will be very close to $0.5$
if the transmitted number of message blocks is large enough. Focused on the
measure of security gap defined as the difference of channel quality between
Bob and Eve, numerical results show that the CodeHop scheme outperforms other
solutions by sufficiently reducing the security gap without sacrificing the
error-correcting performance of Bob.
","[{""version"":""v1"",""created"":""Fri, 10 Nov 2017 16:33:18 GMT""}]","2017-11-13"
"1711.03911","Tamas Kovacs G.","Tamas G. Kovacs (Debrecen, Inst. Nucl. Res.)","Temperature-dependence of the QCD topological susceptibility","9 pages, 6 figures, to be published in Proceedings of the 35th
  International Symposium on Lattice Field Theory (Lattice2017)}: Granada,
  Spain}, to appear in EPJ Web Conf",,"10.1051/epjconf/201817501013",,"hep-lat hep-ph","http://arxiv.org/licenses/nonexclusive-distrib/1.0/","  We recently obtained an estimate of the axion mass based on the hypothesis
that axions make up most of the dark matter in the universe. A key ingredient
for this calculation was the temperature-dependence of the topological
susceptibility of full QCD. Here we summarize the calculation of the
susceptibility in a range of temperatures from well below the finite
temperature cross-over to around 2 GeV. The two main difficulties of the
calculation are the unexpectedly slow convergence of the susceptibility to its
continuum limit and the poor sampling of nonzero topological sectors at high
temperature. We discuss how these problems can be solved by two new techniques,
the first one with reweighting using the quark zero modes and the second one
with the integration method.
","[{""version"":""v1"",""created"":""Fri, 10 Nov 2017 16:34:00 GMT""}]","2018-04-18"
"1711.03912","Jawad Y. Abuhlail","Jawad Abuhlail, Hamza Hroub","Zariski-like Topologies for Lattices with Applications to Modules over
  Commutative Rings","submitted",,,,"math.GN math.AC math.RA","http://arxiv.org/licenses/nonexclusive-distrib/1.0/","  We study Zariski-like topologies on a proper class $X\varsubsetneqq L$ of a
complete lattice $\mathcal{L}=(L,\wedge ,\vee ,0,1)$. We consider $X$ with the
so called classical Zariski topology $(X,\tau ^{cl})$ and study its topological
properties (e.g. the separation axioms, the connectedness, the compactness) and
provide sufficient conditions for it to be $\textit{spectral}$. We say that
$\mathcal{L}$ is $X$\emph{-top} iff% \begin{equation*} \tau :=\{X\backslash
V(a)\mid a\in L\},\text{ where }V(a)=\{x\in L\mid a\leq x\} \end{equation*}% is
a topology. We study the interplay between the \textit{algebraic properties} of
an $X$-top complete lattice $\mathcal{L}$ and the $\textit{% topological
properties}$ of $(X,\tau ^{cl})=(X,\tau ).$ Our results are applied to several
spectra which are proper classes of $\mathcal{L}% :=LAT(_{R}M)$ where $M$ is a
left module over an arbitrary associative ring $% R$ (e.g. the spectra of
prime, coprime, fully prime submodules) of $M$ as well as to several spectra of
the dual complete lattice $\mathcal{L}^{0}$ (e.g. the spectra of first, second
and fully coprime submodules of $M$).
","[{""version"":""v1"",""created"":""Fri, 10 Nov 2017 16:38:25 GMT""}]","2017-11-13"
"1711.03915","Kyle Ballantine","Ryan I. Moodie, Kyle E. Ballantine, Jonathan Keeling","Generalized classes of continuous symmetries in two-mode Dicke models","10 pages, 7 figures","Phys. Rev. A 97, 033802 (2018)","10.1103/PhysRevA.97.033802",,"cond-mat.quant-gas cond-mat.other quant-ph","http://arxiv.org/licenses/nonexclusive-distrib/1.0/","  As recently realized experimentally [L\'eonard et al., Nature 543, 87
(2017)], one can engineer models with continuous symmetries by coupling two
cavity modes to trapped atoms, via a Raman pumping geometry. Considering
specifically cases where internal states of the atoms couple to the cavity, we
show an extended range of parameters for which continuous symmetry breaking can
occur, and we classify the distinct steady states and time-dependent states
that arise for different points in this extended parameter regime.
","[{""version"":""v1"",""created"":""Fri, 10 Nov 2017 16:44:56 GMT""},{""version"":""v2"",""created"":""Mon, 26 Feb 2018 17:04:02 GMT""}]","2018-03-05"
"1711.03916","Stephen Kent","Stephen M. Kent","Non-axisymmetric aberration patterns from wide-field telescopes using
  spin-weighted Zernike Polynomials","19 pages, 5 figures","PASP, 130, 986 (2018)","10.1088/1538-3873/aaa6b8","FERMILAB-PUB-17-508-AE-CD","astro-ph.IM","http://arxiv.org/licenses/nonexclusive-distrib/1.0/","  If the optical system of a telescope is perturbed from rotational symmetry,
the Zernike wavefront aberration coefficients describing that system can be
expressed as a function of position in the focal plane using spin-weighted
Zernike polynomials. Methodologies are presented to derive these polynomials to
arbitrary order. This methodology is applied to aberration patterns produced by
a misaligned Ritchey Chretian telescope and to distortion patterns at the focal
plane of the DESI optical corrector, where it is shown to provide a more
efficient description of distortion than conventional expansions.
","[{""version"":""v1"",""created"":""Fri, 10 Nov 2017 16:45:11 GMT""},{""version"":""v2"",""created"":""Thu, 15 Feb 2018 21:41:57 GMT""}]","2018-02-19"
"1711.03917","Alexander Molev","Alexander Molev and Oksana Yakimova","Quantisation and nilpotent limits of Mishchenko-Fomenko subalgebras","32 pages, final version","Represent. Theory 23 (2019), 350-378","10.1090/ert/531",,"math.RT","http://arxiv.org/licenses/nonexclusive-distrib/1.0/","  For any simple Lie algebra $\mathfrak{g}$ and an element
$\mu\in\mathfrak{g}^*$, the corresponding commutative subalgebra
$\mathcal{A}_{\mu}$ of $\mathcal{U}(\mathfrak{g})$ is defined as a homomorphic
image of the Feigin-Frenkel centre associated with $\mathfrak{g}$. It is known
that when $\mu$ is regular this subalgebra solves Vinberg's quantisation
problem, as the graded image of $\mathcal{A}_{\mu}$ coincides with the
Mishchenko-Fomenko subalgebra $\overline{\mathcal{A}}_{\mu}$ of
$\mathcal{S}(\mathfrak{g})$. By a conjecture of Feigin, Frenkel and Toledano
Laredo, this property extends to an arbitrary element $\mu$. We give sufficient
conditions which imply the property for certain choices of $\mu$. In
particular, this proves the conjecture in type C and gives a new proof in type
A. We show that the algebra $\mathcal{A}_{\mu}$ is free in both cases and
produce its generators in an explicit form. Moreover, we prove that in all
classical types generators of $\mathcal{A}_{\mu}$ can be obtained via the
canonical symmetrisation map from certain generators of
$\overline{\mathcal{A}}_{\mu}$. The symmetrisation map is also used to produce
free generators of nilpotent limits of the algebras $\mathcal{A}_{\mu}$ and
give a positive solution of Vinberg's problem for these limit subalgebras.
","[{""version"":""v1"",""created"":""Fri, 10 Nov 2017 16:45:17 GMT""},{""version"":""v2"",""created"":""Mon, 5 Aug 2019 07:13:59 GMT""}]","2019-10-03"
"1711.03918","Zachary del Rosario","Zachary del Rosario and Minyong Lee and Gianluca Iaccarino","Lurking Variable Detection via Dimensional Analysis","28 pages; full simulation codes provided in ancillary document for
  reproducibility",,,,"stat.ME","http://arxiv.org/licenses/nonexclusive-distrib/1.0/","  Lurking variables represent hidden information, and preclude a full
understanding of phenomena of interest. Detection is usually based on
serendipity -- visual detection of unexplained, systematic variation. However,
these approaches are doomed to fail if the lurking variables do not vary. In
this article, we address these challenges by introducing formal hypothesis
tests for the presence of lurking variables, based on Dimensional Analysis.
These procedures utilize a modified form of the Buckingham Pi theorem to
provide structure for a suitable null hypothesis. We present analytic tools for
reasoning about lurking variables in physical phenomena, construct procedures
to handle cases of increasing complexity, and present examples of their
application to engineering problems. The results of this work enable
algorithm-driven lurking variable detection, complementing a traditionally
inspection-based approach.
","[{""version"":""v1"",""created"":""Fri, 10 Nov 2017 16:56:52 GMT""},{""version"":""v2"",""created"":""Sat, 13 Jan 2018 15:37:42 GMT""}]","2018-01-16"
"1711.03919","Susanna Bisogni","Susanna Bisogni, Alessandro Marconi, Guido Risaliti and Elisabeta
  Lusso","EW[OIII] as an orientation indicator for quasars: implications for the
  torus","9 pages, 3 figures, accepted for publication in Frontiers in
  Astronomy and Space Sciences, Research Topic ""Quasars at all cosmic epochs"";
  proceedings of the conference ""Quasars at all cosmic epochs"", held in Padova,
  April 2-7, 2017",,,,"astro-ph.GA","http://arxiv.org/licenses/nonexclusive-distrib/1.0/","  We present an analysis of the average spectral properties of 12,000 SDSS
quasars as a function of accretion disc inclination, as measured from the
equivalent width of the [O III] 5007{\AA} line. The use of this indicator on a
large sample of quasars from the SDSS DR7 has proven the presence of
orientation effects on the features of UV/optical spectra, confirming the
presence of outflows in the NLR gas and that the geometry of the BLR is
disc-like. Relying on the goodness of this indicator, we are now using it to
investigate other bands/components of AGN. Specifically, the study of the
UV/optical/IR SED of the same sample provides information on the obscuring
""torus"". The SED shows a decrease of the IR fraction moving from face-on to
edge-on sources, in agreement with models where the torus is co-axial with the
accretion disc. Moreover, the fact we are able to observe the broad emission
lines also in sources in an edge-on position, suggests that the torus is rather
clumpy than smooth as in the Unified Model. The behaviour of the SED as a
function of EW[OIII] is in agreement with the predictions of the clumpy torus
models as well.
","[{""version"":""v1"",""created"":""Fri, 10 Nov 2017 17:00:59 GMT""},{""version"":""v2"",""created"":""Wed, 15 Nov 2017 16:56:58 GMT""}]","2017-11-16"
