"1711.03973","Jonathan Heckman","Falk Hassler and Jonathan J. Heckman","Punctures and Dynamical Systems","v2: 52 pages, 7 figures, clarifications and references added",,"10.1007/s11005-018-1118-4",,"hep-th math.DS","http://arxiv.org/licenses/nonexclusive-distrib/1.0/","  With the aim of better understanding the class of 4D theories generated by
compactifications of 6D superconformal field theories (SCFTs), we study the
structure of N = 1 supersymmetric punctures for class S_Gamma theories, namely
the 6D SCFTs obtained from M5-branes probing an ADE singularity. For M5-branes
probing a C^2 / Z_k singularity, the punctures are governed by a dynamical
system in which evolution in time corresponds to motion to a neighboring node
in an affine A-type quiver. Classification of punctures reduces to determining
consistent initial conditions which produce periodic orbits. The study of this
system is particularly tractable in the case of a single M5-brane. Even in this
""simple"" case, the solutions exhibit a remarkable level of complexity: Only
specific rational values for the initial momenta lead to periodic orbits, and
small perturbations in these values lead to vastly different late time
behavior. Another difference from half BPS punctures of class S theories
includes the appearance of a continuous complex ""zero mode"" modulus in some
puncture solutions. The construction of punctures with higher order poles
involves a related set of recursion relations. The resulting structures also
generalize to systems with multiple M5-branes as well as probes of D- and
E-type orbifold singularities.
","[{""version"":""v1"",""created"":""Fri, 10 Nov 2017 19:00:04 GMT""},{""version"":""v2"",""created"":""Wed, 20 Jun 2018 19:04:32 GMT""}]","2018-08-29"
"1711.03974","Erin Cox","Erin G. Cox, Robert J. Harris, Leslie W. Looney, Hsin-Fang Chiang,
  Claire Chandler, Kaitlin Kratter, Zhi-Yun Li, Laura Perez, John J. Tobin","Protoplanetary Disks in $\rho$ Ophiuchus as Seen From ALMA","26 pages, 16 figures. Accepted for publication in ApJ",,"10.3847/1538-4357/aa97e2",,"astro-ph.SR astro-ph.GA","http://arxiv.org/licenses/nonexclusive-distrib/1.0/","  We present a high angular resolution ($\sim 0.2^{\prime\prime}$), high
sensitivity ($\sigma \sim 0.2$ mJy) survey of the 870 $\mu$m continuum emission
from the circumstellar material around 49 pre-main sequence stars in the $\rho$
Ophiuchus molecular cloud. Because most millimeter instruments have resided in
the northern hemisphere, this represents the largest high-resolution,
millimeter-wave survey of the circumstellar disk content of this cloud. Our
survey of 49 systems comprises 63 stars; we detect disks associated with 29
single sources, 11 binaries, 3 triple systems and 4 transition disks. We
present flux and radius distributions for these systems; in particular, this is
the first presentation of a reasonably complete probability distribution of
disk radii at millimeter-wavelengths. We also compare the flux distribution of
these protoplanetary disks with that of the disk population of the
Taurus-Auriga molecular cloud. We find that disks in binaries are both
significantly smaller and have much less flux than their counterparts around
isolated stars. We compute truncation calculations on our binary sources and
find that these disks are too small to have been affected by tidal truncation
and posit some explanations for this. Lastly, our survey found 3 candidate
gapped disks, one of which is a newly identified transition disk with no
signature of a dip in infrared excess in extant observations.
","[{""version"":""v1"",""created"":""Fri, 10 Nov 2017 19:00:05 GMT""}]","2017-12-27"
"1711.03975","Jonathan Squire","Jonathan Squire and Philip F. Hopkins","Resonant Drag Instabilities in protoplanetary disks: the streaming
  instability and new, faster-growing instabilities","Accepted in MNRAS, 29 pages. We recommend reading section 9 for a
  general overview of astrophysical implications",,"10.1093/mnras/sty854",,"astro-ph.EP","http://arxiv.org/licenses/nonexclusive-distrib/1.0/","  We identify and study a number of new, rapidly growing instabilities of dust
grains in protoplanetary disks, which may be important for planetesimal
formation. The study is based on the recognition that dust-gas mixtures are
generically unstable to a Resonant Drag Instability (RDI), whenever the gas,
absent dust, supports undamped linear modes. We show that the ""streaming
instability"" is an RDI associated with epicyclic oscillations; this provides
simple interpretations for its mechanisms and accurate analytic expressions for
its growth rates and fastest-growing wavelengths. We extend this analysis to
more general dust streaming motions and other waves, including buoyancy and
magnetohydrodynamic oscillations, finding various new instabilities. Most
importantly, we identify the disk ""settling instability,"" which occurs as dust
settles vertically into the midplane of a rotating disk. For small grains, this
instability grows many orders of magnitude faster than the standard streaming
instability, with a growth rate that is independent of grain size. Growth
timescales for realistic dust-to-gas ratios are comparable to the disk orbital
period, and the characteristic wavelengths are more than an order of magnitude
larger than the streaming instability (allowing the instability to concentrate
larger masses). This suggests that in the process of settling, dust will band
into rings then filaments or clumps, potentially seeding dust traps,
high-metallicity regions that in turn seed the streaming instability, or even
overdensities that coagulate or directly collapse to planetesimals.
","[{""version"":""v1"",""created"":""Fri, 10 Nov 2017 19:00:07 GMT""},{""version"":""v2"",""created"":""Sat, 14 Apr 2018 22:39:33 GMT""}]","2018-04-18"
"1711.03976","Eric Murphy","E.J.Murphy, D. Dong, E. Momjian, S. Linden, R.C.Kennicutt, Jr., D.S.
  Meier, E. Schinnerer, and J.L. Turner","The Star Formation in Radio Survey: Jansky Very Large Array 33 GHz
  Observations of Nearby Galaxy Nuclei and Extranuclear Star-Forming Regions","29 pages, 5 figures, 6 tables, accepted for publication in the
  Astrophysical Journal; v2 - corrected typos for minor axis beam sizes in
  tables 3 & 4. arXiv admin note: text overlap with arXiv:1210.3360",,"10.3847/1538-4365/aa99d7",,"astro-ph.GA","http://arxiv.org/licenses/nonexclusive-distrib/1.0/","  We present 33 GHz imaging for 112 pointings towards galaxy nuclei and
extranuclear star-forming regions at $\approx$2"" resolution using the Karl G.
Jansky Very Large Array (VLA) as part of the Star Formation in Radio Survey. A
comparison with 33 GHz Robert C. Byrd Green Bank Telescope single-dish
observations indicates that the interferometric VLA observations recover
$78\pm4 %$ of the total flux density over 25"" regions ($\approx$ kpc-scales)
among all fields. On these scales, the emission being resolved out is most
likely diffuse non-thermal synchrotron emission. Consequently, on the
$\approx30-300$ pc scales sampled by our VLA observations, the bulk of the 33
GHz emission is recovered and primarily powered by free-free emission from
discrete HII regions, making it an excellent tracer of massive star formation.
Of the 225 discrete regions used for aperture photometry, 162 are extranuclear
(i.e., having galactocentric radii $r_{\rm G} \geq 250$ pc) and detected at
$>3\sigma$ significance at 33 GHz and in H$\alpha$. Assuming a typical 33 GHz
thermal fraction of 90 %, the ratio of optically-thin 33 GHz-to-uncorrected
H$\alpha$ star formation rates indicate a median extinction value on
$\approx30-300$ pc scales of $A_{\rm H\alpha} \approx 1.26\pm0.09$ mag with an
associated median absolute deviation of 0.87 mag. We find that 10 % of these
sources are ""highly embedded"" (i.e., $A_{\rm H\alpha}\gtrsim3.3$ mag),
suggesting that on average HII regions remain embedded for $\lesssim1$ Myr.
Finally, we find the median 33 GHz continuum-to-H$\alpha$ line flux ratio to be
statistically larger within $r_{\rm G}<250$ pc relative the outer-disk regions
by a factor of $1.82\pm0.39$, while the ratio of 33 GHz-to-24 $\mu$m flux
densities are lower by a factor of $0.45\pm0.08$, which may suggest increased
extinction in the central regions.
","[{""version"":""v1"",""created"":""Fri, 10 Nov 2017 19:00:08 GMT""},{""version"":""v2"",""created"":""Fri, 17 Nov 2017 13:33:49 GMT""}]","2018-02-14"
"1711.03977","Antonio Cava","Antonio Cava, Daniel Schaerer, Johan Richard, Pablo G.
  P\'erez-Gonz\'alez, Miroslava Dessauges-Zavadsky, Lucio Mayer and Valentina
  Tamburello","The nature of giant clumps in distant galaxies probed by the anatomy of
  the Cosmic Snake","Nature Astronomy, published online on 13th of November 2017 (see
  https://www.nature.com/natastron/). Authors' version including
  Letter+Methods+Supplementary Info: 12 pages, 3 figures (main); 20 pages
  (Methods); 18 pages, 10 figures, 5 tables (Supplementary Info)",,"10.1038/s41550-017-0295-x",,"astro-ph.GA","http://arxiv.org/licenses/nonexclusive-distrib/1.0/","  Giant stellar clumps are ubiquitous in high-redshift galaxies. They are
thought to play an important role in the build-up of galactic bulges and as
diagnostics of star formation feedback in galactic discs. Hubble Space
Telescope (HST) blank field imaging surveys have estimated that these clumps
have masses up to 10$^{9.5}$ M$_{\odot}$ and linear sizes larger than ~1 kpc.
Recently, gravitational lensing has also been used to get higher spatial
resolution. However, both recent lensed observations and models suggest that
the clumps properties may be overestimated by the limited resolution of
standard imaging techniques. A definitive proof of this observational bias is
nevertheless still missing. Here we investigate directly the effect of
resolution on clump properties by analysing multiple gravitationally-lensed
images of the same galaxy at different spatial resolutions, down to 30 pc. We
show that the typical mass and size of giant clumps, generally observed at
$\sim$1 kpc resolution in high-redshift galaxies, are systematically
overestimated. The high spatial resolution data, only enabled by strong
gravitational lensing using currently available facilities, support smaller
scales of clump formation by fragmentation of the galactic gas disk via
gravitational instabilities.
","[{""version"":""v1"",""created"":""Fri, 10 Nov 2017 19:00:11 GMT""}]","2017-11-15"
"1711.03978","Jiayin Gu","Stefano Di Vita, Gauthier Durieux, Christophe Grojean, Jiayin Gu, Zhen
  Liu, Giuliano Panico, Marc Riembau, Thibaud Vantalon","A global view on the Higgs self-coupling at lepton colliders","33 pages, 16 figures",,"10.1007/JHEP02(2018)178","DESY 17-131, FERMILAB-PUB-17-462-T","hep-ph hep-ex","http://creativecommons.org/licenses/by/4.0/","  We perform a global effective-field-theory analysis to assess the precision
on the determination of the Higgs trilinear self-coupling at future lepton
colliders. Two main scenarios are considered, depending on whether the
center-of-mass energy of the colliders is sufficient or not to access Higgs
pair production processes. Low-energy machines allow for ~40% precision on the
extraction of the Higgs trilinear coupling through the exploitation of
next-to-leading-order effects in single Higgs measurements, provided that runs
at both 240/250 GeV and 350 GeV are available with luminosities in the few
attobarns range. A global fit, including possible deviations in other SM
couplings, is essential in this case to obtain a robust determination of the
Higgs self-coupling. High-energy machines can easily achieve a ~20% precision
through Higgs pair production processes. In this case, the impact of additional
coupling modifications is milder, although not completely negligible.
","[{""version"":""v1"",""created"":""Fri, 10 Nov 2017 19:00:23 GMT""}]","2018-04-04"
"1711.03979","Ioannis Liodakis","I. Liodakis, V. Pavlidou, I. Papadakis, E. Angelakis, N. Marchili, J.
  A. Zensus, L. Fuhrmann, V. Karamanavis, I. Myserlis, I. Nestoras, E.
  Palaiologou, and A. C. S. Readhead","Scale invariant jets: from blazars to microquasars","13 pages, 4 figures, accepted for publication in APJ",,"10.3847/1538-4357/aa9992",,"astro-ph.HE","http://arxiv.org/licenses/nonexclusive-distrib/1.0/","  Black holes, anywhere in the stellar-mass to supermassive range, are often
associated with relativistic jets. Models suggest that jet production may be a
universal process common in all black hole systems regardless of their mass.
Although in many cases observations support such hypotheses for microquasars
and Seyfert galaxies, little is known on whether boosted blazar jets also
comply with such universal scaling laws. We use uniquely rich multiwavelength
radio light curves from the F-GAMMA program and the most accurate Doppler
factors available to date to probe blazar jets in their emission rest frame
with unprecedented accuracy. We identify for the first time a strong
correlation between the blazar intrinsic broad-band radio luminosity and black
hole mass, which extends over $\sim$ 9 orders of magnitude down to microquasars
scales. Our results reveal the presence of a universal scaling law that bridges
the observing and emission rest frames in beamed sources and allows us to
effectively constrain jet models. They consequently provide an independent
method for estimating the Doppler factor, and for predicting expected radio
luminosities of boosted jets operating in systems of intermediate or
tens-of-solar mass black holes, immediately applicable to cases as those
recently observed by LIGO.
","[{""version"":""v1"",""created"":""Fri, 10 Nov 2017 19:00:26 GMT""}]","2017-12-27"
"1711.03980","Daniel Mayerson","John Golden and Daniel R. Mayerson","Mellin Bootstrap for Scalars in Generic Dimension","11 pages + appendices. v2: references added, few minor revisions;
  published version","JHEP06(2018)066","10.1007/JHEP06(2018)066","LCTP-17-05","hep-th","http://arxiv.org/licenses/nonexclusive-distrib/1.0/","  We use the recently developed framework of the Mellin bootstrap to study
perturbatively free scalar CFTs in arbitrary dimensions. This approach uses the
crossing-symmetric Mellin space formulation of correlation functions to
generate algebraic bootstrap equations by demanding that only physical
operators contribute to the OPE. We find that there are no perturbatively
interacting CFTs with only fundamental scalars in $d>6$ dimensions (to at least
second order in the perturbation). Our results can be seen as a modest step
towards understanding the space of interacting CFTs in $d>6$ and are consistent
with the intuition that no such CFTs exist.
","[{""version"":""v1"",""created"":""Fri, 10 Nov 2017 19:00:33 GMT""},{""version"":""v2"",""created"":""Thu, 14 Jun 2018 20:29:40 GMT""}]","2018-06-18"
"1711.03981","Yi Zhang","Yi Zhang","Unified non-Fermi liquid and superconductivity in a model of
  strongly-correlated systems","8 pages, 5 figures; comments are welcome and appreciated",,,,"cond-mat.str-el cond-mat.mes-hall cond-mat.supr-con","http://arxiv.org/licenses/nonexclusive-distrib/1.0/","  We study a model of strongly-correlated systems that incorporates phases such
as Fermi liquids, non-Fermi liquids, and superconductivity, in addition to
potential intertwined orders. The model describes Fermi surfaces of spinful
electron gas or electron liquid coupled to bosons via an intermediate gauge
field. Effectively, the coupling imposes constraints and interactions between
the fermion spin and the local boson density. This grants the bosons the
meaning as the Schwinger boson of the magnetic order and allows us to probe a
larger phase space, rather than around the quantum critical point. We design
the initial model so that after the boson and gauge fields are integrated out
exactly, the resulting fermion-only effective theory only consists of several
local interactions, allowing controlled weak-coupling interpretation for
certain parameter regions. Consequently, we find a non-Fermi liquid whose
degrees of freedom in the effective theory take the form of an \emph{emergent}
Fermi surface that has a different Luttinger volume from the original fermions,
therefore explicitly violates the Luttinger theorem. Further, this allows a
$d$-wave superconducting instability if the effective interacting induced by
boson coupling is in the relevant pairing channel. When the emergent Fermi
surface undergoes a Lifshitz transition, the carrier type changes. In addition,
we attribute the Mott insulating behavior in the strong coupling limit to the
loss of emergent Fermi surface and argue the possibility of coexisting magnetic
order. Our effective theory also suggests the possibility of charge density
waves as a consequence of \emph{effective} strong repulsion and is independent
of the Fermi-surface-nesting scenario. We discuss the possible optimal
conditions for higher superconducting transition temperature and potential
relevances and implications for realistic materials.
","[{""version"":""v1"",""created"":""Fri, 10 Nov 2017 19:00:36 GMT""}]","2017-11-15"
"1711.03982","Albino Perego Dr","Albino Perego, David Radice and Sebastiano Bernuzzi","AT2017gfo: an anisotropic and three-component kilonova counterpart of
  GW170817","9 pages, 4 figures and one table. Submitted to ApJL",,"10.3847/2041-8213/aa9ab9",,"astro-ph.HE","http://arxiv.org/licenses/nonexclusive-distrib/1.0/","  The detection of a kilo/macronova electromagnetic counterpart (AT2017gfo) of
the first gravitational wave signal compatible with the merger of two neutron
stars (GW170817) has confirmed the occurrence of r-process nucleosynthesis in
this kind of events. The blue and red components of AT2017gfo have been
interpreted as the signature of multi-component ejecta in the merger dynamics.
However, the explanation of AT2017gfo in terms of the properties of the ejecta
and of the ejection mechanisms is still incomplete. In this work, we analyse
AT2017gfo with a new semi-analytic model of kilo/macronova inferred from
general relativistic simulations of the merger and long-term numerical models
of the merger aftermath. The model accounts for the anisotropic emission from
the three known mass ejecta components: dynamic, winds and secular outflows
from the disk. The early multi-band light-curves of AT2017gfo can only be
explained by the presence of a relatively low opacity component of the ejecta
at high latitudes. This points to the key role of weak interactions in setting
the ejecta properties and determining the nucleosynthetic yields. Our model
constrains also the total ejected mass associated to AT2017gfo to be between
$0.042$ and $0.077 M_{\odot}$; the observation angle of the source to be
between $\pi/12$ and $7\pi/36 $; and the mass of the disk to be $ \gtrsim 0.08
M_{\odot}$.
","[{""version"":""v1"",""created"":""Fri, 10 Nov 2017 19:00:39 GMT""}]","2017-12-13"
"1711.03983","Svetlana Jorstad","Svetlana G. Jorstad, Alan P. Marscher, Daria A. Morozova, Ivan S.
  Troitsky, Iv\'an Agudo, Carolina Casadio, Adi Foord, Jos\'e L. G\'omez,
  Nicholas R. MacDonald, Sol N. Molina, Anne L\""ahteenm\""aki, Joni Tammi, Merja
  Tornikoski","Kinematics of Parsec-Scale Jets of Gamma-Ray Blazars at 43~GHz within
  the VLBA-BU-BLAZAR Program","48 pages, 18 figures, Tables 2,3,5, & 7 in a full length and figures
  2 and 4 for each source can be found in the journal version of the paper","The Astrophysical Journal, Volume 846, Issue 2, article id. 98, 35
  pp. (2017)","10.3847/1538-4357/aa8407",,"astro-ph.GA astro-ph.HE","http://arxiv.org/licenses/nonexclusive-distrib/1.0/","  We analyze the parsec-scale jet kinematics from 2007 June to 2013 January of
a sample of $\gamma$-ray bright blazars monitored roughly monthly with the Very
Long Baseline Array at 43~GHz. In a total of 1929 images, we measure apparent
speeds of 252 emission knots in 21 quasars, 12 BL~Lacertae objects (BLLacs),
and 3 radio galaxies, ranging from 0.02$c$ to 78$c$; 21\% of the knots are
quasi-stationary. Approximately 1/3 of the moving knots execute non-ballistic
motions, with the quasars exhibiting acceleration along the jet within 5~pc
(projected) of the core, and knots in the BLLacs tending to decelerate near the
core. Using apparent speeds of components and timescales of variability from
their light curves, we derive physical parameters of 120 superluminal knots,
including variability Doppler factors, Lorentz factors, and viewing angles. We
estimate the half-opening angle of each jet based on the projected opening
angle and scatter of intrinsic viewing angles of knots. We determine
characteristic values of physical parameters for each jet and AGN class based
on the range of values obtained for individual features. We calculate intrinsic
brightness temperatures of the cores, $T_{\rm b,int}^{\rm core}$, at all
epochs, finding that the radio galaxies usually maintain equipartition
conditions in the cores, while $\sim$30\% of $T_{\rm b,int}^{\rm core}$
measurements in the quasars and BLLacs deviate from equipartition values by a
factor $>$10. This probably occurs during transient events connected with
active states. In the Appendix we briefly describe the behavior of each blazar
during the period analyzed.
","[{""version"":""v1"",""created"":""Fri, 10 Nov 2017 19:00:39 GMT""}]","2017-11-15"
"1711.03984","Avraham Klein","Avraham Klein and Samuel Lederer and Debanjan Chowdhury and Erez Berg
  and Andrey Chubukov","Dynamical susceptibility of a near-critical non-conserved order
  parameter and B2g Raman response in Fe-based superconductors",,"Phys. Rev. B 98, 041101 (2018)","10.1103/PhysRevB.98.041101",,"cond-mat.str-el cond-mat.supr-con","http://arxiv.org/licenses/nonexclusive-distrib/1.0/","  We analyze the dynamical response of a two-dimensional system of itinerant
fermions coupled to a scalar boson $\phi$, which undergoes a continuous
transition towards nematic order with $d-$wave form-factor. We consider two
cases: (a) when $\phi$ is a soft collective mode of fermions near a Pomeranchuk
instability, and (b) when it is an independent critical degree of freedom, such
as a composite spin order parameter near an Ising-nematic transition. In both
cases, the order-parameter is not a conserved quantity and the $d-$wave
fermionic polarization $\Pi (q, \Omega)$ remains finite even at $q=0$. The
polarization $\Pi (0, \Omega)$ has similar behavior in the two cases, but the
relations between $\Pi (0, \Omega)$ and the bosonic susceptibility $\chi (0,
\Omega)$ are different, leading to different forms of $\chi^{\prime \prime} (0,
\Omega)$, as measured by Raman scattering. We compare our results with
polarization-resolved Raman data for the Fe-based superconductors
FeSe$_{1-x}$S$_x$, NaFe$_{1-x}$Co$_x$As and BaFe$_2$As$_2$. We argue that the
data for FeSe$_{1-x}$S$_x$ are well described within Pomeranchuk scenario,
while the data for NaFe$_{1-x}$Co$_x$As and BaFe$_2$As$_2$ are better described
within the ""independent"" scenario involving a composite spin order.
","[{""version"":""v1"",""created"":""Fri, 10 Nov 2017 19:01:01 GMT""}]","2018-07-11"
"1711.03985","Mufti Mahmud","Mufti Mahmud, M. Shamim Kaiser, Amir Hussain, Stefano Vassanelli","Applications of Deep Learning and Reinforcement Learning to Biological
  Data","33 pages, 5 figures, 1 table, survey paper, IEEE Trans. Neural Netw.
  Learn. Syst., 2018",,"10.1109/TNNLS.2018.2790388",,"cs.LG stat.ML","http://creativecommons.org/licenses/by-nc-sa/4.0/","  Rapid advances of hardware-based technologies during the past decades have
opened up new possibilities for Life scientists to gather multimodal data in
various application domains (e.g., Omics, Bioimaging, Medical Imaging, and
[Brain/Body]-Machine Interfaces), thus generating novel opportunities for
development of dedicated data intensive machine learning techniques. Overall,
recent research in Deep learning (DL), Reinforcement learning (RL), and their
combination (Deep RL) promise to revolutionize Artificial Intelligence. The
growth in computational power accompanied by faster and increased data storage
and declining computing costs have already allowed scientists in various fields
to apply these techniques on datasets that were previously intractable for
their size and complexity. This review article provides a comprehensive survey
on the application of DL, RL, and Deep RL techniques in mining Biological data.
In addition, we compare performances of DL techniques when applied to different
datasets across various application domains. Finally, we outline open issues in
this challenging research area and discuss future development perspectives.
","[{""version"":""v1"",""created"":""Fri, 10 Nov 2017 19:06:46 GMT""},{""version"":""v2"",""created"":""Sun, 7 Jan 2018 07:06:20 GMT""}]","2018-01-09"
"1711.03986","Daniel Rudolf","David Krieg and Daniel Rudolf","Recovery algorithms for high-dimensional rank one tensors","16 pages, Accepted for publication in J. Approx. Theory",,,,"math.NA","http://arxiv.org/licenses/nonexclusive-distrib/1.0/","  We present deterministic algorithms for the uniform recovery of $d$-variate
rank one tensors from function values. These tensors are given as product of
$d$ univariate functions whose $r$th weak derivative is bounded by $M$. The
recovery problem is known to suffer from the curse of dimensionality for $M\geq
2^r r!$. For smaller $M$, a randomized algorithm is known which breaks the
curse. We construct a deterministic algorithm which is even less costly. In
fact, we completely characterize the tractability of this problem by three
different ranges of the parameter $M$.
","[{""version"":""v1"",""created"":""Fri, 10 Nov 2017 19:08:56 GMT""},{""version"":""v2"",""created"":""Sat, 18 Aug 2018 10:18:38 GMT""}]","2018-08-21"
