"1711.04086","Swagat Ranjan Das","Swagat Ranjan Das (1), Anandmayee Tej (1), Sarita Vig (1), Tie Liu
  (2,3), Swarna K. Ghosh (4), Ishwara Chandra C.H.(4) ((1) Indian Institute of
  Space Science and Technology, (2) Korea Astronomy and Space Science Institute
  776, Republic of Korea, (3) East Asian Observatory, 660 N. A'ohoku Place,
  Hilo, HI 96720, USA, (4) National Centre For Radio Astrophysics (NCRA-TIFR),
  Pune, India)","Radio and infrared study of southern H II regions G346.056-0.021 and
  G346.077-0.056","16 pages, 12 figures, accepted for publication in A&A",,,,"astro-ph.GA astro-ph.SR","http://arxiv.org/licenses/nonexclusive-distrib/1.0/","  Aims. We present a multiwavelength study of two southern Galactic H II
regions G346.056-0.021 and G346.077-0.056 which are located at a distance of
10.9 kpc. The distribution of ionized gas, cold and warm dust and the stellar
population associated with the two H II regions are studied in detail using
measurements at near-infrared, mid-infrared, far-infrared, submillimeter and
radio wavelengths.
  Methods. The radio continuum maps at 1280 and 610 MHz were obtained using the
Giant Metrewave Radio Telescope to probe the ionized gas. The dust temperature,
column density and dust emissivity maps were generated by using modified
blackbody fits in the far-infrared wavelength range 160 - 500 {\mu}m. Various
near- and mid-infrared colour and magnitude criteria were adopted to identify
candidate ionizing star(s) and the population of young stellar objects in the
associated field.
  Results. The radio maps reveal the presence diffuse ionized emission
displaying distinct cometary morphologies. The 1280 MHz flux densities
translate to ZAMS spectral types in the range O7.5V - O7V and O8.5V - O8V for
the ionizing stars of G346.056-0.021 and G346.077-0.056, respectively. A few
promising candidate ionizing star(s) are identified using near-infrared
photometric data. The column density map shows the presence of a large, dense
dust clump enveloping G346.077-0.056. The dust temperature map shows peaks
towards the two H II regions. The submillimetre image shows the presence of two
additional clumps one being associated with G346.056-0.021. The masses of the
clumps are estimated to range between {\sim} 1400 to 15250 M{\sun}. Based on
simple analytic calculations and the correlation seen between the ionized gas
distribution and the local density structure, the observed cometary morphology
in the radio maps is better explained invoking the champagne-flow model.
","[{""version"":""v1"",""created"":""Sat, 11 Nov 2017 06:14:38 GMT""}]","2017-11-15"
"1711.04087","Jun-Bao Wu","Jun-Bao Wu","Notes on Integrable Boundary Interactions of Open $SU(4)$ Alternating
  Spin Chains","v4,12 pages, no figures, published version. To appaer in SCIENCE
  CHINA Physics, Mechanics & Astronomy","Sci. China Phys. Mech. Astron. (2018) 61: 070011","10.1007/s11433-018-9190-y","CJQS-2018-004","hep-th nlin.SI","http://arxiv.org/licenses/nonexclusive-distrib/1.0/","  In arXiv:1704.05807, it was shown that the planar flavored ABJM theory is
integrable in the scalar sector at two-loop order using coordinate Bethe
ansatz. A salient feature of this case is that the boundary reflection matrices
are anti-diagonal with respect to the chosen basis. In this paper, we relax the
coefficients of the boundary terms to be general constants in order to search
for integrable systems among this class. We found that at each end of the spin
chain, the only integrable boundary interaction, besides the one in
arXiv:1704.05807, is the one with vanishing boundary interactions leading to
diagonal reflection matrices. We also construct non-supersymmetric plannar
flavored ABJM theory which leads to trivial boundary interaction at both ends
of the open chain from two-loop anomalous dimension matrix in the scalar
sector.
","[{""version"":""v1"",""created"":""Sat, 11 Nov 2017 06:27:21 GMT""},{""version"":""v2"",""created"":""Tue, 21 Nov 2017 13:10:12 GMT""},{""version"":""v3"",""created"":""Thu, 11 Jan 2018 00:53:27 GMT""},{""version"":""v4"",""created"":""Thu, 5 Apr 2018 02:26:56 GMT""}]","2020-04-23"
"1711.04088","Wang Rui","Rui Wang, W. Su, Jian-Xin Zhu, C. S. Ting, Hai Li, Changfeng Chen,
  Baigeng Wang, Xiaoqun Wang","Kondo Signatures of a Quantum Magnetic Impurity in Topological
  Superconductors",,"Phys. Rev. Lett. 122, 087001 (2019)","10.1103/PhysRevLett.122.087001",,"cond-mat.supr-con","http://arxiv.org/licenses/nonexclusive-distrib/1.0/","  We study the Kondo physics of a quantum magnetic impurity in two-dimensional
topological superconductors (TSCs), either intrinsic or induced on the surface
of a bulk topological insulator, using a numerical renormalization group
technique. We show that, despite sharing the p + ip pairing symmetry, intrinsic
and extrinsic TSCs host different physical processes that produce distinct
Kondo signatures. Extrinsic TSCs harbor an unusual screening mechanism
involving both electron and orbital degrees of freedom that produces rich and
prominent Kondo phenomena, especially an intriguing pseudospin Kondo singlet
state in the superconducting gap and a spatially anisotropic spin correlation.
In sharp contrast, intrinsic TSCs support a robust impurity spin doublet ground
state and an isotropic spin correlation. These findings advance fundamental
knowledge of novel Kondo phenomena in TSCs and suggest experimental avenues for
their detection and distinction.
","[{""version"":""v1"",""created"":""Sat, 11 Nov 2017 06:44:52 GMT""},{""version"":""v2"",""created"":""Thu, 28 Jun 2018 16:33:57 GMT""},{""version"":""v3"",""created"":""Sun, 13 Jan 2019 07:00:04 GMT""}]","2019-03-06"
"1711.04089","Sohei Ashida","Sohei Ashida","Scattering theory for multistate Schr\""odinger operators",,,"10.1063/1.4989733",,"math-ph math.MP","http://arxiv.org/licenses/nonexclusive-distrib/1.0/","  We study multistate Schr\""odinger operators related to molecular dynamics. We
consider potentials which do not necessarily decay and prove absence of the
singular continuous spectrum and propagation estimates which mean the
scattering at speed larger than a positive constant and decay of the state with
potentials higher than considered energy at infinity. We also consider the
multistate Schr\""odinger operators with many-body structures. We obtain the
Mourre estimate and the minimal velocity estimate for the many-body operators.
The lower bound of the velocity is determined by the distance between the
energy and thresholds below the energy.
","[{""version"":""v1"",""created"":""Sat, 11 Nov 2017 06:54:34 GMT""}]","2018-01-17"
"1711.04090","Xianda Zhou","Xianda Zhou, William Yang Wang","MojiTalk: Generating Emotional Responses at Scale",,,,,"cs.CL cs.AI","http://arxiv.org/licenses/nonexclusive-distrib/1.0/","  Generating emotional language is a key step towards building empathetic
natural language processing agents. However, a major challenge for this line of
research is the lack of large-scale labeled training data, and previous studies
are limited to only small sets of human annotated sentiment labels.
Additionally, explicitly controlling the emotion and sentiment of generated
text is also difficult. In this paper, we take a more radical approach: we
exploit the idea of leveraging Twitter data that are naturally labeled with
emojis. More specifically, we collect a large corpus of Twitter conversations
that include emojis in the response, and assume the emojis convey the
underlying emotions of the sentence. We then introduce a reinforced conditional
variational encoder approach to train a deep generative model on these
conversations, which allows us to use emojis to control the emotion of the
generated text. Experimentally, we show in our quantitative and qualitative
analyses that the proposed models can successfully generate high-quality
abstractive conversation responses in accordance with designated emotions.
","[{""version"":""v1"",""created"":""Sat, 11 Nov 2017 07:20:51 GMT""},{""version"":""v2"",""created"":""Sat, 12 May 2018 05:10:42 GMT""}]","2018-05-15"
"1711.04091","Tor Anderson","Tor Anderson and Chin-Yao Chang and Sonia Martinez","Maximizing Algebraic Connectivity of Constrained Graphs in Adversarial
  Environments","8 pages, submitted to European Control Conference 2018",,,,"math.OC","http://arxiv.org/licenses/nonexclusive-distrib/1.0/","  This paper aims to maximize algebraic connectivity of networks via topology
design under the presence of constraints and an adversary. We are concerned
with three problems. First, we formulate the concave maximization topology
design problem of adding edges to an initial graph, which introduces a
nonconvex binary decision variable, in addition to subjugation to general
convex constraints on the feasible edge set. Unlike previous methods, our
method is justifiably not greedy and capable of accommodating these additional
constraints. We also study a scenario in which a coordinator must selectively
protect edges of the network from a chance of failure due to a physical
disturbance or adversarial attack. The coordinator needs to strategically
respond to the adversary's action without presupposed knowledge of the
adversary's feasible attack actions. We propose three heuristic algorithms for
the coordinator to accomplish the objective and identify worst-case preventive
solutions. Each algorithm is shown to be effective in simulation and we provide
some discussion on their compared performance.
","[{""version"":""v1"",""created"":""Sat, 11 Nov 2017 07:41:56 GMT""}]","2017-11-15"
"1711.04092","Indranil Sahoo","Indranil Sahoo, Joseph Guinness and Brian J. Reich","A Test for Isotropy on a Sphere using Spherical Harmonic Functions",,"Statistica Sinica 29 (2019): 1253-1276","10.5705/ss.202017.0475",,"stat.ME","http://arxiv.org/licenses/nonexclusive-distrib/1.0/","  Analysis of geostatistical data is often based on the assumption that the
spatial random field is isotropic. This assumption, if erroneous, can adversely
affect model predictions and statistical inference. Nowadays many applications
consider data over the entire globe and hence it is necessary to check the
assumption of isotropy on a sphere. In this paper, a test for spatial isotropy
on a sphere is proposed. The data are first projected onto the set of spherical
harmonic functions. Under isotropy, the spherical harmonic coefficients are
uncorrelated whereas they are correlated if the underlying fields are not
isotropic. This motivates a test based on the sample correlation matrix of the
spherical harmonic coefficients. In particular, we use the largest eigenvalue
of the sample correlation matrix as the test statistic. Extensive simulations
are conducted to assess the Type I errors of the test under different
scenarios. We show how temporal correlation affects the test and provide a
method for handling temporal correlation. We also gauge the power of the test
as we move away from isotropy. The method is applied to the near-surface air
temperature data which is part of the HadCM3 model output. Although we do not
expect global temperature fields to be isotropic, we propose several
anisotropic models with increasing complexity, each of which has an isotropic
process as model component and we apply the test to the isotropic component in
a sequence of such models as a method of determining how well the models
capture the anisotropy in the fields.
","[{""version"":""v1"",""created"":""Sat, 11 Nov 2017 07:58:01 GMT""},{""version"":""v2"",""created"":""Wed, 15 Nov 2017 03:13:29 GMT""}]","2020-07-30"
"1711.04093","Guangfeng Dong","Guangfeng Dong and Changjian Liu and Jiazhong Yang","On the maximal saddle order of p:-q resonant saddle","19 pages",,,,"math.CA","http://arxiv.org/licenses/nonexclusive-distrib/1.0/","  In this paper, we obtain some estimations of the saddle order which is the
sole topological invariant of the non-integrable resonant saddles of planar
polynomial vector fields of arbitrary degree $n$. Firstly, we prove that, for
any given resonance $p:-q$, $(p, q)=1$, and sufficiently big integer $n$, the
maximal saddle order can grow at least as rapidly as $n^2$. Secondly, we show
that there exists an integer $k_0$, which grows at least as rapidly as
$3n^2/2$, such that $L_{k_0}$ does not belong to the ideal generated by the
first $k_0-1$ saddle values $L_1, L_2, \cdots, L_{k_0-1}$, where $L_{k}$ means
the $k$-th saddle value of the given system. In particular, if $p=1$ (or
$q=1$), we obtain a sharper result that $k_0$ can grow at least as rapidly as
$2 n^2$.
","[{""version"":""v1"",""created"":""Sat, 11 Nov 2017 07:58:33 GMT""},{""version"":""v2"",""created"":""Mon, 30 Jul 2018 13:02:03 GMT""},{""version"":""v3"",""created"":""Fri, 15 Mar 2019 02:21:55 GMT""}]","2019-03-18"
"1711.04094","Junliang Guo","Junliang Guo, Linli Xu, Xunpeng Huang, Enhong Chen","Enhancing Network Embedding with Auxiliary Information: An Explicit
  Matrix Factorization Perspective","DASFAA 2018",,,,"cs.SI cs.LG stat.ML","http://arxiv.org/licenses/nonexclusive-distrib/1.0/","  Recent advances in the field of network embedding have shown the
low-dimensional network representation is playing a critical role in network
analysis. However, most of the existing principles of network embedding do not
incorporate auxiliary information such as content and labels of nodes flexibly.
In this paper, we take a matrix factorization perspective of network embedding,
and incorporate structure, content and label information of the network
simultaneously. For structure, we validate that the matrix we construct
preserves high-order proximities of the network. Label information can be
further integrated into the matrix via the process of random walk sampling to
enhance the quality of embedding in an unsupervised manner, i.e., without
leveraging downstream classifiers. In addition, we generalize the Skip-Gram
Negative Sampling model to integrate the content of the network in a matrix
factorization framework. As a consequence, network embedding can be learned in
a unified framework integrating network structure and node content as well as
label information simultaneously. We demonstrate the efficacy of the proposed
model with the tasks of semi-supervised node classification and link prediction
on a variety of real-world benchmark network datasets.
","[{""version"":""v1"",""created"":""Sat, 11 Nov 2017 08:07:23 GMT""},{""version"":""v2"",""created"":""Mon, 5 Mar 2018 03:39:23 GMT""}]","2018-03-06"
"1711.04095","Haiying Shan","Hai-Ying Shan, Chang-Xiang He and Zhen-Sheng Yu","The energy change of the complete multipartite graph",,,,,"math.CO","http://arxiv.org/licenses/nonexclusive-distrib/1.0/","  The energy of a graph is defined as the sum of the absolute values of all
eigenvalues of the graph. Akbari et al. \cite{S. Akbari} proved that for a
complete multipartite graph $K_{t_1 ,\ldots,t_k}$, if $t_i\geq 2 \
(i=1,\ldots,k)$, then deleting any edge will increase the energy. A natural
question is how the energy changes when $\min\{t_1 ,\ldots,t_k\}=1$. In this
paper, we will answer this question and completely determine how the energy of
a complete multipartite graph changes when one edge is removed.
","[{""version"":""v1"",""created"":""Sat, 11 Nov 2017 08:15:21 GMT""}]","2017-11-15"
"1711.04096","Zhiyong Chen","Wu Zhao, Zhiyong Chen, Kuikui Li, and Bin Xia","Artificial Interference Aided Physical Layer Security in Cache-enabled
  Heterogeneous Networks","submitted to IEEE ICC 2018",,,,"cs.IT math.IT","http://arxiv.org/licenses/nonexclusive-distrib/1.0/","  Caching popular contents is a promising way to offload the mobile data
traffic in wireless networks, but so far the potential advantage of caching in
improving physical layer security (PLS) is rarely considered. In this paper, we
contribute to the design and theoretical understanding of exploiting the
caching ability of users to improve the PLS in a wireless heterogeneous network
(HetNet). In such network, the base station (BS) ensures the secrecy of
communication by utilizing some of the available power to transmit a pre-cached
file, such that only the eavesdropper's channel is degraded. Accordingly, the
node locations of BSs, users and eavesdroppers are first modeled as mutually
independent poisson point processes (PPPs) and the corresponding file access
protocol is developed. We then derive analytical expressions of two metrics,
average secrecy rate and secrecy coverage probability, for the proposed system.
Numerical results are provided to show the significant security advantages of
the proposed network and to characterize the impact of network resource on the
secrecy metrics.
","[{""version"":""v1"",""created"":""Sat, 11 Nov 2017 08:16:49 GMT""}]","2017-11-15"
"1711.04097","Margarete Muhlleitner","Philipp Basler, Margarete M\""uhlleitner and Jonas Wittbrodt","The CP-Violating 2HDM in Light of a Strong First Order Electroweak Phase
  Transition and Implications for Higgs Pair Production",,,"10.1007/JHEP03(2018)061","DESY 17-174, KA-TP-39-2017","hep-ph","http://arxiv.org/licenses/nonexclusive-distrib/1.0/","  We investigate the strength of the electroweak phase transition (EWPT) within
the CP-violating 2-Higgs-Doublet Model (C2HDM). By applying a renormalisation
scheme which allows efficient scans of the C2HDM parameter space, we analyse
the possibility of a strong first order EWPT required for baryogenesis and
study its phenomenological implications for the LHC. Like in the CP-conserving
(real) 2HDM (R2HDM) we find that a strong EWPT favours mass gaps between the
non-SM-like Higgs bosons. These lead to prominent final states comprised of
gauge+Higgs bosons or pairs of Higgs bosons. In contrast to the R2HDM, the
CP-mixing of the C2HDM also favours approximately mass degenerate spectra with
dominant decays into SM particles. The requirement of a strong EWPT further
allows us to distinguish the C2HDM from the R2HDM using the signal strengths of
the SM-like Higgs boson. We additionally find that a strong EWPT requires an
enhancement of the SM-like trilinear Higgs coupling at next-to-leading order
(NLO) by up to a factor of 2.4 compared to the NLO SM coupling, establishing
another link between cosmology and collider phenomenology. We provide several
C2HDM benchmark scenarios compatible with a strong EWPT and all experimental
and theoretical constraints. We include the dominant branching ratios of the
non-SM-like Higgs bosons as well as the Higgs pair production cross section of
the SM-like Higgs boson for every benchmark point. The pair production cross
sections can be substantially enhanced compared to the SM and could be
observable at the high-luminosity LHC, allowing access to the trilinear Higgs
couplings.
","[{""version"":""v1"",""created"":""Sat, 11 Nov 2017 08:18:12 GMT""}]","2018-04-04"
"1711.04098","J\'anos R\'evai","J\'anos R\'evai","Are the chiral based $\bar{K}N$ potentials really energy dependent?","Final version to be published in Few Body Systems","Few-Body Syst. 59(2018)49","10.1007/s00601-018-1371-1",,"nucl-th","http://arxiv.org/licenses/nonexclusive-distrib/1.0/","  It is shown, that the energy dependence of the chiral based $\bar{K}N$
potentials, responsible for the occurrence of two poles in the $I=0$ sector, is
the consequence of applying the on-shell factorization introduced in [E. Oset,
A. Ramos, Nucl. Phys. A 635(1998)99]. When the dynamical equation is solved
without this approximation, the $T$-matrix has only one pole in the energy
region of the $\Lambda(1405)$ resonance.
","[{""version"":""v1"",""created"":""Sat, 11 Nov 2017 08:28:53 GMT""},{""version"":""v2"",""created"":""Thu, 23 Nov 2017 14:41:56 GMT""},{""version"":""v3"",""created"":""Mon, 26 Mar 2018 07:07:19 GMT""}]","2018-04-11"
"1711.04099","Matyas Barczy","Matyas Barczy, Fanni K. Ned\'enyi, Gyula Pap","On aggregation of multitype Galton-Watson branching processes with
  immigration","26 pages","Modern Stochastics: Theory and Applications (5) 1, (2018), 53-79",,,"math.PR","http://arxiv.org/licenses/nonexclusive-distrib/1.0/","  Limit behaviour of temporal and contemporaneous aggregations of independent
copies of a stationary multitype Galton-Watson branching process with
immigration is studied in the so-called iterated and simultaneous cases,
respectively. In both cases, the limit process is a zero mean Brownian motion
with the same covariance function under third order moment conditions on the
branching and immigration distributions. We specialize our results for
generalized integer-valued autoregressive processes and single-type
Galton-Watson processes with immigration as well.
","[{""version"":""v1"",""created"":""Sat, 11 Nov 2017 08:34:27 GMT""},{""version"":""v2"",""created"":""Thu, 18 Jan 2018 17:58:36 GMT""}]","2018-06-08"
"1711.04100","Adolfo Avella","Andrea Di Ciolo, Adolfo Avella","Single-particle properties of the Hubbard model in a novel three-pole
  approximation","13 pages, 3 figures, 16 panels","Physica B 536, 687 (2018)","10.1016/j.physb.2017.09.051",,"cond-mat.str-el","http://arxiv.org/licenses/nonexclusive-distrib/1.0/","  We study the 2D Hubbard model using the Composite Operator Method within a
novel three-pole approximation. Motivated by the long-standing experimental
puzzle of the single-particle properties of the underdoped cuprates, we include
in the operatorial basis, together with the usual Hubbard operators, a field
describing the electronic transitions dressed by the nearest-neighbor spin
fluctuations, which play a crucial role in the unconventional behavior of the
Fermi surface and of the electronic dispersion. Then, we adopt this
approximation to study the single-particle properties in the strong coupling
regime and find an unexpected behavior of the van Hove singularity that can be
seen as a precursor of a pseudogap regime.
","[{""version"":""v1"",""created"":""Sat, 11 Nov 2017 08:41:25 GMT""}]","2018-05-01"
"1711.04101","Laknath Semage","Laknath Semage","Recommender Systems with Random Walks: A Survey","15 pages, a survey paper",,,,"cs.IR cs.AI cs.SI","http://creativecommons.org/licenses/by-sa/4.0/","  Recommender engines have become an integral component in today's e-commerce
systems. From recommending books in Amazon to finding friends in social
networks such as Facebook, they have become omnipresent.
  Generally, recommender systems can be classified into two main categories:
content based and collaborative filtering based models. Both these models build
relationships between users and items to provide recommendations. Content based
systems achieve this task by utilizing features extracted from the context
available, whereas collaborative systems use shared interests between user-item
subsets.
  There is another relatively unexplored approach for providing recommendations
that utilizes a stochastic process named random walks. This study is a survey
exploring use cases of random walks in recommender systems and an attempt at
classifying them.
","[{""version"":""v1"",""created"":""Sat, 11 Nov 2017 08:43:06 GMT""}]","2017-11-15"
"1711.04102","Zhu Yi","Yungui Gong, Eleftherios Papantonopoulos, Zhu Yi","Constraints on scalar-tensor theory of gravity by the recent
  observational results on gravitational waves","7 pages, 1 figure, typo corrected, references added and updated, Eur.
  Phys. J. C in press","Eur. Phys. J. C (2018) 78: 738","10.1140/epjc/s10052-018-6227-9",,"gr-qc astro-ph.CO","http://arxiv.org/licenses/nonexclusive-distrib/1.0/","  The speed of gravitational waves provides us a new tool to test alternative
theories of gravity. The constraint on the speed of gravitational waves from
GW170817 and GRB170817A is used to test some classes of Horndeski theory. In
particular, we consider the coupling of a scalar field to Einstein tensor and
the coupling of the Gauss-Bonnet term to a scalar field. The coupling strength
of the Gauss-Bonnet coupling is constrained to be in the order of $10^{-15}$.
In the Horndeski theory we show that in order for this theory to satisfy the
stringent constraint on the speed of GWs the mass scale $M$ introduced in the
non-minimally derivative coupling is constrained to be in the range
$10^{15}\text{GeV}\gg M \gtrsim 2\times 10^{-35}$GeV taking also under
consideration the early times upper bound for the mass scale $M$. The large
mass ranges require no fine-tuning because the effect of non-minimally
derivative coupling is negligible at late times.
","[{""version"":""v1"",""created"":""Sat, 11 Nov 2017 08:44:21 GMT""},{""version"":""v2"",""created"":""Mon, 17 Sep 2018 04:40:12 GMT""}]","2018-09-19"
