"1709.10131","Sarah H\""orst","Sarah M. Horst, Y. Heidi Yoon, Melissa S. Ugelow, Alex H. Parker, Rui
  Li, Joost A. de Gouw, Margaret A. Tolbert","Laboratory Investigations of Titan Haze Formation: In Situ Measurement
  of Gas and Particle Composition","55 pages, 18 figures, 4 tables, Accepted in Icarus","Icarus, 301,136-151 , 2018","10.1016/j.icarus.2017.09.039",,"astro-ph.EP","http://arxiv.org/licenses/nonexclusive-distrib/1.0/","  Prior to the arrival of Cassini-Huygens, aerosol production in Titan's
atmosphere was believed to begin in the stratosphere where chemical processes
are predominantly initiated by FUV radiation. However, measurements taken by
Cassini UVIS and CAPS indicate that haze formation initiates in the
thermosphere where there is a greater flux of EUV photons and energetic
particles available to initiate chemical reactions, including the destruction
of N2. The discovery of previously unpredicted nitrogen species in Titan's
atmosphere by Cassini INMS indicates that nitrogen participates in the
chemistry to a much greater extent than was appreciated before Cassini. The
degree of nitrogen in the haze is important for understanding the diversity of
molecules present in Titan's atmosphere and on its surface. We have conducted a
series of simulation experiments using either spark discharge or FUV photons to
initiate chemistry in CH4/N2 gas mixtures (0.01% CH4/99.99% N2 to 10% CH4/90%
N2). We obtained in situ real-time measurements using an HR-ToF-AMS to measure
the particle composition as a function of particle size and a PIT-MS to measure
the composition of gas phase products. These two techniques allow us to
investigate the effect of energy source and initial CH4 concentration on the
degree of nitrogen incorporation in both the gas and solid phase products. The
results presented here confirm that FUV photons produce not only solid phase
nitrogen bearing products but also gas phase nitrogen species. We find that in
both the gas and solid phase, nitrogen is found in nitriles rather than amines
and both the gas phase and solid phase products are composed primarily of
molecules with a low degree of aromaticity. The UV experiments reproduce the
absolute abundances measured in Titan's stratosphere for a number of gas phase
species including C4H2, C6H6, HCN, CH3CN, HC3N, and C2H5CN. [Edited for length]
","[{""version"":""v1"",""created"":""Thu, 28 Sep 2017 19:04:38 GMT""}]","2017-12-19"
"1709.10132","Joey Huchette","Joey Huchette, Juan Pablo Vielma","A mixed-integer branching approach for very small formulations of
  disjunctive constraints",,,,,"math.OC","http://arxiv.org/licenses/nonexclusive-distrib/1.0/","  An important problem in optimization is the construction of mixed-integer
programming (MIP) formulations of disjunctive constraints that are both strong
and small. Motivated by lower bounds on the number of integer variables that
are required by traditional MIP formulations, we present a more general
mixed-integer branching formulation framework. Our approach maintains favorable
algorithmic properties of traditional MIP formulations: in particular,
amenability to branch-and-bound and branch-and-cut algorithms. Our main
technical result gives an explicit linear inequality description for both
traditional MIP and mixed-integer branching formulations for a wide range of
disjunctive constraints. The formulations obtained from this description have
linear programming relaxations that are as strong as possible and generalize
some of the most computationally effective formulations for piecewise linear
functions and other disjunctive constraints. We use this result to produce a
strong mixed-integer branching formulation for any disjunctive constraint that
uses only two integer variables and a linear number of extra constraints. We
sharpen this result for univariate piecewise linear functions and annulus
constraints arising in power systems and robotics, producing strong
mixed-integer branching formulations that use only two integer variables and a
constant ($\leq 6$) number of general inequality constraints. Along the way, we
produce two strong logarithmic-sized traditional MIP formulations for the
annulus constraint using our main technical result, illustrating its broader
utility in the traditional MIP setting.
","[{""version"":""v1"",""created"":""Thu, 28 Sep 2017 19:09:57 GMT""},{""version"":""v2"",""created"":""Sun, 3 Dec 2017 20:57:19 GMT""}]","2017-12-05"
"1709.10133","Anton Burkov","A.A. Burkov","Mirror Anomaly in Dirac Semimetals","5 pages, 3 figures. Typos corrected. Published version","Phys. Rev. Lett. 120, 016603 (2018)","10.1103/PhysRevLett.120.016603",,"cond-mat.mes-hall","http://arxiv.org/licenses/nonexclusive-distrib/1.0/","  We demonstrate that, apart from the chiral anomaly, Dirac semimetals possess
another quantum anomaly, which we call the mirror anomaly, and which manifests
in a singular response of the Dirac semimetal to an applied magnetic field.
Namely, the anomalous Hall conductivity exhibits step-function singularities
when the field is rotated. We show that this phenomenon is closely analogous to
the parity anomaly of (2+1)-dimensional Dirac fermions, but with mirror
symmetry, which we demonstrate emerges near any Dirac point at a time reversal
invariant momentum, replacing the parity symmetry.
","[{""version"":""v1"",""created"":""Thu, 28 Sep 2017 19:11:50 GMT""},{""version"":""v2"",""created"":""Thu, 2 Nov 2017 20:54:28 GMT""},{""version"":""v3"",""created"":""Fri, 5 Jan 2018 19:24:03 GMT""}]","2018-01-09"
"1709.10134","Dagoberto Contreras","D. Contreras, J. Hutchinson, A. Moss, D. Scott, J. P. Zibin","Closing in on the large-scale CMB power asymmetry","6 pages, 3 figures. Comments welcome","Phys. Rev. D 97, 063504 (2018)","10.1103/PhysRevD.97.063504",,"astro-ph.CO","http://arxiv.org/licenses/nonexclusive-distrib/1.0/","  Measurements of the cosmic microwave background (CMB) temperature
anisotropies have revealed a dipolar asymmetry in power at the largest scales,
in apparent contradiction with the statistical isotropy of standard
cosmological models. The significance of the effect is not very high, and is
dependent on a posteriori choices. Nevertheless, a number of models have been
proposed that produce a scale-dependent asymmetry. We confront several such
models for a physical, position-space modulation with CMB temperature
observations. We find that, while some models that maintain the standard
isotropic power spectrum are allowed, others, such as those with modulated
tensor or uncorrelated isocurvature modes, can be ruled out on the basis of the
overproduction of isotropic power. This remains the case even when an extra
isocurvature mode fully anti-correlated with the adiabatic perturbations is
added to suppress power on large scales.
","[{""version"":""v1"",""created"":""Thu, 28 Sep 2017 19:12:15 GMT""}]","2018-03-07"
"1709.10135","Andrew K. Waldron","R. Bonezzi, O. Corradini, E. Latini and A. Waldron","Quantum Mechanics and Hidden Superconformal Symmetry","12 pages LaTeX, updated references and improved discussion","Phys. Rev. D 96, 126005 (2017)","10.1103/PhysRevD.96.126005",,"hep-th math-ph math.MP quant-ph","http://arxiv.org/licenses/nonexclusive-distrib/1.0/","  Solvability of the ubiquitous quantum harmonic oscillator relies on a
spectrum generating osp(1|2) superconformal symmetry. We study the problem of
constructing all quantum mechanical models with a hidden osp(1|2) symmetry on a
given space of states. This problem stems from interacting higher spin models
coupled to gravity. In one dimension, we show that the solution to this problem
is the Plyushchay family of quantum mechanical models with hidden
superconformal symmetry obtained by viewing the harmonic oscillator as a one
dimensional Dirac system, so that Grassmann parity equals wavefunction parity.
These models--both oscillator and particle-like--realize all possible unitary
irreducible representations of osp(1|2).
","[{""version"":""v1"",""created"":""Thu, 28 Sep 2017 19:13:14 GMT""},{""version"":""v2"",""created"":""Tue, 10 Oct 2017 17:02:30 GMT""}]","2017-12-20"
"1709.10136","Dean Koro\v{s}ak","Dean Koro\v{s}ak and Marjan Slak Rupnik","Collective sensing of $\beta$-cells generates the metabolic code at
  optimal islet size",,,,,"physics.bio-ph cond-mat.stat-mech q-bio.CB q-bio.QM","http://arxiv.org/licenses/nonexclusive-distrib/1.0/","  Major part of a pancreatic islet is composed of beta cells that secrete
insulin, a key hormone regulating influx of nutrients into all cells in a
vertebrate organism to support nutrition, housekeeping or energy storage. Beta
cells constantly communicate with each other using both direct, short-range
interactions through gap junctions, and paracrine long-range signaling.
However, how these cell interactions shape collective sensing and cell behavior
in islets that leads to insulin release is unknown. When stimulated by specific
ligands, primarily glucose, beta cells collectively respond with expression of
a series of transient Ca$^{2+}$ changes on several temporal scales. Here we
analyze a set of Ca$^{2+}$ spike trains recorded in acute rodent pancreatic
tissue slice under physiological conditions. We found strongly correlated
states of co-spiking cells coexisting with mostly weak pairwise correlations
widespread across the islet. Furthermore, the collective Ca$^{2+}$ spiking
activity in islet shows on-off intermittency with scaling of spiking
amplitudes, and stimulus dependent autoassociative memory features. We use a
simple spin glass-like model for the functional network of a beta cell
collective to describe these findings and argue that Ca$^{2+}$ spike trains
produced by collective sensing of beta cells constitute part of the islet
metabolic code that regulates insulin release and limits the islet size.
","[{""version"":""v1"",""created"":""Thu, 28 Sep 2017 19:16:31 GMT""},{""version"":""v2"",""created"":""Wed, 11 Oct 2017 19:41:59 GMT""}]","2017-10-13"
"1709.10137","Widmer Martin","Martin Widmer","Bounds for the $\ell$-torsion in class groups","To appear in Bull. Lond. Math. Soc",,"10.1112/blms.12113",,"math.NT","http://arxiv.org/licenses/nonexclusive-distrib/1.0/","  We prove for each integer $\ell\geq 1$ an unconditional upper bound for the
size of the $\ell$-torsion subgroup $Cl_K[\ell]$ of the class group of $K$,
which holds for all but a zero density set of number fields $K$ of degree
$d\in\{4,5\}$ (with the additional restriction in the case $d = 4$ that the
field be non-$D_4$). For sufficiently large $\ell$ this improves recent results
of Ellenberg, Matchett Wood, and Pierce, and is also stronger than the best
currently known pointwise bounds under GRH. Conditional on GRH and on a weak
conjecture on the distribution of number fields our bounds also hold for
arbitrary degrees $d$.
","[{""version"":""v1"",""created"":""Thu, 28 Sep 2017 19:20:31 GMT""}]","2017-11-22"
"1709.10138","Kelly Iarosz","F. S. Borges, E. L. Lameu, K. C. Iarosz, P. R. Protachevicz, I. L.
  Caldas, R. L. Viana, E. E. N. Macau, A. M. Batista, M. S. Baptista","Inference of topology and the nature of synapses, and the flow of
  information in neuronal networks",,"Phys. Rev. E 97, 022303 (2018)","10.1103/PhysRevE.97.022303",,"q-bio.NC physics.bio-ph","http://arxiv.org/licenses/nonexclusive-distrib/1.0/","  The characterisation of neuronal connectivity is one of the most important
matters in neuroscience. In this work, we show that a recently proposed
informational quantity, the causal mutual information, employed with an
appropriate methodology, can be used not only to correctly infer the direction
of the underlying physical synapses, but also to identify their excitatory or
inhibitory nature, considering easy to handle and measure bivariate
time-series. The success of our approach relies on a surprising property found
in neuronal networks by which non-adjacent neurons do ""understand"" each other
(positive mutual information), however this exchange of information is not
capable of causing effect (zero transfer entropy). Remarkably, inhibitory
connections, responsible for enhancing synchronisation, transfer more
information than excitatory connections, known to enhance entropy in the
network. We also demonstrate that our methodology can be used to correctly
infer directionality of synapses even in the presence of dynamic and
observational Gaussian noise, and is also successful in providing the effective
directionality of inter modular connectivity, when only mean fields can be
measured.
","[{""version"":""v1"",""created"":""Thu, 28 Sep 2017 19:21:37 GMT""}]","2018-02-14"
"1709.10139","Maximilien Levesque","C\'edric Gageat, Luc Belloni, Daniel Borgis and Maximilien Levesque","Bridge functional for the molecular density functional theory with
  consistent pressure and surface tension and its importance for solvation in
  water",,,,,"physics.chem-ph cond-mat.mtrl-sci cond-mat.soft cond-mat.stat-mech physics.comp-ph","http://arxiv.org/licenses/nonexclusive-distrib/1.0/","  We address the problem of predicting the solvation free energy and
equilibrium solvent density profile in fews minutes from the molecular density
functional theory beyond the usual hypernetted-chain approximation. We
introduce a bridge functional of a coarse-grained, weighted solvent density. In
few minutes at most, for solutes of sizes ranging from small compounds to large
proteins, we produce (i) an estimation of the free energy of solvation within 1
kcal/mol of the experimental data for the hydrophobic solutes presented here,
and (ii) the solvent distribution around the solute. Contrary to previous
propositions, this bridge functional is thermodynamically consistent in that it
produces the correct liquid-vapor coexistence and the experimental surface
tension. We show this consistency to be of crucial importance for water at room
temperature and pressure. This bridge functional is designed to be simple,
local, and thus numerically efficient. Finally, we illustrate this new level of
molecular theory of solutions with the study of the hydration shell of a
protein.
","[{""version"":""v1"",""created"":""Thu, 28 Sep 2017 19:28:13 GMT""}]","2017-10-02"
"1709.10140","Carlos Eduardo Arango Gutierrez","Carlos Arango, R\'emy Dernat, John Sanabria","Performance Evaluation of Container-based Virtualization for High
  Performance Computing Environments","Keywords: Container-based virtualization; Linux containers;
  Singularity-Containers; Docker; High performance computing",,,,"cs.OS cs.DC cs.PF","http://creativecommons.org/licenses/by-sa/4.0/","  Virtualization technologies have evolved along with the development of
computational environments since virtualization offered needed features at that
time such as isolation, accountability, resource allocation, resource fair
sharing and so on. Novel processor technologies bring to commodity computers
the possibility to emulate diverse environments where a wide range of
computational scenarios can be run. Along with processors evolution, system
developers have created different virtualization mechanisms where each new
development enhanced the performance of previous virtualized environments.
Recently, operating system-based virtualization technologies captured the
attention of communities abroad (from industry to academy and research) because
their important improvements on performance area.
  In this paper, the features of three container-based operating systems
virtualization tools (LXC, Docker and Singularity) are presented. LXC, Docker,
Singularity and bare metal are put under test through a customized single node
HPL-Benchmark and a MPI-based application for the multi node testbed. Also the
disk I/O performance, Memory (RAM) performance, Network bandwidth and GPU
performance are tested for the COS technologies vs bare metal. Preliminary
results and conclusions around them are presented and discussed.
","[{""version"":""v1"",""created"":""Thu, 28 Sep 2017 19:30:05 GMT""}]","2017-10-02"
"1709.10141","Michael Monoyios Prof","Vicky Henderson, Kamil Klad\'ivko, Michael Monoyios, Christoph
  Reisinger","Executive stock option exercise with full and partial information on a
  drift change point","48 pages, final version, accepted for publication in SIAM Journal on
  Financial Mathematics",,,,"q-fin.MF","http://arxiv.org/licenses/nonexclusive-distrib/1.0/","  We analyse the optimal exercise of an executive stock option (ESO) written on
a stock whose drift parameter falls to a lower value at a change point, an
exponentially distributed random time independent of the Brownian motion
driving the stock. Two agents, who do not trade the stock, have differing
information on the change point, and seek to optimally exercise the option by
maximising its discounted payoff under the physical measure. The first agent
has full information, and observes the change point. The second agent has
partial information and filters the change point from price observations. This
scenario is designed to mimic the positions of two employees of varying
seniority, a fully informed executive and a partially informed less senior
employee, each of whom receives an ESO. The partial information scenario yields
a model under the observation filtration $\widehat{\mathbb{F}}$ in which the
stock drift becomes a diffusion driven by the innovations process, an
$\widehat{\mathbb{F}}$-Brownian motion also driving the stock under
$\widehat{\mathbb{F}}$, and the partial information optimal stopping value
function has two spatial dimensions. We rigorously characterise the free
boundary PDEs for both agents, establish shape and regularity properties of the
associated optimal exercise boundaries, and prove the smooth pasting property
in both information scenarios, exploiting some stochastic flow ideas to do so
in the partial information case. We develop finite difference algorithms to
numerically solve both agents' exercise and valuation problems and illustrate
that the additional information of the fully informed agent can result in
exercise patterns which exploit the information on the change point, lending
credence to empirical studies which suggest that privileged information of bad
news is a factor leading to early exercise of ESOs prior to poor stock price
performance.
","[{""version"":""v1"",""created"":""Thu, 28 Sep 2017 19:33:00 GMT""},{""version"":""v2"",""created"":""Fri, 26 Oct 2018 10:57:02 GMT""},{""version"":""v3"",""created"":""Tue, 18 Feb 2020 20:52:55 GMT""},{""version"":""v4"",""created"":""Fri, 17 Jul 2020 13:50:11 GMT""}]","2020-07-20"
"1709.10142","Arash Rahnama","Arash Rahnama and Panos J. Antsaklis","Resilient Learning-Based Control for Synchronization of Passive
  Multi-Agent Systems under Attack",,,,,"cs.SY math.OC stat.ML","http://arxiv.org/licenses/nonexclusive-distrib/1.0/","  In this paper, we show synchronization for a group of output passive agents
that communicate with each other according to an underlying communication graph
to achieve a common goal. We propose a distributed event-triggered control
framework that will guarantee synchronization and considerably decrease the
required communication load on the band-limited network. We define a general
Byzantine attack on the event-triggered multi-agent network system and
characterize its negative effects on synchronization. The Byzantine agents are
capable of intelligently falsifying their data and manipulating the underlying
communication graph by altering their respective control feedback weights. We
introduce a decentralized detection framework and analyze its steady-state and
transient performances. We propose a way of identifying individual Byzantine
neighbors and a learning-based method of estimating the attack parameters.
Lastly, we propose learning-based control approaches to mitigate the negative
effects of the adversarial attack.
","[{""version"":""v1"",""created"":""Thu, 28 Sep 2017 19:36:53 GMT""}]","2017-10-02"
"1709.10143","Bangxian Han","Bang-Xian Han","Ricci tensor on smooth metric measure space with boundary","7 pages","The main result of this paper is contained in the subsequent paper
  arXiv: 1902.00942",,,"math.MG math.DG math.FA","http://arxiv.org/licenses/nonexclusive-distrib/1.0/","  The aim of this note is to study the measure-valued Ricci tensor on smooth
metric measure space with boundary, which is a generalization of Bakry-Emery's
modified Ricci tensor on weighted Riemannian manifold. As an application, we
offer a new approach to study curvature-dimension condition of smooth metric
measure space with boundary.
","[{""version"":""v1"",""created"":""Thu, 28 Sep 2017 19:39:47 GMT""}]","2019-10-30"
"1709.10144","Hiromitsu Harada Mr","Hiromitsu Harada, Amaury Mouchet and Akira Shudo","Riemann surfaces of complex classical trajectories and tunnelling
  splitting in one-dimensional systems","28 pages,18 figures",,"10.1088/1751-8121/aa8c67",,"quant-ph","http://arxiv.org/licenses/nonexclusive-distrib/1.0/","  The topology of complex classical paths is investigated to discuss quantum
tunnelling splittings in one-dimensional systems. Here the Hamiltonian is
assumed to be given as polynomial functions, so the fundamental group for the
Riemann surface provides complete information on the topology of complex paths,
which allows us to enumerate all the possible candidates contributing to the
semiclassical sum formula for tunnelling splittings. This naturally leads to
action relations among classically disjoined regions, revealing entirely
non-local nature in the quantization condition. The importance of the proper
treatment of Stokes phenomena is also discussed in Hamiltonians in the normal
form.
","[{""version"":""v1"",""created"":""Thu, 28 Sep 2017 19:42:11 GMT""},{""version"":""v2"",""created"":""Wed, 31 Jan 2018 06:47:37 GMT""}]","2018-02-01"
"1709.10145","Matt Darnley","M. J. Darnley, R. Hounsell, P. Godon, D. A. Perley, M. Henze, N. P. M.
  Kuin, B. F. Williams, S. C. Williams, M. F. Bode, D. J. Harman, K. Hornoch,
  M. Link, J.-U. Ness, V. A. R. M. Ribeiro, E. M. Sion, A. W. Shafter, M. M.
  Shara","Inflows, Outflows, and a Giant Donor in the Remarkable Recurrent Nova
  M31N 2008-12a? - Hubble Space Telescope Photometry of the 2015 Eruption","20 pages, 8 figures, 5 tables, accepted for publication in The
  Astrophysical Journal",,"10.3847/1538-4357/aa9062",,"astro-ph.HE astro-ph.SR","http://arxiv.org/licenses/nonexclusive-distrib/1.0/","  The recurrent nova M31N 2008-12a experiences annual eruptions, contains a
near-Chandrasekhar mass white dwarf, and has the largest mass accretion rate in
any nova system. In this paper, we present Hubble Space Telescope (HST)
WFC3/UVIS photometry of the late decline of the 2015 eruption. We couple these
new data with archival HST observations of the quiescent system and Keck
spectroscopy of the 2014 eruption. The late-time photometry reveals a rapid
decline to a minimum luminosity state, before a possible recovery /
re-brightening in the run-up to the next eruption. Comparison with accretion
disk models supports the survival of the accretion disk during the eruptions,
and uncovers a quiescent disk mass accretion rate of the order of
$10^{-6}\,M_\odot\,\mathrm{yr}^{-1}$, which may rise beyond
$10^{-5}\,M_\odot\,\mathrm{yr}^{-1}$ during the super-soft source phase - both
of which could be problematic for a number of well-established nova eruption
models. Such large accretion rates, close to the Eddington limit, might be
expected to be accompanied by additional mass loss from the disk through a wind
and even collimated outflows. The archival HST observations, combined with the
disk modeling, provide the first constraints on the mass donor;
$L_\mathrm{donor}=103^{+12}_{-11}\,L_\odot$,
$R_\mathrm{donor}=14.14^{+0.46}_{-0.47}\,R_\odot$, and $T_\mathrm{eff,
donor}=4890\pm110$ K, which may be consistent with an irradiated M31 red-clump
star. Such a donor would require a system orbital period $\gtrsim5$ days. Our
updated analysis predicts that the M31N 2008-12a WD could reach the
Chandrasekhar mass in < 20 kyr.
","[{""version"":""v1"",""created"":""Thu, 28 Sep 2017 19:44:03 GMT""}]","2017-11-15"
