"1709.10029","Bart Paul Gerard Van Parys","Dimitris Bertsimas, Bart Van Parys","Sparse High-Dimensional Regression: Exact Scalable Algorithms and Phase
  Transitions",,,,,"math.OC stat.ML","http://arxiv.org/licenses/nonexclusive-distrib/1.0/","  We present a novel binary convex reformulation of the sparse regression
problem that constitutes a new duality perspective. We devise a new cutting
plane method and provide evidence that it can solve to provable optimality the
sparse regression problem for sample sizes n and number of regressors p in the
100,000s, that is two orders of magnitude better than the current state of the
art, in seconds. The ability to solve the problem for very high dimensions
allows us to observe new phase transition phenomena. Contrary to traditional
complexity theory which suggests that the difficulty of a problem increases
with problem size, the sparse regression problem has the property that as the
number of samples $n$ increases the problem becomes easier in that the solution
recovers 100% of the true signal, and our approach solves the problem extremely
fast (in fact faster than Lasso), while for small number of samples n, our
approach takes a larger amount of time to solve the problem, but importantly
the optimal solution provides a statistically more relevant regressor. We argue
that our exact sparse regression approach presents a superior alternative over
heuristic methods available at present.
","[{""version"":""v1"",""created"":""Thu, 28 Sep 2017 16:00:49 GMT""}]","2017-09-29"
"1709.10030","Bart Paul Gerard Van Parys","Dimitris Bertsimas, Bart Van Parys","Sparse Hierarchical Regression with Polynomials",,,,,"math.OC cs.LG stat.ML","http://arxiv.org/licenses/nonexclusive-distrib/1.0/","  We present a novel method for exact hierarchical sparse polynomial
regression. Our regressor is that degree $r$ polynomial which depends on at
most $k$ inputs, counting at most $\ell$ monomial terms, which minimizes the
sum of the squares of its prediction errors. The previous hierarchical sparse
specification aligns well with modern big data settings where many inputs are
not relevant for prediction purposes and the functional complexity of the
regressor needs to be controlled as to avoid overfitting. We present a two-step
approach to this hierarchical sparse regression problem. First, we discard
irrelevant inputs using an extremely fast input ranking heuristic. Secondly, we
take advantage of modern cutting plane methods for integer optimization to
solve our resulting reduced hierarchical $(k, \ell)$-sparse problem exactly.
The ability of our method to identify all $k$ relevant inputs and all $\ell$
monomial terms is shown empirically to experience a phase transition.
Crucially, the same transition also presents itself in our ability to reject
all irrelevant features and monomials as well. In the regime where our method
is statistically powerful, its computational complexity is interestingly on par
with Lasso based heuristics. The presented work fills a void in terms of a lack
of powerful disciplined nonlinear sparse regression methods in high-dimensional
settings. Our method is shown empirically to scale to regression problems with
$n\approx 10,000$ observations for input dimension $p\approx 1,000$.
","[{""version"":""v1"",""created"":""Thu, 28 Sep 2017 16:01:08 GMT""}]","2017-09-29"
"1709.10031","Alex Bartel","Alex Bartel and Matthew Spencer","Relations between permutation representations in positive characteristic","18 pages; minor corrections and improvements. Final version to appear
  in Bull. London Math. Soc",,"10.1112/blms.12230",,"math.RT math.GR","http://arxiv.org/licenses/nonexclusive-distrib/1.0/","  Given a finite group G and a field F, a G-set X gives rise to an
F[G]-permutation module F[X]. This defines a map from the Burnside ring of G to
its representation ring over F. It is an old problem in representation theory,
with wide-ranging applications in algebra, number theory, and geometry, to give
explicit generators of the kernel K_F(G) of this map, i.e. to classify pairs of
G-sets X, Y such that F[X] is isomorphic to F[Y]. When F has characteristic 0,
a complete description of K_F(G) is now known. In this paper, we give a similar
description of K_F(G) when F is a field of characteristic p>0 in all but the
most complicated case, which is when G has a subquotient that is a
non-p-hypo-elementary (p,p)-Dress group.
","[{""version"":""v1"",""created"":""Thu, 28 Sep 2017 16:02:43 GMT""},{""version"":""v2"",""created"":""Wed, 19 Dec 2018 12:43:00 GMT""}]","2019-02-06"
"1709.10032","Francesco Giovanni Celiberto","Francesco Giovanni Celiberto, Dmitry Yu. Ivanov, Beatrice Murdaca,
  Alessandro Papa","High-energy resummation in heavy-quark pair photoproduction","17 pages, 5 figures, 2 tables; changed some text, removed one figure
  and added one reference; version accepted for publication in Phys. Lett. B",,"10.1016/j.physletb.2017.12.020",,"hep-ph","http://arxiv.org/licenses/nonexclusive-distrib/1.0/","  We present our predictions for the inclusive production of two heavy
quark-antiquark pairs, separated by a large rapidity interval, in the collision
of (quasi-)real photons at the energies of LEP2 and of some future
electron-positron colliders. We include in our calculation the full resummation
of leading logarithms in the center-of-mass energy and a partial resummation of
the next-to-leading logarithms, within the Balitsky-Fadin-Kuraev-Lipatov (BFKL)
approach.
","[{""version"":""v1"",""created"":""Thu, 28 Sep 2017 16:02:45 GMT""},{""version"":""v2"",""created"":""Fri, 3 Nov 2017 17:37:59 GMT""},{""version"":""v3"",""created"":""Tue, 12 Dec 2017 17:00:46 GMT""}]","2018-01-17"
"1709.10033","Tristan Buckmaster","Tristan Buckmaster and Vlad Vicol","Nonuniqueness of weak solutions to the Navier-Stokes equation","36 pages; minor corrections per referee comments; version accepted by
  Annals of Mathematics",,,,"math.AP math-ph math.MP","http://arxiv.org/licenses/nonexclusive-distrib/1.0/","  For initial datum of finite kinetic energy, Leray has proven in 1934 that
there exists at least one global in time finite energy weak solution of the 3D
Navier-Stokes equations. In this paper we prove that weak solutions of the 3D
Navier-Stokes equations are not unique in the class of weak solutions with
finite kinetic energy. Moreover, we prove that Holder continuous dissipative
weak solutions of the 3D Euler equations may be obtained as a strong vanishing
viscosity limit of a sequence of finite energy weak solutions of the 3D
Navier-Stokes equations.
","[{""version"":""v1"",""created"":""Thu, 28 Sep 2017 16:06:07 GMT""},{""version"":""v2"",""created"":""Thu, 5 Oct 2017 15:46:10 GMT""},{""version"":""v3"",""created"":""Wed, 20 Jun 2018 01:03:26 GMT""},{""version"":""v4"",""created"":""Thu, 11 Oct 2018 14:11:57 GMT""}]","2018-10-12"
"1709.10034","Claudio Bonati","Claudio Bonati and Massimo D'Elia","Topological critical slowing down: variations on a toy model","18 pages, 14 eps figures. Some changes and references added. To be
  published by Phys Rev E","Phys. Rev. E 98, 013308 (2018)","10.1103/PhysRevE.98.013308",,"hep-lat cond-mat.stat-mech physics.comp-ph","http://arxiv.org/licenses/nonexclusive-distrib/1.0/","  Numerical simulations of lattice quantum field theories whose continuum
counterparts possess classical solutions with non-trivial topology face a
severe critical slowing down as the continuum limit is approached. Standard
Monte-Carlo algorithms develop a loss of ergodicity, with the system remaining
frozen in configurations with fixed topology. We analyze the problem in a
simple toy model, consisting of the path integral formulation of a quantum
mechanical particle constrained to move on a circumference. More specifically,
we implement for this toy model various techniques which have been proposed to
solve or alleviate the problem for more complex systems, like non-abelian gauge
theories, and compare them both in the regime of low temperature and in that of
very high temperature. Among the various techniques, we consider also a new
algorithm which completely solves the freezing problem, but unfortunately is
specifically tailored for this particular model and not easily exportable to
more complex systems.
","[{""version"":""v1"",""created"":""Thu, 28 Sep 2017 16:06:32 GMT""},{""version"":""v2"",""created"":""Thu, 12 Jul 2018 17:11:44 GMT""}]","2018-08-01"
"1709.10035","Panditi Vemareddy","P. Vemareddy, N. Gopalswamy and B. Ravindra","Prominence eruption initiated by helical kink-instability of an embedded
  flux rope","Accepted in ApJ, 13 pages, 9 figures",,"10.3847/1538-4357/aa9020",,"astro-ph.SR","http://arxiv.org/licenses/nonexclusive-distrib/1.0/","  We study the triggering mechanism of a limb-prominence eruption and the
associated coronal mass ejection near AR 12342 using SDO and LASCO/SOHO
observations. The prominence is seen with an embedded flux thread (FT) at one
end and bifurcates from the middle to a different footpoint location. The
morphological evolution of the FT is similar to an unstable flux rope (FR),
which we regard as prominence embedded FR. The FR twist exceeds the critical
value. In addition, the morphology of the prominence plasma in 304\AA~images
marks the helical nature of the magnetic skeleton with a total of 2.96 turns
along arc length. The potential field extrapolation model indicates that the
critical height of the background magnetic field gradient falls within the
inner corona (105Mm) consistent with the extent of coronal plasma loops. These
results suggest that the helical kink instability in the embedded FR caused the
slow rise of the prominence to a height of the torus instability domain.
Moreover, the differential emission measure analysis unveils heating of the
prominence plasma to coronal temperatures during eruption, suggesting a
reconnection-related heating underneath the upward rising embedded FR. The
prominence starts with a slow rise motion of 10km/s, followed by fast and slow
acceleration phases having an average acceleration of $28.9m/s^2$, $2.4m/s^2$
in C2, C3 field of view respectively. As predicted by previous numerical
simulations, the observed synchronous kinematic profiles of the CME leading
edge and the core supports the involved FR instability in the prominence
initiation.
","[{""version"":""v1"",""created"":""Thu, 28 Sep 2017 16:07:56 GMT""}]","2017-11-29"
"1709.10036","Sadra Sadraddini","Sadra Sadraddini and Calin Belta","Distributed Robust Set-Invariance for Interconnected Linear Systems","8 Pages. Submitted to American Control Conference (ACC), 2018",,,,"cs.SY math.OC","http://arxiv.org/licenses/nonexclusive-distrib/1.0/","  We introduce a class of distributed control policies for networks of
discrete-time linear systems with polytopic additive disturbances. The
objective is to restrict the network-level state and controls to user-specified
polyhedral sets for all times. This problem arises in many safety-critical
applications. We consider two problems. First, given a communication graph
characterizing the structure of the information flow in the network, we find
the optimal distributed control policy by solving a single linear program.
Second, we find the sparsest communication graph required for the existence of
a distributed invariance-inducing control policy. Illustrative examples,
including one on platooning, are presented.
","[{""version"":""v1"",""created"":""Thu, 28 Sep 2017 16:08:37 GMT""}]","2017-09-29"
"1709.10037","Ron Meiry","Ron Meiry, Omer Gurewitz and Asaf Cohen","Integer Forcing: Effective SNR Distribution and Practical Block-Based
  Schemes","22 pages, 5 figures",,,,"cs.IT math.IT","http://arxiv.org/licenses/nonexclusive-distrib/1.0/","  Integer Forcing (IF) is a novel linear receiver architecture, where instead
of separating the codewords sent by each transmitter, and decoding them
individually, forces integer-valued linear combinations at each receive
antenna, and decodes the linear combinations. The original codewords are
obtained by inverting the integer-valued matrix. While demonstrating superior
performance, IF requires complex optimization in order to find the optimal
linear combinations, and demands either using multi-level nested lattice codes,
or reducing the rates of all transmitters to equal the weakest one. Finally,
the distribution of the resulting effective SNR is hard to evaluate.
  In this paper, we first give simple upper and lower bounds on the effective
SNR of a single linear combination in IF. These expressions allow us to easily
bound the distribution of the effective SNR for any given linear combination
used. We then suggest two simple block-based IF schemes. These schemes, while
sub-optimal, significantly reduce the complexity of the optimization process,
and, more importantly, do not require reducing the rates of all transmitters,
as decoding is done block-wise. Finally, we bound the distribution of the
effective SNR of the decoding schemes, and show via simulations the superiority
of block-wise schemes at low SNR.
","[{""version"":""v1"",""created"":""Thu, 28 Sep 2017 16:12:27 GMT""},{""version"":""v2"",""created"":""Sun, 1 Oct 2017 17:58:31 GMT""}]","2017-10-03"
"1709.10038","Hyungsik Roger Moon","Khai X. Chiong, Hyungsik Roger Moon","Estimation of Graphical Models using the $L_{1,2}$ Norm",,,,,"econ.EM stat.ME","http://arxiv.org/licenses/nonexclusive-distrib/1.0/","  Gaussian graphical models are recently used in economics to obtain networks
of dependence among agents. A widely-used estimator is the Graphical Lasso
(GLASSO), which amounts to a maximum likelihood estimation regularized using
the $L_{1,1}$ matrix norm on the precision matrix $\Omega$. The $L_{1,1}$ norm
is a lasso penalty that controls for sparsity, or the number of zeros in
$\Omega$. We propose a new estimator called Structured Graphical Lasso
(SGLASSO) that uses the $L_{1,2}$ mixed norm. The use of the $L_{1,2}$ penalty
controls for the structure of the sparsity in $\Omega$. We show that when the
network size is fixed, SGLASSO is asymptotically equivalent to an infeasible
GLASSO problem which prioritizes the sparsity-recovery of high-degree nodes.
Monte Carlo simulation shows that SGLASSO outperforms GLASSO in terms of
estimating the overall precision matrix and in terms of estimating the
structure of the graphical model. In an empirical illustration using a classic
firms' investment dataset, we obtain a network of firms' dependence that
exhibits the core-periphery structure, with General Motors, General Electric
and U.S. Steel forming the core group of firms.
","[{""version"":""v1"",""created"":""Thu, 28 Sep 2017 16:15:30 GMT""},{""version"":""v2"",""created"":""Sun, 1 Oct 2017 21:32:41 GMT""}]","2017-10-03"
"1709.10039","Christoph Berkholz","Christoph Berkholz, Jens Keppeler, Nicole Schweikardt","Answering UCQs under updates and in the presence of integrity
  constraints",,,,,"cs.DB cs.LO","http://arxiv.org/licenses/nonexclusive-distrib/1.0/","  We investigate the query evaluation problem for fixed queries over fully
dynamic databases where tuples can be inserted or deleted. The task is to
design a dynamic data structure that can immediately report the new result of a
fixed query after every database update. We consider unions of conjunctive
queries (UCQs) and focus on the query evaluation tasks testing (decide whether
an input tuple belongs to the query result), enumeration (enumerate, without
repetition, all tuples in the query result), and counting (output the number of
tuples in the query result).
  We identify three increasingly restrictive classes of UCQs which we call
t-hierarchical, q-hierarchical, and exhaustively q-hierarchical UCQs. Our main
results provide the following dichotomies: If the query's homomorphic core is
t-hierarchical (q-hierarchical, exhaustively q-hierarchical), then the testing
(enumeration, counting) problem can be solved with constant update time and
constant testing time (delay, counting time). Otherwise, it cannot be solved
with sublinear update time and sublinear testing time (delay, counting time),
unless the OV-conjecture and/or the OMv-conjecture fails.
  We also study the complexity of query evaluation in the dynamic setting in
the presence of integrity constraints, and we obtain according dichotomy
results for the special case of small domain constraints (i.e., constraints
which state that all values in a particular column of a relation belong to a
fixed domain of constant size).
","[{""version"":""v1"",""created"":""Thu, 28 Sep 2017 16:15:37 GMT""}]","2017-09-29"
"1709.10040","Tahir Bachar Issa Tahir Bachar M","Tahir Bachar Issa and Wenxian Shen","Persistence, coexistence and extinction in two species chemotaxis models
  on bounded heterogeneous environments",,,,,"math.AP","http://arxiv.org/licenses/nonexclusive-distrib/1.0/","  In this paper, we consider a two species chemotaxis system of
parabolic-parabolic-elliptic type with Lotka-Volterra type competition terms in
heterogeneous media. We first find various conditions on the parameters which
guarantee the global existence and boundedness of classical solutions with
nonnegative initial functions. Next, we find further conditions on the
parameters which establish the persistence of the two species. Then, under the
same set of conditions for the persistence of two species, we prove the
existence of coexistence states. Finally we prove the extinction phenomena in
the sense that one of the species dies out asymptotically and the other reaches
its carrying capacity as time goes to infinity. The persistence in general two
species chemotaxis systems is studied for the first time. Several important
techniques are developed to study the persistence and coexistence of the two
species chemotaxis systems. Many existing results on the persistence,
coexistence, and extinction on two species competition systems without
chemotaxis are recovered.
","[{""version"":""v1"",""created"":""Thu, 28 Sep 2017 16:17:18 GMT""},{""version"":""v2"",""created"":""Mon, 9 Oct 2017 20:08:17 GMT""},{""version"":""v3"",""created"":""Wed, 10 Jan 2018 04:16:54 GMT""},{""version"":""v4"",""created"":""Fri, 8 Jun 2018 05:05:37 GMT""}]","2018-06-11"
"1709.10041","Ivo Shterev","Ivo D. Shterev, David B. Dunson, Cliburn Chan, Gregory D. Sempowski","Bayesian Multi Plate High Throughput Screening of Compounds",,,,,"stat.ML","http://arxiv.org/licenses/nonexclusive-distrib/1.0/","  High throughput screening of compounds (chemicals) is an essential part of
drug discovery [7], involving thousands to millions of compounds, with the
purpose of identifying candidate hits. Most statistical tools, including the
industry standard B-score method, work on individual compound plates and do not
exploit cross-plate correlation or statistical strength among plates. We
present a new statistical framework for high throughput screening of compounds
based on Bayesian nonparametric modeling. The proposed approach is able to
identify candidate hits from multiple plates simultaneously, sharing
statistical strength among plates and providing more robust estimates of
compound activity. It can flexibly accommodate arbitrary distributions of
compound activities and is applicable to any plate geometry. The algorithm
provides a principled statistical approach for hit identification and false
discovery rate control. Experiments demonstrate significant improvements in hit
identification sensitivity and specificity over the B-score method, which is
highly sensitive to threshold choice. The framework is implemented as an
efficient R extension package BHTSpack and is suitable for large scale data
sets.
","[{""version"":""v1"",""created"":""Thu, 28 Sep 2017 16:17:25 GMT""}]","2017-09-29"
"1709.10042","Vince Vatter","Robert Brignall, Michael Engen, Vincent Vatter","A counterexample regarding labelled well-quasi-ordering",,,,,"math.CO","http://arxiv.org/licenses/nonexclusive-distrib/1.0/","  Korpelainen, Lozin, and Razgon conjectured that a hereditary property of
graphs which is well-quasi-ordered by the induced subgraph order and defined by
only finitely many minimal forbidden induced subgraphs is labelled
well-quasi-ordered, a notion stronger than that of $n$-well-quasi-order
introduced by Pouzet in the 1970s. We present a counterexample to this
conjecture. In fact, we exhibit a hereditary property of graphs which is
well-quasi-ordered by the induced subgraph order and defined by finitely many
minimal forbidden induced subgraphs yet is not $2$-well-quasi-ordered. This
counterexample is based on the widdershins spiral, which has received some
study in the area of permutation patterns.
","[{""version"":""v1"",""created"":""Thu, 28 Sep 2017 16:18:18 GMT""},{""version"":""v2"",""created"":""Fri, 29 Sep 2017 13:46:18 GMT""},{""version"":""v3"",""created"":""Thu, 4 Oct 2018 20:14:50 GMT""}]","2018-10-08"
"1709.10043","Oliver Sutton","Andrea Cangiani, Emmanuil H. Georgoulis, Andrew Yu. Morozov and Oliver
  J. Sutton","Revealing new dynamical patterns in a reaction-diffusion model with
  cyclic competition via a novel computational framework","24 pages, 35 figures",,"10.1098/rspa.2017.0608",,"q-bio.PE math.NA","http://arxiv.org/licenses/nonexclusive-distrib/1.0/","  Understanding how patterns and travelling waves form in chemical and
biological reaction-diffusion models is an area which has been widely
researched, yet is still experiencing fast development. Surprisingly enough, we
still do not have a clear understanding about all possible types of dynamical
regimes in classical reaction-diffusion models such as Lotka-Volterra
competition models with spatial dependence. In this work, we demonstrate some
new types of wave propagation and pattern formation in a classical three
species cyclic competition model with spatial diffusion, which have been so far
missed in the literature. These new patterns are characterised by a high
regularity in space, but are different from patterns previously known to exist
in reaction-diffusion models, and may have important applications in improving
our understanding of biological pattern formation and invasion theory. Finding
these new patterns is made technically possible by using an automatic adaptive
finite element method driven by a novel a posteriori error estimate which is
proven to provide a reliable bound for the error of the numerical method. We
demonstrate how this numerical framework allows us to easily explore the
dynamical patterns both in two and three spatial dimensions.
","[{""version"":""v1"",""created"":""Thu, 28 Sep 2017 16:18:41 GMT""}]","2018-05-24"
"1709.10044","Taner Akg\""un","Taner Akg\""un, Pablo Cerd\'a-Dur\'an, Juan Antonio Miralles, Jos\'e A.
  Pons","The force-free twisted magnetosphere of a neutron star - II:
  Degeneracies of the Grad-Shafranov equation","12 pages, 9 figures; added missing reference; accepted for
  publication in MNRAS",,"10.1093/mnras/stx2814",,"astro-ph.HE","http://arxiv.org/licenses/nonexclusive-distrib/1.0/","  We extend our previous study of equilibrium solutions of non-rotating
force-free magnetospheres of neutron stars. We show that multiple solutions
exist for the same sets of parameters, implying that the solutions are
degenerate. We are able to obtain configurations with disconnected field lines,
however, in nearly all cases these correspond to degenerate higher energy
solutions. We carry out a wide parametric search in order to understand the
properties of the solutions. We confirm our previous results that the lower
energy solutions have up to $\sim 25\%$ more energy than the vacuum case,
helicity of the order of $\sim 5$ (in some defined units), maximum twist of
$\sim 1.5$ rad, and a dipole strength that is up to $\sim 40\%$ larger than the
vacuum dipole. Including the degenerate higher energy solutions allows for
larger theoretical limits of up to $\sim 80\%$ more energy with respect to the
vacuum case, helicity of the order of $\sim 8$, and a dipole strength that can
now be up to four times that of the vacuum dipole, while the twist can be
significantly larger and even diverge for configurations with disconnected
domains. The higher energy solutions are probably unstable, therefore, it is
unlikely that such magnetospheres exist under normal conditions in magnetars
and high magnetic field pulsars.
","[{""version"":""v1"",""created"":""Thu, 28 Sep 2017 16:20:58 GMT""},{""version"":""v2"",""created"":""Wed, 10 Oct 2018 16:20:10 GMT""}]","2018-10-11"
