"1709.10381","Lasha Abzianidze","Lasha Abzianidze, Johan Bos","Towards Universal Semantic Tagging","9 pages, International Conference on Computational Semantics (IWCS)",,,,"cs.CL","http://arxiv.org/licenses/nonexclusive-distrib/1.0/","  The paper proposes the task of universal semantic tagging---tagging word
tokens with language-neutral, semantically informative tags. We argue that the
task, with its independent nature, contributes to better semantic analysis for
wide-coverage multilingual text. We present the initial version of the semantic
tagset and show that (a) the tags provide semantically fine-grained
information, and (b) they are suitable for cross-lingual semantic parsing. An
application of the semantic tagging in the Parallel Meaning Bank supports both
of these points as the tags contribute to formal lexical semantics and their
cross-lingual projection. As a part of the application, we annotate a small
corpus with the semantic tags and present new baseline result for universal
semantic tagging.
","[{""version"":""v1"",""created"":""Fri, 29 Sep 2017 12:58:05 GMT""}]","2017-10-02"
"1709.10382","Wei Wang","Wei Wang","On the production of hidden-flavored hadronic states at high energy","5 pages, 1 figure; v2: 12 pages, 7 figures, title changed,
  discussions expanded, conclusion remained, to appear in Chinese Physics C","Chinese Physics C Vol. 42, No. 4 (2018) 043103","10.1088/1674-1137/42/4/043103",,"hep-ph","http://arxiv.org/licenses/nonexclusive-distrib/1.0/","  I discuss the production mechanism of hidden-flavored hadrons at high energy.
Using $e^+e^-$ collisions and light-meson pair production in high energy
exclusive processes, I demonstrate that hidden quark pairs do not necessarily
participate in short-distance hard scattering. Implications are then explored
in a few examples. Finally, I discuss the production mechanism of $X(3872)$ in
hadron collisions, where some misunderstandings have arisen in the literature.
","[{""version"":""v1"",""created"":""Fri, 29 Sep 2017 13:02:39 GMT""},{""version"":""v2"",""created"":""Thu, 5 Oct 2017 14:58:35 GMT""},{""version"":""v3"",""created"":""Wed, 31 Jan 2018 02:31:30 GMT""}]","2018-03-05"
"1709.10383","Ricardo Guti\'errez","Dominic Gribben, Igor Lesanovsky and Ricardo Gutierrez","Quench dynamics of a dissipative Rydberg gas in the classical and
  quantum regime","11 pages, 5 figures","Phys. Rev. A 97, 011603 (2018)","10.1103/PhysRevA.97.011603",,"cond-mat.stat-mech cond-mat.quant-gas quant-ph","http://arxiv.org/licenses/nonexclusive-distrib/1.0/","  Understanding the non-equilibrium behavior of quantum systems is a major goal
of contemporary physics. Much research is currently focused on the dynamics of
many-body systems in low-dimensional lattices following a quench, i.e., a
sudden change of parameters. Already such a simple setting poses substantial
theoretical challenges for the investigation of the real-time post-quench
quantum dynamics. In classical many-body systems the
Kolmogorov-Mehl-Johnson-Avrami model describes the phase transformation
kinetics of a system that is quenched across a first order phase transition.
Here we show that a similar approach can be applied for shedding light on the
quench dynamics of an interacting gas of Rydberg atoms, which has become an
important experimental platform for the investigation of quantum
non-equilibrium effects. We are able to gain an analytic understanding of the
time-evolution following a sudden quench from an initial state devoid of
Rydberg atoms and identify strikingly different behaviors of the excitation
growth in the classical and quantum regimes. Our approach allows us to describe
quenches near a non-equilibrium phase transition and provides an approximate
analytic solution deep in the quantum domain.
","[{""version"":""v1"",""created"":""Fri, 29 Sep 2017 13:03:34 GMT""},{""version"":""v2"",""created"":""Fri, 26 Jan 2018 14:00:56 GMT""}]","2018-01-29"
"1709.10384","Camelia Pop","Donatella Danielli, Arshak Petrosyan, and Camelia A. Pop","Obstacle problems for nonlocal operators",,,,,"math.AP math.PR q-fin.MF","http://arxiv.org/licenses/nonexclusive-distrib/1.0/","  We prove existence, uniqueness, and regularity of viscosity solutions to the
stationary and evolution obstacle problems defined by a class of nonlocal
operators that are not stable-like and may have supercritical drift. We give
sufficient conditions on the coefficients of the operator to obtain H\""older
and Lipschitz continuous solutions. The class of nonlocal operators that we
consider include non-Gaussian asset price models widely used in mathematical
finance, such as Variance Gamma Processes and Regular L\'evy Processes of
Exponential type. In this context, the viscosity solutions that we analyze
coincide with the prices of perpetual and finite expiry American options.
","[{""version"":""v1"",""created"":""Fri, 29 Sep 2017 13:05:32 GMT""},{""version"":""v2"",""created"":""Mon, 2 Oct 2017 16:51:17 GMT""}]","2017-10-03"
"1709.10385","Andrei Igoshev Petrovich","A.P. Igoshev (1) and S.B. Popov (2) ((1) Nijmegen (2) SAI MSU)","How to make a mature accreting magnetar","8 pages, 3 figures, accepted to MNRAS on September 29",,"10.1093/mnras/stx2573",,"astro-ph.HE","http://arxiv.org/licenses/nonexclusive-distrib/1.0/","  Several candidates for accreting magnetars have been proposed recently by
different authors. Existence of such systems contradicts the standard magnetic
field decay scenario where a large magnetic field of a neutron star reaches
$\lesssim$ few$\times 10^{13}$G at ages $\gtrsim 1$ Myr. Among other sources,
the high mass X-ray binary 4U0114+65 seems to have a strong magnetic field
around $10^{14}$ G. We develop a new Bayesian estimate for the kinematic age
and demonstrate that 4U0114+65 has kinematic age 2.4-5 Myr ($95\%$ credential
interval) since the formation of the neutron star. We discuss which conditions
are necessary to explain the potential existence of magnetars in accreting
high-mass binaries with ages about few Myrs and larger. Three necessary
ingredients are: the Hall attractor to prevent rapid decay of dipolar field,
relatively rapid cooling of the crust in order to avoid Ohmic decay due to
phonons, and finally, low values of the parameter $Q$ to obtain long Ohmic time
scale due to impurities. If age and magnetic field estimates for proposed
accreting magnetars are correct, then these systems set the strongest limit on
the crust impurity for a selected sample of neutron stars and provide evidence
in favour of the Hall attractor.
","[{""version"":""v1"",""created"":""Fri, 29 Sep 2017 13:09:48 GMT""}]","2017-11-29"
"1709.10386","Ursula Laa","Ursula Laa","On the coverage of the pMSSM by simplified model results","5 pages. To appear in the proceedings of the European Physical
  Society Conference on High Energy Physics 2017 (EPS-HEP 2017)",,,,"hep-ph hep-ex","http://arxiv.org/licenses/nonexclusive-distrib/1.0/","  ATLAS and CMS have been performing a large number of searches for physics
beyond the Standard Model (BSM). In particular results of supersymmetry (SUSY)
searches are typically interpreted in the context of simplified models. While
mass limits obtained in this manner are highly model dependent, cross section
upper limits (or efficiency maps) may be used to obtain constraints on generic
BSM scenarios without any further event and detector simulation. This procedure
has been automatised in the public tool SModelS, which first decomposes the
generic scenario into its simplified model components which can then be tested
directly against the experimental constraints in the SModelS database. We
briefly introduce SModelS and then discuss how the coverage by simplified model
results compares to what can be obtained in a full simulation study for the
example of the 19 parameter phenomenological MSSM (pMSSM). Considering all
parameter points that ATLAS has tested in a comprehensive study [1], we find
that about 60 % of the points excluded by ATLAS can be excluded from simplified
model constraints. This fraction could be improved by considering currently
`missing' simplified model topologies. We show that in particular topologies
with asymmetric branches are often important, while long cascade decays with
more than one intermediate particle are less relevant. A particularly
interesting asymmetric branch topology is a 3 jet + $E_T^{\mathrm{miss}}$
signature arising from gluino-squark production.
","[{""version"":""v1"",""created"":""Fri, 29 Sep 2017 13:13:27 GMT""}]","2017-10-02"
"1709.10387","Martin Hanke","Martin Hanke","Well-posedness of the Iterative Boltzmann Inversion","17 pages",,"10.1007/s10955-017-1944-2",,"math-ph math.MP","http://arxiv.org/licenses/nonexclusive-distrib/1.0/","  The iterative Boltzmann inversion is an iterative scheme to determine an
effective pair potential for an ensemble of identical particles in thermal
equilibrium from the corresponding radial distribution function. Although the
method is reported to work reasonably well in practice, it still lacks a
rigorous convergence analysis. In this paper we provide some first steps
towards such an analysis, and we show under quite general assumptions that the
algorithm is well-defined in a neighborhood of the true pair potential,
assuming that such a potential exists.
  On our way we establish important properties of the cavity distribution
function and provide a proof of a statement formulated by Groeneveld concerning
the rate of decay at infinity of the Ursell function associated with a
Lennard-Jones type potential.
","[{""version"":""v1"",""created"":""Fri, 29 Sep 2017 13:15:49 GMT""}]","2018-01-17"
"1709.10389","Jean-Marc Schlenker","Hao Chen and Jean-Marc Schlenker","Weakly Inscribed Polyhedra","25 pages, 12 figures. v2: improved exposition, etc. v3: mostly
  updated introduction for clarity",,,,"math.MG math.DG math.GT","http://arxiv.org/licenses/nonexclusive-distrib/1.0/","  We study convex polyhedra in $\mathbb{R}\mathbb{P}^3$ with all their vertices
on a sphere. We do not require, in particular, that the polyhedra lie in the
interior of the sphere, hence the term ""weakly inscribed"". Such polyhedra can
be interpreted as ideal polyhedra, if we regard $\mathbb{R}\mathbb{P}^3$ as a
combination of the hyperbolic space and the de Sitter space, with the sphere as
the common ideal boundary. We have three main results: (1) the $1$-skeleta of
weakly inscribed polyhedra are characterized in a purely combinatorial way, (2)
the exterior dihedral angles are characterized by linear programming, and (3)
we also describe the hyperbolic-de Sitter structure induced on the boundary of
weakly inscribed polyhedra.
","[{""version"":""v1"",""created"":""Fri, 29 Sep 2017 13:21:21 GMT""},{""version"":""v2"",""created"":""Sun, 20 May 2018 06:36:02 GMT""},{""version"":""v3"",""created"":""Tue, 4 Feb 2020 15:16:16 GMT""}]","2020-02-05"
"1709.10390","Maren Ring","Maren H. Ring, Achill Sch\""urmann","Local Formulas for Ehrhart Coefficients from Lattice Tiles","minor corrections, simplified notation",,,,"math.MG","http://arxiv.org/licenses/nonexclusive-distrib/1.0/","  As shown by McMullen in 1983, the coefficients of the Ehrhart polynomial of a
lattice polytope can be written as a weighted sum of facial volumes. The
weights in such a local formula depend only on the outer normal cones of faces,
but are far from being unique. In this paper, we develop an infinite class of
such local formulas. These are based on choices of fundamental domains in
sublattices and obtained by polyhedral volume computations. We hereby also give
a kind of geometric interpretation for the Ehrhart coefficients. Since our
construction gives us a great variety of possible local formulas, these can,
for instance, be chosen to fit well with a given polyhedral symmetry group. In
contrast to other constructions of local formulas, ours does not rely on
triangulations of rational cones into simplicial or even unimodular ones.
","[{""version"":""v1"",""created"":""Fri, 29 Sep 2017 13:22:24 GMT""},{""version"":""v2"",""created"":""Fri, 29 Jun 2018 13:50:16 GMT""},{""version"":""v3"",""created"":""Mon, 4 Mar 2019 13:23:51 GMT""},{""version"":""v4"",""created"":""Mon, 6 May 2019 12:17:37 GMT""}]","2019-05-07"
"1709.10391","Kim Myung-Whun","Purevdorj Munkhbaatar and Kim Myung-Whun","Orbital wave in the Raman scattering cross section of LaMnO3","3 figures","Phys. Rev. B 97, 085101 (2018)","10.1103/PhysRevB.97.085101",,"cond-mat.str-el","http://arxiv.org/licenses/nonexclusive-distrib/1.0/","  We calculated the polarization-dependent Raman scattering cross section
spectra of LaMnO3 below the A-type magnetic ordering temperature. Two strong
peaks appear around the MnO6 octahedra stretching phonon frequency. One mode
shows Ag symmetry, while the other mode shows Bg symmetry. We found that the Ag
symmetry peak is a Jahn-Teller phonon coupled to the orbital wave and the Bg
symmetry peak is an orbital wave coupled to a Q2 phonon mode via the
Jahn-Teller electron phonon coupling.
","[{""version"":""v1"",""created"":""Fri, 29 Sep 2017 13:22:34 GMT""}]","2018-02-07"
"1709.10392","Vitorio A. De Lorenci","G. H. Camargo, V. A. De Lorenci, C. C. H. Ribeiro, F. F. Rodrigues,
  and M. M. Silva","Vacuum fluctuations of a scalar field near a reflecting boundary and
  their effects on the motion of a test particle","17 pages, 8 figures","JHEP07(2018)173","10.1007/JHEP07(2018)173",,"hep-th quant-ph","http://arxiv.org/licenses/nonexclusive-distrib/1.0/","  The contribution from quantum vacuum fluctuations of a real massless scalar
field to the motion of a test particle that interacts with the field in the
presence of a perfectly reflecting flat boundary is here investigated. There is
no quantum induced dispersions on the motion of the particle when it is alone
in the empty space. However, when a reflecting wall is introduced, dispersions
occur with magnitude dependent on how fast the system evolves between the two
scenarios. A possible way of implementing this process would be by means of an
idealized sudden switching, for which the transition occurs instantaneously.
Although the sudden process is a simple and mathematically convenient
idealization it brings some divergences to the results, particularly at a time
corresponding to a round trip of a light signal between the particle and the
wall. It is shown that the use of smooth switching functions, besides
regularizing such divergences, enables us to better understand the behavior of
the quantum dispersions induced on the motion of the particle. Furthermore, the
action of modifying the vacuum state of the system leads to a change in the
particle energy that depends on how fast the transition between these states is
implemented. Possible implications of these results to the similar case of an
electric charge near a perfectly conducting wall are discussed.
","[{""version"":""v1"",""created"":""Fri, 29 Sep 2017 13:22:51 GMT""},{""version"":""v2"",""created"":""Thu, 2 Aug 2018 14:46:47 GMT""}]","2018-08-03"
"1709.10397","Katarzyna Grebieszkow","Katarzyna Grebieszkow (for the NA61/SHINE Collaboration)","New results on fluctuations and correlations from the NA61/SHINE
  experiment at the CERN SPS","proceedings from The European Physical Society Conference on High
  Energy Physics (EPS-HEP 2017), 5-12 July 2017, Venice, Italy",,,,"nucl-ex hep-ex","http://arxiv.org/licenses/nonexclusive-distrib/1.0/","  The exploration of the QCD phase diagram is the most important task of
present heavy ion experiments. In particular, we want to study the phase
transition from hadronic to partonic matter and look for the critical point
(CP) of strongly interacting matter. Fluctuations and correlations in kinematic
characteristics and particle yields may help to locate the CP (in analogy to
enlarged fluctuations due to critical opalescence close to a CP in a liquid/gas
transition). The strong interactions program of the NA61/SHINE experiment may
allow to discover or rule out the existence of the CP in the Super Proton
Synchrotron energy domain. For this purpose we perform a two-dimensional scan
by varying the energy ($5.1 < \sqrt{s_{NN}} < 16.8/17.3$ GeV) and the system
size (p+p, p+Pb, Be+Be, Ar+Sc, Xe+La, Pb+Pb) of the collisions.
  In this report new NA61/SHINE results on fluctuations and correlations in
p+p, Be+Be, and Ar+Sc collisions are presented. In particular, results on
transverse momentum and multiplicity fluctuations, as well as higher order
moments of net-charge fluctuations are discussed. The NA61/SHINE data are
compared to predictions of string hadronic models and to NA49 results.
","[{""version"":""v1"",""created"":""Fri, 29 Sep 2017 13:28:32 GMT""}]","2019-08-14"
"1709.10398","Ian Crossfield","David R. Ciardi, Ian J. M. Crossfield, Adina D. Feinstein, Joshua E.
  Schlieder, Erik A. Petigura, Trevor J. David, Makennah Bristow, Rahul I.
  Patel, Lauren Arnold, Bj\""orn Benneke, Jessie L. Christiansen, Courtney D.
  Dressing, Benjamin J. Fulton, Andrew W. Howard, Howard Isaacson, Evan
  Sinukoff, Beverly Thackeray","K2-136: A Hyades Binary Star with a Neptune-sized Planet","13 pages, 8 figures, 2 tables. Accepted to AAS Journals",,"10.3847/1538-3881/aa9921",,"astro-ph.EP","http://arxiv.org/licenses/nonexclusive-distrib/1.0/","  We report the discovery of a Neptune-size planet (Rp = 3.0 Re) in the Hyades
Cluster. The host star is in a binary system, comprising a K5V star and M7/8V
star with a projected separation of 40 AU. The planet orbits the primary star
with an orbital period of 17.3 days and a transit duration of 3 hours. The host
star is bright (V=11.2, J=9.1) and so may be a good target for precise radial
velocity measurements. K2-136A c is the first Neptune-sized planet to be found
orbiting in a binary system within an open cluster. The Hyades is the nearest
star cluster to the Sun, has an age of 625-750 Myr, and forms one of the
fundamental rungs in the distance ladder; understanding the planet population
in such a well-studied cluster can help us understand and set constraints on
the formation and evolution of planetary systems.
","[{""version"":""v1"",""created"":""Fri, 29 Sep 2017 13:29:07 GMT""},{""version"":""v2"",""created"":""Mon, 6 Nov 2017 18:07:37 GMT""}]","2018-03-07"
"1709.10400","Erik Tellgren","Erik I. Tellgren, Andre Laestadius, Trygve Helgaker, Simen Kvaal and
  Andrew M. Teale","Uniform magnetic fields in density-functional theory",,,"10.1063/1.5007300",,"physics.chem-ph cond-mat.mtrl-sci physics.comp-ph","http://arxiv.org/licenses/nonexclusive-distrib/1.0/","  We construct a density-functional formalism adapted to uniform external
magnetic fields that is intermediate between conventional Density Functional
Theory and Current-Density Functional Theory (CDFT). In the intermediate
theory, which we term LDFT, the basic variables are the density, the canonical
momentum, and the paramagnetic contribution to the magnetic moment. Both a
constrained-search formulation and a convex formulation in terms of
Legendre--Fenchel transformations are constructed. Many theoretical issues in
CDFT find simplified analogues in LDFT. We prove results concerning
$N$-representability, Hohenberg--Kohn-like mappings, existence of minimizers in
the constrained-search expression, and a restricted analogue to gauge
invariance. The issue of additivity of the energy over non-interacting
subsystems, which is qualitatively different in LDFT and CDFT, is also
discussed.
","[{""version"":""v1"",""created"":""Fri, 29 Sep 2017 13:33:21 GMT""}]","2018-02-14"
"1709.10402","Krishna Dasaratha","Krishna Dasaratha","Distributions of Centrality on Networks",,"Games and Economic Behavior, Vol. 122, July 2020, 1-27","10.1016/j.geb.2020.03.008",,"cs.SI physics.soc-ph q-fin.EC","http://arxiv.org/licenses/nonexclusive-distrib/1.0/","  We provide a framework for determining the centralities of agents in a broad
family of random networks. Current understanding of network centrality is
largely restricted to deterministic settings, but practitioners frequently use
random network models to accommodate data limitations or prove asymptotic
results. Our main theorems show that on large random networks, centrality
measures are close to their expected values with high probability. We
illustrate the economic consequences of these results by presenting three
applications: (1) In network formation models based on community structure
(called stochastic block models), we show network segregation and differences
in community size produce inequality. Benefits from peer effects tend to accrue
disproportionately to bigger and better-connected communities. (2) When link
probabilities depend on geography, we can compute and compare the centralities
of agents in different locations. (3) In models where connections depend on
several independent characteristics, we give a formula that determines
centralities 'characteristic-by-characteristic'. The basic techniques from
these applications, which use the main theorems to reduce questions about
random networks to deterministic calculations, extend to many network games.
","[{""version"":""v1"",""created"":""Fri, 29 Sep 2017 13:34:03 GMT""},{""version"":""v2"",""created"":""Thu, 25 Jan 2018 00:01:21 GMT""},{""version"":""v3"",""created"":""Wed, 22 Aug 2018 19:48:00 GMT""},{""version"":""v4"",""created"":""Mon, 10 Jun 2019 15:24:40 GMT""}]","2022-02-07"
"1709.10404","Maha Saeed","Maha Mohammed Saeed","Countable Normality","No comments",,,,"math.GN","http://arxiv.org/licenses/nonexclusive-distrib/1.0/","  A. V. Arhangel'ski\u{i} introduced in 2012, when he was visiting the
department of Mathematics at King Abduaziz University, new weaker versions of
normality, called \it $C$-normality, \rm and \it countable normality. \rm The
purpose of this paper is to investigate countable normality property. We prove
that normality implies countable normality but the converse is not true in
general. We present some examples to show relationships between countable
normality and other weaker versions of normality such as $C$-normality,
$L$-noramlity, and mild normality. We answer the following open problem of
Arhangel'ski\u{i}: ""Is there a Tychonoff space which is not $C$-normal ?"".
  Throughout this paper, we denote an ordered pair by $\langle x,y\rangle$, the
set of positive integers by $\mathbb{N}$ and the set of real numbers by
$\mathbb{R}$. A $T_4$ space is a $T_1$ normal space, a Tychonoff space is a
$T_1$ completely regular space, and a $T_3$ space is a $T_1$ regular space. We
do not assume $T_2$ in the definition of compactness and we do not assume
regularity in the definition of Lindel\""ofness. For a subset $A$ of a space
$X$, ${\rm int} A$ and $\overline{A}$ denote the interior and the closure of
$A$, respectively. An ordinal $\gamma$ is the set of all ordinals $\alpha$ such
that $\alpha<\gamma$. The first infinite ordinal is $\omega_0$, the first
uncountable ordinal is $\omega_1$, and the successor cardinal of $\omega_1$ is
$\omega_2$.
","[{""version"":""v1"",""created"":""Fri, 29 Sep 2017 13:34:42 GMT""}]","2017-10-02"
"1709.10405","Jan-Hendrik Lorenz","Jan-Hendrik Lorenz","Runtime Distributions and Criteria for Restarts",,"SOFSEM 2018: Theory and Practice of Computer Science. SOFSEM 2018.
  Lecture Notes in Computer Science, vol 10706, (2018), 493-507","10.1007/978-3-319-73117-9_35",,"cs.DS","http://arxiv.org/licenses/nonexclusive-distrib/1.0/","  Randomized algorithms sometimes employ a restart strategy. After a certain
number of steps, the current computation is aborted and restarted with a new,
independent random seed. In some cases, this results in an improved overall
expected runtime. This work introduces properties of the underlying runtime
distribution which determine whether restarts are advantageous. The most
commonly used probability distributions admit the use of a scale and a location
parameter. Location parameters shift the density function to the right, while
scale parameters affect the spread of the distribution. It is shown that for
all distributions scale parameters do not influence the usefulness of restarts
and that location parameters only have a limited influence. This result
simplifies the analysis of the usefulness of restarts. The most important
runtime probability distributions are the log-normal, the Weibull, and the
Pareto distribution. In this work, these distributions are analyzed for the
usefulness of restarts. Secondly, a condition for the optimal restart time (if
it exists) is provided. The log-normal, the Weibull, and the generalized Pareto
distribution are analyzed in this respect. Moreover, it is shown that the
optimal restart time is also not influenced by scale parameters and that the
influence of location parameters is only linear.
","[{""version"":""v1"",""created"":""Fri, 29 Sep 2017 13:39:39 GMT""}]","2019-04-29"
