"1709.10241","Seung Ki Baek","Seung Ki Baek and Beom Jun Kim","Free energy of a chemotactic model with nonlinear diffusion","14 pages, 6 figures","Sci. Rep. 7, 8909 (2017)","10.1038/s41598-017-09369-w",,"cond-mat.stat-mech physics.bio-ph","http://arxiv.org/licenses/nonexclusive-distrib/1.0/","  The Patlak-Keller-Segel equation is a canonical model of chemotaxis to
describe self-organized aggregation of organisms interacting with chemical
signals. We investigate a variant of this model, assuming that the organisms
exert effective pressure proportional to the number density. From the resulting
set of partial differential equations, we derive a Lyapunov functional that can
also be regarded as the free energy of this model, and minimize it with a Monte
Carlo method to detect the condition for self-organized aggregation. Focusing
on radially symmetric solutions on a two-dimensional disc, we find that the
chemical interaction competes with diffusion so that aggregation occurs when
the relative interaction strength exceeds a certain threshold. Based on the
analysis of the free-energy landscape, we argue that the transition from a
homogeneous state to aggregation is abrupt yet continuous.
","[{""version"":""v1"",""created"":""Fri, 29 Sep 2017 05:43:23 GMT""},{""version"":""v2"",""created"":""Fri, 27 Oct 2017 12:17:28 GMT""}]","2017-10-30"
"1709.10242","Liu Feng","Feng Liu, Yong Shi, Ying Liu","Intelligence Quotient and Intelligence Grade of Artificial Intelligence",,"Annals of Data Science, June 2017, Volume 4, Issue 2, pp 179-191","10.1007/s40745-017-0109-0",,"cs.AI","http://arxiv.org/licenses/nonexclusive-distrib/1.0/","  Although artificial intelligence is currently one of the most interesting
areas in scientific research, the potential threats posed by emerging AI
systems remain a source of persistent controversy. To address the issue of AI
threat, this study proposes a standard intelligence model that unifies AI and
human characteristics in terms of four aspects of knowledge, i.e., input,
output, mastery, and creation. Using this model, we observe three challenges,
namely, expanding of the von Neumann architecture; testing and ranking the
intelligence quotient of naturally and artificially intelligent systems,
including humans, Google, Bing, Baidu, and Siri; and finally, the dividing of
artificially intelligent systems into seven grades from robots to Google Brain.
Based on this, we conclude that AlphaGo belongs to the third grade.
","[{""version"":""v1"",""created"":""Fri, 29 Sep 2017 05:43:39 GMT""},{""version"":""v2"",""created"":""Wed, 4 Oct 2017 16:33:07 GMT""}]","2017-10-05"
"1709.10243","Seung Ki Baek","Seung Ki Baek, Su Do Yi, and Hyeong-Chai Jeong","Duality between cooperation and defection in the presence of tit-for-tat
  in replicator dynamics","11 pages, 8 figures","J. Theor. Biol. 430, 215 (2017)","10.1016/j.jtbi.2017.07.026",,"q-bio.PE nlin.AO","http://arxiv.org/licenses/nonexclusive-distrib/1.0/","  The prisoner's dilemma describes a conflict between a pair of players, in
which defection is a dominant strategy whereas cooperation is collectively
optimal. The iterated version of the dilemma has been extensively studied to
understand the emergence of cooperation. In the evolutionary context, the
iterated prisoner's dilemma is often combined with population dynamics, in
which a more successful strategy replicates itself with a higher growth rate.
Here, we investigate the replicator dynamics of three representative
strategies, i.e., unconditional cooperation, unconditional defection, and
tit-for-tat, which prescribes reciprocal cooperation by mimicking the
opponent's previous move. Our finding is that the dynamics is self-dual in the
sense that it remains invariant when we apply time reversal and exchange the
fractions of unconditional cooperators and defectors in the population. The
duality implies that the fractions can be equalized by tit-for-tat players,
although unconditional cooperation is still dominated by defection.
Furthermore, we find that mutation among the strategies breaks the exact
duality in such a way that cooperation is more favored than defection, as long
as the cost-to-benefit ratio of cooperation is small.
","[{""version"":""v1"",""created"":""Fri, 29 Sep 2017 05:50:35 GMT""}]","2017-10-02"
"1709.10244","Yiwei Li","Yiwei Li, Osman Kahraman, Christoph A. Haselwandter","Distribution of randomly diffusing particles in inhomogeneous media","8 figures","Phys. Rev. E, 96:032139, 2017","10.1103/PhysRevE.96.032139",,"physics.bio-ph","http://arxiv.org/licenses/nonexclusive-distrib/1.0/","  Diffusion can be conceptualized, at microscopic scales, as the random hopping
of particles between neighboring lattice sites. In the case of diffusion in
inhomogeneous media, distinct spatial domains in the system may yield distinct
particle hopping rates. Starting from the master equations (MEs) governing
diffusion in inhomogeneous media we derive here, for arbitrary spatial
dimensions, the deterministic lattice equations (DLEs) specifying the average
particle number at each lattice site for randomly diffusing particles in
inhomogeneous media. We consider the case of free diffusion with no steric
constraints on the maximum particle number per lattice site as well as the case
of diffusion under steric constraints imposing a maximum particle
concentration. We find, for both transient and asymptotic regimes, excellent
agreement between the DLEs and kinetic Monte Carlo simulations of the MEs. The
DLEs provide a computationally efficient method for predicting the (average)
distribution of randomly diffusing particles in inhomogeneous media, with the
number of DLEs associated with a given system being independent of the number
of particles in the system. From the DLEs we obtain general analytic
expressions for the steady-state particle distributions for free diffusion and,
in special cases, diffusion under steric constraints in inhomogeneous media. We
find that, in the steady state of the system, the average fraction of particles
in a given domain is independent of most system properties, such as the
arrangement and shape of domains, and only depends on the number of lattice
sites in each domain, the hopping rates, the number of distinct particle
species, and the total number of particles of each particle species in the
system. Our results provide general insights into the role of spatially
inhomogeneous particle hopping rates in setting the particle distributions in
inhomogeneous media.
","[{""version"":""v1"",""created"":""Fri, 29 Sep 2017 05:52:14 GMT""}]","2017-10-02"
"1709.10245","Qihang Liu","Xiaoqing Zhou, Qihang Liu, QuanSheng Wu, Tom Nummy, Haoxiang Li,
  Justin Griffith, Stephen Parham, Justin Waugh, Eve Emmanouilidou, Bing Shen,
  Oleg V. Yazyev, Ni Ni, and Daniel Dessau","Coexistence of Tunable Weyl Points and Topological Nodal Lines in
  Ternary Transition-Metal Telluride TaIrTe4","14 pages, 4 figures","Phys. Rev. B 97, 241102 (2018)","10.1103/PhysRevB.97.241102",,"cond-mat.mtrl-sci","http://arxiv.org/licenses/nonexclusive-distrib/1.0/","  We report a combined theoretical and experimental study on TaIrTe4, a
potential candidate of the minimal model of type-II Weyl semimetals.
Unexpectedly, an intriguing node structure with twelve Weyl points and a pair
of nodal lines protected by mirror symmetry was found by first-principle
calculations, with its complex signatures such as the topologically non-trivial
band crossings and topologically trivial Fermi arcs cross-validated by
angle-resolved photoemission spectroscopy. Through external strain, the number
of Weyl points can be reduced to the theoretical minimum of four, and the
appearance of the nodal lines can be switched between different mirror planes
in momentum space. The coexistence of tunable Weyl points and nodal lines
establishes ternary transition-metal tellurides as a unique test ground for
topological state characterization and engineering.
","[{""version"":""v1"",""created"":""Fri, 29 Sep 2017 06:08:44 GMT""}]","2018-06-13"
"1709.10246","Pranav Kumar Jha","Pranav Kumar Jha, S Sushmitha Shree and D. Sriram Kumar","An Opportunistic-Non Orthogonal Multiple Access based Cooperative
  Relaying system over Rician Fading Channels","arXiv admin note: substantial text overlap with arXiv:1709.08224",,,,"eess.SP cs.IT math.IT","http://arxiv.org/licenses/nonexclusive-distrib/1.0/","  Non-orthogonal Multiple Access (NOMA) has become a salient technology for
improving the spectral efficiency of the next generation 5G wireless
communication networks. In this paper, the achievable average rate of an
Opportunistic Non-Orthogonal Multiple Access (O-NOMA) based Cooperative
Relaying System (CRS) is studied under Rician fading channels with Channel
State Information (CSI) available at the source terminal. Based on CSI, for
opportunistic transmission, the source immediately chooses either the direct
transmission or the cooperative NOMA transmission using the relay, which can
provide better achievable average rate performance than the existing
Conventional-NOMA (C-NOMA) based CRS with no CSI at the source node.
Furthermore, a mathematical expression is also derived for the achievable
average rate and the results are compared with C-NOMA based CRS with no CSI at
the transmitter end, over a range of increasing power allocation coefficients,
transmit Signal-to-Noise Ratios (SNRs) and average channel powers. Numerical
results show that the CRS using O-NOMA with CSI achieves better spectral
efficiency in terms of the achievable average rate than the Conventional-NOMA
based CRS without CSI. To check the consistency of the derived analytical
results, Monte Carlo simulations are performed which verify that the results
are consistent and matched well with the simulation results.
","[{""version"":""v1"",""created"":""Fri, 29 Sep 2017 06:11:17 GMT""},{""version"":""v2"",""created"":""Tue, 3 Oct 2017 13:02:12 GMT""},{""version"":""v3"",""created"":""Thu, 12 Oct 2017 10:17:32 GMT""},{""version"":""v4"",""created"":""Wed, 13 Dec 2017 11:21:41 GMT""},{""version"":""v5"",""created"":""Thu, 28 Dec 2017 13:59:58 GMT""},{""version"":""v6"",""created"":""Fri, 29 Dec 2017 18:05:01 GMT""},{""version"":""v7"",""created"":""Mon, 15 Jan 2018 17:57:55 GMT""}]","2018-01-16"
"1709.10247","Juan Li","Juan Li, Zhiqiang Shen, Junzhi Wang, Xi Chen, Di Li, Yajun Wu, Jian
  Dong, Rongbing Zhao, Wei Gou, Jinqing Wang, Shanghuo Li, Bingru Wang, Xingwu
  Zheng","Widespread Presence of Glycolaldehyde and Ethylene Glycol Around
  Sagittarius B2","20 pages, 7 figures, accepted by ApJ",,"10.3847/1538-4357/aa9069",,"astro-ph.GA astro-ph.SR","http://arxiv.org/licenses/nonexclusive-distrib/1.0/","  We report the detection of widespread CH$_2$OHCHO and HOCH$_2$CH$_2$OH
emission in Galactic center giant molecular cloud Sagittarius B2 using the
Shanghai Tianma 65m Radio Telescope. Our observations show for the first time
that the spatial distribution of these two important prebiotic molecules
extends over 15 arc-minutes, corresponding to a linear size of approximately 36
pc. These two molecules are not just distributed in or near the hot cores. The
abundance of these two molecules seems to decrease from the cold outer region
to the central region associated with star-formation activity. Results present
here suggest that these two molecules are likely to form through a low
temperature process. Recent theoretical and experimental studies demonstrated
that prebiotic molecules can be efficiently formed in icy grain mantles through
several pathways. However, these complex ice features cannot be directly
observed, and most constraints on the ice compositions come from millimeter
observations of desorbed ice chemistry products. These results, combined with
laboratory studies, strongly support the existence of abundant prebiotic
molecules in ices.
","[{""version"":""v1"",""created"":""Fri, 29 Sep 2017 06:14:15 GMT""}]","2017-11-15"
"1709.10248","Patrick Purdon","Patrick A. Stokes and Patrick L. Purdon","In reply to Faes et al. and Barnett et al. regarding ""A study of
  problems encountered in Granger causality analysis from a neuroscience
  perspective""",,,,,"stat.ME q-bio.NC","http://arxiv.org/licenses/nonexclusive-distrib/1.0/","  This reply is in response to commentaries by Barnett, Barrett, and Seth
(arXiv:1708.08001) and Faes, Stramaglia, and Marinazzo (arXiv:1708.06990) on
our paper entitled ""A study of problems encountered in Granger causality
analysis from a neuroscience perspective."" (PNAS 114(34):7063-7072. 2017). In
our paper, we analyzed several properties of Granger-Geweke causality (GGC) and
discussed potential problems in neuroscience applications. We demonstrated: (i)
that GGC, estimated using separate model fits, is either severely biased,
particularly when the true model is known, or a high variance is introduced to
overcome the bias; and (ii) that GGC does not reflect some component dynamics
of the system. The commentaries by both Faes et al. and Barnett et al. point
out that the computational problems of (i) are resolved by using recent
computational methods. We acknowledge that these problems are indeed resolved
by these methods. However, the traditional computation using separate model
fits continues to be presented and applied. More fundamentally, the
interpretational problems stemming from (ii) are not in anyway addressed by the
improved methods because they are inherent to the definition of GGC. These
properties are indeed acknowledged by both commentaries. We have no
misconception of the GGC measure and do not claim that these properties are
facially wrong. But we do discuss at length how these properties make it
inappropriate and misleading for common types of scientific questions, how
presentation of GGC results without model estimates are not decipherable, and
how the absence of clear statements of questions of interest present further
opportunities for misinterpretation.
","[{""version"":""v1"",""created"":""Fri, 29 Sep 2017 06:19:45 GMT""}]","2017-10-02"
"1709.10249","Hongbae Ann","Hong Bae Ann","Morphology of Dwarf Galaxies in Isolated Satellite Systems","14 pages, 8 figures","Journal of the Korean Astronomical Society, vol. 50, no. 4, pp.
  111-124 (2017)","10.5303/JKAS.2017.50.4.111",,"astro-ph.GA","http://arxiv.org/licenses/nonexclusive-distrib/1.0/","  The environmental dependence of the morphology of dwarf galaxies in isolated
satellite systems is analyzed to understand the origin of the dwarf galaxy
morphology using the visually classified morphological types of 5836 local
galaxies with $z \lesssim 0.01$. We consider six sub-types of dwarf galaxies,
dS0, dE, dE$_{bc}$, dSph, dE$_{blue}$, and dI, of which the first four
sub-types are considered as early-type and the last two as late-type. The
environmental parameters we consider are the projected distance from the host
galaxy ($r_{p}$), local and global background densities, and the host
morphology. The spatial distributions of dwarf satellites of early-type
galaxies are much different from those of dwarf satellites of late-type
galaxies, suggesting the host morphology combined with $r_{p}$ plays a decisive
role on the morphology of the dwarf satellite galaxies. The local and global
background densities play no significant role on the morphology of dwarfs in
the satellite systems hosted by early-type galaxies. However, in the satellite
system hosted by late-type galaxies, the global background densities of dE and
dSph satellites are significantly different from those of dE$_{bc}$,
dE$_{blue}$, and dI satellites. The blue-cored dwarf satellites (dE$_{bc}$) of
early-type galaxies are likely to be located at $r_{p} > 0.3$ Mpc to keep their
cold gas from the ram pressure stripping by the hot corona of early-type
galaxies. The spatial distribution of dE$_{bc}$ satellites of early-type
galaxies and their global background densities suggest that their cold gas is
intergalactic material accreted before they fall into the satellite systems.
","[{""version"":""v1"",""created"":""Fri, 29 Sep 2017 06:35:06 GMT""}]","2017-10-04"
"1709.10250","Aaditya Ramdas","Aaditya Ramdas, Jianbo Chen, Martin J. Wainwright, Michael I. Jordan","DAGGER: A sequential algorithm for FDR control on DAGs","29 pages, 10 figures, accepted for publication by Biometrika",,,,"stat.ME cs.LG math.ST stat.ML stat.TH","http://arxiv.org/licenses/nonexclusive-distrib/1.0/","  We propose a linear-time, single-pass, top-down algorithm for multiple
testing on directed acyclic graphs (DAGs), where nodes represent hypotheses and
edges specify a partial ordering in which hypotheses must be tested. The
procedure is guaranteed to reject a sub-DAG with bounded false discovery rate
(FDR) while satisfying the logical constraint that a rejected node's parents
must also be rejected. It is designed for sequential testing settings, when the
DAG structure is known a priori, but the $p$-values are obtained selectively
(such as in a sequence of experiments), but the algorithm is also applicable in
non-sequential settings when all $p$-values can be calculated in advance (such
as variable/model selection). Our DAGGER algorithm, shorthand for Greedily
Evolving Rejections on DAGs, provably controls the false discovery rate under
independence, positive dependence or arbitrary dependence of the $p$-values.
The DAGGER procedure specializes to known algorithms in the special cases of
trees and line graphs, and simplifies to the classical Benjamini-Hochberg
procedure when the DAG has no edges. We explore the empirical performance of
DAGGER using simulations, as well as a real dataset corresponding to a gene
ontology, showing favorable performance in terms of time and power.
","[{""version"":""v1"",""created"":""Fri, 29 Sep 2017 06:38:11 GMT""},{""version"":""v2"",""created"":""Tue, 10 Oct 2017 01:21:47 GMT""},{""version"":""v3"",""created"":""Tue, 4 Dec 2018 20:06:02 GMT""}]","2018-12-06"
"1709.10251","Yoon-Gu Kang","Yoon-Gu Kang, Sun-Woo Kim, and Jun-Hyung Cho","Competing charge density wave and antiferromagnetism of metallic atom
  wires in GaN(10${\overline{1}}$0) and ZnO(10${\overline{1}}$0)","7 pages, 6 figures","Phys. Rev. B 96, 235416 (2017)","10.1103/PhysRevB.96.235416",,"cond-mat.mtrl-sci cond-mat.mes-hall","http://arxiv.org/licenses/nonexclusive-distrib/1.0/","  Low-dimensional electron systems often show a delicate interplay between
electron-phonon and electron-electron interactions, giving rise to interesting
quantum phases such as the charge density wave (CDW) and magnetism. Using the
density-functional theory (DFT) calculations with the semilocal and hybrid
exchange-correlation functionals as well as the exact-exchange plus correlation
in the random-phase approximation (EX + cRPA), we systematically investigate
the ground state of the metallic atom wires containing dangling-bond (DB)
electrons, fabricated by partially hydrogenating the GaN(10${\overline{1}}$0)
and ZnO(10${\overline{1}}$0) surfaces. We find that the CDW or
antiferromagnetic (AFM) order has an electronic energy gain due to a band-gap
opening, thereby being more stabilized compared to the metallic state. Our
semilocal DFT calculation predicts that both DB wires in
GaN(10${\overline{1}}$0) and ZnO(10${\overline{1}}$0) have the same CDW ground
state, whereas the hybrid DFT and EX+cRPA calculations predict the AFM ground
state for the former DB wire and the CDW ground state for the latter one. It is
revealed that more localized Ga DB electrons in GaN(10${\overline{1}}$0) prefer
the AFM order, while less localized Zn DB electrons in ZnO(10${\overline{1}}$0)
the CDW formation. Our findings demonstrate that the drastically different
ground states are competing in the DB wires created on the two representative
compound semiconductor surfaces.
","[{""version"":""v1"",""created"":""Fri, 29 Sep 2017 06:50:42 GMT""},{""version"":""v2"",""created"":""Sat, 2 Dec 2017 06:38:36 GMT""}]","2017-12-20"
"1709.10252","Xun-Jie Xu","Manfred Lindner, Werner Rodejohann and Xun-Jie Xu","Neutrino Parameters from Reactor and Accelerator Neutrino Experiments","16pages, 9 figures, matches the version to be published in PRD","Phys. Rev. D 97, 075024 (2018)","10.1103/PhysRevD.97.075024",,"hep-ph hep-ex","http://arxiv.org/licenses/nonexclusive-distrib/1.0/","  We revisit correlations of neutrino oscillation parameters in reactor and
long-baseline neutrino oscillation experiments. A framework based on an
effective value of $\theta_{13}$ is presented, which can easily reproduce
experimental results. It also clarifies why current and future long-baseline
experiments will have less precision on values around $\delta_{CP} = \pm \pi/2$
than on values around $\delta_{CP} = 0$. Optimization potential for the
determination of the theoretically very interesting values around $\delta_{CP}
= -\pi/2$ is also pointed out, which would require that future runs of
accelerator experiments are not equally shared $1:1$ in neutrino and
antineutrino modes, but rather $2:1$. Recent hints on the CP phase and the mass
ordering are then considered from the point of view that different reactor and
long-baseline neutrino experiments provide currently different best-fit values
of $\theta_{13}$ and $\theta_{23}$. We point out that the significance of the
hints changes for the different available best-fit values.
","[{""version"":""v1"",""created"":""Fri, 29 Sep 2017 06:50:43 GMT""},{""version"":""v2"",""created"":""Sat, 7 Apr 2018 20:13:57 GMT""}]","2018-04-25"
"1709.10253","Yorick Hardy","Yorick Hardy","Partial determinants of Kronecker products",,,,,"math.RA","http://arxiv.org/licenses/nonexclusive-distrib/1.0/","  Let $\det_2(A)$ be the block-wise determinant (partial determinant). We
consider the condition for completing the determinant $\det(\det_2(A)) =
\det(A),$ and characterize the case for an arbitrary Kronecker product $A$ of
matrices over an arbitrary field. Further insisting that
$\det_2(AB)=\det_2(A)\det_2(B)$, for Kronecker products $A$ and $B$, yields a
multiplicative monoid of matrices. This leads to a determinant-root operation
$\text{Det}$ which satisfies $\text{Det}(\text{Det}_2(A)) = \text{Det}(A)$ when
$A$ is a Kronecker product of matrices for which $\text{Det}$ is defined.
","[{""version"":""v1"",""created"":""Fri, 29 Sep 2017 06:54:12 GMT""},{""version"":""v2"",""created"":""Fri, 12 Jan 2018 09:01:33 GMT""}]","2018-01-15"
"1709.10254","Noam Ravid","Noam Ravid, Dori Medini and Benny Kimelfeld","Ranked Enumeration of Minimal Triangulations","15 pages, 9 figures",,,,"cs.DS","http://arxiv.org/licenses/nonexclusive-distrib/1.0/","  A tree decomposition of a graph facilitates computations by grouping vertices
into bags that are interconnected in an acyclic structure, hence their
importance in a plethora of problems such as query evaluation over databases
and inference over probabilistic graphical models. The relative benefit from
different tree decompositions is measured by diverse (sometime complex) cost
functions that vary from one application to another. For generic cost functions
like width and fill-in, an optimal tree decomposition can be efficiently
computed in some cases, notably when the number of minimal separators is
bounded by a polynomial (due to Bouchitte and Todinca), we refer to this
assumption as ""poly-MS."" To cover the variety of cost functions in need, it has
recently been proposed to devise algorithms for enumerating many decomposition
candidates for applications to choose from using specialized, or even
machine-learned, cost functions.
  We explore the ability to produce a large collection of ""high quality"" tree
decompositions. We present the first algorithm for ranked enumeration of the
proper (non-redundant) tree decompositions, or equivalently minimal
triangulations, under a wide class of cost functions that substantially
generalizes the above generic ones. On the theoretical side, we establish the
guarantee of polynomial delay if poly-MS is assumed, or if we are interested in
tree decompositions of a width bounded by a constant. We describe an
experimental evaluation on graphs of various domains (including join queries,
Bayesian networks, treewidth benchmarks and random), and explore both the
applicability of the poly-MS assumption and the performance of our algorithm
relative to the state of the art.
","[{""version"":""v1"",""created"":""Fri, 29 Sep 2017 06:58:26 GMT""},{""version"":""v2"",""created"":""Sun, 7 Oct 2018 11:27:57 GMT""}]","2018-10-09"
"1709.10255","Victor Rivera","Kizilov Mikhail, Antonio Bucchiarone, Manuel Mazzara, Larisa Safina,
  Victor Rivera","Domain Objects and Microservices for Systems Development: a roadmap",,"Advances in Intelligent Systems and Computing, 2018","10.1007/978-3-319-70578-1_10",,"cs.SE","http://arxiv.org/licenses/nonexclusive-distrib/1.0/","  This paper discusses a roadmap to investigate Domain Objects being an
adequate formalism to capture the peculiarity of microservice architecture, and
to support Software development since the early stages. It provides a survey of
both Microservices and Domain Objects, and it discusses plans and reflections
on how to investigate whether a modeling approach suited to adaptable
service-based components can also be applied with success to the microservice
scenario.
","[{""version"":""v1"",""created"":""Fri, 29 Sep 2017 07:04:08 GMT""}]","2019-04-22"
