"1706.05625","Huanhai Xin","Huanhai Xin, Ziheng Li, Wei Dong, Leiqi Zhang, Zhen Wang and Jian Zhao","Generalized-impedance and Stability Criterion for Grid-connected
  Converters","11 pages",,,,"cs.SY","http://arxiv.org/licenses/nonexclusive-distrib/1.0/","  The output impedance matrix of a grid-connected converter plays an important
role in analyzing system stability. Due to the dynamics of the DC-link control
and the phase locked loop (PLL), the output impedance matrices of the converter
and grid are difficult to be diagonally decoupled simultaneously, neither in
the dq domain nor in the phase domain. It weakens the effectiveness of
impedance-based stability criterion (ISC) in system oscillation analysis. To
this end, this paper innovatively proposes the generalized-impedance based
stability criterion (GISC) to reduce the dimension of the transfer function
matrix and simplify system small-signal stability analysis. Firstly, the
impedances of the converter and the grid in polar coordinates are formulated,
and the concept of generalized-impedance of the converter and the grid is put
forward. Secondly, through strict mathematical derivation, the equation that
implies the dynamic interaction between the converter and the grid is then
extracted from the characteristic equation of the grid-connected converter
system. Using the proposed method, the small-signal instability of system can
be interpreted as the resonance of the generalized-impedances of the converter
and the grid. Besides, the GISC is equivalent to ISC when the dynamics of the
outer-loop control and PLL are not considered. Finally, the effectiveness of
the proposed method is further verified using the MATLAB based digital
simulation and RT-LAB based hardware-in-the-loop (HIL) simulation.
","[{""version"":""v1"",""created"":""Sun, 18 Jun 2017 09:42:29 GMT""}]","2017-06-20"
"1706.05626","Ahmad Taha","Ahmad F. Taha, Nikolaos Gatsis, Bing Dong, Ankur Pipri and Zhaoxuan Li","Buildings-to-Grid Integration Framework","In Press, IEEE Transactions on Smart Grid",,,,"math.OC cs.SY","http://arxiv.org/licenses/nonexclusive-distrib/1.0/","  This paper puts forth a mathematical framework for Buildings-to-Grid (BtG)
integration in smart cities. The framework explicitly couples power grid and
building's control actions and operational decisions, and can be utilized by
buildings and power grids operators to simultaneously optimize their
performance. Simplified dynamics of building clusters and building-integrated
power networks with algebraic equations are presented---both operating at
different time-scales. A model predictive control (MPC)-based algorithm that
formulates the BtG integration and accounts for the time-scale discrepancy is
developed. The formulation captures dynamic and algebraic power flow
constraints of power networks and is shown to be numerically advantageous. The
paper analytically establishes that the BtG integration yields a reduced total
system cost in comparison with decoupled designs where grid and building
operators determine their controls separately. The developed framework is
tested on standard power networks that include thousands of buildings modeled
using industrial data. Case studies demonstrate building energy savings and
significant frequency regulation, while these findings carry over in network
simulations with nonlinear power flows and mismatch in building model
parameters. Finally, simulations indicate that the performance does not
significantly worsen when there is uncertainty in the forecasted weather and
base load conditions.
","[{""version"":""v1"",""created"":""Sun, 18 Jun 2017 09:50:22 GMT""},{""version"":""v2"",""created"":""Fri, 22 Sep 2017 02:09:15 GMT""},{""version"":""v3"",""created"":""Mon, 9 Oct 2017 21:45:48 GMT""}]","2017-10-11"
"1706.05627","Attilio Sacripanti","Attilio Sacripanti, Tania De Blasis","Safety on Judo Children: Methodology and Results","23 pages, 21 figures, 5 tables, Paper submitted during 4th European
  Science of Judo Research Symposium and 3rd Scientific and Professional
  Conference on Judo: Applicable Research in Judo 12-13. June 2017. Porec,
  Croatia",,,,"physics.pop-ph","http://arxiv.org/licenses/nonexclusive-distrib/1.0/","  Many doctors although they have not firsthand experience of judo, describe it
as a sport unsuitable for children. Theoretically speaking falls derived by
Judo throwing techniques,could be potentially dangerous,especially for kids,if
poorly managed.A lot of researches were focalized on trauma or injuries taking
place in judo, both during training and competition The goal of this Research
is to define and apply a scientific methodology to evaluate the hazard in falls
by judo throws for children during training.By organizing the research there
are defined: Five throws with different falls and flight time. The maximum
impact forces and velocities. The contact surfaces of bodies on the Tatami. The
Elastocaloric effect to evaluate the energy absorption by Tatami Materials. The
maximum Strain on the Tatami. The impact reaction Stress on the children
bodies. After valuated the mechanic of falls.Is performed the evaluation of
contact body surfaces on the Tatami, by a Japanese AVIO Thermal Camera. To
connect the impact biomechanics with the potential trauma, the only worldwide
accepted methodology both from Medical and Engineering people is the Crash test
Methodology. Connecting in this way, the mechanical results with the resulting
physiological hazard of Judo throwing techniques. With this use it is proved
that correct falls of judo throws are safe for judo boy, on IJF approved
Tatami.The last two troubles that our analysis has singled out about still judo
throwing techniques training for kids are: The wrong combination of kids during
training and the potential long term trauma that have for organ target both
Liver and Spleen. These unevaluated problems are present in kids training, in
such delicate issues a Digital Assistant named (Hazard Training Sentinel) that
is able to alert if cumulative stress for spleen and liver could be dangerous
for a specific boy.
","[{""version"":""v1"",""created"":""Sun, 18 Jun 2017 09:50:35 GMT""}]","2017-06-20"
"1706.05628","Bin Sheng","Bin Sheng, Yuefang Sun","An improved kernel for the cycle contraction problem","12 pages, 3 figures",,,,"cs.DS","http://arxiv.org/licenses/nonexclusive-distrib/1.0/","  The problem of modifying a given graph to satisfy certain properties has been
one of the central topics in parameterized tractability study. In this paper,
we study the cycle contraction problem, which makes a graph into a cycle by
edge contractions. The problem has been studied {by Belmonte et al. [IPEC
2013]} who obtained a linear kernel with at most $6k+6$ vertices. We provide an
improved kernel with at most $5k+4$ vertices for it in this paper.
","[{""version"":""v1"",""created"":""Sun, 18 Jun 2017 10:01:12 GMT""}]","2017-06-20"
"1706.05629","Yunhao Lu","Chengcheng Xiao, Fang Wang, Shengyuan A. Yang, Yunhao Lu","Ferroelectricity and Antiferroelectricity in Elemental Group-V Monolayer
  Materials","14 pages, 4 figures",,,,"cond-mat.mtrl-sci","http://arxiv.org/licenses/nonexclusive-distrib/1.0/","  Ferroelectricity is usually found in compound materials composed by different
elements. Here, based on first-principles calculations, we reveal the first
example of spontaneous electrical polarization and ferroelectricity in stable
two-dimensional elemental materials: elemental Group-V (As, Sb, and Bi)
monolayers. The polarization is due to the spontaneous lattice distortion with
atomic layer buckling. Interestingly, for Bi monolayer, apart from the
ferroelectric phase, we find that it can also host an antiferroelectric phase.
The Curie temperatures of these elemental materials can be higher than room
temperature, making them promising for realizing ultrathin ferroelectric
devices of broad interest.
","[{""version"":""v1"",""created"":""Sun, 18 Jun 2017 10:10:17 GMT""}]","2017-06-20"
"1706.05630","Raul Guilherme Batista Mendes","Raul Guilherme Batista Mendes, Francisco C\'esar de S\'a Barreto,
  Jander Pereira dos Santos","Thermodynamic States of the Mixed Spin 1/2 and Spin 1 Hexagonal Nanowire
  System Obtained from a Seven-Site Cluster Within an Improved Mean Field
  Approximation",,,,,"cond-mat.stat-mech","http://arxiv.org/licenses/nonexclusive-distrib/1.0/","  The mean field approximation results in the mixed spin 1/2 Ising model and
spin 1 Blume-Capel model, in the hexagonal nanowire system, are obtained from
the Bogoliubov inequality. The Gibbs free energy, magnetization and critical
frontiers are obtained. Besides the stable branches of the order parameters, we
obtain the metastable and unstable parts of these curves and also find phase
transitions of the metastable branches of the order parameters. The
classification of the stable, metastable and unstable states is made by
comparing the free energy values of these states.
","[{""version"":""v1"",""created"":""Sun, 18 Jun 2017 10:39:00 GMT""}]","2017-06-20"
"1706.05631","N. A. Chowdhury","N. A. Chowdhury, M. M. Hasan, A. Mannan, and A. A. Mamun","Nucleus-acoustic envelope solitons and their modulational instability in
  a degenerate quantum plasma system","Submitted to Advances in Space Research",,,,"physics.plasm-ph","http://creativecommons.org/publicdomain/zero/1.0/","  The basic features of nucleus-acoustic (NA) envelope bright and dark
solitons, which exist in degenerate quantum plasmas, have been theoretically
investigated by deriving the nonlinear Schr\""odinger (NLS) equation. The
reductive perturbation method, which is valid for a small but finite amplitude
limit, is employed. It is found that the bright envelope solitons are
modulationally unstable, whereas the dark ones are stable. It is also observed
that the fundamental properties (viz. Modulational instability (MI) growth
rate, width and energy concentration of NA waves, etc.) of NA unstable bright
envelope solitons are significantly modified by constituent particles number
density. The implications of our results obtained from our present
investigation in astrophysical compact objects like white dwarfs and neutron
stars are briefly discussed.
","[{""version"":""v1"",""created"":""Sun, 18 Jun 2017 11:21:15 GMT""}]","2017-06-20"
"1706.05632","Konstantin Medynets","Kostya Medynets and James P. Talisse","Toeplitz Subshifts with Trivial Centralizers and Positive Entropy","REU project, 15 pages",,,,"math.DS","http://arxiv.org/licenses/nonexclusive-distrib/1.0/","  Given a dynamical system $(X,G)$, the centralizer $C(G)$ denotes the group of
all homeomorphisms of $X$ which commute with the action of $G$. This group is
sometimes called the automorphism group of the dynamical system $(X,G)$. In
this note, we generalize the construction of Bulatek and Kwiatkowski (1992) to
$\mathbb Z^d$-Toepltiz systems by identifying a class of $\mathbb Z^d$-Toeplitz
systems that have trivial centralizers. We show that this class of $\mathbb
Z^d$-Toeplitz with trivial centralizers contains systems with positive
topological entropy.
","[{""version"":""v1"",""created"":""Sun, 18 Jun 2017 11:26:42 GMT""}]","2017-06-20"
"1706.05633","Yuan Liu","Yuan Liu","Joint resource allocation in SWIPT-based multi-antenna
  decode-and-forward relay networks","To appear in IEEE TVT",,,,"cs.IT math.IT","http://arxiv.org/licenses/nonexclusive-distrib/1.0/","  In this paper, we consider relay-assisted simultaneous wireless information
and power transfer (SWIPT) for two-hop cooperative transmission, where a
half-duplex multi-antenna relay adopts decode-and-forward (DF) relaying
strategy for information forwarding. The relay is assumed to be energy-free and
needs to harvest energy from the source node. By embedding power splitting (PS)
at each relay antenna to coordinate the received energy and information, joint
problem of determining PS ratios and power allocation at the multi-antenna
relay node is formulated to maximize the end-to-end achievable rate. We show
that the multi-antenna relay is equivalent to a virtual single-antenna relay in
such a SWIPT system, and the problem is optimally solved with closed-form. To
reduce the hardware cost of the PS scheme, we further propose the antenna
clustering scheme, where the multiple antennas at the relay are partitioned
into two disjoint groups which are exclusively used for information decoding
and energy harvesting, respectively. Optimal clustering algorithm is first
proposed but with exponential complexity. Then a greedy clustering algorithms
is introduced with linear complexity and approaching to the optimal
performance. Several valuable insights are provided via theoretical analysis
and simulation results.
","[{""version"":""v1"",""created"":""Sun, 18 Jun 2017 11:32:46 GMT""}]","2017-06-20"
"1706.05634","N. A. Chowdhury","N. A. Chowdhury, A. Mannan, M. M. Hasan, and A. A. Mamun","Heavy ion-acoustic rogue waves in electron-positron multi-ion plasmas","Submitted to Chaos",,"10.1063/1.4985113",,"physics.plasm-ph","http://creativecommons.org/publicdomain/zero/1.0/","  The nonlinear propagation of heavy-ion-acoustic (HIA) waves (HIAWs) in a four
component multi-ion plasma (containing inertial heavy negative ions and light
positive ions, as well as inertialess nonextensive electrons and positrons) has
been theoretically investigated. The nonlinear Schr\""{o}dinger (NLS) equation
is derived by employing the reductive perturbation method. It is found that the
NLS equation leads to the modulational instability (MI) of HIAWs, and to the
formation of HIA rogue waves (HIARWs), which are due to the effects of
nonlinearity and dispersion in the propagation of HIAWs. The conditions for MI
of HIAWs, and the basic properties of the generated HIARWs are identified. It
is observed that the striking features (viz. instability criteria, growth rate
of MI, amplitude and width of HIARWs, etc.) of the HIAWs are significantly
modified by effects of nonextensivity of electrons and positrons, ratio of
light positive ion mass to heavy negative ion mass, ratio of electron number
density to light positive ion number density, and ratio of electron temperature
to positron temperature, etc. The relevancy of our present investigation to the
observations in the space (viz. cometary comae and earth's ionosphere) and
laboratory (laser plasma interaction experimental devices) plasmas is pointed
out.
","[{""version"":""v1"",""created"":""Sun, 18 Jun 2017 11:53:41 GMT""}]","2017-10-11"
"1706.05635","Pak-Hin Thomas Tam","Pak-Hin Thomas Tam, Xin-Bo He (Sun Yat-sen University), Qing-Wen Tang
  (Nanchang University), Xiang-Yu Wang (Nanjing University)","An evolving GeV spectrum from prompt to afterglow: the case of GRB
  160509A","ApJL, in press",,"10.3847/2041-8213/aa7ca5",,"astro-ph.HE","http://arxiv.org/licenses/nonexclusive-distrib/1.0/","  We present the high-energy emission properties of GRB 160509A, from its
prompt mission to late afterglow phase. GRB 160509A contains two emission
episodes: 0-40s and 280-420s after the burst onset (t0). The relatively high
fluence of GRB 160509A allows us to establish an evolving spectrum above 100
MeV. During the first emission episode, the >100 MeV spectrum is soft with
\Gamma=>3.0, which can be smoothly connected to keV energies with a Band
function with a high-energy cutoff. The >100 MeV spectrum rapidly changes to a
hard spectrum with \Gamma<=1.5 after t0+40s. The existence of very energetic
photons, e.g., a 52 GeV that arrives t0+77 seconds, and a 29 GeV that arrives
t0+70 ks, is hard to reconcile by the synchrotron emission from forward-shock
electrons, but likely due to inverse Compton mechanism (e.g., synchrotron
self-Compton emission). A soft spectrum (\Gamma~2) between 300s and 1000s after
the burst onset is also found at a significance of about 2 standard deviations,
which suggests a different emission mechanism at work for this short period of
time. GRB 160509A represents the latest example where inverse Compton emission
has to be taken into account in explaining the afterglow GeV emission, which
had been suggested long before the launch of Fermi LAT.
","[{""version"":""v1"",""created"":""Sun, 18 Jun 2017 11:57:35 GMT""}]","2017-07-26"
"1706.05636","N. A. Chowdhury","N. A. Chowdhury, M. M. Hasan, A. Mannan, and A. A. Mamun","Modulational instability and ion-acoustic envelope solitons in four
  component plasmas","Submitted to Physics of plasmas",,,,"physics.plasm-ph","http://creativecommons.org/publicdomain/zero/1.0/","  Modulational instability (MI) of ion-acoustic waves (IAWs) has been
theoretically investigated in a plasma system which is composed of inertial
warm adiabatic ions, isothermal positrons, and two temperature superthermal
electrons. A nonlinear Schr\""odinger (NLS) equation is derived by using
reductive perturbation method that governs the MI of the IAWs. The numerical
analysis of the solution of NLS equation shows the existence of both stable
(dark envelope solitons exist) and unstable (bright envelope solitons exist)
regimes of IAWs. It is observed that the basic features (viz. stability of the
wave profile and MI growth rate) of the IAWs are significantly modified by the
superthermal parameter ($\kappa$) and related plasma parameters. The results of
our present investigation should be useful for understanding different
nonlinear phenomena in both space and laboratory plasmas.
","[{""version"":""v1"",""created"":""Sun, 18 Jun 2017 12:00:55 GMT""}]","2017-06-20"
"1706.05637","Ofer Strichman","Dor Cohen and Ofer Strichman","The impact of Entropy and Solution Density on selected SAT heuristics",,,"10.3390/e20090713",,"cs.AI cs.LO","http://arxiv.org/licenses/nonexclusive-distrib/1.0/","  In a recent article [Oh'15], Oh examined the impact of various key heuristics
(e.g., deletion strategy, restart policy, decay factor, database reduction) in
competitive SAT solvers. His key findings are that their expected success
depends on whether the input formula is satisfiable or not. To further
investigate these findings, we focused on two properties of satisfiable
formulas: the entropy of the formula, which approximates the freedom we have in
assigning the variables, and the solution density, which is the number of
solutions divided by the search space. We found that both predict better the
effect of these heuristics, and that satisfiable formulas with small entropy
`behave' similarly to unsatisfiable formulas.
","[{""version"":""v1"",""created"":""Sun, 18 Jun 2017 12:03:33 GMT""}]","2018-10-17"
"1706.05638","Jinghai Shao","Jianhai Bao, Jinghai Shao, Chenggui Yuan","Invariant Measures for Path-Dependent Random Diffusions","32 pages",,,,"math.PR","http://arxiv.org/licenses/nonexclusive-distrib/1.0/","  In this work, we are concerned with existence and uniqueness of invariant
measures for path-dependent random diffusions and their time discretizations.
The random diffusion here means a diffusion process living in a random
environment characterized by a continuous time Markov chain. Under certain
ergodic conditions, we show that the path-dependent random diffusion enjoys a
unique invariant probability measure and converges exponentially to its
equilibrium under the Wasserstein distance. Also, we demonstrate that the time
discretization of the path-dependent random diffusion involved admits a unique
invariant probability measure and shares the corresponding ergodic property
when the stepsize is sufficiently small. During this procedure, the difficulty
arose from the time-discretization of continuous time Markov chain has to be
deal with, for which an estimate on its exponential functional is presented.
","[{""version"":""v1"",""created"":""Sun, 18 Jun 2017 12:12:41 GMT""}]","2017-06-20"
"1706.05639","Xi-Long Fan","Xilong Fan, Christopher Messenger, Ik Siong Heng","Probing intrinsic properties of short gamma-ray bursts with
  gravitational waves",,"Phys. Rev. Lett. 119, 181102 (2017)","10.1103/PhysRevLett.119.181102","LIGO-P1400077","astro-ph.HE gr-qc","http://arxiv.org/licenses/nonexclusive-distrib/1.0/","  Progenitors of short gamma-ray bursts are thought to be neutron stars
coalescing with their companion black hole or neutron star, which are one of
the main gravitational wave sources. We have devised a Bayesian framework for
combining gamma-ray burst and gravitational wave information that allows us to
probe short gamma-ray burst luminosities. We show that combined short gamma-ray
burst and gravitational wave observations not only improve progenitor distance
and inclination angle estimates, they also allow the isotropic luminosities of
short gamma-ray bursts to be determined without the need for host galaxy or
light-curve information. We characterise our approach by simulating 1000 joint
short gamma-ray burst and gravitational wave detections by Advanced LIGO and
Advanced Virgo. We show that ${\sim}90\%$ of the simulations have uncertainties
on short gamma-ray burst isotropic luminosity estimates that are within a
factor of 2 of the ideal scenario, where the distance is known exactly.
Therefore, isotropic luminosities can be confidently determined for short
gamma-ray bursts observed jointly with gravitational wave detected by Advanced
LIGO and Advanced Virgo. Planned enhancements to Advanced LIGO will extend its
range and likely produce several joint detections of short gamma-ray bursts and
gravitational waves. Third-generation gravitational wave detectors will allow
for isotropic luminosity estimates for the majority of the short gamma-ray
burst population within a redshift of $z{\sim}1$.
","[{""version"":""v1"",""created"":""Sun, 18 Jun 2017 12:14:14 GMT""},{""version"":""v2"",""created"":""Sat, 4 Nov 2017 06:31:31 GMT""}]","2017-11-08"
"1706.05640","Christian Borghesi","Christian Borghesi","Effective gravity and effective quantum equations in a system inspired
  by walking droplets experiments","16 pages, 2 figures. To appear in Annales de la Fondation Louis de
  Broglie",,,,"physics.class-ph quant-ph","http://arxiv.org/licenses/nonexclusive-distrib/1.0/","  In this paper we suggest a macroscopic toy system in which a potential-like
energy is generated by a non-uniform pulsation of the medium (i.e. pulsation of
transverse standing oscillations that the elastic medium of the system tends to
support at each point). This system is inspired by walking droplets experiments
with submerged barriers. We first show that a Poincar\'e-Lorentz covariant
formalization of the system causes inconsistency and contradiction. The
contradiction is solved by using a general covariant formulation and by
assuming a relation between the metric associated with the elastic medium and
the pulsation of the medium. (Calculations are performed in a Newtonian-like
metric, constant in time). We find ($i$) an effective Schr\""odinger equation
with external potential, ($ii$) an effective de Broglie-Bohm guidance formula
and ($iii$) an energy of the `particle' which has a direct counterpart in
general relativity as well as in quantum mechanics. We analyze the wave and the
`particle' in an effective free fall and with a harmonic potential. This
potential-like energy is an effective gravitational potential, rooted in the
pulsation of the medium at each point. The latter, also conceivable as a
natural clock, makes easy to understand why proper time varies from place to
place.
","[{""version"":""v1"",""created"":""Sun, 18 Jun 2017 12:31:29 GMT""},{""version"":""v2"",""created"":""Thu, 31 Jan 2019 15:20:13 GMT""}]","2019-02-01"
"1706.05641","Caili Sang Ph.D","Caili Sang","A tighter S-type singular value inclusion set for rectangular tensors","12 pages, 1 figures",,,,"math.NA","http://arxiv.org/licenses/nonexclusive-distrib/1.0/","  A new S-type singular value inclusion set for rectangular tensors is given
and proved to be tighter than that in [Sang C.L., An S-type singular value
inclusion set for rectangular tensors, J. Inequal. Appl. 2017: 141, 2017].
Based on this set, new bounds for the largest singular value of nonnegative
rectangular tensors are obtained and proved to be better than some existing
results. Compared with the results in the paper mentioned above, the advantage
of the new results is that, under the same computations, we can obtain a
tighter singular value inclusion set for rectangular tensors and sharper bounds
for the largest singular value of nonnegative rectangular tensors. Finally, a
numerical example is given to verify the theoretical results.
","[{""version"":""v1"",""created"":""Sun, 18 Jun 2017 12:43:31 GMT""}]","2017-06-20"
"1706.05642","Clara Shikhelman","Noga Alon and Clara Shikhelman","$H$-free subgraphs of dense graphs maximizing the number of cliques and
  their blow-ups",,,,,"math.CO","http://arxiv.org/licenses/nonexclusive-distrib/1.0/","  We consider the structure of $H$-free subgraphs of graphs with high minimal
degree. We prove that for every $k>m$ there exists an
$\epsilon:=\epsilon(k,m)>0$ so that the following holds. For every graph $H$
with chromatic number $k$ from which one can delete an edge and reduce the
chromatic number, and for every graph $G$ on $n>n_0(H)$ vertices in which all
degrees are at least $(1-\epsilon)n$, any subgraph of $G$ which is $H$-free and
contains the maximum number of copies of the complete graph $K_m$ is
$(k-1)$-colorable.
  We also consider several extensions for the case of a general forbidden graph
$H$ of a given chromatic number, and for subgraphs maximizing the number of
copies of balanced blowups of complete graphs.
","[{""version"":""v1"",""created"":""Sun, 18 Jun 2017 13:01:12 GMT""}]","2017-06-20"
