"1706.05643","Vasile Patrascu","Vasile Patrascu","Entropy, neutro-entropy and anti-entropy for neutrosophic information","14 pages",,"10.13140/RG.2.2.29001.95848","Technical Report TI.1.6.2017","cs.AI cs.IT math.IT","http://arxiv.org/licenses/nonexclusive-distrib/1.0/","  This approach presents a multi-valued representation of the neutrosophic
information. It highlights the link between the bifuzzy information and
neutrosophic one. The constructed deca-valued structure shows the neutrosophic
information complexity. This deca-valued structure led to construction of two
new concepts for the neutrosophic information: neutro-entropy and anti-entropy.
These two concepts are added to the two existing: entropy and non-entropy.
Thus, we obtained the following triad: entropy, neutro-entropy and
anti-entropy.
","[{""version"":""v1"",""created"":""Sun, 18 Jun 2017 13:01:59 GMT""}]","2017-06-20"
"1706.05644","Delfim F. M. Torres","Amar Chidouh, Delfim F. M. Torres","Existence of positive solutions to a discrete fractional boundary value
  problem and corresponding Lyapunov-type inequalities","This is a preprint of a paper whose final and definite form is with
  journal Opuscula Mathematica, vol. 38, no. 1 (2018), ISSN 1232-9274, e-ISSN
  2300-6919, available at [http://dx.doi.org/10.7494/OpMath]. Submitted
  15-Nov-2016; Revised 31-May-2017; Accepted 18-June-2017","Opuscula Math. 38 (2018), no. 1 , 31--40","10.7494/OpMath.2018.38.1.31",,"math.CA","http://arxiv.org/licenses/nonexclusive-distrib/1.0/","  We prove existence of positive solutions to a boundary value problem
depending on discrete fractional operators. Then, corresponding discrete
fractional Lyapunov-type inequalities are obtained.
","[{""version"":""v1"",""created"":""Sun, 18 Jun 2017 13:05:12 GMT""}]","2017-10-13"
"1706.05645","Mohamed Ghoneim","Mohamed T. Ghoneim and Muhammad M. Hussain","Neuron-inspired flexible memristive device on silicon (100)",,,,,"physics.app-ph cond-mat.mes-hall","http://creativecommons.org/licenses/by/4.0/","  Comprehensive understanding of the world's most energy efficient powerful
computer, the human brain, is an elusive scientific issue. Still, already
gained knowledge indicates memristors can be used as a building block to model
the brain. At the same time, brain cortex is folded allowing trillions of
neurons to be integrated in a compact volume. Therefore, we report flexible
aluminium oxide based memristive devices fabricated and then derived from
widely used bulk mono-crystalline silicon (100). We use complementary metal
oxide semiconductor based processes to layout the foundation for ultra large
scale integration (ULSI) of such memory devices to advance the task of
comprehending a physical model of human brain.
","[{""version"":""v1"",""created"":""Sun, 18 Jun 2017 13:24:22 GMT""}]","2017-06-20"
"1706.05646","Siddhartha Bhattacharya","Siddhartha Bhattacharya","Balanced words in higher dimensions",,,,,"math.CO","http://arxiv.org/licenses/nonexclusive-distrib/1.0/","  For $d\ge 1$, a word $w\in \{ 0,1\}^{\Z^d}$ is called balanced if there
exists $M > 0$ such that for any two rectangles $R, R^{'}\subset\Z^d$ that are
translates of each other, the number of occurrences of the symbol $1$ in $R$
and $R^{'}$ differ by at most $M$. It is known that for every balanced word
$w$, the asymptotic frequency of the symbol $1$ ( called the density of $w$ )
exists. In this paper we show that there exist two dimensional balanced words
with irrational densities, answering a question raised by Berth\'e and
Tijdeman.
","[{""version"":""v1"",""created"":""Sun, 18 Jun 2017 13:28:32 GMT""}]","2017-06-20"
"1706.05647","Siddhartha Bhattacharya","Siddhartha Bhattacharya","Ergodicity of algebraic actions of nilpotent groups","9 pages, no figures",,,,"math.DS","http://arxiv.org/licenses/nonexclusive-distrib/1.0/","  An algebraic $\Gamma$-action is an action of a countable group $\Gamma$ on a
compact abelian group $X$ by continuous automorphisms of $X$. We prove that any
expansive algebraic action of a finitely generated nilpotent group $\Gamma$ on
a connected group $X$ is ergodic. We also show that this result does not hold
for actions of polycyclic groups.
","[{""version"":""v1"",""created"":""Sun, 18 Jun 2017 13:29:58 GMT""}]","2017-06-20"
"1706.05648","Asish Ghoshal","Asish Ghoshal and Jean Honorio","Learning Sparse Polymatrix Games in Polynomial Time and Sample
  Complexity",,"International Conference on Artificial Intelligence and Statistics
  (AISTATS) 2018",,,"cs.LG","http://arxiv.org/licenses/nonexclusive-distrib/1.0/","  We consider the problem of learning sparse polymatrix games from observations
of strategic interactions. We show that a polynomial time method based on
$\ell_{1,2}$-group regularized logistic regression recovers a game, whose Nash
equilibria are the $\epsilon$-Nash equilibria of the game from which the data
was generated (true game), in $\mathcal{O}(m^4 d^4 \log (pd))$ samples of
strategy profiles --- where $m$ is the maximum number of pure strategies of a
player, $p$ is the number of players, and $d$ is the maximum degree of the game
graph. Under slightly more stringent separability conditions on the payoff
matrices of the true game, we show that our method learns a game with the exact
same Nash equilibria as the true game. We also show that $\Omega(d \log (pm))$
samples are necessary for any method to consistently recover a game, with the
same Nash-equilibria as the true game, from observations of strategic
interactions. We verify our theoretical results through simulation experiments.
","[{""version"":""v1"",""created"":""Sun, 18 Jun 2017 13:31:36 GMT""},{""version"":""v2"",""created"":""Mon, 20 Nov 2017 16:11:39 GMT""}]","2019-01-30"
"1706.05649","Kater Murch","M. Naghiloo, A. N. Jordan, K. W. Murch","Achieving optimal quantum acceleration of frequency estimation using
  adaptive coherent control","8 pages, 4 figures","Phys. Rev. Lett. 119, 180801 (2017)","10.1103/PhysRevLett.119.180801",,"quant-ph","http://arxiv.org/licenses/nonexclusive-distrib/1.0/","  Precision measurements of frequency are critical to accurate timekeeping, and
are fundamentally limited by quantum measurement uncertainties. While for
time-independent quantum Hamiltonians, the uncertainty of any parameter scales
at best as $1/T$, where $T$ is the duration of the experiment, recent
theoretical works have predicted that explicitly time-dependent Hamiltonians
can yield a $1/T^2$ scaling of the uncertainty for an oscillation frequency.
This quantum acceleration in precision requires coherent control, which is
generally adaptive. We experimentally realize this quantum improvement in
frequency sensitivity with superconducting circuits, using a single transmon
qubit. With optimal control pulses, the theoretically ideal frequency precision
scaling is reached for times shorter than the decoherence time. This result
demonstrates a fundamental quantum advantage for frequency estimation.
","[{""version"":""v1"",""created"":""Sun, 18 Jun 2017 13:34:14 GMT""},{""version"":""v2"",""created"":""Wed, 30 Aug 2017 02:17:51 GMT""}]","2017-11-08"
"1706.05650","Cheng Guo","Yunlong Xiao, Cheng Guo, Fei Meng, Naihuan Jing, Man-Hong Yung","Incompatibility of Observables as State-Independent Bound of Uncertainty
  Relations","Comments are welcome","Phys. Rev. A 100, 032118 (2019)","10.1103/PhysRevA.100.032118",,"quant-ph","http://arxiv.org/licenses/nonexclusive-distrib/1.0/","  For a pair of observables, they are called ""incompatible"", if and only if the
commutator between them does not vanish, which represents one of the key
features in quantum mechanics. The question is, how can we characterize the
incompatibility among three or more observables? Here we explore one possible
route towards this goal through Heisenberg's uncertainty relations, which
impose fundamental constraints on the measurement precisions for incompatible
observables. Specifically, we quantify the incompatibility by the optimal
state-independent bounds of additive variance-based uncertainty relations. In
this way, the degree of incompatibility becomes an intrinsic property among the
operators, but not on the quantum state. To justify our case, we focus on the
incompatibility of spin systems. For an arbitrary setting of two or three
linearly-independent Pauli-spin operators, the incompatibility is analytically
solved, the spins are maximally incompatible if and only if they are orthogonal
to each other. On the other hand, the measure of incompatibility represents a
versatile tool for applications such as testing entanglement of bipartite
states, and EPR-steering criteria.
","[{""version"":""v1"",""created"":""Sun, 18 Jun 2017 13:34:26 GMT""},{""version"":""v2"",""created"":""Wed, 19 Jul 2017 16:02:25 GMT""},{""version"":""v3"",""created"":""Thu, 6 Jun 2019 06:06:08 GMT""}]","2019-10-02"
"1706.05651","Bryce Kerr","Bryce Kerr","Incomplete Gauss sums modulo primes",,,,,"math.NT","http://arxiv.org/licenses/nonexclusive-distrib/1.0/","  We obtain a new bound for incomplete Gauss sums modulo primes. Our argument
falls under the framework of Vinogradov's method which we use to reduce the
problem under consideration to bounding the number of solutions to two distinct
systems of congruences. The first is related to Vinogradov's mean value
theorem, although the second does not appear to have been considered before.
Our bound improves on current results in the range $N\ge
q^{2k^{-1/2}+O(k^{-3/2})}$.
","[{""version"":""v1"",""created"":""Sun, 18 Jun 2017 13:34:39 GMT""}]","2017-06-20"
"1706.05652","Akio Ohama","Akio Ohama, Daichi Tsutsumi, Hidetoshi Sano, Kazufumi Torii, Atsushi
  Nishimura, Kazuhiro Shima, Habe Asao Hiroaki Yamamoto, Kengo Tachihara,
  Yutaka Hasagawa, Kimihiro Kimura, Hideo Ogawa and Yasuo Fukui","High-mass star formation in Orion triggered by cloud-cloud collision II,
  Two merging molecular clouds in NGC2024","24 pages, 10 figures, submitted for publication in PASJ (cloud-cloud
  collision special issue)",,,,"astro-ph.GA","http://arxiv.org/licenses/nonexclusive-distrib/1.0/","  We analyzed the NANTEN2 13CO (J=2-1 and 1-0) datasets in NGC 2024. We found
that the cloud consists of two velocity components, whereas the cloud shows
mostly single-peaked CO profiles. The two components are physically connected
to the HII region as evidenced by their close correlation with the dark lanes
and the emission nebulosity. The two components show complementary distribution
with a displacement of 0.4 pc. Such complementary distribution is typical to
colliding clouds discovered in regions of high-mass star formation. We
hypothesize that cloud-cloud collision between the two components triggered the
formation of the late O stars and early B stars localized within 0.3 pc of the
cloud peak. The collision timescale is estimated to be ~ 10^5 yrs from a ratio
of the displacement and the relative velocity 3-4 km s-1 corrected for probable
projection. The high column density of the colliding cloud 1023 cm-2 is similar
to those in the other massive star clusters in RCW 38, Westerlund 2, NGC 3603,
and M42, which are likely formed under trigger by cloud-cloud collision. The
present results provide an additional piece of evidence favorable to high-mass
star formation by a major cloud-cloud collision in Orion.
","[{""version"":""v1"",""created"":""Sun, 18 Jun 2017 13:47:39 GMT""}]","2017-06-20"
"1706.05653","Volodymyr Kravchuk P.","Volodymyr P. Kravchuk, Denis D. Sheka, Oleksii M. Volkov, Ulrich K.
  R\""o{\ss}ler, Jeroen van den Brink, Denys Makarov, Yuri Gaididei","Multiplet of skyrmion states on a curvilinear defect: skyrmion lattices
  as a ground state",,"Phys. Rev. Lett. 120, 067201 (2018)","10.1103/PhysRevLett.120.067201",,"cond-mat.str-el","http://arxiv.org/licenses/nonexclusive-distrib/1.0/","  We show that the presence of a localized curvilinear defect drastically
changes magnetic properties of a thin perpendicularly magnetized ferromagnetic
film. For a large enough defect amplitude a discrete set of equilibrium
magnetization states appears forming a ladder of energy levels. Each
equilibrium state has either zero or unit topological charge, i.e.
topologically trivial and skyrmion multiplets generally appear. Transitions
between the levels with the same topological charge are allowed and can be
utilized to encode and switch a bit of information. There is a wide range of
geometrical and material parameters, where the skyrmion level has the lowest
energy. As a result, periodically arranged curvilinear defects generate a
skyrmion lattice as the ground state.
","[{""version"":""v1"",""created"":""Sun, 18 Jun 2017 13:51:21 GMT""}]","2018-02-14"
"1706.05654","Benjamin Passer","Benjamin Passer, Orr Shalit, Baruch Solel","Minimal and maximal matrix convex sets","47 pages, 5 figures. Version 2 corrects minor errors and clarifies
  some of the theorem statements. Remarks have been added throughout the text,
  and section 4 has been expanded a bit. To appear in Journal of Functional
  Analysis","J. Funct. Anal. 274:11 (2018), 3197-3253","10.1016/j.jfa.2017.11.011",,"math.OA","http://arxiv.org/licenses/nonexclusive-distrib/1.0/","  To every convex body $K \subseteq \mathbb{R}^d$, one may associate a minimal
matrix convex set $\mathcal{W}^{\textrm{min}}(K)$, and a maximal matrix convex
set $\mathcal{W}^{\textrm{max}}(K)$, which have $K$ as their ground level. The
main question treated in this paper is: under what conditions on a given pair
of convex bodies $K,L \subseteq \mathbb{R}^d$ does
$\mathcal{W}^{\textrm{max}}(K) \subseteq \mathcal{W}^{\textrm{min}}(L)$ hold?
For a convex body $K$, we aim to find the optimal constant $\theta(K)$ such
that $\mathcal{W}^{\textrm{max}}(K) \subseteq \theta(K) \cdot
\mathcal{W}^{\textrm{min}}(K)$; we achieve this goal for all the $\ell^p$ unit
balls, as well as for other sets. For example, if $\overline{\mathbb{B}}_{p,d}$
is the closed unit ball in $\mathbb{R}^d$ with the $\ell^p$ norm, then \[
\theta(\overline{\mathbb{B}}_{p,d}) = d^{1-|1/p - 1/2|}. \] This constant is
sharp, and it is new for all $p \neq 2$. Moreover, for some sets $K$ we find a
minimal set $L$ for which $\mathcal{W}^{\textrm{max}}(K) \subseteq
\mathcal{W}^{\textrm{min}}(L)$. In particular, we obtain that a convex body $K$
satisfies $\mathcal{W}^{\textrm{max}}(K) = \mathcal{W}^{\textrm{min}}(K)$ if
and only if $K$ is a simplex.
  These problems relate to dilation theory, convex geometry, operator systems,
and completely positive maps. We discuss and exploit these connections as well.
For example, our results show that every $d$-tuple of self-adjoint operators of
norm less than or equal to $1$, can be dilated to a commuting family of
self-adjoints, each of norm at most $\sqrt{d}$. We also introduce new explicit
constructions of these (and other) dilations.
","[{""version"":""v1"",""created"":""Sun, 18 Jun 2017 13:59:27 GMT""},{""version"":""v2"",""created"":""Mon, 27 Nov 2017 10:26:15 GMT""}]","2019-07-04"
"1706.05655","Liudmila Ostroumova Prokhorenkova","Aleksandr Dorodnykh, Liudmila Ostroumova Prokhorenkova, Egor Samosvat","Preferential placement for community structure formation",,,,,"physics.soc-ph cs.SI","http://creativecommons.org/licenses/by/4.0/","  Various models have been recently proposed to reflect and predict different
properties of complex networks. However, the community structure, which is one
of the most important properties, is not well studied and modeled. In this
paper, we suggest a principle called ""preferential placement"", which allows to
model a realistic clustering structure. We provide an extensive empirical
analysis of the obtained structure as well as some theoretical results.
","[{""version"":""v1"",""created"":""Sun, 18 Jun 2017 14:03:00 GMT""},{""version"":""v2"",""created"":""Mon, 2 Oct 2017 17:33:06 GMT""},{""version"":""v3"",""created"":""Wed, 21 Mar 2018 08:15:26 GMT""},{""version"":""v4"",""created"":""Tue, 8 May 2018 11:01:04 GMT""},{""version"":""v5"",""created"":""Sun, 3 Feb 2019 13:18:18 GMT""}]","2019-02-05"
"1706.05656","Stefan Frank","Stefan Frank, Jinbiao Yang","Lexical representation explains cortical entrainment during speech
  comprehension","Submitted for publication",,"10.1371/journal.pone.0197304",,"q-bio.NC cs.CL","http://arxiv.org/licenses/nonexclusive-distrib/1.0/","  Results from a recent neuroimaging study on spoken sentence comprehension
have been interpreted as evidence for cortical entrainment to hierarchical
syntactic structure. We present a simple computational model that predicts the
power spectra from this study, even though the model's linguistic knowledge is
restricted to the lexical level, and word-level representations are not
combined into higher-level units (phrases or sentences). Hence, the cortical
entrainment results can also be explained from the lexical properties of the
stimuli, without recourse to hierarchical syntax.
","[{""version"":""v1"",""created"":""Sun, 18 Jun 2017 14:04:09 GMT""},{""version"":""v2"",""created"":""Wed, 12 Jul 2017 07:33:02 GMT""},{""version"":""v3"",""created"":""Thu, 20 Jul 2017 11:26:48 GMT""},{""version"":""v4"",""created"":""Mon, 9 Oct 2017 14:24:45 GMT""},{""version"":""v5"",""created"":""Wed, 3 Jan 2018 13:53:14 GMT""},{""version"":""v6"",""created"":""Wed, 10 Jan 2018 13:35:26 GMT""}]","2018-06-15"
"1706.05657","Anna-Zuzana Dubnickova","Cyril Adamu\v{s}\v{c}in, Erik Barto\v{s}, Stanislav Dubni\v{c}ka, Anna
  Z. Dubni\v{c}kov\'a","Erratum: Numerical values of the $f^F, f^D$ and $f^S$ coupling constants
  in SU(3) invariant Lagrangian of the interaction of the vector-meson nonets
  with $1/2^+$ octet baryons [Phys. Rev. C93, 055208 (2016)]","8 pages, Erratum: Phys. Rev. C93, 055208 (2016)",,,,"hep-ph","http://arxiv.org/licenses/nonexclusive-distrib/1.0/","  It is clearly demonstrated that numerical values of the $f^F, f^D$ and $f^S$
coupling constants in SU(3) invariant Lagrangian of the interaction of the
vector-meson nonets with $1/2^+$ octet baryons do not depend on the chosen
version of the $\omega-\phi$ mixing.
","[{""version"":""v1"",""created"":""Sun, 18 Jun 2017 14:07:53 GMT""},{""version"":""v2"",""created"":""Sun, 25 Jun 2017 18:16:37 GMT""}]","2017-06-27"
"1706.05658","Steven Kirk","Roya Momen, Alireza Azizi, Lingling Wang, Yang Ping, Tianlv Xu, Steven
  R. Kirk, Wenxuan Li, Sergei Manzhos and Samantha Jenkins","The Role of Weak Interactions in Characterizing Peptide Folding
  Preferences using a QTAIM Interpretation of the Ramachandran Plot
  ({\phi}-{\psi})","Submitted to IJQC","International Journal of Quantum Chemistry, Volume118, Issue2,
  e25456 (2018)","10.1002/qua.25456",,"physics.chem-ph physics.atm-clus","http://arxiv.org/licenses/nonexclusive-distrib/1.0/","  The Ramachandran plot is a potent way to understand structures of
biomolecules, however, the original formulation of the Ramachandran plot only
considers backbone conformations. We formulate a new interpretation of the
original Ramachandran plot ($\phi-\psi$) that can include a description of the
weaker interactions including both the hydrogen bonds and H$---$H bonds as a
new way to derive insights into the phenomenon of peptide folding. We use QTAIM
(quantum theory of atoms in molecules) to interpret the Ramachandran plot.
Specifically, we show that QTAIM analysis permits identifying key regions of
the Ramachandran plot without the need for massive data sets. A highly
non-linear relationship is found between the QTAIM vector-derived interpreted
Ramachandran plot and the conventional Ramachandran plot ($\phi-\psi$)
demonstrating that this new approach is not a trivial coordinate
transformation. An investigation of both the backbone and the weaker bonds
within the framework of the QTAIM interpreted Ramachandran plot was found to be
in line with physical intuition. The least-preferred directions calculated for
the hydrogen bonds and H$---$H bonds were found to coincide with the 'unlikely'
regions of the Ramachandran plot.
","[{""version"":""v1"",""created"":""Sun, 18 Jun 2017 14:15:15 GMT""}]","2018-04-03"
"1706.05659","Akio Ohama","Akio Ohama, Mikito Kono, Shinji Fujita, Daichi Tsutsumi, Yusuke
  Hattori, Kazufumi Torii, Atsushi Nishimura, Hidetoshi Sano, Hiroaki Yamamoto,
  Kengo Tachihara and Yasuo Fukui","Molecular gas in the compact H{\sc ii} region RCW 166; possible evidence
  for an early phase of cloud-cloud collision prior to the bubble formation","21 pages, 9 figures",,"10.1093/pasj/psy012",,"astro-ph.GA","http://arxiv.org/licenses/nonexclusive-distrib/1.0/","  Young HII regions are an important site to study O star formation based on
distributions of ionized and molecular gas. We revealed that two molecular
clouds at $\sim 48$ km s$^{-1}$ and $\sim 53$ km s$^{-1}$ are associated with
the HII regions G018.149-00.283 in RCW 166 by using the JCMT CO High-Resolution
Survey (COHRS) of the $^{12}$CO ($J$=3--2) emission. G018.149-00.283 comprises
a bright ring at 8 $\mu$m and an extended HII region inside the ring. The $\sim
48$ km s$^{-1}$ cloud delineates the ring, and the $\sim 53$ km s$^{-1}$ cloud
is located within the ring, indicating a complementary distribution between the
two molecular components. We propose a hypothesis that high-mass stars within
G018.149-00.283 were formed by triggering in cloud-cloud collision at a
projected velocity separation of $\sim 5$ km s$^{-1}$. We argue that
G018.149-00.283 is in an early evolutionary stage, $\sim 0.1$ Myr after the
collision according to the scheme by [hab92] which will be followed by a bubble
formation stage like RCW 120. We also suggested that nearby HII regions N21 and
N22 are candidates for bubbles possibly formed by cloud-cloud collision.
[ino13] showed that the interface gas becomes highly turbulent and realizes a
high-mass accretion rate of $10^{-3}$ -- $10^{-4}$ $M_{\odot}$ $/$yr by
magnetohydrodynamical numerical simulations, which offers an explanation of the
O-star formation. A fairly high frequency of cloud-cloud collision in RCW 166
is probably due to the high cloud density in this part of the Scutum arm.
","[{""version"":""v1"",""created"":""Sun, 18 Jun 2017 14:21:29 GMT""},{""version"":""v2"",""created"":""Thu, 15 Feb 2018 15:03:49 GMT""}]","2018-06-13"
"1706.05660","Lazar Friedland","Lazar Friedland and Arkadiy Shagalov","Extreme driven ion acoustic waves",,"Phys. Plasmas 24, 082106 (2017)","10.1063/1.4986031",,"physics.plasm-ph","http://arxiv.org/licenses/nonexclusive-distrib/1.0/","  Excitation of large amplitude strongly nonlinear ion acoustic waves from a
trivial equilibrium by a chirped frequency drive is discussed. Under certain
conditions, after passage through the linear resonance in this system, the
nonlinearity and the variation of parameters work in tandem to preserve the
phase-locking with the driving wave via excursion of the excited ion acoustic
wave in its parameter space, yielding controlled growth of the wave amplitude.
We study these autoresonant waves via a fully nonlinear warm fluid model and
predict formation of sharply peaked (extreme) ion acoustic excitations with
local ion density significantly exceeding the unperturbed plasma density. The
driven wave amplitude is bounded by the kinetic wave-breaking, as the local
maximum fluid velocity of the wave approaches the phase velocity of the drive.
The Vlasov-Poisson simulations are used to confirm the results of the fluid
model and the Whitham's averaged variational principle is applied in analyzing
evolution of the autoresonant ion acoustic waves.
","[{""version"":""v1"",""created"":""Sun, 18 Jun 2017 14:25:44 GMT""}]","2019-01-08"
"1706.05661","Zeda Li","Zeda Li and Robert T. Krafty","Adaptive Bayesian Power Spectrum Analysis of Multivariate Nonstationary
  Time Series","30 pages, 9 figures",,,,"stat.ME","http://arxiv.org/licenses/nonexclusive-distrib/1.0/","  This article introduces a nonparametric approach to multivariate time-varying
power spectrum analysis. The procedure adaptively partitions a time series into
an unknown number of approximately stationary segments, where some spectral
components may remain unchanged across segments, allowing components to evolve
differently over time. Local spectra within segments are fit through Whittle
likelihood based penalized spline models of modified Cholesky components, which
provide flexible nonparametric estimates that preserve positive definite
structures of spectral matrices. The approach is formulated in a Bayesian
framework, in which the number and location of partitions are random, and
relies on reversible jump Markov chain and Hamiltonian Monte Carlo methods that
can adapt to the unknown number of segments and parameters. By averaging over
the distribution of partitions, the approach can approximate both abrupt and
slow-varying changes in spectral matrices. Empirical performance is evaluated
in simulation studies and illustrated through analyses of
electroencephalography during sleep and of the El Ni\~no-Southern Oscillation.
","[{""version"":""v1"",""created"":""Sun, 18 Jun 2017 14:30:01 GMT""},{""version"":""v2"",""created"":""Tue, 27 Jun 2017 16:51:13 GMT""}]","2017-06-28"
