"1706.05585","Tom Hope","Tom Hope, Joel Chan, Aniket Kittur, Dafna Shahaf","Accelerating Innovation Through Analogy Mining","KDD 2017",,,,"cs.CL cs.AI stat.ML","http://arxiv.org/licenses/nonexclusive-distrib/1.0/","  The availability of large idea repositories (e.g., the U.S. patent database)
could significantly accelerate innovation and discovery by providing people
with inspiration from solutions to analogous problems. However, finding useful
analogies in these large, messy, real-world repositories remains a persistent
challenge for either human or automated methods. Previous approaches include
costly hand-created databases that have high relational structure (e.g.,
predicate calculus representations) but are very sparse. Simpler
machine-learning/information-retrieval similarity metrics can scale to large,
natural-language datasets, but struggle to account for structural similarity,
which is central to analogy. In this paper we explore the viability and value
of learning simpler structural representations, specifically, ""problem
schemas"", which specify the purpose of a product and the mechanisms by which it
achieves that purpose. Our approach combines crowdsourcing and recurrent neural
networks to extract purpose and mechanism vector representations from product
descriptions. We demonstrate that these learned vectors allow us to find
analogies with higher precision and recall than traditional
information-retrieval methods. In an ideation experiment, analogies retrieved
by our models significantly increased people's likelihood of generating
creative ideas compared to analogies retrieved by traditional methods. Our
results suggest a promising approach to enabling computational analogy at scale
is to learn and leverage weaker structural representations.
","[{""version"":""v1"",""created"":""Sat, 17 Jun 2017 22:29:37 GMT""}]","2017-06-20"
"1706.05586","Selin S. Aslan","Selin Aslan, Eric de Sturler, Misha E. Kilmer","Randomized Approach to Nonlinear Inversion Combining Simultaneous Random
  and Optimized Sources and Detectors","The algorithm to select optimized sources and detectors and combining
  these with randomized sources and detectors has been substantially revised
  from the previous version",,,,"math.NA","http://arxiv.org/licenses/nonexclusive-distrib/1.0/","  In partial differential equations-based (PDE-based) inverse problems with
many measurements, many large-scale discretized PDEs must be solved for each
evaluation of the misfit or objective function. In the nonlinear case,
evaluating the Jacobian requires solving an additional set of systems. This
leads to a tremendous computational cost, and this is by far the dominant cost
for these problems. Several authors have proposed randomization and stochastic
programming techniques to drastically reduce the number of system solves by
estimating the objective function using only a few appropriately chosen random
linear combinations of the sources. While some have reported good solution
quality at a greatly reduced cost, for our problem of interest, diffuse optical
tomography, the approach often does not lead to sufficiently accurate
solutions.
  We propose two improvements. First, to efficiently exploit Newton-type
methods, we modify the stochastic estimates to include random linear
combinations of detectors, drastically reducing the number of adjoint solves.
Second, after solving to a modest tolerance, we compute a few simultaneous
sources and detectors that maximize the Frobenius norm of the sampled Jacobian
to improve the rate of convergence and obtain more accurate solutions. We
complement these optimized simultaneous sources and detectors by random
simultaneous sources and detectors constrained to a complementary subspace. Our
approach leads to solutions of the same quality as obtained using all sources
and detectors but at a greatly reduced computational cost, as the number of
large-scale linear systems to be solved is significantly reduced.
","[{""version"":""v1"",""created"":""Sat, 17 Jun 2017 22:42:50 GMT""},{""version"":""v2"",""created"":""Wed, 26 Jul 2017 14:59:12 GMT""},{""version"":""v3"",""created"":""Tue, 17 Jul 2018 15:54:24 GMT""}]","2018-07-18"
"1706.05587","Liang-Chieh Chen","Liang-Chieh Chen, George Papandreou, Florian Schroff, Hartwig Adam","Rethinking Atrous Convolution for Semantic Image Segmentation","Add more experimental results",,,,"cs.CV","http://arxiv.org/licenses/nonexclusive-distrib/1.0/","  In this work, we revisit atrous convolution, a powerful tool to explicitly
adjust filter's field-of-view as well as control the resolution of feature
responses computed by Deep Convolutional Neural Networks, in the application of
semantic image segmentation. To handle the problem of segmenting objects at
multiple scales, we design modules which employ atrous convolution in cascade
or in parallel to capture multi-scale context by adopting multiple atrous
rates. Furthermore, we propose to augment our previously proposed Atrous
Spatial Pyramid Pooling module, which probes convolutional features at multiple
scales, with image-level features encoding global context and further boost
performance. We also elaborate on implementation details and share our
experience on training our system. The proposed `DeepLabv3' system
significantly improves over our previous DeepLab versions without DenseCRF
post-processing and attains comparable performance with other state-of-art
models on the PASCAL VOC 2012 semantic image segmentation benchmark.
","[{""version"":""v1"",""created"":""Sat, 17 Jun 2017 22:48:57 GMT""},{""version"":""v2"",""created"":""Tue, 8 Aug 2017 23:21:29 GMT""},{""version"":""v3"",""created"":""Tue, 5 Dec 2017 18:06:21 GMT""}]","2017-12-06"
"1706.05588","Catherine Hsu","Catherine Hsu","Two classes of number fields with a non-principal Euclidean ideal","12 pages","International Journal of Number Theory 12.04 (2016): 1123-1136","10.1142/S1793042116500688",,"math.NT","http://arxiv.org/licenses/nonexclusive-distrib/1.0/","  This paper introduces two classes of totally real quartic number fields, one
of biquadratic extensions and one of cyclic extensions, each of which has a
non-principal Euclidean ideal. It generalizes techniques of Graves used to
prove that the number field $\mathbb{Q}(\sqrt{2},\sqrt{35})$ has a
non-principal Euclidean ideal.
","[{""version"":""v1"",""created"":""Sat, 17 Jun 2017 22:53:34 GMT""}]","2017-06-20"
"1706.05589","Catherine Hsu","C. Hsu","Higher congruences between newforms and Eisenstein series of squarefree
  level","19 pages. Minor revisions. Accepted for publication in The Journal de
  Th\'eorie des Nombres de Bordeaux",,,,"math.NT","http://arxiv.org/licenses/nonexclusive-distrib/1.0/","  Let $p\geq 5$ be prime. For elliptic modular forms of weight 2 and level
$\Gamma_0(N)$ where $N>6$ is squarefree, we bound the depth of Eisenstein
congruences modulo $p$ (from below) by a generalized Bernoulli number with
correction factors and show how this depth detects the local non-principality
of the Eisenstein ideal. We then use admissibility results of Ribet and Yoo to
give an infinite class of examples where the Eisenstein ideal is not locally
principal. Lastly, we illustrate these results with explicit computations and
give an interesting commutative algebra application related to Hilbert--Samuel
multiplicities.
","[{""version"":""v1"",""created"":""Sat, 17 Jun 2017 23:01:44 GMT""},{""version"":""v2"",""created"":""Sat, 17 Mar 2018 02:16:48 GMT""},{""version"":""v3"",""created"":""Mon, 3 Dec 2018 11:13:34 GMT""},{""version"":""v4"",""created"":""Mon, 22 Jul 2019 15:03:45 GMT""}]","2019-07-23"
"1706.05590","Grey Ercole Ph. D.","Claudianor O. Alves, Mario Daniel H. Bola\~nos, Grey Ercole","Minimization of quotients with variable exponents","29 pages","Journal of Differential Equations, Volume 265, Issue 4, 15 August
  2018, Pages 1596-1626","10.1016/j.jde.2018.04.010",,"math.AP","http://arxiv.org/licenses/nonexclusive-distrib/1.0/","  Let $\Omega$ be a bounded domain of $\mathbb{R}^{N}$, $p\in
C^{1}(\overline{\Omega}),$ $q\in C(\overline{\Omega})$ and $l,j\in\mathbb{N}.$
We describe the asymptotic behavior of the minimizers of the Rayleigh quotient
$\frac{\Vert\nabla u\Vert_{lp(x)}}{\Vert u\Vert_{jq(x)}}$, first when
$j\rightarrow\infty$ and after when $l\rightarrow\infty.$
","[{""version"":""v1"",""created"":""Sat, 17 Jun 2017 23:19:51 GMT""}]","2018-07-17"
"1706.05591","Adam Kubica","Adam Kubica, Katarzyna Ryszewska","Fractional diffusion equation with the distributed order Caputo
  derivative",,,,,"math.AP","http://arxiv.org/licenses/nonexclusive-distrib/1.0/","  We consider fractional diffusion equation with the distributed order Caputo
derivative. We prove existence of a weak and regular solution for general
uniformly elliptic operator under the assumption that the weight function is
only integrable.
","[{""version"":""v1"",""created"":""Sat, 17 Jun 2017 23:20:15 GMT""},{""version"":""v2"",""created"":""Fri, 6 Oct 2017 14:39:15 GMT""},{""version"":""v3"",""created"":""Wed, 7 Feb 2018 18:09:00 GMT""}]","2018-02-08"
"1706.05592","Mohsen Imani","Mohsen Imani, Armon Barton, and Matthew Wright","Forming Guard Sets using AS Relationships",,,,,"cs.CR","http://arxiv.org/licenses/nonexclusive-distrib/1.0/","  The mechanism for picking guards in Tor suffers from security problems like
guard fingerprinting and from performance issues. To address these issues,
Hayes and Danezis proposed the use of guard sets, in which the Tor system
groups all guards into sets, and each client picks one of these sets and uses
its guards. Unfortunately, guard sets frequently need nodes added or they are
broken up due to fluctuations in network bandwidth. In this paper, we first
show that these breakups create opportunities for malicious guards to join many
guard sets by merely tuning the bandwidth they make available to Tor, and this
greatly increases the number of clients exposed to malicious guards. To address
this problem, we propose a new method for forming guard sets based on Internet
location. We construct a hierarchy that keeps clients and guards together more
reliably and prevents guards from easily joining arbitrary guard sets. This
approach also has the advantage of confining an attacker with access to limited
locations on the Internet to a small number of guard sets. We simulate this
guard set design using historical Tor data in the presence of both relay-level
adversaries and network-level adversaries, and we find that our approach is
good at confining the adversary into few guard sets and thus limiting the
impact of attacks.
","[{""version"":""v1"",""created"":""Sat, 17 Jun 2017 23:36:09 GMT""}]","2017-06-20"
"1706.05593","Sherif Abuelenin","Sherif M. Abuelenin and Rabab F. Abdel-Kader","Closed-Form Mathematical Representations of Interval Type-2 Fuzzy Logic
  Systems","15 pages, 10 figures, 3 tables",,,,"cs.SY","http://arxiv.org/licenses/nonexclusive-distrib/1.0/","  Interval type-2 fuzzy logic systems (IT2 FLSs) have a wide range of
applications due to their abilities to handle uncertainties compared to their
type-1 counterparts. This paper discusses the representation of IT2 FLSs in
closed mathematical form. Two novel inference mechanisms are introduced, each
of them represents a whole IT2 FLS. The two forms are based on approximating
Coupland and John's geometric method and the Nie-Tan method. Having closed-form
representations is preferred in the design of control systems, especially when
stability analysis is studied. Additionally, the simplicity of the proposed
mechanisms, offers an easy way for implementation. Simulation results show that
the proposed method perform very closely to other methods. Simulation results
are provided.
","[{""version"":""v1"",""created"":""Sat, 17 Jun 2017 23:39:56 GMT""},{""version"":""v2"",""created"":""Sat, 17 Mar 2018 08:45:27 GMT""}]","2018-03-20"
"1706.05594","Abdelaziz Tajmouati","Mohamed Amouch, Mohamed Karmouni, Abdelaziz Tajmouati","Spectra Originated from Fredholm Theory and Browder's Theorem","15",,,,"math.SP","http://arxiv.org/licenses/nonexclusive-distrib/1.0/","  We give a new characterization of Browders theorem through equality between
the pseudo B-Weyl spectrum and the generalized Drazin spectrum. Also, we will
give conditions under which pseudo B-Fredholm and pseudo B-Weyl spectrum
introduced in [11] and [30] become stable under commuting Riesz perturbations.
","[{""version"":""v1"",""created"":""Sun, 18 Jun 2017 00:07:06 GMT""}]","2017-06-20"
"1706.05595","Arthur Hoffmann-Ostenhof","Arthur Hoffmann-Ostenhof, Thomas Jatschka","Snarks with special spanning trees",,,,,"math.CO","http://arxiv.org/licenses/nonexclusive-distrib/1.0/","  Let $G$ be a cubic graph which has a decomposition into a spanning tree $T$
and a $2$-regular subgraph $C$, i.e. $E(T) \cup E(C) = E(G)$ and $E(T) \cap
E(C) = \emptyset$. We provide an answer to the following question: which
lengths can the cycles of $C$ have if $G$ is a snark? Note that $T$ is a hist
(i.e. a spanning tree without a vertex of degree two) and that every cubic
graph with a hist has the above decomposition.
","[{""version"":""v1"",""created"":""Sun, 18 Jun 2017 00:10:44 GMT""},{""version"":""v2"",""created"":""Sun, 7 Oct 2018 10:06:54 GMT""}]","2018-10-09"
"1706.05596","Kamal Rahimi Malekshan","Kamal Rahimi Malekshan and Weihua Zhuang","Joint Scheduling and Transmission Power Control in Wireless Ad Hoc
  Networks",,,,,"cs.NI","http://arxiv.org/licenses/nonexclusive-distrib/1.0/","  In this paper, we study how to determine concurrent transmissions and the
transmission power level of each link to maximize spectrum efficiency and
minimize energy consumption in a wireless ad hoc network. The optimal joint
transmission packet scheduling and power control strategy are determined when
the node density goes to infinity and the network area is unbounded. Based on
the asymptotic analysis, we determine the fundamental capacity limits of a
wireless network, subject to an energy consumption constraint. We propose a
scheduling and transmission power control mechanism to approach the optimal
solution to maximize spectrum and energy efficiencies in a practical network.
The distributed implementation of the proposed scheduling and transmission
power control scheme is presented based on our MAC framework proposed in [1].
Simulation results demonstrate that the proposed scheme achieves 40% higher
throughput than existing schemes. Also, the energy consumption using the
proposed scheme is about 20% of the energy consumed using existing power saving
MAC protocols.
","[{""version"":""v1"",""created"":""Sun, 18 Jun 2017 00:22:54 GMT""}]","2017-06-20"
"1706.05597","Akira Ishii Prof.","Akira Ishii","Analysis and Predictions of Social Phenomena via social media using
  Social Physics method","14 pages, 12 figures, accepted as the proceedings of the 3rd
  International Congress on Economics, Social Sciences and Information
  Management 2017 (ICESSIM 2016), which will be held in Bali - Indonesia, from
  01 - 02 April 2017",,,,"physics.soc-ph","http://arxiv.org/licenses/nonexclusive-distrib/1.0/","  As a method of analyzing and predicting social phenomena using social media
as data, we propose a method using a mathematical model of hit phenomenon which
is the theory of social physics. I could explain the transition of the number
of social media written in movies, TV dramas, Music Concerts, Pokemon GO and
proposed a method that can be used for analysis and prediction of social
phenomena.
","[{""version"":""v1"",""created"":""Sun, 18 Jun 2017 00:57:54 GMT""}]","2017-06-20"
"1706.05598","Tengyu Ma","Rong Ge and Tengyu Ma","On the Optimization Landscape of Tensor Decompositions","Best paper in the NIPS 2016 Workshop on Nonconvex Optimization for
  Machine Learning: Theory and Practice. In submission",,,,"cs.LG cs.DS math.OC math.PR stat.ML","http://arxiv.org/licenses/nonexclusive-distrib/1.0/","  Non-convex optimization with local search heuristics has been widely used in
machine learning, achieving many state-of-art results. It becomes increasingly
important to understand why they can work for these NP-hard problems on typical
data. The landscape of many objective functions in learning has been
conjectured to have the geometric property that ""all local optima are
(approximately) global optima"", and thus they can be solved efficiently by
local search algorithms. However, establishing such property can be very
difficult.
  In this paper, we analyze the optimization landscape of the random
over-complete tensor decomposition problem, which has many applications in
unsupervised learning, especially in learning latent variable models. In
practice, it can be efficiently solved by gradient ascent on a non-convex
objective. We show that for any small constant $\epsilon > 0$, among the set of
points with function values $(1+\epsilon)$-factor larger than the expectation
of the function, all the local maxima are approximate global maxima.
Previously, the best-known result only characterizes the geometry in small
neighborhoods around the true components. Our result implies that even with an
initialization that is barely better than the random guess, the gradient ascent
algorithm is guaranteed to solve this problem.
  Our main technique uses Kac-Rice formula and random matrix theory. To our
best knowledge, this is the first time when Kac-Rice formula is successfully
applied to counting the number of local minima of a highly-structured random
polynomial with dependent coefficients.
","[{""version"":""v1"",""created"":""Sun, 18 Jun 2017 01:18:42 GMT""}]","2017-06-20"
"1706.05599","Mohammadhossein Chaghazardi","Mohammadhossein Chaghazardi, Shuchin Aeron","Sample, computation vs storage tradeoffs for classification using tensor
  subspace models","5 Pages",,,,"cs.LG stat.ML","http://arxiv.org/licenses/nonexclusive-distrib/1.0/","  In this paper, we exhibit the tradeoffs between the (training) sample,
computation and storage complexity for the problem of supervised classification
using signal subspace estimation. Our main tool is the use of tensor subspaces,
i.e. subspaces with a Kronecker structure, for embedding the data into lower
dimensions. Among the subspaces with a Kronecker structure, we show that using
subspaces with a hierarchical structure for representing data leads to improved
tradeoffs. One of the main reasons for the improvement is that embedding data
into these hierarchical Kronecker structured subspaces prevents overfitting at
higher latent dimensions.
","[{""version"":""v1"",""created"":""Sun, 18 Jun 2017 01:36:20 GMT""},{""version"":""v2"",""created"":""Wed, 21 Jun 2017 07:18:15 GMT""},{""version"":""v3"",""created"":""Tue, 27 Jun 2017 16:40:44 GMT""}]","2017-06-28"
"1706.05600","Iman Sargolzahi","Iman Sargolzahi and Sayyed Yahya Mirafzali","Entanglement increase from local interaction in the absence of initial
  quantum correlation in the environment and between the system and the
  environment","8 pages, 1 figure. References are added. The title is changed","Phys. Rev. A 97, 022331 (2018)","10.1103/PhysRevA.97.022331",,"quant-ph","http://arxiv.org/licenses/nonexclusive-distrib/1.0/","  We consider a bipartite quantum system S=AB such that the part A is isolated
from the environment E and only the part B interacts with E. Under such
circumstances, entanglement of the system may experience decreases and
increases, during the evolution of the system. Here, we show that the
entanglement of the system can exceed its initial value, under such local
interaction, even though, at the initial moment, there is no entanglement in
the environment and the system and the environment are only classically
correlated. The case which is studied in this paper possesses another
interesting feature too: The reduced dynamics of the system can be modeled as a
completely positive map. In addition, we introduce the concept of inaccessible
entanglement to explain why entanglement can exceed its initial value, under
local interactions, in open quantum systems.
","[{""version"":""v1"",""created"":""Sun, 18 Jun 2017 01:37:45 GMT""},{""version"":""v2"",""created"":""Wed, 16 Aug 2017 10:33:25 GMT""},{""version"":""v3"",""created"":""Fri, 23 Feb 2018 18:26:32 GMT""}]","2018-02-26"
"1706.05601","Andrei Zotov","A. Zotov","Relativistic elliptic matrix tops and finite Fourier transformations","19 pages, minor corrections, some examples added","Modern Physics Letters A, 32 (2017) 1750169","10.1142/S0217732317501693",,"math-ph hep-th math.MP nlin.SI","http://arxiv.org/licenses/nonexclusive-distrib/1.0/","  We consider a family of classical elliptic integrable systems including
(relativistic) tops and their matrix extensions of different types. These
models can be obtained from the ""off-shell"" Lax pairs, which do not satisfy the
Lax equations in general case but become true Lax pairs under various
conditions (reductions). At the level of the off-shell Lax matrix there is a
natural symmetry between the spectral parameter $z$ and relativistic parameter
$\eta$. It is generated by the finite Fourier transformation, which we describe
in detail. The symmetry allows to consider $z$ and $\eta$ on an equal footing.
Depending on the type of integrable reduction any of the parameters can be
chosen to be the spectral one. Then another one is the relativistic deformation
parameter. As a by-product we describe the model of $N^2$ interacting $GL(M)$
matrix tops and/or $M^2$ interacting $GL(N)$ matrix tops depending on a choice
of the spectral parameter.
","[{""version"":""v1"",""created"":""Sun, 18 Jun 2017 02:25:12 GMT""},{""version"":""v2"",""created"":""Fri, 15 Sep 2017 16:13:48 GMT""},{""version"":""v3"",""created"":""Tue, 5 Dec 2017 02:23:18 GMT""}]","2017-12-06"
"1706.05602","Juan Li","Jose Blanchet, Juan Li, Marvin K. Nakayama","Rare-Event Simulation for Distribution Networks","27 pages",,,,"math.OC math.NA","http://arxiv.org/licenses/nonexclusive-distrib/1.0/","  We model equilibrium allocations in a distribution network as the solution of
a linear program (LP) which minimizes the cost of unserved demands across nodes
in the network. The constraints in the LP dictate that once a given node's
supply is exhausted, its unserved demand is distributed among neighboring
nodes. All nodes do the same and the resulting solution is the equilibrium
allocation. Assuming that the demands are random (following a jointly Gaussian
law), our goal is to study the probability that the optimal cost (i.e. the cost
of unserved demands in equilibrium) exceeds a large threshold, which is a rare
event. Our contribution is the development of importance sampling and
conditional Monte Carlo algorithms for estimating this probability. We
establish the asymptotic efficiency of our algorithms and also present
numerical results which illustrate strong performance of our procedures.
","[{""version"":""v1"",""created"":""Sun, 18 Jun 2017 03:03:58 GMT""}]","2017-06-20"
"1706.05603","Dapeng Zhan","Dapeng Zhan","Optimal H\""older Continuity and Dimension Properties for SLE with
  Minkowski Content Parametrization","Revisions were made according to the referees' comments",,,,"math.PR","http://arxiv.org/licenses/nonexclusive-distrib/1.0/","  We make use of the fact that a two-sided whole-plane Schramm-Loewner
evolution (SLE$_\kappa$) curve $\gamma$ for $\kappa\in(0,8)$ from $\infty$ to
$\infty$ through $0$ may be parametrized by its $d$-dimensional Minkowski
content, where $d=1+\frac\kappa 8$, and become a self-similar process of index
$\frac 1d$ with stationary increments. We prove that such $\gamma$ is locally
$\alpha$-H\""older continuous for any $\alpha<\frac 1d$. In the case
$\kappa\in(0,4]$, we show that $\gamma$ is not locally $\frac 1d$-H\""older
continuous. We also prove that, for any deterministic closed set $A\subset
\mathbb{R}$, the Hausdorff dimension of $\gamma(A)$ almost surely equals $d$
times the Hausdorff dimension of $A$.
","[{""version"":""v1"",""created"":""Sun, 18 Jun 2017 03:04:32 GMT""},{""version"":""v2"",""created"":""Mon, 31 Jul 2017 03:02:04 GMT""},{""version"":""v3"",""created"":""Fri, 14 Dec 2018 03:56:59 GMT""}]","2018-12-17"
"1706.05604","Mohsen Karimzadeh Kiskani","Mohsen Karimzadeh Kiskani and Hamid Sadjadpour","Secure and Private Cloud Storage Systems with Random Linear Fountain
  Codes","8 pages, 2 figures",,,,"cs.IT math.IT","http://arxiv.org/licenses/nonexclusive-distrib/1.0/","  An information theoretic approach to security and privacy called Secure And
Private Information Retrieval (SAPIR) is introduced. SAPIR is applied to
distributed data storage systems. In this approach, random combinations of all
contents are stored across the network. Our coding approach is based on Random
Linear Fountain (RLF) codes. To retrieve a content, a group of servers
collaborate with each other to form a Reconstruction Group (RG). SAPIR achieves
asymptotic perfect secrecy if at least one of the servers within an RG is not
compromised. Further, a Private Information Retrieval (PIR) scheme based on
random queries is proposed. The PIR approach ensures the users privately
download their desired contents without the servers knowing about the requested
contents indices. The proposed scheme is adaptive and can provide privacy
against a significant number of colluding servers.
","[{""version"":""v1"",""created"":""Sun, 18 Jun 2017 04:42:05 GMT""}]","2017-06-20"
