"1710.01110","Bayram Tekin","Gokcen Deniz Ozen, Sahin Kurekci, Bayram Tekin","Entropy in Born-Infeld Gravity","15 pages, an appendix on black hole entropy added, matches the
  published version","Phys. Rev. D 96, 124038 (2017)","10.1103/PhysRevD.96.124038",,"hep-th gr-qc","http://arxiv.org/licenses/nonexclusive-distrib/1.0/","  There is a class of higher derivative gravity theories that are in some sense
natural extensions of cosmological Einstein's gravity with a unique maximally
symmetric classical vacuum and only a massless spin-2 excitation about the
vacuum and no other perturbative modes. These theories are of the Born-Infeld
determinantal form. We show that the macroscopic dynamical entropy as defined
by Wald for bifurcate Killing horizons in these theories are equivalent to the
geometric Bekenstein-Hawking entropy (or more properly Gibbons-Hawking entropy
for the case of de Sitter spacetime) but given with an effective gravitational
constant which encodes all the information about the background spacetime and
the underlying theory. We also show that the higher curvature terms increase
the entropy. We carry out the computations in generic n-dimensions including
the particularly interesting limits of three, four and infinite number of
dimensions. We also give a preliminary discussion about the black hole entropy
in generic dimensions for the BI theories.
","[{""version"":""v1"",""created"":""Tue, 3 Oct 2017 12:42:44 GMT""},{""version"":""v2"",""created"":""Fri, 6 Oct 2017 12:18:45 GMT""},{""version"":""v3"",""created"":""Thu, 4 Jan 2018 14:15:13 GMT""}]","2018-01-08"
"1710.01111","Sarah Recchia","S. Recchia, S. Gabici","Non-linear acceleration at supernova remnant shocks and the hardening in
  the cosmic ray spectrum",,,"10.1093/mnrasl/slx191",,"astro-ph.HE","http://arxiv.org/licenses/nonexclusive-distrib/1.0/","  In the last few years several experiments have shown that the cosmic ray
spectrum below the knee is not a perfect power-law. In particular, the proton
and helium spectra show a spectral hardening by ~ 0.1-0.2 in spectral index at
particle energies of ~ 200-300 GeV/nucleon. Moreover, the helium spectrum is
found to be harder than that of protons by ~ 0.1 and some evidence for a
similar hardening was also found in the spectra of heavier elements. Here we
consider the possibility that the hardening may be the result of a dispersion
in the slope of the spectrum of cosmic rays accelerated at supernova remnant
shocks. Such a dispersion is indeed expected within the framework of non-linear
theories of diffusive shock acceleration, which predict steeper (harder)
particle spectra for larger (smaller) cosmic ray acceleration efficiencies.
","[{""version"":""v1"",""created"":""Tue, 3 Oct 2017 12:44:33 GMT""},{""version"":""v2"",""created"":""Sat, 14 Oct 2017 10:54:59 GMT""}]","2017-12-27"
"1710.01112","Santabrata Das","Biplob Sarkar, Santabrata Das and Samir Mandal","Properties of magnetically supported dissipative accretion flow around
  black holes with cooling effects","15 pages, 12 figures, accepted for publication in MNRAS on September
  25; comments welcome",,"10.1093/mnras/stx2505",,"astro-ph.HE","http://arxiv.org/licenses/nonexclusive-distrib/1.0/","  We investigate the global structure of the advection dominated accretion flow
around a Schwarzschild black hole where the accretion disc is threaded by
toroidal magnetic fields. We consider synchrotron radiative process as an
effective cooling mechanism active in the flow. With this, we obtain the global
transonic accretion solutions by exploring the variety of boundary conditions
and dissipation parameters, namely accretion rate (${\dot m}$) and viscosity
($\alpha_B$). The fact that depending on the initial parameters, steady state
accretion flows can possess centrifugally supported shock waves. These global
shock solutions exist even when the level of dissipation is relatively high. We
study the properties of shock waves and observe that the dynamics of the
post-shock corona (hereafter, PSC) is regulated by the flow parameters.
Interestingly, we find that shock solution disappears completely when the
dissipation parameters exceed their critical values. We calculate the critical
values of viscosity parameter ($\alpha^{\rm cri}_B$) adopting the canonical
values of adiabatic indices as $\gamma=4/3$ (ultra-relativistic) and $1.5$
(semi-non-relativistic) and find that in the gas pressure dominated domain,
$\alpha^{\rm cri}_B \sim 0.4$ for $\gamma=4/3$ and $\alpha^{\rm cri}_B \sim
0.27$ for $\gamma=1.5$, respectively. We further show that global shock
solutions are relatively more luminous compared to the shock free solutions.
Also, we have calculated the synchrotron spectra for shocked solutions. When
the shock is considered to be dissipative in nature, it would have an important
implication as the available energy at PSC can be utilized to power the
outflowing matter escaped from PSC. Towards this, we calculate the maximum
shock luminosity and discuss the observational implication of our present
formalism.
","[{""version"":""v1"",""created"":""Tue, 3 Oct 2017 12:47:16 GMT""}]","2017-11-29"
"1710.01113","Chiara Boldrini","Chiara Boldrini, Riccardo Incaini, Raffaele Bruno","Relocation in Car Sharing Systems with Shared Stackable Vehicles:
  Modelling Challenges and Outlook","IEEE ITSC 2017: 20th International Conference on Intelligent
  Transportation Systems, Yokohama, Japan. October 16 - 19, 2017",,,,"cs.PF","http://arxiv.org/licenses/nonexclusive-distrib/1.0/","  Car sharing is expected to reduce traffic congestion and pollution in cities
while at the same time improving accessibility to public transport. However,
the most popular form of car sharing, one-way car sharing, still suffers from
the vehicle unbalance problem. Innovative solutions to this issue rely on
custom vehicles with stackable capabilities: customers or operators can drive a
train of vehicles if necessary, thus efficiently bringing several cars from an
area with few requests to an area with many requests. However, how to model a
car sharing system with stackable vehicles is an open problem in the related
literature. In this paper, we propose a queueing theoretical model to fill this
gap, and we use this model to derive an upper-bound on user-based relocation
capabilities. We also validate, for the first time in the related literature,
legacy queueing theoretical models against a trace of real car sharing data.
Finally, we present preliminary results about the impact, on car availability,
of simple user-based relocation heuristics with stackable vehicles. Our results
indicate that user-based relocation schemes that exploit vehicle stackability
can significantly improve car availability at stations.
","[{""version"":""v1"",""created"":""Tue, 3 Oct 2017 12:49:43 GMT""}]","2017-10-04"
"1710.01114","Matthew Hale","Matthew T. Hale","Differential Privacy for Sets in Euclidean Space","14 pages, 3 figures; Submitted to ACC 2018",,,,"math.OC","http://arxiv.org/licenses/nonexclusive-distrib/1.0/","  As multi-agent systems become more numerous and more data-driven, novel forms
of privacy are needed in order to protect data types that are not accounted for
by existing privacy frameworks. In this paper, we present a new form of privacy
for set-valued data which extends the notion of differential privacy to sets
which users want to protect. While differential privacy is typically defined in
terms of probability distributions, we show that it is more natural here to
define privacy for sets over their capacity functionals, which capture the
probability of a random set intersecting some other set. In terms of sets'
capacity functionals, we provide a novel definition of differential privacy for
set-valued data. Based on this definition, we introduce the Laplacian
Perturbation Mechanism (so named because it applies random perturbations to
sets), and show that it provides ?-differential privacy as prescribed by our
definition. These theoretical results are supported by numerical results,
demonstrating the practical applicability of the developments made.
","[{""version"":""v1"",""created"":""Tue, 3 Oct 2017 12:55:02 GMT""}]","2017-10-04"
"1710.01115","Tahsin Reasat","Tahsin Reasat, Celia Shahnaz","Detection of Inferior Myocardial Infarction using Shallow Convolutional
  Neural Networks",,,"10.1109/R10-HTC.2017.8289058",,"cs.CV","http://arxiv.org/licenses/nonexclusive-distrib/1.0/","  Myocardial Infarction is one of the leading causes of death worldwide. This
paper presents a Convolutional Neural Network (CNN) architecture which takes
raw Electrocardiography (ECG) signal from lead II, III and AVF and
differentiates between inferior myocardial infarction (IMI) and healthy
signals. The performance of the model is evaluated on IMI and healthy signals
obtained from Physikalisch-Technische Bundesanstalt (PTB) database. A
subject-oriented approach is taken to comprehend the generalization capability
of the model and compared with the current state of the art. In a
subject-oriented approach, the network is tested on one patient and trained on
rest of the patients. Our model achieved a superior metrics scores (accuracy=
84.54%, sensitivity= 85.33% and specificity= 84.09%) when compared to the
benchmark. We also analyzed the discriminating strength of the features
extracted by the convolutional layers by means of geometric separability index
and euclidean distance and compared it with the benchmark model.
","[{""version"":""v1"",""created"":""Tue, 3 Oct 2017 12:56:49 GMT""},{""version"":""v2"",""created"":""Wed, 4 Oct 2017 13:30:22 GMT""},{""version"":""v3"",""created"":""Fri, 1 Dec 2017 08:51:11 GMT""},{""version"":""v4"",""created"":""Sat, 18 Aug 2018 04:59:13 GMT""}]","2018-08-21"
"1710.01116","Simon King","Luigi Delle Rose, Shaaban Khalil, Simon J. D. King, Carlo Marzo,
  Stefano Moretti, Cem S. Un","Supersymmetric Gauged B-L Model of Dark Matter and Fine Tuning","Prepared for proceedings for EPS-HEP 2017, talk presented by Simon
  King",,,,"hep-ph","http://arxiv.org/licenses/nonexclusive-distrib/1.0/","  We investigate how the Fine-Tuning (FT) in the B-L Supersymmetric Standard
Model (BLSSM) compares to the Minimally Supersymmetric Standard Model (MSSM),
where both models have universality. This is done for two scales: both low
(i.e. collider) and high (i.e. Grand Unified Theory (GUT)) scales. We see this
is similar for both models and the two scale regimes. We also study the
possible Dark Matter (DM) candidates each model offers in a realistic scenario
satisfying relic density constraints. Our findings are that whilst the
parameter space for the single MSSM DM candidate is severely constrained, the
BLSSM offers multiple candidates in a much wider region.
","[{""version"":""v1"",""created"":""Tue, 3 Oct 2017 12:58:07 GMT""}]","2017-10-04"
"1710.01118","Ana M. Montero","Ana M. Montero","Correlation functions and thermophysical properties of one-dimensional
  liquids","Bachelor's degree thesis (University of Extremadura); 61 pages, 30
  figures",,,,"cond-mat.soft cond-mat.stat-mech","http://arxiv.org/licenses/nonexclusive-distrib/1.0/","  The properties of one-dimensional liquids are studied for several interaction
potentials for which, under certain assumptions, the properties of the system
admit an analytical solution. The studied potentials are the triangle-well and
the ramp potential, and then we use the knowledge of these ones to study the
hard-rod and the sticky-hard-rod potentials. For each one of these potentials,
we study its equation of state and other thermodynamic quantities such as the
compressibility factor and the internal energy. Then, we study its correlation
functions, such as the radial distribution function, the structure factor and
the direct correlation function. For the latter one, the approximations known
as Percus--Yevick and hypernetted-chain have been compared to the analytical
result. Finally, the asymptotic behaviour of the radial distribution function
is studied and the Fisher--Widom line computed for the triangle-well potential.
","[{""version"":""v1"",""created"":""Mon, 2 Oct 2017 16:42:06 GMT""}]","2017-10-04"
"1710.01120","Shi Pi","Dan Li, Shi Pi, and Robert J. Scherrer","Oscillating scalar fields in extended quintessence","14 pages","Phys. Rev. D 97, 023530 (2018)","10.1103/PhysRevD.97.023530","YITP-17-103","gr-qc astro-ph.CO","http://arxiv.org/licenses/nonexclusive-distrib/1.0/","  We study a rapidly-oscillating scalar field with potential $V(\phi) =
k|\phi|^n$ nonminally coupled to the Ricci scalar $R$ via a term of the form
$(1- 8 \pi G_0 \xi \phi^2) R$ in the action. In the weak coupling limit, we
calculate the effect of the nonminimal coupling on the time-averaged equation
of state parameter $\gamma = (p + \rho)/\rho$. The change in $\langle \gamma
\rangle$ is always negative for $n \ge 2$ and always positive for $n < 0.71$
(which includes the case where the oscillating scalar field could serve as dark
energy), while it can be either positive or negative for intermediate values of
$n$. Constraints on the time-variation of $G$ force this change to be
infinitesimally small at the present time whenever the scalar field dominates
the expansion, but constraints in the early universe are not as stringent. The
rapid oscillation induced in $G$ also produces an additional contribution to
the Friedman equation that behaves like an effective energy density with a
stiff equation of state, but we show that, under reasonable assumptions, this
effective energy density is always smaller than the density of the scalar field
itself.
","[{""version"":""v1"",""created"":""Tue, 3 Oct 2017 13:01:44 GMT""}]","2018-01-31"
"1710.01122","Helen L Bear","Helen L. Bear, Stephen J. Cox, Richard W. Harvey","Speaker-independent machine lip-reading with speaker-dependent viseme
  classifiers",,"Helen L. Bear, Stephen J. Cox, Richard W. Harvey,
  Speaker-independent machine lip-reading with speaker-dependent viseme
  classifiers. Audio-Visual Speech Processing (AVSP) 2015, p190-195",,,"cs.CV eess.AS","http://arxiv.org/licenses/nonexclusive-distrib/1.0/","  In machine lip-reading, which is identification of speech from visual-only
information, there is evidence to show that visual speech is highly dependent
upon the speaker [1]. Here, we use a phoneme-clustering method to form new
phoneme-to-viseme maps for both individual and multiple speakers. We use these
maps to examine how similarly speakers talk visually. We conclude that broadly
speaking, speakers have the same repertoire of mouth gestures, where they
differ is in the use of the gestures.
","[{""version"":""v1"",""created"":""Tue, 3 Oct 2017 13:02:41 GMT""}]","2018-04-26"
"1710.01123","The ATLAS Collaboration","ATLAS Collaboration","Search for heavy resonances decaying into $WW$ in the $e\nu\mu\nu$ final
  state in $pp$ collisions at $\sqrt{s}=13$ TeV with the ATLAS detector","50 pages in total, author list starting page 34, 12 figures, 7
  tables, published version, all figures including auxiliary figures are
  available at:
  https://atlas.web.cern.ch/Atlas/GROUPS/PHYSICS/PAPERS/HIGG-2016-31","Eur. Phys. J. C 78 (2018) 24","10.1140/epjc/s10052-017-5491-4","CERN-EP-2017-214","hep-ex","http://creativecommons.org/licenses/by/4.0/","  A search for neutral heavy resonances is performed in the $WW\to e\nu\mu\nu$
decay channel using $pp$ collision data corresponding to an integrated
luminosity of 36.1 fb$^{-1}$, collected at a centre-of-mass energy of 13 TeV by
the ATLAS detector at the Large Hadron Collider. No evidence of such heavy
resonances is found. In the search for production via the quark--antiquark
annihilation or gluon--gluon fusion process, upper limits on $\sigma_X \times
B(X \to WW)$ as a function of the resonance mass are obtained in the mass range
between 200 GeV and up to 5 TeV for various benchmark models: a Higgs-like
scalar in different width scenarios, a two-Higgs-doublet model, a heavy vector
triplet model, and a warped extra dimensions model. In the vector-boson fusion
process, constraints are also obtained on these resonances, as well as on a
Higgs boson in the Georgi--Machacek model and a heavy tensor particle coupling
only to gauge bosons.
","[{""version"":""v1"",""created"":""Tue, 3 Oct 2017 13:03:05 GMT""},{""version"":""v2"",""created"":""Wed, 31 Jan 2018 14:15:12 GMT""}]","2018-02-01"
"1710.01125","Lars Simon","Lars Simon, Berit Stens{\o}nes","On Newton Diagrams of Plurisubharmonic Polynomials","12 pages",,,,"math.CV","http://arxiv.org/licenses/nonexclusive-distrib/1.0/","  Each extreme edge of the Newton diagram of a plurisubharmonic polynomial on
$\mathbb{C}^2$ gives rise to a plurisubharmonic polynomial. It is tempting to
believe that the union of the extreme edges or the convex hull of said union
will do the same. We construct a plurisubharmonic polynomial $P$ on
$\mathbb{C}^2$ with precisely two extreme edges $E_1$ and $E_2$, such that
neither $E_1\cup{E_2}$ nor $\text{Conv}({E_1\cup{}E_2})$ yields a
plurisubharmonic polynomial.
","[{""version"":""v1"",""created"":""Tue, 3 Oct 2017 13:08:04 GMT""}]","2017-10-04"
"1710.01127","Alex Olieman","Alex Olieman, Kaspar Beelen, and Jaap Kamps","Finding Talk About the Past in the Discourse of Non-Historians","Presented at Drift-a-LOD 2017",,,,"cs.IR cs.DL","http://arxiv.org/licenses/nonexclusive-distrib/1.0/","  A heightened interest in the presence of the past has given rise to the new
field of memory studies, but there is a lack of search and research tools to
support studying how and why the past is evoked in diachronic discourses.
Searching for temporal references is not straightforward. It entails bridging
the gap between conceptually-based information needs on one side, and
term-based inverted indexes on the other.
  Our approach enables the search for references to (intersubjective)
historical periods in diachronic corpora. It consists of a
semantically-enhanced search engine that is able to find references to many
entities at a time, which is combined with a novel interface that invites its
user to actively sculpt the search result set. Until now we have been concerned
mostly with user-friendly retrieval and selection of sources, but our tool can
also contribute to existing efforts to create reusable linked data from and for
research in the humanities.
","[{""version"":""v1"",""created"":""Tue, 3 Oct 2017 13:11:44 GMT""}]","2017-10-04"
"1710.01137","Pietro Miraglio","Eleonora Cinti, Pietro Miraglio and Enrico Valdinoci","One-dimensional symmetry for the solutions of a three-dimensional water
  wave problem",,,,,"math.AP","http://arxiv.org/licenses/nonexclusive-distrib/1.0/","  We prove a one-dimensional symmetry result for a weighted
Dirichlet-to-Neumann problem arising in a model for water waves in dimension 3.
More precisely we prove that minimizers and bounded monotone solutions depend
on only one Euclidean variable. The analogue of this result for the
2-dimensional case (and without weights) was established in an article by De La
Llave and the third author. In this paper, a crucial ingredient in the proof is
given by an energy estimate for minimizers obtained via a comparison argument.
","[{""version"":""v1"",""created"":""Tue, 3 Oct 2017 13:20:14 GMT""},{""version"":""v2"",""created"":""Thu, 26 Oct 2017 09:17:23 GMT""}]","2017-10-27"
"1710.01138","Jorge Lillo-Box","J. Lillo-Box, D. Barrado, P. Figueira, A. Leleu, N. C. Santos, A.C.M.
  Correia, P. Robutel, J. P. Faria","The TROY project: Searching for co-orbital bodies to known planets. I.
  Project goals and first results from archival radial velocity","Accepted for publication in A&A, 18 pages, 7 figures, 6 tables.
  Project website: http://www.sc.eso.org/~jlillobo/troy/","A&A 609, A96 (2018)","10.1051/0004-6361/201730652",,"astro-ph.EP","http://arxiv.org/licenses/nonexclusive-distrib/1.0/","  The detection of Earth-like planets, exocomets or Kuiper belts show that the
different components found in the solar system should also be present in other
planetary systems. Trojans are one of these components and can be considered
fossils of the first stages in the life of planetary systems. Their detection
in extrasolar systems would open a new scientific window to investigate
formation and migration processes. In this context, the main goal of the TROY
project is to detect exotrojans for the first time and to measure their
occurrence rate (eta-Trojan). In this first paper, we describe the goals and
methodology of the project. Additionally, we used archival radial velocity data
of 46 planetary systems to place upper limits on the mass of possible trojans
and investigate the presence of co-orbital planets down to several tens of
Earth masses. We used archival radial velocity data of 46 close-in (P<5 days)
transiting planets (without detected companions) with information from
high-precision radial velocity instruments. We took advantage of the time of
mid-transit and secondary eclipses (when available) to constrain the possible
presence of additional objects co-orbiting the star along with the planet.
This, together with a good phase coverage, breaks the degeneracy between a
trojan planet signature and signals coming from additional planets or
underestimated eccentricity. We identify nine systems for which the archival
data provide 1-sigma evidence for a mass imbalance between L4 and L5. Two of
these systems provide 2-sigma detection, but no significant detection is found
among our sample. We also report upper limits to the masses at L4/L5 in all
studied systems and discuss the results in the context of previous findings.
","[{""version"":""v1"",""created"":""Tue, 3 Oct 2017 13:21:08 GMT""}]","2018-01-24"
"1710.01139","Hui Xu","Hui Xu, Yangfan Zhou, Yu Kang, Michael R. Lyu","On Secure and Usable Program Obfuscation: A Survey",,,,,"cs.CR cs.SE","http://arxiv.org/licenses/nonexclusive-distrib/1.0/","  Program obfuscation is a widely employed approach for software intellectual
property protection. However, general obfuscation methods (e.g., lexical
obfuscation, control obfuscation) implemented in mainstream obfuscation tools
are heuristic and have little security guarantee. Recently in 2013, Garg et al.
have achieved a breakthrough in secure program obfuscation with a graded
encoding mechanism and they have shown that it can fulfill a compelling
security property, i.e., indistinguishability. Nevertheless, the mechanism
incurs too much overhead for practical usage. Besides, it focuses on
obfuscating computation models (e.g., circuits) rather than real codes. In this
paper, we aim to explore secure and usable obfuscation approaches from the
literature. Our main finding is that currently we still have no such approaches
made secure and usable. The main reason is we do not have adequate evaluation
metrics concerning both security and performance. On one hand, existing
code-oriented obfuscation approaches generally evaluate the increased obscurity
rather than security guarantee. On the other hand, the performance requirement
for model-oriented obfuscation approaches is too weak to develop practical
program obfuscation solutions.
","[{""version"":""v1"",""created"":""Tue, 3 Oct 2017 13:22:55 GMT""}]","2017-10-04"
"1710.01140","Vlad Avrigeanu","V. Avrigeanu, M. Avrigeanu","Consistent optical potential for incident and emitted low-energy
  $\alpha$ particles. II. $\alpha$-emission in fast-neutron induced reactions
  on Zr isotopes","18 pages, 11 figures, accepted for publication in Phys. Rev. C","Physical Review C 96, 044610 (2017)","10.1103/PhysRevC.96.044610",,"nucl-th","http://arxiv.org/licenses/nonexclusive-distrib/1.0/","  Background: Challenging questions of the $\alpha$-particle optical-model
potential (OMP) are still pointed out by recent high-precision measurements of
$\alpha$-induced reaction data below the Coulomb barrier. Moreover, the
reliability of a previous OMP for $\alpha$-particles on nuclei within the mass
number range 45$\leq$$A$$\leq$209 has been recently proved for emitted $\alpha$
particles as well, but only in the case of proton-induced reactions on Zn
isotopes [Phys. Rev. C {\bf 91}, 064611 (2015), Paper I].
  Purpose: Analysis of most recent $(\alpha,\gamma)$ reaction data for Ge and
Zr isotopes, which provides an additional validation of the above-mentioned
potential, is related to a further account of $\alpha$-particle emission in
neutron-induced reactions on Zr isotopes, at the same time with a suitable
description of all competitive processes.
  Methods: A consistent parameter set, established or validated by independent
analysis of recent various data, particularly $\gamma$-ray strength functions,
have been involved within model calculation of the $(\alpha,\gamma)$ as well as
$(n,\alpha)$ reaction cross sections. The latter are part of the whole analysis
of the neutron activation of Zr isotopes, in order to avoid any error
compensation or latent ambiguity.
  Results: The aforesaid potential provides a consistent description of recent
$\alpha$-induced reaction data with no empirical rescaling factors of the
$\gamma$ and/or nucleon widths. On the other hand, its use leads to
underestimated predictions of the pre-equilibrium emission and statistical
models for the $(n,\alpha)$ reaction cross sections.
  Conclusions: An optical potential with a volume imaginary component seems to
be needed to describe the low-energy $\alpha$-particle evaporation, while only
surface absorption occurs in $\alpha$-induced reactions at similar energies.
","[{""version"":""v1"",""created"":""Tue, 3 Oct 2017 13:23:44 GMT""}]","2017-10-17"
