"1710.00745","Hao Zhang","Hao Zhang, Scott T. M. Dawson, Clarence W. Rowley, Eric A. Deem, Louis
  N. Cattafesta","Evaluating the accuracy of the dynamic mode decomposition","21 pages, 10 figures",,,,"math.DS","http://arxiv.org/licenses/nonexclusive-distrib/1.0/","  Dynamic mode decomposition (DMD) gives a practical means of extracting
dynamic information from data, in the form of spatial modes and their
associated frequencies and growth/decay rates. DMD can be considered as a
numerical approximation to the Koopman operator, an infinite-dimensional linear
operator defined for (nonlinear) dynamical systems. This work proposes a new
criterion to estimate the accuracy of DMD on a mode-by-mode basis, by
estimating how closely each individual DMD eigenfunction approximates the
corresponding Koopman eigenfunction. This approach does not require any prior
knowledge of the system dynamics or the true Koopman spectral decomposition.
The method may be applied to extensions of DMD (i.e., extended/kernel DMD),
which are applicable to a wider range of problems. The accuracy criterion is
first validated against the true error with a synthetic system for which the
true Koopman spectral decomposition is known. We next demonstrate how this
proposed accuracy criterion can be used to assess the performance of various
choices of kernel when using the kernel method for extended DMD. Finally, we
show that our proposed method successfully identifies modes of high accuracy
when applying DMD to data from experiments in fluids, in particular particle
image velocimetry of a cylinder wake and a canonical separated boundary layer.
","[{""version"":""v1"",""created"":""Mon, 2 Oct 2017 16:00:37 GMT""}]","2017-10-03"
"1710.00746","Michal Kreps","Thomas Blake and Michal Kreps","Angular distribution of polarised $\Lambda_b$ baryons decaying to
  $\Lambda \ell^+\ell^-$",,"JHEP 11 (2017) 138","10.1007/JHEP11(2017)138","EOS-2017-02","hep-ph","http://creativecommons.org/licenses/by/4.0/","  Rare $b \to s\ell^+\ell^-$ flavour-changing-neutral-current processes provide
important tests of the Standard Model of particle physics. Angular observables
in exclusive $b \to s\ell^+\ell^-$ processes can be particularly powerful as
they allow hadronic uncertainties to be controlled. Amongst the exclusive
processes that have been studied by experiments, the decay $\Lambda_b\to
\Lambda\ell^+\ell^-$ is unique in that the $\Lambda_b$ baryon can be produced
polarised. In this paper, we derive an expression for the angular distribution
of the $\Lambda_b\to \Lambda\ell^+\ell^-$ decay for the case where the
$\Lambda_b$ baryon is produced polarised. This extends the number of angular
observables in this decay from 10 to 34. Standard Model expectations for the
new observables are provided and the sensitivity of the observables is explored
under a variety of new physics models. At low-hadronic recoil, four of the new
observables have a new short distance dependence that is absent in the
unpolarised case. The remaining observables depend on the same short distance
contributions as the unpolarised observables, but with different dependence on
hadronic form-factors. These relations provide possibilities for novel tests of
the SM that could be carried out with the data that will become available at
the LHC or a future $e^+e^-$ collider.
","[{""version"":""v1"",""created"":""Mon, 2 Oct 2017 16:01:24 GMT""},{""version"":""v2"",""created"":""Wed, 6 Dec 2017 12:08:52 GMT""}]","2017-12-07"
"1710.00747","Chandrima Ganguly","Chandrima Ganguly and John D. Barrow","Evolution of Cyclic Mixmaster Universes with Non-comoving Radiation","18 pages, 26 figures","Phys. Rev. D 96, 123534 (2017)","10.1103/PhysRevD.96.123534",,"gr-qc hep-th","http://arxiv.org/licenses/nonexclusive-distrib/1.0/","  We study a model of a cyclic, spatially homogeneous, anisotropic 'mixmaster'
universe of Bianchi type IX, containing a radiation field with non-comoving
('tilted' with respect to the tetrad frame of reference) velocities and
vorticity. We employ a combination of numerical and approximate analytic
methods to investigate the consequences of the second law of thermodynamics on
the evolution. We model a smooth cycle-to-cycle evolution of the mixmaster
universe, bouncing at a finite minimum, by the device of adding a comoving
'ghost' field with negative energy density. In the absence of a cosmological
constant, an increase in entropy, injected at the start of each cycle, causes
an increase in the volume maxima, increasing approach to flatness, falling
velocities and vorticities, and growing anisotropy at the expansion maxima of
successive cycles. We find that the velocities oscillate rapidly as they evolve
and change logarithmically in time relative to the expansion volume. When the
conservation of momentum and angular momentum constraints are imposed, the
spatial components of these velocities fall to smaller values when the entropy
density increases, and vice versa. Isotropisation is found to occur when a
positive cosmological constant is added because the sequence of oscillations
ends and the dynamics expand forever, evolving towards a quasi de Sitter
asymptote with constant velocity amplitudes. The case of a single cycle of
evolution with a negative cosmological constant added is also studied.
","[{""version"":""v1"",""created"":""Mon, 2 Oct 2017 16:01:47 GMT""}]","2018-01-03"
"1710.00748","Mehmet Aktas","Mehmet Fatih Aktas, Pei Peng, Emina Soljanin","Effective Straggler Mitigation: Which Clones Should Attack and When?","Published at MAMA Workshop in conjunction with ACM Sigmetrics, June
  5, 2017",,,,"cs.PF cs.DC cs.IT math.IT","http://arxiv.org/licenses/nonexclusive-distrib/1.0/","  Redundancy for straggler mitigation, originally in data download and more
recently in distributed computing context, has been shown to be effective both
in theory and practice. Analysis of systems with redundancy has drawn
significant attention and numerous papers have studied pain and gain of
redundancy under various service models and assumptions on the straggler
characteristics. We here present a cost (pain) vs. latency (gain) analysis of
using simple replication or erasure coding for straggler mitigation in
executing jobs with many tasks. We quantify the effect of the tail of task
execution times and discuss tail heaviness as a decisive parameter for the cost
and latency of using redundancy. Specifically, we find that coded redundancy
achieves better cost vs. latency and allows for greater achievable latency and
cost tradeoff region compared to replication and can yield reduction in both
cost and latency under less heavy tailed execution times. We show that delaying
redundancy is not effective in reducing cost.
","[{""version"":""v1"",""created"":""Mon, 2 Oct 2017 16:04:27 GMT""}]","2017-10-03"
"1710.00749","Qudsia Gani","Qudsia Gani and W. Bari","Cross-sections for $\nu_{\mu}$ and $\bar{\nu_{\mu}}$ induced single pion
  production processes in the few GeV using NuWro",,,,,"hep-ph","http://arxiv.org/licenses/nonexclusive-distrib/1.0/","  For a continued progress in the pursuit of neutrino oscillation parameters,
we require to have a precise knowledge of the pion production processes which
act as a source of backgrounds and systematic uncertainties in neutrino
oscillation experiments because pions can mimic a final state electron
(positron). Therefore a pion production principal interaction may appear to be
quasi-elastic if the pion is absorbed in the final state interactions.
Charged-current single pion production processes induced by $\nu_{\mu}$ and
$\bar{\nu_{\mu}}$ interactions with hydrocarbon target $(CH_{2})$ has been
studied using NuWro event generator and the cross-sections so obtained have
been compared with the results of Miner$\nu$A experiment.
","[{""version"":""v1"",""created"":""Mon, 2 Oct 2017 16:05:32 GMT""}]","2017-10-19"
"1710.00750","Luis Anchordoqui","Luis A. Anchordoqui and Jorge F. Soriano","New test of Lorentz symmetry using ultrahigh-energy cosmic rays","To be published in PRD","Phys. Rev. D 97, 043010 (2018)","10.1103/PhysRevD.97.043010",,"hep-ph astro-ph.HE","http://arxiv.org/licenses/nonexclusive-distrib/1.0/","  We propose an innovative test of Lorentz symmetry by observing pairs of
simultaneous parallel extensive air showers produced by the fragments of
ultrahigh-energy cosmic ray nuclei which disintegrated in collisions with solar
photons. We show that the search for a cross-correlation of showers in arrival
time and direction becomes background free for an angular scale < 3^\circ and a
time window {\cal O}(10 s). We also show that if the solar photo-disintegration
probability of helium is {\cal O} (10^{-5.5}) then the hunt for spatiotemporal
coincident showers could be within range of existing cosmic ray facilities,
such as the Pierre Auger Observatory. We demonstrate that the actual
observation of a few events can be used to constrain Lorentz violating
dispersion relations of the nucleon.
","[{""version"":""v1"",""created"":""Mon, 2 Oct 2017 16:08:41 GMT""},{""version"":""v2"",""created"":""Wed, 8 Nov 2017 12:00:53 GMT""},{""version"":""v3"",""created"":""Thu, 1 Feb 2018 14:30:11 GMT""}]","2018-02-21"
"1710.00751","Dirk Nuyens","Ivan G. Graham, Frances Y. Kuo, Dirk Nuyens, Rob Scheichl, Ian H.
  Sloan","Analysis of circulant embedding methods for sampling stationary random
  fields",,,,,"math.NA","http://arxiv.org/licenses/nonexclusive-distrib/1.0/","  In this paper we prove, under mild conditions, that the positive definiteness
of the circulant matrix appearing in the circulant embedding method is always
guaranteed, provided the enclosing cube is sufficiently large. We examine in
detail the case of the Mat\'ern covariance, and prove (for fixed correlation
length) that, as $h_0\rightarrow 0$, positive definiteness is guaranteed when
the random field is sampled on a cube of size order $(1 + \nu^{1/2} \log
h_0^{-1})$ times larger than the size of the physical domain. (Here $h_0$ is
the mesh spacing of the regular grid and $\nu$ the Mat\'ern smoothness
parameter.) We show that the sampling cube can become smaller as the
correlation length decreases when $h_0$ and $\nu$ are fixed. Our results are
confirmed by numerical experiments. We prove several results about the decay of
the eigenvalues of the circulant matrix. These lead to the conjecture, verified
by numerical experiment, that they decay with the same rate as the
Karhunen--Lo\`{e}ve eigenvalues of the covariance operator.
","[{""version"":""v1"",""created"":""Mon, 2 Oct 2017 16:09:33 GMT""},{""version"":""v2"",""created"":""Tue, 20 Mar 2018 15:54:38 GMT""}]","2018-03-21"
"1710.00752","Mihai Horoi","Mihai Horoi and Jayani Dissanayake","Constant temperature description of the nuclear level densities",,,"10.1063/1.5016131",,"nucl-th","http://arxiv.org/licenses/nonexclusive-distrib/1.0/","  The spin and parity dependent nuclear level densities (NLD) are calculated
for medium-heavy nuclei using shell model techniques. The NLD are used to
calculate cross sections and reaction rates of interest for nuclear
astrophysics and nuclear energy applications. We investigate a new approach of
describing the shell model NLD via a constant temperature parametrization. This
approach provides new information about the effects of symmetries on the
temperature of the low-lying nuclear states, and it is shown to be more
versatile for applications.
","[{""version"":""v1"",""created"":""Mon, 2 Oct 2017 16:10:19 GMT""}]","2018-01-17"
"1710.00753","Markus Faulhuber","Markus Faulhuber","A Short Note on the Frame Set of Odd Functions","accepted: Bulletin of the Australian Mathematical Society; 12 pages;
  Version 3 makes use of symmetric time-frequency shifts. In this case the
  appearing phase factors are easier to handle. Also, the main result is
  extended to higher dimensions. [In Version 2 a mistake in the assumptions was
  corrected. The windows should be chosen from Feichtinger's algebra rather
  than from the Hilbert space L2.]","Bulletin of the Australian Mathematical Society, 98(3):481-493,
  Dec 2018","10.1017/S0004972718000746",,"math.FA math-ph math.MP","http://arxiv.org/licenses/nonexclusive-distrib/1.0/","  In this work we derive a simple argument which shows that Gabor systems
consisting of odd functions of $d$ variables and symplectic lattices of density
$2^d$ cannot constitute a Gabor frame. In the 1--dimensional, separable case,
this is a special case of a result proved by Lyubarskii and Nes, however, we
use a different approach in this work exploiting the algebraic relation between
the ambiguity function and the Wigner distribution as well as their relation
given by the (symplectic) Fourier transform. Also, we do not need the
assumption that the lattice is separable and, hence, new restrictions are added
to the full frame set of odd functions.
","[{""version"":""v1"",""created"":""Mon, 2 Oct 2017 16:17:42 GMT""},{""version"":""v2"",""created"":""Fri, 6 Oct 2017 12:40:15 GMT""},{""version"":""v3"",""created"":""Mon, 11 Jun 2018 12:59:47 GMT""}]","2018-12-07"
"1710.00754","Volker Schlue","Grigorios Fournodavlos, Volker Schlue","On ""hard stars"" in general relativity","v1: 30 pages, 2 figures. v2: 41 pages, 2 figures; Section 4 now
  includes a linearisation of the Einstein-Euler equations, a new uniform
  boundedness result, and the construction of periodic solutions for the
  linearised system; abstract and Section 1.3 extended to reflect these
  additions; various remarks and references added; to appear in AHP","Ann. Henri Poincare 20, 2135-2172 (2019)","10.1007/s00023-019-00793-4",,"math.AP gr-qc physics.flu-dyn","http://arxiv.org/licenses/nonexclusive-distrib/1.0/","  We study spherically symmetric solutions to the Einstein-Euler equations
which model an idealized relativistic neutron star surrounded by vacuum. These
are barotropic fluids with a free boundary, governed by an equation of state
which sets the speed of sound equal to the speed of light. We demonstrate the
existence of a 1-parameter family of static solutions, or ''hard stars,'' and
describe their stability properties:
  First, we show that small stars are a local minimum of the mass energy
functional under variations which preserve the total number of particles. In
particular, we prove that the second variation of the mass energy functional
controls the ''mass aspect function.''
  Second, we derive the linearisation of the Euler-Einstein system around small
stars in ''comoving coordinates,'' and prove a uniform boundedness statement
for an energy, which is exactly at the level of the variational argument.
Finally, we exhibit the existence of time periodic solutions to the linearised
system, which shows that energy boundedness is optimal for this problem.
","[{""version"":""v1"",""created"":""Mon, 2 Oct 2017 16:19:36 GMT""},{""version"":""v2"",""created"":""Mon, 4 Mar 2019 06:47:14 GMT""}]","2021-08-16"
"1710.00756","Jing Liao","Mingming He, Jing Liao, Dongdong Chen, Lu Yuan and Pedro V. Sander","Progressive Color Transfer with Dense Semantic Correspondences","Accepted by TOG",,,,"cs.CV","http://arxiv.org/licenses/nonexclusive-distrib/1.0/","  We propose a new algorithm for color transfer between images that have
perceptually similar semantic structures. We aim to achieve a more accurate
color transfer that leverages semantically-meaningful dense correspondence
between images. To accomplish this, our algorithm uses neural representations
for matching. Additionally, the color transfer should be spatially variant and
globally coherent. Therefore, our algorithm optimizes a local linear model for
color transfer satisfying both local and global constraints. Our proposed
approach jointly optimizes matching and color transfer, adopting a
coarse-to-fine strategy. The proposed method can be successfully extended from
one-to-one to one-to-many color transfer. The latter further addresses the
problem of mismatching elements of the input image. We validate our proposed
method by testing it on a large variety of image content.
","[{""version"":""v1"",""created"":""Mon, 2 Oct 2017 16:25:41 GMT""},{""version"":""v2"",""created"":""Wed, 12 Dec 2018 18:47:07 GMT""}]","2018-12-13"
"1710.00757","Jan Goedgebeur","Jan Goedgebeur","On the smallest snarks with oddness 4 and connectivity 2","5 pages","Electron. J. Comb. 25(2) (2018)",,,"math.CO cs.DM","http://arxiv.org/licenses/nonexclusive-distrib/1.0/","  A snark is a bridgeless cubic graph which is not 3-edge-colourable. The
oddness of a bridgeless cubic graph is the minimum number of odd components in
any 2-factor of the graph.
  Lukot'ka, M\'acajov\'a, Maz\'ak and \v{S}koviera showed in [Electron. J.
Combin. 22 (2015)] that the smallest snark with oddness 4 has 28 vertices and
remarked that there are exactly two such graphs of that order. However, this
remark is incorrect as -- using an exhaustive computer search -- we show that
there are in fact three snarks with oddness 4 on 28 vertices. In this note we
present the missing snark and also determine all snarks with oddness 4 up to 34
vertices.
","[{""version"":""v1"",""created"":""Mon, 2 Oct 2017 16:26:46 GMT""},{""version"":""v2"",""created"":""Fri, 27 Apr 2018 13:43:30 GMT""}]","2018-04-30"
"1710.00758","Nikolai Wyderka","Nikolai Wyderka, Felix Huber, Otfried G\""uhne","Constraints on correlations in multiqubit systems","8 pages, 1 figure, fixed a mistake (see ""Note added"" at the end of
  the text)","Phys. Rev. A 97, 060101 (2018)","10.1103/PhysRevA.97.060101",,"quant-ph","http://arxiv.org/licenses/nonexclusive-distrib/1.0/","  The set of correlations between particles in multipartite quantum systems is
larger than those in classical systems. Nevertheless, it is subject to
restrictions by the underlying quantum theory. In order to better understand
the structure of this set, a possible strategy is to divide all correlations
into two components, depending on the question of whether they involve an odd
or an even number of particles. For pure multi-qubit states we prove that these
two components are inextricably interwoven and often one type of correlations
completely determines the other. As an application, we prove that all pure
qubit states with an odd number of qubits are uniquely determined among all
mixed states by the odd component of the correlations. In addition, our
approach leads to invariants under the time evolution with Hamiltonians
containing only odd correlations and can simplify entanglement detection.
","[{""version"":""v1"",""created"":""Mon, 2 Oct 2017 16:26:54 GMT""},{""version"":""v2"",""created"":""Wed, 27 Jun 2018 12:20:00 GMT""},{""version"":""v3"",""created"":""Tue, 9 Apr 2019 11:28:56 GMT""}]","2019-04-10"
"1710.00759","Brajesh Gupt","Brajesh Gupt","Constraining Planck scale physics with CMB and Reionization Optical
  Depth","5 pages, 3 figures",,,"IGC-17/10-1","astro-ph.CO gr-qc hep-th","http://arxiv.org/licenses/nonexclusive-distrib/1.0/","  We present proof of principle for a two way interplay between physics at very
early Universe and late time observations. We find a relation between
primordial mechanisms responsible for large scale power suppression in the
primordial power spectrum and the value of reionization optical depth $\tau$.
Such mechanisms can affect the estimation of $\tau$. We show that using future
measurements of $\tau$, one can obtain constraints on the pre-inflationary
dynamics, providing a new window on the physics of the very early Universe.
Furthermore, the new, re-estimated $\tau$ can potentially resolve moderate
discrepancy between high and low-$\ell$ measurements of $\tau$, hence providing
empirical support for the power suppression anomaly and its primordial origin.
","[{""version"":""v1"",""created"":""Mon, 2 Oct 2017 16:27:22 GMT""}]","2017-10-04"
"1710.00760","Majdi Khalid","Majdi Khalid, Indrakshi Ray, and Hamidreza Chitsaz","Scalable Nonlinear AUC Maximization Methods",,,,,"cs.LG","http://arxiv.org/licenses/nonexclusive-distrib/1.0/","  The area under the ROC curve (AUC) is a measure of interest in various
machine learning and data mining applications. It has been widely used to
evaluate classification performance on heavily imbalanced data. The kernelized
AUC maximization machines have established a superior generalization ability
compared to linear AUC machines because of their capability in modeling the
complex nonlinear structure underlying most real-world data. However, the high
training complexity renders the kernelized AUC machines infeasible for
large-scale data. In this paper, we present two nonlinear AUC maximization
algorithms that optimize pairwise linear classifiers over a finite-dimensional
feature space constructed via the k-means Nystr\""{o}m method. Our first
algorithm maximize the AUC metric by optimizing a pairwise squared hinge loss
function using the truncated Newton method. However, the second-order batch AUC
maximization method becomes expensive to optimize for extremely massive
datasets. This motivate us to develop a first-order stochastic AUC maximization
algorithm that incorporates a scheduled regularization update and scheduled
averaging techniques to accelerate the convergence of the classifier.
Experiments on several benchmark datasets demonstrate that the proposed AUC
classifiers are more efficient than kernelized AUC machines while they are able
to surpass or at least match the AUC performance of the kernelized AUC
machines. The experiments also show that the proposed stochastic AUC classifier
outperforms the state-of-the-art online AUC maximization methods in terms of
AUC classification accuracy.
","[{""version"":""v1"",""created"":""Mon, 2 Oct 2017 16:28:35 GMT""},{""version"":""v2"",""created"":""Tue, 27 Mar 2018 19:24:33 GMT""},{""version"":""v3"",""created"":""Sun, 9 Sep 2018 00:30:18 GMT""},{""version"":""v4"",""created"":""Mon, 29 Apr 2019 05:26:04 GMT""}]","2019-04-30"
"1710.00761","Niko Tratnik Mr.","Niko Tratnik, Dong Ye","Resonance Graphs and Perfect Matchings of Graphs on Surfaces",,,,,"math.CO","http://arxiv.org/licenses/nonexclusive-distrib/1.0/","  Let $G$ be a graph embedded in a surface and let $\mathcal F$ be a set of
even faces of $G$ (faces bounded by a cycle of even length). The resonance
graph of $G$ with respect to $\mathcal F$, denoted by $R(G;\mathcal F)$, is a
graph such that its vertex set is the set of all perfect matchings of $G$ and
two vertices $M_1$ and $M_2$ are adjacent to each other if and only if the
symmetric difference $M_1\oplus M_2$ is a cycle bounding some face in $\mathcal
F$. It has been shown that if $G$ is a matching-covered plane bipartite graph,
the resonance graph of $G$ with respect to the set of all inner faces is
isomorphic to the covering graph of a distributive lattice. It is evident that
the resonance graph of a plane graph $G$ with respect to an even-face set
$\mathcal F$ may not be the covering graph of a distributive lattice. In this
paper, we show the resonance graph of a graph $G$ on a surface with respect to
a given even-face set $\mathcal F$ can always be embedded into a hypercube as
an induced subgraph. Furthermore, we show that the Clar covering polynomial of
$G$ with respect to $\mathcal F$ is equal to the cube polynomial of the
resonance graph $R(G;\mathcal F)$, which generalizes previous results on some
subfamilies of plane graphs.
","[{""version"":""v1"",""created"":""Mon, 2 Oct 2017 16:29:45 GMT""}]","2017-10-03"
"1710.00762","Ernest Ma","Corey Kownacki, Ernest Ma, Nicholas Pollard, Oleg Popov, and
  Mohammadreza Zakeri","Dark Revelations of the $[SU(3)]^3$ and $[SU(3)]^4$ Gauge Extensions of
  the Standard Model","12 pages, no figure",,"10.1016/j.physletb.2017.12.018","UCRHEP-T585 (Oct 2017)","hep-ph","http://arxiv.org/licenses/nonexclusive-distrib/1.0/","  Two theoretically well-motivated gauge extensions of the standard model are
$SU(3)_C \times SU(3)_L \times SU(3)_R$ and $SU(3)_q \times SU(3)_L \times
SU(3)_l \times SU(3)_R$, where $SU(3)_q$ is the same as $SU(3)_C$ and $SU(3)_l$
is its color leptonic counterpart. Each as three variations, according to how
$SU(3)_R$ is broken. It is shown here for the first time that a built-in dark
$U(1)_D$ gauge symmetry exists in all six versions, and may be broken to
discrete $Z_2$ dark parity. The available dark matter candidates in each case
include fermions, scalars, as well as {\it vector gauge bosons}. This work
points to the unity of matter with dark matter, the origin of which is not {\it
ad hoc}.
","[{""version"":""v1"",""created"":""Mon, 2 Oct 2017 16:30:52 GMT""}]","2018-01-17"
