"1710.01004","Narbe Mardirossian","Narbe Mardirossian, James D. McClain, Garnet Kin-Lic Chan","Lowering of the complexity of quantum chemistry methods by choice of
  representation",,,"10.1063/1.5007779",,"physics.chem-ph","http://arxiv.org/licenses/nonexclusive-distrib/1.0/","  The complexity of the standard hierarchy of quantum chemistry methods is not
invariant to the choice of representation. This work explores how the scaling
of common quantum chemistry methods can be reduced using real-space,
momentum-space, and time-dependent intermediate representations without
introducing approximations. We find the scalings of exact Gaussian basis
Hartree--Fock theory, second-order M{\o}ller-Plesset perturbation theory, and
coupled cluster theory (specifically, linearized coupled cluster doubles and
the distinguishable cluster approximation with doubles) to be
$\mathcal{O}(N^3)$, $\mathcal{O}(N^3)$, and $\mathcal{O}(N^5)$ respectively,
where $N$ denotes system size. These scalings are not asymptotic and hold over
all ranges of $N$.
","[{""version"":""v1"",""created"":""Tue, 3 Oct 2017 06:32:37 GMT""}]","2018-02-14"
"1710.01005","Andrew Lucas","Andrew Lucas","Constraints on hydrodynamics from many-body quantum chaos","7 + 19 pages, 1+0 figures. v2: revised presentation of key results,
  added small calculations on SYK chains",,,,"hep-th cond-mat.stat-mech cond-mat.str-el","http://arxiv.org/licenses/nonexclusive-distrib/1.0/","  Is the hydrodynamics of an interacting many-body system fundamentally limited
by basic principles of quantum mechanics? Starting with the conjecture that
viscosity is at least as large as entropy density (as measured in fundamental
units), there has been a long search for a precise answer to this question. In
this work, we identify a simple relationship between hydrodynamics and
many-body quantum chaos in a broad class of experimentally realizable systems.
Consistency with the quantum butterfly effect leads to upper bounds on the
speed of sound and diffusion constants of hydrodynamics. These bounds link two
very different theories of quantum many-body dynamics, clarify the relationship
between classical hydrodynamics and quantum information loss, and provide a
simple way to constrain theories of thermalization and quantum chaos in
experiments.
","[{""version"":""v1"",""created"":""Tue, 3 Oct 2017 06:32:46 GMT""},{""version"":""v2"",""created"":""Wed, 25 Oct 2017 20:06:53 GMT""}]","2017-10-27"
"1710.01006","Szymon Szott","Szymon Szott, Jerzy Konorski","Selfish Attacks in Two-hop IEEE 802.11 Relay Networks: Impact and
  Countermeasures","4 pages, 3 figures, 1 table, letter",,"10.1109/LWC.2018.2809726",,"cs.NI","http://arxiv.org/licenses/nonexclusive-distrib/1.0/","  In IEEE 802.11 networks, selfish stations can pursue a better quality of
service (QoS) through selfish MAC-layer attacks. Such attacks are easy to
perform, secure routing protocols do not prevent them, and their detection may
be complex. Two-hop relay topologies allow a new angle of attack: a selfish
relay can tamper with either source traffic, transit traffic, or both. We
consider the applicability of selfish attacks and their variants in the two-hop
relay topology, quantify their impact, and study defense measures.
","[{""version"":""v1"",""created"":""Tue, 3 Oct 2017 06:34:27 GMT""},{""version"":""v2"",""created"":""Tue, 16 Jan 2018 11:19:48 GMT""}]","2018-08-01"
"1710.01007","Ilaria Brivio","Ilaria Brivio","The Neutrino Option","5 + 1 pages, 4 figures. Contribution to the proceedings of EPS-HEP
  2017, European Physical Society conference on High Energy Physics, 5-12 July
  2017, Venice, Italy. Reference added",,,,"hep-ph","http://arxiv.org/licenses/nonexclusive-distrib/1.0/","  We discuss the possibility that the Higgs potential and electroweak scale are
generated radiatively in a type-I seesaw scenario. A Higgs potential consistent
with experimental constraints can be obtained in this hypothesis for a Majorana
mass scale $m_N\sim 10-500$ PeV and with neutrino Yukawa couplings of order
$|\omega|\sim 10^{-4.5}-10^{-6}$. Remarkably, neutrino masses and mixings can
be simultaneously accommodated within this parameter space. This framework,
that ties together Higgs phenomenology, precision top quark mass measurements
and neutrino physics, represents an alternative approach to the hierarchy
problem, in which the Higgs mass is not stabilized around the TeV scale, but
rather determined by radiative corrections at higher energies. Traditional
hurdles in overcoming the hierarchy problem are then traded for the new
challenge of generating PeV Majorana masses while suppressing the tree-level
scalar potential in the UV.
","[{""version"":""v1"",""created"":""Tue, 3 Oct 2017 06:45:29 GMT""},{""version"":""v2"",""created"":""Mon, 27 Nov 2017 13:26:20 GMT""}]","2017-11-28"
"1710.01008","Taro Fujisawa","Taro Fujisawa","A remark on semipositivity theorems","The notation in Example 4.6 is slightly changed",,,,"math.AG","http://arxiv.org/licenses/nonexclusive-distrib/1.0/","  We propose a new class of filtered vector bundles, which is related to
variation of (mixed) Hodge structures and give a slight generalization of the
Fujita--Zucker--Kawamata semipositivity theorem.
","[{""version"":""v1"",""created"":""Tue, 3 Oct 2017 06:58:45 GMT""},{""version"":""v2"",""created"":""Sun, 8 Oct 2017 04:25:13 GMT""}]","2017-10-10"
"1710.01009","Luca Lista","Luca Lista (on behalf of the CMS Collaboration)","Top quark measurements in the CMS experiment","8 pages, 3 figures. To be submitted to European Physical Journal Web
  of Conferences","Front.in Phys. 17 (2017) 29, Proceedings of the 6th International
  Conference on New Frontiers in Physics, 17-29 August 2017, Kolymbari, Greece","10.1051/epjconf/201818202074","CMS CR-2017/270","hep-ex","http://arxiv.org/licenses/nonexclusive-distrib/1.0/","  Experimental results on top-quark physics obtained at the CMS experiment are
reported based on the data recorded at centre-of-mass energy up to 13 TeV.
Inclusive and differential cross sections for both top-quark pair and single
top-quark production are presented, as well as measurements of top-quark
properties in production and decay, and searches for anomalous couplings. The
presented measurements test theoretical predictions, including recent
perturbative QCD calculations, provide constraints of fundamental standard
model parameters, and set limits on physics beyond the standard model.
","[{""version"":""v1"",""created"":""Tue, 3 Oct 2017 07:01:36 GMT""}]","2018-08-29"
"1710.01010","Shakeel Ahmad Professor","Shaista Khan and Shakeel Ahmad","Entropy and Multifractality in Relativistic Ion-Ion Collisions","17 pages, 5 figures, 2 tables","Advances in High Energy Physics Volume 2018, Article ID 2136908,
  11 pages","10.1155/2018/2136908","Article ID 2136908","hep-ph nucl-th","http://arxiv.org/licenses/nonexclusive-distrib/1.0/","  Entropy production in multiparticle systems is investigated by analysing the
experimental data on ion-ion collision at AGS and SPS energies and comparing
the findings with those reported earlier for hadron-hadron, hadron-nucleus and
nucleus-nucleus collisions. It is observed that the entropy produced in limited
and full phase space, when normalised to maximum rapidity exhibits a kind of
scaling which is nicely supported by Monte Carlo model \hij. Using the
R\'{e}nyi's order-q information entropy, multifractal characteristics of
particle production are examined in terms of Generalized dimensions, D$_{q}$.
Nearly the same values of multifractal specific heat, \(c\) observed in
hadronic and ion-ion collisions over a wide range of incident energies suggest
that the quantity \(c\) may be used as a universal characteristic of
multiparticle production in hadron-hadron, hadron-nucleus and nucleus-nucleus
collisions.
","[{""version"":""v1"",""created"":""Tue, 3 Oct 2017 07:07:05 GMT""}]","2018-04-16"
"1710.01011","Shahla Faisal","Shahla Faisal, Gerhard Tutz","Nearest Neighbor Imputation for Categorical Data by Weighting of
  Attributes",,,,,"stat.ME","http://arxiv.org/licenses/nonexclusive-distrib/1.0/","  Missing values are a common phenomenon in all areas of applied research.
While various imputation methods are available for metrically scaled variables,
methods for categorical data are scarce. An imputation method that has been
shown to work well for high dimensional metrically scaled variables is the
imputation by nearest neighbor methods. In this paper, we extend the weighted
nearest neighbors approach to impute missing values in categorical variables.
The proposed method, called $\mathtt{wNNSel_{cat}}$, explicitly uses the
information on association among attributes. The performance of different
imputation methods is compared in terms of the proportion of falsely imputed
values. Simulation results show that the weighting of attributes yields smaller
imputation errors than existing approaches. A variety of real data sets is used
to support the results obtained by simulations.
","[{""version"":""v1"",""created"":""Tue, 3 Oct 2017 07:18:42 GMT""}]","2017-10-04"
"1710.01012","Mukesh Kumar Choudhary","Mukesh K. Choudhary and P Ravindran","Search for Thermoelectrics with High Figure of Merit in half-Heusler
  compounds with multinary substitution",,,"10.1063/1.5029029",,"cond-mat.mtrl-sci","http://arxiv.org/licenses/nonexclusive-distrib/1.0/","  In order to improve the thermoelectric performance of TiCoSb we have
substituted 50% of Ti equally with Zr and Hf at Ti site and Sb with Sn and Se
equally at Sb site. The electronic structure of Ti0.5Zr0.25Hf0.25CoSn0.5Se0.5
is investigated using the full potential linearized augmented plane wave method
and the thermoelectric transport properties are calculated on the basis of
semi-classical Boltzmann transport theory. Our band structure calculations show
that Ti0.5Zr0.25Hf0.25CoSn0.5Se0.5 has semiconducting behavior with indirect
band gap value of 0.98 eV which follow the empirical rule of 18
valence-electron content to bring semiconductivity in half Heusler compounds,
indicating that one can have semiconducting behavior in multinary phase of half
Heusler compounds if they full fill the 18 VEC rule and this open-up the
possibility of designing thermoelectrics with high figure of merit in half
Heusler compounds. We show that at high temperature of around 700K
Ti0.5Zr0.25Hf0.25CoSn0.5Se0.5 has high thermoelectric figure of merit of ZT =
1.05 which is higher than that of TiCoSb (~ 0.95) suggesting that by going from
ternary to multinary phase system one can enhance the thermoelectric figure of
merit at higher temperatures.
","[{""version"":""v1"",""created"":""Tue, 3 Oct 2017 07:18:48 GMT""}]","2018-05-09"
"1710.01013","Emanuele Sansone","Emanuele Sansone, Francesco G.B. De Natale","Training Feedforward Neural Networks with Standard Logistic Activations
  is Feasible",,,,,"cs.NE cs.LG stat.ML","http://arxiv.org/licenses/nonexclusive-distrib/1.0/","  Training feedforward neural networks with standard logistic activations is
considered difficult because of the intrinsic properties of these sigmoidal
functions. This work aims at showing that these networks can be trained to
achieve generalization performance comparable to those based on hyperbolic
tangent activations. The solution consists on applying a set of conditions in
parameter initialization, which have been derived from the study of the
properties of a single neuron from an information-theoretic perspective. The
proposed initialization is validated through an extensive experimental
analysis.
","[{""version"":""v1"",""created"":""Tue, 3 Oct 2017 07:21:03 GMT""}]","2017-10-04"
"1710.01014","Oleg Denisov","M. Aghasyan, R. Akhunzyanov, M.G. Alexeev, G.D. Alexeev, A. Amoroso,
  V. Andrieux, N.V. Anfimov, V. Anosov, A. Antoshkin, K. Augsten, W.
  Augustyniak, A. Austregesilo, C.D.R. Azevedo, B. Badelek, F. Balestra, M.
  Ball, J. Barth, R. Beck, Y. Bedfer, J. Bernhard, K. Bicker, E. R. Bielert, R.
  Birsa, M. Bodlak, P. Bordalo, F. Bradamante, A. Bressan, M. Buechele, V.E.
  Burtsev, W.-C. Chang, C. Chatterjee, M. Chiosso, I. Choi, A.G. Chumakov,
  S.-U. Chung, A. Cicuttin, M.L. Crespo, S. Dalla Torre, S.S. Dasgupta, S.
  Dasgupta, O.Yu. Denisov, L. Dhara, S.V. Donskov, N. Doshita, Ch. Dreisbach,
  W. Duennweber, R.R. Dusaev, M. Dziewiecki, A. Efremov, P.D. Eversheim, M.
  Faessler, A. Ferrero, M. Finger, M. Finger jr., H. Fischer, C. Franco, N. du
  Fresne von Hohenesche, J.M. Friedrich, V. Frolov, E. Fuchey, F. Gautheron,
  O.P. Gavrichtchouk, S. Gerassimov, J. Giarra, F. Giordano, I. Gnesi, M.
  Gorzellik, A. Grasso, A. Gridin, M. Grosse Perdekamp, B. Grube, T.
  Grussenmeyer, A. Guskov, D. Hahne, G. Hamar, D. von Harrach, F.H. Heinsius,
  R. Heitz, F. Herrmann, N. Horikawa, N. d'Hose, C.-Y. Hsieh, S. Huber, S.
  Ishimoto, A. Ivanov, Yu. Ivanshin, T. Iwata, V. Jary, R. Joosten, P. Joerg,
  E. Kabuss, A. Kerbizi, B. Ketzer, G.V. Khaustov, Yu.A. Khokhlov, Yu.
  Kisselev, F. Klein, J.H. Koivuniemi, V.N. Kolosov, K. Kondo, K. Koenigsmann,
  I. Konorov, V.F. Konstantinov, A.M. Kotzinian, O.M. Kouznetsov, Z. Kral, M.
  Kraemer, P. Kremser, F. Krinner, Z.V. Kroumchtein, Y. Kulinich, F. Kunne, K.
  Kurek, R.P. Kurjata, I.I. Kuznetsov, A. Kveton, A.A. Lednev, E.A. Levchenko,
  M. Levillain, S. Levorato, Y.-S. Lian, J. Lichtenstadt, R. Longo, V.E.
  Lyubovitskij, A. Maggiora, A. Magnon, N. Makins, N. Makke, G.K. Mallot, S.A.
  Mamon, B. Marianski, A. Martin, J. Marzec, J. Matousek, H. Matsuda, T.
  Matsuda, G.V. Meshcheryakov, M. Meyer, W. Meyer, Yu.V. Mikhailov, M.
  Mikhasenko, E. Mitrofanov, N. Mitrofanov, Y. Miyachi, A. Moretti, A.
  Nagaytsev, F. Nerling, D. Neyret, J. Novy, W.-D. Nowak, G. Nukazuka, A.S.
  Nunes, A.G. Olshevsky, I. Orlov, M. Ostrick, D. Panzieri, B. Parsamyan, S.
  Paul, J.-C. Peng, F. Pereira, M. Pesek, M. Peskova, D.V. Peshekhonov, N.
  Pierre, S. Platchkov, J. Pochodzalla, V.A. Polyakov, J. Pretz, M. Quaresma,
  C. Quintans, S. Ramos, C. Regali, G. Reicherz, C. Riedl, N.S. Rogacheva, D.I.
  Ryabchikov, A. Rybnikov, A. Rychter, R. Salac, V.D. Samoylenko, A. Sandacz,
  C. Santos, S. Sarkar, I.A. Savin, T. Sawada, G. Sbrizzai, P. Schiavon, K.
  Schmidt, H. Schmieden, K. Schoenning, E. Seder, A. Selyunin, L. Silva, L.
  Sinha, S. Sirtl, M. Slunecka, J. Smolik, A. Srnka, D. Steffen, M. Stolarski,
  O. Subrt, M. Sulc, H. Suzuki, A. Szabelski, T. Szameitat, P. Sznajder, M.
  Tasevsky, S. Tessaro, F. Tessarotto, A. Thiel, J. Tomsa, F. Tosello, V.
  Tskhay, S. Uhl, B.I. Vasilishin, A. Vauth, J. Veloso, A.Vidon, M. Virius, S.
  Wallner, T. Weisrock, M. Wilfert, J. ter Wolbeek, K. Zaremba, P. Zavada, M.
  Zavertyaev, E. Zemlyanichkina, N. Zhuravlev, M. Ziembicki","Longitudinal double-spin asymmetry $A_1^{\rm p}$ and spin-dependent
  structure function $g_1^{\rm p}$ of the proton at small values of $x$ and
  $Q^2$","19 pages, 7 figures",,"10.1016/j.physletb.2018.03.044","CERN-EP-2017-263","hep-ex","http://arxiv.org/licenses/nonexclusive-distrib/1.0/","  We present a precise measurement of the proton longitudinal double-spin
asymmetry $A_1^{\rm p}$ and the proton spin-dependent structure function
$g_1^{\rm p}$ at photon virtualities $0.006~({\rm GeV}/c)^2<Q^2 < 1~({\rm
GeV}/c)^2$ in the Bjorken $x$ range of $4 \times 10^{-5} < x < 4 \times
10^{-2}$. The results are based on data collected by the COMPASS Collaboration
at CERN using muon beam energies of $160~{\rm GeV}$ and $200~{\rm GeV}$. The
statistical precision is more than tenfold better than that of the previous
measurement in this region. In the whole range of $x$, the measured values of
$A_1^{\rm p}$ and $g_1^{\rm p}$ are found to be positive. It is for the first
time that spin effects are found at such low values of $x$.
","[{""version"":""v1"",""created"":""Tue, 3 Oct 2017 07:22:28 GMT""}]","2018-05-23"
"1710.01015","Christian Gutt","Jan Verwohlt, Mario Reiser, Lisa Randolph, Aleksandar Matic, Luis
  Aguilera Medina, Anders Madsen, Michael Sprung, Alexey Zozulya and Christian
  Gutt","Low dose X-ray speckle visibility spectroscopy reveals nanoscale
  dynamics in radiation sensitive ionic liquids","7 pages, 5 figures","Phys. Rev. Lett. 120, 168001 (2018)","10.1103/PhysRevLett.120.168001",,"cond-mat.soft","http://arxiv.org/licenses/nonexclusive-distrib/1.0/","  X-ray radiation damage provides a serious bottle neck for investigating
{\mu}s to s dynamics on nanometer length scales employing X-ray photon
correlation spectroscopy. This limitation hinders the investigation of real
time dynamics in most soft matter and biological materials which can tolerate
only X-ray doses of kGy and below. Here, we show that this bottleneck can be
overcome by low dose X-ray speckle visibility spectroscopy. Employing X-ray
doses of 22 kGy to 438 kGy and analyzing the sparse speckle pattern of count
rates as low as 6.7x10-3 per pixel we follow the slow nanoscale dynamics of an
ionic liquid (IL) at the glass transition. At the pre-peak of nanoscale order
in the IL we observe complex dynamics upon approaching the glass transition
temperature TG with a freezing in of the alpha relaxation and a multitude of
milli-second local relaxations existing well below TG. We identify this fast
relaxation as being responsible for the increasing development of nanoscale
order observed in ILs at temperatures below TG.
","[{""version"":""v1"",""created"":""Tue, 3 Oct 2017 07:24:36 GMT""},{""version"":""v2"",""created"":""Tue, 10 Apr 2018 16:47:52 GMT""}]","2018-04-25"
"1710.01016","Renquan Zhang","Renquan Zhang and Sen Pei","Dynamic range maximization in excitable networks","10 pages, 8 figures",,"10.1063/1.4997254",,"nlin.AO physics.soc-ph","http://arxiv.org/licenses/nonexclusive-distrib/1.0/","  We study the strategy to optimally maximize the dynamic range of excitable
networks by removing the minimal number of links. A network of excitable
elements can distinguish a broad range of stimulus intensities and has its
dynamic range maximized at criticality. In this study, we formulate the
activation propagation in excitable networks as a message passing process in
which the critical state is reached when the largest eigenvalue of the weighted
non-backtracking (WNB) matrix is exactly one. By considering the impact of
single link removal on the largest eigenvalue, we develop an efficient
algorithm that aims to identify the optimal set of links whose removal will
drive the system to the critical state. Comparisons with other competing
heuristics on both synthetic and real-world networks indicate that the proposed
method can maximize the dynamic range by removing the smallest number of links,
and at the same time maintain the largest size of the giant connected
component.
","[{""version"":""v1"",""created"":""Tue, 3 Oct 2017 07:25:46 GMT""}]","2018-01-10"
"1710.01017","Stephane Barland","B. Garbin, J. Javaloyes, G. Tissoni, S. Barland","Hopping and emergent dynamics of optical localized states in a trapping
  potential",,,,,"physics.optics","http://arxiv.org/licenses/nonexclusive-distrib/1.0/","  The position and motion of localized states of light in propagative
geometries can be controlled via an adequate parameter modulation. Here, we
show theoretically and experimentally that this process can be accurately
described as the phase locking of oscillators to an external forcing and that
non-reciprocal interactions between light bits can drastically modify this
picture. Interactions lead to the convective motion of defects and to unlocking
as a collective emerging phenomenon.
","[{""version"":""v1"",""created"":""Tue, 3 Oct 2017 07:28:44 GMT""},{""version"":""v2"",""created"":""Wed, 10 Jun 2020 09:37:55 GMT""}]","2020-06-11"
"1710.01018","Diego Gonzalez-Diaz","D. Gonzalez-Diaz, F. Monrabal, S. Murphy","Gaseous and dual-phase time projection chambers for imaging rare
  processes","Version accepted in NIM after small modifications. Quality of figures
  slightly reduced in pre-print due to arXiv restrictions on file size",,"10.1016/j.nima.2017.09.024",,"physics.ins-det","http://arxiv.org/licenses/nonexclusive-distrib/1.0/","  Modern approaches to the detection and imaging of rare particle interactions
through gaseous and dual-phase time projection chambers are discussed. We
introduce and examine their basic working principles and enabling technological
assets.
","[{""version"":""v1"",""created"":""Tue, 3 Oct 2017 07:54:41 GMT""},{""version"":""v2"",""created"":""Sat, 7 Oct 2017 18:54:44 GMT""}]","2018-03-14"
"1710.01019","Tomomi Omura","Tomomi Omura, masato Kiuchi, Carsten G\""uttler, Akiko M. Nakamura","Centrifugal Experiments with Simulated Regolith:Effects of Gravity, Size
  Distribution, and Particle Shape on Porosity",,"Trans. JSASS Aerosp. Tech. Jpn., 14 (2016), Pk_17-Pk_21",,,"astro-ph.EP","http://arxiv.org/licenses/nonexclusive-distrib/1.0/","  Porosity is a key characteristic of the regolith on the surface of small
bodies. The porosity of the regolith on the surface of asteroids is changed by
applied pressure, and the relationship between pressure and porosity depends on
the particle properties of the regolith. We performed compression measurements
on samples of different materials, particle size distributions, and shapes to
examine the relationship between particle size and pressure required for
compression. We used a centrifuge and a compression testing machine for the
experiments. The applied pressure for the centrifuge and the compression
testing machine experiments ranged from 10^2 to 5x10^3 Pa and from 10^4 to
5x10^6 Pa, respectively. The initial porosity before compression was generally
higher for samples with smaller particles and narrower particle size
distributions. A sample compressed more easily when it consisted of smaller
particles, probably due to smaller frictional forces between particles. We
estimated the porosity of granular asteroids based on the results of our
experiments. The estimated porosity at the center of a homogeneous asteroid
with a radius of 50 km is 0.43. This porosity is typical of the porosity of
asteroids of similar size.
","[{""version"":""v1"",""created"":""Tue, 3 Oct 2017 08:00:15 GMT""}]","2017-10-04"
"1710.01020","Sifei Liu","Sifei Liu, Shalini De Mello, Jinwei Gu, Guangyu Zhong, Ming-Hsuan
  Yang, Jan Kautz","Learning Affinity via Spatial Propagation Networks","A long version of NIPS 2017",,,,"cs.CV cs.LG","http://arxiv.org/licenses/nonexclusive-distrib/1.0/","  In this paper, we propose spatial propagation networks for learning the
affinity matrix for vision tasks. We show that by constructing a row/column
linear propagation model, the spatially varying transformation matrix exactly
constitutes an affinity matrix that models dense, global pairwise relationships
of an image. Specifically, we develop a three-way connection for the linear
propagation model, which (a) formulates a sparse transformation matrix, where
all elements can be the output from a deep CNN, but (b) results in a dense
affinity matrix that effectively models any task-specific pairwise similarity
matrix. Instead of designing the similarity kernels according to image features
of two points, we can directly output all the similarities in a purely
data-driven manner. The spatial propagation network is a generic framework that
can be applied to many affinity-related tasks, including but not limited to
image matting, segmentation and colorization, to name a few. Essentially, the
model can learn semantically-aware affinity values for high-level vision tasks
due to the powerful learning capability of the deep neural network classifier.
We validate the framework on the task of refinement for image segmentation
boundaries. Experiments on the HELEN face parsing and PASCAL VOC-2012 semantic
segmentation tasks show that the spatial propagation network provides a
general, effective and efficient solution for generating high-quality
segmentation results.
","[{""version"":""v1"",""created"":""Tue, 3 Oct 2017 08:00:15 GMT""}]","2017-10-04"
"1710.01021","Takeo Uramoto","Takeo Uramoto","Semi-galois Categories II: An arithmetic analogue of Christol's theorem","20 pages. Made corrections in the last parts of the proofs of
  Proposition 2 and Lemma 3.2; fixed some typos and wording",,,,"math.NT","http://arxiv.org/licenses/nonexclusive-distrib/1.0/","  In connection with our previous work on semi-galois categories, this paper
proves an arithmetic analogue of Christol's theorem concerning an
automata-theoretic characterization of when a formal power series over finite
field is algebraic over the polynomial ring. There are by now several variants
of Christol's theorem, all of which are concerned with rings of positive
characteristic. This paper provides an arithmetic (or F_1) variant of
Christol's theorem in the sense that it replaces the polynomial ring with the
ring of integers of a number field and the ring of formal power series with the
ring of Witt vectors. We also study some related problems.
","[{""version"":""v1"",""created"":""Tue, 3 Oct 2017 08:06:01 GMT""},{""version"":""v2"",""created"":""Wed, 24 Jan 2018 17:03:01 GMT""},{""version"":""v3"",""created"":""Sun, 11 Feb 2018 19:56:31 GMT""}]","2018-02-13"
