"1710.00882","Markus H\""ohnerbach","Markus H\""ohnerbach, Ahmed E. Ismail, Paolo Bientinesi","The Tersoff many-body potential: Sustainable performance through
  vectorization","SC15 Workshop: Producing High Performance and Sustainable Software
  for Molecular Simulation",,,,"cs.CE","http://arxiv.org/licenses/nonexclusive-distrib/1.0/","  Molecular dynamics models materials by simulating each individual particle's
trajectory. Many-body potentials lead to a more accurate trajectory simulation,
and are used in materials science and computational chemistry. We present
optimization results for one multi-body potential on a range of vector
instruction sets, targeting both CPUs and accelerators like the Intel Xeon Phi.
Parallelization of MD simulations is well-studied; by contrast, vectorization
is relatively unexplored. Given the prevalence and power of modern vector
units, exploiting them is imperative for high performance software. When
running on a highly parallel machine, any improvement to the scalar performance
is paid back in hundreds or thousands of saved core hours. Vectorization is
already commonly used in the optimization or pair potentials; multi-body
potentials pose new, unique challenges. Indeed, their optimization pushes the
boundaries of current compilers, forcing us to use explicit vectorization
techniques for now. In this study, we add an optimized implementation of
Tersoff potential to the LAMMPS molecular dynamics simulation package. To
reduce the burden of explicit vectorization, we abstract from the specific
vector instruction set and desired precision: From one algorithm, we get
optimized implementations for many platforms, from SSE4.2 to AVX512, and the
Intel Xeon Phi. We compare the kernels across different architectures, and
determine suitable architecture-dependent parameters. Our optimizations benefit
any architecture, but have a disproportionate effect on the Intel Xeon Phi,
which beats the CPU (2xE5-2650) after optimization.
","[{""version"":""v1"",""created"":""Mon, 2 Oct 2017 19:45:52 GMT""}]","2017-10-04"
"1710.00883","Martin Klimes","Martin Klimes and Christiane Rousseau","Generic 2-parameter perturbations of parabolic singular points of vector
  fields in C","44 pages, 34 figures",,,,"math.DS","http://arxiv.org/licenses/nonexclusive-distrib/1.0/","  We describe the equivalence classes of germs of generic $2$-parameter
families of complex vector fields $\dot z = \omega_\epsilon(z)$ on $\mathbb{C}$
unfolding a singular parabolic point of multiplicity $k+1$: $\omega_0= z^{k+1}
+o(z^{k+1})$. The equivalence is under conjugacy by holomorphic change of
coordinate and parameter. As a preparatory step, we present the bifurcation
diagram of the family of vector fields $\dot z = z^{k+1} + \epsilon_1 z +
\epsilon_0$ over $\mathbb{CP}^1$. This presentation is done using the new tools
of periodgon and star domain. We then provide a description of the modulus
space and (almost) unique normal forms for the equivalence classes of germs.
","[{""version"":""v1"",""created"":""Mon, 2 Oct 2017 19:48:18 GMT""}]","2017-10-04"
"1710.00884","Olaf Lechtenfeld","Nikolay Kozyrev, Sergey Krivonos, Olaf Lechtenfeld, Armen Nersessian,
  Anton Sutulin","Curved Witten-Dijkgraaf-Verlinde-Verlinde equation and ${\cal N}{=}\,4$
  mechanics","1+4 pages; v2: title change, published version","Phys. Rev. D 96, 101702 (2017)","10.1103/PhysRevD.96.101702",,"hep-th math-ph math.AG math.MP nlin.SI","http://arxiv.org/licenses/nonexclusive-distrib/1.0/","  We propose a generalization of the Witten-Dijkgraaf-Verlinde-Verlinde (WDVV)
equation from ${\mathbb R}^n$ to an arbitrary Riemannian manifold. Its form is
obtained by extending the relation of the WDVV equation with ${\cal N}{=}\,4$
supersymmetric $n$-dimensional mechanics from flat to curved space. The
resulting `curved WDVV equation' is written in terms of a third-rank Codazzi
tensor. For every flat-space WDVV solution subject to a simple constraint we
provide a curved-space solution on any isotropic space, in terms of the
rotationally invariant conformal factor of the metric.
","[{""version"":""v1"",""created"":""Mon, 2 Oct 2017 19:48:19 GMT""},{""version"":""v2"",""created"":""Fri, 10 Nov 2017 22:44:20 GMT""}]","2017-11-22"
"1710.00885","Rachel Mandelbaum","Rachel Mandelbaum, Fran\c{c}ois Lanusse, Alexie Leauthaud, Robert
  Armstrong, Melanie Simet, Hironao Miyatake, Joshua E. Meyers, James Bosch,
  Ryoma Murata, Satoshi Miyazaki, Masayuki Tanaka","Weak lensing shear calibration with simulations of the HSC survey","29 pages, 18 figures, 3 tables. Matches MNRAS accepted version. The
  Hubble Space Telescope postage stamp images used as the inputs to the
  simulations were publicly released at
  https://hsc-release.mtk.nao.ac.jp/doc/index.php/weak-lensing-simulation-catalog-pdr1/",,"10.1093/mnras/sty2420",,"astro-ph.CO astro-ph.IM","http://arxiv.org/licenses/nonexclusive-distrib/1.0/","  We present results from a set of simulations designed to constrain the weak
lensing shear calibration for the Hyper Suprime-Cam (HSC) survey. These
simulations include HSC observing conditions and galaxy images from the Hubble
Space Telescope (HST), with fully realistic galaxy morphologies and the impact
of nearby galaxies included. We find that the inclusion of nearby galaxies in
the images is critical to reproducing the observed distributions of galaxy
sizes and magnitudes, due to the non-negligible fraction of unrecognized blends
in ground-based data, even with the excellent typical seeing of the HSC survey
(0.58"" in the $i$-band). Using these simulations, we detect and remove the
impact of selection biases due to the correlation of weights and the quantities
used to define the sample (S/N and apparent size) with the lensing shear. We
quantify and remove galaxy property-dependent multiplicative and additive shear
biases that are intrinsic to our shear estimation method, including a $\sim 10$
per cent-level multiplicative bias due to the impact of nearby galaxies and
unrecognized blends. Finally, we check the sensitivity of our shear calibration
estimates to other cuts made on the simulated samples, and find that the
changes in shear calibration are well within the requirements for HSC weak
lensing analysis. Overall, the simulations suggest that the weak lensing
multiplicative biases in the first-year HSC shear catalog are controlled at the
1 per cent level.
","[{""version"":""v1"",""created"":""Mon, 2 Oct 2017 19:56:21 GMT""},{""version"":""v2"",""created"":""Mon, 3 Sep 2018 12:59:49 GMT""}]","2018-09-12"
"1710.00886","Nima Hatami","Nima Hatami, Yann Gavet and Johan Debayle","Classification of Time-Series Images Using Deep Convolutional Neural
  Networks","The 10th International Conference on Machine Vision (ICMV 2017)",,,,"cs.CV","http://arxiv.org/licenses/nonexclusive-distrib/1.0/","  Convolutional Neural Networks (CNN) has achieved a great success in image
recognition task by automatically learning a hierarchical feature
representation from raw data. While the majority of Time-Series Classification
(TSC) literature is focused on 1D signals, this paper uses Recurrence Plots
(RP) to transform time-series into 2D texture images and then take advantage of
the deep CNN classifier. Image representation of time-series introduces
different feature types that are not available for 1D signals, and therefore
TSC can be treated as texture image recognition task. CNN model also allows
learning different levels of representations together with a classifier,
jointly and automatically. Therefore, using RP and CNN in a unified framework
is expected to boost the recognition rate of TSC. Experimental results on the
UCR time-series classification archive demonstrate competitive accuracy of the
proposed approach, compared not only to the existing deep architectures, but
also to the state-of-the art TSC algorithms.
","[{""version"":""v1"",""created"":""Mon, 2 Oct 2017 19:59:24 GMT""},{""version"":""v2"",""created"":""Sat, 7 Oct 2017 13:39:44 GMT""}]","2017-10-10"
"1710.00887","Peter Rosenberg","Peter Rosenberg, Hao Shi, Shiwei Zhang","Accurate computations of Rashba spin-orbit coupling in interacting
  systems: from the Fermi gas to real materials","12 pages, 8 figures","Journal of Physics and Chemistry of Solids 128 (May 2019) 161-168","10.1016/j.jpcs.2017.12.026",,"cond-mat.str-el cond-mat.quant-gas","http://arxiv.org/licenses/nonexclusive-distrib/1.0/","  We describe the treatment of Rashba spin-orbit coupling (SOC) in interacting
many-fermion systems within the auxiliary-field quantum Monte Carlo framework,
and present a set of illustrative results. These include numerically exact
calculations on the ground-state properties of the spin-balanced, attractive
two-dimensional Fermi gas, as well as a study of a tight-binding Hamiltonian
with repulsive interaction. These systems are formally connected via the
Hubbard Hamiltonian with SOC, but cover different physics ranging from
superfluidity and triplet pairing to SOC in real materials in the presence of
strong interactions in localized orbitals. We carry out detailed benchmark
studies of the method in the latter case when an approximation is needed to
control the sign problem for repulsive Coulomb interactions. The methods
presented here provide an approach for predictive computations in materials to
study the interplay of SOC and strong correlation.
","[{""version"":""v1"",""created"":""Mon, 2 Oct 2017 20:00:12 GMT""}]","2019-06-10"
"1710.00888","Jose Berengueres Ph.D","Jose Berengueres and Dani Castro","Sentiment Perception of Readers and Writers in Emoji use","8 pages, 17 figures",,,,"cs.IR cs.CL cs.HC","http://arxiv.org/licenses/nonexclusive-distrib/1.0/","  Previous research has traditionally analyzed emoji sentiment from the point
of view of the reader of the content not the author. Here, we analyze emoji
sentiment from the point of view of the author and present a emoji sentiment
benchmark that was built from an employee happiness dataset where emoji happen
to be annotated with daily happiness of the author of the comment. The data
spans over 3 years, and 4k employees of 56 companies based in Barcelona. We
compare sentiment of writers to readers. Results indicate that, there is an 82%
agreement in how emoji sentiment is perceived by readers and writers. Finally,
we report that when authors use emoji they report higher levels of happiness.
Emoji use was not found to be correlated with differences in author moodiness.
","[{""version"":""v1"",""created"":""Mon, 2 Oct 2017 20:07:18 GMT""},{""version"":""v2"",""created"":""Tue, 9 Jan 2018 23:26:06 GMT""}]","2018-01-11"
"1710.00889","Guilherme Fran\c{c}a","Guilherme Fran\c{c}a, Jos\'e Bento","How is Distributed ADMM Affected by Network Topology?",,,,,"stat.ML math.OC","http://arxiv.org/licenses/nonexclusive-distrib/1.0/","  When solving consensus optimization problems over a graph, there is often an
explicit characterization of the convergence rate of Gradient Descent (GD)
using the spectrum of the graph Laplacian. The same type of problems under the
Alternating Direction Method of Multipliers (ADMM) are, however, poorly
understood. For instance, simple but important non-strongly-convex consensus
problems have not yet being analyzed, especially concerning the dependency of
the convergence rate on the graph topology. Recently, for a non-strongly-convex
consensus problem, a connection between distributed ADMM and lifted Markov
chains was proposed, followed by a conjecture that ADMM is faster than GD by a
square root factor in its convergence time, in close analogy to the mixing
speedup achieved by lifting several Markov chains. Nevertheless, a proof of
such a claim is is still lacking. Here we provide a full characterization of
the convergence of distributed over-relaxed ADMM for the same type of consensus
problem in terms of the topology of the underlying graph. Our results provide
explicit formulas for optimal parameter selection in terms of the second
largest eigenvalue of the transition matrix of the graph's random walk. Another
consequence of our results is a proof of the aforementioned conjecture, which
interestingly, we show it is valid for any graph, even the ones whose random
walks cannot be accelerated via Markov chain lifting.
","[{""version"":""v1"",""created"":""Mon, 2 Oct 2017 20:11:25 GMT""}]","2017-10-04"
"1710.00890","Zigfried Hampel-Arias","HAWC Collaboration: R. Alfaro (1) C. Alvarez (2), R. Arceo (2), J.C.
  Arteaga-Vel\'azquez (3), D. Avila Rojas (1), H.A. Ayala Solares (4), A.S.
  Barber (5), A. Becerril (1), E. Belmont-Moreno (1), S.Y. BenZvi (6), C.
  Brisbois (4), K.S. Caballero-Mora (2), T. Capistr\'an (7), A. Carrami\~nana
  (7), S. Casanova (8, 9), M. Castillo (3), U. Cotti (3), J. Cotzomi (10), S.
  Couti\~no de Le\'on (7), C. De Le\'on (10), E. De la Fuente (11), R. Diaz
  Hernandez (7), S. Dichiara (12), B.L. Dingus (13), M.A. DuVernois (14), J.C.
  D\'iaz-V\'elez (11), R.W. Ellsworth (15), O. Enriquez-Rivera (16), D.W.
  Fiorino (17), H. Fleischhack (4), N. Fraija (12), J.A. Garc\'ia-Gonz\'alez
  (1), A. Gonz\'alez Mu\~noz (1), M.M. Gonz\'alez (12), J.A. Goodman (17), Z.
  Hampel-Arias (14), J.P. Harding (13), A. Hernandez-Almada (1), J. Hinton (9),
  F. Hueyotl-Zahuantitla (2), C.M. Hui (18), P. Huntemeyer (4), A. Iriarte
  (12), A. Jardin-Blicq (9), V. Joshi (9), S. Kaufmann (2), A. Lara (16), R.J.
  Lauer (19), D. Lennarz (20), H. Le\'on Vargas (1), J.T. Linnemann (21), A.L.
  Longinotti (7), G. Luis Raya (22), R. Luna-Garc\'ia (23), D. L\'opez-C\'amara
  (24), R. L\'opez-Coto (9), K. Malone (25), S.S. Marinelli (21), O. Martinez
  (10), I. Martinez-Castellanos (17), J. Mart\'inez-Castro (23), H.
  Mart\'inez-Huerta (26), J.A. Matthews (19), P. Miranda-Romagnoli (27), E.
  Moreno (10), M. Mostaf\'a (25), L. Nellen (28), M. Newbold (5), M.U. Nisa
  (6), R. Noriega-Papaqui (27), R. Pelayo (23), J. Pretz (25), E.G.
  P\'erez-P\'erez (22), Z. Ren (19), C.D. Rho (6), C. Rivi\`ere (17), D.
  Rosa-Gonz\'alez (7), M. Rosenberg (25), E. Ruiz-Velasco (1), F. Salesa Greus
  (8), A. Sandoval (1), M. Schneider (29), H. Schoorlemmer (9), G. Sinnis (13),
  A.J. Smith (17), R.W. Springer (5), P. Surajbali (9), I. Taboada (20), O.
  Tibolla (2), K. Tollefson (21), I. Torres (7), T.N. Ukwatta (13), L.
  Villase\~nor (10), T. Weisgarber (14), S. Westerhoff (14), J. Wood (14), T.
  Yapici (6), A. Zepeda (26, 2), H. Zhou (13), and J.D. \'Alvarez (3) ((1)
  Instituto de F\'isica, Universidad Nacional Aut\'onoma de M\'exico, (2)
  Universidad Aut\'onoma de Chiapas, Tuxtla Guti\'errez Chiapas, Mexico (3)
  Universidad Michoacana de San Nicol\'as de Hidalgo, Morelia, Mexico (4)
  Department of Physics, Michigan Technological University, Houghton, MI, USA
  (5) Department of Physics and Astronomy, University of Utah, Salt Lake City,
  UT, USA (6) Department of Physics and Astronomy, University of Rochester,
  Rochester, NY, USA (7) Instituto Nacional de Astrof\'isica, \'Optica y
  Electr\'onica, Tonantzintla, Puebla, Mexico (8) Instytut Fizyki Jadrowej im
  Henryka Niewodniczanskiego Polskiej Akademii Nauk, Krakow, Poland 9
  Max-Planck Institute for Nuclear Physics, Heidelberg, Germany (10) Facultad
  de Ciencias F\'isico Matem\'aticas, Benem\'erita Universidad Aut\'onoma de
  Puebla, Puebla, Mexico (11) Departamento de F\'isica, Centro Universitario de
  Ciencias Exactase Ingenierias, Universidad de Guadalajara, Guadalajara,
  Mexico (12) Instituto de Astronom\'ia, Universidad Nacional Aut\'onoma de
  M\'exico, Mexico City, Mexico (13) Physics Division, Los Alamos National
  Laboratory, Los Alamos, NM, USA (14) Department of Physics, University of
  Wisconsin-Madison, Madison, WI, USA (15) School of Physics, Astronomy, and
  Computational Sciences, George Mason University, Fairfax, VA, USA (16)
  Instituto de Geof\'isica, Universidad Nacional Aut\'onoma de M\'exico, Mexico
  City, Mexico (17) Department of Physics, University of Maryland, College
  Park, MD, USA (18) NASA Marshall Space Flight Center, Astrophysics Office,
  Huntsville, AL, USA (19) Department of Physics and Astronomy, University of
  New Mexico, Albuquerque, NM, USA (20) School of Physics and Center for
  Relativistic Astrophysics - Georgia Institute of Technology, Atlanta, GA, USA
  (21) Department of Physics and Astronomy, Michigan State University, East
  Lansing, MI, USA (22) Universidad Politecnica de Pachuca, Pachuca, Hidalgo,
  Mexico (23) Centro de Investigac\'ion en Computac\'ion, Instituto
  Polit\'ecnico Nacional, Mexico City, Mexico (24) C\'atedras Conacyt|Instituto
  de Astronom\'ia, Universidad Nacional Aut\'onoma de M\'exico, Mexico City,
  Mexico (25) Department of Physics, Pennsylvania State University, University
  Park, PA, USA (26) Physics Department, Centro de Investigacion y de Estudios
  Avanzados del IPN, Mexico City, Mexico (27) Universidad Aut\'onoma del Estado
  de Hidalgo, Pachuca, Mexico (28) Instituto de Ciencias Nucleares, Universidad
  Nacional Aut\'onoma de M\'exico, Mexico City, Mexico (29) Santa Cruz
  Institute for Particle Physics, University of California, Santa Cruz, Santa
  Cruz, CA, USA)","All-particle cosmic ray energy spectrum measured by the HAWC experiment
  from 10 to 500 TeV","16 pages, 11 figures, 4 tables, submission to Physical Review D","Phys. Rev. D 96, 122001 (2017)","10.1103/PhysRevD.96.122001",,"astro-ph.HE","http://arxiv.org/licenses/nonexclusive-distrib/1.0/","  We report on the measurement of the all-particle cosmic ray energy spectrum
with the High Altitude Water Cherenkov (HAWC) Observatory in the energy range
10 to 500 TeV. HAWC is a ground based air-shower array deployed on the slopes
of Volcan Sierra Negra in the state of Puebla, Mexico, and is sensitive to
gamma rays and cosmic rays at TeV energies. The data used in this work were
taken from 234 days between June 2016 to February 2017. The primary cosmic-ray
energy is determined with a maximum likelihood approach using the particle
density as a function of distance to the shower core. Introducing quality cuts
to isolate events with shower cores landing on the array, the reconstructed
energy distribution is unfolded iteratively. The measured all-particle spectrum
is consistent with a broken power law with an index of $-2.49\pm0.01$ prior to
a break at $(45.7\pm0.1$) TeV, followed by an index of $-2.71\pm0.01$. The
spectrum also respresents a single measurement that spans the energy range
between direct detection and ground based experiments. As a verification of the
detector response, the energy scale and angular resolution are validated by
observation of the cosmic ray Moon shadow's dependence on energy.
","[{""version"":""v1"",""created"":""Mon, 2 Oct 2017 20:12:53 GMT""},{""version"":""v2"",""created"":""Wed, 1 Nov 2017 16:12:36 GMT""}]","2018-03-22"
"1710.00891","Jan Rozendaal","Jan Rozendaal and Mark Veraar","Stability theory for semigroups using $(L^{p},L^{q})$ Fourier
  multipliers","40 pages. To appear in Journal of Functional Analysis","J. Funct. Anal. 275 (2018), no. 10, 2845-2894","10.1016/j.jfa.2018.06.015",,"math.FA math.AP","http://arxiv.org/licenses/nonexclusive-distrib/1.0/","  We study polynomial and exponential stability for $C_{0}$-semigroups using
the recently developed theory of operator-valued $(L^{p},L^{q})$ Fourier
multipliers. We characterize polynomial decay of orbits of a $C_{0}$-semigroup
in terms of the $(L^{p},L^{q})$ Fourier multiplier properties of its resolvent.
Using this characterization we derive new polynomial decay rates which depend
on the geometry of the underlying space. We do not assume that the semigroup is
uniformly bounded, our results depend only on spectral properties of the
generator. As a corollary of our work on polynomial stability we reprove and
unify various existing results on exponential stability, and we also obtain a
new theorem on exponential stability for positive semigroups.
","[{""version"":""v1"",""created"":""Mon, 2 Oct 2017 20:13:06 GMT""},{""version"":""v2"",""created"":""Tue, 10 Oct 2017 06:25:59 GMT""},{""version"":""v3"",""created"":""Fri, 29 Jun 2018 00:23:28 GMT""}]","2018-10-04"
"1710.00892","Joseph Geumlek","Joseph Geumlek, Shuang Song, Kamalika Chaudhuri","R\'enyi Differential Privacy Mechanisms for Posterior Sampling","to be published in NIPS 2017",,,,"cs.LG cs.AI cs.CR","http://arxiv.org/licenses/nonexclusive-distrib/1.0/","  Using a recently proposed privacy definition of R\'enyi Differential Privacy
(RDP), we re-examine the inherent privacy of releasing a single sample from a
posterior distribution. We exploit the impact of the prior distribution in
mitigating the influence of individual data points. In particular, we focus on
sampling from an exponential family and specific generalized linear models,
such as logistic regression. We propose novel RDP mechanisms as well as
offering a new RDP analysis for an existing method in order to add value to the
RDP framework. Each method is capable of achieving arbitrary RDP privacy
guarantees, and we offer experimental results of their efficacy.
","[{""version"":""v1"",""created"":""Mon, 2 Oct 2017 20:15:43 GMT""}]","2017-10-04"
"1710.00893","Zhe Zhang","Zhe Zhang, Shaoshan Liu, Grace Tsai, Hongbing Hu, Chen-Chi Chu, and
  Feng Zheng","PIRVS: An Advanced Visual-Inertial SLAM System with Flexible Sensor
  Fusion and Hardware Co-Design",,,,,"cs.RO cs.CV","http://arxiv.org/licenses/nonexclusive-distrib/1.0/","  In this paper, we present the PerceptIn Robotics Vision System (PIRVS)
system, a visual-inertial computing hardware with embedded simultaneous
localization and mapping (SLAM) algorithm. The PIRVS hardware is equipped with
a multi-core processor, a global-shutter stereo camera, and an IMU with precise
hardware synchronization. The PIRVS software features a novel and flexible
sensor fusion approach to not only tightly integrate visual measurements with
inertial measurements and also to loosely couple with additional sensor
modalities. It runs in real-time on both PC and the PIRVS hardware. We perform
a thorough evaluation of the proposed system using multiple public
visual-inertial datasets. Experimental results demonstrate that our system
reaches comparable accuracy of state-of-the-art visual-inertial algorithms on
PC, while being more efficient on the PIRVS hardware.
","[{""version"":""v1"",""created"":""Mon, 2 Oct 2017 20:17:54 GMT""}]","2017-10-04"
"1710.00894","Pariya Behrouzi","P. Behrouzi and E.C. Wit","Detecting Epistatic Selection with Partially Observed Genotype Data
  Using Copula Graphical Models","27 pages, 9 figures",,,,"stat.AP q-bio.GN q-bio.MN q-bio.PE stat.ME","http://arxiv.org/licenses/nonexclusive-distrib/1.0/","  Recombinant Inbred Lines derived from divergent parental lines can display
extensive segregation distortion and long-range linkage disequilibrium (LD)
between distant loci. These genomic signatures are consistent with epistatic
selection during inbreeding. Epistatic interactions affect growth and fertility
traits or even cause complete lethality. Detecting epistasis is challenging as
multiple testing approaches are under-powered and true long-range LD is
difficult to distinguish from drift.
  Here we develop a method for reconstructing an underlying network of genomic
signatures of high-dimensional epistatic selection from multi-locus genotype
data. The network captures the conditionally dependent short- and long-range LD
structure and thus reveals ""aberrant"" marker-marker associations that are due
to epistatic selection rather than gametic linkage. The network estimation
relies on penalized Gaussian copula graphical models, which accounts for a
large number of markers p and a small number of individuals n.
  A multi-core implementation of our algorithm makes it feasible to estimate
the graph in high-dimensions also in the presence of significant portions of
missing data. We demonstrate the efficiency of the proposed method on simulated
datasets as well as on genotyping data in A.thaliana and maize. In addition, we
implemented the method in the R package netgwas which is freely available at
https://CRAN.R-project.org/package=netgwas.
","[{""version"":""v1"",""created"":""Mon, 2 Oct 2017 20:18:51 GMT""},{""version"":""v2"",""created"":""Sun, 31 Dec 2017 01:21:34 GMT""}]","2018-01-03"
"1710.00895","Thomas Kloss","Thomas Kloss, Joseph Weston, Xavier Waintal","Transient and Sharvin resistances of Luttinger liquids","6 pages, 3 figures, final version","Phys. Rev. B 97, 165134 (2018)","10.1103/PhysRevB.97.165134",,"cond-mat.mes-hall","http://arxiv.org/licenses/nonexclusive-distrib/1.0/","  Although the intrinsic conductance of an interacting one-dimensional system
is renormalized by the electron-electron correlations, it has been known for
some time that this renormalization is washed out by the presence of the
(non-interacting) electrodes to which the wire is connected. Here, we study the
transient conductance of such a wire: a finite voltage bias is suddenly applied
across the wire and we measure the current before it has enough time to reach
its stationary value. These calculations allow us to extract the Sharvin
(contact) resistance of Luttinger and Fermi liquids. In particular, we find
that a perfect junction between a Fermi liquid electrode and a Luttinger liquid
electrode is characterized by a contact resistance that consists of half the
quantum of conductance in series with half the intrinsic resistance of an
infinite Luttinger liquid. These results were obtained using two different
methods: a dynamical Hartree-Fock approach and a self-consistent Boltzmann
approach. Although these methods are formally approximate we find a perfect
match with the exact results of Luttinger/Fermi liquid theory.
","[{""version"":""v1"",""created"":""Mon, 2 Oct 2017 20:19:49 GMT""},{""version"":""v2"",""created"":""Thu, 26 Apr 2018 08:00:21 GMT""}]","2018-04-27"
