"1710.06354","Jan Perina Jr.","Jan Perina Jr, Vaclav Michalek, Ondrej Haderka","Noise reduction in photon counting by exploiting spatial correlations","12 pages, 16 figures","Physical Review Applied 8, 044018 (2017)",,,"quant-ph","http://arxiv.org/licenses/nonexclusive-distrib/1.0/","  Joint photocount distributions of a weak twin beam acquired by an iCCD camera
are analyzed with respect to the beam spatial correlations. A method for
extracting these correlations from the experimental joint photocount
distributions is suggested using a suitable statistical model that quantifies
the contribution of spatial correlations to the joint photocount distributions.
In detail, the profile of twin-beam intensity spatial cross-correlation
function is revealed from the curve that gives the genuine mean photon-pair
number (both photons from a pair are detected) as a function of the extent of
the detection area. Also, the principle of reducing the noise in
photon-number-resolving detection by using spatial correlations is
experimentally demonstrated.
","[{""version"":""v1"",""created"":""Tue, 17 Oct 2017 16:00:24 GMT""}]","2018-12-11"
"1710.06355","Nathan Noiry","Nathan Noiry","Spectra of Wishart Matrices with size-dependent entries","17 pages, 6 figures",,,,"math.PR","http://arxiv.org/licenses/nonexclusive-distrib/1.0/","  We prove the convergence of the empirical spectral measure of Wishart
matrices with size-dependent entries and characterize the limiting law by its
moments. We apply our result to the cases where the entries are Bernoulli
variables with parameter c=n or truncated heavy-tailed random variables. In
both cases, when c goes to infinity or when the truncation is small, the
limiting spectrum is a perturbation of the Marchenko-Pastur distribution and we
compute its leading term.
","[{""version"":""v1"",""created"":""Tue, 17 Oct 2017 16:02:26 GMT""}]","2017-10-18"
"1710.06356","Dibyendu Panigrahi DP","D. Panigrahi and S. Chatterjee","Tolman-Bondi-Lema\^itre spacetime with a generalised Chaplygin gas","20 pages, 7 figurs","Acta Physica Polonica B, Vol. - 50 (2019), No. 9, Page No:
  1555-1577","10.5506/APhysPolB.50.1555",,"gr-qc","http://arxiv.org/licenses/nonexclusive-distrib/1.0/","  The Tolman-Bondi-Lema\^itre type of inhomogeneous spacetime with generalised
Chaplygin gas equation of state given by $p = -\frac{A}{\rho^{\alpha}}$ is
investigated where $ \alpha$ is a constant. We get an inhomogeneous spacetime
at early stage but at the late stage of universe the inhomogeneity disappear
with suitable radial co-ordinate transformation. For the large scale factor our
model behaves like $\Lambda$CDM type which is in accord with the recent WMAP
studies. We have calculated $\frac{\partial \rho}{\partial r}$ and it is found
to be negative for $\alpha > 0$ which is in agreement with the observational
analysis. A striking difference with Chaplygin gas ($ \alpha = 1$) lies in the
fact that with any suitable co-ordinate transformation our metric cannot be
reduced to the Einstein-de Sitter type of homogeneous spacetime as is possible
for the Chaplygin gas. We have also studied the effective deceleration
parameter and find that the desired feature of \emph{flip} occurs at the late
universe. It is seen that the flip time depends explicitly on $\alpha$. We also
find that flip is not synchronous occurring earlier at the outer shells, thus
offering a natural path against occurrence of wellknown shell crossing
singularity. This is unlike the Tolman-Bondi case with perfect gas where one
has to impose stringent external conditions to avoid this type of singularity.
We further observe that if we adopt separation of variables method to solve the
field equations the inhomogeneity in matter distribution disappears. The whole
situation is later discussed with the help of Raychaudhury equation and the
results compared with previous cases. This work is the generalisation of our
previous article where we have taken $\alpha =1$.
","[{""version"":""v1"",""created"":""Tue, 17 Oct 2017 16:04:56 GMT""},{""version"":""v2"",""created"":""Thu, 21 Dec 2017 17:58:32 GMT""},{""version"":""v3"",""created"":""Wed, 6 Nov 2019 17:42:23 GMT""}]","2019-11-07"
"1710.06357","Omjyoti Dutta","Omjyoti Dutta and Geza Giedke","Ferroelectric nano-traps for polar molecules",,"Phys. Rev. A 97, 023416 (2018)","10.1103/PhysRevA.97.023416",,"cond-mat.quant-gas physics.atom-ph quant-ph","http://arxiv.org/licenses/nonexclusive-distrib/1.0/","  We propose and analyze an electrostatic-optical nano-scale trap for cold
diatomic polar molecules. The main ingredient of our proposal is an
square-array of ferroelectric nano-rods {with alternating polarization}. We
show that, in contrast to electrostatic traps using the linear Stark effect, a
quadratic Stark potential supports long-lived trapped states. The molecules are
kept at a fixed height from the nano-rods by a standing-wave optical dipole
trap. For the molecules and materials considered, we find that nano-traps with
trap frequency up to 1MHz, ground-state width $\sim20$nm with lattice
periodicity of $\sim 200$nm. Analyzing the loss mechanisms due to
non-adiabaticity, surface-induced radiative transitions, and laser-induced
transitions, we show the existence of trapped states with life-time $\sim 1$s,
competitive with current traps created via optical mechanisms. As an
application we extend our discussion to an 1D array of nano-traps to simulate
of a long-range spin Hamiltonian in our structure.
","[{""version"":""v1"",""created"":""Tue, 17 Oct 2017 16:05:11 GMT""}]","2018-02-21"
"1710.06358","Tomasz Stebel","Anna Kulesza, Leszek Motyka, Tomasz Stebel and Vincent Theeuwes","Improving predictions for associated $t\bar{t}H$ production at the LHC:
  soft gluon resummation through NNLL accuracy","6 pages, 1 figure, 1 table, proceedings prepared for the European
  Physical Society Conference on High Energy Physics (EPS-HEP 2017), 5-12 July
  2017, Venice, Italy",,,"MS-TP-17-20","hep-ph","http://arxiv.org/licenses/nonexclusive-distrib/1.0/","  In the following we present our recent results on the resummation of soft
gluon corrections to the $pp\rightarrow t\bar{t}H$ cross section at the LHC.
The resummation was carried out at next-to-next-to-leading-logarithmic (NNLL)
accuracy using the Mellin space technique. Obtained results were matched to the
NLO cross section. We show that the resummation leads to reduction of
scale-variation uncertainty of the total $pp\rightarrow t\bar{t}H$ cross
section.
","[{""version"":""v1"",""created"":""Tue, 17 Oct 2017 16:05:25 GMT""}]","2017-10-18"
"1710.06359","Hans Kastrup","H.A. Kastrup","Wigner functions for the pair angle and orbital angular momentum:
  Possible applications in quantum information","Expanded version (delayed due to illness): inclusion of mixed states
  and fractional angular momenta; 10 pages, 4 figures",,,"DESY 17-147","quant-ph math-ph math.MP physics.data-an physics.optics","http://creativecommons.org/licenses/by/4.0/","  The framework of Wigner functions for the canonical pair angle and orbital
angular momentum, derived and analyzed in 2 recent papers [H. A. Kastrup,
Phys.Rev. A 94, 062113(2016) and Phys.Rev. A 95, 052111(2017)] is applied to
elementary concepts of quantum information like qubits and 2-qubits, e.g.,
entangled EPR/Bell states etc. Properties of the associated Wigner functions of
such superposed states (pure and mixed) are discussed and illustrated. The
Wigner functions of ERP/Bell states are distinguished by their topologically
""twisted"" domain on the configuration subspace S^1xS^1, a torus, of the total
phase space. Like the applications of Wigner functions in quantum optics the
results presented in the present paper may be useful for the description and
analysis of quantum information experiments with orbital angular momenta of
light beams or electron beams, respectively.
","[{""version"":""v1"",""created"":""Tue, 17 Oct 2017 16:07:22 GMT""},{""version"":""v2"",""created"":""Thu, 15 Aug 2019 13:05:32 GMT""}]","2019-08-16"
"1710.06360","Hideaki Kano","Hideaki Kano, Junya Honda, Kentaro Sakamaki, Kentaro Matsuura,
  Atsuyoshi Nakamura, Masashi Sugiyama","Good Arm Identification via Bandit Feedback",,,,,"stat.ML","http://arxiv.org/licenses/nonexclusive-distrib/1.0/","  We consider a novel stochastic multi-armed bandit problem called {\em good
arm identification} (GAI), where a good arm is defined as an arm with expected
reward greater than or equal to a given threshold. GAI is a pure-exploration
problem that a single agent repeats a process of outputting an arm as soon as
it is identified as a good one before confirming the other arms are actually
not good. The objective of GAI is to minimize the number of samples for each
process. We find that GAI faces a new kind of dilemma, the {\em
exploration-exploitation dilemma of confidence}, which is different difficulty
from the best arm identification. As a result, an efficient design of
algorithms for GAI is quite different from that for the best arm
identification. We derive a lower bound on the sample complexity of GAI that is
tight up to the logarithmic factor $\mathrm{O}(\log \frac{1}{\delta})$ for
acceptance error rate $\delta$. We also develop an algorithm whose sample
complexity almost matches the lower bound. We also confirm experimentally that
our proposed algorithm outperforms naive algorithms in synthetic settings based
on a conventional bandit problem and clinical trial researches for rheumatoid
arthritis.
","[{""version"":""v1"",""created"":""Tue, 17 Oct 2017 16:08:16 GMT""},{""version"":""v2"",""created"":""Sat, 10 Feb 2018 09:31:52 GMT""}]","2018-02-13"
"1710.06361","Shantanu Basu","Shantanu Basu and Sayantan Auddy","From Molecular Clouds to the IMF: Spatial and Temporal Effects","10 pages, 4 figures, to appear in Memorie della SAIt",,,,"astro-ph.GA","http://arxiv.org/licenses/nonexclusive-distrib/1.0/","  We review star formation in molecular clouds and describe why magnetic fields
may be important and how they can influence filamentary structure and the
column density probability distribution function (PDF). We also comment on the
origin of the stellar and substellar initial mass function (IMF), which may
require explanations beyond a simple Jeans length argument in turbulent
molecular clouds. A mathematical model of the modified lognormal power-law
(MLP) distribution function provides a framework within which to connect
accretion processes with the IMF.
","[{""version"":""v1"",""created"":""Tue, 17 Oct 2017 16:10:51 GMT""}]","2017-10-18"
"1710.06362","Margaret Regan","Jonathan D. Hauenstein and Margaret H. Regan","Adaptive strategies for solving parameterized systems using homotopy
  continuation",,,,,"math.NA","http://arxiv.org/licenses/nonexclusive-distrib/1.0/","  Three aspects of applying homotopy continuation, which is commonly used to
solve parameterized systems of polynomial equations, are investigated. First,
for parameterized systems which are homogeneous, we investigate options for
performing computations on an adaptively chosen affine coordinate patch.
Second, for parameterized systems which are overdetermined, we investigate
options for adaptively selecting a well-constrained subsystem to restore
numerical stability. Finally, since one is typically interested in only
computing real solutions for parameterized problems which arise from
applications, we investigate a scheme for heuristically identifying solution
paths which appear to be ending at nonreal solutions and truncating them. We
demonstrate these three aspects on two problems arising in computer vision.
","[{""version"":""v1"",""created"":""Tue, 17 Oct 2017 16:15:48 GMT""}]","2017-10-18"
"1710.06363","Tevong You","B.C. Allanach, Ben Gripaios, Tevong You","The Case for Future Hadron Colliders From $B \to K^{(*)} \mu^+ \mu^-$
  Decays","24 pages, 10 figures. v2: Improved discussion and references added,
  version submitted to JHEP",,"10.1007/JHEP03(2018)021","Cavendish-HEP-2017-11, DAMTP-2017-39","hep-ph hep-ex","http://arxiv.org/licenses/nonexclusive-distrib/1.0/","  Recent measurements in $B \to K^{(*)} \mu^+ \mu^-$ decays are somewhat
discrepant with Standard Model predictions. They may be harbingers of new
physics at an energy scale potentially accessible to direct discovery. We
estimate the sensitivity of future hadron colliders to the possible new
particles that may be responsible for the anomalies: leptoquarks or
$Z^\prime$s. We consider luminosity upgrades for a 14 TeV LHC, a 33 TeV LHC,
and a 100 TeV $pp$ collider such as the FCC-hh. Coverage of $Z^\prime$ models
is excellent: for narrow particles, with perturbative couplings that may
explain the $b$-decay results for $Z^\prime$ masses up to 20 TeV, a 33 TeV 1
ab$^{-1}$ LHC is expected to cover most of the parameter space up to 8 TeV in
mass, whereas the 100 TeV FCC-hh with 10 ab$^{-1}$ will cover all of it. A
smaller portion of the leptoquark parameter space is covered by future
colliders: for example, in a $\mu^+\mu^-jj$ di-leptoquark search, a 100 TeV 10
ab$^{-1}$ collider has a projected sensitivity up to leptoquark masses of 12
TeV (extendable to 21 TeV with a strong coupling for single leptoquark
production), whereas leptoquark masses up to 41 TeV may in principle explain
the anomalies.
","[{""version"":""v1"",""created"":""Tue, 17 Oct 2017 16:16:12 GMT""},{""version"":""v2"",""created"":""Tue, 7 Nov 2017 18:21:54 GMT""}]","2018-04-04"
"1710.06364","Scott Burns","Scott Allen Burns","Subtractive Color Mixture Computation",,,,,"cs.GR","http://creativecommons.org/licenses/by-sa/4.0/","  Modeling subtractive color mixture (e.g., the way that paints mix) is
difficult when working with colors described only by three-dimensional color
space values, such as RGB. Although RGB values are sufficient to describe a
specific color sensation, they do not contain enough information to predict the
RGB color that would result from a subtractive mixture of two specified RGB
colors. Methods do exist for accurately modeling subtractive mixture, such as
the Kubelka-Munk equations, but require extensive spectrophotometric
measurements of the mixed components, making them unsuitable for many computer
graphics applications. This paper presents a strategy for modeling subtractive
color mixture given only the RGB information of the colors being mixed, written
for a general audience. The RGB colors are first transformed to generic,
representative spectral distributions, and then this spectral information is
used to perform the subtractive mixture, using the weighted
arithmetic-geometric mean. This strategy provides reasonable, representative
subtractive mixture colors with only modest computational effort and no
experimental measurements. As such, it provides a useful way to model
subtractive color mixture in computer graphics applications.
","[{""version"":""v1"",""created"":""Tue, 17 Oct 2017 16:18:04 GMT""}]","2017-10-18"
"1710.06365","Paolo Carniti","Claudio Arnaboldi, Paolo Carniti, Lorenzo Cassina, Claudio Gotti,
  Xiaohua Liu, Gianluigi Pessina","The front-end electronics system for the CUORE experiment",,,"10.1088/1748-0221/13/02/P02026",,"physics.ins-det","http://arxiv.org/licenses/nonexclusive-distrib/1.0/","  CUORE is an array of thermal calorimeters composed of 988 crystals held at
about 10 mK, whose absorbed energy is read out with semiconductor thermistors.
The composition of the crystal is TeO2, and the aim is the study of the double
beta decay of 130Te on very long and stable runs. CUPID-0 is an array of 26
Zn82Se crystals with double thermistor readout to study the double beta decay
of 82Se. In the present paper, we present an overview of the entire front-end
electronic readout chain, from the preamplifier to the anti-aliasing filter.
This overview includes motivations, design strategies, circuit implementation
and performance results of the electronic system, including other auxiliary yet
important elements like power supplies and the slow control communication
system. The stringent requirements of stability on the very long experimental
runs that are foreseen during CUORE and CUPID-0 operation, are achieved thanks
to novel solutions of the front-end preamplifier and of the detector bias
circuit setup.
","[{""version"":""v1"",""created"":""Tue, 17 Oct 2017 16:18:43 GMT""},{""version"":""v2"",""created"":""Mon, 27 Nov 2017 08:41:46 GMT""},{""version"":""v3"",""created"":""Thu, 1 Feb 2018 15:37:11 GMT""}]","2018-03-14"
"1710.06367","Arnab Char","Anirban Banerjee, Arnab Char","On the spectrum of directed uniform and non-uniform hypergraphs",,,,,"math.SP math.CO math.NA","http://arxiv.org/licenses/nonexclusive-distrib/1.0/","  Here, we suggest a method to represent general directed uniform and
non-uniform hypergraphs by different connectivity tensors. We show many results
on spectral properties of undirected hypergraphs also hold for general directed
uniform hypergraphs. Our representation of a connectivity tensor will be very
useful for the further development in spectral theory of directed hypergraphs.
At the end, we have also introduced the concept of weak* irreducible
hypermatrix to better explain connectivity of a directed hypergraph.
","[{""version"":""v1"",""created"":""Tue, 17 Oct 2017 16:23:56 GMT""},{""version"":""v2"",""created"":""Mon, 23 Oct 2017 13:39:35 GMT""},{""version"":""v3"",""created"":""Wed, 15 Aug 2018 07:50:14 GMT""}]","2018-08-16"
"1710.06368","Zhiyu Sun","Zhiyu Sun and Yusen He and Andrey Gritsenko and Amaury Lendasse and
  Stephen Baek","Embedded Spectral Descriptors: Learning the point-wise correspondence
  metric via Siamese neural networks",,,,,"cs.GR cs.CV","http://arxiv.org/licenses/nonexclusive-distrib/1.0/","  A robust and informative local shape descriptor plays an important role in
mesh registration. In this regard, spectral descriptors that are based on the
spectrum of the Laplace-Beltrami operator have been a popular subject of
research for the last decade due to their advantageous properties, such as
isometry invariance. Despite such, however, spectral descriptors often fail to
give a correct similarity measure for non-isometric cases where the metric
distortion between the models is large. Hence, they are not reliable for
correspondence matching problems when the models are not isometric. In this
paper, it is proposed a method to improve the similarity metric of spectral
descriptors for correspondence matching problems. We embed a spectral shape
descriptor into a different metric space where the Euclidean distance between
the elements directly indicates the geometric dissimilarity. We design and
train a Siamese neural network to find such an embedding, where the embedded
descriptors are promoted to rearrange based on the geometric similarity. We
demonstrate our approach can significantly enhance the performance of the
conventional spectral descriptors by the simple augmentation achieved via the
Siamese neural network in comparison to other state-of-the-art methods.
","[{""version"":""v1"",""created"":""Tue, 17 Oct 2017 16:26:04 GMT""},{""version"":""v2"",""created"":""Mon, 25 Jun 2018 21:30:24 GMT""},{""version"":""v3"",""created"":""Fri, 18 Oct 2019 07:37:30 GMT""}]","2019-10-21"
"1710.06369","Junpeng Hou","Junpeng Hou, Xi-Wang Luo, Kuei Sun, Thomas Bersano, Vandna Gokhroo,
  Sean Mossman, Peter Engels and Chuanwei Zhang","Momentum-Space Josephson Effects","10 pages, 7 figures","Phys. Rev. Lett. 120, 120401 (2018)","10.1103/PhysRevLett.120.120401",,"cond-mat.quant-gas","http://arxiv.org/licenses/nonexclusive-distrib/1.0/","  The Josephson effect is a prominent phenomenon of quantum supercurrents that
has been widely studied in superconductors and superfluids. Typical Josephson
junctions consist of two real-space superconductors (superfluids) coupled
through a weak tunneling barrier. Here we propose a momentum-space Josephson
junction in a spin-orbit coupled Bose-Einstein condensate, where states with
two diffferent momenta are coupled through Raman-assisted tunneling. We show
that Josephson currents can be induced not only by applying the equivalent of
""voltages"", but also by tuning tunneling phases. Such tunneling-phase-driven
Josephson junctions in momentum space are characterized through both full mean
field analysis and a concise two-level model, demonstrating the important role
of interactions between atoms. Our scheme provides a platform for
experimentally realizing momentum-space Josephson junctions and exploring their
applications in quantum-mechanical circuits.
","[{""version"":""v1"",""created"":""Tue, 17 Oct 2017 16:28:00 GMT""},{""version"":""v2"",""created"":""Fri, 8 Jun 2018 03:53:07 GMT""}]","2018-06-11"
"1710.06370","Alessandro Melchiorri Prof.","Eleonora Di Valentino, Alessandro Melchiorri","First cosmological constraints combining Planck with the recent
  gravitational-wave standard siren measurement of the Hubble constant","5 pages, 4 Figures, few typos corrected","Phys. Rev. D 97, 041301 (2018)","10.1103/PhysRevD.97.041301",,"astro-ph.CO gr-qc hep-ph","http://arxiv.org/licenses/nonexclusive-distrib/1.0/","  The recent observations of gravitational-wave and electromagnetic emission
produced by the merger of the binary neutron-star system GW170817 have opened
the possibility of using standard sirens to constrain the value of the Hubble
constant. While the reported bound of $H_0=70_{-8}^{+12}$ at $68 \%$ C.L. is
significantly weaker than those recently derived by observations of Cepheid
variables, it does not require any form of cosmic distance ladder and can be
considered as complementary and, in principle, more conservative. Here we
combine, for the first time, the new measurement with the Planck Cosmic
Microwave Background observations in a $12$ parameters extended $\Lambda$CDM
scenario, where the Hubble constant is weakly constrained from CMB data alone
and bound to a low value $H_0=55^{+7}_{-20}$ km/s/Mpc at $68 \%$ C.L. We point
out that the non-Gaussian shape of the GW170817 bound makes lower values of the
Hubble constant in worst agreement with observations than what expected from a
Gaussian form. The inclusion of the new GW170817 Hubble constant measurement
therefore significantly reduces the allowed parameter space, improving the
cosmological bounds on several parameters as the neutrino mass, curvature and
the dark energy equation of state.
","[{""version"":""v1"",""created"":""Tue, 17 Oct 2017 16:28:32 GMT""},{""version"":""v2"",""created"":""Thu, 19 Oct 2017 21:36:25 GMT""}]","2018-02-28"
"1710.06371","Ivan Vuli\'c","Ivan Vuli\'c and Nikola Mrk\v{s}i\'c","Specialising Word Vectors for Lexical Entailment","NAACL-HLT 2018 (long paper)",,,,"cs.CL","http://creativecommons.org/licenses/by/4.0/","  We present LEAR (Lexical Entailment Attract-Repel), a novel post-processing
method that transforms any input word vector space to emphasise the asymmetric
relation of lexical entailment (LE), also known as the IS-A or
hyponymy-hypernymy relation. By injecting external linguistic constraints
(e.g., WordNet links) into the initial vector space, the LE specialisation
procedure brings true hyponymy-hypernymy pairs closer together in the
transformed Euclidean space. The proposed asymmetric distance measure adjusts
the norms of word vectors to reflect the actual WordNet-style hierarchy of
concepts. Simultaneously, a joint objective enforces semantic similarity using
the symmetric cosine distance, yielding a vector space specialised for both
lexical relations at once. LEAR specialisation achieves state-of-the-art
performance in the tasks of hypernymy directionality, hypernymy detection, and
graded lexical entailment, demonstrating the effectiveness and robustness of
the proposed asymmetric specialisation model.
","[{""version"":""v1"",""created"":""Tue, 17 Oct 2017 16:39:09 GMT""},{""version"":""v2"",""created"":""Thu, 19 Apr 2018 13:02:39 GMT""}]","2018-04-20"
"1710.06372","Maher Alharby","Maher Alharby and Aad van Moorsel","Blockchain-based Smart Contracts: A Systematic Mapping Study","Keywords: Blockchain, Smart contracts, Systematic Mapping Study,
  Survey","Fourth International Conference on Computer Science and
  Information Technology (CSIT-2017)","10.5121/csit.2017.71011",,"cs.CR","http://arxiv.org/licenses/nonexclusive-distrib/1.0/","  An appealing feature of blockchain technology is smart contracts. A smart
contract is executable code that runs on top of the blockchain to facilitate,
execute and enforce an agreement between untrusted parties without the
involvement of a trusted third party. In this paper, we conduct a systematic
mapping study to collect all research that is relevant to smart contracts from
a technical perspective. The aim of doing so is to identify current research
topics and open challenges for future studies in smart contract research. We
extract 24 papers from different scientific databases. The results show that
about two thirds of the papers focus on identifying and tackling smart contract
issues. Four key issues are identified, namely, codifying, security, privacy
and performance issues. The rest of the papers focuses on smart contract
applications or other smart contract related topics. Research gaps that need to
be addressed in future studies are provided.
","[{""version"":""v1"",""created"":""Tue, 17 Oct 2017 16:39:23 GMT""}]","2017-10-18"
