"1710.06699","Aviad Elyashar","Aviad Elyashar, Jorge Bendahan, Rami Puzis","Detecting Clickbait in Online Social Media: You Won't Believe How We Did
  It",,,,,"cs.SI","http://arxiv.org/licenses/nonexclusive-distrib/1.0/","  In this paper, we propose an approach for the detection of clickbait posts in
online social media (OSM). Clickbait posts are short catchy phrases that
attract a user's attention to click to an article. The approach is based on a
machine learning (ML) classifier capable of distinguishing between clickbait
and legitimate posts published in OSM. The suggested classifier is based on a
variety of features, including image related features, linguistic analysis, and
methods for abuser detection. In order to evaluate our method, we used two
datasets provided by Clickbait Challenge 2017. The best performance obtained by
the ML classifier was an AUC of 0.8, an accuracy of 0.812, precision of 0.819,
and recall of 0.966. In addition, as opposed to previous studies, we found that
clickbait post titles are statistically significant shorter than legitimate
post titles. Finally, we found that counting the number of formal English words
in the given content is useful for clickbait detection.
","[{""version"":""v1"",""created"":""Wed, 18 Oct 2017 12:33:30 GMT""}]","2017-10-19"
"1710.06700","Hamdy Mubarak","Hamdy Mubarak","Build Fast and Accurate Lemmatization for Arabic",,,,,"cs.CL","http://arxiv.org/licenses/nonexclusive-distrib/1.0/","  In this paper we describe the complexity of building a lemmatizer for Arabic
which has a rich and complex derivational morphology, and we discuss the need
for a fast and accurate lammatization to enhance Arabic Information Retrieval
(IR) results. We also introduce a new data set that can be used to test
lemmatization accuracy, and an efficient lemmatization algorithm that
outperforms state-of-the-art Arabic lemmatization in terms of accuracy and
speed. We share the data set and the code for public.
","[{""version"":""v1"",""created"":""Wed, 18 Oct 2017 12:36:06 GMT""}]","2017-10-19"
"1710.06701","Sergio Almaraz","Sergio Almaraz, Ezequiel Barbosa","Rigidity on an eigenvalue problem with mixed boundary condition","5 pages",,,,"math.DG","http://arxiv.org/licenses/nonexclusive-distrib/1.0/","  We prove an Obata-type rigidity result for the spherical cap and apply it for
an eigenvalue problem with mixed boundary condition.
","[{""version"":""v1"",""created"":""Wed, 18 Oct 2017 12:36:27 GMT""}]","2017-10-19"
"1710.06702","Jonathan Simone","Jonathan Simone","Tight contact structures on some plumbed 3-manifolds","The first version of this paper only considered tight contact
  structures with no Giroux torsion on certain plumbed 3-manifolds. This
  updated version classifies all tight contact structures on such 3-manifolds",,,,"math.GT","http://arxiv.org/licenses/nonexclusive-distrib/1.0/","  In this article, we prove a generalization of a theorem of Lisca-Matic to
Stein cobordisms and develop a method for distinguishing certain Stein
cobordisms using rotation numbers. Using these results along with standard
techniques from convex surface theory and classifications of tight contact
structures on certain 3-manifolds due to Honda, we classify the tight contact
structures on a certain class of plumbed 3-manifolds that bound non-simply
connected 4-manifolds. Moreover, we give descriptions of the Stein fillings of
the Stein fillable contact structures.
","[{""version"":""v1"",""created"":""Wed, 18 Oct 2017 12:41:31 GMT""},{""version"":""v2"",""created"":""Mon, 17 Sep 2018 22:23:09 GMT""}]","2018-09-19"
"1710.06703","Amal Rannen Triki","Amal Rannen Triki, Maxim Berman and Matthew B. Blaschko","Function Norms and Regularization in Deep Networks","17 pages, 8 figures",,,,"cs.LG stat.ML","http://arxiv.org/licenses/nonexclusive-distrib/1.0/","  Deep neural networks (DNNs) have become increasingly important due to their
excellent empirical performance on a wide range of problems. However,
regularization is generally achieved by indirect means, largely due to the
complex set of functions defined by a network and the difficulty in measuring
function complexity. There exists no method in the literature for additive
regularization based on a norm of the function, as is classically considered in
statistical learning theory. In this work, we propose sampling-based
approximations to weighted function norms as regularizers for deep neural
networks. We provide, to the best of our knowledge, the first proof in the
literature of the NP-hardness of computing function norms of DNNs, motivating
the necessity of an approximate approach. We then derive a generalization bound
for functions trained with weighted norms and prove that a natural stochastic
optimization strategy minimizes the bound. Finally, we empirically validate the
improved performance of the proposed regularization strategies for both convex
function sets as well as DNNs on real-world classification and image
segmentation tasks demonstrating improved performance over weight decay,
dropout, and batch normalization. Source code will be released at the time of
publication.
","[{""version"":""v1"",""created"":""Wed, 18 Oct 2017 12:43:01 GMT""},{""version"":""v2"",""created"":""Thu, 28 Jun 2018 23:21:55 GMT""}]","2018-07-02"
"1710.06704","Bai-Chu Yu","Bai-Chu Yu, Zhih-Ahn Jia, Yu-chun Wu, Guang-Can Guo","Geometric Local Hidden State Model for Some Two-qubit States",,"Phys. Rev. A 98, 052345 (2018)","10.1103/PhysRevA.98.052345",,"quant-ph","http://arxiv.org/licenses/nonexclusive-distrib/1.0/","  Adopting the geometric description of steering assemblages and local hidden
states (LHS) model, we construct the optimal LHS model for some two-qubit
states under continuous projective measurements, and obtain a sufficient
steering criterion for all two-qubit states. Using the criterion, we show more
two-qubit states that are asymmetric in steering scenario under projective
measurements. Then we generalize the geometric description into higher
dimensional bipartite cases, calculate the steering bound of two-qutrit
isotropic states and make discussion on more general cases.
","[{""version"":""v1"",""created"":""Wed, 18 Oct 2017 12:45:14 GMT""},{""version"":""v2"",""created"":""Thu, 19 Oct 2017 07:00:57 GMT""},{""version"":""v3"",""created"":""Wed, 1 Nov 2017 03:01:31 GMT""},{""version"":""v4"",""created"":""Fri, 16 Nov 2018 08:09:43 GMT""}]","2018-12-05"
"1710.06705","Olivier Marchal","Olivier Marchal","Application de la r\'ecurrence topologique aux int\'egrales de matrices
  al\'eatoires et aux syst\`emes int\'egrables","Written in French. M\'emoire d'habilitation \`a diriger des
  recherches. 102 pages including many figures",,,,"math-ph hep-th math.MP math.PR","http://arxiv.org/licenses/nonexclusive-distrib/1.0/","  The goal of this ""Habilitation \`a diriger des recherches"" is to present two
different applications, namely computations of certain partition functions in
probability and applications to integrable systems, of the topological
recursion developed by B. Eynard and N. Orantin in 2007. Since its creation,
the range of applications of the topological recursion has been growing and
many results in different fields have been obtained. The first aspect that I
will develop deals with the historical domain of the topological recursion:
random matrix integrals. I will review the formalism of the topological
recursion as well as how it can be used to obtain asymptotic $\frac{1}{N}$
series expansion of various matrix integrals. In particular, a key feature of
the topological recursion is that it can recover from the leading order of the
asymptotic all sub-leading orders with elementary computations. This method is
particularly well known and fruitful in the case of hermitian matrix integrals,
but I will also show that the general method can be used to cover integrals
with hard edges, integrals over unitary matrices and much more. In the end, I
will also briefly mention the generalization to $\beta$-ensembles. In a second
chapter, I will review the connection between the topological recursion and the
study of integrable systems having a Lax pair representation. Most of the
results presented there will be illustrated by the case of the famous six
Painlev\'e equations. Though the formalism used in this chapter may look
completely disconnected from the previous one, it is well known that the local
statistics of eigenvalues in random matrix theory exhibit a universality
phenomenon and that the encountered universal systems are precisely driven by
some solutions of the Painlev\'{e} equations. As I will show, the connection
can be made very explicit with the topological recursion formalism.
","[{""version"":""v1"",""created"":""Wed, 18 Oct 2017 12:46:27 GMT""},{""version"":""v2"",""created"":""Thu, 19 Oct 2017 08:42:08 GMT""}]","2017-10-20"
"1710.06706","Zhongzhong  Qin","Rong Ma, Wei Liu, Zhongzhong Qin, Xiaojun Jia, and Jiangrui Gao","Generating quantum correlated twin beams by four-wave mixing in hot
  cesium vapor","6 pages, 5 figures, comments are welcome","Phys. Rev. A 96, 043843 (2017)","10.1103/PhysRevA.96.043843",,"quant-ph","http://arxiv.org/licenses/nonexclusive-distrib/1.0/","  Using a nondegenerate four-wave mixing process based on a double-$\Lambda$
scheme in hot cesium vapor, we generate quantum correlated twin beams with a
maximum intensity-difference squeezing of 6.5 dB. The substantially improved
squeezing can be mainly attributed to very good frequency and phase-difference
stability between the pump and probe beams in our experiment.
Intensity-difference squeezing can be observed within a wide experimental
parameter range, which guarantees its robust generation. Since this scheme
produces multi-spatial-mode twin beams at the Cs $D_{1}$ line, it is of
interest for experiments involving quantum imaging and coherent interfaces
between atomic and solid-state systems.
","[{""version"":""v1"",""created"":""Wed, 18 Oct 2017 12:48:18 GMT""}]","2017-10-19"
"1710.06707","Michael Smidman","C. Y. Guo, M. Smidman, B. Shen, W. Wu, F. K. Lin, X. L Han, Y. Chen,
  F. Wu, Y. F. Wang, W. B. Jiang, X. Lu, J. P. Hu, J. L. Luo, H. Q. Yuan","Evidence for triplet superconductivity near an antiferromagnetic
  instability in CrAs","9 pages, 5 figures","Phys. Rev. B 98, 024520 (2018)","10.1103/PhysRevB.98.024520",,"cond-mat.supr-con","http://arxiv.org/licenses/nonexclusive-distrib/1.0/","  Superconductivity was recently observed in CrAs as the helimagnetic order is
suppressed by applying pressure, suggesting possible unconventional
superconductivity. To reveal the nature of the superconducting order parameter
of CrAs, here we report the angular dependence of the upper critical field
under pressure. Upon rotating the field by 360 degrees in the $bc$-plane, six
maxima are observed in the upper critical field, where the oscillations have
both six-fold and two-fold symmetric components. Our analysis suggests the
presence of an unconventional odd-parity spin triplet state.
","[{""version"":""v1"",""created"":""Wed, 18 Oct 2017 12:54:14 GMT""},{""version"":""v2"",""created"":""Tue, 7 Aug 2018 10:08:17 GMT""}]","2018-08-08"
"1710.06708","Saeid Zahmatkesh Komeleh","Saeid Zahmatkesh","The partial-isometric crossed products by semigroups of endomorphisms
  are Morita equivalent to crossed products by groups",,,,,"math.OA","http://arxiv.org/licenses/nonexclusive-distrib/1.0/","  Let $\Gamma^{+}$ be the positive cone of a totally ordered abelian discrete
group $\Gamma$, and $\alpha$ an action of $\Gamma^{+}$ by extendible
endomorphisms of a $C^*$-algebra $A$. We prove that the partial-isometric
crossed product $A\times_{\alpha}^{\textrm{piso}}\Gamma^{+}$ is a full corner
of a group crossed product $\mathcal{B}\times_{\beta}\Gamma$, where
$\mathcal{B}$ is a subalgebra of $\ell^{\infty}(\Gamma,A)$ generated by a
collection of faithful copies of $A$, and the action $\beta$ on $\mathcal{B}$
is induced by shift on $\ell^{\infty}(\Gamma,A)$. We then use this realization
to show that $A\times_{\alpha}^{\textrm{piso}}\Gamma^{+}$ has an essential
ideal $J$, which is a full corner in an ideal $\mathcal{I}\times_{\beta}\Gamma$
of $\mathcal{B}\times_{\beta}\Gamma$.
","[{""version"":""v1"",""created"":""Wed, 18 Oct 2017 12:55:24 GMT""}]","2017-10-19"
"1710.06709","Marek Skarka","M. Skarka, J. Li\v{s}ka, R. D\v{r}ev\v{e}n\'y, E. Guggenberger, \'A.
  S\'odor, T. G. Barnes and K. Kolenberg","A cautionary tale of interpreting O-C diagrams: period instability in a
  classical RR Lyr Star Z CVn mimicking as a distant companion","15 pages, 8 tables, 9 figures, accepted for publication in MNRAS",,"10.1093/mnras/stx2737",,"astro-ph.SR","http://arxiv.org/licenses/nonexclusive-distrib/1.0/","  We present a comprehensive study of Z CVn, an RR Lyrae star that shows
long-term cyclic variations of its pulsation period. A possible explanation
suggested from the shape of the O-C diagram is the light travel-time effect,
which we thoroughly examine. We used original photometric and spectroscopic
measurements and investigated the period evolution using available maximum
times spanning more than one century. If the binary hypothesis is valid, Z CVn
orbits around a black hole with minimal mass of $56.5$ $\mathfrak{M}_{\odot}$
on a very wide ($P_{\rm orbit}=78.3$ years) and eccentric orbit ($e=0.63$). We
discuss the probability of a formation of a black hole-RR Lyrae pair and,
although we found it possible, there is no observational evidence of the black
hole in the direction to Z CVn. However, the main objection against the binary
hypothesis is the comparison of the systemic radial velocity curve model and
spectroscopic observations that clearly show that Z CVn cannot be bound in such
a binary. Therefore, the variations of pulsation period are likely intrinsic to
the star. This finding represents a discovery/confirmation of a new type of
cyclic period changes in RR Lyrae stars. By the analysis of our photometric
data, we found that the Blazhko modulation with period of 22.931 d is strongly
dominant in amplitude. The strength of the phase modulation varies and is
currently almost undetectable. We also estimated photometric physical
parameters of Z CVn and investigated their variations during the Blazhko cycle
using the Inverse Baade-Wesselink method.
","[{""version"":""v1"",""created"":""Wed, 18 Oct 2017 12:56:40 GMT""}]","2017-10-19"
"1710.06710","Zohar Nussinov","Zohar Nussinov","Macroscopic Length Correlations in Non-Equilibrium Systems and Their
  Possible Realizatons","145 pages, 7 figures (increase in page number primarily due to new
  style file)","Nuclear Physics B, volume 953, 114948 (2020)","10.1016/j.nuclphysb.2020.114948",,"quant-ph cond-mat.stat-mech hep-th math-ph math.MP","http://arxiv.org/licenses/nonexclusive-distrib/1.0/","  We consider general systems that start from and/or end in thermodynamic
equilibrium while experiencing a finite rate of change of their energy density
or other intensive quantities $q$ at intermediate times. We demonstrate that at
these times, during which $q$ varies at a finite rate, the associated
covariance, the connected pair correlator $G_{ij} = \langle q_{i} q_{j} \rangle
- \langle q_{i} \rangle \langle q_{j} \rangle$, between any two (far separated)
sites $i$ and $j$ in a macroscopic system may, on average, become finite. Once
the global mean $q$ no longer changes, the average of $G_{ij}$ over all site
pairs $i$ and $j$ may tend to zero. However, when the equilibration times are
significant (e.g., as in a glass that is not in true thermodynamic equilibrium
yet in which the energy density (or temperature) reaches a final steady state
value), these long range correlations may persist also long after $q$ ceases to
change. We explore viable experimental implications of our findings and
speculate on their potential realization in glasses (where a prediction of a
theory based on the effect that we describe here suggests a universal collapse
of the viscosity that agrees with all published viscosity measurements over
sixteen decades) and non-Fermi liquids. We discuss effective equilibrium in
driven systems and derive uncertainty relation based inequalities that connect
the heat capacity to the dynamics in general open thermal systems. These
rigorous thermalization inequalities suggest the shortest possible fluctuation
times scales in open equilibrated systems at a temperature $T$ are typically
""Planckian"" (i.e., ${\cal{O}}(\hbar/(k_{B} T))$). We briefly comment on
parallels between quantum measurements, unitary quantum evolution, and
thermalization and on how Gaussian distributions may generically emerge.
","[{""version"":""v1"",""created"":""Wed, 18 Oct 2017 12:57:48 GMT""},{""version"":""v10"",""created"":""Thu, 20 Dec 2018 18:59:10 GMT""},{""version"":""v11"",""created"":""Mon, 31 Dec 2018 14:07:08 GMT""},{""version"":""v12"",""created"":""Mon, 7 Jan 2019 05:37:14 GMT""},{""version"":""v13"",""created"":""Wed, 24 Jul 2019 14:16:07 GMT""},{""version"":""v14"",""created"":""Sun, 18 Aug 2019 02:00:27 GMT""},{""version"":""v15"",""created"":""Wed, 28 Aug 2019 15:51:34 GMT""},{""version"":""v16"",""created"":""Fri, 13 Dec 2019 17:24:37 GMT""},{""version"":""v17"",""created"":""Thu, 2 Jan 2020 15:15:58 GMT""},{""version"":""v2"",""created"":""Mon, 30 Oct 2017 17:51:39 GMT""},{""version"":""v3"",""created"":""Mon, 6 Nov 2017 15:48:00 GMT""},{""version"":""v4"",""created"":""Sun, 26 Nov 2017 03:58:51 GMT""},{""version"":""v5"",""created"":""Mon, 12 Feb 2018 16:36:37 GMT""},{""version"":""v6"",""created"":""Sun, 25 Feb 2018 03:05:01 GMT""},{""version"":""v7"",""created"":""Tue, 22 May 2018 16:59:33 GMT""},{""version"":""v8"",""created"":""Fri, 25 May 2018 16:07:35 GMT""},{""version"":""v9"",""created"":""Tue, 2 Oct 2018 17:21:29 GMT""}]","2021-01-13"
"1710.06711","Raluca Diaconu","Raluca Diaconu, Jean Bacon, Jie Deng, Jatinder Singh","ComFlux: External Composition and Adaptation of Pervasive Applications",,,,,"cs.CY cs.SE","http://arxiv.org/licenses/nonexclusive-distrib/1.0/","  Technology is becoming increasingly pervasive. At present, the system
components working together to provide functionality, be they purely software
or with a physical element, tend to operate within silos, bound to a particular
application or usage.
  This is counter to the wider vision of pervasive computing, where a
potentially limitless number of applications can be realised through the
dynamic and seamless interactions of system components. We believe this
application composition should be externally controlled, driven by policy and
subject to access control. We present ComFlux, our open source middleware, and
show through a number of designs and implementations, how it supports this
functionality with acceptable overhead.
","[{""version"":""v1"",""created"":""Wed, 18 Oct 2017 12:58:51 GMT""}]","2017-10-19"
"1710.06712","Matthieu Porte","Matthieu Porte","Linear response for Dirac observables of Anosov diffeomorphisms","22 pages, 3 figures","Discrete & Continuous Dynamical Systems - A, 39 (4): 1799-1819
  (2019)","10.3934/dcds.2019078",,"math.DS","http://arxiv.org/licenses/nonexclusive-distrib/1.0/","  We consider a $\mathcal{C}^3$ family $t\mapsto f_t$ of $\mathcal{C}^4$ Anosov
diffeomorphisms on a compact Riemannian manifold $M$. Denoting by $\rho_t$ the
SRB measure of $f_t$, we prove that the map $t\mapsto\int \theta d\rho_t$ is
differentiable if $\theta$ is of the form $\theta(x)=h(x)\delta(g(x)-a)$, with
$\delta$ the Dirac distribution, $g:M\rightarrow \mathbb{R}$ a $\mathcal{C}^4$
function, $h:M\rightarrow\mathbb{R}$ a $\mathcal{C}^3$ function and $a$ a
regular value of $g$. We also require a transversality condition, namely that
the intersection of the support of $h$ with the level set $\{g(x)=a\} $ is
foliated by 'admissible stable leaves'.
","[{""version"":""v1"",""created"":""Wed, 18 Oct 2017 13:03:50 GMT""}]","2019-07-08"
"1710.06713","Gianluigi Bodo","G. Bodo and F. Tavecchio","Recollimation shocks and radiative losses in extragalactic relativistic
  jets","8 pages, 8 figures, Astronomy and Astrophysics accepted","A&A 609, A122 (2018)","10.1051/0004-6361/201732000",,"astro-ph.HE","http://arxiv.org/licenses/nonexclusive-distrib/1.0/","  We present the results of state-of-the-art simulations of recollimation
shocks induced by the interaction of a relativistic jet with an external
medium, including the effect of radiative losses of the shocked gas. Our
simulations confirm that -- as suggested by earlier semi-analytical models --
the post-shock pressure loss induced by radiative losses may lead to a
stationary equilibrium state characterized by a very strong focusing of the
flow, with the formation of quite narrow nozzles, with cross-sectional radii as
small as $10^{-3}$ times the length scale of the jet. We also study the
time-dependent evolution of the jet structure induced of a density perturbation
injected at the flow base. The set-up and the results of the simulations are
particularly relevant for the interpretation of the observed rapid variability
of the $\gamma$-ray emission associated to flat spectrum radio quasars. In
particular, the combined effects of jet focusing and Doppler beaming of the
observed radiation make it possible to explain the sub-hour flaring events such
as that observed in the FSRQ PKS 1222+216 by MAGIC.
","[{""version"":""v1"",""created"":""Wed, 18 Oct 2017 13:07:21 GMT""}]","2018-02-07"
"1710.06714","Thomas A. Searles","Joshua A. Burrow, Riad Yahiaoui, Andrew Sarangan, Imad Agha, Jay
  Mathews and Thomas A. Searles","Polarization-dependent electromagnetic responses of ultrathin and highly
  flexible asymmetric terahertz metasurfaces","9 pages, 5 figures",,"10.1364/OE.25.032540",,"physics.app-ph","http://arxiv.org/licenses/nonexclusive-distrib/1.0/","  We report the polarization-dependent electromagnetic response from a series
of novel terahertz (THz) metasurfaces where asymmetry is introduced through the
displacement of two adjacent metallic arms separated by a distance $\delta$.
For all polarization states, the symmetric metasurface exhibits a low quality
(Q) factor fundamental dipole mode. By breaking the symmetry, we experimentally
observe a secondary dipole-like mode with a Q factor nearly $9\times$ higher
than the fundamental resonance. As $\delta$ increases, the fundamental dipole
mode $f_{1}$ redshifts and the secondary mode $f_{2}$ blueshifts creating a
highly transmissive spectral window. Polarization-dependent measurements reveal
a full suppression of $f_{2}$ for all asymmetries at $\theta \geq 60^\circ$.
Furthermore, at $\delta \geq 60 \text{ }\mu\text{m}$, we observe a polarization
selective electromagnetic induced transparency (EIT) for the fundamental mode.
This work paves the way for applications in filtering, sensing and slow-light
devices common to other high Q factor THz metasurfaces with EIT-like response.
","[{""version"":""v1"",""created"":""Wed, 18 Oct 2017 13:08:59 GMT""}]","2018-02-14"
"1710.06715","Ed Bennett","Ed Bennett, Deog Ki Hong, Jong-Wan Lee, C.-J. David Lin, Biagio
  Lucini, Maurizio Piai and Davide Vadacchino","Higgs compositeness in $\mathrm{Sp}(2N)$ gauge theories ---
  Resymplecticisation, scale setting and topology","8 pages, 6 figures; talk presented at the 35th International
  Symposium on Lattice Field Theory, 18-24 June 2017, Granada, Spain",,"10.1051/epjconf/201817508012",,"hep-lat","http://creativecommons.org/licenses/by/4.0/","  As part of an ongoing programme to study $\mathrm{Sp}(2N)$ gauge theories as
potential realisations of composite Higgs models, we consider the case of
$\mathrm{Sp}(4)$ on the lattice, both as a pure gauge theory, and with two
Dirac fermion flavors in the fundamental representation. In order to compare
results between these two cases and maintain control of lattice artefacts, we
make use of the gradient flow to set the scale of the simulations. We present
some technical aspects of the simulations, including preliminary results for
the scale setting in the two cases and results for the topological charge
history.
","[{""version"":""v1"",""created"":""Wed, 18 Oct 2017 13:11:56 GMT""}]","2018-04-18"
