"1710.06578","Masashi Okada Dr","Masashi Okada, Tadahiro Taniguchi","Acceleration of Gradient-based Path Integral Method for Efficient
  Optimal and Inverse Optimal Control","ICRA2018 camera ready version",,"10.1109/ICRA.2018.8463164",,"cs.SY","http://arxiv.org/licenses/nonexclusive-distrib/1.0/","  This paper deals with a new accelerated path integral method, which
iteratively searches optimal controls with a small number of iterations. This
study is based on the recent observations that a path integral method for
reinforcement learning can be interpreted as gradient descent. This observation
also applies to an iterative path integral method for optimal control, which
sets a convincing argument for utilizing various optimization methods for
gradient descent, such as momentum-based acceleration, step-size adaptation and
their combination. We introduce these types of methods to the path integral and
demonstrate that momentum-based methods, like Nesterov Accelerated Gradient and
Adam, can significantly improve the convergence rate to search for optimal
controls in simulated control systems. We also demonstrate that the accelerated
path integral could improve the performance on model predictive control for
various vehicle navigation tasks. Finally, we represent this accelerated path
integral method as a recurrent network, which is the accelerated version of the
previously proposed path integral networks (PI-Net). We can train the
accelerated PI-Net more efficiently for inverse optimal control with less RAM
than the original PI-Net.
","[{""version"":""v1"",""created"":""Wed, 18 Oct 2017 04:01:33 GMT""},{""version"":""v2"",""created"":""Fri, 9 Mar 2018 09:37:13 GMT""}]","2019-10-08"
"1710.06579","Zi-Qiang Zhang","Zi-qiang Zhang, De-fu Hou and Gang Chen","Imaginary potential of moving quarkonia in a D-instanton background","9 pages, 5 figures","J. Phys. G: Nucl. Part. Phys. 44 (2017) 115001","10.1088/1361-6471/aa8daa",,"hep-th","http://arxiv.org/licenses/nonexclusive-distrib/1.0/","  The imaginary part of the inter-quarks potential of moving heavy quarkonia is
investigated in a dual supergravity of the AdS background deformed by dilaton,
which induces the gauge field condensate in the dual gauge theory. We analyze
the quark anti-quark pair moving transverse and parallel to the plasma wind,
respectively. It is shown that for both cases the presence of D-instanton
density tends to increase the inter-distance and decrease the imaginary
potential, reverse to the effect of the pair's velocity. Moreover, it is found
that the D-instanton density has stronger effects for the parallel case rather
than transverse.
","[{""version"":""v1"",""created"":""Wed, 18 Oct 2017 04:21:18 GMT""}]","2017-10-19"
"1710.06580","Yue Sun","Yue Sun, Akiyoshi Park, Sunseng Pyon, Tsuyoshi Tamegai, and Hisashi
  Kitamura","Symmetry-unprotected nodes or gap minima in $s_{++}$ state of FeSe
  single crystal","6 pages, 3 figures","Phys. Rev. B Rapid Communication 96, 140505(R) (2017)","10.1103/PhysRevB.96.140505",,"cond-mat.supr-con cond-mat.str-el","http://arxiv.org/licenses/nonexclusive-distrib/1.0/","  We report the study on superconducting pairing mechanism of FeSe via the
pair-breaking effects induced by H$^+$-irradiation combined with
low-temperature specific heat measurements. A multi-gap structure with nodes or
gap minima is suggested in a clean FeSe by the specific heat results. The
suppression of critical temperature $T_c$ with increasing the defect density
manifests a two-step behavior. When the increase in the residual resistivity is
small, $\Delta\rho_0$ $<$ $\sim$4.5 $\mu\Omega$cm, $T_c$ is gradually
suppressed with increasing the density of scattering centers, suggesting the
presence of symmetry-unprotected nodes or gap minima. However, for
$\Delta\rho_0$ $>$ $\sim$4.5 $\mu\Omega$cm, $T_c$ is almost independent of the
scattering, which indicates that the nodes or gap minima are lifted and the
order parameter becomes almost isotropic without sign change. Thus, the
superconductivity in FeSe is found to be realized in symmetry-unprotected nodal
or highly anisotropic $s_{++}$ state.
","[{""version"":""v1"",""created"":""Wed, 18 Oct 2017 04:23:49 GMT""}]","2017-10-19"
"1710.06581","Guangcun Liu","Guangcun Liu and Yi-Cai Zhang","Studies of Single Component Fermi Gas near a $P$-wave Resonance with
  Lowest Order Constrained Variational Method",,,"10.1209/0295-5075/122/40006",,"cond-mat.quant-gas","http://arxiv.org/licenses/nonexclusive-distrib/1.0/","  We study single component Fermi gas near a $p$-wave resonance with the lowest
order constrained variational (LOCV) method. We obtain the energy per particle
for the ground state of single component Fermi gas near a $p$-wave resonance
with LOCV method. We also calculate compressibility of the single component
Fermi gas near a $p$-wave resonance and it shows that near the $p$-wave
resonance, the system would lose its stability and collapse. The two $p$-wave
contacts are also obtained and their variation tendencies with interaction
strength are consistent with recent experimental results.
","[{""version"":""v1"",""created"":""Wed, 18 Oct 2017 04:24:26 GMT""},{""version"":""v2"",""created"":""Wed, 11 Jul 2018 06:57:36 GMT""}]","2018-08-01"
"1710.06582","Xiaoming Zhang","Feiran Huang, Xiaoming Zhang, Zhoujun Li, Tao Mei, Yueying He,
  Zhonghua Zhao","Learning Social Image Embedding with Deep Multimodal Attention Networks",,"Proceedings of Thematic Workshops of the 25th ACM Multimedia 2017","10.1145/3126686.3126720",,"cs.MM cs.LG stat.ML","http://arxiv.org/licenses/nonexclusive-distrib/1.0/","  Learning social media data embedding by deep models has attracted extensive
research interest as well as boomed a lot of applications, such as link
prediction, classification, and cross-modal search. However, for social images
which contain both link information and multimodal contents (e.g., text
description, and visual content), simply employing the embedding learnt from
network structure or data content results in sub-optimal social image
representation. In this paper, we propose a novel social image embedding
approach called Deep Multimodal Attention Networks (DMAN), which employs a deep
model to jointly embed multimodal contents and link information. Specifically,
to effectively capture the correlations between multimodal contents, we propose
a multimodal attention network to encode the fine-granularity relation between
image regions and textual words. To leverage the network structure for
embedding learning, a novel Siamese-Triplet neural network is proposed to model
the links among images. With the joint deep model, the learnt embedding can
capture both the multimodal contents and the nonlinear network information.
Extensive experiments are conducted to investigate the effectiveness of our
approach in the applications of multi-label classification and cross-modal
search. Compared to state-of-the-art image embeddings, our proposed DMAN
achieves significant improvement in the tasks of multi-label classification and
cross-modal search.
","[{""version"":""v1"",""created"":""Wed, 18 Oct 2017 04:28:20 GMT""}]","2017-10-19"
"1710.06583","Yang Lu","Yang Lu and Minghui Zhu","Distributed economic control of dynamically coupled networks","14 pages, 4 figures, journal",,,,"math.OC","http://arxiv.org/licenses/nonexclusive-distrib/1.0/","  This paper investigates the synthesis of distributed economic control
algorithms under which dynamically coupled physical systems are regulated to a
variational equilibrium of a constrained convex game. We study two
complementary cases: (i) each subsystem is linear and controllable; and (ii)
each subsystem is nonlinear and in the strict-feedback form. The convergence of
the proposed algorithms is guaranteed using Lyapunov analysis. Their
performance is verified by two case studies on a multi-zone building
temperature regulation problem and an optimal power flow problem, respectively.
","[{""version"":""v1"",""created"":""Wed, 18 Oct 2017 04:40:57 GMT""},{""version"":""v2"",""created"":""Thu, 19 Oct 2017 03:06:00 GMT""},{""version"":""v3"",""created"":""Sun, 22 Oct 2017 03:37:39 GMT""},{""version"":""v4"",""created"":""Fri, 2 Nov 2018 03:06:57 GMT""},{""version"":""v5"",""created"":""Tue, 5 Mar 2019 02:47:17 GMT""},{""version"":""v6"",""created"":""Fri, 10 Jan 2020 18:54:25 GMT""},{""version"":""v7"",""created"":""Tue, 24 Aug 2021 10:33:15 GMT""}]","2021-08-25"
"1710.06584","Jhih-Shih You","Jhih-Shih You, Jian-Ming Tang, Wen-Min Huang","Collective resonances near zero energy induced by a point defect in
  bilayer graphene","6 figures. to appear in Sci. Rep","Scientific Reports 8, 10938 (2018)","10.1038/s41598-018-29213-z",,"cond-mat.mes-hall","http://arxiv.org/licenses/nonexclusive-distrib/1.0/","  Intrinsic defects give rise to scattering processes governing the transport
properties of mesoscopic systems. We investigate analytically and numerically
the local density of states in Bernal stacking bilayer graphene with a point
defect. With Bernal stacking structure, there are two types of lattice sites.
One corresponds to connected sites, where carbon atoms from each layer stack on
top of each other, and the other corresponds to disconnected sites. From our
theoretical study, a picture emerges in which the pronounced zero-energy peak
in the local density of states does not attribute to zero-energy impurity
states associated to two different types of defects but to a collective
phenomenon of the low-energy resonant states induced by the defect. To
corroborate this description, we numerically show that at small system size
$N$, where $N$ is the number of unit cells, the zero-energy peak near the
defect scales as $1/\ln N$ for the quasi-localized zero-energy state and as
$1/N$ for the delocalized zero-energy state. As the system size approaches to
the thermodynamic limit, the former zero-energy peak becomes a power-law
singularity $1/|E|$ in low energies, while the latter is broadened into a
Lorentzian shape. A striking point is that both types of zero-energy peaks
decay as $1/r^2$ away from the defect, manifesting the quasi-localized
character. Based on our results, we propose a general formula for the local
density of states in low-energy and in real space. Our study sheds light on
this fundamental problem of defects.
","[{""version"":""v1"",""created"":""Wed, 18 Oct 2017 04:48:31 GMT""},{""version"":""v2"",""created"":""Tue, 3 Jul 2018 16:11:24 GMT""}]","2018-09-10"
"1710.06585","Eitan Tadmor","Siming He, Eitan Tadmor","Suppressing chemotactic blow-up through a fast splitting scenario on the
  plane",,,"10.1007/s00205-018-01336-7",,"math.AP","http://arxiv.org/licenses/nonexclusive-distrib/1.0/","  We revisit the question of global regularity for the Patlak-Keller-Segel
(PKS) chemotaxis model. The classical 2D hyperbolic-elliptic model blows up for
initial mass M>8\pi. We consider more realistic scenario which takes into
account the flow of the ambient environment induced by harmonic potentials, and
thus retain the identical elliptic structure as in the original PKS.
Surprisingly, we find that already the simplest case of linear stationary
vector field, $Ax^\top$, with large enough amplitude $A$, prevents chemotactic
blow-up. Specifically, the presence of such an ambient fluid transport creates
what we call a 'fast splitting scenario', which competes with the focusing
effect of aggregation so that 'enough mass' is pushed away from concentration
along the $x_1$-axis, thus avoiding a finite time blow-up, at least for
M<16\pi. Thus, the enhanced ambient flow doubles the amount of allowable mass
which evolve to global smooth solutions.
","[{""version"":""v1"",""created"":""Wed, 18 Oct 2017 05:08:21 GMT""},{""version"":""v2"",""created"":""Fri, 26 Oct 2018 03:05:04 GMT""}]","2018-12-05"
"1710.06586","Marcus Niechciol","M. Niechciol, M. Risse, P. Ruehl, M. Settimo, P.W. Younk, A. Yushkov","$F_\gamma$: a new observable for photon-hadron discrimination in hybrid
  air shower events","10 pages, 6 figures; v2: added journal reference","Astropart. Phys. 97 (2018), 88-95","10.1016/j.astropartphys.2017.10.004",,"astro-ph.HE astro-ph.IM","http://arxiv.org/licenses/nonexclusive-distrib/1.0/","  To search for ultra-high-energy photons in primary cosmic rays, air shower
observables are needed that allow a good separation between primary photons and
primary hadrons. We present a new observable, $F_\gamma$, which can be
extracted from ground-array data in hybrid events, where simultaneous
measurements of the longitudinal and the lateral shower profile are performed.
The observable is based on a template fit to the lateral distribution measured
by the ground array with the template taking into account the complementary
information from the measurement of the longitudinal profile, i.e. the primary
energy and the geometry of the shower. $F_\gamma$ shows a very good
photon-hadron separation, which is even superior to the separation given by the
well-known $X_\text{max}$ observable (the atmospheric depth of the shower
maximum). At energies around $1\,\text{EeV}$ ($10\,\text{EeV}$), $F_\gamma$
provides a background rejection better than $97.8\,\%$ ($99.9\,\%$) at a signal
efficiency of $50\,\%$. Advantages of the observable $F_\gamma$ are its
technical stability with respect to irregularities in the ground array (i.e.
missing or temporarily non-operating stations) and that it can be applied over
the full energy range accessible to the air shower detector, down to its
threshold energy. Furthermore, $F_\gamma$ complements nicely to $X_\text{max}$
such that both observables can well be combined to achieve an even better
discrimination power, exploiting the rich information available in hybrid
events.
","[{""version"":""v1"",""created"":""Wed, 18 Oct 2017 05:14:26 GMT""},{""version"":""v2"",""created"":""Tue, 21 Nov 2017 18:27:04 GMT""}]","2017-11-22"
"1710.06587","Zhaohui Yang","Zhaohui Yang, Wei Xu, Jianfeng Shi, Hao Xu, Ming Chen","Association and Load Optimization with User Priorities in Load-Coupled
  Heterogeneous Networks","14pages, 10 figures",,,,"cs.IT math.IT","http://creativecommons.org/licenses/by/4.0/","  In this paper, we consider the network utility maximization problem with
various user priorities via jointly optimizing user association, load
distribution and power control in a load-coupled heterogeneous network. In
order to tackle the nonconvexity of the problem, we first analyze the problem
by obtaining the optimal resource allocation strategy in closed form and
characterizing the optimal base station load distribution pattern. Both
observations are shown essential in simplifying the original problem and making
it possible to transform the nonconvex load distribution and power control
problem into convex reformulation via exponential variable transformation. An
iterative algorithm with low complexity is accordingly presented to obtain a
suboptimal solution to the joint optimization problem. Simulation results show
that the proposed algorithm achieves better performance than conventional
approaches.
","[{""version"":""v1"",""created"":""Wed, 18 Oct 2017 05:17:21 GMT""}]","2017-10-19"
"1710.06588","Dae-Yun Kim","Yong-Keun Park, Dae-Yun Kim, Joo-Sung Kim, Yune-Seok Nam, Min-Ho Park,
  Hyeok-Cheol Choi, Byoung-Chul Min, and Sug-Bong Choe","Empirical correlation between the interfacial Dzyaloshinskii Moriya
  interaction and work function in metallic magnetic trilayers","18 pages, 4 figures, and 2 tables",,,,"cond-mat.mtrl-sci","http://arxiv.org/licenses/nonexclusive-distrib/1.0/","  The Dzyaloshinskii Moriya interaction (DMI) generates intriguing chiral
magnetic objects such as magnetic skyrmions and chiral domain walls that can be
used as building blocks in emerging magnetic nanodevices. To achieve better
stability and functionality of these chiral objects, it is essential to achieve
a larger DMI. In this paper, we report an experimental observation that in
magnetic trilayer films, the DMI strength is mainly determined by the work
functions of the nonmagnetic layers interfaced with the magnetic layer. The
clear correlation with the intrinsic material parameters provides a guideline
for material selection to engineer the DMI strength.
","[{""version"":""v1"",""created"":""Wed, 18 Oct 2017 05:17:22 GMT""}]","2017-10-19"
"1710.06589","Joshua Brown","Lionel Barnett, Joshua Brown, Terry Bossomaier","Anomalous Behaviour of Mutual Information in Finite Flocks","9 pages, 4 figures",,"10.1209/0295-5075/120/38005",,"cond-mat.stat-mech","http://arxiv.org/licenses/nonexclusive-distrib/1.0/","  The existing consensus is that flocks are poised at criticality, entailing
long correlation lengths and a maximal value of Shannon mutual information in
the large-system limit. We show, by contrast, that for finite flocks in the
long observation time limit, mutual information may not only fail to peak at
criticality---as observed for other critical systems---but also diverge as
noise tends to zero. This result carries implications for other finite-size,
out-of-equilibrium systems, where observation times may vary widely compared to
time scales of internal system dynamics; thus it may not be assumed that mutual
information locates the phase transition.
","[{""version"":""v1"",""created"":""Wed, 18 Oct 2017 06:08:43 GMT""}]","2018-03-14"
"1710.06590","Emeric Dynomant","Emeric Dynomant, Mathilde Gorieu, Helene Perrin, Marion Denorme,
  Fabien Pichon, Arnaud Desfeux","MEDOC: a Python wrapper to load MEDLINE into a local MySQL database","4 pages, 1 figure",,,,"cs.DL cs.DB","http://creativecommons.org/licenses/by-nc-sa/4.0/","  Since the MEDLINE database was released, the number of documents indexed by
this entity has risen every year. Several tools have been developed by the
National Institutes of Health (NIH) to query this corpus of scientific
publications. However, in terms of advances in big data, text-mining and data
science, an option to build a local relational database containing all metadata
available on MEDLINE would be truly useful to optimally exploit these
resources. MEDOC (MEdline DOwnloading Contrivance) is a Python program designed
to download data on an FTP and to load all extracted information into a local
MySQL database. It took MEDOC 4 days and 17 hours to load the 26 million
documents available on this server onto a standard computer. This indexed
relational database allows the user to build complex and rapid queries. All
fields can thus be searched for desired information, a task that is difficult
to accomplish through the PubMed graphical interface. MEDOC is free and
publicly available at https://github.com/MrMimic/MEDOC.
","[{""version"":""v1"",""created"":""Wed, 18 Oct 2017 06:14:53 GMT""}]","2017-10-19"
"1710.06591","Joshua Brown","Joshua Brown, Terry Bossomaier, Lionel Barnett","Review of Data Structures for Computationally Efficient
  Nearest-Neighbour Entropy Estimators for Large Systems with Periodic Boundary
  Conditions","16 pages, 8 figures",,,,"stat.CO","http://arxiv.org/licenses/nonexclusive-distrib/1.0/","  Information theoretic quantities are extremely useful in discovering
relationships between two or more data sets. One popular method---particularly
for continuous systems---for estimating these quantities is the nearest
neighbour estimators. When system sizes are very large or the systems have
periodic boundary conditions issues with performance and correctness surface,
however solutions are known for each problem. Here we show that these solutions
are inappropriate in systems that simultaneously contain both features and
discuss a lesser known alternative solution involving Vantage Point trees that
is capable of addressing both issues.
","[{""version"":""v1"",""created"":""Wed, 18 Oct 2017 06:22:15 GMT""}]","2017-10-19"
"1710.06592","Ryoki Fukushima","Marek Biskup, Ryoki Fukushima, Wolfgang Koenig","Eigenvalue fluctuations for lattice Anderson Hamiltonians: Unbounded
  potentials","25 pages","Interdisciplinary Information Sciences, 2018 Volume 24 Issue 1
  Pages 59-76","10.4036/iis.2018.A.03",,"math.PR math-ph math.MP math.ST stat.TH","http://arxiv.org/licenses/nonexclusive-distrib/1.0/","  We consider random Schr\""odinger operators with Dirichlet boundary conditions
outside lattice approximations of a smooth Euclidean domain and study the
behavior of its lowest-lying eigenvalues in the limit when the lattice spacing
tends to zero. Under a suitable moment assumption on the random potential and
regularity of the spatial dependence of its mean, we prove that the eigenvalues
of the random operator converge to those of a deterministic Schr\""odinger
operator. Assuming also regularity of the variance, the fluctuation of the
random eigenvalues around their mean are shown to obey a multivariate central
limit theorem. This extends the authors' recent work where similar conclusions
have been obtained for bounded random potentials.
","[{""version"":""v1"",""created"":""Wed, 18 Oct 2017 06:29:54 GMT""}]","2018-07-04"
"1710.06593","David Nguyen","David H. Nguyen","Detecting Partial Rosettes in Tumor Histopathology Using The Cross
  Product",,,,,"q-bio.TO","http://arxiv.org/licenses/nonexclusive-distrib/1.0/","  Tumors of the eye and nervous system often exhibit an arch-like arrangement
of nuclei, called rosettes. Pathologists are able to identify rosettes [full
circles] and the presence of partial rosettes [semi-circles] and interpret this
as a sign of differentiation in a tumor. However, there is no objective method
to quantitate the many partial rosettes that are obvious or not obvious to the
naked eye. This paper proposes a mathematical algorithm to computationally
detect the presence of obvious or non-obvious partial rosettes, henceforth
referred to as Nguyen-Wu Partial Rosettes. Quantifying the degree of partial
rosettes present in a tumor may allow pathologists to stratify tumors into more
refined groups that may respond better to therapy or have different clinical
outcomes. The Midline Cross Product [MCP] algorithm calculates the magnitude of
two cross products and adds them together to obtain one value. Each of the two
cross products results from [1] the line that connects the midpoints of longest
lengths of two neighboring ovals, and [2] the line that extends from the
midpoint from one longest length and is perpendicular to that longest length.
The MCP algorithm makes nuclei that are arranged in consecutive rows and arches
quantitatively distinct from nuclei that are arranged next to each other in a
disorderly manner.
","[{""version"":""v1"",""created"":""Wed, 18 Oct 2017 06:43:38 GMT""}]","2017-10-19"
"1710.06594","Masaki Kameko","Masaki Kameko","On the motivic Peterson conjecture","14 pages, to appear in Homology, Homotopy and Applications","Homology, Homotopy and Applications, 20(2), 2018, 361-375","10.4310/HHA.2018.v20.n2.a18",,"math.AT math.AG","http://arxiv.org/licenses/nonexclusive-distrib/1.0/","  We show that the analogue of the Peterson conjecture on the action of
Steenrod squares does not hold in motivic cohomology.
","[{""version"":""v1"",""created"":""Wed, 18 Oct 2017 06:52:22 GMT""},{""version"":""v2"",""created"":""Sat, 14 Apr 2018 01:53:56 GMT""}]","2018-07-30"
"1710.06595","Futoshi Futami","Futoshi Futami, Issei Sato and Masashi Sugiyama","Variational Inference based on Robust Divergences",,,,,"stat.ML","http://arxiv.org/licenses/nonexclusive-distrib/1.0/","  Robustness to outliers is a central issue in real-world machine learning
applications. While replacing a model to a heavy-tailed one (e.g., from
Gaussian to Student-t) is a standard approach for robustification, it can only
be applied to simple models. In this paper, based on Zellner's optimization and
variational formulation of Bayesian inference, we propose an outlier-robust
pseudo-Bayesian variational method by replacing the Kullback-Leibler divergence
used for data fitting to a robust divergence such as the beta- and
gamma-divergences. An advantage of our approach is that superior but complex
models such as deep networks can also be handled. We theoretically prove that,
for deep networks with ReLU activation functions, the \emph{influence function}
in our proposed method is bounded, while it is unbounded in the ordinary
variational inference. This implies that our proposed method is robust to both
of input and output outliers, while the ordinary variational method is not. We
experimentally demonstrate that our robust variational method outperforms
ordinary variational inference in regression and classification with deep
networks.
","[{""version"":""v1"",""created"":""Wed, 18 Oct 2017 06:57:03 GMT""},{""version"":""v2"",""created"":""Wed, 28 Feb 2018 08:57:09 GMT""}]","2018-03-01"
