"1710.06460","Valerio Faraoni","Marianne Lapierre-Leonard, Valerio Faraoni, and Faycal Hammad","Cosmological applications of the Brown-York quasilocal mass","8 pages, to appear in Phys. Rev. D",,"10.1103/PhysRevD.96.083525",,"gr-qc","http://arxiv.org/licenses/nonexclusive-distrib/1.0/","  The Brown-York quasilocal energy is applied to three cosmological problems
which have previously been studied with the Hawking-Hayward quasilocal energy
(Newtonian simulations of large scale structure formation, turnaround radius in
the present accelerating universe, and lensing by the cosmological constant).
It is found that, in an appropriate gauge and to first order in the amplitude
of the cosmological perturbations describing local structures, the
Hawking-Hayward and the Brown-York quasilocal masses predict the same results.
","[{""version"":""v1"",""created"":""Tue, 17 Oct 2017 18:27:24 GMT""}]","2017-11-22"
"1710.06461","Thomas A. Wasserman","Thomas A. Wasserman","The Symmetric Tensor Product on the Drinfeld Centre of a Symmetric
  Fusion Category","40 pages, many diagrams","Journal of Pure and Applied Algebra, Volume 224, Issue 8, August
  2020, 106348","10.1016/j.jpaa.2020.106348",,"math.QA math.CT","http://arxiv.org/licenses/nonexclusive-distrib/1.0/","  We define a symmetric tensor product on the Drinfeld centre of a symmetric
fusion category, in addition to its usual tensor product. We examine what this
tensor product looks like under Tannaka duality, identifying the symmetric
fusion category with the representation category of a finite (super)-group.
Under this identification, the Drinfeld centre is the category of equivariant
vector bundles over the finite group (underlying the super-group, in the super
case). In the non-super case, we show that the symmetric tensor product
corresponds to the fibrewise tensor product of these vector bundles. In the
super case, we define for each super-group structure on the finite group a
super-version of the fibrewise tensor product. We show that the symmetric
tensor product on the Drinfeld centre of the representation category of the
resulting finite super-groups corresponds to this super-version of the
fibrewise tensor product on the category of equivariant vector bundles over the
finite group.
","[{""version"":""v1"",""created"":""Tue, 17 Oct 2017 18:28:17 GMT""},{""version"":""v2"",""created"":""Tue, 29 Oct 2019 12:46:49 GMT""},{""version"":""v3"",""created"":""Thu, 27 May 2021 08:39:17 GMT""}]","2021-05-28"
"1710.06462","Suchismit Mahapatra","Suchismit Mahapatra, Varun Chandola","S-Isomap++: Multi Manifold Learning from Streaming Data",,,"10.1109/BigData.2017.8257987",,"stat.ML cs.LG","http://arxiv.org/licenses/nonexclusive-distrib/1.0/","  Manifold learning based methods have been widely used for non-linear
dimensionality reduction (NLDR). However, in many practical settings, the need
to process streaming data is a challenge for such methods, owing to the high
computational complexity involved. Moreover, most methods operate under the
assumption that the input data is sampled from a single manifold, embedded in a
high dimensional space. We propose a method for streaming NLDR when the
observed data is either sampled from multiple manifolds or irregularly sampled
from a single manifold. We show that existing NLDR methods, such as Isomap,
fail in such situations, primarily because they rely on smoothness and
continuity of the underlying manifold, which is violated in the scenarios
explored in this paper. However, the proposed algorithm is able to learn
effectively in presence of multiple, and potentially intersecting, manifolds,
while allowing for the input data to arrive as a massive stream.
","[{""version"":""v1"",""created"":""Tue, 17 Oct 2017 18:30:57 GMT""},{""version"":""v2"",""created"":""Mon, 23 Oct 2017 01:08:19 GMT""},{""version"":""v3"",""created"":""Sat, 17 Mar 2018 23:20:39 GMT""}]","2018-03-20"
"1710.06463","Rania Rayyes","Rania Rayyes, Daniel Kubus, Carsten Hartmann and Jochen Steil","Learning Inverse Statics Models Efficiently",,,"10.3389/fnbot.2018.00068",,"cs.LG","http://arxiv.org/licenses/nonexclusive-distrib/1.0/","  Online Goal Babbling and Direction Sampling are recently proposed methods for
direct learning of inverse kinematics mappings from scratch even in
high-dimensional sensorimotor spaces following the paradigm of ""learning while
behaving"". To learn inverse statics mappings - primarily for gravity
compensation - from scratch and without using any closed-loop controller, we
modify and enhance the Online Goal Babbling and Direction Sampling schemes.
Moreover, we exploit symmetries in the inverse statics mappings to drastically
reduce the number of samples required for learning inverse statics models.
Results for a 2R planar robot, a 3R simplified human arm, and a 4R humanoid
robot arm clearly demonstrate that their inverse statics mappings can be
learned successfully with our modified online Goal Babbling scheme.
Furthermore, we show that the number of samples required for the 2R and 3R arms
can be reduced by a factor of at least 8 and 16 resp. -depending on the number
of discovered symmetries.
","[{""version"":""v1"",""created"":""Tue, 17 Oct 2017 18:35:29 GMT""}]","2019-06-24"
"1710.06464","Hanyi Wang","HanYi Wang and Mukul M. Sharma","New Variable Compliance Method for Estimating In-Situ Stress and
  Leak-Off from DFIT Data",,,,,"physics.geo-ph","http://arxiv.org/licenses/nonexclusive-distrib/1.0/","  It is shown that using Carter leak-off is an oversimplification that leads to
significant errors in the interpretation of DFIT data. Most importantly, this
article reveals that previous methods of estimating minimum in-situ stress
often lead to significant over or underestimates. Based on our modeling and
simulation results, we propose a much more accurate and reliable method to
estimate the minimum in-situ stress and fracture pressure dependent leak-off
rate.
","[{""version"":""v1"",""created"":""Tue, 17 Oct 2017 18:35:43 GMT""},{""version"":""v2"",""created"":""Tue, 24 Oct 2017 20:01:19 GMT""}]","2017-10-26"
"1710.06465","Achintya Kundu","Achintya Kundu, Francis Bach, Chiranjib Bhattacharyya","Convex optimization over intersection of simple sets: improved
  convergence rate guarantees via an exact penalty approach",,,,,"math.OC","http://arxiv.org/licenses/nonexclusive-distrib/1.0/","  We consider the problem of minimizing a convex function over the intersection
of finitely many simple sets which are easy to project onto. This is an
important problem arising in various domains such as machine learning. The main
difficulty lies in finding the projection of a point in the intersection of
many sets. Existing approaches yield an infeasible point with an
iteration-complexity of $O(1/\varepsilon^2)$ for nonsmooth problems with no
guarantees on the in-feasibility. By reformulating the problem through exact
penalty functions, we derive first-order algorithms which not only guarantees
that the distance to the intersection is small but also improve the complexity
to $O(1/\varepsilon)$ and $O(1/\sqrt{\varepsilon})$ for smooth functions. For
composite and smooth problems, this is achieved through a saddle-point
reformulation where the proximal operators required by the primal-dual
algorithms can be computed in closed form. We illustrate the benefits of our
approach on a graph transduction problem and on graph matching.
","[{""version"":""v1"",""created"":""Tue, 17 Oct 2017 18:40:13 GMT""}]","2017-10-19"
"1710.06466","Christopher Monahan","Christopher Monahan, Kostas Orginos","Finite continuum quasi distributions from lattice QCD","Eight pages, two figures. Proceedings of the 35th International
  Symposium on Lattice Field Theory",,"10.1051/epjconf/201817506004","INT-PUB-17-044","hep-lat","http://arxiv.org/licenses/nonexclusive-distrib/1.0/","  We present a new approach to extracting continuum quasi distributions from
lattice QCD. Quasi distributions are defined by matrix elements of a
Wilson-line operator extended in a spatial direction, evaluated between nucleon
states at finite momentum. We propose smearing this extended operator with the
gradient flow to render the corresponding matrix elements finite in the
continuum limit. This procedure provides a nonperturbative method to remove the
power-divergence associated with the Wilson line and the resulting matrix
elements can be directly matched to light-front distributions via perturbation
theory.
","[{""version"":""v1"",""created"":""Tue, 17 Oct 2017 18:41:07 GMT""}]","2018-04-18"
"1710.06467","Rafael Mart\'in-Dom\'enech Mr.","R. Martin-Domenech, G.A. Cruz-Diaz, G.M. Munoz Caro","UV photoprocessing of NH3 ice: photon-induced desorption mechanisms",,,"10.1093/mnras/stx2510",,"astro-ph.GA astro-ph.EP astro-ph.SR","http://arxiv.org/licenses/nonexclusive-distrib/1.0/","  Ice mantles detected on the surface of dust grains toward the coldest regions
of the interstellar medium can be photoprocessed by the secondary ultraviolet
(UV) field present in dense cloud interiors. In this work, we present
UV-irradiation experiments under astrophysically relevant conditions of pure
NH3 ice samples in an ultra-high vacuum chamber where solid samples were
deposited onto a substrate at 8 K. The ice analogs were subsequently
photoprocessed with a microwave-discharged hydrogen- flow lamp. The induced
radiation and photochemistry led to the production of H2, N2 and N2H4. In
addition, photodesorption to the gas phase of the original ice component, NH3,
and two of the three detected photoproducts, H2 and N2, was observed thanks to
a quadrupole mass spectrometer (QMS). Calibration of the QMS allowed
quantifica- tion of the photodesorption yields, leading to Ypd(NH3)=2.1+2.1-1.0
x 10^-3 molecules per incident photon, which remained constant during the whole
experiments, while photodesorption of H2 and N2 increased with fluence,
pointing toward an indirect photodesorption mecha- nism involving energy
transfer for these species. Photodesorption yield of N2 molecules after a
fluence equivalent to that experienced by ice mantles in space was similar to
that of the NH3 molecules (Ypd (N2) = 1.7+1.7-0.9 x 10^-3 molecules incident
photon ).
","[{""version"":""v1"",""created"":""Tue, 17 Oct 2017 18:43:37 GMT""}]","2017-11-15"
"1710.06468","Kalle Karu","Kalle Karu","Relative Hard Lefschetz Theorem for Fans","38 pages",,,,"math.AG math.CO","http://arxiv.org/licenses/nonexclusive-distrib/1.0/","  We prove the Relative Hard Lefschetz theorem and the Relative Hodge-Riemann
bilinear relations for combinatorial intersection cohomology sheaves on fans.
","[{""version"":""v1"",""created"":""Tue, 17 Oct 2017 18:52:05 GMT""}]","2017-10-19"
"1710.06469","Simone Giacomelli","Simone Giacomelli","RG flows with supersymmetry enhancement and geometric engineering","clarifications added, version published in JHEP",,"10.1007/JHEP06(2018)156",,"hep-th","http://arxiv.org/licenses/nonexclusive-distrib/1.0/","  In this paper we study a class of $\mathcal{N}=2$ SCFTs with ADE global
symmetry defined via Type IIB compactification on a class of hypersurfaces in
$\mathbb{C}^3\times\mathbb{C}^*$. These can also be constructed by
compactifying the 6d (2,0) theory of type ADE on a sphere with an irregular and
a full punctures. When we couple to the ADE moment map a chiral multiplet in
the adjoint representation and turn on a (principal) nilpotent vev for it, all
the theories in this family display enhancement of supersymmetry in the
infrared. We observe that all known examples of lagrangian theories which flow,
upon the same type of deformation, to strongly coupled $\mathcal{N}=2$ theories
fit naturally in our framework, thus providing a new perspective on this topic.
We propose an infrared equivalence between this RG flow and a manifestly
$\mathcal{N}=2$ preserving one and, as a byproduct, we extract a precise
prescription to relate the SW curves describing the UV and IR fixed points for
all theories with A or D global symmetry. We also find, for a certain subclass,
a simple relation between UV and IR theories at the level of chiral algebras.
","[{""version"":""v1"",""created"":""Tue, 17 Oct 2017 18:54:59 GMT""},{""version"":""v2"",""created"":""Thu, 11 Jan 2018 16:55:24 GMT""},{""version"":""v3"",""created"":""Sun, 29 Jul 2018 23:26:00 GMT""}]","2018-08-01"
"1710.06470","Gelasio Salazar","Carolina Medina, Jorge Ram\'irez-Alfons\'in, Gelasio Salazar","On the number of unknot diagrams",,,,,"math.CO","http://arxiv.org/licenses/nonexclusive-distrib/1.0/","  Let $D$ be a knot diagram, and let ${\mathcal D}$ denote the set of diagrams
that can be obtained from $D$ by crossing exchanges. If $D$ has $n$ crossings,
then ${\mathcal D}$ consists of $2^n$ diagrams. A folklore argument shows that
at least one of these $2^n$ diagrams is unknot, from which it follows that
every diagram has finite unknotting number. It is easy to see that this
argument can be used to show that actually ${\mathcal D}$ has more than one
unknot diagram, but it cannot yield more than $4n$ unknot diagrams. We improve
this linear bound to a superpolynomial bound, by showing that at least
$2^{\sqrt[3]{n}}$ of the diagrams in ${\mathcal D}$ are unknot. We also show
that either all the diagrams in ${\mathcal D}$ are unknot, or there is a
diagram in ${\mathcal D}$ that is a diagram of the trefoil knot.
","[{""version"":""v1"",""created"":""Tue, 17 Oct 2017 18:56:21 GMT""}]","2017-10-19"
"1710.06471","Qian Yu","Qian Yu, Mohammad Ali Maddah-Ali, and A. Salman Avestimehr","Coded Fourier Transform",,,,,"cs.DC cs.IT cs.LG math.IT","http://arxiv.org/licenses/nonexclusive-distrib/1.0/","  We consider the problem of computing the Fourier transform of
high-dimensional vectors, distributedly over a cluster of machines consisting
of a master node and multiple worker nodes, where the worker nodes can only
store and process a fraction of the inputs. We show that by exploiting the
algebraic structure of the Fourier transform operation and leveraging concepts
from coding theory, one can efficiently deal with the straggler effects. In
particular, we propose a computation strategy, named as coded FFT, which
achieves the optimal recovery threshold, defined as the minimum number of
workers that the master node needs to wait for in order to compute the output.
This is the first code that achieves the optimum robustness in terms of
tolerating stragglers or failures for computing Fourier transforms.
Furthermore, the reconstruction process for coded FFT can be mapped to MDS
decoding, which can be solved efficiently. Moreover, we extend coded FFT to
settings including computing general $n$-dimensional Fourier transforms, and
provide the optimal computing strategy for those settings.
","[{""version"":""v1"",""created"":""Tue, 17 Oct 2017 18:57:52 GMT""}]","2017-10-19"
"1710.06472","Adrien Florio","Yannis Burnier, Adrien Florio, Olaf Kaczmarek, Lukas Mazur","Thermal Simulations, Open Boundary Conditions and Switches","7 pages, 4 figures, 35th International Symposium on Lattice Field
  Theory","EPJ Web Conf. 175 (2018) 07004","10.1051/epjconf/201817507004",,"hep-lat","http://creativecommons.org/licenses/by/4.0/","  $SU(N)$ gauge theories on compact spaces have a non-trivial vacuum structure
characterized by a countable set of topological sectors and their topological
charge. In lattice simulations, every topological sector needs to be explored a
number of times which reflects its weight in the path integral. Current lattice
simulations are impeded by the so-called freezing of the topological charge
problem. As the continuum is approached, energy barriers between topological
sectors become well defined and the simulations get trapped in a given sector.
A possible way out was introduced by L\""uscher and Schaefer using open boundary
condition in the time extent. However, this solution cannot be used for thermal
simulations, where the time direction is required to be periodic. In this
proceedings, we present results obtained using open boundary conditions in
space, at non-zero temperature. With these conditions, the topological charge
is not quantized and the topological barriers are lifted. A downside of this
method are the strong finite-size effects introduced by the boundary
conditions. We also present some exploratory results which show how these
conditions could be used on an algorithmic level to reshuffle the system and
generate periodic configurations with non-zero topological charge.
","[{""version"":""v1"",""created"":""Tue, 17 Oct 2017 19:00:17 GMT""}]","2020-08-12"
"1710.06473","Omid Haji Maghsoudi","Omid Haji Maghsoudi, Annie Vahedipour Tabrizi, Benjamin Robertson,
  Andrew Spence","Superpixels Based Marker Tracking Vs. Hue Thresholding In Rodent
  Biomechanics Application","This paper has been accepted for 2017 Asilomar conference, IEEE",,"10.1109/ACSSC.2017.8335168",,"cs.CV","http://arxiv.org/licenses/nonexclusive-distrib/1.0/","  Examining locomotion has improved our basic understanding of motor control
and aided in treating motor impairment. Mice and rats are premier models of
human disease and increasingly the model systems of choice for basic
neuroscience. High frame rates (250 Hz) are needed to quantify the kinematics
of these running rodents. Manual tracking, especially for multiple markers,
becomes time-consuming and impossible for large sample sizes. Therefore, the
need for automatic segmentation of these markers has grown in recent years. We
propose two methods to segment and track these markers: first, using SLIC
superpixels segmentation with a tracker based on position, speed, shape, and
color information of the segmented region in the previous frame; second, using
a thresholding on hue channel following up with the same tracker. The
comparison showed that the SLIC superpixels method was superior because the
segmentation was more reliable and based on both color and spatial information.
","[{""version"":""v1"",""created"":""Tue, 17 Oct 2017 19:08:29 GMT""},{""version"":""v2"",""created"":""Fri, 3 Nov 2017 15:31:45 GMT""},{""version"":""v3"",""created"":""Sun, 14 Jan 2018 20:50:33 GMT""},{""version"":""v4"",""created"":""Mon, 28 May 2018 15:48:19 GMT""}]","2018-05-29"
"1710.06474","Matteo Bina","Matteo Bina, Federico Grasselli, Matteo G. A. Paris","Continuous-variable quantum probes for structured environments","10 pages, 10 figures","Phys. Rev. A 97, 012125 (2018)","10.1103/PhysRevA.97.012125",,"quant-ph","http://arxiv.org/licenses/nonexclusive-distrib/1.0/","  We address parameter estimation for complex/structured systems and suggest an
effective estimation scheme based on continuous-variables quantum probes. In
particular, we investigate the use of a single bosonic mode as a probe for
Ohmic reservoirs, and obtain the ultimate quantum limits to the precise
estimation of their cutoff frequency. We assume the probe prepared in a
Gaussian state and determine the optimal working regime, i.e. the conditions
for the maximization of the quantum Fisher information in terms of the initial
preparation, the reservoir temperature and the interaction time. Upon
investigating the Fisher information of feasible measurements we arrive at a
remarkable simple result: homodyne detection of canonical variables allows one
to achieve the ultimate quantum limit to precision under suitable, mild,
conditions. Finally, upon exploiting a perturbative approach, we find the
invariant sweet spots of the (tunable) characteristic frequency of the probe,
able to drive the probe towards the optimal working regime.
","[{""version"":""v1"",""created"":""Tue, 17 Oct 2017 19:11:53 GMT""}]","2018-01-31"
"1710.06475","Brendan McLaughlin Dr","A Mueller, S Schippers, R A Phaneuf, A M Covington, A Aguilar, G
  Hinojosa, J Bozek, M M Sant'Anna, A S Schlachter, C Cisneros and B M
  McLaughlin","Photoionisation of Ca$^{+}$ ions in the valence-energy region
  20$\sim$eV~--~56$\sim$eV : experiment and theory","19 pages, 14 figures, 3 tables","J. Phys. B: At. Mol. Opt. Phys. 50 (2017) 205001","10.1088/1361-6455/aa8ba8",,"physics.atom-ph","http://arxiv.org/licenses/nonexclusive-distrib/1.0/","  Relative cross sections for the valence shell photoionisation (PI) of $\rm
^2S$ ground level and $\rm ^2D$ metastable Ca$^{+}$ ions were measured with
high energy resolution by using the ion-photon merged-beams technique at the
Advanced Light Source. Overview measurements were performed with a full width
at half maximum bandpass of $\Delta E =17$~meV, covering the energy range 20~eV
-- 56~eV. Details of the PI spectrum were investigated at energy resolutions
reaching the level of $\Delta E=3.3$~meV. The photon energy scale was
calibrated with an uncertainty of $\pm5$~meV. By comparison with previous
absolute measurements %by Kjeldsen et al in the energy range 28~eV -- 30.5~eV
and by Lyon et al in the energy range 28~eV -- 43~eV the present experimental
high-resolution data were normalised to an absolute cross-section scale and the
fraction of metastable Ca$^{+}$ ions that were present in the parent ion beam
was determined to be 18$\pm$4\%. Large-scale R-matrix calculations using the
Dirac Coulomb approximation and employing 594 levels in the close-coupling
expansion were performed for the Ca$^{+}(3s^23p^64s~^2\textrm{S}_{1/2})$ and
Ca$^{+}(3s^2 3p^6 3d~^2\textrm{D}_{3/2,5/2})$ levels. The experimental data are
compared with the results of these calculations and previous theoretical and
experimental studies.
","[{""version"":""v1"",""created"":""Tue, 17 Oct 2017 19:12:20 GMT""}]","2017-10-19"
"1710.06476","Aleksey Bolgar","A. N. Bolgar, J. I. Zotova, D. D. Kirichenko, I. S. Besedin, A. V.
  Semenov, R. S. Shaikhaidarov and O. V. Astafiev","Experimental demonstration of a two-dimensional phonon cavity in the
  quantum regime",,"Phys. Rev. Lett. 120, 223603, (2017)","10.1103/PhysRevLett.120.223603",,"quant-ph","http://arxiv.org/licenses/nonexclusive-distrib/1.0/","  The quantum regime in acoustic systems is a focus of recent fundamental
research in the new field of Quantum Acoustodynamics (QAD). Systems based on
surface acoustic waves having an advantage of easy integration in
two-dimensions are particularly promising for the demonstration of novel
effects in QAD and development of novel devices of quantum acousto-electronics.
We demonstrate the vacuum mode of the surface acoustic wave resonator by
coupling it to a superconducting artificial atom. The artificial atom is
implemented into the resonator formed by two Brag mirrors. The results are
consistent with expectations supported by the system model and our
calculations. This work opens the way to map analogues of quantum optical
effects into acoustic systems.
","[{""version"":""v1"",""created"":""Tue, 17 Oct 2017 19:12:40 GMT""}]","2018-06-15"
"1710.06477","Majdoub Mohamed","Abdelwahab Bensouilah, Dhouha Draouil and Mohamed Majdoub","Energy critical Schr\""odinger equation with weighted exponential
  nonlinearity I: Local and global well-posedness",,,,,"math.AP","http://arxiv.org/licenses/nonexclusive-distrib/1.0/","  We investigate the initial value problem for a defocusing nonlinear
Schr\""odinger equation with weighted exponential nonlinearity $$ i\partial_t
u+\Delta u=\frac{u}{|x|^b}(e^{\alpha|u|^2}-1); \qquad (t,x) \in
\mathbb{R}\times\mathbb{R}^2, $$ where $0< b <1$ and $\alpha=2\pi(2-b)$. We
establish local and global well-posedness in the subcritical and critical
regimes.
","[{""version"":""v1"",""created"":""Tue, 17 Oct 2017 19:16:51 GMT""}]","2017-10-19"
"1710.06478","Salvador Hern\'andez","Salvador Hern\'andez, F. Javier Trigos-Arrieta","When a totally bounded group topology is the Bohr Topology of a LCA
  group",,,,,"math.GN","http://arxiv.org/licenses/nonexclusive-distrib/1.0/","  We look at the Bohr topology of maximally almost periodic groups (MAP, for
short). Among other results, we investigate when a totally bounded abelian
group $(G,w)$ is the Bohr reflection of a locally compact abelian group.
Necessary and sufficient conditions are established in terms of the inner
properties of $w$. As an application, an example of a MAP group $(G,t)$ is
given such that every closed, metrizable subgroup $N$ of $bG$ with $N \cap G =
\{0\}$ preserves compactness but $(G,t)$ does not strongly respects
compactness. Thereby, we respond to Questions 4.1 and 4.3 in [comftrigwu].
","[{""version"":""v1"",""created"":""Tue, 17 Oct 2017 19:19:29 GMT""},{""version"":""v2"",""created"":""Thu, 20 Sep 2018 10:43:57 GMT""}]","2018-09-21"
