"1710.10526","Holger Dette","Holger Dette, Maria Konstantinou, Kirsten Schorning, Josua G\""osmann","Optimal designs for regression with spherical data",,,,,"math.ST stat.ME stat.TH","http://arxiv.org/licenses/nonexclusive-distrib/1.0/","  In this paper optimal designs for regression problems with spherical
predictors of arbitrary dimension are considered. Our work is motivated by
applications in material sciences, where crystallographic textures such as the
missorientation distribution or the grain boundary distribution (depending on a
four dimensional spherical predictor) are represented by series of
hyperspherical harmonics, which are estimated from experimental or simulated
data. For this type of estimation problems we explicitly determine optimal
designs with respect to Kiefers $\Phi_p$-criteria and a class of orthogonally
invariant information criteria recently introduced in the literature. In
particular, we show that the uniform distribution on the $m$-dimensional sphere
is optimal and construct discrete and implementable designs with the same
information matrices as the continuous optimal designs. Finally, we illustrate
the advantages of the new designs for series estimation by hyperspherical
harmonics, which are symmetric with respect to the first and second
crystallographic point group.
","[{""version"":""v1"",""created"":""Sat, 28 Oct 2017 20:13:20 GMT""}]","2017-10-31"
"1710.10527","Gilberto Ramalho","G. Ramalho","Combined parametrization of the neutron electric form factor and the
  $\gamma^\ast N \to \Delta(1232)$ quadrupole form factors","Published in European Physics Journal A. Extended version. New
  format. 14 pages, 7 figures","Eur.Phys.J. A55 (2019) no.3, 32","10.1140/epja/i2019-12699-0","LFTC-17-10/10","hep-ph hep-ex hep-lat nucl-ex nucl-th","http://arxiv.org/licenses/nonexclusive-distrib/1.0/","  Models based on $SU(6)$ symmetry breaking and large $N_c$ limit provide
relations between the pion cloud contributions to the $\gamma^\ast N \to
\Delta(1232)$ quadrupole form factors, electric ($G_E$) and Coulomb ($G_C$),
and the neutron electric form factor $G_{En}$, suggesting that those form
factors are dominated by the same physical processes. Those relations are
improved in order to satisfy a fundamental constraint between the electric and
Coulomb quadrupole form factors in the long wavelength limit, when the photon
three-momentum vanishes (Siegert's theorem). Inspired by those relations, we
study alternative parametrizations for the neutron electric form factor. The
parameters of the new form are then determined by a combined fit to the
$G_{En}$ and the $\gamma^\ast N \to \Delta(1232)$ quadrupole form factor data.
We obtain a very good description of the $G_E$ and $G_C$ data when we combine
the pion cloud contributions with small valence quark contributions to the
$\gamma^\ast N \to \Delta(1232)$ quadrupole form factors. The best description
of the data is obtained when the second momentum of $G_{En}$ is $r_n^4 \simeq
-0.4$ fm$^4$. We conclude that the square radii associated with $G_E$ and
$G_C$, $r_E^2$ and $r_C^2$, respectively, are large, revealing the long
extension of the pion cloud. We conclude also that those square radii are
related by $r_E^2 - r_C^2 = 0.6 \pm 0.2$ fm$^2$. The last result is mainly the
consequence of the pion cloud effects and Siegert's theorem.
","[{""version"":""v1"",""created"":""Sat, 28 Oct 2017 20:29:50 GMT""},{""version"":""v2"",""created"":""Thu, 7 Mar 2019 19:02:37 GMT""}]","2019-03-11"
"1710.10528","Ian M. Musson","Ian M. Musson","\vS{a}povalov elements and the Jantzen sum formula for contragredient
  Lie superalgebras","Comments welcome",,,,"math.RT","http://arxiv.org/licenses/nonexclusive-distrib/1.0/","  If $\mathfrak{g}$ is a contragredient Lie superalgebra and $\gamma$ is a root
of $\mathfrak{g},$ we prove the existence and uniqueness of \v{S}apovalov
elements for $\gamma$ and give upper bounds on the degrees of their
coefficients. Then we use \v{S}apovalov elements to define some new highest
weight modules. If $X$ is a set of orthogonal isotropic roots and $\lambda \in
\mathfrak{h}^*$ is such that $\lambda +\rho$ is orthogonal to all roots in $X$,
we construct a highest weight module $M^X(\lambda)$ with character
$\epsilon^\lambda {p}_X$. Here $p_X$ is a function that counts partitions not
involving roots in $X$. Examples of such modules can be constructed via
parabolic induction provided $X$ is contained in the set of simple roots of
some Borel subalgebra. However our construction works without this condition
and provides a highest weight module for the distinguished Borel subalgebra.
The main results are analogs of the \v{S}apovalov determinant and the Jantzen
sum formula for $M^X(\lambda)$ when $\mathfrak{g}$ has type A.For the proof it
is enough to study the behavior for certain ""relatively general"" highest
weights. Using an equivalence of categories due to Cheng, Mazorchuk and Wang,
the information we require is deduced from the behavior of the modules
$M^X(\lambda)$ when $\mathfrak{g}=\mathfrak{gl}(2,1)$ or $\mathfrak{gl}(2,2)$.
These low dimensional cases are studied in detail in an appendix.
","[{""version"":""v1"",""created"":""Sat, 28 Oct 2017 21:09:19 GMT""}]","2017-10-31"
"1710.10529","Hanbaek Lyu","Michael Damron, Janko Gravner, Matthew Junge, Hanbaek Lyu, David
  Sivakoff","Parking on transitive unimodular graphs","20 pages, 4 figures, revision",,,,"math.PR","http://arxiv.org/licenses/nonexclusive-distrib/1.0/","  Place a car independently with probability $p$ at each site of a graph. Each
initially vacant site is a parking spot that can fit one car. Cars
simultaneously perform independent random walks. When a car encounters an
available parking spot it parks there. Other cars can still drive over the
site, but cannot park there. For a large class of transitive and unimodular
graphs, we show that the root is almost surely visited infinitely many times
when $p \geq 1/2$, and only finitely many times otherwise.
","[{""version"":""v1"",""created"":""Sat, 28 Oct 2017 21:23:20 GMT""},{""version"":""v2"",""created"":""Tue, 31 Oct 2017 14:58:14 GMT""},{""version"":""v3"",""created"":""Thu, 6 Sep 2018 07:57:48 GMT""}]","2018-09-07"
"1710.10530","Charles Livingston","Charles Livingston","Signature invariants related to the unknotting number","13 pages, 3 figures. Added results concern signature bounds on the
  unknotting number of slice knots","Pacific J. Math. 305 (2020) 229-250","10.2140/pjm.2020.305.229",,"math.GT","http://arxiv.org/licenses/nonexclusive-distrib/1.0/","  New lower bounds on the unknotting number of a knot are constructed from the
classical knot signature function. These bounds can be twice as strong as
previously known signature bounds. They can also be stronger than known bounds
arising from Heegaard Floer and Khovanov homology. Results include new bounds
on the Gordian distance between knots and information about four-dimensional
knot invariants. By considering a related non-balanced signature function,
bounds on the unknotting number of slice knots are constructed; these are
related to the property of double-sliceness.
","[{""version"":""v1"",""created"":""Sat, 28 Oct 2017 21:30:27 GMT""},{""version"":""v2"",""created"":""Tue, 12 Jun 2018 14:30:58 GMT""}]","2020-03-18"
"1710.10531","Shou-Wen Wang","Shou-Wen Wang","Inferring dissipation from the violation of Fluctuation-Dissipation
  Theorem","10 pages, 4 figures","Phys. Rev. E 97, 052125 (2018)","10.1103/PhysRevE.97.052117",,"cond-mat.stat-mech","http://arxiv.org/licenses/nonexclusive-distrib/1.0/","  The Harada-Sasa equality elegantly connects the energy dissipation rate of a
moving object with its measurable violation of the Fluctuation-Dissipation
Theorem (FDT). Although proven for Langevin processes, its validity remains
unclear for discrete Markov systems whose forward and backward transition rates
respond asymmetrically to external perturbation. A typical example is a motor
protein called kinesin. Here we show generally that the FDT violation persists
surprisingly in the high-frequency limit due to the asymmetry, resulting in a
divergent FDT violation integral and thus a complete breakdown of the
Harada-Sasa equality. A renormalized FDT violation integral still well predicts
the dissipation rate when each discrete transition produces a small entropy in
the environment. Our study also suggests a new way to infer this perturbation
asymmetry based on the measurable high-frequency-limit FDT violation.
","[{""version"":""v1"",""created"":""Sat, 28 Oct 2017 21:54:14 GMT""},{""version"":""v2"",""created"":""Tue, 20 Mar 2018 09:27:27 GMT""}]","2018-05-30"
"1710.10532","Daniel Kasenberg","Daniel Kasenberg, Matthias Scheutz","Interpretable Apprenticeship Learning with Temporal Logic Specifications","Accepted to the 56th IEEE Conference on Decision and Control (CDC
  2017)",,,,"cs.SY cs.AI cs.LG","http://arxiv.org/licenses/nonexclusive-distrib/1.0/","  Recent work has addressed using formulas in linear temporal logic (LTL) as
specifications for agents planning in Markov Decision Processes (MDPs). We
consider the inverse problem: inferring an LTL specification from demonstrated
behavior trajectories in MDPs. We formulate this as a multiobjective
optimization problem, and describe state-based (""what actually happened"") and
action-based (""what the agent expected to happen"") objective functions based on
a notion of ""violation cost"". We demonstrate the efficacy of the approach by
employing genetic programming to solve this problem in two simple domains.
","[{""version"":""v1"",""created"":""Sat, 28 Oct 2017 22:01:55 GMT""}]","2017-11-02"
"1710.10533","Luke Yates","L. A. Yates and P. D. Jarvis","Hidden supersymmetry and quadratic deformations of the space-time
  conformal superalgebra","25 pages, Latex; corrected typos, minor clarification of degeneracy
  conditions",,"10.1088/1751-8121/aab215",,"hep-th","http://arxiv.org/licenses/nonexclusive-distrib/1.0/","  We analyze the structure of the family of quadratic superalgebras, introduced
in J Phys A 44(23):235205 (2011), for the quadatic deformations of $N = 1$
space-time conformal supersymmetry. We characterize in particular the
`zero-step' modules for this case. In such modules, the odd generators vanish
identically, and the quadratic superalgebra is realized on a single irreducible
representation of the even subalgebra (which is a Lie algebra). In the case
under study, the quadratic deformations of $N = 1$ space-time conformal
supersymmetry, it is shown that each massless positive energy unitary
irreducible representation (in the standard classification of Mack), forms such
a zero-step module, for an appropriate parameter choice amongst the quadratic
family (with vanishing central charge). For these massless particle multiplets
therefore, quadratic supersymmetry is unbroken, in that the supersymmetry
generators annihilate \emph{all} physical states (including the vacuum state),
while at the same time, superpartners do not exist.
","[{""version"":""v1"",""created"":""Sat, 28 Oct 2017 22:40:48 GMT""},{""version"":""v2"",""created"":""Wed, 15 Nov 2017 03:40:27 GMT""}]","2018-04-04"
"1710.10534","Matthias Benjamin Jungfleisch","Matthias B. Jungfleisch, Joseph Sklenar, Junjia Ding, Jungsik Park,
  John E. Pearson, Valentine Novosad, Peter Schiffer, and Axel Hoffmann","High frequency dynamics modulated by collective magnetization reversal
  in artificial spin ice",,"Phys. Rev. Applied 8, 064026 (2017)","10.1103/PhysRevApplied.8.064026",,"cond-mat.other cond-mat.mes-hall","http://arxiv.org/licenses/nonexclusive-distrib/1.0/","  Spin-torque ferromagnetic resonance (ST-FMR) arises in heavy
metal/ferromagnet heterostructures when an alternating charge current is passed
through the bilayer stack. The methodology to detect the resonance is based on
the anisotropic magnetoresistance, which is the change in the electrical
resistance due to different orientations of the magnetization. In connected
networks of ferromagnetic nanowires, known as artificial spin ice, the
magnetoresistance is rather complex owing to the underlying collective behavior
of the geometrically frustrated magnetic domain structure. Here, we demonstrate
ST-FMR investigations in a square artificial spin-ice system and correlate our
observations to magnetotransport measurements. The experimental findings are
described using a simulation approach that highlights the importance of the
correlated dynamics response of the magnetic system. Our results open the
possibility of designing reconfigurable microwave oscillators and
magnetoresistive devices based on connected networks of nanomagnets.
","[{""version"":""v1"",""created"":""Sat, 28 Oct 2017 22:41:27 GMT""}]","2018-01-03"
"1710.10535","Marius Wigmans","Sehwook Lee, Michele Livan and Richard Wigmans","On the limits of the hadronic energy resolution of calorimeters","21 pages, 12 figures, accepted for publication in Nuclear Instruments
  and Methods in Physics Research A",,"10.1016/j.nima.2017.10.087",,"physics.ins-det hep-ex","http://arxiv.org/licenses/nonexclusive-distrib/1.0/","  In particle physics experiments, the quality of calorimetric particle
detection is typically considerably worse for hadrons than for electromagnetic
showers. In this paper, we investigate the root causes of this problem and
evaluate two different methods that have been exploited to remedy this
situation: compensation and dual readout. It turns out that the latter approach
is more promising, as evidenced by experimental results.
","[{""version"":""v1"",""created"":""Sat, 28 Oct 2017 23:34:08 GMT""}]","2018-03-14"
"1710.10536","Yat Tin Chow","Yat Tin Chow, Wilfrid Gangbo","A partial Laplacian as an infinitesimal generator on the Wasserstein
  space",,,,,"math.AP","http://arxiv.org/licenses/nonexclusive-distrib/1.0/","  We study stochastic processes on the Wasserstein space, together with their
infinitesimal generators. One of these processes is modeled after Brownian
motion and plays a central role in our work. Its infinitesimal generator
defines a partial Laplacian on the space of Borel probability measures, and we
use it to define heat flow on the Wasserstein space. We verify a distinctive
smoothing effect of this flow for a particular class of initial conditions. To
this end, we will develop a theory of Fourier analysis and conic surfaces in
metric spaces. We note that the use of the infinitesimal generators has been
instrumental in proving various theorems for Mean Field Games, and we
anticipate they will play a key role in future studies of viscosity solutions
of PDEs in the Wasserstein space.
","[{""version"":""v1"",""created"":""Sat, 28 Oct 2017 23:40:55 GMT""}]","2017-10-31"
"1710.10537","Xicheng Zhang","Xicheng Zhang and Guohuan Zhao","Heat kernel and ergodicity of SDEs with distributional drifts","30pages",,,,"math.PR math.AP","http://arxiv.org/licenses/nonexclusive-distrib/1.0/","  In this paper we consider the following SDE with distributional drift $b$: $$
{\rm d} X_t=\sigma(X_t){\rm d} B_t+b(X_t){\rm d} t,\ X_0=x\in{\mathbb R}^d, $$
where $\sigma$ is a bounded continuous and uniformly non-degenerate $d\times
d$-matrix-valued function, $B$ is a $d$-dimensional standard Brownian motion.
Let $\alpha\in(0,\frac{1}{2}]$, $p\in(\frac{d}{1-\alpha},\infty)$ and
$\beta\in[\alpha,1]$, $q\in(\frac{d}{\beta},\infty)$. Assume $\|({\mathbb
I}-\Delta)^{-\alpha/2}b\|_p+\|(-\Delta)^{\beta/2}\sigma\|_q<\infty$. We show
the existence and uniqueness of martingale solutions to the above SDE, and
obtain sharp two-sided and gradient estimates of the heat kernel associated to
the above SDE. Moreover, we study the ergodicity and global regularity of the
invariant measures of the associated semigroup under some dissipative
assumptions.
","[{""version"":""v1"",""created"":""Sat, 28 Oct 2017 23:47:30 GMT""},{""version"":""v2"",""created"":""Mon, 9 Apr 2018 07:25:14 GMT""}]","2018-04-10"
"1710.10538","Ramanathan Guha","Ramanathan V. Guha","Partial Knowledge In Embeddings",,,,,"cs.AI","http://arxiv.org/licenses/nonexclusive-distrib/1.0/","  Representing domain knowledge is crucial for any task. There has been a wide
range of techniques developed to represent this knowledge, from older logic
based approaches to the more recent deep learning based techniques (i.e.
embeddings). In this paper, we discuss some of these methods, focusing on the
representational expressiveness tradeoffs that are often made. In particular,
we focus on the the ability of various techniques to encode `partial knowledge'
- a key component of successful knowledge systems. We introduce and describe
the concepts of `ensembles of embeddings' and `aggregate embeddings' and
demonstrate how they allow for partial knowledge.
","[{""version"":""v1"",""created"":""Sat, 28 Oct 2017 23:55:33 GMT""}]","2017-10-31"
"1710.10539","Xinchu Fu","Zhongpu Xu, Kezan Li, Mengfeng Sun, Xinchu Fu","Interaction between cluster synchronization and epidemic spread in
  community networks","22 pages, 8 figures",,,,"nlin.AO","http://arxiv.org/licenses/nonexclusive-distrib/1.0/","  In real world, there is a significant relation between human behaviors and
epidemic spread. Especially, the reactions among individuals in different
communities to epidemics may be different, which lead to cluster
synchronization of human behaviors. So, a mathematical model that embeds
community structures, behavioral evolution and epidemic transmission is
constructed to study the interaction between cluster synchronization and
epidemic spread. The epidemic threshold of the model is obtained by using
Gersgorin Lemma and dynamical system theory. By applying the Lyapunov stability
method, the stability analysis of cluster synchronization and spreading
dynamics are presented. Then, some numerical simulations are performed to
illustrate and complement our theoretical results. As far as we know, this work
is the first one to address the interplay between cluster synchronization and
epidemic transmission in community networks, so it may deepen the understanding
of the impact of cluster behaviors on infectious disease dynamics.
","[{""version"":""v1"",""created"":""Sun, 29 Oct 2017 00:23:53 GMT""}]","2017-10-31"
"1710.10540","Christian Lomp","Christian Lomp, Alveri Sant'Ana and Ricardo Leite dos Santos","Panov's theorem for weak Hopf algebras","12 pages",,,,"math.RA","http://arxiv.org/licenses/nonexclusive-distrib/1.0/","  Panov proved necessary and sufficient conditions to extend the Hopf algebra
structure of an algebra $R$ to an Ore extension $R[x;\sigma,\delta]$ with $x$
being a skew-primitive element. In this paper we extend Panov's result to Ore
extensions over weak Hopf algebras. As an application we study Ore extensions
of connected groupoid algebras.
","[{""version"":""v1"",""created"":""Sun, 29 Oct 2017 00:35:39 GMT""}]","2017-10-31"
"1710.10541","Audrey Thirouin","Audrey Thirouin, and Scott S. Sheppard","A possible dynamically Cold Classical contact binary: (126719) 2002
  CC249","In press, The Astronomical Journal",,"10.3847/1538-3881/aa96fb",,"astro-ph.EP","http://arxiv.org/licenses/nonexclusive-distrib/1.0/","  Images of the Kuiper belt object (126719) 2002 CC249 obtained in 2016 and
2017 using the 6.5m Magellan-Baade Telescope and the 4.3m Discovery Channel
Telescope are presented. A lightcurve with a periodicity of 11.87+/-0.01 h and
a peak-to-peak amplitude of 0.79+/-0.04 mag is reported. This high amplitude
double-peaked lightcurve can be due to a single elongated body, but it is best
explained by a contact binary system from its U-/V-shaped lightcurve. We
present a simple full-width-at-half-maximum (FWHM) test that can be used to
determine if an object is likely a contact binary or an elongated object based
on its lightcurve. Considering that 2002 CC249 is in hydrostatic equilibrium, a
system with a mass ratio qmin=0.6, and a density \rho min=1gcc, or less
plausible a system with qmax=1, and \rho max=5gcc can interpret the lightcurve.
Assuming a single Jacobi ellipsoid in hydrostatic equilibrium, and an
equatorial view, we estimate \rho = 0.34gcc, and a/b=2.07. Finally, we report a
new color study showing that 2002 CC249 displays an ultra red surface
characteristic of a dynamically Cold Classical trans-Neptunian object.
","[{""version"":""v1"",""created"":""Sun, 29 Oct 2017 00:38:23 GMT""}]","2017-12-06"
"1710.10542","Ignat Soroko","Max Forester, Ignat Soroko, Jing Tao","Genus bounds in right-angled Artin groups","V.2: a second main theorem was added and the title changed. 16 pages,
  4 figures. V.1: 14 pages, 4 figures","Publ. Mat. 64 (2020), no. 1, 233-253","10.5565/PUBLMAT6412010",,"math.GR math.GT","http://arxiv.org/licenses/nonexclusive-distrib/1.0/","  We show that in any right-angled Artin group whose defining graph has
chromatic number $k$, every non-trivial element has stable commutator length at
least $1/(6k)$. Secondly, if the defining graph does not contain triangles,
then every non-trivial element has stable commutator length at least $1/20$.
These results are obtained via an elementary geometric argument based on
earlier work of Culler.
","[{""version"":""v1"",""created"":""Sun, 29 Oct 2017 00:43:26 GMT""},{""version"":""v2"",""created"":""Thu, 8 Mar 2018 03:13:16 GMT""}]","2020-03-03"
"1710.10543","Norikazu Saito","Norikazu Saito","Variational analysis of the discontinuous Galerkin time-stepping method
  for parabolic equations","20 pages; The original version was submitted on 29 October 2017",,,,"math.NA cs.NA","http://arxiv.org/licenses/nonexclusive-distrib/1.0/","  The discontinuous Galerkin (DG) time-stepping method applied to abstract
evolution equation of parabolic type is studied using a variational approach.
We establish the inf-sup condition or Babu\v{s}ka--Brezzi condition for the DG
bilinear form. Then, a nearly best approximation property and a nearly
symmetric error estimate are obtained as corollaries. Moreover, the optimal
order error estimates under appropriate regularity assumption on the solution
are derived as direct applications of the standard interpolation error
estimates. Our method of analysis is new for the DG time-stepping method; it
differs from previous works by which the method is formulated as the one-step
method. We apply our abstract results to the finite element approximation of a
second order parabolic equation with space-time variable coefficient functions
in a polyhedral domain, and derive the optimal order error estimates in several
norms.
","[{""version"":""v1"",""created"":""Sun, 29 Oct 2017 00:43:38 GMT""},{""version"":""v2"",""created"":""Thu, 3 May 2018 06:09:10 GMT""},{""version"":""v3"",""created"":""Wed, 8 Aug 2018 01:41:37 GMT""},{""version"":""v4"",""created"":""Tue, 14 Jan 2020 12:51:09 GMT""},{""version"":""v5"",""created"":""Thu, 23 Jan 2020 12:32:34 GMT""}]","2020-01-24"
"1710.10544","Saverio Bolognani","Liviu Aolaritei, Saverio Bolognani and Florian D\""orfler","Hierarchical and Distributed Monitoring of Voltage Stability in
  Distribution Networks","arXiv admin note: text overlap with arXiv:1612.00207","IEEE Transactions on Power Systems, vol. 33 no. 6, pp. 6705-6714,
  2018","10.1109/TPWRS.2018.2850448",,"math.OC","http://arxiv.org/licenses/nonexclusive-distrib/1.0/","  We consider the problem of quantifying and assessing the steady-state voltage
stability in radial distribution networks. Our approach to the voltage
stability problem is based on a local, approximate, and yet highly accurate
characterization of the determinant of the Jacobian of the power flow equations
parameterized according to the branch-flow model. The proposed determinant
approximation allows us to construct a voltage stability index that can be
computed in a fully distributed or in a hierarchical fashion, resulting in a
scalable approach to the assessment of steady-state voltage stability. Finally,
we provide upper bounds for the approximation error and we numerically validate
the quality and the robustness of the proposed approximation with the IEEE
123-bus test feeder.
","[{""version"":""v1"",""created"":""Sun, 29 Oct 2017 00:49:43 GMT""},{""version"":""v2"",""created"":""Thu, 4 Jul 2019 11:45:23 GMT""}]","2019-07-05"
"1710.10545","Hadley Black","Hadley Black, Deeparnab Chakrabarty, C. Seshadhri","A $o(d) \cdot \text{polylog}~n$ Monotonicity Tester for Boolean
  Functions over the Hypergrid $[n]^d$",,,,,"cs.DM cs.CC cs.DS","http://arxiv.org/licenses/nonexclusive-distrib/1.0/","  We study monotonicity testing of Boolean functions over the hypergrid $[n]^d$
and design a non-adaptive tester with $1$-sided error whose query complexity is
$\tilde{O}(d^{5/6})\cdot \text{poly}(\log n,1/\epsilon)$. Previous to our work,
the best known testers had query complexity linear in $d$ but independent of
$n$. We improve upon these testers as long as $n = 2^{d^{o(1)}}$.
  To obtain our results, we work with what we call the augmented hypergrid,
which adds extra edges to the hypergrid. Our main technical contribution is a
Margulis-style isoperimetric result for the augmented hypergrid, and our
tester, like previous testers for the hypercube domain, performs directed
random walks on this structure.
","[{""version"":""v1"",""created"":""Sun, 29 Oct 2017 01:00:12 GMT""}]","2017-10-31"
