"1710.10596","Hajime Sotani","Hajime Sotani","Pulse profiles from a pulsar in scalar-tensor gravity","accepted for publication in PRD","Phys. Rev. D 96, 104010 (2017)","10.1103/PhysRevD.96.104010",,"astro-ph.HE gr-qc","http://arxiv.org/licenses/nonexclusive-distrib/1.0/","  The pulse profile from a neutron star in scalar-tensor theory of gravity is
examined for several stellar models, where we assume the existence of the
antipodal hot spots on the neutron star based on the polar cap model. Then, we
find that the pulse profile from the scalarized neutron star in scalar-tensor
gravity is almost the same as that in general relativity, i.e., without a
scalar field, if the stellar compactness of the both stars is very similar.
That is, the existence of the scalar field does not directly change the pulse
profile from the neutron star, while the stellar compactness is crucial for
determining the pulse shape even in the scalar-tensor gravity. Additionally, we
find that the pulse shape from the scalarized neutron star is more or less
similar to that from the neutron star with the same mass in general relativity,
while the ratio of the minimum amplitude to the maximum amplitude in the pulse
profile depend strongly on the coupling constant in scalar-tensor gravity,
depending on the angle between the rotational and magnetic axes and the angle
between the rotational axis and the direction to the observer. So, the direct
observation of the pulse profile together with the additional observation of
the stellar mass, one may extract the imprint of the gravitational theory in
strong field regime.
","[{""version"":""v1"",""created"":""Sun, 29 Oct 2017 11:29:06 GMT""}]","2017-11-17"
"1710.10597","Gen Wang","Gen Wang","A Study of Generalized Covariant Hamilton Systems On Generalized Poisson
  manifold","15 pages",,,,"math.DS","http://arxiv.org/licenses/nonexclusive-distrib/1.0/","  Since the basic theoretical framework of generalized Hamilton system is not
perfect and complete, there are often some practical problems that can not be
expressed by generalized Hamilton system. The generalized gradient operator is
defined by the structure function on manifold to improve the basic theoretical
framework of the whole generalized Hamilton system. The generalized structure
Poisson bracket is defined as well on manifolds. The geometric bracket is also
given, and the covariant extension form of the generalized Hamilton system
directly related to the structure function, the generalized covariance, is
further obtained--generalized covariant Hamilton system, It includes thorough
generalized Hamiltonian system and S-dynamic system.
","[{""version"":""v1"",""created"":""Sun, 29 Oct 2017 12:14:35 GMT""},{""version"":""v2"",""created"":""Thu, 16 Nov 2017 13:48:25 GMT""},{""version"":""v3"",""created"":""Mon, 27 Nov 2017 04:54:15 GMT""},{""version"":""v4"",""created"":""Tue, 9 Jan 2018 04:45:08 GMT""},{""version"":""v5"",""created"":""Fri, 24 Aug 2018 08:13:50 GMT""},{""version"":""v6"",""created"":""Thu, 18 Apr 2019 00:54:17 GMT""},{""version"":""v7"",""created"":""Tue, 21 Jan 2020 02:18:24 GMT""}]","2020-01-22"
"1710.10598","Milad Shafiee Ashtiani","Milad Shafiee-Ashtiani, Aghil Yousefi-Koma, Reihaneh Mirjalili, Hessam
  Maleki, Mojtaba Karimi","Push Recovery of a Position-Controlled Humanoid Robot Based on Capture
  Point Feedback Control",,,,,"cs.RO","http://arxiv.org/licenses/nonexclusive-distrib/1.0/","  In this paper, a combination of ankle and hip strategy is used for push
recovery of a position-controlled humanoid robot. Ankle strategy and hip
strategy are equivalent to Center of Pressure (CoP) and Centroidal Moment Pivot
(CMP) regulation respectively. For controlling the CMP and CoP we need a
torque-controlled robot, however most of the conventional humanoid robots are
position controlled. In this regard, we present an efficient way for
implementation of the hip and ankle strategies on a position controlled
humanoid robot. We employ a feedback controller to compensate the capture point
error. Using our scheme, a simple and practical push recovery controller is
designed which can be implemented on the most of the conventional humanoid
robots without the need for torque sensors. The effectiveness of the proposed
approach is verified through push recovery experiments on SURENA-Mini humanoid
robot under severe pushes.
","[{""version"":""v1"",""created"":""Sun, 29 Oct 2017 12:15:53 GMT""}]","2017-10-31"
"1710.10599","T. Damour","Thibault Damour","High-energy gravitational scattering and the general relativistic
  two-body problem","25 pages, 5 figures","Phys. Rev. D 97, 044038 (2018)","10.1103/PhysRevD.97.044038",,"gr-qc","http://arxiv.org/licenses/nonexclusive-distrib/1.0/","  A technique for translating the classical scattering function of two
gravitationally interacting bodies into a corresponding (effective one-body)
Hamiltonian description has been recently introduced [Phys.\ Rev.\ D {\bf 94},
104015 (2016)]. Using this technique, we derive, for the first time, to
second-order in Newton's constant (i.e. one classical loop) the Hamiltonian of
two point masses having an arbitrary (possibly relativistic) relative velocity.
The resulting (second post-Minkowskian) Hamiltonian is found to have a tame
high-energy structure which we relate both to gravitational self-force studies
of large mass-ratio binary systems, and to the ultra high-energy quantum
scattering results of Amati, Ciafaloni and Veneziano. We derive several
consequences of our second post-Minkowskian Hamiltonian: (i) the need to use
special phase-space gauges to get a tame high-energy limit; and (ii)
predictions about a (rest-mass independent) linear Regge trajectory behavior of
high-angular-momenta, high-energy circular orbits. Ways of testing these
predictions by dedicated numerical simulations are indicated. We finally
indicate a way to connect our classical results to the quantum gravitational
scattering amplitude of two particles, and we urge amplitude experts to use
their novel techniques to compute the 2-loop scattering amplitude of scalar
masses, from which one could deduce the third post-Minkowskian effective
one-body Hamiltonian.
","[{""version"":""v1"",""created"":""Sun, 29 Oct 2017 12:16:27 GMT""}]","2018-03-07"
"1710.10600","Daniel Lopez Martinez","Daniel Lopez-Martinez","Regularization approaches for support vector machines with applications
  to biomedical data",,,,,"cs.LG cs.AI stat.ML","http://arxiv.org/licenses/nonexclusive-distrib/1.0/","  The support vector machine (SVM) is a widely used machine learning tool for
classification based on statistical learning theory. Given a set of training
data, the SVM finds a hyperplane that separates two different classes of data
points by the largest distance. While the standard form of SVM uses L2-norm
regularization, other regularization approaches are particularly attractive for
biomedical datasets where, for example, sparsity and interpretability of the
classifier's coefficient values are highly desired features. Therefore, in this
paper we consider different types of regularization approaches for SVMs, and
explore them in both synthetic and real biomedical datasets.
","[{""version"":""v1"",""created"":""Sun, 29 Oct 2017 12:17:19 GMT""}]","2017-10-31"
"1710.10601","James Moffat FIMA C Math FORS","James Moffat, Charles HT Wang","Factorial Representations of Compact Lie Groups, Wigner Sets and Locally
  Invariant Quantum Fields","11 pages","J Phys Math 9:1 (2018)","10.4172/2090-0902.1000259",,"math-ph gr-qc math.MP","http://arxiv.org/licenses/nonexclusive-distrib/1.0/","  The fibre bundle construct defined in our previous work continues to be the
context for this paper; quantum fields composed of fibre algebras become
liftings of; or sections through; a fibre bundle with base space a subset of
curved space-time. We consider a compact Lie group such as SU(n) acting as a
local gauge group of automorphisms of each fibre algebra A(x). Compact Lie
groups, represented as gauge groups acting locally on quantum fields, are key
elements in electroweak and strong force unification. In our recent joint work
we have focused on the translational subgroup of the Poincare group as the
generator of local diffeomorphism invariant quantum states. Here we extend
those algebraic non-perturbative approaches to address the other half of
unification by considering the existence of quantum states of the fibre algebra
A(x) invariant to the action of compact non-abelian Lie groups. Wigner sets are
complementary to little groups and we prove they have the finite intersection
property. Exploiting this then allows us to show that invariant states are
common in the sense that the weakly closed convex hull of every normal (density
matrix) state contains such an invariant state. From these results and our
related research emerges the existence of a locally invariant density matrix
quantum state of the field.
","[{""version"":""v1"",""created"":""Sun, 29 Oct 2017 12:19:52 GMT""}]","2018-05-31"
"1710.10602","Weichao Guo","Weichao Guo, Jianxun He, Huoxiong Wu","Limiting weak-type behaviors of some integral operators",,,,,"math.CA","http://arxiv.org/licenses/nonexclusive-distrib/1.0/","  In this paper, we explore the limiting weak-type behaviors of some integral
operators including maximal operators, singular and fractional integral
operators and maximal truncated singular integrals et al. Some optimal limiting
weak-type behaviors are given, which essentially improve and extend the
previous results in this topics.
","[{""version"":""v1"",""created"":""Sun, 29 Oct 2017 12:23:23 GMT""}]","2017-10-31"
"1710.10603","Weichao Guo","Guoping Zhao, Weichao Guo","Hausdorff operators on the Sobolev spaces $W^{k,1}$",,,,,"math.CA","http://arxiv.org/licenses/nonexclusive-distrib/1.0/","  This paper is served as a first contribution regarding the boundedness of
Hausdorff operators on function spaces with smoothness. The sharp conditions
are established for boundedness of Hausdorff operators on Sobolev spaces
$W^{k,1}$. As applications, some bounded and unbounded properties of Hardy
operator and adjoint Hardy operator on $W^{k,1}$ are deduced.
","[{""version"":""v1"",""created"":""Sun, 29 Oct 2017 12:26:36 GMT""},{""version"":""v2"",""created"":""Wed, 7 Mar 2018 04:46:52 GMT""}]","2018-03-08"
"1710.10604","Yancheng Yuan","Defeng Sun, Kim-Chuan Toh, Yancheng Yuan, Xin-Yuan Zhao","SDPNAL+: A Matlab software for semidefinite programming with bound
  constraints (version 1.0)",,"Optimization Methods and Software (2019)
  [https://doi.org/10.1080/10556788.2019.1576176]",,,"math.OC","http://arxiv.org/licenses/nonexclusive-distrib/1.0/","  SDPNAL+ is a {\sc Matlab} software package that implements an augmented
Lagrangian based method to solve large scale semidefinite programming problems
with bound constraints. The implementation was initially based on a majorized
semismooth Newton-CG augmented Lagrangian method, here we designed it within an
inexact symmetric Gauss-Seidel based semi-proximal ADMM/ALM (alternating
direction method of multipliers/augmented Lagrangian method) framework for the
purpose of deriving simpler stopping conditions and closing the gap between the
practical implementation of the algorithm and the theoretical algorithm. The
basic code is written in {\sc Matlab}, but some subroutines in C language are
incorporated via Mex files. We also design a convenient interface for users to
input their SDP models into the solver. Numerous problems arising from
combinatorial optimization and binary integer quadratic programming problems
have been tested to evaluate the performance of the solver. Extensive numerical
experiments conducted in [Yang, Sun, and Toh, Mathematical Programming
Computation, 7 (2015), pp. 331--366] show that the proposed method is quite
efficient and robust, in that it is able to solve 98.9\% of the 745 test
instances of SDP problems arising from various applications to the accuracy of
$ 10^{-6}$ in the relative KKT residual.
","[{""version"":""v1"",""created"":""Sun, 29 Oct 2017 12:39:33 GMT""},{""version"":""v2"",""created"":""Thu, 16 May 2019 16:13:46 GMT""}]","2019-05-17"
"1710.10605","Jacek Tafel","J. Tafel","All transverse and TT tensors in flat spaces of any dimension","9 pages","Gen. Rel. Grav. 50, 31 (2018)","10.1007/s10714-018-2355-7",,"gr-qc","http://arxiv.org/licenses/nonexclusive-distrib/1.0/","  We present general formulas for transverse and transverse-traceless (TT)
symmetric tensors in flat spaces. TT tensors in conformally flat spaces can be
obtained by means of a conformal transformation.
","[{""version"":""v1"",""created"":""Sun, 29 Oct 2017 12:52:31 GMT""},{""version"":""v2"",""created"":""Sat, 11 Nov 2017 10:02:11 GMT""}]","2020-02-24"
"1710.10606","Vassili Kolokoltsov","Vassili Kolokoltsov and Marianna Troeva","Regularity and Sensitivity for McKean-Vlasov SPDEs","Submitted to American Institute of Physics",,"10.1063/1.5012668",,"math.PR","http://arxiv.org/licenses/nonexclusive-distrib/1.0/","  In the first part of the paper we develop the sensitivity analysis for the
nonlinear McKean-Vlasov diffusions stressing precise estimates of growth of
solutions and their derivatives with respect to the initial data, under rather
general assumptions on the coefficients. The exact estimates become
particularly important when treating the extension of these equations having
random coefficient, since the noise is usually assumed to be unbounded.
  The second part contains our main results dealing with the sensitivity of
stochastic McKean-Vlasov diffusions. By using the method of stochastic
characteristics, we transfer these equations to the non-stochastic equations
with random coefficients thus making it possible to use the estimates obtained
in the first part. The motivation for studying sensitivity of McKean-Vlasov
SPDEs arises naturally from the analysis of the mean-field games with common
noise.
","[{""version"":""v1"",""created"":""Sun, 29 Oct 2017 13:01:14 GMT""}]","2017-12-06"
"1710.10607","Aurelien Manchon","Yao-Jun Dong, Abderrezak Belabbes, Aur\'elien Manchon","Modeling Dzyaloshinskii-Moriya Interaction at Transition Metal
  Interfaces: Constrained Moment versus Generalized Bloch Theorem","7 pages, 6 figures",,,,"cond-mat.mes-hall","http://arxiv.org/licenses/nonexclusive-distrib/1.0/","  Dzyaloshinskii-Moriya interaction (DMI) at Pt/Co interfaces is investigated
theoretically using two different first principles methods. The first one uses
the constrained moment method to build a spin spiral in real space, while the
second method uses the generalized Bloch theorem approach to construct a spin
spiral in reciprocal space. We show that although the two methods produce an
overall similar total DMI energy, the dependence of DMI as a function of the
spin spiral wavelength is dramatically different. We suggest that long-range
magnetic interactions, that determine itinerant magnetism in transition metals,
are responsible for this discrepancy. We conclude that the generalized Bloch
theorem approach is more adapted to model DMI in transition metal systems,
where magnetism is delocalized, while the constrained moment approach is mostly
applicable to weak or insulating magnets, where magnetism is localized.
","[{""version"":""v1"",""created"":""Sun, 29 Oct 2017 13:04:41 GMT""}]","2017-10-31"
"1710.10608","Eugene M. Chudnovsky","E. M. Chudnovsky and D. A. Garanin","Skyrmion Glass in a Disordered Magnetic Film","6 pages, 6 figures",,,,"cond-mat.mes-hall","http://arxiv.org/licenses/nonexclusive-distrib/1.0/","  We show that high concentration of skyrmions can be achieved in magnetic
films with quenched disorder. A 2D system of Heisenberg spins with feromagnetic
exchange, $J$, and random magnetic anisotropy of strength $D_R \ll J$ has been
studied. Analytical theory for the dependence of the average skyrmion size on
the magnetic field $H$, and for the stability of pinned skyrmions, is
complemented by numerical studies of 2D lattices containing up to 40 million
spins. At low fields the average size of the skyrmion, $\lambda$, is determined
by the average size of Imry-Ma domains. On increasing the field the skyrmions
first shrink, with $\lambda \propto D_R/H$, and then collapse at fields
distributed around $H_c \propto D_R^{4/3}$. Concentration of the skyrmions goes
down with the field as $\exp[-(H/H_c)^{3/2}]$.
","[{""version"":""v1"",""created"":""Sun, 29 Oct 2017 13:18:57 GMT""}]","2017-10-31"
"1710.10609","Dhiraj Madan","Dhiraj Madan and Sachindra Joshi","Finding Dominant User Utterances And System Responses in Conversations",,,,,"cs.CL","http://arxiv.org/licenses/nonexclusive-distrib/1.0/","  There are several dialog frameworks which allow manual specification of
intents and rule based dialog flow. The rule based framework provides good
control to dialog designers at the expense of being more time consuming and
laborious. The job of a dialog designer can be reduced if we could identify
pairs of user intents and corresponding responses automatically from prior
conversations between users and agents. In this paper we propose an approach to
find these frequent user utterances (which serve as examples for intents) and
corresponding agent responses. We propose a novel SimCluster algorithm that
extends standard K-means algorithm to simultaneously cluster user utterances
and agent utterances by taking their adjacency information into account. The
method also aligns these clusters to provide pairs of intents and response
groups. We compare our results with those produced by using simple Kmeans
clustering on a real dataset and observe upto 10% absolute improvement in
F1-scores. Through our experiments on synthetic dataset, we show that our
algorithm gains more advantage over K-means algorithm when the data has large
variance.
","[{""version"":""v1"",""created"":""Sun, 29 Oct 2017 13:21:18 GMT""}]","2017-10-31"
"1710.10610","Yulia Zaitseva","Yulia Zaitseva","Homogeneous locally nilpotent derivations of non-factorial trinomial
  algebras","12 pages","Math. Notes 105 (2019), no. 6, 818-830","10.1134/S0001434619050201",,"math.AG math.AC","http://arxiv.org/licenses/nonexclusive-distrib/1.0/","  We describe homogeneous locally nilpotent derivations of the algebra of
regular functions for a class of affine trinomial hypersurfaces. This class
comprises all non-factorial trinomial hypersurfaces.
","[{""version"":""v1"",""created"":""Sun, 29 Oct 2017 13:24:58 GMT""},{""version"":""v2"",""created"":""Fri, 28 Jun 2019 14:27:49 GMT""}]","2019-07-01"
"1710.10611","A-Li Luo","Li-Li Wang, A-Li Luo, Shi-Yin Shen, Wen Hou, Xiao Kong, Yi-Han Song,
  Jian-Nan Zhang, Wu Hong, Zi-Huang Cao, Yong-Hui Hou, Yue-Fei Wang, Yong
  Zhang, and Yong-Heng Zhao","Spectral classification and composites of galaxies in LAMOST DR4","14 pages, 11 figures",,"10.1093/mnras/stx2798",,"astro-ph.GA","http://arxiv.org/licenses/nonexclusive-distrib/1.0/","  We study the classification and composite spectra of galaxy in the fourth
data release (DR4) of the Large Sky Area Multi-Object Fiber Spectroscopic
Telescope (LAMOST). We select 40,182 spectra of galaxies from LAMOST DR4, which
have photometric in- formation but no spectroscopic observations in the Sloan
Digital Sky Survey(SDSS). These newly observed spectra are re-calibrated and
classified into six classes, i.e. pas- sive, H{\alpha}-weak, star-forming,
composite, LINER and Seyfert using the line intensity (H\b{eta},
[OIII]{\lambda}5007, H{\alpha} and [NII]{\lambda}6585). We also study the
correlation between spectral classes and morphological types through three
parameters: concentration index, (u - r) color, and D4000n index. We calculate
composite spectra of high signal-to-noise ra- tio(S/N) for six spectral
classes, and using these composites we pick out some features that can
differentiate the classes effectively, including H\b{eta}, Fe5015, H{\gamma}A,
HK, and Mg2 band etc. In addition, we compare our composite spectra with the
SDSS ones and analyse their difference. A galaxy catalogue of 40,182 newly
observed spectra (36,601 targets) and the composite spectra of the six classes
are available online.
","[{""version"":""v1"",""created"":""Sun, 29 Oct 2017 13:34:52 GMT""}]","2017-12-27"
"1710.10612","Ur\v{s}ka Jeler\v{c}i\v{c}","Ur\v{s}ka Jeler\v{c}i\v{c}","Mechanical model of Golgi apparatus","Draft",,,,"physics.bio-ph cond-mat.soft","http://arxiv.org/licenses/nonexclusive-distrib/1.0/","  The Golgi apparatus has intrigued researchers since its discovery and despite
the advances, there are still many open questions in regards to its shape and
function. Here, we propose a mechanical model of Golgi apparatus stack and
explain its most elementary geometrical properties: the equilibrium number of
cisternae, the stack size, and its general equilibrium shape. In order to gain
comprehensive insight into the stack morphology, we combine both analytical and
numerical methods. We successfully reconstruct the stack morphology using
minimal assumptions, thus identifying the most dominant factors regulating the
stack shape. We demonstrate that energy-wise the stack prefers an overall bent
shape and show strong evidence that the adhesion strength determines the
equilibrium number of cisternae per stack. We explore the morphological role of
fenestrations and discuss their impact on the overall stack structure. We also
comment on the effects of the membrane asymmetry on the shape of the cisternae
and thus offer a broad steady-state study of the stack morphology and present a
method that can be used also for other membrane-bound organelles.
","[{""version"":""v1"",""created"":""Sun, 29 Oct 2017 13:36:25 GMT""}]","2017-10-31"
"1710.10613","Helmunt Vigo Cotrina","H. Vigo-Cotrina and A.P. Guimar\~aes","Writing and storing information in an array of magnetic vortex nanodisks
  using their azimuthal modes",,,"10.1016/j.jmmm.2018.03.064",,"cond-mat.mes-hall","http://arxiv.org/licenses/nonexclusive-distrib/1.0/","  The switching of a vortex core of a single disk in an array of a multilayer
system is investigated by micromagnetic simulation. We found that the
perpendicular uniaxial anisotropy (PUA) decreases the frequencies of the
azimuthal mode in disks with magnetic vortex configuration. We obtained a phase
diagram of magnetic field intensity vs. frequency of the azimuthal mode, as a
function of the value of perpendicular uniaxial anisotropy. We demonstrated
that rotating magnetic fields (CW and CCW) with frequency equal to azimuthal
modes can be used to switch the vortex core of single disks in a disk array.
This allows obtaining different memory states with a single array of nanodisks,
and therefore writing information through the application of rotating fields.
","[{""version"":""v1"",""created"":""Sun, 29 Oct 2017 13:40:12 GMT""}]","2018-05-09"
"1710.10614","The CMS Collaboration","CMS Collaboration","Search for standard model production of four top quarks with same-sign
  and multilepton final states in proton-proton collisions at $\sqrt{s} =$ 13
  TeV","Replaced with the published version. Added the journal reference and
  DOI. All the figures and tables, including additional supplementary figures
  and material, can be found at
  cms-results.web.cern.ch/cms-results/public-results/publications/TOP-17-009/
  (CMS Public Pages)","Eur. Phys. J. C 78 (2018) 140","10.1140/epjc/s10052-018-5607-5","CMS-TOP-17-009, CERN-EP-2017-262","hep-ex","http://creativecommons.org/licenses/by/4.0/","  A search for standard model production of four top quarks
($\mathrm{t}\overline{\mathrm{t}}\mathrm{t}\overline{\mathrm{t}})$ is reported
using events containing at least three leptons (e, $\mu$) or a same-sign lepton
pair. The events are produced in proton-proton collisions at a center-of-mass
energy of 13 TeV at the LHC, and the data sample, recorded in 2016, corresponds
to an integrated luminosity of 35.9 fb$^{-1}$. Jet multiplicity and flavor are
used to enhance signal sensitivity, and dedicated control regions are used to
constrain the dominant backgrounds. The observed and expected signal
significances are, respectively, 1.6 and 1.0 standard deviations, and the
$\mathrm{t}\overline{\mathrm{t}}\mathrm{t}\overline{\mathrm{t}}$ cross section
is measured to be 16.9 $^{+13.8}_{-11.4}$ fb, in agreement with
next-to-leading-order standard model predictions. These results are also used
to constrain the Yukawa coupling between the top quark and the Higgs boson to
be less than 2.1 times its expected standard model value at 95% confidence
level.
","[{""version"":""v1"",""created"":""Sun, 29 Oct 2017 13:43:49 GMT""},{""version"":""v2"",""created"":""Tue, 20 Feb 2018 14:28:51 GMT""}]","2018-02-21"
