"1710.10487","Harry Zheng","Jingtang Ma, Wenyuan Li, Harry Zheng","Dual control Monte Carlo method for tight bounds of value function under
  Heston stochastic volatility model","25 pages, 2 figures",,,,"q-fin.CP","http://arxiv.org/licenses/nonexclusive-distrib/1.0/","  The aim of this paper is to study the fast computation of the lower and upper
bounds on the value function for utility maximization under the Heston
stochastic volatility model with general utility functions. It is well known
there is a closed form solution of the HJB equation for power utility due to
its homothetic property. It is not possible to get closed form solution for
general utilities and there is little literature on the numerical scheme to
solve the HJB equation for the Heston model. In this paper we propose an
efficient dual control Monte Carlo method for computing tight lower and upper
bounds of the value function. We identify a particular form of the dual control
which leads to the closed form upper bound for a class of utility functions,
including power, non-HARA and Yarri utilities. Finally, we perform some
numerical tests to see the efficiency, accuracy, and robustness of the method.
The numerical results support strongly our proposed scheme.
","[{""version"":""v1"",""created"":""Sat, 28 Oct 2017 16:09:10 GMT""}]","2017-10-31"
"1710.10488","Zuzanna Szancer","Zuzanna Szancer","$\widetilde{J}$-tangent affine hypersurfaces with an induced almost
  paracontact structure",,,,,"math.DG","http://arxiv.org/licenses/nonexclusive-distrib/1.0/","  We study real affine hypersurfaces $f\colon M\rightarrow \mathbb{R}^{2n+2}$
with an almost paracontact structure $(\varphi ,\xi,\eta)$ induced by a
$\widetilde{J}$-tangent transversal vector filed, where $\widetilde{J}$ is the
canonical paracomplex structure on $\mathbb{R}^{2n+2}$. We give a
classification of hypersurfaces for which an induced almost paracontact
structure is metric relative to the second fundamental form. Some other
properties of such hypersurfaces are also studied.
","[{""version"":""v1"",""created"":""Sat, 28 Oct 2017 16:09:51 GMT""}]","2017-10-31"
"1710.10489","Bin Liu","Bin Liu","ILAPF: Incremental Learning Assisted Particle Filtering","5 pages, 4 figures, conference",,,,"stat.ME stat.CO","http://arxiv.org/licenses/nonexclusive-distrib/1.0/","  This paper is concerned with dynamic system state estimation based on a
series of noisy measurement with the presence of outliers. An incremental
learning assisted particle filtering (ILAPF) method is presented, which can
learn the value range of outliers incrementally during the process of particle
filtering. The learned range of outliers is then used to improve subsequent
filtering of the future state. Convergence of the outlier range estimation
procedure is indicated by extensive empirical simulations using a set of
differing outlier distribution models. The validity of the ILAPF algorithm is
evaluated by illustrative simulations, and the result shows that ILAPF is more
accurate and faster than a recently published state-ofthe-art robust particle
filter. It also shows that the incremental learning property of the ILAPF
algorithm provides an efficient way to implement transfer learning among
related state filtering tasks.
","[{""version"":""v1"",""created"":""Sat, 28 Oct 2017 16:11:45 GMT""},{""version"":""v2"",""created"":""Thu, 1 Feb 2018 09:53:58 GMT""}]","2018-02-02"
"1710.10490","Leonid Sokolinsky","Leonid B. Sokolinsky","Analytical Estimation of the Scalability of Iterative Numerical
  Algorithms on Distributed Memory Multiprocessors","Submitted to a special issue of Lobachevskii Journal of Mathematics
  on ""Parallel Structure of Algorithms""",,"10.1134/S1995080218040121",,"cs.DC","http://arxiv.org/licenses/nonexclusive-distrib/1.0/","  This article presents a new high-level parallel computational model named BSF
- Bulk Synchronous Farm. The BSF model extends the BSP model to deal with the
compute-intensive iterative numerical methods executed on distributed-memory
multiprocessor systems. The BSF model is based on the master-worker paradigm
and the SPMD programming model. The BSF model makes it possible to predict the
upper scalability bound of a BSF-program with great accuracy. The BSF model
also provides equations for estimating the speedup and parallel efficiency of a
BSF-program.
","[{""version"":""v1"",""created"":""Sat, 28 Oct 2017 16:17:23 GMT""},{""version"":""v2"",""created"":""Fri, 10 Nov 2017 16:06:56 GMT""}]","2018-05-29"
"1710.10491","Sai Teja Somu","Sai Teja Somu","On $rth$ coefficient of divisors of $x^n-1$","6 pages",,,,"math.NT","http://arxiv.org/licenses/nonexclusive-distrib/1.0/","  Let $r,n$ be two natural numbers and let $H(r,n)$ denote the maximal absolute
value of $r$th coefficient of divisors of $x^n-1$. In this paper, we show that
$\sum_{n\leq x}H(r,n)$ is asymptotically equal to $c(r)x(\log x)^{2^r-1}$ for
some constant $c(r)>0$. Furthermore, we give an explicit expression of $c(r)$
in terms of $r$.
","[{""version"":""v1"",""created"":""Sat, 28 Oct 2017 16:42:08 GMT""}]","2017-10-31"
"1710.10492","Giuseppe Trainiti","Giuseppe Trainiti and Massimo Ruzzene","Optical evaluation of the wave filtering properties of graded undulated
  lattices",,,"10.1063/1.5011369",,"physics.app-ph","http://arxiv.org/licenses/nonexclusive-distrib/1.0/","  We investigate and experimentally demonstrate the elastic wave filtering
properties of graded undulated lattices. Square reticulates composed of curved
beams are characterized by graded mechanical properties which result from the
spatial modulation of the curvature parameter. Among such properties, the
progressive formation of frequency bandgaps leads to strong wave attenuation
over a broad frequency range. The experimental investigation of wave
transmission, and the detection of full wavefields effectively illustrate this
behavior. Transmission measurements are conducted using a scanning Laser
vibrometer, while a dedicated digital image correlation procedure is
implemented to capture in-plane wave motion at selected frequencies. The
presented results illustrate the broadband attenuation characteristics
resulting from spatial grading of the lattice curvature, whose in-depth
investigation is enabled by the presented experimental procedures.
","[{""version"":""v1"",""created"":""Sat, 28 Oct 2017 16:45:41 GMT""}]","2018-01-17"
"1710.10493","Chen-Te Ma","Po-Yao Chang, Su-Kuan Chu, and Chen-Te Ma","Bell's Inequality, Generalized Concurrence and Entanglement in Qubits","42 pages, 7 figures, 2 tables, minor changes, references added",,,,"quant-ph cond-mat.mes-hall cond-mat.str-el hep-th","http://arxiv.org/licenses/nonexclusive-distrib/1.0/","  It is well known that the maximal violation of the Bell's inequality for a
two-qubit system is related to the entanglement formation in terms of a
concurrence. However, a generalization of this relation to an $n$-qubit state
has not been found. In the paper, we demonstrate some extensions of the
relation between the upper bound of the Bell's violation and a {\it
generalized} concurrence in several $n$-qubit states. In particular, we show
the upper bound of the Bell's violation can be expressed as a function of the
generalized concurrence, if a state can be expressed in terms of two variables.
We apply the relation to the Wen-Plaquette model and show that the topological
entanglement entropy can be extracted from the maximal Bell's violation.
","[{""version"":""v1"",""created"":""Sat, 28 Oct 2017 16:52:35 GMT""},{""version"":""v2"",""created"":""Thu, 9 Nov 2017 02:32:01 GMT""},{""version"":""v3"",""created"":""Wed, 13 Mar 2019 08:27:55 GMT""}]","2019-03-14"
"1710.10494","Farzaneh Momeni","F. Momeni and M. H. Naderi","Steady-state mechanical squeezing and ground-state cooling of a Duffing
  anharmonic oscillator in an optomechanical cavity assisted by a nonlinear
  medium","14 pages, 12 figures",,"10.1088/1555-6611/aaac70",,"quant-ph physics.optics","http://arxiv.org/licenses/nonexclusive-distrib/1.0/","  In this paper, we study theoretically a hybrid optomechanical system
consisting of a degenerate optical parametric amplifier inside a driven optical
cavity with a moving end mirror which is modeled as a stiffening Duffing-like
anharmonic quantum mechanical oscillator. By providing analytical expressions
for the critical values of the system parameters corresponding to the emergence
of the multistability behavior in the steady-state response of the system, we
show that the stiffening mechanical Duffing anharmonicity reduces the width of
the multistability region while the optical parametric nonlinearity can be
exploited to drive the system toward the multistability region. We also show
that for appropriate values of the mechanical anharmonicity strength the
steady-state mechanical squeezing and the ground-state cooling of the
mechanical resonator can be achieved. Moreover, we find that the presence of
the nonlinear gain medium can lead to the improvement of the mechanical
anharmonicity-induced cooling of the mechanical motion, as well as to the
mechanical squeezing beyond the standard quantum limit of 3 dB.
","[{""version"":""v1"",""created"":""Sat, 28 Oct 2017 16:52:40 GMT""},{""version"":""v2"",""created"":""Tue, 26 Dec 2017 15:15:09 GMT""}]","2018-04-18"
"1710.10495","Khaled El-Wazan","Khaled El-Wazan and Ahmed Younes and S. B. Doma","A Quantum Algorithm for Testing Junta Variables and Learning Boolean
  Functions via Entanglement Measure",,,,,"quant-ph","http://arxiv.org/licenses/nonexclusive-distrib/1.0/","  Given a black-box representing an unknown Boolean function $f$ of $n$
variables, in this paper we propose a fast quantum algorithm to test whether or
not a certain variable in the function $f$ is a junta variable. The proposed
algorithm creates entanglement between the variable under test and an auxiliary
qubit, where the entanglement is measured using concurrence measure to decide
if the variable is junta. The paper shows applications to the proposed
algorithm in learning and categorization of Boolean functions.
","[{""version"":""v1"",""created"":""Sat, 28 Oct 2017 16:56:57 GMT""},{""version"":""v2"",""created"":""Sun, 5 Nov 2017 19:23:51 GMT""},{""version"":""v3"",""created"":""Sat, 16 Feb 2019 17:15:45 GMT""}]","2019-02-19"
"1710.10496","Reuven Segev","Reuven Segev and Jedrzej Sniatycki","On jets, almost symmetric tensors, and traction hyper-stresses","23 pages","Math. Mech. Compl. Sys. 6 (2018) 101-124","10.2140/memocs.2018.6.101",,"math-ph math.MP","http://arxiv.org/licenses/nonexclusive-distrib/1.0/","  The paper considers the formulation of higher-order continuum mechanics on
differentiable manifolds devoid of any metric or parallelism structure. For
generalized velocities modeled as sections of some vector bundle, a variational
kth order hyper-stress is an object that acts on jets of generalized velocities
to produce power densities. The traction hyper-stress is introduced as an
object that induces hyper-traction fields on the boundaries of subbodies.
Additional aspects of multilinear algebra relevant to the analysis of these
objects are reviewed.
","[{""version"":""v1"",""created"":""Sat, 28 Oct 2017 17:00:07 GMT""}]","2018-06-06"
"1710.10497","Dominic Breit","Dominic Breit, Eduard Feireisl","Stochastic Navier-Stokes-Fourier equations",,,,,"math.AP","http://arxiv.org/licenses/nonexclusive-distrib/1.0/","  We study the full Navier--Stokes--Fourier system governing the motion of a
general viscous, heat-conducting, and compressible fluid subject to stochastic
perturbation. Stochastic effects are implemented through (i) random initial
data, (ii) a forcing term in the momentum equation represented by a
multiplicative white noise, (iii) random heat source in the internal energy
balance. We establish existence of a weak martingale solution under physically
grounded structural assumptions. As a byproduct of our theory we can show that
stationary martingale solutions only exist in certain trivial cases.
","[{""version"":""v1"",""created"":""Sat, 28 Oct 2017 17:13:01 GMT""}]","2017-10-31"
"1710.10498","Shubhangi Tandon","Sharath T. S. and Shubhangi Tandon","Topic Based Sentiment Analysis Using Deep Learning",,,,,"cs.CL cs.IR","http://arxiv.org/licenses/nonexclusive-distrib/1.0/","  In this paper , we tackle Sentiment Analysis conditioned on a Topic in
Twitter data using Deep Learning . We propose a 2-tier approach : In the first
phase we create our own Word Embeddings and see that they do perform better
than state-of-the-art embeddings when used with standard classifiers. We then
perform inference on these embeddings to learn more about a word with respect
to all the topics being considered, and also the top n-influencing words for
each topic. In the second phase we use these embeddings to predict the
sentiment of the tweet with respect to a given topic, and all other topics
under discussion.
","[{""version"":""v1"",""created"":""Sat, 28 Oct 2017 17:13:49 GMT""}]","2017-10-31"
"1710.10499","Christopher Izzo","C. Izzo, G. Bollen, M. Brodeur, M. Eibach, K. Gulyuz, J. D. Holt, J.
  M. Kelly, M. Redshaw, R. Ringle, R. Sandler, S. Schwarz, S. R. Stroberg, C.
  S. Sumithrarachchi, A. A. Valverde, A. C. C. Villari","Precision Mass Measurements of Neutron-Rich Co Isotopes Beyond N=40","7 pages, 6 figures","Phys. Rev. C 97, 014309 (2018)","10.1103/PhysRevC.97.014309",,"nucl-ex","http://arxiv.org/licenses/nonexclusive-distrib/1.0/","  The region near Z=28, N=40 is a subject of great interest for nuclear
structure studies due to spectroscopic signatures in $^{68}$Ni suggesting a
subshell closure at N=40. Trends in nuclear masses and their derivatives
provide a complementary approach to shell structure investigations via
separation energies. Penning trap mass spectrometry has provided precise
measurements for a number of nuclei in this region, however a complete picture
of the mass surfaces has so far been limited by the large uncertainty remaining
for nuclei with N > 40 along the iron and cobalt chains. Here we present the
first Penning trap measurements of $^{68,69}$Co, performed at the Low-Energy
Beam and Ion Trap facility at the National Superconducting Cyclotron
Laboratory. In addition, we perform ab initio calculations of ground state and
two-neutron separation energies of cobalt isotopes with the valence-space
in-medium similarity renormalization group approach based on a particular set
of two- and three-nucleon forces which predict saturation in infinite matter.
We discuss the importance of these measurements and calculations for
understanding the evolution of nuclear structure near $^{68}$Ni.
","[{""version"":""v1"",""created"":""Sat, 28 Oct 2017 17:20:09 GMT""}]","2018-01-24"
"1710.10500","Luca Merlo Dr.","L. Merlo, F. Pobbe, and S. Rigolin","The Minimal Axion Minimal Linear $\sigma$ Model","40 pages, 3 figures. V2 matches the version published in EPJC. V3:
  typo corrected and references added",,"10.1140/epjc/s10052-018-5892-z",,"hep-ph","http://arxiv.org/licenses/nonexclusive-distrib/1.0/","  The minimal $SO(5)/SO(4)$ linear $\sigma$ model is extended including an
additional complex scalar field, singlet under the global $SO(5)$ and the
Standard Model gauge symmetries. The presence of this scalar field creates the
conditions to generate an axion \`a la KSVZ, providing a solution to the strong
CP problem, or an axion-like-particle. Different choices for the PQ charges are
possible and lead to physically distinct Lagrangians. The internal consistency
of each model necessarily requires the study of the scalar potential describing
the $SO(5)\to SO(4)$, electroweak and PQ symmetry breaking. A single minimal
scenario is identified and the associated scalar potential is minimised
including counterterms needed to ensure one-loop renormalizability. In the
allowed parameter space, phenomenological features of the scalar degrees of
freedom, of the exotic fermions and of the axion are illustrated. Two distinct
possibilities for the axion arise: either it is a QCD axion with an associated
scale larger than $\sim10^{5}$ TeV and therefore falling in the category of the
invisible axions; or it is a more massive axion-like-particle, such as a $1$
GeV axion with an associated scale of $\sim200$ TeV, that may show up in
collider searches.
","[{""version"":""v1"",""created"":""Sat, 28 Oct 2017 17:23:40 GMT""},{""version"":""v2"",""created"":""Thu, 31 May 2018 12:32:19 GMT""},{""version"":""v3"",""created"":""Fri, 8 Nov 2019 15:38:58 GMT""}]","2019-11-11"
"1710.10501","Li Yao","Li Yao, Eric Poblenz, Dmitry Dagunts, Ben Covington, Devon Bernard,
  Kevin Lyman","Learning to diagnose from scratch by exploiting dependencies among
  labels","include the link for the dataset split",,,,"cs.CV","http://arxiv.org/licenses/nonexclusive-distrib/1.0/","  The field of medical diagnostics contains a wealth of challenges which
closely resemble classical machine learning problems; practical constraints,
however, complicate the translation of these endpoints naively into classical
architectures. Many tasks in radiology, for example, are largely problems of
multi-label classification wherein medical images are interpreted to indicate
multiple present or suspected pathologies. Clinical settings drive the
necessity for high accuracy simultaneously across a multitude of pathological
outcomes and greatly limit the utility of tools which consider only a subset.
This issue is exacerbated by a general scarcity of training data and maximizes
the need to extract clinically relevant features from available samples --
ideally without the use of pre-trained models which may carry forward
undesirable biases from tangentially related tasks. We present and evaluate a
partial solution to these constraints in using LSTMs to leverage
interdependencies among target labels in predicting 14 pathologic patterns from
chest x-rays and establish state of the art results on the largest publicly
available chest x-ray dataset from the NIH without pre-training. Furthermore,
we propose and discuss alternative evaluation metrics and their relevance in
clinical practice.
","[{""version"":""v1"",""created"":""Sat, 28 Oct 2017 17:25:23 GMT""},{""version"":""v2"",""created"":""Thu, 1 Feb 2018 22:16:56 GMT""}]","2018-02-05"
"1710.10502","Stefan Krompiewski","Stefan Krompiewski, and Gianaurelio Cuniberti","Edge magnetism impact on electrical conductance and thermoelectric
  properties of graphenelike nanoribbons","6 pages, 8 figures","Phys. Rev. B 96, 155447 (2017)","10.1103/PhysRevB.96.155447",,"cond-mat.mes-hall cond-mat.mtrl-sci","http://arxiv.org/licenses/nonexclusive-distrib/1.0/","  Edge states in narrow quasi two-dimensional nanostructures determine, to a
large extent, their electric, thermoelectric and magnetic properties.
Non-magnetic edge states may quite often lead to topological insulator type
behavior. However another scenario develops when the zigzag edges are magnetic
and the time reversal symmetry is broken. In this work we report on the
electronic band structure modifications, electrical conductance and
thermoelectric properties of narrow zigzag nanoribbons with spontaneously
magnetized edges. Theoretical studies based on the Kane-Mele- Hubbard
tight-binding model show that for silicene, germanene and stanene both the
Seebeck coefficient and the thermoelectric power factor are strongly enhanced
for energies close to the charge neutrality point. Perpendicular gate voltage
lifts the spin degeneracy of energy bands in the ground state with antiparallel
magnetized zigzag edges and makes the electrical conductance significantly
spin-polarized. Simultaneously the gate voltage worsens the thermoelectric
performance. Estimated room-temperature figures of merit for the aforementioned
nanoribbons can exceed a value of 3 if phonon thermal conductances are
adequately reduced.
","[{""version"":""v1"",""created"":""Sat, 28 Oct 2017 17:26:13 GMT""}]","2017-10-31"
"1710.10503","Masakiyo Miyazawa","Sergey Foss, Masakiyo Miyazawa","Customer sojourn time in GI/G/1 feedback queue in the presence of heavy
  tails","34 pages, 4 figures, to appear in Journal of Statistical Physics",,"10.1007/s10955-018-2079-9",,"math.PR","http://arxiv.org/licenses/nonexclusive-distrib/1.0/","  We consider a single-server GI/GI/1 queueing system with feedback. We assume
the service times distribution to be (intermediate) regularly varying. We find
the tail asymptotics for a customer's sojourn time in two regimes: the customer
arrives in an empty system, and the customer arrives in the system in the
stationary regime. In particular, in the case of Poisson input we use the
branching processes structure and provide more precise formulae. As auxiliary
results, we find the tail asymptotics for the busy period distribution in a
single-server queue with an intermediate varying service times distribution and
establish the principle-of-a-single-big-jump equivalences that characterise the
asymptotics.
","[{""version"":""v1"",""created"":""Sat, 28 Oct 2017 17:28:01 GMT""},{""version"":""v2"",""created"":""Wed, 6 Jun 2018 19:14:54 GMT""},{""version"":""v3"",""created"":""Sun, 17 Jun 2018 12:16:12 GMT""}]","2018-08-01"
"1710.10504","Rui Liu","Rui Liu, Wei Wei, Weiguang Mao, Maria Chikina","Phase Conductor on Multi-layered Attentions for Machine Comprehension",,,,,"cs.CL","http://arxiv.org/licenses/nonexclusive-distrib/1.0/","  Attention models have been intensively studied to improve NLP tasks such as
machine comprehension via both question-aware passage attention model and
self-matching attention model. Our research proposes phase conductor
(PhaseCond) for attention models in two meaningful ways. First, PhaseCond, an
architecture of multi-layered attention models, consists of multiple phases
each implementing a stack of attention layers producing passage representations
and a stack of inner or outer fusion layers regulating the information flow.
Second, we extend and improve the dot-product attention function for PhaseCond
by simultaneously encoding multiple question and passage embedding layers from
different perspectives. We demonstrate the effectiveness of our proposed model
PhaseCond on the SQuAD dataset, showing that our model significantly
outperforms both state-of-the-art single-layered and multiple-layered attention
models. We deepen our results with new findings via both detailed qualitative
analysis and visualized examples showing the dynamic changes through
multi-layered attention models.
","[{""version"":""v1"",""created"":""Sat, 28 Oct 2017 17:28:04 GMT""},{""version"":""v2"",""created"":""Wed, 1 Nov 2017 00:15:22 GMT""}]","2017-11-02"
"1710.10505","Steffen Wei{\ss}er","Steffen Wei{\ss}er","Anisotropic polygonal and polyhedral discretizations in finite element
  analysis",,,"10.1051/m2an/2018066",,"math.NA","http://arxiv.org/licenses/nonexclusive-distrib/1.0/","  New interpolation and quasi-interpolation operators of Cl\'ement- and
Scott-Zhang-type are analyzed on anisotropic polygonal and polyhedral meshes.
Since no reference element is available, an appropriate linear mapping to a
reference configuration plays a crucial role. A priori error estimates are
derived respecting the anisotropy of the discretization. Finally, the found
estimates are employed to propose an adaptive mesh refinement based on
bisection which leads to highly anisotropic and adapted discretizations with
general element shapes in two- and three-dimensions.
","[{""version"":""v1"",""created"":""Sat, 28 Oct 2017 17:28:12 GMT""}]","2019-10-29"
"1710.10506","Irinel Chiorescu","G. Yue, L. Chen, J. Barreda, V. Bevara, L. Hu, L. Wu, Z. Wang, P.
  Andrei, S. Bertaina and I. Chiorescu","Sensitive spin detection using an on-chip SQUID-waveguide resonator","submitted","Appl. Phys. Lett. 111, 202601 (2017)","10.1063/1.5006693",,"cond-mat.mes-hall","http://arxiv.org/licenses/nonexclusive-distrib/1.0/","  Precise detection of spin resonance is of paramount importance to achieve
coherent spin control in quantum computing. We present a novel setup for spin
resonance measurements, which uses a dc-SQUID flux detector coupled to an
antenna from a coplanar waveguide. The SQUID and the waveguide are fabricated
from 20~nm Nb thin film, allowing high magnetic field operation with the field
applied parallel to the chip. We observe a resonance signal between the first
and third excited states of Gd spins $S=7/2$ in a CaWO$_4$ crystal, relevant
for state control in multi-level systems.
","[{""version"":""v1"",""created"":""Sat, 28 Oct 2017 17:31:08 GMT""}]","2017-11-17"
"1710.10507","Philippe Claudin","P. Claudin, O. Duran, B. Andreotti","Dissolution instability and roughening transition","13 pages, 7 figures","J. Fluid Mech., vol. 832 (2017)","10.1017/jfm.2017.711",,"physics.flu-dyn","http://arxiv.org/licenses/nonexclusive-distrib/1.0/","  We theoretically investigate the pattern formation observed when a fluid
flows over a solid substrate that can dissolve or melt. We use a turbulent
mixing description that includes the effect of the bed roughness. We show that
the dissolution instability at the origin of the pattern is associated with an
anomaly at the transition from a laminar to a turbulent hydrodynamic response
with respect to the bed elevation. This anomaly, and therefore the instability,
disappears when the bed becomes hydrodynamically rough, above a threshold
roughness-based Reynolds number. This suggests a possible mechanism for the
selection of the pattern amplitude. The most unstable wavelength scales as
observed in nature on the thickness of the viscous sublayer, with a
multiplicative factor that depends on the dimensionless parameters of the
problem.
","[{""version"":""v1"",""created"":""Sat, 28 Oct 2017 17:37:14 GMT""}]","2017-11-22"
