"1710.10562","Tara Moradi","Tara Moradi, Malek Bagheri Harouni, Mohammad Hossein Naderi","Photon antibunching control in a quantum dot and metallic nanoparticle
  hybrid system with non-Markovian dynamics",,,,,"physics.optics","http://arxiv.org/licenses/nonexclusive-distrib/1.0/","  Photon-number statistics of the emitted photons from a quantum dot placed in
the vicinity of a metallic nanoparticle (with either shell or solid-sphere
geometry) in the non-Markovian regime is investigated theoretically. In the
model scheme, the quantum dot is considered as a InAs three- level system in
Lambda-type configuration with two transition channels. One of channels is
driven by a polarized classical field while the two channels are coupled to the
plasmon modes. Plasmon resonance modes of a nanoshell, in contrast of a
nanosphere, are tunable at demand frequency by controlling the thickness and
the materials of the core and the embedding media. The results reveal that the
emitted photons from the hybrid system under consideration are antibunched.
Moreover, the anti- bunching behavior of the emitted photons can be controlled
by the geometrical parameters of the system, namely, the quantum dot-metal nano
particle separation distance, as well as the system's physical parameters
including the detuning frequency of the quantum dot transitions with respect to
the surface plasmon modes, and the Rabi frequency of the polarized driving
field. Additionally, the studied system has the potential to be a highly
controllable single-photon source.
","[{""version"":""v1"",""created"":""Sun, 29 Oct 2017 04:35:15 GMT""},{""version"":""v2"",""created"":""Tue, 14 Nov 2017 22:38:59 GMT""},{""version"":""v3"",""created"":""Sat, 16 Dec 2017 04:43:51 GMT""},{""version"":""v4"",""created"":""Thu, 7 Jun 2018 15:49:42 GMT""}]","2018-06-08"
"1710.10563","Sarah Harrison","Francesca Ferrari and Sarah M. Harrison","Properties of extremal CFTs with small central charge","41 pages + appendices",,,,"hep-th","http://arxiv.org/licenses/nonexclusive-distrib/1.0/","  We analyze aspects of extant examples of 2d extremal chiral (super)conformal
field theories with $c\leq 24$. These are theories whose only operators with
dimension smaller or equal to $c/24$ are the vacuum and its (super)Virasoro
descendents. The prototypical example is the monster CFT, whose famous genus
zero property is intimately tied to the Rademacher summability of its twined
partition functions, a property which also distinguishes the functions of
Mathieu and umbral moonshine. However, there are now several additional known
examples of extremal CFTs, all of which have at least $\mathcal N=1$
supersymmetry and global symmetry groups connected to sporadic simple groups.
We investigate the extent to which such a property, which distinguishes the
monster moonshine module from other $c=24$ chiral CFTs, holds for the other
known extremal theories. We find that in most cases, the special Rademacher
summability property present for monstrous and umbral moonshine does not hold
for the other extremal CFTs, with the exception of the Conway module and two
$c=12, ~\mathcal N=4$ superconformal theories with $M_{11}$ and $M_{22}$
symmetry. This suggests that the connection between extremal CFT, sporadic
groups, and mock modular forms transcends strict Rademacher summability
criteria.
","[{""version"":""v1"",""created"":""Sun, 29 Oct 2017 04:59:34 GMT""}]","2017-10-31"
"1710.10564","Trung Pham","Toan Tran, Trung Pham, Gustavo Carneiro, Lyle Palmer and Ian Reid","A Bayesian Data Augmentation Approach for Learning Deep Models","Accepted to NISP 2017",,,,"cs.CV cs.LG","http://arxiv.org/licenses/nonexclusive-distrib/1.0/","  Data augmentation is an essential part of the training process applied to
deep learning models. The motivation is that a robust training process for deep
learning models depends on large annotated datasets, which are expensive to be
acquired, stored and processed. Therefore a reasonable alternative is to be
able to automatically generate new annotated training samples using a process
known as data augmentation. The dominant data augmentation approach in the
field assumes that new training samples can be obtained via random geometric or
appearance transformations applied to annotated training samples, but this is a
strong assumption because it is unclear if this is a reliable generative model
for producing new training samples. In this paper, we provide a novel Bayesian
formulation to data augmentation, where new annotated training points are
treated as missing variables and generated based on the distribution learned
from the training set. For learning, we introduce a theoretically sound
algorithm --- generalised Monte Carlo expectation maximisation, and demonstrate
one possible implementation via an extension of the Generative Adversarial
Network (GAN). Classification results on MNIST, CIFAR-10 and CIFAR-100 show the
better performance of our proposed method compared to the current dominant data
augmentation approach mentioned above --- the results also show that our
approach produces better classification results than similar GAN models.
","[{""version"":""v1"",""created"":""Sun, 29 Oct 2017 05:02:14 GMT""}]","2017-10-31"
"1710.10565","Naman Kohli","Naman Kohli, Daksha Yadav, Mayank Vatsa, Richa Singh, and Afzel Noore","Synthetic Iris Presentation Attack using iDCGAN","International Joint Conference on Biometrics 2017",,,,"cs.CV","http://arxiv.org/licenses/nonexclusive-distrib/1.0/","  Reliability and accuracy of iris biometric modality has prompted its
large-scale deployment for critical applications such as border control and
national ID projects. The extensive growth of iris recognition systems has
raised apprehensions about susceptibility of these systems to various attacks.
In the past, researchers have examined the impact of various iris presentation
attacks such as textured contact lenses and print attacks. In this research, we
present a novel presentation attack using deep learning based synthetic iris
generation. Utilizing the generative capability of deep convolutional
generative adversarial networks and iris quality metrics, we propose a new
framework, named as iDCGAN (iris deep convolutional generative adversarial
network) for generating realistic appearing synthetic iris images. We
demonstrate the effect of these synthetically generated iris images as
presentation attack on iris recognition by using a commercial system. The
state-of-the-art presentation attack detection framework, DESIST is utilized to
analyze if it can discriminate these synthetically generated iris images from
real images. The experimental results illustrate that mitigating the proposed
synthetic presentation attack is of paramount importance.
","[{""version"":""v1"",""created"":""Sun, 29 Oct 2017 05:19:49 GMT""}]","2017-10-31"
"1710.10566","Shiue Yuan Shiau","Shiue-Yuan Shiau, Ching-Hang Chien, Yia-Chung Chang, Monique Combescot","Coboson many-body formalism for atom-dimer scattering length","11 pages, 8 figures. Published in Annals of Physics",,"10.1016/j.aop.2018.11.026",,"cond-mat.quant-gas","http://arxiv.org/licenses/nonexclusive-distrib/1.0/","  We use the composite boson (coboson) many-body formalism to tackle scattering
lengths for cold fermionic atoms. We show that bound dimers can be taken as
elementary entities provided that fermion exchanges between them are treated
exactly, as can be done through the coboson formalism. This alternative tool
extended to cold atom physics not only makes transparent many-body processes
through Shiva diagrams specific to cobosons, but also simplifies calculations.
Indeed, the integral equation we derive for the atom-dimer scattering length
and solve by restricting the dimer relative motion to the ground state, gives
values in remarkable agreement with the exact scattering length values for all
fermion mass ratios. This remarkable agreement also holds true for the
dimer-dimer scattering length, except for equal fermion masses where our
restricted procedure gives a value slightly larger than the accepted one
($0.64a_d$ instead of $0.60a_d$). All this proves that the scattering of a
cold-atom dimer with an atom or another dimer is essentially controlled by the
dimer relative-motion ground state, a physical result not obvious at first.
","[{""version"":""v1"",""created"":""Sun, 29 Oct 2017 05:37:11 GMT""},{""version"":""v2"",""created"":""Sun, 9 Dec 2018 03:19:17 GMT""}]","2018-12-11"
"1710.10567","Aurelia Chenu","Shiue-Yuan Shiau, Aur\'elia Chenu, Monique Combescot","Composite boson signature in the interference pattern of atomic dimer
  condensates","10+7 pp, 3 figures. v2: version accepted for publication in New J.
  Phys","New J. Phys. 21, 043041 (2019)","10.1088/1367-2630/ab0cc6",,"cond-mat.quant-gas quant-ph","http://arxiv.org/licenses/nonexclusive-distrib/1.0/","  We predict the existence of high frequency modes in the interference pattern
of two condensates made of fermionic-atom dimers. These modes, which result
from fermion exchanges between condensates, constitute a striking signature of
the dimer composite nature. From the 2-coboson spatial correlation function,
that we derive analytically, and the Shiva diagrams that visualize many-body
effects specific to composite bosons, we identify the physical origin of these
high frequency modes and determine the conditions to see them experimentally by
using bound fermionic-atom pairs trapped on optical lattice sites. The dimer
granularity which appears in these modes comes from Pauli blocking that
prevents two dimers to be located at the same lattice site.
","[{""version"":""v1"",""created"":""Sun, 29 Oct 2017 05:52:12 GMT""},{""version"":""v2"",""created"":""Wed, 6 Mar 2019 02:46:54 GMT""}]","2022-01-11"
"1710.10568","Jianfei Chen","Jianfei Chen, Jun Zhu and Le Song","Stochastic Training of Graph Convolutional Networks with Variance
  Reduction",,,,,"stat.ML cs.LG","http://arxiv.org/licenses/nonexclusive-distrib/1.0/","  Graph convolutional networks (GCNs) are powerful deep neural networks for
graph-structured data. However, GCN computes the representation of a node
recursively from its neighbors, making the receptive field size grow
exponentially with the number of layers. Previous attempts on reducing the
receptive field size by subsampling neighbors do not have a convergence
guarantee, and their receptive field size per node is still in the order of
hundreds. In this paper, we develop control variate based algorithms which
allow sampling an arbitrarily small neighbor size. Furthermore, we prove new
theoretical guarantee for our algorithms to converge to a local optimum of GCN.
Empirical results show that our algorithms enjoy a similar convergence with the
exact algorithm using only two neighbors per node. The runtime of our
algorithms on a large Reddit dataset is only one seventh of previous neighbor
sampling algorithms.
","[{""version"":""v1"",""created"":""Sun, 29 Oct 2017 06:14:00 GMT""},{""version"":""v2"",""created"":""Fri, 23 Feb 2018 12:55:08 GMT""},{""version"":""v3"",""created"":""Thu, 1 Mar 2018 15:23:22 GMT""}]","2018-03-02"
"1710.10569","Linlin Fei","Linlin Fei, K. H. Luo, Chuandong Lin, Qing Li","Modeling incompressible thermal flows using a central-moment-based
  lattice Boltzmann method",,"Int. J. Heat Mass Transfer 120, 624 (2018)","10.1016/j.ijheatmasstransfer.2017.12.052",,"physics.comp-ph","http://arxiv.org/licenses/nonexclusive-distrib/1.0/","  In this paper, a central-moment-based lattice Boltzmann (CLB) method for
incompressible thermal flows is proposed. In the method, the incompressible
Navier-Stokes equations and the convection-diffusion equation for the
temperature field are sloved separately by two different CLB equations. Through
the Chapman-Enskog analysis, the macroscopic governing equations for
incompressible thermal flows can be reproduced. For the flow field, the tedious
implementation for CLB method is simplified by using the shift matrix with a
simplified central-moment set, and the consistent forcing scheme is adopted to
incorporate forcing effects. Compared with several D2Q5
multiple-relaxation-time (MRT) lattice Boltzmann methods for the temperature
equation, the proposed method is shown to be better Galilean invariant through
measuring the thermal diffusivities on a moving reference frame. Thus a higher
Mach number can be used for convection flows, which decreases the computational
load significantly. Numerical simulations for several typical problems confirm
the accuracy, efficiency, and stability of the present method. The grid
convergence tests indicate that the proposed CLB method for incompressible
thermal flows is of second-order accuracy in space.
","[{""version"":""v1"",""created"":""Sun, 29 Oct 2017 06:58:33 GMT""}]","2017-12-21"
"1710.10570","Saiprasad Koturwar","Saiprasad Koturwar, Shabbir Merchant","Weight Initialization of Deep Neural Networks(DNNs) using Data
  Statistics","The work is currently under progress",,,,"cs.LG stat.ML","http://arxiv.org/licenses/nonexclusive-distrib/1.0/","  Deep neural networks (DNNs) form the backbone of almost every
state-of-the-art technique in the fields such as computer vision, speech
processing, and text analysis. The recent advances in computational technology
have made the use of DNNs more practical. Despite the overwhelming performances
by DNN and the advances in computational technology, it is seen that very few
researchers try to train their models from the scratch. Training of DNNs still
remains a difficult and tedious job. The main challenges that researchers face
during training of DNNs are the vanishing/exploding gradient problem and the
highly non-convex nature of the objective function which has up to million
variables. The approaches suggested in He and Xavier solve the vanishing
gradient problem by providing a sophisticated initialization technique. These
approaches have been quite effective and have achieved good results on standard
datasets, but these same approaches do not work very well on more practical
datasets. We think the reason for this is not making use of data statistics for
initializing the network weights. Optimizing such a high dimensional loss
function requires careful initialization of network weights. In this work, we
propose a data dependent initialization and analyze its performance against the
standard initialization techniques such as He and Xavier. We performed our
experiments on some practical datasets and the results show our algorithm's
superior classification accuracy.
","[{""version"":""v1"",""created"":""Sun, 29 Oct 2017 07:23:19 GMT""},{""version"":""v2"",""created"":""Sat, 17 Mar 2018 08:25:20 GMT""}]","2018-03-20"
"1710.10571","Aman Sinha","Aman Sinha, Hongseok Namkoong, Riccardo Volpi, and John Duchi","Certifying Some Distributional Robustness with Principled Adversarial
  Training","ICLR 2018: https://openreview.net/forum?id=Hk6kPgZA-",,,,"stat.ML cs.LG","http://arxiv.org/licenses/nonexclusive-distrib/1.0/","  Neural networks are vulnerable to adversarial examples and researchers have
proposed many heuristic attack and defense mechanisms. We address this problem
through the principled lens of distributionally robust optimization, which
guarantees performance under adversarial input perturbations. By considering a
Lagrangian penalty formulation of perturbing the underlying data distribution
in a Wasserstein ball, we provide a training procedure that augments model
parameter updates with worst-case perturbations of training data. For smooth
losses, our procedure provably achieves moderate levels of robustness with
little computational or statistical cost relative to empirical risk
minimization. Furthermore, our statistical guarantees allow us to efficiently
certify robustness for the population loss. For imperceptible perturbations,
our method matches or outperforms heuristic approaches.
","[{""version"":""v1"",""created"":""Sun, 29 Oct 2017 07:27:57 GMT""},{""version"":""v2"",""created"":""Thu, 30 Nov 2017 18:01:49 GMT""},{""version"":""v3"",""created"":""Tue, 9 Jan 2018 20:20:25 GMT""},{""version"":""v4"",""created"":""Tue, 1 May 2018 05:52:13 GMT""},{""version"":""v5"",""created"":""Fri, 1 May 2020 07:29:34 GMT""}]","2020-05-04"
"1710.10572","Thomas Basile","Thomas Basile","A note on rectangular partially massless fields","31 pages, 4 figures; v2: typos corrected and references added",,,,"hep-th","http://arxiv.org/licenses/nonexclusive-distrib/1.0/","  We study a class of non-unitary so(2,d) representations (for even values of
d), describing mixed-symmetry partially massless fields which constitute
natural candidates for defining higher-spin singletons of higher order. It is
shown that this class of so(2,d) modules obeys of natural generalisation of a
couple of defining properties of unitary higher-spin singletons. In particular,
we find out that upon restriction to the subalgebra so(2,d-1), these
representations branch onto a sum of modules describing partially massless
fields of various depths. Finally, their tensor product is worked out in the
particular case of d=4, where the appearance of a variety of mixed-symmetry
partially massless fields in this decomposition is observed.
","[{""version"":""v1"",""created"":""Sun, 29 Oct 2017 07:41:29 GMT""},{""version"":""v2"",""created"":""Tue, 15 May 2018 12:09:30 GMT""}]","2018-05-16"
"1710.10573","Du\v{s}an Repov\v{s}","Nikolaos S. Papageorgiou, Vicen\c{t}iu D. R\u{a}dulescu, and Du\v{s}an
  D. Repov\v{s}","Nonhomogeneous Hemivariational Inequalities with Indefinite Potential
  and Robin Boundary Condition",,"J. Optim. Theory Appl. 175:2 (2017), 293-323","10.1007/s10957-017-1173-5",,"math.AP","http://arxiv.org/licenses/nonexclusive-distrib/1.0/","  We consider a nonlinear, nonhomogeneous Robin problem with an indefinite
potential and a nonsmooth primitive in the reaction term. In fact, the
right-hand side of the problem (reaction term) is the Clarke subdifferential of
a locally Lipschitz integrand. We assume that asymptotically this term is
resonant with respect the principal eigenvalue (from the left). We prove the
existence of three nontrivial smooth solutions, two of constant sign and the
third nodal. We also show the existence of extremal constant sign solutions.
The tools come from nonsmooth critical point theory and from global
optimization (direct method).
","[{""version"":""v1"",""created"":""Sun, 29 Oct 2017 08:01:13 GMT""}]","2017-10-31"
"1710.10574","Zih-Wei Lin","Zih-Wei Lin, Tzu-Wei Sung, Hung-Yi Lee, Lin-Shan Lee","Personalized word representations Carrying Personalized Semantics
  Learned from Social Network Posts","Accepted by the 12th biannual IEEE workshop on Automatic Speech
  Recognition and Understanding (ASRU'17)",,,,"cs.CL","http://arxiv.org/licenses/nonexclusive-distrib/1.0/","  Distributed word representations have been shown to be very useful in various
natural language processing (NLP) application tasks. These word vectors learned
from huge corpora very often carry both semantic and syntactic information of
words. However, it is well known that each individual user has his own language
patterns because of different factors such as interested topics, friend groups,
social activities, wording habits, etc., which may imply some kind of
personalized semantics. With such personalized semantics, the same word may
imply slightly differently for different users. For example, the word
""Cappuccino"" may imply ""Leisure"", ""Joy"", ""Excellent"" for a user enjoying
coffee, by only a kind of drink for someone else. Such personalized semantics
of course cannot be carried by the standard universal word vectors trained with
huge corpora produced by many people. In this paper, we propose a framework to
train different personalized word vectors for different users based on the very
successful continuous skip-gram model using the social network data posted by
many individual users. In this framework, universal background word vectors are
first learned from the background corpora, and then adapted by the personalized
corpus for each individual user to learn the personalized word vectors. We use
two application tasks to evaluate the quality of the personalized word vectors
obtained in this way, the user prediction task and the sentence completion
task. These personalized word vectors were shown to carry some personalized
semantics and offer improved performance on these two evaluation tasks.
","[{""version"":""v1"",""created"":""Sun, 29 Oct 2017 08:04:24 GMT""}]","2017-10-31"
"1710.10575","Carlo A. Trugenberger","M. C. Diamantini, C. A. Trugenberger, I. Lukyanchuk and V. M. Vinokur","Gauge Topological Nature of the Superconductor-Insulator Transition",,,,,"cond-mat.supr-con cond-mat.str-el hep-th","http://arxiv.org/licenses/nonexclusive-distrib/1.0/","  It has long been believed that, at absolute zero, electrons can form only one
quantum coherent state, a superconductor. Yet, several two dimensional
superconducting systems were found to harbor the superinsulating state with
infinite resistance, a mirror image of superconductivity, and a metallic state
often referred to as Bose metal, characterized by finite longitudinal and
vanishing Hall resistances. The nature of these novel and mysterious quantum
coherent states is the subject of intense study.Here, we propose a topological
gauge description of the superconductor-insulator transition (SIT) that enables
us to identify the underlying mechanism of superinsulation as Polyakov's linear
confinement of Cooper pairs via instantons. We find a criterion defining
conditions for either a direct SIT or for the SIT via the intermediate Bose
metal and demonstrate that this Bose metal phase is a Mott topological
insulator in which the Cooper pair-vortex liquid is frozen by Aharonov-Bohm
interactions.
","[{""version"":""v1"",""created"":""Sun, 29 Oct 2017 08:22:39 GMT""},{""version"":""v2"",""created"":""Wed, 13 Jun 2018 16:08:01 GMT""}]","2018-06-14"
"1710.10576","Wenbiao Jiang","Wenbiao Jiang","The role of solid surface in bubble formation and detachment at a
  submerged orifice",,,,,"physics.chem-ph physics.flu-dyn","http://arxiv.org/licenses/nonexclusive-distrib/1.0/","  Bubble formation and detachment at a submerged orifice exists widely in both
daily life and academic research, and the influence of solid surface on bubble
formation and detachment has also been extensively investigated. For example,
it has been observed that the bubble on a hydrophobic surface is larger than
the one on a hydrophilic surface. However, this phenomenon is not sufficiently
explained in existing literature. To explain it, we redefine the capillary
force at the orifice edge and the adhesive force between bubble and solid.
Subsequently, we are able to establish an approach that quantitatively explains
the relation between bubble volume and surface wettability. In addition, we
also suggest an alternative mechanism of bubble pinch-off. In our opinion, the
formation of bubble neck during pinch-off may be due to three-phase equilibrium
at the orifice edge, and the breakup of bubble neck may result from the
stretching action of the upward buoyancy force and the downward capillary
force.
","[{""version"":""v1"",""created"":""Sun, 29 Oct 2017 08:23:20 GMT""},{""version"":""v2"",""created"":""Fri, 3 Nov 2017 20:49:56 GMT""}]","2017-11-07"
"1710.10577","Quanshi Zhang","Quanshi Zhang, Wenguan Wang, Song-Chun Zhu","Examining CNN Representations with respect to Dataset Bias","in AAAI 2018",,,,"cs.CV","http://arxiv.org/licenses/nonexclusive-distrib/1.0/","  Given a pre-trained CNN without any testing samples, this paper proposes a
simple yet effective method to diagnose feature representations of the CNN. We
aim to discover representation flaws caused by potential dataset bias. More
specifically, when the CNN is trained to estimate image attributes, we mine
latent relationships between representations of different attributes inside the
CNN. Then, we compare the mined attribute relationships with ground-truth
attribute relationships to discover the CNN's blind spots and failure modes due
to dataset bias. In fact, representation flaws caused by dataset bias cannot be
examined by conventional evaluation strategies based on testing images, because
testing images may also have a similar bias. Experiments have demonstrated the
effectiveness of our method.
","[{""version"":""v1"",""created"":""Sun, 29 Oct 2017 08:25:51 GMT""},{""version"":""v2"",""created"":""Wed, 22 Nov 2017 02:19:32 GMT""}]","2017-11-23"
