"1708.01115","Andreas H\""artel","Andreas H\""artel and David Richard and Thomas Speck","Three-body correlations and conditional forces in suspensions of active
  hard disks",,"Phys. Rev. E 97, 012606 (2018)","10.1103/PhysRevE.97.012606",,"cond-mat.soft","http://arxiv.org/licenses/nonexclusive-distrib/1.0/","  Self-propelled Brownian particles show rich out-of-equilibrium physics, for
instance, the motility-induced phase separation (MIPS). While decades of
studying the structure of liquids have established a deep understanding of
passive systems, not much is known about correlations in active suspensions. In
this work we derive an approximate analytic theory for three-body correlations
and forces in systems of active Brownian disks starting from the many-body
Smoluchowski equation. We use our theory to predict the conditional forces that
act on a tagged particle and their dependence on the propulsion speed of
self-propelled disks. We identify preferred directions of these forces in
relation to the direction of propulsion and the positions of the surrounding
particles. We further relate our theory to the effective swimming speed of the
active disks, which is relevant for the physics of MIPS. To test and validate
our theory, we additionally run particle-resolved computer simulations, for
which we explicitly calculate the three-body forces. In this context, we
discuss the modeling of active Brownian swimmers with nearly hard interaction
potentials. We find very good agreement between our simulations and numerical
solutions of our theory, especially for the nonequilibrium pair-distribution
function. For our analytical results, we carefully discuss their range of
validity in the context of the different levels of approximation we applied.
This discussion allows us to study the individual contribution of particles to
three-body forces and to the emerging structure. Thus, our work sheds light on
the collective behavior, provides the basis for further studies of correlations
in active suspensions, sheds new light onto the collective behavior, and makes
a step towards an emerging liquid state theory.
","[{""version"":""v1"",""created"":""Thu, 3 Aug 2017 12:26:56 GMT""},{""version"":""v2"",""created"":""Mon, 15 Jan 2018 15:59:32 GMT""}]","2018-01-17"
"1708.01116","Yongyao Li","Yongyao Li, Zhiwei Fan, Zhihuan Luo, Yan Liu, Hexiang He, Jiantao
  L\""u, Jianing Xie, Chunqing Huang, and Haishu Tan","Cross-symmetry breaking of two-component discrete dipolar matter-wave
  solitons","13 pages, 11 figures, 94 references","Front. Phys. 12(5), 124206 (2017)","10.1007/s11467-017-0702-x",,"nlin.PS","http://arxiv.org/licenses/nonexclusive-distrib/1.0/","  We study the spontaneous symmetry breaking of dipolar Bose--Einstein
condensates trapped in stacks of two-well systems, which may be effectively
built as one-dimensional trapping lattices sliced by a repelling laser sheet.
If the potential wells are sufficiently deep, the system is modeled by coupled
discrete Gross--Pitaevskii equations with nonlocal self- and cross-interaction
terms representing dipole--dipole interactions. When the dipoles are not
polarized perpendicular or parallel to the lattice, the cross-interaction is
asymmetric, replacing the familiar symmetric two-component solitons with a new
species of cross-symmetric or -asymmetric ones. The orientation of the dipole
moments and the interwell hopping rate strongly affect the shapes of the
discrete two-component solitons as well as the characteristics of the
cross-symmetry breaking and the associated phase transition. The sub- and
super-critical types of cross-symmetry breaking can be controlled by either the
hopping rate between the components or the total norm of the solitons. The
effect of the interplay between the contact nonlinearity and the dipole angle
on the cross-symmetry breaking is also discussed.
","[{""version"":""v1"",""created"":""Thu, 3 Aug 2017 12:32:49 GMT""}]","2017-08-04"
"1708.01117","Scientific Information Service CERN","M. Mulders (ed.), G. Zanderighi (ed.)","2014 European School of High-Energy Physics","4 lectures, 123 pages, published as CERN Yellow Report at this url:
  <https://e-publishing.cern.ch/index.php/CYR/issue/view/23>",,"10.5170/CERN-2016-003","CERN-2016-003","hep-ph","http://creativecommons.org/licenses/by/4.0/","  The European School of High-Energy Physics is intended to give young
physicists an introduction to the the- oretical aspects of recent advances in
elementary particle physics. These proceedings contain lecture notes on the
theory of quantum chromodynamics, Higgs physics, Flavour physics and CP
violation, and Supersymmetry.
","[{""version"":""v1"",""created"":""Thu, 3 Aug 2017 12:36:19 GMT""}]","2017-08-04"
"1708.01118","Scientific Information Service CERN","Bernhard Holzer (ed.) (CERN)","CAS - CERN Accelerator School: Plasma Wake Acceleration","15 lectures, 308 pages, published as CERN Yellow Report a this url:
  <https://e-publishing.cern.ch/index.php/CYR/issue/view/11>",,"10.5170/CERN-2016-001","CERN-2016-001","physics.acc-ph","http://creativecommons.org/licenses/by/4.0/","  These proceedings are of interest to staff and students in accelerator
laboratories, university departments and companies working in or having an
interest in the field of new acceleration techniques. Following introductory
lectures on plasma and laser physics, the course covers the different
components of a plasma wake accelerator and plasma beam systems. Topical
seminars and an overview about alternative new techniques like dielectric
accelerators are included. Lectures on the experimental studies and their
latest results, on diagnostic tools and state of the art wake acceleration
facilities, both present and planned, complement the theoretical part.
","[{""version"":""v1"",""created"":""Thu, 3 Aug 2017 12:37:49 GMT""}]","2017-08-04"
"1708.01119","Yoichi Takeda","Y. Takeda and S. UeNo","Towards Spectroscopically Detecting the Global Latitudinal Temperature
  Variation on the Solar Surface","28 pages, 12 figures, 1 table, accepted for publication in Solar
  Physics",,"10.1007/s11207-017-1144-x",,"astro-ph.SR","http://arxiv.org/licenses/nonexclusive-distrib/1.0/","  A very slight rotation-induced latitudinal temperature variation (presumably
on the order of several Kelvin) on the solar surface is theoretically expected.
While recent high-precision solar brightness observations reported its
detection, confirmation by an alternative approach using the strengths of
spectral lines is desirable, for which reducing the noise due to random
fluctuation caused by atmospheric inhomogeneity is critical. Towards this
difficult task, we carried out a pilot study of spectroscopically investigating
the relative variation of temperature (T) at a number of points in the solar
circumference region near to the limb (where latitude dependence should show up
if any exists) based on the equivalent widths (W) of 28 selected lines in the
5367--5393A and 6075--6100A regions. Our special attention was paid to i)
clarifying which kind of lines should be employed and ii) how much precision
would be accomplished in practice. We found that lines with strong
T-sensitivity (|log W/log T|) should be used and that very weak lines should be
avoided because they inevitably suffer large relative fluctuations (Delta_W/W).
Our analysis revealed that a precision of Delta_T/T ~ 0.003 (corresponding to
~15K) can be achieved at best by a spectral line with comparatively large |log
W/log T|, though this can possibly be further improved if other more suitable
lines are used. Accordingly, if many such favorable lines could be measured
with sub-% precision of Delta_W/W and by averaging the resulting Delta_T/T from
each line, the random noise would eventually be reduced down to <~1K and
detection of very subtle amount of global T-gradient might be possible.
","[{""version"":""v1"",""created"":""Thu, 3 Aug 2017 12:50:02 GMT""}]","2017-08-30"
"1708.01120","Eric Charron","R. Chamakhi, R. Puthumpally-Joseph, M. Telmini, and E. Charron","Extracting spectroscopic molecular parameters from short pulse
  photo-electron angular distributions","8 pages, 8 figures","The Journal of Chemical Physics 147, 144304 (2017)","10.1063/1.4998818",,"physics.chem-ph quant-ph","http://arxiv.org/licenses/nonexclusive-distrib/1.0/","  Using a quantum wave packet simulation including the nuclear and electronic
degrees of freedom, we investigate the femtosecond and picosecond energy- and
angle-resolved photoelectron spectra of the E($^1\Sigma_g^+$) electronic state
of Li$_2$. We find that the angular distributions of the emitted photoelectrons
depend strongly on the pulse duration in the regime of ultrashort laser pulses.
This effect is illustrated by the extraction of a time-dependent asymmetry
parameter whose variation with pulse duration can be explained by an incoherent
average over different ion rotational quantum numbers. We then derive for the
variation of the asymmetry parameter a simple analytical formula, which can be
used to extract the asymptotic CW asymmetry parameters of individual
transitions from measurements performed with ultra-short pulses.
","[{""version"":""v1"",""created"":""Thu, 3 Aug 2017 13:01:15 GMT""}]","2019-04-04"
"1708.01121","Antoine Jacquier Dr.","B. Horvath, A. Jacquier, C. Lacombe","Asymptotic behaviour of randomised fractional volatility models","23 pages, main assumptions relaxed, some typos corrected",,,,"math.PR","http://arxiv.org/licenses/nonexclusive-distrib/1.0/","  We study the asymptotic behaviour of a class of small-noise diffusions driven
by fractional Brownian motion, with random starting points. Different scalings
allow for different asymptotic properties of the process (small-time and tail
behaviours in particular). In order to do so, we extend some results on sample
path large deviations for such diffusions. As an application, we show how these
results characterise the small-time and tail estimates of the implied
volatility for rough volatility models, recently proposed in mathematical
finance.
","[{""version"":""v1"",""created"":""Thu, 3 Aug 2017 13:06:33 GMT""},{""version"":""v2"",""created"":""Tue, 5 Jun 2018 14:15:14 GMT""},{""version"":""v3"",""created"":""Thu, 20 Dec 2018 16:43:31 GMT""}]","2018-12-21"
"1708.01122","Jerri Nummenpalo","Jean Cardinal, Jerri Nummenpalo, Emo Welzl","Solving and Sampling with Many Solutions: Satisfiability and Other Hard
  Problems","18 pages, 1 figure",,,,"cs.DM","http://arxiv.org/licenses/nonexclusive-distrib/1.0/","  We investigate parameterizing hard combinatorial problems by the size of the
solution set compared to all solution candidates. Our main result is a uniform
sampling algorithm for satisfying assignments of 2-CNF formulas that runs in
expected time $O^*(\varepsilon^{-0.617})$ where $\varepsilon$ is the fraction
of assignments that are satisfying. This improves significantly over the
trivial sampling bound of expected $\Theta^*(\varepsilon^{-1})$, and on all
previous algorithms whenever $\varepsilon = \Omega(0.708^n)$. We also consider
algorithms for 3-SAT with an $\varepsilon$ fraction of satisfying assignments,
and prove that it can be solved in $O^*(\varepsilon^{-2.27})$ deterministic
time, and in $O^*(\varepsilon^{-0.936})$ randomized time. Finally, to further
demonstrate the applicability of this framework, we also explore how similar
techniques can be used for vertex cover problems.
","[{""version"":""v1"",""created"":""Thu, 3 Aug 2017 13:12:03 GMT""}]","2017-08-04"
"1708.01123","Oleg Skoromnik","O. D. Skoromnik and I. D. Feranchuk","Analytic approximation for eigenvalues of a class of $\mathcal{PT}$
  symmetric Hamiltonians","8 pages, 3 figures","Phys. Rev. A 96, 052102 (2017)","10.1103/PhysRevA.96.052102",,"quant-ph","http://arxiv.org/licenses/nonexclusive-distrib/1.0/","  An analytical approximation for the eigenvalues of $\mathcal{PT}$ symmetric
Hamiltonian $\mathsf{H} = -d^{2}/dx^{2} - (\mathrm{i}x)^{\epsilon+2}$,
$\epsilon > -1$ is developed via simple basis sets of harmonic-oscillator wave
functions with variable frequencies and equilibrium positions. We demonstrate
that our approximation provides high accuracy for any given energy level for
all values of $\epsilon > -1$.
","[{""version"":""v1"",""created"":""Thu, 3 Aug 2017 13:15:50 GMT""},{""version"":""v2"",""created"":""Thu, 21 Sep 2017 11:53:44 GMT""}]","2017-11-08"
"1708.01124","Guido Menichetti","G. Bevilacqua and G. Grosso and G. Menichetti and G. Pastori
  Parravicini","Thermoelectric efficiency of nanoscale devices in the linear regime","33 pages, 10 figures, Published","Phys. Rev. B 94, 245419, 2016","10.1103/PhysRevB.94.245419",,"cond-mat.mes-hall","http://arxiv.org/licenses/nonexclusive-distrib/1.0/","  We study quantum transport through two-terminal nanoscale devices in contact
with two particle reservoirs at different temperatures and chemical potentials.
We discuss the general expressions controlling the electric charge current,
heat currents and the efficiency of energy transmutation in steady conditions
in the linear regime.
  With focus in the parameter domain where the electron system acts as a
power-generator, we elaborate workable expressions for optimal efficiency and
thermoelectric pameters of nanoscale devices. The general concepts are set at
work in the paradigmatic cases of Lorentzian resonances and antiresonances, and
the encompassing Fano transmission function: the treatments are fully analytic,
in terms of the trigamma functions and Bernoulli numbers. From the general
curves here reported describing transport through the above model transmission
functions, useful guidelines for optimal efficiency and thermopower can be
inferred for engineering nanoscale devices in energy regions where they show
similar transmission functions.
","[{""version"":""v1"",""created"":""Thu, 3 Aug 2017 13:16:41 GMT""}]","2017-08-04"
"1708.01125","Rajvi Shah","Rajvi Shah, Visesh Chari, P J Narayanan","A Unified View-Graph Selection Framework for Structure from Motion","Submitted to CVPR 2018",,,,"cs.CV","http://arxiv.org/licenses/nonexclusive-distrib/1.0/","  View-graph is an essential input to large-scale structure from motion (SfM)
pipelines. Accuracy and efficiency of large-scale SfM is crucially dependent on
the input view-graph. Inconsistent or inaccurate edges can lead to inferior or
wrong reconstruction. Most SfM methods remove `undesirable' images and pairs
using several, fixed heuristic criteria, and propose tailor-made solutions to
achieve specific reconstruction objectives such as efficiency, accuracy, or
disambiguation. In contrast to these disparate solutions, we propose a single
optimization framework that can be used to achieve these different
reconstruction objectives with task-specific cost modeling. We also construct a
very efficient network-flow based formulation for its approximate solution. The
abstraction brought on by this selection mechanism separates the challenges
specific to datasets and reconstruction objectives from the standard SfM
pipeline and improves its generalization. This paper demonstrates the
application of the proposed view-graph framework with standard SfM pipeline for
two particular use-cases, (i) accurate and ghost-free reconstructions of highly
ambiguous datasets using costs based on disambiguation priors, and (ii)
accurate and efficient reconstruction of large-scale Internet datasets using
costs based on commonly used priors.
","[{""version"":""v1"",""created"":""Thu, 3 Aug 2017 13:17:01 GMT""},{""version"":""v2"",""created"":""Mon, 4 Dec 2017 11:56:25 GMT""}]","2017-12-05"
"1708.01126","Andres Conca","Andres Conca, Alessia Niesen, G\""unter Reiss, and Burkard Hillebrands","Evolution of the interfacial perpendicular magnetic anisotropy constant
  of the Co$_2$FeAl/MgO interface upon annealing","6 pages, 5 figures",,"10.1088/1361-6463/aab5d8",,"cond-mat.mtrl-sci","http://arxiv.org/licenses/nonexclusive-distrib/1.0/","  We investigate thickness series of films of the Heusler alloy Co$_2$FeAl in
order to study the effect of annealing on the interface with a MgO layer and on
the bulk magnetic properties. Our results reveal that while the perpendicular
interface anisotropy constant $K^{\perp}_{\rm S}$ is zero for the as-deposited
samples, its value increases with annealing up to a value of $1.14\, \pm
\,0.07$~mJ/m$^2$ for the series annealed at 320$^{\rm o}$C and of $2.07\, \pm
\,0.7$~mJ/m$^2$ for the 450$^{\rm o}$C annealed series owing to a strong
modification of the interface during the thermal treatment. This large value
ensures a stabilization of a perpendicular magnetization orientation for a
thickness below 1.7~nm. The data additionally shows that the in-plane biaxial
anisotropy constant has a different evolution with thickness in as-deposited
and annealed systems. The Gilbert damping parameter $\alpha$ shows minima for
all series for a thickness of 40~nm and an absolute minimum value of
$2.8\pm0.1\cdot10^{-3}$. The thickness dependence is explained in terms of an
inhomogenous magnetization state generated by the interplay between the
different anisotropies of the system and by crystalline disorder.
","[{""version"":""v1"",""created"":""Thu, 3 Aug 2017 13:26:07 GMT""},{""version"":""v2"",""created"":""Tue, 23 Jan 2018 11:21:03 GMT""}]","2018-04-18"
"1708.01127","Dusa McDuff","Dusa McDuff","Constructing the virtual fundamental class of a Kuranishi atlas","71 pages, 5 figures; v 3 is revised after a referee report","Algebr. Geom. Topol. 19 (2019) 151-238","10.2140/agt.2019.19.151",,"math.SG math.CT","http://arxiv.org/licenses/nonexclusive-distrib/1.0/","  Consider a space $X$, such as a compact space of $J$-holomorphic stable maps,
that is the zero set of a Kuranishi atlas. This note explains how to define the
virtual fundamental class of $X$ by representing $X$ via the zero set of a map
$S_M: M\to E$, where $E$ is a finite dimensional vector space and the domain
$M$ is an oriented, weighted branched topological manifold. Moreover, $S_M$ is
equivariant under the action of the global isotropy group $\Gamma$ on $M$ and
$E$. This tuple $(M,E, \Gamma, S_M)$ together with a homeomorphism
$S_M^{-1}(0)/\Gamma \to X$ forms a single finite dimensional model (or chart)
for $X$. The construction assumes only that the atlas satisfies a topological
version of the index condition that can be obtained from a standard, rather
than a smooth, gluing theorem. However if $X$ is presented as the zero set of
an sc-Fredholm operator on a strong polyfold bundle, we outline a much more
direct construction of the branched manifold $M$ that uses an sc-smooth
partition of unity.
","[{""version"":""v1"",""created"":""Thu, 3 Aug 2017 13:26:09 GMT""},{""version"":""v2"",""created"":""Fri, 6 Oct 2017 13:09:04 GMT""},{""version"":""v3"",""created"":""Wed, 5 Sep 2018 19:44:28 GMT""}]","2019-02-13"
"1708.01128","Yoichi Takeda","Y. Takeda, S. Kawanomoto, N. Ohishi","Fourier analysis of He 4471/Mg 4481 line profiles for separating
  rotational velocity and axial inclination in rapidly-rotating B-type stars","18 pages, 8 figures, 2 tables, accepted for publication in Mon. Not.
  Roy. Astron. Soc",,"10.1093/mnras/stx2021",,"astro-ph.SR","http://arxiv.org/licenses/nonexclusive-distrib/1.0/","  While the effect of rotation on spectral lines is complicated in
rapidly-rotating stars because of the appreciable gravity-darkening effect
differing from line to line, it is possible to make use of this line-dependent
complexity to separately determine the equatorial rotation velocity (ve) and
the inclination angle (i) of rotational axis. Although line-widths of spectral
lines were traditionally used for this aim, we tried in this study to apply the
Fourier method, which utilizes the unambiguously determinable first-zero
frequency (sigma1) in the Fourier transform of line profile. Equipped with this
technique, we analyzed the profiles of HeI 4471 and MgII 4481 lines of six
rapidly-rotating (vesini~150-300km/s) late B-type stars, while comparing them
with the theoretical profiles simulated on a grid of models computed for
various combination of (ve, i). According to our calculation, sigma1 tends to
be larger than the classical value for given vesini. This excess progressively
grows with an increase in ve, and is larger for the He line than the Mg line,
which leads to sigma1He > sigma1Mg. It was shown that ve and i are separately
determinable from the intersection of two loci (sets of solutions reproducing
the observed sigma1 for each line) on the ve vs. i plane. Yet, line profiles
alone are not sufficient for their unique discrimination, for which photometric
information (such as colors) needs to be simultaneously employed.
","[{""version"":""v1"",""created"":""Thu, 3 Aug 2017 13:26:22 GMT""}]","2017-09-13"
"1708.01129","Yan-Qing Ma","Peng Zhang, Yan-Qing Ma, Qian Chen, Kuang-Ta Chao","Analytical calculation for the gluon fragmentation into spin-triplet
  S-wave quarkonium","18 pages, 6 figures","Phys. Rev. D 96, 094016 (2017)","10.1103/PhysRevD.96.094016",,"hep-ph","http://arxiv.org/licenses/nonexclusive-distrib/1.0/","  Fragmentation is the dominant mechanism for hadron production with high
transverse momentum. For spin-triplet S-wave heavy quarkonium production,
contribution of gluon fragmenting to color-singlet channel has been numerically
calculated since 1993. However, there is still no analytic expression available
up to now because of its complexity. In this paper, we calculate both
polarization-summed and polarized fragmentation functions of gluon fragmenting
to a heavy quark-antiquark pair with quantum number $^3S_1^{[1]}$. Our
calculations are performed in two different frameworks. One is the widely used
nonrelativistic QCD factorization, and the other is the newly proposed soft
gluon factorization. In either case, we calculate at both leading order and
next-to-leading order in velocity expansion. All of our final results are
presented in terms of compact analytic expressions.
","[{""version"":""v1"",""created"":""Thu, 3 Aug 2017 13:29:02 GMT""}]","2017-11-29"
"1708.01130","Thierry Lecroq","Jacqueline W. Daykin and Richard Groult and Yannick Guesnet and
  Thierry Lecroq and Arnaud Lefebvre and Martine L\'eonard and Laurent Mouchard
  and \'Elise Prieur-Gaston and Bruce Watson","Efficient pattern matching in degenerate strings with the
  Burrows-Wheeler transform","7 pages, 1 figure",,,,"cs.DS","http://arxiv.org/licenses/nonexclusive-distrib/1.0/","  A degenerate or indeterminate string on an alphabet $\Sigma$ is a sequence of
non-empty subsets of $\Sigma$. Given a degenerate string $t$ of length $n$, we
present a new method based on the Burrows--Wheeler transform for searching for
a degenerate pattern of length $m$ in $t$ running in $O(mn)$ time on a constant
size alphabet $\Sigma$. Furthermore, it is a hybrid pattern-matching technique
that works on both regular and degenerate strings. A degenerate string is said
to be conservative if its number of non-solid letters is upper-bounded by a
fixed positive constant $q$; in this case we show that the search complexity
time is $O(qm^2)$. Experimental results show that our method performs well in
practice.
","[{""version"":""v1"",""created"":""Thu, 3 Aug 2017 13:30:41 GMT""}]","2017-08-04"
"1708.01132","Alexandre Zenchuk","E.B. Fel'dman and A.I. Zenchuk","Coherence evolution and transfer supplemented by state-restoring","18 pages","Journal of Experimental and Theoretical Physics, 2017, Vol. 125,
  No. 6, pp. 1042-1050","10.1134/S1063776117120044",,"quant-ph","http://arxiv.org/licenses/nonexclusive-distrib/1.0/","  The evolution of quantum coherences comes with a set of conservation laws
provided that the Hamiltonian governing this evolution conserves the
spin-excitation number. At that, coherences do not intertwist during the
evolution. Using the transmission line and the receiver in the initial ground
state we can transfer the coherences to the receiver without interaction
between them, { although the matrix elements contributing to each particular
coherence intertwist in the receiver's state. } Therefore we propose a tool
based on the unitary transformation at the receiver side to { untwist these
elements and thus} restore (at least partially) the structure of the sender's
initial density matrix. A communication line with two-qubit sender and receiver
is considered as an example of implementation of this technique.
","[{""version"":""v1"",""created"":""Thu, 3 Aug 2017 13:40:59 GMT""}]","2018-04-04"
