"1708.00921","Mingzhe Chen","Mingzhe Chen, Walid Saad, and Changchuan Yin","Echo State Learning for Wireless Virtual Reality Resource Allocation in
  UAV-enabled LTE-U Networks",,,,,"cs.IT math.IT","http://arxiv.org/licenses/nonexclusive-distrib/1.0/","  In this paper, the problem of resource management is studied for a network of
wireless virtual reality (VR) users communicating using an unmanned aerial
vehicle (UAV)-enabled LTE-U network. In the studied model, the UAVs act as VR
control centers that collect tracking information from the VR users over the
wireless uplink and, then, send the constructed VR images to the VR users over
an LTE-U downlink. Therefore, resource allocation in such a UAV-enabled LTE-U
network must jointly consider the uplink and downlink links over both licensed
and unlicensed bands. In such a VR setting, the UAVs can dynamically adjust the
image quality and format of each VR image to change the data size of each VR
image, then meet the delay requirement. Therefore, resource allocation must
also take into account the image quality and format. This VR-centric resource
allocation problem is formulated as a noncooperative game that enables a joint
allocation of licensed and unlicensed spectrum bands, as well as a dynamic
adaptation of VR image quality and format. To solve this game, a learning
algorithm based on the machine learning tools of echo state networks (ESNs)
with leaky integrator neurons is proposed. Unlike conventional ESN based
learning algorithms that are suitable for discrete-time systems, the proposed
algorithm can dynamically adjust the update speed of the ESN's state and,
hence, it can enable the UAVs to learn the continuous dynamics of their
associated VR users. Simulation results show that the proposed algorithm
achieves up to 14% and 27.1% gains in terms of total VR QoE for all users
compared to Q-learning using LTE-U and Q-learning using LTE.
","[{""version"":""v1"",""created"":""Wed, 2 Aug 2017 20:28:41 GMT""}]","2017-08-04"
"1708.00922","Siyuan Dong","Siyuan Dong, Wenzhen Yuan, Edward Adelson","Improved GelSight Tactile Sensor for Measuring Geometry and Slip","IEEE/RSJ International Conference on Intelligent Robots and Systems",,"10.1109/IROS.2017.8202149",,"cs.RO","http://arxiv.org/licenses/nonexclusive-distrib/1.0/","  A GelSight sensor uses an elastomeric slab covered with a reflective membrane
to measure tactile signals. It measures the 3D geometry and contact force
information with high spacial resolution, and successfully helped many
challenging robot tasks. A previous sensor, based on a semi-specular membrane,
produces high resolution but with limited geometry accuracy. In this paper, we
describe a new design of GelSight for robot gripper, using a Lambertian
membrane and new illumination system, which gives greatly improved geometric
accuracy while retaining the compact size. We demonstrate its use in measuring
surface normals and reconstructing height maps using photometric stereo. We
also use it for the task of slip detection, using a combination of information
about relative motions on the membrane surface and the shear distortions. Using
a robotic arm and a set of 37 everyday objects with varied properties, we find
that the sensor can detect translational and rotational slip in general cases,
and can be used to improve the stability of the grasp.
","[{""version"":""v1"",""created"":""Wed, 2 Aug 2017 20:32:17 GMT""}]","2018-03-01"
"1708.00923","Giulio Schimperna","Michela Eleuteri, Stefania Gatti, Giulio Schimperna","Regularity and long-time behavior for a thermodynamically consistent
  model for complex fluids in two space dimensions",,,,,"math.AP","http://arxiv.org/licenses/nonexclusive-distrib/1.0/","  We consider a thermodynamically consistent model for the evolution of
thermally conducting two-phase incompressible fluids. Complementing previous
results, we prove additional regularity properties of solutions in the case
when the evolution takes place in the two-dimensional flat torus with periodic
boundary conditions. Thanks to improved regularity, we can also prove
uniqueness and characterize the long-time behavior of trajectories showing
existence of the global attractor in a suitable phase-space.
","[{""version"":""v1"",""created"":""Wed, 2 Aug 2017 20:39:25 GMT""}]","2017-08-04"
"1708.00925","Wujun Zhang","Ricardo H. Nochetto, Shawn W. Walker, Wujun Zhang","The Ericksen Model of Liquid Crystals with Colloidal and Electric
  Effects","53 pages, 29 figures",,"10.1016/j.jcp.2017.09.035",,"math.NA","http://arxiv.org/licenses/nonexclusive-distrib/1.0/","  We present a robust discretization of the Ericksen model of liquid crystals
with variable degree of orientation coupled with colloidal effects and electric
fields. The total energy consists of the Ericksen energy, a weak anchoring (or
penalized Dirichlet) energy to model colloids, and an electrical energy for a
given electric field. We describe our special discretization of the total
energy along with a method to compute minimizers via a discrete quasi-gradient
flow algorithm which has a strictly monotone energy decreasing property.
Numerical experiments are given in two and three dimensions to illustrate that
the method is able to capture non-trivial defect patterns, such as the Saturn
ring defect. We conclude with a rigorous proof of the Gamma-convergence of our
discrete energy to the continuous energy.
","[{""version"":""v1"",""created"":""Wed, 2 Aug 2017 20:43:36 GMT""}]","2017-11-22"
"1708.00926","L. A. Arias-Hernandez","G. Valencia-Ortega and L. A. Arias-Hernandez","Thermodynamic properties of diatomic molecules systems under anharmonic
  Eckart potential","12 pages, 8 figures, 1 table, submitted to the Int. J. Quantum. Chem","Int J Quantum Chem. 2018;e25589","10.1002/qua.25589",,"physics.chem-ph","http://arxiv.org/licenses/nonexclusive-distrib/1.0/","  Due to one of the most representative contributions to the energy in diatomic
molecules being the vibrational, we consider the generalized Morse potential
(GMP) as one of the typical potential of interaction for one-dimensional
microscopic systems, which describes local anharmonic effects. From Eckart
potential (EP) model, it is possible to find a connection with the GMP model,
as well as obtain the analytical expression for the energy spectrum because it
is based on $S\,O\left(2,1\right)$ algebras. In this work we find the
macroscopic properties such as vibrational mean energy $U$, specific heat $C$,
Helmholtz free energy $F$ and entropy $S$ for a heteronuclear diatomic system,
along with the exact partition function and its approximation for the high
temperature region. Finally, we make a comparison between the graphs of some
thermodynamic functions obtained with the GMP and the Morse potential (MP) for
$H\,Cl$ molecules.
","[{""version"":""v1"",""created"":""Wed, 2 Aug 2017 20:51:48 GMT""}]","2019-01-03"
"1708.00927","Steve Elliott","S.R. Elliott and H. Ejiri","Solar Neutrinos as Background to Neutrinoless Double-beta Decay
  Experiments","proceedings submission for MEDEX 2017",,"10.1063/1.5007633","LA-UR-17-26441","nucl-ex physics.ins-det","http://arxiv.org/licenses/nonexclusive-distrib/1.0/","  Solar neutrinos interact within double-beta decay (\BB) detectors and
contribute to backgrounds for \BB\ experiments. Background contributions due to
charge-current solar neutrino interactions with \BB\ nuclei of $^{76}$Ge,
$^{82}$Se, $^{100}$Mo, $^{130}$Te, $^{136}$Xe, and $^{150}$Nd are evaluated.
They are shown to be significant for future high-sensitivity \BB\ experiments
that may search for Majorana neutrino masses in the inverted-hierarchy mass
region. The impact of solar neutrino backgrounds and their reduction are
discussed for future \BB\ experiments.
","[{""version"":""v1"",""created"":""Wed, 2 Aug 2017 20:57:27 GMT""}]","2017-10-25"
"1708.00928","Angelos Koutsianas","Angelos Koutsianas","On the solutions of the Diophantine equation $(x-d)^2+x^2+(x+d)^2=y^n$
  for $d$ a prime power","We have completely changed the methodology compare to the first
  version. For fix $d$ the new approach has already been used by Vandita Patel
  and the author in an earlier paper https://doi.org/10.1142/S1793042118501646
  and we extend it when $d$ is an arbitrary prime power",,,,"math.NT","http://arxiv.org/licenses/nonexclusive-distrib/1.0/","  In this paper, we determine the primitive solutions of the Diophantine
equation $(x-d)^2+x^2+(x+d)^2=y^n$ when $n\geq 2$ and $d=p^b$, $p$ a prime and
$p\leq 10^4$. The main ingredients are the characterization of primitive
divisors on Lehmer sequences and the development of an algorithmic method of
proving the non-existence of integer solutions of the equation $f(x)=a^b$,
where $f(x)\in\mathbb Z[x]$, $a$ a positive integer and $b$ an arbitrary
positive integer.
","[{""version"":""v1"",""created"":""Wed, 2 Aug 2017 21:00:51 GMT""},{""version"":""v2"",""created"":""Tue, 27 Mar 2018 20:04:39 GMT""},{""version"":""v3"",""created"":""Mon, 5 Nov 2018 05:08:11 GMT""},{""version"":""v4"",""created"":""Wed, 15 May 2019 09:39:14 GMT""}]","2019-05-16"
"1708.00929","Kyle Oman","Kyle A. Oman, Else Starkenburg, Julio F. Navarro","The ""Building Blocks"" of Stellar Halos","7 pages, 3 figures, published in the proceedings of ""On the Origin
  (and Evolution) of Baryonic Galaxy Halos"", Puerto Ayora, Ecuador, March 13-17
  2017, Eds. Duncan A. Forbes and Ericson D. Lopez","Galaxies, 5, 33 (2017)","10.3390/galaxies5030033",,"astro-ph.GA","http://creativecommons.org/licenses/by/4.0/","  The stellar halos of galaxies encode their accretion histories. In
particular, the median metallicity of a halo is determined primarily by the
mass of the most massive accreted object. We use hydrodynamical cosmological
simulations from the APOSTLE project to study the connection between the
stellar mass, the metallicity distribution, and the stellar age distribution of
a halo and the identity of its most massive progenitor. We find that the
stellar populations in an accreted halo typically resemble the old stellar
populations in a present-day dwarf galaxy with a stellar mass $\sim 0.2-0.5$
dex greater than that of the stellar halo. This suggest that had they not been
accreted, the primary progenitors of stellar halos would have evolved to
resemble typical nearby dwarf irregulars.
","[{""version"":""v1"",""created"":""Wed, 2 Aug 2017 21:04:29 GMT""}]","2017-08-04"
"1708.00930","Paolo Bestagini","Mauro Barni, Luca Bondi, Nicol\`o Bonettini, Paolo Bestagini, Andrea
  Costanzo, Marco Maggini, Benedetta Tondi, Stefano Tubaro","Aligned and Non-Aligned Double JPEG Detection Using Convolutional Neural
  Networks","Submitted to Journal of Visual Communication and Image Representation
  (first submission: March 20, 2017; second submission: August 2, 2017)",,"10.1016/j.jvcir.2017.09.003",,"cs.CR cs.MM","http://arxiv.org/licenses/nonexclusive-distrib/1.0/","  Due to the wide diffusion of JPEG coding standard, the image forensic
community has devoted significant attention to the development of double JPEG
(DJPEG) compression detectors through the years. The ability of detecting
whether an image has been compressed twice provides paramount information
toward image authenticity assessment. Given the trend recently gained by
convolutional neural networks (CNN) in many computer vision tasks, in this
paper we propose to use CNNs for aligned and non-aligned double JPEG
compression detection. In particular, we explore the capability of CNNs to
capture DJPEG artifacts directly from images. Results show that the proposed
CNN-based detectors achieve good performance even with small size images (i.e.,
64x64), outperforming state-of-the-art solutions, especially in the non-aligned
case. Besides, good results are also achieved in the commonly-recognized
challenging case in which the first quality factor is larger than the second
one.
","[{""version"":""v1"",""created"":""Wed, 2 Aug 2017 21:11:27 GMT""}]","2017-10-11"
"1708.00931","Sanchit Alekh","Abhinav Gupta, Agrim Khanna, Anmol Jagetia, Devansh Sharma, Sanchit
  Alekh, Vaibhav Choudhary","Combining Keystroke Dynamics and Face Recognition for User Verification",,,"10.1109/CSE.2015.37",,"cs.HC cs.CV","http://arxiv.org/licenses/nonexclusive-distrib/1.0/","  The massive explosion and ubiquity of computing devices and the outreach of
the web have been the most defining events of the century so far. As more and
more people gain access to the internet, traditional know-something and
have-something authentication methods such as PINs and passwords are proving to
be insufficient for prohibiting unauthorized access to increasingly personal
data on the web. Therefore, the need of the hour is a user-verification system
that is not only more reliable and secure, but also unobtrusive and
minimalistic. Keystroke Dynamics is a novel Biometric Technique; it is not only
unobtrusive, but also transparent and inexpensive. The fusion of keystroke
dynamics and Face Recognition engenders the most desirable characteristics of a
verification system. Our implementation uses Hidden Markov Models (HMM) for
modelling the Keystroke Dynamics, with the help of two widely used Feature
Vectors: Keypress Latency and Keypress Duration. On the other hand, Face
Recognition makes use of the traditional Eigenfaces approach.The results show
that the system has a high precision, with a False Acceptance Rate of 5.4% and
a False Rejection Rate of 9.2%. Moreover, it is also future-proof, as the
hardware requirements, i.e. camera and keyboard (physical or on-screen), have
become an indispensable part of modern computing.
","[{""version"":""v1"",""created"":""Wed, 2 Aug 2017 21:13:59 GMT""}]","2017-08-04"
"1708.00932","Angel Moreno","Maud Formanek, Angel J. Moreno","Effects of Precursor Topology and Synthesis under Crowding Conditions on
  the Structure of Single-Chain Polymer Nanoparticles","10 pages, 10 figures",,,,"cond-mat.soft","http://arxiv.org/licenses/nonexclusive-distrib/1.0/","  By means of molecular dynamics simulations we investigate the formation of
single-chain nanoparticles through intramolecular cross-linking of polymer
chains, in the presence of their precursors acting as purely steric crowders in
concentrated solution. In the case of the linear precursors, the structure of
the resulting SCNPs is weakly affected by the density at which the synthesis is
performed. Crowding has significant effects if ring precursors are used: higher
concentrations lead to the formation of SCNPs with more compact and spherical
morphologies. Such SCNPs retain in the swollen state (high dilution) the
crumpled globular conformations adopted by the ring precursors in the crowded
solutions. Increasing the concentration of both the linear and ring precursors
up to $30 \%$ leads to faster formation of the respective SCNPs.
","[{""version"":""v1"",""created"":""Wed, 2 Aug 2017 21:17:37 GMT""}]","2017-08-04"
"1708.00933","Davinder Singh","Davinder Singh and Shubhrangshu Dasgupta","Coherence and its Role in Excitation Energy Transfer in
  Fenna-Mathews-Olson Complex",,"J. Phys. Chem. B, 121, 1290-94 (2017)","10.1021/acs.jpcb.7b00276",,"physics.chem-ph physics.bio-ph","http://arxiv.org/licenses/nonexclusive-distrib/1.0/","  We show that the coherence between different bacteriochlorophyll-a (BChla)
sites in the Fenna-Mathews-Olson complex is an essential ingredient for
excitation energy transfer between various sites. The coherence delocalizes the
excitation energy, which results in the redistribution of excitation among all
the BChla sites in the steady state. We further show that the system remains
partially coherent at the steady state. In our numerical simulation of the
non-Markovian density matrix equation, we consider both the inhomogeneity of
the protein environment and the effect of active vibronic modes.
","[{""version"":""v1"",""created"":""Wed, 2 Aug 2017 21:18:24 GMT""}]","2017-08-04"
"1708.00934","Gonzalo Molina","Daniel A. Jaume, Gonzalo Molina","Null Decomposition of Trees","23 pages, 6 figures",,,,"math.CO","http://arxiv.org/licenses/nonexclusive-distrib/1.0/","  Let $T$ be a tree, we show that the null space of the adjacency matrix of $T$
has relevant information about the structure of $T$. We introduce the Null
Decomposition of trees, and use it in order to get formulas for independence
number and matching number of a tree. We also prove that the number of maximum
matchings in a tree is related to the null decomposition.
","[{""version"":""v1"",""created"":""Wed, 2 Aug 2017 21:19:16 GMT""}]","2017-08-04"
"1708.00935","Prieslei Goulart","Prieslei Goulart","Phantom wormholes in Einstein-Maxwell-dilaton theory","v3: Solution and deflection angle written in terms of asymptotic
  charges. Matches the published version, Classical and Quantum Gravity (2017)",,"10.1088/1361-6382/aa9dfc",,"gr-qc hep-th","http://arxiv.org/licenses/nonexclusive-distrib/1.0/","  In this paper we give an electrically charged traversable wormhole solution
for the Einstein-Maxwell-dilaton theory when the dilaton is a phantom field,
i.e. it has flipped sign kinetic term appearing in the action. In the limit
when the charge is zero, we recover the anti-Fisher solution, which can be
reduced to the Bronnikov-Ellis solution under certain choices of integration
constants. The equations of motion of this theory share the same S-duality
invariance of string theory, so the electrically charged solution is rotated
into the magnetically charged one by applying such transformations. The scalar
field is topological, so we compute its topological charge, and discuss that
under appropriate boundary conditions we can have a lump, a kink, or an
anti-kink profile. We determine the position of the throat, and show the
embedding diagram of the wormhole. As a physical application, we apply the
Gauss-Bonnet theorem to compute the deflection angle of a light-ray that passes
close to the wormhole.
","[{""version"":""v1"",""created"":""Wed, 2 Aug 2017 21:21:47 GMT""},{""version"":""v2"",""created"":""Mon, 7 Aug 2017 18:53:04 GMT""},{""version"":""v3"",""created"":""Wed, 6 Dec 2017 13:34:56 GMT""}]","2017-12-07"
"1708.00936","Hyeondeok Shin","Hyeondeok Shin, Jeongnim Kim, Hoonkyung Lee, Olle Heinonen, Anouar
  Benali, and Yongkyung Kwon","The Nature of Interlayer Binding and Stacking of $sp$-$sp^{2}$
  Hybridized Carbon Layers: A Quantum Monte Carlo Study","25 pages, 6 figures",,,,"cond-mat.mtrl-sci","http://arxiv.org/licenses/nonexclusive-distrib/1.0/","  $\alpha$-graphyne is a two-dimensional sheet of $sp$-$sp^2$ hybridized carbon
atoms in a honeycomb lattice. While the geometrical structure is similar to
that of graphene, the hybridized triple bonds give rise to electronic structure
that is different from that of graphene. Similar to graphene, $\alpha$-graphyne
can be stacked in bilayers with two stable configurations, but the different
stackings have very different electronic structures: one is predicted to have
gapless parabolic bands and the other a tunable band gap which is attractive
for applications. In order to realize applications, it is crucial to understand
which stacking is more stable. This is difficult to model, as the stability is
a result of weak interlayer van der Waals interactions which are not well
captured by density functional theory (DFT). We have used quantum Monte Carlo
simulations that accurately include van der Waals interactions to calculate the
interlayer binding energy of bilayer graphyne and to determine its most stable
stacking mode. Our results show that interlayer bindings of $sp$- and
$sp^{2}$-bonded carbon networks are significantly underestimated in a Kohn-Sham
DFT approach, even with an exchange-correlation potential corrected to include,
in some approximation, van der Waals interactions. Finally, our quantum Monte
Carlo calculations reveal that the interlayer binding energy difference between
the two stacking modes is only 0.9(4) meV/atom. From this we conclude that the
two stable stacking modes of bilayer $\alpha$-graphyne are almost degenerate
with each other, and both will occur with about the same probability at room
temperature unless there is a synthesis path that prefers one stacking over the
other.
","[{""version"":""v1"",""created"":""Wed, 2 Aug 2017 21:35:40 GMT""}]","2017-08-04"
"1708.00937","Anton Souslov","Benjamin Loewe, Anton Souslov, and Paul M. Goldbart","Flocking from a quantum analogy: Spin-orbit coupling in an active fluid","13 pages, 3 figures","New Journal of Physics 20, 013020 (2018)","10.1088/1367-2630/aa9cdc",,"cond-mat.soft cond-mat.stat-mech","http://arxiv.org/licenses/nonexclusive-distrib/1.0/","  Systems composed of strongly interacting self-propelled particles can form a
spontaneously flowing polar active fluid. The study of the connection between
the microscopic dynamics of a single such particle and the macroscopic dynamics
of the fluid can yield insights into experimentally realizable active flows,
but this connection is well understood in only a few select cases. We introduce
a model of self-propelled particles based on an analogy with the motion of
electrons that have strong spin-orbit coupling. We find that, within our model,
self-propelled particles are subject to an analog of the Heisenberg uncertainty
principle that relates translational and rotational noise. Furthermore, by
coarse-graining this microscopic model, we establish expressions for the
coefficients of the Toner-Tu equations---the hydrodynamic equations that
describe an active fluid composed of these ""active spins."" The connection
between self-propelled particles and quantum spins may help realize exotic
phases of matter using active fluids via analogies with systems composed of
strongly correlated electrons.
","[{""version"":""v1"",""created"":""Wed, 2 Aug 2017 21:38:34 GMT""}]","2018-03-02"
"1708.00938","Philip H\""ausser","Philip Haeusser, Thomas Frerix, Alexander Mordvintsev, Daniel Cremers","Associative Domain Adaptation","In IEEE International Conference on Computer Vision (ICCV), 2017",,,,"cs.CV","http://arxiv.org/licenses/nonexclusive-distrib/1.0/","  We propose associative domain adaptation, a novel technique for end-to-end
domain adaptation with neural networks, the task of inferring class labels for
an unlabeled target domain based on the statistical properties of a labeled
source domain. Our training scheme follows the paradigm that in order to
effectively derive class labels for the target domain, a network should produce
statistically domain invariant embeddings, while minimizing the classification
error on the labeled source domain. We accomplish this by reinforcing
associations between source and target data directly in embedding space. Our
method can easily be added to any existing classification network with no
structural and almost no computational overhead. We demonstrate the
effectiveness of our approach on various benchmarks and achieve
state-of-the-art results across the board with a generic convolutional neural
network architecture not specifically tuned to the respective tasks. Finally,
we show that the proposed association loss produces embeddings that are more
effective for domain adaptation compared to methods employing maximum mean
discrepancy as a similarity measure in embedding space.
","[{""version"":""v1"",""created"":""Wed, 2 Aug 2017 21:38:45 GMT""}]","2017-08-04"
"1708.00939","Qiuhua Huang","Qiuhua Huang, Renke Huang, Bruce J. Palmer, Yuan Liu, Shuangshuang
  Jin, Ruisheng Diao, Yousu Chen, Yu Zhang","A Reference Implementation of WECC Composite Load Model in Matlab and
  GridPACK","8 pages",,,,"cs.SY","http://creativecommons.org/licenses/by/4.0/","  The composite load model (CLM) proposed by the Western Electricity
Coordinating Council (WECC) is gaining increasing traction in industry,
particularly in North America. At the same time, it has been recognized that
further improvements in structure, initialization and aggregation methods are
needed to enhance model accuracy. However, the lack of an open-source
implementation of the WECC CLM has become a roadblock for many researchers for
further improvement. To bridge this gap, this paper presents the first open
reference implementation of the WECC CLM. Individual load components and the
CLM are first developed and tested in Matlab, then translated to the high
performance computing (HPC) based, parallel simulation framework - GridPACK.
The main contributions of the paper include: 1) presenting important yet
undocumented details of modeling and initializing the CLM, particularly for a
parallel simulation frame-work like GridPACK; 2) implementation details of the
load components such as the single-phase air conditioner motor; 3) implementing
the CLM in a modular and extensible manner. The implementation has been tested
at both the component as well as system levels and benchmarked against
commercial simulation programs, with satisfactory accuracy.
","[{""version"":""v1"",""created"":""Wed, 2 Aug 2017 21:39:23 GMT""}]","2017-08-04"
