"1708.05344","Andrew Brock","Andrew Brock, Theodore Lim, J.M. Ritchie, Nick Weston","SMASH: One-Shot Model Architecture Search through HyperNetworks",,,,,"cs.LG","http://arxiv.org/licenses/nonexclusive-distrib/1.0/","  Designing architectures for deep neural networks requires expert knowledge
and substantial computation time. We propose a technique to accelerate
architecture selection by learning an auxiliary HyperNet that generates the
weights of a main model conditioned on that model's architecture. By comparing
the relative validation performance of networks with HyperNet-generated
weights, we can effectively search over a wide range of architectures at the
cost of a single training run. To facilitate this search, we develop a flexible
mechanism based on memory read-writes that allows us to define a wide range of
network connectivity patterns, with ResNet, DenseNet, and FractalNet blocks as
special cases. We validate our method (SMASH) on CIFAR-10 and CIFAR-100,
STL-10, ModelNet10, and Imagenet32x32, achieving competitive performance with
similarly-sized hand-designed networks. Our code is available at
https://github.com/ajbrock/SMASH
","[{""version"":""v1"",""created"":""Thu, 17 Aug 2017 16:03:33 GMT""}]","2017-08-18"
"1708.05345","Kevin Truong","Kevin Truong and Alexander Ossipov","Statistical properties of eigenvectors and eigenvalues of structured
  random matrices","14 pages, 4 figures","J. Phys. A, 51, 065001 (2018)","10.1088/1751-8121/aaa011",,"math-ph cond-mat.stat-mech math.MP","http://arxiv.org/licenses/nonexclusive-distrib/1.0/","  We study the eigenvalues and the eigenvectors of $N\times N$ structured
random matrices of the form $H = W\tilde{H}W+D$ with diagonal matrices $D$ and
$W$ and $\tilde{H}$ from the Gaussian Unitary Ensemble. Using the supersymmetry
technique we derive general asymptotic expressions for the density of states
and the moments of the eigenvectors. We find that the eigenvectors remain
ergodic under very general assumptions, but a degree of their ergodicity
depends strongly on a particular choice of $W$ and $D$. For a special case of
$D=0$ and random $W$, we show that the eigenvectors can become critical and are
characterized by non-trivial fractal dimensions.
","[{""version"":""v1"",""created"":""Thu, 17 Aug 2017 16:08:31 GMT""},{""version"":""v2"",""created"":""Thu, 16 Aug 2018 19:56:44 GMT""}]","2018-08-20"
"1708.05346","Jan Feyereisl","Jan Feyereisl, Matej Nikl, Martin Poliak, Martin Stransky, Michal
  Vlasak","General AI Challenge - Round One: Gradual Learning","Presented as keynote talk at IJCAI Workshop on Evaluating
  General-Purpose AI (EGPAI 2017)",,,,"cs.AI","http://arxiv.org/licenses/nonexclusive-distrib/1.0/","  The General AI Challenge is an initiative to encourage the wider artificial
intelligence community to focus on important problems in building intelligent
machines with more general scope than is currently possible. The challenge
comprises of multiple rounds, with the first round focusing on gradual
learning, i.e. the ability to re-use already learned knowledge for efficiently
learning to solve subsequent problems. In this article, we will present details
of the first round of the challenge, its inspiration and aims. We also outline
a more formal description of the challenge and present a preliminary analysis
of its curriculum, based on ideas from computational mechanics. We believe,
that such formalism will allow for a more principled approach towards
investigating tasks in the challenge, building new curricula and for
potentially improving consequent challenge rounds.
","[{""version"":""v1"",""created"":""Thu, 17 Aug 2017 16:10:58 GMT""}]","2017-08-18"
"1708.05347","Minjia Shi","MinJia Shi, Zahra Sepasdar, Rongsheng Wu, Patrick Sol\'e","Two weight $\mathbb{Z}_{p^k}$-codes, $p$ odd prime","This paper has been submitted in early 2016",,,,"cs.IT math.IT","http://arxiv.org/licenses/nonexclusive-distrib/1.0/","  We show that regular homogeneous two-weight $\mathbb{Z}_{p^k}$-codes where
$p$ is odd and $k\geqslant 2$ with dual Hamming distance at least four do not
exist. The proof relies on existence conditions for the strongly regular graph
built on the cosets of the dual code.
","[{""version"":""v1"",""created"":""Thu, 17 Aug 2017 16:11:24 GMT""}]","2017-08-18"
"1708.05348","Stephen Flood","S. P. Flood, J. M. Speight","Chern-Simons deformation of vortices on compact domains","22 pages, 3 figures",,"10.1016/j.geomphys.2018.07.009",,"hep-th","http://arxiv.org/licenses/nonexclusive-distrib/1.0/","  Existence of Maxwell-Chern-Simons-Higgs (MCSH) vortices in a Hermitian line
bundle $\L$ over a general compact Riemann surface $\Sigma$ is proved by a
continuation method. The solutions are proved to be smooth both spatially and
as functions of the Chern-Simons deformation parameter $\kappa$, and exist for
all $|\kappa|<\kappa_*$, where $\kappa_*$ depends, in principle, on the
geometry of $\Sigma$, the degree $n$ of $\L$, which may be interpreted as the
vortex number, and the vortex positions. A simple upper bound on $\kappa_*$,
depending only on $n$ and the volume of $\Sigma$, is found. Further, it is
proved that a positive {\em lower} bound on $\kappa_*$, depending on $\Sigma$
and $n$, but independent of vortex positions, exists. A detailed numerical
study of rotationally equivariant vortices on round two-spheres is performed.
We find that $\kappa_*$ in general does depend on vortex positions, and, for
fixed $n$ and radius, tends to be larger the more evenly vortices are
distributed between the North and South poles. A generalization of the MCSH
model to compact K\""ahler domains $\Sigma$ of complex dimension $k\geq 1$ is
formulated. The Chern-Simons term is replaced by the integral over spacetime of
$A\wedge F\wedge \omega^{k-1}$, where $\omega$ is the K\""ahler form on
$\Sigma$. A topological lower bound on energy is found, attained by solutions
of a deformed version of the usual vortex equations on $\Sigma$. Existence,
uniqueness and smoothness of vortex solutions of these generalized equations is
proved, for $|\kappa|<\kappa_*$, and an upper bound on $\kappa_*$ depending
only on the K\""ahler class of $\Sigma$ and the first Chern class of $\L$ is
obtained.
","[{""version"":""v1"",""created"":""Thu, 17 Aug 2017 16:13:01 GMT""}]","2018-09-26"
"1708.05349","Aayush Bansal","Aayush Bansal and Yaser Sheikh and Deva Ramanan","PixelNN: Example-based Image Synthesis","Project Page: http://www.cs.cmu.edu/~aayushb/pixelNN/",,,,"cs.CV cs.GR cs.LG","http://arxiv.org/licenses/nonexclusive-distrib/1.0/","  We present a simple nearest-neighbor (NN) approach that synthesizes
high-frequency photorealistic images from an ""incomplete"" signal such as a
low-resolution image, a surface normal map, or edges. Current state-of-the-art
deep generative models designed for such conditional image synthesis lack two
important things: (1) they are unable to generate a large set of diverse
outputs, due to the mode collapse problem. (2) they are not interpretable,
making it difficult to control the synthesized output. We demonstrate that NN
approaches potentially address such limitations, but suffer in accuracy on
small datasets. We design a simple pipeline that combines the best of both
worlds: the first stage uses a convolutional neural network (CNN) to maps the
input to a (overly-smoothed) image, and the second stage uses a pixel-wise
nearest neighbor method to map the smoothed output to multiple high-quality,
high-frequency outputs in a controllable manner. We demonstrate our approach
for various input modalities, and for various domains ranging from human faces
to cats-and-dogs to shoes and handbags.
","[{""version"":""v1"",""created"":""Thu, 17 Aug 2017 16:13:42 GMT""}]","2017-08-18"
"1708.05353","Toru Shiozaki","Hai-Anh Le and Toru Shiozaki","Occupied-orbital fast multipole method for efficient exact exchange
  evaluation",,,"10.1021/acs.jctc.7b00880",,"physics.chem-ph","http://arxiv.org/licenses/nonexclusive-distrib/1.0/","  We present an efficient algorithm for computing the exact exchange
contributions in the Hartree-Fock and hybrid density functional theory models
on the basis of the fast multipole method (FMM). Our algorithm is based on the
observation that FMM with hierarchical boxes can be efficiently used in the
exchange matrix construction, when at least one of the indices of the exchange
matrix is constrained to be an occupied orbital. Timing benchmarks are
presented for alkane chains (C400H802 and C150H302), a graphene sheet
(C150H30), a water cluster [(H2O)100], and a protein Crambin
(C202H317O64N55S6). The computational cost of the far-field exchange evaluation
for Crambin is roughly 3% that of a self-consistent field iteration when the
multipoles up to rank 2 are used.
","[{""version"":""v1"",""created"":""Thu, 17 Aug 2017 16:25:15 GMT""}]","2018-01-30"
"1708.05354","Daniel Urban F","Daniel F. Urban and Christian Els\""asser","Atomic defects and dopants in ternary Z-phase transition-metal nitrides
  CrMN with M=V, Nb, Ta investigated with density functional theory",,"Phys. Rev. B 96, 104107 (2017)","10.1103/PhysRevB.96.104107",,"cond-mat.mtrl-sci","http://arxiv.org/licenses/nonexclusive-distrib/1.0/","  A density functional theory study of atomic defects and dopants in ternary
Z-phase transition-metal nitrides CrMN with M=V, Nb, or Ta is presented.
Various defect formation energies of native point defects and of substitutional
atoms of other metal elements which are abundant in the steel as well, are
evaluated. The dependence thereof on the thermodynamic environment, i.e. the
chemical conditions of a growing Z-phase precipitate, is studied and different
growth scenarios are compared. The results obtained may help to relate results
of experimental atomic-scale analysis, by atom probe tomography or transmission
electron microscopy, to the theoretical modeling of the formation process of
the Z phase from binary transition metal nitrides.
","[{""version"":""v1"",""created"":""Thu, 17 Aug 2017 16:28:57 GMT""},{""version"":""v2"",""created"":""Fri, 6 Oct 2017 08:08:02 GMT""}]","2017-10-09"
"1708.05355","Junhwa Hur","Junhwa Hur and Stefan Roth","MirrorFlow: Exploiting Symmetries in Joint Optical Flow and Occlusion
  Estimation","14 pages, To appear in ICCV 2017",,,,"cs.CV","http://arxiv.org/licenses/nonexclusive-distrib/1.0/","  Optical flow estimation is one of the most studied problems in computer
vision, yet recent benchmark datasets continue to reveal problem areas of
today's approaches. Occlusions have remained one of the key challenges. In this
paper, we propose a symmetric optical flow method to address the well-known
chicken-and-egg relation between optical flow and occlusions. In contrast to
many state-of-the-art methods that consider occlusions as outliers, possibly
filtered out during post-processing, we highlight the importance of joint
occlusion reasoning in the optimization and show how to utilize occlusion as an
important cue for estimating optical flow. The key feature of our model is to
fully exploit the symmetry properties that characterize optical flow and
occlusions in the two consecutive images. Specifically through utilizing
forward-backward consistency and occlusion-disocclusion symmetry in the energy,
our model jointly estimates optical flow in both forward and backward
direction, as well as consistent occlusion maps in both views. We demonstrate
significant performance benefits on standard benchmarks, especially from the
occlusion-disocclusion symmetry. On the challenging KITTI dataset we report the
most accurate two-frame results to date.
","[{""version"":""v1"",""created"":""Thu, 17 Aug 2017 16:32:34 GMT""}]","2017-08-18"
"1708.05357","Celestine D\""unner","Celestine D\""unner, Thomas Parnell, Martin Jaggi","Efficient Use of Limited-Memory Accelerators for Linear Learning on
  Heterogeneous Systems",,,,,"cs.LG cs.DC math.OC stat.ML","http://creativecommons.org/licenses/by/4.0/","  We propose a generic algorithmic building block to accelerate training of
machine learning models on heterogeneous compute systems. Our scheme allows to
efficiently employ compute accelerators such as GPUs and FPGAs for the training
of large-scale machine learning models, when the training data exceeds their
memory capacity. Also, it provides adaptivity to any system's memory hierarchy
in terms of size and processing speed. Our technique is built upon novel
theoretical insights regarding primal-dual coordinate methods, and uses duality
gap information to dynamically decide which part of the data should be made
available for fast processing. To illustrate the power of our approach we
demonstrate its performance for training of generalized linear models on a
large-scale dataset exceeding the memory size of a modern GPU, showing an
order-of-magnitude speedup over existing approaches.
","[{""version"":""v1"",""created"":""Thu, 17 Aug 2017 16:33:20 GMT""},{""version"":""v2"",""created"":""Tue, 7 Nov 2017 10:47:36 GMT""}]","2017-11-08"
"1708.05358","Masato Minamitsuji","Masato Minamitsuji","Proca stars with nonminimal coupling to the Einstein tensor","16 pages, 11 figures","Phys. Rev. D 96, 044017 (2017)","10.1103/PhysRevD.96.044017",,"gr-qc","http://arxiv.org/licenses/nonexclusive-distrib/1.0/","  We investigate Proca star (PS) solutions, namely boson star (BS) type
solutions for a complex vector field with mass and nonminimal coupling to the
Einstein tensor. Irrespective of the existence of nonminimal coupling, PS
solutions are mini-BS type, but the inclusion of it changes properties. For
positive nonminimal coupling parameters, PS solutions do not exist for central
amplitudes above some certain value due to the singular behavior of the
evolution equations. For negative nonminimal coupling parameters, there is no
such singular behavior but sufficiently enhanced numerical resolutions are
requested for larger amplitudes. Irrespective of the sign of the nonzero
nonminimal coupling parameter, PSs with the maximal Arnowitt-Deser-Misner mass
and Noether charge are gravitationally bound. Properties of PSs are very
similar to those of BSs in scalar-tensor theories including healthy
higher-derivative terms.
","[{""version"":""v1"",""created"":""Thu, 17 Aug 2017 16:38:54 GMT""}]","2017-08-18"
"1708.05359","Zolt\'an Makai Dr","Z. Makai, L. D. Anderson, J. L. Mascoop, B. Johnstone","The Infrared and Radio Fluxes Densities of Galactic HII Regions","27 pages, 16 figures, 5 tables",,"10.3847/1538-4357/aa84b6",,"astro-ph.GA","http://arxiv.org/licenses/nonexclusive-distrib/1.0/","  We derive infrared and radio flux densities of all ~1000 known Galactic HII
regions in the Galactic longitude range 17.5 < l < 65 degree. Our sample comes
from the Wide-Field Infrared Survey Explorer (WISE) catalog of Galactic \hii
regions \citep{anderson2014}. We compute flux densities at six wavelengths in
the infrared (GLIMPSE 8 microns, WISE 12 microns and 22 microns, MIPSGAL 24
microns, and Hi-GAL 70 microns and 160 microns) and two in the radio (MAGPIS 20
cm and VGPS 21 cm). All HII region infrared flux densities are strongly
correlated with their ~20 cm flux densities. All HII regions used here,
regardless of physical size or Galactocentric radius, have similar infrared to
radio flux density ratios and similar infrared colors, although the smallest
regions ($r<1\,$pc), have slightly elevated IR to radio ratios. The colors
$\log_{10}(F_{24 micron}/F_{12 micron}) \ge 0$ and $\log_{10}(F_{70
micron}/F_{12 micron}) \ge 1.2$, and $\log_{10}(F_{24 micron}/F_{12 micron})
\ge 0$ and $\log_{10}(F_{160 micron}/F_{70 micron}) \le 0.67$ reliably select
HII regions, independent of size. The infrared colors of ~22$\%$ of HII
regions, spanning a large range of physical sizes, satisfy the IRAS color
criteria of \citet{wood1989} for HII regions, after adjusting the criteria to
the wavelengths used here. Since these color criteria are commonly thought to
select only ultra-compact HII regions, this result indicates that the true
ultra-compact HII region population is uncertain. Comparing with a sample of IR
color indices from star-forming galaxies, HII regions show higher
$\log_{10}(F_{70 micron}/F_{12 micron})$ ratios. We find a weak trend of
decreasing infrared to ~20 cm flux density ratios with increasing $R_{gal}$, in
agreement with previous extragalactic results, possibly indicating a decreased
dust abundance in the outer Galaxy.
","[{""version"":""v1"",""created"":""Thu, 17 Aug 2017 16:39:22 GMT""}]","2017-09-06"
"1708.05360","Joel Franklin","E. Banyas, J. Franklin","The (Weak) Gravitational Field of a Dirac Monopole","to appear, Classical and Quantum Gravity","Classical and Quantum Gravity 34, 195004, 2017","10.1088/1361-6382/aa8657",,"gr-qc hep-th","http://arxiv.org/licenses/nonexclusive-distrib/1.0/","  We establish the gravitational detectability of a Dirac monopole using a
weak-field limit of general relativity, which can be developed from the
Newtonian gravitational potential by including energy as a source. The
resulting potential matches (by construction) the weak-field limit of two
different solutions to Einstein's equations of general relativity: one
associated with the magnetically monopolar spray of field lines emerging from
the half-infinite solenoid that makes up the Dirac monopole, the other
associated with the field-energetic source of the solenoid itself (the Dirac
string). The string's gravitational effect dominates, and we suggest that the
primary strong-field contribution of the Dirac configuration is that of a
half-infinite line of energy, whose GR solution is known.
","[{""version"":""v1"",""created"":""Thu, 17 Aug 2017 16:49:19 GMT""}]","2017-09-22"
"1708.05361","Brian Collier","Daniele Alessandrini and Brian Collier","The geometry of maximal components of the PSp(4,R) character variety","Order of cover in Theorem 5.12 corrected and other minor changes were
  made","Geom. Topol. 23 (2019) 1251-1337","10.2140/gt.2019.23.1251",,"math.GT math.AG math.DG","http://arxiv.org/licenses/nonexclusive-distrib/1.0/","  In this paper we describe the space of maximal components of the character
variety of surface group representations into PSp(4,R) and Sp(4,R). For every
rank 2 real Lie group of Hermitian type, we construct a mapping class group
invariant complex structure on the maximal components. For the groups PSp(4,R)
and Sp(4,R), we give a mapping class group invariant parameterization of each
maximal component as an explicit holomorphic fiber bundle over Teichm\""uller
space. Special attention is put on the connected components which are singular,
we give a precise local description of the singularities and their geometric
interpretation. We also describe the quotient of the maximal components for
PSp(4,R) and Sp(4,R) by the action of the mapping class group as a holomorphic
submersion over the moduli space of curves. These results are proven in two
steps, first we use Higgs bundles to give a non-mapping class group equivariant
parameterization, then we prove an analogue of Labourie's conjecture for
maximal PSp(4,R) representations.
","[{""version"":""v1"",""created"":""Thu, 17 Aug 2017 16:58:25 GMT""},{""version"":""v2"",""created"":""Fri, 10 Aug 2018 21:16:29 GMT""}]","2019-06-05"
"1708.05362","Monica Visan","Rowan Killip, Monica Visan, and Xiaoyi Zhang","Low regularity conservation laws for integrable PDE",,,,,"math.AP","http://arxiv.org/licenses/nonexclusive-distrib/1.0/","  We present a general method for obtaining conservation laws for integrable
PDE at negative regularity and exhibit its application to KdV, NLS, and mKdV.
Our method works uniformly for these problems posed both on the line and on the
circle.
","[{""version"":""v1"",""created"":""Thu, 17 Aug 2017 17:01:35 GMT""}]","2017-08-18"
"1708.05363","Sergii Kivva","Sergii Kivva, Mark Zheleznyak, Alexander Pilipenko, Vasyl Yoschenko","A central-upwind scheme for open water flow in a wet/dry
  multiply-connected channel network",,"Pure and Applied Geophysics (2020)","10.1007/s00024-020-02416-0",,"math.NA","http://creativecommons.org/licenses/by-nc-sa/4.0/","  Our goal was to develop a robust algorithm for numerical simulation of
one-dimensional shallow-water flow in a complex multiply-connected channel
network with arbitrary geometry and variable topography. We apply a
central-upwind scheme with a novel reconstruction of the open water surface in
partially flooded cells that does not require additional correction. The
proposed reconstruction and an exact integration of source terms for momentum
conservation equation provide positivity preserving and well-balanced features
of the scheme for various wet-dry states. We use two models based on continuity
equation and mass and momentum conservation equations integrated for a control
volume around the channel junction to its treatment. These junction models
permit to simulate a subcritical and supercritical flow in a channel network.
Numerous numerical experiments demonstrate the robustness of the proposed
numerical algorithm and a good agreement of numerical results with exact
solutions, experimental data, and results of the previous numerical studies.
The proposed new specialized test on inundation and drying of initially dry
channel network shows the merits of the new numerical algorithm to simulate the
subcritical/supercritical open water flows in the network.
","[{""version"":""v1"",""created"":""Thu, 17 Aug 2017 17:03:11 GMT""},{""version"":""v2"",""created"":""Wed, 12 Dec 2018 15:37:19 GMT""}]","2020-04-07"
"1708.05364","Arkady Gonoskov","Arkady Gonoskov","Theory of relativistic radiation reflection from plasmas",,,"10.1063/1.5000785",,"physics.plasm-ph","http://arxiv.org/licenses/nonexclusive-distrib/1.0/","  We consider the reflection of relativistically strong radiation from plasma
and identify the physical origin of the electrons' tendency to form a thin
sheet, which maintains its localisation throughout its motion. Thereby we
justify the principle of the relativistic electronic spring (RES) proposed in
[A. Gonoskov et al. PRE 84, 046403 (2011)]. Using the RES principle we derive a
closed set of differential equations that describe the reflection of radiation
with arbitrary variation of polarization and intensity from plasma with
arbitrary density profile for arbitrary angle of incidence. PIC simulations
show that the theory captures the essence of the plasma dynamics. In
particular, it can be applied for the studies of plasma heating and surface
high-harmonic generation with intense lasers.
","[{""version"":""v1"",""created"":""Thu, 17 Aug 2017 17:03:35 GMT""}]","2018-02-14"
"1708.05365","Juan Carlos Beam\'in","J. C. Beamin, D. Minniti, J. B. Pullen, V. D. Ivanov, E. Bendek,
  A.Bayo, M. Gromadzki, R. Kurtev, P. W. Lucas, R. P. Butler","Searching for Faint Comoving Companions to the $\alpha$ Centauri system
  in the VVV Survey Infrared Images","8 pages, 6 figures, 3 tables. Accepted for publication in MNRAS",,"10.1093/mnras/stx2144",,"astro-ph.SR astro-ph.EP","http://arxiv.org/licenses/nonexclusive-distrib/1.0/","  The VVV survey has observed the southern disk of the Milky Way in the near
infrared, covering 240 deg$^{2}$ in the $ZYJHK_S$ filters. We search the VVV
Survey images in a $\sim$19 deg$^{2}$ field around $\alpha$ Centauri, the
nearest stellar system to the Sun, to look for possible overlooked companions
that the baseline in time of VVV would be able to uncover. The photometric
depth of our search reaches $Y\sim$19.3 mag, $J\sim$19 mag, and $K_S\sim$17
mag. This search has yielded no new companions in $\alpha$ Centauri system,
setting an upper mass limit for any unseen companion well into the brown
dwarf/planetary mass regime. The apparent magnitude limits were turned into
effective temperature limits, and the presence of companion objects with
effective temperatures warmer than 325K can be ruled out using different
state-of-the-art atmospheric models.
  These limits were transformed into mass limits using evolutionary models,
companions with masses above 11 M$_{Jup}$ were discarded, extending the
constraints recently provided in the literature up to projected distances of
d<7 000 AU from $\alpha$ Cen AB and $\sim$1200 AU from Proxima. In the next few
years, the VVV extended survey (VVVX) will allow to extend the search and place
similar limits on brown dwarfs/planetary companions to $\alpha$ Cen AB for
separations up to 20 000AU.
","[{""version"":""v1"",""created"":""Thu, 17 Aug 2017 17:08:43 GMT""}]","2017-08-18"
