"1708.05594","Tu Dinh Nguyen","Tu Dinh Nguyen, Truyen Tran, Dinh Phung, Svetha Venkatesh","Statistical Latent Space Approach for Mixed Data Modelling and
  Applications",,,,,"cs.LG stat.ML","http://arxiv.org/licenses/nonexclusive-distrib/1.0/","  The analysis of mixed data has been raising challenges in statistics and
machine learning. One of two most prominent challenges is to develop new
statistical techniques and methodologies to effectively handle mixed data by
making the data less heterogeneous with minimum loss of information. The other
challenge is that such methods must be able to apply in large-scale tasks when
dealing with huge amount of mixed data. To tackle these challenges, we
introduce parameter sharing and balancing extensions to our recent model, the
mixed-variate restricted Boltzmann machine (MV.RBM) which can transform
heterogeneous data into homogeneous representation. We also integrate
structured sparsity and distance metric learning into RBM-based models. Our
proposed methods are applied in various applications including latent patient
profile modelling in medical data analysis and representation learning for
image retrieval. The experimental results demonstrate the models perform better
than baseline methods in medical data and outperform state-of-the-art rivals in
image dataset.
","[{""version"":""v1"",""created"":""Fri, 18 Aug 2017 13:17:57 GMT""}]","2017-08-21"
"1708.05595","Huaxin Xiao","Huaxin Xiao, Jiashi Feng, Yunchao Wei, Maojun Zhang","Self-explanatory Deep Salient Object Detection",,,,,"cs.CV","http://arxiv.org/licenses/nonexclusive-distrib/1.0/","  Salient object detection has seen remarkable progress driven by deep learning
techniques. However, most of deep learning based salient object detection
methods are black-box in nature and lacking in interpretability. This paper
proposes the first self-explanatory saliency detection network that explicitly
exploits low- and high-level features for salient object detection. We
demonstrate that such supportive clues not only significantly enhances
performance of salient object detection but also gives better justified
detection results. More specifically, we develop a multi-stage saliency encoder
to extract multi-scale features which contain both low- and high-level saliency
context. Dense short- and long-range connections are introduced to reuse these
features iteratively. Benefiting from the direct access to low- and high-level
features, the proposed saliency encoder can not only model the object context
but also preserve the boundary. Furthermore, a self-explanatory generator is
proposed to interpret how the proposed saliency encoder or other deep saliency
models making decisions. The generator simulates the absence of interesting
features by preventing these features from contributing to the saliency
classifier and estimates the corresponding saliency prediction without these
features. A comparison function, saliency explanation, is defined to measure
the prediction changes between deep saliency models and corresponding
generator. Through visualizing the differences, we can interpret the capability
of different deep neural networks based saliency detection models and
demonstrate that our proposed model indeed uses more reasonable structure for
salient object detection. Extensive experiments on five popular benchmark
datasets and the visualized saliency explanation demonstrate that the proposed
method provides new state-of-the-art.
","[{""version"":""v1"",""created"":""Fri, 18 Aug 2017 13:19:01 GMT""}]","2017-08-21"
"1708.05596","Hanno K\""upers","Hanno K\""upers, Ryan B. Lewis, Abbes Tahraoui, Mathias Matalla, Olaf
  Kr\""uger, Faebian Bastiman, Henning Riechert, and Lutz Geelhaar","Diameter evolution of selective area grown Ga-assisted GaAs nanowires",,"Nano Res. (2018) 11: 2885","10.1007/s12274-018-1984-1",,"cond-mat.mes-hall","http://arxiv.org/licenses/nonexclusive-distrib/1.0/","  We present a novel two-step approach for the selective area growth (SAG) of
GaAs nanowires (NWs) by molecular beam epitaxy which has enabled a detailed
exploration of the NW diameter evolution. In the first step, the growth
parameters are optimized for the nucleation of vertically-oriented NWs. In the
second step, the growth parameters are chosen to optimize the NW shape,
allowing NWs with a thin diameter (45 nm) and an untapered morphology to be
realized. This result is in contrast to the commonly observed thick, inversely
tapered shape of SAG NWs. We quantify the flux dependence of radial
vapour-solid (VS) growth and build a model that takes into account diffusion on
the NW sidewalls to explain the observed VS growth rates. Combining this model
for the radial VS growth with an existing model for the droplet dynamics at the
NW top, we achieve full understanding of the diameter of NWs over their entire
length and the evolution of the diameter and tapering during growth. We
conclude that only the combination of droplet dynamics and VS growth results in
an untapered morphology. This result enables NW shape engineering and has
important implications for doping of NWs.
","[{""version"":""v1"",""created"":""Fri, 18 Aug 2017 13:22:59 GMT""}]","2018-07-10"
"1708.05597","Teiko Heinosaari","Claudio Carmeli, Teiko Heinosaari, Sabrina Maniscalco, Jussi Schultz,
  Alessandro Toigo","Determining quantum coherence with minimal resources",,"New J. Phys. 20, 063038 (2018)","10.1088/1367-2630/aacbea",,"quant-ph","http://arxiv.org/licenses/nonexclusive-distrib/1.0/","  We characterize minimal measurement setups for validating the quantum
coherence of an unknown quantum state. We show that for a $d$-level system, the
optimal strategy consists of measuring $d$ orthonormal bases such that each
measured basis is mutually unbiased with respect to the reference basis, and
together with the reference basis they form an informationally complete set of
measurements. We show that, in general, any strategy capable of validating
quantum coherence allows one to evaluate also the exact value of coherence. We
then give an explicit construction of the optimal measurements for arbitrary
dimensions. Finally, we show that the same measurement setup is also optimal
for the modified task of verifying if the coherence is above or below a given
threshold value.
","[{""version"":""v1"",""created"":""Fri, 18 Aug 2017 13:25:39 GMT""}]","2018-06-27"
"1708.05598","Stefano Bonzio","Stefano Bonzio, Andrea Loi and Luisa Peruzzi","On the nxnxn Rubik's Cube","18 pages, to appear on Mathematica Slovaca","Mathematica Slovaca 68/2018","10.1515/ms-2017-0158",,"math.CO","http://arxiv.org/licenses/nonexclusive-distrib/1.0/","  We describe in details the nxnxn Rubik's Cube, namely a Rubik's Cube with n
rotating slices in each face. Then we state and prove the ""first law of
Cubology"", i.e. the solvability criterion, for it
","[{""version"":""v1"",""created"":""Fri, 18 Aug 2017 13:26:05 GMT""}]","2020-04-20"
"1708.05599","Yuan Sun","Yuan Sun, Chang Liu, Ping-Xing Chen, Liang Liu","Polarization induced interference within electromagnetically induced
  transparency for atoms of double-V linkage","7 figures","Phys. Rev. A 97, 023815 (2018)","10.1103/PhysRevA.97.023815",,"physics.atom-ph quant-ph","http://arxiv.org/licenses/nonexclusive-distrib/1.0/","  People have been paying attention to the role of atoms' complex internal
level structures in the research of electromagnetically induced transparency
(EIT) for a long time, where the various degenerate Zeeman levels usually
generate complex linkage patterns for the atomic transitions. It turns out,
with special choices of the atomic states and the atomic transitions' linkage
structure, clear signatures of quantum interference induced by the probe and
coupling light's polarizations can emerge from a typical EIT phenomena. We
propose to study a four state system with double-V linkage pattern for the
transitions and analyze the polarization induced interference under the EIT
condition. We show that such interference arises naturally under mild
conditions on the optical field and atom manipulation. Its anticipated
properties and its potential application of all optical switching in
polarization degree of freedom are also discussed. Moreover, we construct a
variation form of double-M linkage pattern where the polarization induced
interference enables polarization-dependent cross-modulation between incident
lights that can be effective even at the few-photon level. The theme is to gain
more insight into the essential question: how can we build non-trivial optical
medium where incident lights will induce polarization-dependent non-linear
optical interactions, covering a wide range of the incidence intensity from the
many-photon level to the few-photon level, respectively.
","[{""version"":""v1"",""created"":""Fri, 18 Aug 2017 13:28:13 GMT""},{""version"":""v2"",""created"":""Sun, 3 Sep 2017 12:04:53 GMT""}]","2018-02-21"
"1708.05600","Gr\'egoire Martinon","Gr\'egoire Martinon","The instability of anti-de Sitter space-time","Topical review, 58 pages, 37 figures, 1 table",,,,"gr-qc hep-th","http://arxiv.org/licenses/nonexclusive-distrib/1.0/","  In this review, we retrace the recent progress in the anti-de Sitter (AdS)
instability problem. By instability we mean that for large classes of initial
data, any perturbation of AdS space-time, however small, leads to the formation
of a black hole. Since the seminal work of Bizo\'n and Rostworowski in 2011,
many different kinds of numerical experiments were performed in asymptotically
AdS space-times, unveiling a very intricate structure of the instability. In
particular, many efforts were dedicated to the search of islands of stability,
i.e.\ families of initial data that resist black hole formation. Many
analytical and numerical tools were deployed to disentangle stable from
unstable initial data, and shed new light on the necessary and sufficient
conditions for collapse. Recently, research beyond spherical symmetry became
more and more engaged. This is a very promising channel of investigation toward
a deeper understanding of the gravitational dynamics in asymptotically AdS
space-times.
","[{""version"":""v1"",""created"":""Fri, 18 Aug 2017 13:29:09 GMT""},{""version"":""v2"",""created"":""Wed, 23 Aug 2017 15:43:04 GMT""},{""version"":""v3"",""created"":""Mon, 18 Sep 2017 12:39:05 GMT""}]","2017-09-19"
"1708.05601","Yuri Obukhov","Yuri N. Obukhov, Alexander J. Silenko, Oleg V. Teryaev","General treatment of quantum and classical spinning particles in
  external fields","38 pages, Revtex, minor changes","Phys. Rev. D 96, 105005 (2017)","10.1103/PhysRevD.96.105005",,"hep-th gr-qc","http://arxiv.org/licenses/nonexclusive-distrib/1.0/","  We develop the general theory of spinning particles with electric and
magnetic dipole moments moving in arbitrary electromagnetic, inertial and
gravitational fields. Both the quantum-mechanical and classical dynamics is
investigated. We start from the covariant Dirac equation extended to a
spin-${\frac 12}$ fermion with anomalous magnetic and electric dipole moments
and then perform the relativistic Foldy-Wouthuysen transformation. This
transformation allows us to obtain the quantum-mechanical equations of motion
for the physical operators in the Schr\""odinger form and to establish the
classical limit of relativistic quantum mechanics. The results obtained are
then compared to the general classical description of the spinning particle
interacting with electromagnetic, inertial and gravitational fields. The
complete agreement between the quantum mechanics and the classical theory is
proven in the general case. As an application of the results obtained, we
consider the dynamics of a spinning particle in a gravitational wave and
analyze the prospects of using the magnetic resonance setup to find possible
manifestations of the gravitational wave on spin.
","[{""version"":""v1"",""created"":""Fri, 18 Aug 2017 13:30:55 GMT""},{""version"":""v2"",""created"":""Wed, 8 Nov 2017 21:56:35 GMT""}]","2017-11-15"
"1708.05603","Tu Dinh Nguyen","Tu Dinh Nguyen, Truyen Tran, Dinh Phung, Svetha Venkatesh","Nonnegative Restricted Boltzmann Machines for Parts-based
  Representations Discovery and Predictive Model Stabilization",,,,,"cs.LG","http://arxiv.org/licenses/nonexclusive-distrib/1.0/","  The success of any machine learning system depends critically on effective
representations of data. In many cases, it is desirable that a representation
scheme uncovers the parts-based, additive nature of the data. Of current
representation learning schemes, restricted Boltzmann machines (RBMs) have
proved to be highly effective in unsupervised settings. However, when it comes
to parts-based discovery, RBMs do not usually produce satisfactory results. We
enhance such capacity of RBMs by introducing nonnegativity into the model
weights, resulting in a variant called nonnegative restricted Boltzmann machine
(NRBM). The NRBM produces not only controllable decomposition of data into
interpretable parts but also offers a way to estimate the intrinsic nonlinear
dimensionality of data, and helps to stabilize linear predictive models. We
demonstrate the capacity of our model on applications such as handwritten digit
recognition, face recognition, document classification and patient readmission
prognosis. The decomposition quality on images is comparable with or better
than what produced by the nonnegative matrix factorization (NMF), and the
thematic features uncovered from text are qualitatively interpretable in a
similar manner to that of the latent Dirichlet allocation (LDA). The stability
performance of feature selection on medical data is better than RBM and
competitive with NMF. The learned features, when used for classification, are
more discriminative than those discovered by both NMF and LDA and comparable
with those by RBM.
","[{""version"":""v1"",""created"":""Fri, 18 Aug 2017 13:34:18 GMT""}]","2017-08-21"
"1708.05604","Viacheslav Khomenko","Viacheslav Khomenko (1), Oleg Shyshkov (1), Olga Radyvonenko (1),
  Kostiantyn Bokhan (1) ((1) Samsung R&D Institute Ukraine SRK)","Accelerating recurrent neural network training using sequence bucketing
  and multi-GPU data parallelization","4 pages, 5 figures, Comments, 2016 IEEE First International
  Conference on Data Stream Mining & Processing (DSMP), Lviv, 2016","IEEE DSMP Lviv (2016) 100-103","10.1109/DSMP.2016.7583516",,"cs.LG cs.NE","http://arxiv.org/licenses/nonexclusive-distrib/1.0/","  An efficient algorithm for recurrent neural network training is presented.
The approach increases the training speed for tasks where a length of the input
sequence may vary significantly. The proposed approach is based on the optimal
batch bucketing by input sequence length and data parallelization on multiple
graphical processing units. The baseline training performance without sequence
bucketing is compared with the proposed solution for a different number of
buckets. An example is given for the online handwriting recognition task using
an LSTM recurrent neural network. The evaluation is performed in terms of the
wall clock time, number of epochs, and validation loss value.
","[{""version"":""v1"",""created"":""Fri, 18 Aug 2017 13:36:30 GMT""}]","2017-08-21"
"1708.05605","Roman Poberezhnyuk","R. V. Poberezhnyuk, V. Vovchenko, D. V. Anchishkin, M. I. Gorenstein","Quantum van der Waals and Walecka models of nuclear matter","17 pages, 6 figures",,"10.1142/S0218301317500616",,"nucl-th","http://arxiv.org/licenses/nonexclusive-distrib/1.0/","  A comparable study of the quantum van der Waals and Walecka models of nuclear
matter is presented. Each model contains two parameters which characterize the
repulsive and attractive interactions between nucleons. These parameters are
fixed in order to reproduce the known properties of the nuclear ground state.
Both models predict a first-order liquid-gas phase transition and a very
similar behavior in the vicinity of the critical point. Critical exponents of
the quantum van der Waals model are studied both analytically and numerically.
There are important differences in the behavior of the thermodynamical
functions of the considered models at large values of the nucleon number
density. At the same time both models fall into the universality class of
mean-field theory.
","[{""version"":""v1"",""created"":""Fri, 18 Aug 2017 13:37:04 GMT""},{""version"":""v2"",""created"":""Thu, 12 Oct 2017 14:19:40 GMT""}]","2017-11-22"
"1708.05606","Yikun Jiang","Arpan Bhattacharyya, Ling-Yan Hung, Yikun Jiang","Null hypersurface quantization, electromagnetic duality and asymptotic
  symmetries of Maxwell theory","26 pages, typos corrected","JHEP 1803 (2018) 027","10.1007/JHEP03(2018)027",,"hep-th gr-qc","http://arxiv.org/licenses/nonexclusive-distrib/1.0/","  In this paper we consider introducing careful regularization in the
quantization of Maxwell theory in the asymptotic null infinity. This allows
systematic discussions of the commutators in various boundary conditions, and
application of Dirac brackets accordingly in a controlled manner. This method
is most useful when we consider asymptotic charges that are not localized at
the boundary $u\to \pm \infty$ like large gauge transformations. We show that
our method reproduces the operator algebra in known cases, and it can be
applied to other space-time symmetry charges such as the BMS transformations.
We also obtain the asymptotic form of the U(1) charge following from the
electromagnetic duality in an explicitly EM symmetric Schwarz-Sen type action.
Using our regularization method, we demonstrate that the charge generates the
expected transformation of a helicity operator. Our method promises
applications in more generic theories.
","[{""version"":""v1"",""created"":""Fri, 18 Aug 2017 13:39:03 GMT""},{""version"":""v2"",""created"":""Wed, 18 Jul 2018 18:41:17 GMT""}]","2018-07-20"
"1708.05607","Tadeusz Litak","Tadeusz Litak","Constructive Modalities with Provability Smack","The paper is a modified and extended version (""Author's Cut"") of my
  contribution for the ""Leo Esakia on Duality in Modal and Intuitionistic
  Logics.""",,"10.1007/978-94-017-8860-1_8",,"cs.LO","http://arxiv.org/licenses/nonexclusive-distrib/1.0/","  I overview the work of the Tbilisi school on intuitionistic modal logics of
well-founded/scattered structures and its connections with contemporary
theoretical computer science. Fixed-point theorems and their consequences are
of particular interest.
","[{""version"":""v1"",""created"":""Fri, 18 Aug 2017 13:42:22 GMT""}]","2017-08-21"
"1708.05609","Rangoli Goyal","Rangoli Goyal and Rama Bhargava","GFEM study of magnetohydrodynamics thermo-diffusive effect on nanofluid
  flow over power-law stretching sheet along with regression analysis",,,,,"physics.flu-dyn math.NA physics.comp-ph","http://arxiv.org/licenses/nonexclusive-distrib/1.0/","  The present paper uses the Galerkin Finite Element Method to numerically
study the triple diffusive boundary layer flow of homogenous nanofluid over
power-law stretching sheet with the effect of external magnetic field. The
fluid is composed of nanoparticles along with dissolved solutal particles in
the base fluid. The chief mechanisms responsible for enhancement of convective
transport phenomenon in nanofluids - Brownian Motion, Diffusiophoresis and
Thermophoresis have been considered. The simulations performed in this study
are based on the boundary layer approach. Recently proposed heat flux and
nanoparticle mass flux boundary conditions have been imposed. Heat transfer,
solutal mass transfer and nanoparticle mass transfer are investigated for
different values of controlling parameters i.e. Brownian-motion parameter,
Thermophoresis parameter, magnetic influence parameter and stretching
parameter. Multiple regression analysis has been performed to verify the
relationship among transfer rate parameters and controlling parameters. The
present study finds application in insulation of wires, manufacture of tetra
packs, production of glass fibres, fabrication of various polymer and plastic
products, rubber sheets etc. where the quality merit of desired product depends
on the rate of stretching, external magnetic field and composition of materials
used.
","[{""version"":""v1"",""created"":""Fri, 18 Aug 2017 13:44:49 GMT""}]","2017-08-21"
"1708.05611","Debmalya Panigrahi","Yossi Azar, Arun Ganesh, Rong Ge, Debmalya Panigrahi","Online Service with Delay","30 pages, 11 figures, Appeared in 49th ACM Symposium on Theory of
  Computing (STOC), 2017",,,,"cs.DS","http://arxiv.org/licenses/nonexclusive-distrib/1.0/","  In this paper, we introduce the online service with delay problem. In this
problem, there are $n$ points in a metric space that issue service requests
over time, and a server that serves these requests. The goal is to minimize the
sum of distance traveled by the server and the total delay in serving the
requests. This problem models the fundamental tradeoff between batching
requests to improve locality and reducing delay to improve response time, that
has many applications in operations management, operating systems, logistics,
supply chain management, and scheduling.
  Our main result is to show a poly-logarithmic competitive ratio for the
online service with delay problem. This result is obtained by an algorithm that
we call the preemptive service algorithm. The salient feature of this algorithm
is a process called preemptive service, which uses a novel combination of
(recursive) time forwarding and spatial exploration on a metric space. We hope
this technique will be useful for related problems such as reordering buffer
management, online TSP, vehicle routing, etc. We also generalize our results to
$k > 1$ servers.
","[{""version"":""v1"",""created"":""Fri, 18 Aug 2017 13:45:14 GMT""}]","2017-08-21"
"1708.05614","Denis Boyer","Andrea Falc\'on-Cort\'es, Denis Boyer, Luca Giuggioli, Satya N.
  Majumdar","Localization transition induced by learning in random searches","5 pages, 5 figures + 4 pages of Supplemental Information. Accepted in
  Physical Review Letters","Phys. Rev. Lett. 119, 140603 (2017)","10.1103/PhysRevLett.119.140603",,"cond-mat.stat-mech q-bio.NC","http://arxiv.org/licenses/nonexclusive-distrib/1.0/","  We solve an adaptive search model where a random walker or L\'evy flight
stochastically resets to previously visited sites on a $d$-dimensional lattice
containing one trapping site. Due to reinforcement, a phase transition occurs
when the resetting rate crosses a threshold above which non-diffusive
stationary states emerge, localized around the inhomogeneity. The threshold
depends on the trapping strength and on the walker's return probability in the
memoryless case. The transition belongs to the same class as the
self-consistent theory of Anderson localization. These results show that
similarly to many living organisms and unlike the well-studied Markovian walks,
non-Markov movement processes can allow agents to learn about their environment
and promise to bring adaptive solutions in search tasks.
","[{""version"":""v1"",""created"":""Fri, 18 Aug 2017 13:56:02 GMT""},{""version"":""v2"",""created"":""Mon, 11 Sep 2017 17:02:06 GMT""}]","2017-10-11"
"1708.05615","Eun-jin Kim","Eun-jin Kim, Lucille-Marie Tenk`es, Rainer Hollerbach, Ovidiu
  Radulescu","Far-from-Equilibrium Time Evolution between two Gamma Distributions","26 pages, 11 figures","Entropy 19(10):511, 2017","10.3390/e19100511",,"cond-mat.stat-mech nlin.AO","http://arxiv.org/licenses/nonexclusive-distrib/1.0/","  Many systems in nature and laboratories are far from equilibrium and exhibit
significant fluctuations, invalidating the key assumptions of small
fluctuations and short memory time in or near equilibrium. A full knowledge of
Probability Distribution Functions (PDFs), especially time-dependent PDFs,
becomes essential in understanding far-from-equilibrium processes. We consider
a stochastic logistic model with multiplicative noise, which has gamma
distributions as stationary PDFs. We numerically solve the transient relaxation
problem, and show that as the strength of the stochastic noise increases the
time-dependent PDFs increasingly deviate from gamma distributions. For
sufficiently strong noise a transition occurs whereby the PDF never reaches a
stationary state, but instead forms a peak that becomes ever more narrowly
concentrated at the origin. The addition of an arbitrarily small amount of
additive noise regularizes these solutions, and re-establishes the existence of
stationary solutions. In addition to diagnostic quantities such as mean value,
standard deviation, skewness and kurtosis, the transitions between different
solutions are analyzed in terms of entropy and information length, the total
number of statistically distinguishable states that a system passes through in
time.
","[{""version"":""v1"",""created"":""Fri, 18 Aug 2017 13:56:53 GMT""},{""version"":""v2"",""created"":""Tue, 14 Nov 2017 01:39:54 GMT""}]","2017-11-15"
