"1708.05420","Mallikarjuna Rao Motapothula Dr","M. Motapothula, M. B. H. Breese","A study of small impact parameter ion channeling effects in thin
  crystals","19 pages, 12 figures, submitted to The European Physical Journal
  C(under review)",,"10.1140/epjb/e2018-80580-4",,"physics.atom-ph","http://arxiv.org/licenses/nonexclusive-distrib/1.0/","  We have recorded channeling patterns produced by 1 to 2 MeV protons aligned
with <111> axes in 55 nm thick silicon crystals which exhibit characteristic
angular structure for deflection angles up to and beyond the axial critical
angle, psi(a). Such large angular deflections are produced by ions incident on
atomic strings with small impact parameters, resulting in trajectories which
pass through several radial rings of atomic strings before exiting the thin
crystal. Each ring may focus, steer or scatter the channeled ions in the
transverse direction and the resulting characteristic angular structure beyond
0.6psi(a) at different depths can be related to peaks and troughs in the
nuclear encounter probability. Such radial focusing underlies other axial
channeling phenomena in thin crystals including planar channeling of small
impact parameter trajectories, peaks around the azimuthal distribution at small
tilts and large shoulders in the nuclear encounter probability at tilts beyond
psi(a).
","[{""version"":""v1"",""created"":""Thu, 17 Aug 2017 19:41:19 GMT""}]","2018-04-04"
"1708.05421","Dusan Sarenac","D. Sarenac, D. A. Pushin, M. G. Huber, D. S. Hussey, H. Miao, M. Arif,
  D. G. Cory, A. D. Cronin, B. Heacock, D. L. Jacobson, J. M. LaManna, H. Wen","Three Phase-Grating Moire Neutron Interferometer for Large
  Interferometer Area Applications",,"Phys. Rev. Lett. 120, 113201 (2018)","10.1103/PhysRevLett.120.113201",,"physics.ins-det physics.app-ph","http://arxiv.org/licenses/nonexclusive-distrib/1.0/","  We demonstrate a three phase-grating neutron interferometer as a robust
candidate for large area interferometry applications and characterization of
materials. This novel far-field moire technique allows for broad wavelength
acceptance and relaxed requirements related to fabrication and alignment,
circumventing the main obstacles associated with perfect crystal neutron
interferometry. Interference fringes were observed with a total interferometer
length of four meters, and the effects of an aluminum 6061 alloy sample on the
coherence of the system was examined. Experiments to measure the
autocorrelation length of samples and the universal gravitational constant are
proposed and discussed.
","[{""version"":""v1"",""created"":""Thu, 17 Aug 2017 19:45:35 GMT""}]","2018-03-21"
"1708.05422","Benjamin Vollmayr-Lee","Benjamin Vollmayr-Lee, Jack Hanson, R. Scott McIsaac, Joshua D.
  Hellerick","Anomalous Dimension in a Two-Species Reaction-Diffusion System","(9 pages, 7 figures, corrigendum included)","J. Phys. A: Math. Theor. 51, 034002 (2018)","10.1088/1751-8121/aa98cf",,"cond-mat.stat-mech","http://arxiv.org/licenses/nonexclusive-distrib/1.0/","  We study a two-species reaction-diffusion system with the reactions $A+A\to
(0, A)$ and $A+B\to A$, with general diffusion constants $D_A$ and $D_B$.
Previous studies showed that for dimensions $d\leq 2$ the $B$ particle density
decays with a nontrivial, universal exponent that includes an anomalous
dimension resulting from field renormalization. We demonstrate via
renormalization group methods that the $B$ particle correlation function has a
distinct anomalous dimension resulting in the asymptotic scaling $C_{BB}(r,t)
\sim t^{\phi}f(r/\sqrt{t})$, where the exponent $\phi$ results from the
renormalization of the square of the field associated with the $B$ particles.
We compute this exponent to first order in $\epsilon=2-d$, a calculation that
involves 61 Feynman diagrams, and also determine the logarithmic corrections at
the upper critical dimension $d=2$. Finally, we determine the exponent $\phi$
numerically utilizing a mapping to a four-walker problem for the special case
of $A$ particle coalescence in one spatial dimension.
","[{""version"":""v1"",""created"":""Thu, 17 Aug 2017 19:58:12 GMT""},{""version"":""v2"",""created"":""Fri, 7 Feb 2020 13:00:59 GMT""}]","2020-02-10"
"1708.05423","Daniel Ruiz","D. E. Ruiz","A geometric theory of waves and its applications to plasma physics","PhD thesis, 254 pages, 20 figures",,,,"physics.plasm-ph","http://arxiv.org/licenses/nonexclusive-distrib/1.0/","  Waves play an essential role in many aspects of plasma science, such as
plasma manipulation and diagnostics. Due to the complexity of the governing
equations, approximate models are often necessary to describe wave dynamics. In
this dissertation, waves are treated as geometric objects of a variational
theory rather than formal solutions of specific PDEs. This approach simplifies
calculations, highlights the underlying wave symmetries, and leads to improved
modeling of wave dynamics. This thesis presents two breakthroughs that were
obtained in the general theory of waves. The first main contribution is an
extension and reformulation of geometrical optics (GO) as a first-principle
Lagrangian theory that correctly describes polarization effects, such as
polarization precession and the polarization-driven bending of ray
trajectories, which appear as leading-order corrections to GO. The theory was
applied to several systems of interest, such as relativistic spin-1/2 particles
and radio-frequency waves in magnetized plasma. The second main contribution of
this thesis is the development of a phase-space method to study basic
properties of nonlinear wave--wave interactions. Specifically, I show that
waves propagating in modulated media, both classical and quantum, can
experience time-averaged refraction caused by effective ponderomotive forces on
wave rays. This phenomenon is analogous to the ponderomotive effect encountered
by charged particles in high-frequency electromagnetic fields. I also show that
phase-space methods can be useful to study problems in the field of wave
turbulence, such as the nonlinear interaction of high-frequency waves with
large-scale structures. Overall, the results obtained can serve as a basis for
future studies on more complex nonlinear wave--wave interactions, such as
modulational instabilities in general wave ensembles or wave turbulence.
","[{""version"":""v1"",""created"":""Thu, 17 Aug 2017 20:00:50 GMT""}]","2017-08-21"
"1708.05424","Gwena\""el Joret","Gwena\""el Joret, Piotr Micek, Patrice Ossona de Mendez and Veit
  Wiechert","Nowhere Dense Graph Classes and Dimension","v4: Minor changes suggested by a referee",,,,"math.CO cs.DM","http://arxiv.org/licenses/nonexclusive-distrib/1.0/","  Nowhere dense graph classes provide one of the least restrictive notions of
sparsity for graphs. Several equivalent characterizations of nowhere dense
classes have been obtained over the years, using a wide range of combinatorial
objects. In this paper we establish a new characterization of nowhere dense
classes, in terms of poset dimension: A monotone graph class is nowhere dense
if and only if for every $h \geq 1$ and every $\epsilon > 0$, posets of height
at most $h$ with $n$ elements and whose cover graphs are in the class have
dimension $\mathcal{O}(n^{\epsilon})$.
","[{""version"":""v1"",""created"":""Thu, 17 Aug 2017 20:02:03 GMT""},{""version"":""v2"",""created"":""Fri, 27 Oct 2017 07:32:05 GMT""},{""version"":""v3"",""created"":""Mon, 21 May 2018 11:52:24 GMT""},{""version"":""v4"",""created"":""Thu, 31 Jan 2019 20:19:54 GMT""}]","2019-02-04"
"1708.05425","Tevfik Kosar","Engin Arslan and Tevfik Kosar","A Heuristic Approach to Protocol Tuning for High Performance Data
  Transfers",,,,,"cs.DC","http://arxiv.org/licenses/nonexclusive-distrib/1.0/","  Obtaining optimal data transfer performance is of utmost importance to
today's data-intensive distributed applications and wide-area data replication
services. Doing so necessitates effectively utilizing available network
bandwidth and resources, yet in practice transfers seldom reach the levels of
utilization they potentially could. Tuning protocol parameters such as
pipelining, parallelism, and concurrency can significantly increase utilization
and performance, however determining the best settings for these parameters is
a difficult problem, as network conditions can vary greatly between sites and
over time. Nevertheless, it is an important problem, since poor tuning can
cause either under- or over-utilization of network resources and thus degrade
transfer performance. In this paper, we present three algorithms for
application-level tuning of different protocol parameters for maximizing
transfer throughput in wide-area networks. Our algorithms dynamically tune the
number of parallel data streams per file (for large file optimization), the
level of control channel pipelining (for small file optimization), and the
number of concurrent file transfers to increase I/O throughput (a technique
useful for all types of files). The proposed heuristic algorithms improve the
transfer throughput up to 10x compared to the baseline and 7x compared to the
state of the art solutions.
","[{""version"":""v1"",""created"":""Thu, 17 Aug 2017 20:13:42 GMT""}]","2017-08-21"
"1708.05426","Helen Kirk","Helen Kirk, Rachel K. Friesen, Jaime E. Pineda, Erik Rosolowsky,
  Stella S. R. Offner, Christopher D. Matzner, Philip C. Myers, James Di
  Francesco, Paola Caselli, Felipe O. Alves, Ana Chac\'on-Tanarro, How-Huan
  Chen, Michael Chun-Yuan Chen, Jared Keown, Anna Punanova, Young Min Seo,
  Yancy Shirley, Adam Ginsburg, Christine Hall, Ayushi Singh, H\'ector G. Arce,
  Alyssa A. Goodman, Peter Martin, and Elena Redaelli","The Green Bank Ammonia Survey: Dense Cores Under Pressure in Orion A","Accepted for publication in ApJ Aug 10, 2017",,"10.3847/1538-4357/aa8631",,"astro-ph.GA","http://arxiv.org/licenses/nonexclusive-distrib/1.0/","  We use gas temperature and velocity dispersion data from the Green Bank
Ammonia Survey and core masses and sizes from the James Clerk Maxwell Telescope
Gould Belt Survey to estimate the virial states of dense cores within the Orion
A molecular cloud. Surprisingly, we find that almost none of the dense cores
are sufficiently massive to be bound when considering only the balance between
self-gravity and the thermal and non-thermal motions present in the dense gas.
Including the additional pressure binding imposed by the weight of the ambient
molecular cloud material and additional smaller pressure terms, however,
suggests that most of the dense cores are pressure confined.
","[{""version"":""v1"",""created"":""Thu, 17 Aug 2017 20:15:35 GMT""}]","2017-09-20"
"1708.05427","Daniel Errandonea","Daniel Errandonea, David Santamaria-Perez, Domingo Martinez-Garcia,
  Oscar Gomis, Rakesh Shukla, S. Nagabhusan Achary, Avesh K. Tyagi, and Catalin
  Popescu","Pressure impact on the stability and distortion of the crystal structure
  of CeScO3","39 pages, 1 table, 9 figures","Inorg. Chem., 56, pp 8363-8371 (2017)","10.1021/acs.inorgchem.7b01042",,"cond-mat.mtrl-sci cond-mat.other physics.chem-ph","http://arxiv.org/licenses/nonexclusive-distrib/1.0/","  The effects of high pressure on the crystal structure of orthorhombic (Pnma)
perovskite type cerium scandate have been studied in situ under high pressure
by means of synchrotron x-ray powder diffraction, using a diamond anvil cell.
We have found that the perovskite type crystal structure remains stable up to
40 GPa, the highest pressure reached in the experiments. The evolution of
unit-cell parameters with pressure has indicated an anisotropic compression.
The room-temperature pressure-volume equation of state is obtained from the
experiments. From the evolution of microscopic structural parameters like bond
distances and coordination polyhedra of cerium and scandium, the macroscopic
behavior of CeScO3 under compression has been explained and reasoned for its
large pressure stability. The reported results are discussed in comparison with
high-pressure results from other perovskites.
","[{""version"":""v1"",""created"":""Thu, 17 Aug 2017 20:16:26 GMT""}]","2017-08-21"
"1708.05428","Christoph Mayrhofer","Anamar\'ia Font and Christoph Mayrhofer","Non-Geometric Vacua of the $\mathbf{\text{Spin}(32)/\mathbb Z_2}$
  Heterotic String and Little String Theories","39 pages, 3 figures, and 6 tables",,"10.1007/JHEP11(2017)064",,"hep-th","http://arxiv.org/licenses/nonexclusive-distrib/1.0/","  We study a class of 6d $\mathcal{N}=(1,0)$ non-geometric vacua of the
$\text{Spin}(32)/\mathbb Z_2$ heterotic string which can be understood as
fibrations of genus-two curves over a complex one-dimensional base. The 6d
$\mathcal{N}=(1,0)$ theories living on the defects that arise when the
genus-two fiber degenerates at a point of the base are analyzed by dualizing to
F-theory on elliptic K3-fibered non-compact Calabi-Yau threefolds. We consider
all possible degenerations of genus-two curves and systematically attempt to
resolve the singularities of the dual threefolds. As in the analogous
non-geometric vacua of the $E_8\times E_8$ heterotic string, we find that many
of the resulting dual threefolds contain singularities which do not admit a
crepant resolution. When the singularities can be resolved crepantly, we
determine the emerging effective theories which turn out to be little string
theories at a generic point on their tensor branch. We also observe a form of
duality in which theories living on distinct defects are the same.
","[{""version"":""v1"",""created"":""Thu, 17 Aug 2017 20:20:18 GMT""}]","2017-12-06"
"1708.05429","David Arnett","David Arnett","A. G. W. Cameron 1925-2005, Biographical Memoir, National Academy of
  Sciences","12 pages, I picture",,,,"physics.hist-ph astro-ph.EP astro-ph.SR","http://arxiv.org/licenses/nonexclusive-distrib/1.0/","  Alastair Graham Walker Cameron was an astrophysicist and planetary scientist
of broad interests and exceptional originality. A founder of the field of
nuclear astrophysics, he developed the theoretical understanding of the
chemical elements origins and made pioneering connections between the
abundances of elements in meteorites to advance the theory that the Moon
originated from a giant impact with the young Earth by an object at least the
size of Mars. Cameron was an early and persistent exploiter of computer
technology in the theoretical study of complex astronomical systemsincluding
nuclear reactions in supernovae, the structure of neutron stars, and planetary
collisions.
","[{""version"":""v1"",""created"":""Thu, 17 Aug 2017 20:26:46 GMT""}]","2017-08-21"
"1708.05430","Biman Bagchi -","Puja Banerjee and Biman Bagchi","A mode-coupling theory analysis of the rotation driven translational
  motion of aqueous polyatomic ions",,,"10.1063/1.4994631",,"physics.chem-ph cond-mat.soft","http://arxiv.org/licenses/nonexclusive-distrib/1.0/","  In contrast to simple monatomic alkali and halide ions, complex polyatomic
ions like nitrate, acetate, nitrite, chlorate etc. have not been studied in any
great detail. Experiments have shown that diffusion of polyatomic ions exhibits
many remarkable anomalies, notable among them is the fact that polyatomic ions
with similar size show large difference in their diffusivity values. This fact
has drawn relatively little interest in scientific discussions. We show here
that a mode-coupling theory (MCT) can provide a physically meaningful
interpretation of the anomalous diffusivity of polyatomic ions in water, by
including the contribution of rotational jumps on translational friction. The
two systems discussed here, namely aqueous nitrate ion and aqueous acetate ion,
although have similar ionic radii exhibit largely different diffusivity values
due to the differences in the rate of their rotational jump motions. We have
further verified the mode-coupling theory formalism by comparing it with
experimental and simulation results that agrees well with the theoretical
prediction.
","[{""version"":""v1"",""created"":""Thu, 17 Aug 2017 20:29:33 GMT""}]","2017-10-11"
"1708.05431","Chengyu Yan","Chengyu Yan, Sanjeev Kumar, Michael Pepper, Patrick See, Ian Farrer,
  David Ritchie, Jonathan Griffiths, Geraint Jones","Interference Effects in a Tunable Quantum Point Contact Integrated with
  an Electronic Cavity",,"Physical Review APPLIED 8, 024009 (2017)","10.1103/PhysRevApplied.8.024009",,"cond-mat.mes-hall","http://creativecommons.org/licenses/by/4.0/","  We show experimentally how quantum interference can be produced using an
integrated quantum system comprising an arch-shaped short quantum wire (or
quantum point contact, QPC) of 1D electrons and a reflector forming an
electronic cavity. On tuning the coupling between the QPC and the electronic
cavity, fine oscillations are observed when the arch QPC is operated in the
quasi-1D regime. These oscillations correspond to interference between the 1D
states and a state which is similar to the Fabry-Perot state and suppressed by
a small transverse magnetic field of 60mT. Tuning the reflector, we find a peak
in resistance which follows the behavior expected for a Fano resonance. We
suggest that this is an interesting example of a Fano resonance in an open
system which corresponds to interference at or near the Ohmic contacts due to a
directly propagating, reflected discrete path and the continuum states of the
cavity corresponding to multiple scattering. Remarkably, the Fano factor shows
an oscillatory behavior taking peaks for each fine oscillation, thus,
confirming coupling between the discrete and continuum states. The results
indicate that such a simple quantum device can be used as building blocks to
create more complex integrated quantum circuits for possible applications
ranging from quantum-information processing to realizing the fundamentals of
complex quantum systems.
","[{""version"":""v1"",""created"":""Thu, 17 Aug 2017 20:36:36 GMT""}]","2017-08-21"
"1708.05432","Edward S. Letzter","Edward S. Letzter, Linhong Wang, and Xingting Wang","On $q$-commutative power and Laurent series rings at roots of unity",,,,,"math.RA math.QA","http://arxiv.org/licenses/nonexclusive-distrib/1.0/","  We continue the first and second authors' study of $q$-commutative power
series rings $R=k_q[[x_1,\ldots,x_n]]$ and Laurent series rings $L=k_q[[x^{\pm
1}_1,\ldots,x^{\pm 1}_n]]$, specializing to the case in which the commutation
parameters $q_{ij}$ are all roots of unity. In this setting, $R$ is a PI
algebra, and we can apply results of De Concini, Kac, and Procesi to show that
$L$ is an Azumaya algebra whose degree can be inferred from the $q_{ij}$. Our
main result establishes an exact criterion (dependent on the $q_{ij}$) for
determining when the centers of $L$ and $R$ are commutative Laurent series and
commutative power series rings, respectively. In the event this criterion is
satisfied, it follows that $L$ is a unique factorization ring in the sense of
Chatters and Jordan, and it further follows, by results of Dumas, Launois,
Lenagan, and Rigal, that $R$ is a unique factorization ring. We thus produce
new examples of complete, local, noetherian, noncommutative, unique
factorization rings (that are PI domains).
","[{""version"":""v1"",""created"":""Thu, 17 Aug 2017 20:41:47 GMT""}]","2017-08-21"
"1708.05433","Liang Zheng Tan","Liang Z. Tan and Andrew M. Rappe","Upper limit on nonlinear optical processes: shift current and second
  harmonic generation in extended systems","19 pages, 4 figures","Phys. Rev. B 100, 085102 (2019)","10.1103/PhysRevB.100.085102",,"cond-mat.mes-hall cond-mat.mtrl-sci physics.optics quant-ph","http://arxiv.org/licenses/nonexclusive-distrib/1.0/","  The response functions of a material characterize its behavior under external
stimuli, such as electromagnetic radiation. Such responses may grow linearly
with the amplitude of the incident radiation, as is the case of absorption, or
may be nonlinear. The latter category includes a diverse set of phenomena such
as second harmonic generation (SHG), shift current, sum frequency generation,
and excited state absorption, among others. Despite decades of research into
nonlinear response theory, and the occasional discovery of materials with large
nonlinear responses, there has been no systematic investigation into the
maximum amount of nonlinear optical response attainable in solid-state
materials. In this work, we present an upper bound on the second-order response
functions of materials, which controls the SHG and shift current responses. We
show that this bound depends on the band gap, band width, and geometrical
properties of the material in question. We find that Kuzyk's bound for the
maximum SHG of isolated molecules can be exceeded by conjugation or
condensation of molecules to form molecular solids, and that strongly coupled
systems generally have larger responses than weakly coupled or isolated ones.
As a proof of principle, we perform first-principles calculations of the
response tensors of a wide variety of materials, finding that the materials in
our database do not yet saturate the upper bound. This suggests that new large
SHG and shift current materials will likely be discovered by future materials
research guided by the factors mentioned in this work.
","[{""version"":""v1"",""created"":""Thu, 17 Aug 2017 20:43:15 GMT""}]","2019-08-07"
"1708.05434","Piotr Rzeszut","Piotr Rzeszut, Witold Skowro\'nski, S{\l}awomir Zi\k{e}tek, Piotr
  Ogrodnik and Tomasz Stobiecki","Biaxial magnetic field setup for angular magnetic measurements of thin
  films and spintronic nanodevices",,,"10.1109/TMAG.2018.2845871",,"physics.app-ph cond-mat.mes-hall","http://arxiv.org/licenses/nonexclusive-distrib/1.0/","  The biaxial magnetic-field setup for angular magnetic measurements of thin
film and spintronic devices is designed and presented. The setup allows for
application of the in-plane magnetic field using a quadrupole electromagnet,
controlled by power supply units and integrated with an electromagnet biaxial
magnetic field sensor. In addition, the probe station is equipped with a
microwave circuitry, which enables angle-resolved spin torque oscillation
measurements. The angular dependencies of magnetoresistance and spin diode
effect in a giant magnetoresistance strip are shown as an operational
verification of the experimental setup. We adapted an analytical macrospin
model to reproduce both the resistance and spin-diode angular dependency
measurements.
","[{""version"":""v1"",""created"":""Thu, 17 Aug 2017 20:44:32 GMT""}]","2019-03-22"
"1708.05435","Slobodan Vucetic","Slobodan Vucetic, Ashis Kumar Chanda, Shanshan Zhang, Tian Bai,
  Aniruddha Maiti","Faculty citation measures are highly correlated with peer assessment of
  computer science doctoral programs",,,,,"cs.DL","http://arxiv.org/licenses/nonexclusive-distrib/1.0/","  We study relationship between peer assessment of quality of U.S. Computer
Science (CS) doctoral programs and objective measures of research strength of
those programs. In Fall 2016 we collected Google Scholar citation data for
4,352 tenure-track CS faculty from 173 U.S. universities. The citations are
measured by the t10 index, which represents the number of citations received by
the 10th highest cited paper of a faculty. To measure the research strength of
a CS doctoral program we use 2 groups of citation measures. The first group of
measures averages t10 of faculty in a program. Pearson correlation of those
measures with the peer assessment of U.S. CS doctoral programs published by the
U.S. News in 2014 is as high as 0.890. The second group of measures counts the
number of well cited faculty in a program. Pearson correlation of those
measures with the peer assessment is as high as 0.909. By combining those two
groups of measures using linear regression, we create the Scholar score whose
Pearson correlation with the peer assessment is 0.933 and which explains 87.2%
of the variance in the peer assessment. Our evaluation shows that the highest
62 ranked CS doctoral programs by the U.S. News peer assessment are much higher
correlated with the Scholar score than the next 57 ranked programs, indicating
the deficiencies of peer assessment of less-known CS programs. Our results also
indicate that university reputation might have a sizeable impact on peer
assessment of CS doctoral programs. To promote transparency, the raw data and
the codes used in this study are made available to research community at
http://www.dabi.temple.edu/~vucetic/CSranking/.
","[{""version"":""v1"",""created"":""Thu, 17 Aug 2017 20:46:28 GMT""}]","2017-08-21"
