"1708.05507","Tiege McCarthy","Tiege P. McCarthy, Simon P. Ellingsen, Xi Chen, Shari L. Breen, Maxim
  A. Voronkov and Hai-hua Qiao","Detection of 36 GHz Class I Methanol Maser Emission Towards NGC 4945","7 pages, 3 figures, 1 table",,"10.3847/1538-4357/aa872c",,"astro-ph.GA","http://arxiv.org/licenses/nonexclusive-distrib/1.0/","  We have searched for emission from the 36.2 GHz ($4_{-1} \rightarrow 3_0$E)
methanol transition towards NGC 4945, using the Australia Telescope Compact
Array. 36.2 GHz methanol emission was detected offset south-east from the
Galactic nucleus. The methanol emission is narrow, with a linewidth <10
kms$^{-1}$, and a luminosity five orders of magnitude higher than Galactic
class I masers from the same transition. These characteristics combined the
with physical separation from the strong central thermal emission suggests that
the methanol emission is a maser. This emission is a factor of $\sim90$ more
luminous than the widespread emission detected from the Milky Way central
molecular zone (CMZ). This is the fourth detection of extragalactic class I
emission, and the third detection of extragalactic 36.2 GHz maser emission.
These extragalactic class I methanol masers do not appear to be simply highly
luminous variants of Galactic class I emission, and instead appear to trace
large-scale regions of low-velocity shocks in molecular gas, which may precede,
or be associated with, the early stages of large-scale star formation.
","[{""version"":""v1"",""created"":""Fri, 18 Aug 2017 04:25:50 GMT""}]","2018-11-21"
"1708.05508","Naim Rashid","Naim U. Rashid, Quefeng Li, Jen Jen Yeh, and Joseph G. Ibrahim","Modeling Between-Study Heterogeneity for Improved Reproducibility in
  Gene Signature Selection and Clinical Prediction",,,,,"stat.ME stat.AP","http://arxiv.org/licenses/nonexclusive-distrib/1.0/","  In the genomic era, the identification of gene signatures associated with
disease is of significant interest. Such signatures are often used to predict
clinical outcomes in new patients and aid clinical decision-making. However,
recent studies have shown that gene signatures are often not replicable. This
occurrence has practical implications regarding the generalizability and
clinical applicability of such signatures. To improve replicability, we
introduce a novel approach to select gene signatures from multiple datasets
whose effects are consistently non-zero and account for between-study
heterogeneity. We build our model upon some rank-based quantities, facilitating
integration over different genomic datasets. A high dimensional penalized
Generalized Linear Mixed Model (pGLMM) is used to select gene signatures and
address data heterogeneity. We compare our method to some commonly used
strategies that select gene signatures ignoring between-study heterogeneity. We
provide asymptotic results justifying the performance of our method and
demonstrate its advantage in the presence of heterogeneity through thorough
simulation studies. Lastly, we motivate our method through a case study
subtyping pancreatic cancer patients from four gene expression studies.
","[{""version"":""v1"",""created"":""Fri, 18 Aug 2017 04:40:06 GMT""},{""version"":""v2"",""created"":""Tue, 26 Mar 2019 16:37:58 GMT""}]","2019-03-27"
"1708.05509","Yingtao Tian","Yanghua Jin, Jiakai Zhang, Minjun Li, Yingtao Tian, Huachun Zhu,
  Zhihao Fang","Towards the Automatic Anime Characters Creation with Generative
  Adversarial Networks","16 pages, 15 figures. This paper is presented as a Doujinshi in
  Comiket 92, summer 2017, with the booth number 05a, East-U, Third Day",,,,"cs.CV","http://arxiv.org/licenses/nonexclusive-distrib/1.0/","  Automatic generation of facial images has been well studied after the
Generative Adversarial Network (GAN) came out. There exists some attempts
applying the GAN model to the problem of generating facial images of anime
characters, but none of the existing work gives a promising result. In this
work, we explore the training of GAN models specialized on an anime facial
image dataset. We address the issue from both the data and the model aspect, by
collecting a more clean, well-suited dataset and leverage proper, empirical
application of DRAGAN. With quantitative analysis and case studies we
demonstrate that our efforts lead to a stable and high-quality model. Moreover,
to assist people with anime character design, we build a website
(http://make.girls.moe) with our pre-trained model available online, which
makes the model easily accessible to general public.
","[{""version"":""v1"",""created"":""Fri, 18 Aug 2017 04:57:28 GMT""}]","2017-08-21"
"1708.05510","Theja Tulabandhula","Deeksha Sinha and Theja Tulabandhula","Optimizing Revenue over Data-driven Assortments","28 pages, 4 figures",,,,"math.OC cs.DS","http://arxiv.org/licenses/nonexclusive-distrib/1.0/","  We revisit the problem of large-scale assortment optimization under the
multinomial logit choice model without any assumptions on the structure of the
feasible assortments. Scalable real-time assortment optimization has become
essential in e-commerce operations due to the need for personalization and the
availability of a large variety of items. While this can be done when there are
simplistic assortment choices to be made, not imposing any constraints on the
collection of feasible assortments gives more flexibility to incorporate
insights of store-managers and historically well-performing assortments. We
design fast and flexible algorithms based on variations of binary search that
find the revenue of the (approximately) optimal assortment. We speed up the
comparisons steps using novel vector space embeddings, based on advances in the
information retrieval literature. For an arbitrary collection of assortments,
our algorithms can find a solution in time that is sub-linear in the number of
assortments and for the simpler case of cardinality constraints - linear in the
number of items (existing methods are quadratic or worse). Empirical
validations using the Billion Prices dataset and several retail transaction
datasets show that our algorithms are competitive even when the number of items
is $\sim 10^5$ ($100$x larger instances than previously studied).
","[{""version"":""v1"",""created"":""Fri, 18 Aug 2017 05:05:49 GMT""},{""version"":""v2"",""created"":""Tue, 1 May 2018 04:44:44 GMT""}]","2018-05-02"
"1708.05511","Thomas Schmidt","Katthaleeya Daowsud and Thomas A. Schmidt","Continued fractions for rational torsion","Corrected false statement (due to a clerical error)","J. Number Theory, 189 (2018), 115-130",,,"math.NT","http://arxiv.org/licenses/nonexclusive-distrib/1.0/","  We exhibit a method to use continued fractions in function fields to find new
families of hyperelliptic curves over the rationals with given torsion order in
their Jacobians. To show the utility of the method, we exhibit a new infinite
family of curves over $\mathbb Q$ with genus two whose Jacobians have torsion
order eleven.
  {\bf In this updated version, we correct an error in the initial paper:} The
``new"" family claimed in the original Theorem~1 was pointed out by Professor
D.~Lorenzini to have elements isomorphic with elements in Flynn's family (as
defined in the paper); his guess that the families were the same up to
element-wise isomorphism is correct. Here, we give a family that is new; the
old proof, now free of clerical error (we had replaced our $g_u(x)$ by
$1+g_u(x)$ when determining Igusa invariants), holds. Changes from the original
version are flagged by {\color{red} UPDATED}; there are three of these: the new
family $g_u(x)$; its partial quotients; the way to solve in the naive approach
to find this new family. (We also added an acknowledgement section.) Finally,
as an appendix we include a PDF export of Maple calculations verifying our
correction.
","[{""version"":""v1"",""created"":""Fri, 18 Aug 2017 05:16:50 GMT""},{""version"":""v2"",""created"":""Fri, 19 Aug 2022 21:41:05 GMT""}]","2022-08-23"
"1708.05512","Sanping Zhou","Sanping Zhou, Jinjun Wang, Rui Shi, Qiqi Hou, Yihong Gong, Nanning
  Zheng","Large Margin Learning in Set to Set Similarity Comparison for Person
  Re-identification","Accepted by IEEE Transactions on Multimedia",,,,"cs.CV cs.LG stat.ML","http://arxiv.org/licenses/nonexclusive-distrib/1.0/","  Person re-identification (Re-ID) aims at matching images of the same person
across disjoint camera views, which is a challenging problem in multimedia
analysis, multimedia editing and content-based media retrieval communities. The
major challenge lies in how to preserve similarity of the same person across
video footages with large appearance variations, while discriminating different
individuals. To address this problem, conventional methods usually consider the
pairwise similarity between persons by only measuring the point to point (P2P)
distance. In this paper, we propose to use deep learning technique to model a
novel set to set (S2S) distance, in which the underline objective focuses on
preserving the compactness of intra-class samples for each camera view, while
maximizing the margin between the intra-class set and inter-class set. The S2S
distance metric is consisted of three terms, namely the class-identity term,
the relative distance term and the regularization term. The class-identity term
keeps the intra-class samples within each camera view gathering together, the
relative distance term maximizes the distance between the intra-class class set
and inter-class set across different camera views, and the regularization term
smoothness the parameters of deep convolutional neural network (CNN). As a
result, the final learned deep model can effectively find out the matched
target to the probe object among various candidates in the video gallery by
learning discriminative and stable feature representations. Using the CUHK01,
CUHK03, PRID2011 and Market1501 benchmark datasets, we extensively conducted
comparative evaluations to demonstrate the advantages of our method over the
state-of-the-art approaches.
","[{""version"":""v1"",""created"":""Fri, 18 Aug 2017 05:19:01 GMT""}]","2017-08-21"
"1708.05513","Jean-Luc Margot","Adam H. Greenberg, Jean-Luc Margot, Ashok K. Verma, Patrick A. Taylor,
  Susan E. Hodge","Yarkovsky Drift Detections for 247 Near-Earth Asteroids","27 pages, 9 figures, published in the Astronomical Journal, 159, 92,
  2020",,"10.3847/1538-3881/ab62a3",,"astro-ph.EP","http://arxiv.org/licenses/nonexclusive-distrib/1.0/","  The Yarkovsky effect is a thermal process acting upon the orbits of small
celestial bodies, which can cause these orbits to slowly expand or contract
with time. The effect is subtle (da/dt ~ 10^-4 au/My for a 1 km diameter
object) and is thus generally difficult to measure. We analyzed both optical
and radar astrometry for 600 near-Earth asteroids (NEAs) for the purpose of
detecting and quantifying the Yarkovsky effect. We present 247 NEAs with
measured drift rates, which is the largest published set of Yarkovsky
detections. This large sample size provides an opportunity to examine the
Yarkovsky effect in a statistical manner. In particular, we describe two
independent population-based tests that verify the measurement of Yarkovsky
orbital drift. First, we provide observational confirmation for the Yarkovsky
effect's theoretical size dependence of 1/D, where D is diameter. Second, we
find that the observed ratio of negative to positive drift rates in our sample
is 2.34, which, accounting for bias and sampling uncertainty, implies an actual
ratio of $2.7^{+0.3}_{-0.7}$. This ratio has a vanishingly small probability of
occurring due to chance or statistical noise. The observed ratio of retrograde
to prograde rotators is two times lower than the ratio expected from numerical
predictions from NEA population studies and traditional assumptions about the
sense of rotation of NEAs originating from various main belt escape routes. We
also examine the efficiency with which solar energy is converted into orbital
energy and find a median efficiency in our sample of 12%. We interpret this
efficiency in terms of NEA spin and thermal properties.
","[{""version"":""v1"",""created"":""Fri, 18 Aug 2017 05:49:08 GMT""},{""version"":""v2"",""created"":""Mon, 21 Aug 2017 16:58:51 GMT""},{""version"":""v3"",""created"":""Sat, 26 Aug 2017 19:09:22 GMT""},{""version"":""v4"",""created"":""Tue, 14 Jan 2020 17:33:10 GMT""},{""version"":""v5"",""created"":""Fri, 7 Feb 2020 17:21:40 GMT""}]","2020-02-10"
"1708.05514","Weimin Wang","Weimin Wang, Ken Sakurada, Nobuo Kawaguchi","Reflectance Intensity Assisted Automatic and Accurate Extrinsic
  Calibration of 3D LiDAR and Panoramic Camera Using a Printed Chessboard","20 pages, submitted to the journal of Remote Sensing","Remote Sensing, 9(8):851 (2017)","10.3390/rs9080851",,"cs.CV cs.RO","http://arxiv.org/licenses/nonexclusive-distrib/1.0/","  This paper presents a novel method for fully automatic and convenient
extrinsic calibration of a 3D LiDAR and a panoramic camera with a normally
printed chessboard. The proposed method is based on the 3D corner estimation of
the chessboard from the sparse point cloud generated by one frame scan of the
LiDAR. To estimate the corners, we formulate a full-scale model of the
chessboard and fit it to the segmented 3D points of the chessboard. The model
is fitted by optimizing the cost function under constraints of correlation
between the reflectance intensity of laser and the color of the chessboard's
patterns. Powell's method is introduced for resolving the discontinuity problem
in optimization. The corners of the fitted model are considered as the 3D
corners of the chessboard. Once the corners of the chessboard in the 3D point
cloud are estimated, the extrinsic calibration of the two sensors is converted
to a 3D-2D matching problem. The corresponding 3D-2D points are used to
calculate the absolute pose of the two sensors with Unified Perspective-n-Point
(UPnP). Further, the calculated parameters are regarded as initial values and
are refined using the Levenberg-Marquardt method. The performance of the
proposed corner detection method from the 3D point cloud is evaluated using
simulations. The results of experiments, conducted on a Velodyne HDL-32e LiDAR
and a Ladybug3 camera under the proposed re-projection error metric,
qualitatively and quantitatively demonstrate the accuracy and stability of the
final extrinsic calibration parameters.
","[{""version"":""v1"",""created"":""Fri, 18 Aug 2017 05:58:02 GMT""}]","2017-08-21"
"1708.05515","Seunghak Yu","Seunghak Yu, Nilesh Kulkarni, Haejun Lee, Jihie Kim","Syllable-level Neural Language Model for Agglutinative Language","Accepted at EMNLP 2017 workshop on Subword and Character level models
  in NLP (SCLeM)",,,,"cs.CL","http://arxiv.org/licenses/nonexclusive-distrib/1.0/","  Language models for agglutinative languages have always been hindered in past
due to myriad of agglutinations possible to any given word through various
affixes. We propose a method to diminish the problem of out-of-vocabulary words
by introducing an embedding derived from syllables and morphemes which
leverages the agglutinative property. Our model outperforms character-level
embedding in perplexity by 16.87 with 9.50M parameters. Proposed method
achieves state of the art performance over existing input prediction methods in
terms of Key Stroke Saving and has been commercialized.
","[{""version"":""v1"",""created"":""Fri, 18 Aug 2017 06:02:16 GMT""}]","2017-08-21"
"1708.05516","Nikolay Pogodaev","Nikolay Pogodaev","Numerical Algorithm for Optimal Control of Continuity Equations",,,,,"math.OC","http://arxiv.org/licenses/nonexclusive-distrib/1.0/","  An optimal control problem for the continuity equation is considered. The aim
of a controller is to maximize the total mass within a target set at a given
type moment. An iterative numerical algorithm for solving this problem is
presented.
","[{""version"":""v1"",""created"":""Fri, 18 Aug 2017 06:08:57 GMT""}]","2017-08-21"
"1708.05517","Maram Hasanain","Maram Hasanain, Reem Suwaileh, Tamer Elsayed, Mucahid Kutlu and Hind
  Almerekhi","EveTAR: Building a Large-Scale Multi-Task Test Collection over Arabic
  Tweets",,,,,"cs.IR","http://arxiv.org/licenses/nonexclusive-distrib/1.0/","  This article introduces a new language-independent approach for creating a
large-scale high-quality test collection of tweets that supports multiple
information retrieval (IR) tasks without running a shared-task campaign. The
adopted approach (demonstrated over Arabic tweets) designs the collection
around significant (i.e., popular) events, which enables the development of
topics that represent frequent information needs of Twitter users for which
rich content exists. That inherently facilitates the support of multiple tasks
that generally revolve around events, namely event detection, ad-hoc search,
timeline generation, and real-time summarization. The key highlights of the
approach include diversifying the judgment pool via interactive search and
multiple manually-crafted queries per topic, collecting high-quality
annotations via crowd-workers for relevancy and in-house annotators for
novelty, filtering out low-agreement topics and inaccessible tweets, and
providing multiple subsets of the collection for better availability. Applying
our methodology on Arabic tweets resulted in EveTAR , the first
freely-available tweet test collection for multiple IR tasks. EveTAR includes a
crawl of 355M Arabic tweets and covers 50 significant events for which about
62K tweets were judged with substantial average inter-annotator agreement
(Kappa value of 0.71). We demonstrate the usability of EveTAR by evaluating
existing algorithms in the respective tasks. Results indicate that the new
collection can support reliable ranking of IR systems that is comparable to
similar TREC collections, while providing strong baseline results for future
studies over Arabic tweets.
","[{""version"":""v1"",""created"":""Fri, 18 Aug 2017 06:12:40 GMT""},{""version"":""v2"",""created"":""Mon, 21 Aug 2017 10:13:15 GMT""}]","2017-08-22"
"1708.05518","Hsin-Chieh Liao","Sen-Peng Eu, Tung-Shan Fu, Hsiang-Chun Hsu, Hsin-Chieh Liao","Signed Countings of types B and D permutations and $t,q$-Euler Numbers","21 pages, 3 figures. This version is revised to referee's comments.
  Typos corrected. To appear in Advanced in Applied Mathematics",,,,"math.CO","http://arxiv.org/licenses/nonexclusive-distrib/1.0/","  It is a classical result that the parity-balance of the number of weak
excedances of all permutations (derangements, respectively) of length $n$ is
the Euler number $E_n$, alternating in sign, if $n$ is odd (even,
respectively). Josuat-Verg\`{e}s obtained a $q$-analog of the results
respecting the number of crossings of a permutation. One of the goals in this
paper is to extend the results to the permutations (derangements, respectively)
of types B and D, on the basis of the joint distribution in statistics
excedances, crossings and the number of negative entries obtained by Corteel,
Josuat-Verg\`{e}s and Kim.
  Springer numbers are analogous Euler numbers that count the alternating
permutations of type B, called snakes. Josuat-Verg\`{e}s derived bivariate
polynomials $Q_n(t,q)$ and $R_n(t,q)$ as generalized Euler numbers via
successive $q$-derivatives and multiplications by $t$ on polynomials in $t$.
The other goal in this paper is to give a combinatorial interpretation of
$Q_n(t,q)$ and $R_n(t,q)$ as the enumerators of the snakes with restrictions.
","[{""version"":""v1"",""created"":""Fri, 18 Aug 2017 06:51:29 GMT""},{""version"":""v2"",""created"":""Sat, 3 Feb 2018 07:43:09 GMT""}]","2018-02-06"
"1708.05519","Madeline Marshall","Madeline A. Marshall, Stanislav S. Shabala, Martin G. H. Krause, Kevin
  A. Pimbblet, Darren J. Croton, Matt S. Owers","Triggering Active Galactic Nuclei in galaxy clusters","15 pages, 12 figures. Accepted for publication in MNRAS",,"10.1093/mnras/stx2996",,"astro-ph.GA","http://arxiv.org/licenses/nonexclusive-distrib/1.0/","  We model the triggering of Active Galactic Nuclei (AGN) in galaxy clusters
using the semi- analytic galaxy formation model SAGE (?). We prescribe
triggering methods based on the ram pressure galaxies experience as they move
throughout the intracluster medium, which is hypothesized to trigger star
formation and AGN activity. The clustercentric radius and velocity distribution
of the simulated active galaxies produced by these models are compared with
that of AGN and galaxies with intense star formation from a sample of
low-redshift, relaxed clusters from the Sloan Digital Sky Survey. The ram
pressure triggering model that best explains the clustercentric radius and
velocity distribution of these observed galaxies has AGN and star formation
triggered if $2.5\times10^{-14} < P_{ram} < 2.5\times10^{-13}$ Pa and $P_{ram}
> 2P_{internal}$; this is consistent with expectations from hydrodynamical
simulations of ram-pressure induced star formation. Our results show that ram
pressure is likely to be an important mechanism for triggering star formation
and AGN activity in clusters.
","[{""version"":""v1"",""created"":""Fri, 18 Aug 2017 06:57:26 GMT""},{""version"":""v2"",""created"":""Mon, 20 Nov 2017 21:24:58 GMT""}]","2017-12-27"
"1708.05520","Steffen Rechner","Steffen Rechner","An Optimal Realization Algorithm for Bipartite Graphs with Degrees in
  Prescribed Intervals","Submitted to the Journal of Discrete Algorithms",,,,"cs.DS cs.DM","http://arxiv.org/licenses/nonexclusive-distrib/1.0/","  We consider the problem of constructing a bipartite graph whose degrees lie
in prescribed intervals. Necessary and sufficient conditions for the existence
of such graphs are well-known. However, existing realization algorithms suffer
from large running times. In this paper, we present a realization algorithm
that constructs an appropriate bipartite graph G=(U,V,E) in O(|U| + |V| + |E|)
time, which is asymptotically optimal. In addition, we show that our algorithm
produces edge-minimal bipartite graphs and that it can easily be modified to
construct edge-maximal graphs.
","[{""version"":""v1"",""created"":""Fri, 18 Aug 2017 06:58:37 GMT""}]","2017-08-21"
"1708.05521","Edison Marrese-Taylor","Edison Marrese-Taylor, Yutaka Matsuo","EmoAtt at EmoInt-2017: Inner attention sentence embedding for Emotion
  Intensity","WASSA 2017 Shared Task on Emotion Intensity",,,,"cs.CL","http://arxiv.org/licenses/nonexclusive-distrib/1.0/","  In this paper we describe a deep learning system that has been designed and
built for the WASSA 2017 Emotion Intensity Shared Task. We introduce a
representation learning approach based on inner attention on top of an RNN.
Results show that our model offers good capabilities and is able to
successfully identify emotion-bearing words to predict intensity without
leveraging on lexicons, obtaining the 13th place among 22 shared task
competitors.
","[{""version"":""v1"",""created"":""Fri, 18 Aug 2017 06:59:16 GMT""}]","2017-08-21"
"1708.05522","Shufeng Kong","Shufeng Kong, Sanjiang Li, Michael Sioutis","Exploring Directional Path-Consistency for Solving Constraint Networks",,,"10.1093/comjnl/bxx122",,"cs.AI","http://arxiv.org/licenses/nonexclusive-distrib/1.0/","  Among the local consistency techniques used for solving constraint networks,
path-consistency (PC) has received a great deal of attention. However,
enforcing PC is computationally expensive and sometimes even unnecessary.
Directional path-consistency (DPC) is a weaker notion of PC that considers a
given variable ordering and can thus be enforced more efficiently than PC. This
paper shows that DPC (the DPC enforcing algorithm of Dechter and Pearl) decides
the constraint satisfaction problem (CSP) of a constraint language if it is
complete and has the variable elimination property (VEP). However, we also show
that no complete VEP constraint language can have a domain with more than 2
values. We then present a simple variant of the DPC algorithm, called DPC*, and
show that the CSP of a constraint language can be decided by DPC* if it is
closed under a majority operation. In fact, DPC* is sufficient for guaranteeing
backtrack-free search for such constraint networks. Examples of majority-closed
constraint classes include the classes of connected row-convex (CRC)
constraints and tree-preserving constraints, which have found applications in
various domains, such as scene labeling, temporal reasoning, geometric
reasoning, and logical filtering. Our experimental evaluations show that DPC*
significantly outperforms the state-of-the-art algorithms for solving
majority-closed constraints.
","[{""version"":""v1"",""created"":""Fri, 18 Aug 2017 07:06:23 GMT""}]","2018-04-24"
"1708.05523","Jacopo Gandini","Jacopo Gandini, Andrea Maffei","The Bruhat order on Hermitian symmetric varieties and on abelian
  nilradicals","Final version, 23 pages. Accepted for publication in Journal of the
  European Mathematical Society",,,,"math.AG","http://arxiv.org/licenses/nonexclusive-distrib/1.0/","  Let $G$ be a simple algebraic group and $P$ a parabolic subgroup of $G$ with
abelian unipotent radical $P^u$, and let $B$ be a Borel subgroup of $G$
contained in P. Let $\mathfrak{p}^u$ be the Lie algebra of $P^u$ and let $L$ be
a Levi factor of $P$, then $L$ is a Hermitian symmetric subgroup of $G$ and $B$
acts with finitely many orbits both on $\mathfrak{p}^u$ and on $G/L$. In this
paper we study the Bruhat order of the $B$-orbits in $\mathfrak{p}^u$ and in
$G/L$, proving respectively a conjecture of Panyushev and a conjecture of
Richardson and Ryan.
","[{""version"":""v1"",""created"":""Fri, 18 Aug 2017 07:13:37 GMT""},{""version"":""v2"",""created"":""Fri, 15 Sep 2017 07:28:47 GMT""},{""version"":""v3"",""created"":""Thu, 12 Jul 2018 12:23:49 GMT""}]","2018-07-13"
