"1708.06132","Arijit Bhattacharyay","A. Bhattacharyay","Equilibrium of a Brownian particle with coordinate dependent diffusivity
  and damping: Generalized Boltzmann distribution","11 pages, 1 figure",,,,"cond-mat.stat-mech","http://arxiv.org/licenses/nonexclusive-distrib/1.0/","  Fick's law for coordinate dependent diffusivity is derived. Corresponding
diffusion current in the presence of coordinate dependent diffusivity is
consistent with the form as given by Kramers-Moyal expansion. We have obtained
the equilibrium solution of the corresponding Smoluchowski equation. The
equilibrium distribution is a generalization of the Boltzmann distribution.
This generalized Boltzmann distribution involves an effective potential which
is a function of coordinate dependent diffusivity. We discuss various
implications of the existence of this generalized Boltzmann distribution for
equilibrium of systems with coordinate dependent diffusivity and damping.
","[{""version"":""v1"",""created"":""Mon, 21 Aug 2017 09:56:17 GMT""},{""version"":""v2"",""created"":""Sat, 26 Aug 2017 05:03:25 GMT""},{""version"":""v3"",""created"":""Mon, 11 Dec 2017 11:16:28 GMT""},{""version"":""v4"",""created"":""Thu, 1 Feb 2018 04:06:12 GMT""},{""version"":""v5"",""created"":""Fri, 28 Sep 2018 09:20:59 GMT""}]","2018-10-01"
"1708.06133","Tobias Felipe","T. Felipe, M. Collados, E. Khomenko, S. P. Rajaguru, M. Franz, C.
  Kuckein, A. Asensio Ramos","Signatures of the impact of flare ejected plasma on the photosphere of a
  sunspot light-bridge","Accepted for publication in A&A","A&A 608, A97 (2017)","10.1051/0004-6361/201731374",,"astro-ph.SR","http://arxiv.org/licenses/nonexclusive-distrib/1.0/","  We investigate the properties of a sunspot light-bridge, focusing on the
changes produced by the impact of a plasma blob ejected from a C-class flare.
We observed a sunspot in active region NOAA 12544 using spectropolarimetric
raster maps of the four Fe I lines around 15655 \AA\ with the GREGOR Infrared
Spectrograph (GRIS), narrow-band intensity images sampling the Fe I 6173 \AA\
line with the GREGOR Fabry-P\'erot Interferometer (GFPI), and intensity broad
band images in G-band and Ca II H band with the High-resolution Fast Imager
(HiFI). All these instruments are located at the GREGOR telescope at the
Observatorio del Teide, Tenerife, Spain. The data cover the time before,
during, and after the flare event. The analysis is complemented with
Atmospheric Imaging Assembly (AIA) and Helioseismic and Magnetic Imager (HMI)
data from the Solar Dynamics Observatory (SDO). The physical parameters of the
atmosphere at differents heights were inferred using spectral-line inversion
techniques. We identify photospheric and chromospheric brightenings, heating
events, and changes in the Stokes profiles associated to the flare eruption and
the subsequent arrival of the plasma blob to the light bridge, after traveling
along an active region loop. The measurements suggest that these phenomena are
the result of reconnection events driven by the interaction of the plasma blob
with the magnetic field topology of the light bridge.
","[{""version"":""v1"",""created"":""Mon, 21 Aug 2017 09:57:16 GMT""}]","2017-12-13"
"1708.06134","Dmitry Pelinovsky","E. Destyl, S.P. Nuiro, D.E. Pelinovsky, and P. Poullet","Stabilization of the coupled pendula chain under parametric PT-symmetric
  driving force","13 pages, 6 figures",,"10.1016/j.physleta.2017.10.021",,"nlin.PS math.DS nlin.CD","http://arxiv.org/licenses/nonexclusive-distrib/1.0/","  We consider a chain of coupled pendula pairs, where each pendulum is
connected to the nearest neighbors in the longitudinal and transverse
directions. The common strings in each pair are modulated periodically by an
external force. In the limit of small coupling and near the 1:2 parametric
resonance, we derive a novel system of coupled PT-symmetric discrete nonlinear
Schrodinger equation, which has Hamiltonian symmetry but has no gauge symmetry.
By using the conserved energy, we find the parameter range for the linear and
nonlinear stability of the zero equilibrium. Numerical experiments illustrate
how destabilization of the zero equilibrium takes place when the stability
constraints are not satisfied. The central pendulum excites nearest pendula and
this process continues until a dynamical equilibrium is reached where each
pendulum in the chain oscillates at a finite amplitude.
","[{""version"":""v1"",""created"":""Mon, 21 Aug 2017 09:57:58 GMT""}]","2017-11-22"
"1708.06135","Marcin Pi\k{a}tek dr.","Marcin Piatek and Artur R. Pietrykowski","Solving Heun's equation using conformal blocks","28 pages, revised and extended version",,,,"hep-th","http://arxiv.org/licenses/nonexclusive-distrib/1.0/","  It is known that the classical limit of the second order BPZ null vector
decoupling equation for the simplest two 5-point degenerate spherical conformal
blocks yields: (i) the normal form of the Heun equation with the complex
accessory parameter determined by the 4-point classical block on the sphere,
and (ii) a pair of the Floquet type linearly independent solutions. A key point
in a derivation of the above result is the classical asymptotic of the 5-point
degenerate blocks in which the so-called heavy and light contributions
decouple. In the present work the semi-classical heavy-light factorization of
the 5-point degenerate conformal blocks is studied. In particular, a mechanism
responsible for the decoupling of the heavy and light contributions is
identified. Moreover, it is shown that the factorization property yields a
practical method of computation of the Floquet type Heun's solutions. Finally,
it should be stressed that tools analyzed in this work have a broad spectrum of
applications, in particular, in the studies of spectral problems with the Heun
class of potentials, sphere-torus correspondence in 2d CFT, the KdV theory, the
connection problem for the Heun equation and black hole physics. These
applications are main motivations for the present work.
","[{""version"":""v1"",""created"":""Mon, 21 Aug 2017 10:00:36 GMT""},{""version"":""v2"",""created"":""Thu, 7 Sep 2017 05:22:08 GMT""},{""version"":""v3"",""created"":""Sat, 5 May 2018 21:25:17 GMT""}]","2018-05-08"
"1708.06136","Zhong-Kai Guo","Zhong-Kai Guo","The Large Number Limit of Multifield Inflation","7 pages, 3 figures","Phys. Rev. D 96, 123521 (2017)","10.1103/PhysRevD.96.123521",,"astro-ph.CO","http://arxiv.org/licenses/nonexclusive-distrib/1.0/","  We compute the tensor and scalar spectral index $n_t$, $n_s$, the
tensor-to-scalar ratio $r$, the consistency relation $n_t/r$ in the general
monomial multifield slow-roll inflation models with potentials $V
\sim\sum_i\lambda_i \left|\phi_i\right|^{p_i}$. The general models give a novel
relation that $n_t$, $n_s$ and $n_t/r$ are all proportional to the logarithm of
the number of fields $N_f$ when $N_f$ is getting extremely large with the order
of magnitude around $\mathcal{O}(10^{40})$. An upper bound $N_f\lesssim
N_*e^{ZN_*}$ is given by requiring the slow variation parameter small enough
where $N_*$ is the e-folding number and $Z$ is a function of distributions of
$\lambda_i$ and $p_i$. Besides, $n_t/r$ differs from the single-field result
$-1/8$ with substantial probability except for a few very special cases.
Finally, we derive theoretical bounds $r>2/N_*$ ($r\gtrsim0.03$) and for $n_t$
which can be tested by observation in the near future.
","[{""version"":""v1"",""created"":""Mon, 21 Aug 2017 10:05:49 GMT""},{""version"":""v2"",""created"":""Mon, 28 Aug 2017 06:44:50 GMT""}]","2017-12-21"
"1708.06137","Francois Parmentier","F.D. Parmentier, T. Cazimajou, Y. Sekine, H. Hibino, H. Irie, D.C.
  Glattli, N. Kumada, P. Roulleau","Quantum Hall effect in epitaxial graphene with permanent magnets","9 pages, 3 figures","Sci. Rep. 6, 38393 (2016)","10.1038/srep38393",,"cond-mat.mes-hall","http://creativecommons.org/licenses/by/4.0/","  We have observed the well-kown quantum Hall effect (QHE) in epitaxial
graphene grown on silicon carbide (SiC) by using, for the first time, only
commercial NdFeB permanent magnets at low temperature. The relatively large and
homogeneous magnetic field generated by the magnets, together with the high
quality of the epitaxial graphene films, enables the formation of
well-developed quantum Hall states at Landau level filling factors $\nu=\pm 2$,
commonly observed with superconducting electro-magnets. Furthermore, the
chirality of the QHE edge channels can be changed by a top gate. These results
demonstrate that basic QHE physics are experimentally accessible in graphene
for a fraction of the price of conventional setups using superconducting
magnets, which greatly increases the potential of the QHE in graphene for
research and applications.
","[{""version"":""v1"",""created"":""Mon, 21 Aug 2017 10:08:34 GMT""}]","2017-08-22"
"1708.06138","Wen Zhao","Larissa Santos and Wen Zhao","Statical properties of CMB B-mode polarisation in a partial sky analysis","7 pages, Contribution to the Proceedings of the VII International
  Workshop on Astronomy and Relativistic Astrophysics - IWARA 2016","Int. J. Mod. Phys: Conference Series 45, 1760010 (2017)","10.1142/S2010194517600102",,"astro-ph.CO astro-ph.GA","http://arxiv.org/licenses/nonexclusive-distrib/1.0/","  Measuring the imprint of primordial gravitational waves in the cosmic
microwave background (CMB) polarisation field is one of the main goals in
modern cosmology. However, the so called $B$-mode polarisation can be generated
by different sources besides the primary one predicted by inflationary
theories, known as secondary $B$-mode signal. Among them, CMB lensing and
astrophysical foregrounds play an important role. Moreover, a partial sky
analysis leads to a leakage between $E$-modes and $B$-modes. In this article,
we use the well known Minkowski functionals (MF) statistics to study the
significance of this leakage in the CMB lensing $B$-mode signal. We find that
the MF can detect the $E$-to-$B$ leakage contamination, thus it should not be
neglected in future CMB data analysis.
","[{""version"":""v1"",""created"":""Mon, 21 Aug 2017 10:18:30 GMT""}]","2017-08-22"
"1708.06139","Wen Zhao","Wen Zhao and Larissa Santos","The weird side of the Universe: Preferred axis","7 pages, Contribution to the Proceedings of the VII International
  Workshop on Astronomy and Relativistic Astrophysics - IWARA 2016","Int. J. Mod. Phys: Conference Series 45, 1760009 (2017)","10.1142/S2010194517600096",,"astro-ph.CO","http://arxiv.org/licenses/nonexclusive-distrib/1.0/","  In both WMAP and Planck observations on the temperature anisotropy of cosmic
microwave background (CMB) radiation a number of large-scale anomalies were
discovered in the past years, including the CMB parity asymmetry in the low
multipoles. By defining a directional statistics, we find that the CMB parity
asymmetry is directional dependent, and the preferred axis is stable, which
means that it is independent of the chosen CMB map, the definition of the
statistic, or the CMB masks. Meanwhile, we find that this preferred axis
strongly aligns with those of the CMB quadrupole, octopole, as well as those of
other large-scale observations. In addition, all of them aligns with the CMB
kinematic dipole, which hints to the non-cosmological origin of these
directional anomalies in cosmological observations.
","[{""version"":""v1"",""created"":""Mon, 21 Aug 2017 10:19:13 GMT""}]","2017-08-22"
"1708.06140","Eduardo Antonio Coello Perez","Eduardo Antonio Coello P\'erez, Javier Men\'endez, Achim Schwenk","Gamow-Teller and double-beta decays of heavy nuclei within an effective
  theory","17 pages, 5 figures, results extended to two-neutrino double
  beta-minus decays and two-neutrino double electron-capture decays to excited
  2+ states, matches published version","Phys. Rev. C 98, 045501 (2018)","10.1103/PhysRevC.98.045501",,"nucl-th","http://arxiv.org/licenses/nonexclusive-distrib/1.0/","  We study $\beta$ decays within an effective theory that treats nuclei as a
spherical collective core with an even number of neutrons and protons that can
couple to an additional neutron and/or proton. First we explore Gamow-Teller
$\beta$ decays of parent odd-odd nuclei into low-lying ground-, one-, and
two-phonon states of the daughter even-even system. The low-energy constants of
the effective theory are adjusted to data on $\beta$ decays to ground states or
Gamow-Teller strengths. The corresponding theoretical uncertainty is estimated
based on the power counting of the effective theory. For a variety of
medium-mass and heavy isotopes the theoretical matrix elements are in good
agreement with experiment within the theoretical uncertainties. We then study
the two-neutrino double-$\beta$ decay into ground and excited states. The
results are remarkably consistent with experiment within theoretical
uncertainties, without the necessity to adjust any low-energy constants.
","[{""version"":""v1"",""created"":""Mon, 21 Aug 2017 10:19:24 GMT""},{""version"":""v2"",""created"":""Thu, 4 Oct 2018 08:41:15 GMT""}]","2018-10-05"
"1708.06141","Zhihui Liu","Jialin Hong and Zhihui Liu","Well-posedness and Optimal Regularity of Stochastic Evolution Equations
  with Multiplicative Noises",,"J. Differential Equations 266 (2019), no. 8, 4712--4745","10.1016/j.jde.2018.10.005",,"math.AP math.PR","http://arxiv.org/licenses/nonexclusive-distrib/1.0/","  In this paper, we establish the well-posedness and optimal trajectory
regularity for the solution of stochastic evolution equations with generalized
Lipschitz-type coefficients driven by general multiplicative noises. To ensure
the well-posedness of the problem, the linear operator of the equations is only
need to be a generator of a $\CC_0$-semigroup and the proposed noises are quite
general, which include space-time white noise and rougher noises. When the
linear operator generates an analytic $\CC_0$-semigroup, we derive the optimal
trajectory regularity of the solution through a generalized criterion of
factorization method.
","[{""version"":""v1"",""created"":""Mon, 21 Aug 2017 10:21:25 GMT""},{""version"":""v2"",""created"":""Tue, 7 Nov 2017 13:23:46 GMT""},{""version"":""v3"",""created"":""Sun, 14 Jan 2018 10:15:23 GMT""},{""version"":""v4"",""created"":""Tue, 19 Jun 2018 05:16:18 GMT""}]","2019-02-25"
"1708.06142","Richard Wunsch","Richard W\""unsch, Stefanie Walch, Franti\v{s}ek Dinnbier, Anthony P.
  Whitworth","Tree-based solvers for adaptive mesh refinement code FLASH - I: gravity
  and optical depths","26 pages, 19 figures, 6 tables. Accepted by MNRAS",,"10.1093/mnras/sty015",,"astro-ph.IM astro-ph.GA","http://arxiv.org/licenses/nonexclusive-distrib/1.0/","  We describe an OctTree algorithm for the MPI-parallel, adaptive
mesh-refinement code {\sc FLASH}, which can be used to calculate the gas
self-gravity, and also the angle-averaged local optical depth, for treating
ambient diffuse radiation. The algorithm communicates to the different
processors only those parts of the tree that are needed to perform the tree
walk locally. The advantage of this approach is a relatively low memory
requirement, important in particular for the optical depth calculation, which
needs to process information from many different directions. This feature also
enables a general tree-based radiation transport algorithm that will be
described in a subsequent paper, and delivers excellent scaling up to at least
1500 cores. Boundary conditions for gravity can be either isolated or periodic,
and they can be specified in each direction independently, using a newly
developed generalisation of the Ewald method. The gravity calculation can be
accelerated with the {\em adaptive block update} technique by partially
re-using the solution from the previous time-step. Comparison with the {\sc
Flash} internal multi-grid gravity solver shows that tree based methods provide
a competitive alternative, particularly for problems with isolated or mixed
boundary conditions. We evaluate several multipole acceptance criteria (MACs)
and identify a relatively simple APE MAC which provides high accuracy at low
computational cost. The optical depth estimates are found to agree very well
with those of the {\sc RADMC-3D} radiation transport code, with the tree solver
being much faster. Our algorithm is available in the standard release of the
{\sc FLASH} code in version 4.0 and later.
","[{""version"":""v1"",""created"":""Mon, 21 Aug 2017 10:25:22 GMT""},{""version"":""v2"",""created"":""Tue, 2 Jan 2018 14:58:05 GMT""}]","2018-01-24"
"1708.06143","William Woods","William Woods","On the catenarity of virtually nilpotent mod-$p$ Iwasawa algebras",,,,,"math.RA math.NT math.RT","http://arxiv.org/licenses/nonexclusive-distrib/1.0/","  Let $p>2$ be a prime, $k$ a finite field of characteristic $p$, and $G$ a
nilpotent-by-finite compact $p$-adic analytic group. Write $kG$ for the
completed group ring of $G$ over $k$. We show that $kG$ is a catenary ring.
","[{""version"":""v1"",""created"":""Mon, 21 Aug 2017 10:37:48 GMT""}]","2017-08-22"
"1708.06144","Anna Pappa","Marco Clementi, Anna Pappa, Andreas Eckstein, Ian A. Walmsley, Elham
  Kashefi, Stefanie Barz","Classical multiparty computation using quantum resources","6 pages, 4 figures","Phys. Rev. A 96, 062317 (2017)","10.1103/PhysRevA.96.062317",,"quant-ph","http://arxiv.org/licenses/nonexclusive-distrib/1.0/","  In this work, we demonstrate a new way to perform classical multiparty
computing amongst parties with limited computational resources. Our method
harnesses quantum resources to increase the computational power of the
individual parties. We show how a set of clients restricted to linear classical
processing are able to jointly compute a non-linear multivariable function that
lies beyond their individual capabilities. The clients are only allowed to
perform classical XOR gates and single-qubit gates on quantum states. We also
examine the type of security that can be achieved in this limited setting.
Finally, we provide a proof-of-concept implementation using photonic qubits,
that allows four clients to compute a specific example of a multiparty
function, the pairwise AND.
","[{""version"":""v1"",""created"":""Mon, 21 Aug 2017 10:47:14 GMT""}]","2017-12-20"
"1708.06145","Emiliano De Cristofaro","Apostolos Pyrgelis and Carmela Troncoso and Emiliano De Cristofaro","Knock Knock, Who's There? Membership Inference on Aggregate Location
  Data",,"Proceedings of the 25th Network and Distributed System Security
  Symposium (NDSS 2018)",,,"cs.CR","http://arxiv.org/licenses/nonexclusive-distrib/1.0/","  Aggregate location data is often used to support smart services and
applications, e.g., generating live traffic maps or predicting visits to
businesses. In this paper, we present the first study on the feasibility of
membership inference attacks on aggregate location time-series. We introduce a
game-based definition of the adversarial task, and cast it as a classification
problem where machine learning can be used to distinguish whether or not a
target user is part of the aggregates.
  We empirically evaluate the power of these attacks on both raw and
differentially private aggregates using two mobility datasets. We find that
membership inference is a serious privacy threat, and show how its
effectiveness depends on the adversary's prior knowledge, the characteristics
of the underlying location data, as well as the number of users and the
timeframe on which aggregation is performed. Although differentially private
mechanisms can indeed reduce the extent of the attacks, they also yield a
significant loss in utility. Moreover, a strategic adversary mimicking the
behavior of the defense mechanism can greatly limit the protection they
provide. Overall, our work presents a novel methodology geared to evaluate
membership inference on aggregate location data in real-world settings and can
be used by providers to assess the quality of privacy protection before data
release or by regulators to detect violations.
","[{""version"":""v1"",""created"":""Mon, 21 Aug 2017 10:50:24 GMT""},{""version"":""v2"",""created"":""Wed, 29 Nov 2017 11:47:25 GMT""}]","2017-11-30"
"1708.06146","Dimitrinka Vladeva","Dimitrinka Vladeva","Jordan derivations in finite endomorphism semirings","25 pages",,,,"math.RA","http://arxiv.org/licenses/nonexclusive-distrib/1.0/","  The aim of this article is to start a study of Jordan derivations in finite
endomorphism semirings.
","[{""version"":""v1"",""created"":""Mon, 21 Aug 2017 10:54:14 GMT""},{""version"":""v2"",""created"":""Tue, 22 Aug 2017 13:03:58 GMT""}]","2017-08-23"
"1708.06147","Dariusz Gora","D. Gora, M. Manganaro, E. Bernardini, M. Doro, M. Will, S. Lombardi,
  J. Rico, D. Sobczynska, J. Palacio (for the MAGIC Collaboration)","Sensitivity for tau neutrinos at PeV energies and beyond with the MAGIC
  telescopes","Proceedings of the 35th International Cosmic Ray Conference (ICRC
  2017), Bexco, Busan, Korea,(arXiv:1708.05153)","POS(ICRC2017)992",,"MAGIC-ICRC/2017/16","astro-ph.HE","http://arxiv.org/licenses/nonexclusive-distrib/1.0/","  The MAGIC telescopes, located at the Roque de los Muchachos Observatory (2200
a.s.l.) in the Canary Island of La Palma, are placed on the top of a mountain,
from where a window of visibility of about 5 deg in zenith and 80 deg in
azimuth is open in the direction of the surrounding ocean. This permits to
search for a signature of particle showers induced by earth-skimming cosmic tau
neutrinos in the PeV to EeV energy range arising from the ocean. We have
studied the response of MAGIC to such events, employing Monte Carlo simulations
of upward-going tau neutrino showers. The analysis of the shower images shows
that air showers induced by tau neutrinos can be discriminated from the
hadronic background coming from a similar direction. We have calculated the
point source acceptance and the expected event rates, assuming an incoming tau
neutrino flux consistent with IceCube measurements, and for a sample of generic
neutrino fluxes from photo-hadronic interactions in AGNs. The analysis of about
30 hours of data taken toward the sea leads to a point source sensitivity for
tau neutrinos at the level of the down-going point source analysis of the
Pierre Auger Observatory.
","[{""version"":""v1"",""created"":""Mon, 21 Aug 2017 10:59:40 GMT""},{""version"":""v2"",""created"":""Wed, 23 Aug 2017 07:28:34 GMT""}]","2019-08-14"
"1708.06148","George Mamatsashvili","G. Mamatsashvili, F. Stefani, A. Guseva, M. Avila","Quasi-two-dimensional nonlinear evolution of helical magnetorotational
  instability in a magnetized Taylor-Couette flow","26 pages, 9 figures, accepted for publication in New Journal of
  Physics",,"10.1088/1367-2630/aa9d65",,"physics.flu-dyn astro-ph.EP astro-ph.SR physics.plasm-ph","http://arxiv.org/licenses/nonexclusive-distrib/1.0/","  Magnetorotational instability (MRI) is one of the fundamental processes in
astrophysics, driving angular momentum transport and mass accretion in a wide
variety of cosmic objects. Despite much theoretical/numerical and experimental
efforts over the last decades, its saturation mechanism and amplitude, which
sets the angular momentum transport rate, remains not well understood,
especially in the limit of high resistivity, or small magnetic Prandtl numbers
typical to interiors (dead zones) of protoplanetary disks, liquid cores of
planets and liquid metals in laboratory. Using direct numerical simulations, in
this paper we investigate the nonlinear development and saturation properties
of the helical magnetorotational instability (HMRI) -- a relative of the
standard MRI -- in a magnetized Taylor-Couette flow at very low magnetic
Prandtl number (correspondingly at low magnetic Reynolds number) relevant to
liquid metals. For simplicity, the ratio of azimuthal field to axial field is
kept fixed. From the linear theory of HMRI, it is known that the Elsasser
number, or interaction parameter determines its growth rate and plays a special
role in the dynamics. We show that this parameter is also important in the
nonlinear problem. By increasing its value, a sudden transition from weakly
nonlinear, where the system is slightly above the linear stability threshold,
to strongly nonlinear, or turbulent regime occurs. We calculate the azimuthal
and axial energy spectra corresponding to these two regimes and show that they
differ qualitatively. Remarkably, the nonlinear state remains in all cases
nearly axisymmetric suggesting that HMRI turbulence is quasi two-dimensional in
nature. Although the contribution of non-axisymmetric modes increases
moderately with the Elsasser number, their total energy remains much smaller
than that of the axisymmetric ones.
","[{""version"":""v1"",""created"":""Mon, 21 Aug 2017 11:02:06 GMT""},{""version"":""v2"",""created"":""Mon, 27 Nov 2017 17:10:45 GMT""}]","2017-11-28"
