"1708.06052","Hanshuang Chen","Hanshuang Chen, Chuansheng Shen, Haifeng Zhang and J\""urgen Kurths","Large deviation induced phase switch in an inertial majority-vote model","6 pages, 6 figures","CHAOS 27, 081102 (2017)","10.1063/1.4993520",,"cond-mat.stat-mech","http://arxiv.org/licenses/nonexclusive-distrib/1.0/","  We theoretically study noise-induced phase switch phenomena in an inertial
majority-vote (IMV) model introduced in a recent paper [Phys. Rev. E 95, 042304
(2017)]. The IMV model generates a strong hysteresis behavior as the noise
intensity $f$ goes forward and backward, a main characteristic of a first-order
phase transition, in contrast to a second-order phase transition in the
original MV model. Using the Wentzel-Kramers-Brillouin approximation for the
master equation, we reduce the problem to finding the zero-energy trajectories
in an effective Hamiltonian system, and the mean switching time depends
exponentially on the associated action and the number of particles $N$. Within
the hysteresis region, we find that the actions along the optimal forward
switching path from ordered phase (OP) to disordered phase (DP) and its
backward path, show distinct variation trends with $f$, and intersect at
$f=f_c$ that determines the coexisting line of OP and DP. This results in a
nonmonotonic dependence of the mean switching time between two symmetric OPs on
$f$, with a minimum at $f_c$ for sufficiently large $N$. Finally, the
theoretical results are validated by Monte Carlo simulations.
","[{""version"":""v1"",""created"":""Mon, 21 Aug 2017 01:50:15 GMT""}]","2017-08-22"
"1708.06053","Timo Nieminen","Timo A. Nieminen, Serene H.-J. Choi and Anton Rayner","Tiered Assessment in Upper-Level Undergraduate Physics","3 pages","paper 503 in R. Robinson, C. Foley and J. Arkwright (eds), 20th
  Australian Institute of Physics Congress, Engineers Australia, Canberra
  (2012) [Unpaginated CD-ROM ISBN 978-0-85825-991-1]",,,"physics.ed-ph","http://arxiv.org/licenses/nonexclusive-distrib/1.0/","  Tiered assessment is a differentiated assessment strategy where students can
choose to attempt advanced assessment tasks. We discuss the use of tiered
assessment in second and third year electromagnetics courses.
","[{""version"":""v1"",""created"":""Mon, 21 Aug 2017 01:50:49 GMT""}]","2017-08-22"
"1708.06054","Ichiro Shimada","Ichiro Shimada","On Edge's correspondence associated with \cdot 222","I corrected the matrix \tilde{\alpha} in Figure 3.1",,,,"math.AG","http://arxiv.org/licenses/nonexclusive-distrib/1.0/","  We describe explicitly the correspondence of Edge between the set of planes
contained in the Fermat cubic 4-fold in characteristic 2, and the set of
lattice points T of the Leech lattice such that OABT is a regular tetrahedron,
where O is the origin of the Leech lattice, and A and B are fixed points of the
Leech lattice such that OAB is a regular triangle of edge length 2. Using this
description, we present Conway's isomorphism from PSU(6,4) to \cdot 222 in
terms of matrices.
","[{""version"":""v1"",""created"":""Mon, 21 Aug 2017 01:59:00 GMT""},{""version"":""v2"",""created"":""Thu, 14 Sep 2017 07:30:21 GMT""}]","2017-09-15"
"1708.06055","Jinglai Shen","Jinglai Shen and Seyedahmad Mousavi","Least Sparsity of $p$-norm based Optimization Problems with $p > 1$",,,,,"math.OC","http://arxiv.org/licenses/nonexclusive-distrib/1.0/","  Motivated by $\ell_p$-optimization arising from sparse optimization, high
dimensional data analytics and statistics, this paper studies sparse properties
of a wide range of $p$-norm based optimization problems with $p > 1$, including
generalized basis pursuit, basis pursuit denoising, ridge regression, and
elastic net. It is well known that when $p > 1$, these optimization problems
lead to less sparse solutions. However, the quantitative characterization of
the adverse sparse properties is not available. In this paper, by exploiting
optimization and matrix analysis techniques, we give a systematic treatment of
a broad class of $p$-norm based optimization problems for a general $p > 1$ and
show that optimal solutions to these problems attain full support, and thus
have the least sparsity, for almost all measurement matrices and measurement
vectors. Comparison to $\ell_p$-optimization with $0 < p \le 1$ and
implications to robustness are also given. These results shed light on analysis
and computation of general $p$-norm based optimization problems in various
applications.
","[{""version"":""v1"",""created"":""Mon, 21 Aug 2017 02:01:14 GMT""}]","2017-08-22"
"1708.06056","Scott Paulin","Scott Paulin, Tom Botterill, XiaoQi Chen, Richard Green","Integrating asymptotically-optimal path planning with local optimization",,,,,"cs.RO","http://arxiv.org/licenses/nonexclusive-distrib/1.0/","  Many robots operating in unpredictable environments require an online path
planning algorithm that can quickly compute high quality paths. Asymptotically
optimal planners are capable of finding the optimal path, but can be slow to
converge. Local optimisation algorithms are capable of quickly improving a
solution, but are not guaranteed to converge to the optimal solution. In this
paper we develop a new way to integrate an asymptotically optimal planners with
a local optimiser. We test our approach using RRTConnect* with a short-cutting
local optimiser. Our approach results in a significant performance improvement
when compared with the state-of-the-art RRTConnect* asymptotically optimal
planner and computes paths that are 31\% faster to execute when both are given
3 seconds of planning time.
","[{""version"":""v1"",""created"":""Mon, 21 Aug 2017 02:09:19 GMT""}]","2017-08-22"
"1708.06057","Ri Qu","Ri Qu, Weiwei Dong, Juan Wang, Yanru Bao, Yin Song, Dawei Song","Bipartite entanglement in AJL's algorithm for three-strand braids","16 pages, 6 figures",,,,"quant-ph","http://arxiv.org/licenses/nonexclusive-distrib/1.0/","  Aharonov, Jones, and Landau [Algorithmica 55, 395 (2009)] have presented a
polynomial quantum algorithm for approximating the Jones polynomial. We
investigate the bipartite entanglement properties in AJL's algorithm for
three-strand braids. We re-describe AJL's algorithm as an equivalent algorithm
which involves three work qubits in some mixed state coupled to a single
control qubit. Furthermore, we use the Peres entanglement criterion to study
the entanglement features of the state before measurements present in the
re-described algorithm for all bipartitions. We show that the state is a
product state relative to the bipartition between the first work qubit and the
others. And it has no entanglement between the control qubit and work ones. We
also prove a sufficient and necessary condition for its entanglement between
the second (third) work qubit and the others. Moreover, we discuss the relation
between its bipartite entanglement and elementary crossings in the three-strand
braid group. We find that braids whose trace closures are topologically
identical may have different entanglement properties in AJL's algorithm.
","[{""version"":""v1"",""created"":""Mon, 21 Aug 2017 02:09:50 GMT""}]","2017-08-22"
"1708.06058","Nicholas Cavenagh","Nicholas Cavenagh","Lower bounds on the sizes of defining sets in full $n$-Latin squares and
  full designs","submitted",,,,"math.CO","http://arxiv.org/licenses/nonexclusive-distrib/1.0/","  The full $n$-Latin square is the $n\times n$ array with symbols $1,2,\dots
,n$ in each cell. In this paper we show, as part of a more general result, that
any defining set for the full $n$-Latin square has size $n^3(1-o(1))$. The full
design $N(v,k)$ is the unique simple design with parameters $(v,k,{v-2 \choose
k-2})$; that is, the design consisting of all subsets of size $k$ from a set of
size $v$. We show that any defining set for the full design $N(v,k)$ has size
${v\choose k}(1-o(1))$ (as $v-k$ becomes large). These results improve existing
results and are asymptotically optimal. In particular, the latter result solves
an open problem given in (Donovan, Lefevre, et al, 2009), in which it is
conjectured that the proportion of blocks in the complement of a full design
will asymptotically approach zero.
","[{""version"":""v1"",""created"":""Mon, 21 Aug 2017 02:10:07 GMT""}]","2017-08-22"
"1708.06059","Wennan Zou","Wennan Zou","Reconstructing fluid dynamics with micro-finite element","15 pages, 4 figures",,,,"physics.flu-dyn","http://arxiv.org/licenses/nonexclusive-distrib/1.0/","  In the theory of the Navier-Stokes equations, the viscous fluid in
incompressible flow is modelled as a homogeneous and dense assemblage of
constituent ""fluid particles"" with viscous stress proportional to rate of
strain. The crucial concept of fluid flow is the velocity of the particle that
is accelerated by the pressure and viscous interaction around it. In this
paper, by virtue of the alternative constituent ""micro-finite element"", we
introduce a set of new intrinsic quantities, called the vortex fields, to
characterise the relative orientation between elements and the feature of
micro-eddies in the element, while the description of viscous interaction in
fluid returns to the initial intuition that the interlayer friction is
proportional to the slip strength. Such a framework enables us to reconstruct
the dynamics theory of viscous fluid, in which the flowing fluid can be
modelled as a finite covering of elements and consequently indicated by a
space-time differential manifold that admits complex topological evolution.
","[{""version"":""v1"",""created"":""Mon, 21 Aug 2017 02:16:23 GMT""},{""version"":""v2"",""created"":""Mon, 22 Aug 2022 00:52:36 GMT""}]","2022-08-23"
"1708.06060","Kazumasa A. Takeuchi","Kazumasa A. Takeuchi","An appetizer to modern developments on the Kardar-Parisi-Zhang
  universality class","34 pages, 16 figures, 1 table; lecture notes prepared for Summer
  School ""Fundamental Problems in Statistical Physics XIV"" (16-29 July 2017,
  Bruneck, Italy); descriptions on growth under quenched noise are
  significantly updated in v2; otherwise most changes are stylistic and made
  for better accessibility to non-specialists","Physica A 504, 77-105 (2018)","10.1016/j.physa.2018.03.009",,"cond-mat.stat-mech math-ph math.MP math.PR","http://arxiv.org/licenses/nonexclusive-distrib/1.0/","  The Kardar-Parisi-Zhang (KPZ) universality class describes a broad range of
non-equilibrium fluctuations, including those of growing interfaces, directed
polymers and particle transport, to name but a few. Since the year 2000, our
understanding of the one-dimensional KPZ class has been completely renewed by
mathematical physics approaches based on exact solutions. Mathematical physics
has played a central role since then, leading to a myriad of new developments,
but their implications are clearly not limited to mathematics -- as a matter of
fact, it can also be studied experimentally. The aim of these lecture notes is
to provide an introduction to the field that is accessible to non-specialists,
reviewing basic properties of the KPZ class and highlighting main physical
outcomes of mathematical developments since the year 2000. It is written in a
brief and self-contained manner, with emphasis put on physical intuitions and
implications, while only a small (and mostly not the latest) fraction of
mathematical developments could be covered. Liquid-crystal experiments by the
author and coworkers are also reviewed.
","[{""version"":""v1"",""created"":""Mon, 21 Aug 2017 02:18:16 GMT""},{""version"":""v2"",""created"":""Mon, 5 Feb 2018 08:56:39 GMT""},{""version"":""v3"",""created"":""Mon, 9 Apr 2018 22:09:47 GMT""}]","2018-05-29"
"1708.06061","Arthur Baragar","Arthur Baragar","The Apollonian circle packing and ample cones for K3 surfaces",,,,,"math.AG","http://arxiv.org/licenses/nonexclusive-distrib/1.0/","  In an earlier work, we gave an Apollonian-like pictorial representation for
the ample cone for a class of K3 surfaces. This raises a natural question: Does
the Apollonian packing itself represent the ample cone for a K3 surface? In
this note, we answer this question in the affirmative.
","[{""version"":""v1"",""created"":""Mon, 21 Aug 2017 02:21:38 GMT""}]","2017-08-22"
"1708.06062","Matias Korman","Sergey Bereg, Matias Korman, Rodrigo I. Silveira, Ferran Hurtado,
  Dolores Lara, Jorge Urrutia, Mikio Kano, Carlos Seara, Kevin Verbeek","Balanced partitions of 3-colored geometric sets in the plane","This paper was published in Discrete Applied Mathematics, 181:21--32,
  2015",,"10.1016/j.dam.2014.10.015",,"cs.CG","http://arxiv.org/licenses/nonexclusive-distrib/1.0/","  Let $S$ be a finite set of geometric objects partitioned into classes or
\emph{colors}. A subset $S'\subseteq S$ is said to be \emph{balanced} if $S'$
contains the same amount of elements of $S$ from each of the colors. We study
several problems on partitioning $3$-colored sets of points and lines in the
plane into two balanced subsets: (a) We prove that for every 3-colored
arrangement of lines there exists a segment that intersects exactly one line of
each color, and that when there are $2m$ lines of each color, there is a
segment intercepting $m$ lines of each color. (b) Given $n$ red points, $n$
blue points and $n$ green points on any closed Jordan curve $\gamma$, we show
that for every integer $k$ with $0 \leq k \leq n$ there is a pair of disjoint
intervals on $\gamma$ whose union contains exactly $k$ points of each color.
(c) Given a set $S$ of $n$ red points, $n$ blue points and $n$ green points in
the integer lattice satisfying certain constraints, there exist two rays with
common apex, one vertical and one horizontal, whose union splits the plane into
two regions, each one containing a balanced subset of $S$.
","[{""version"":""v1"",""created"":""Mon, 21 Aug 2017 02:27:50 GMT""}]","2017-08-22"
"1708.06063","Matias Korman","Jean Cardinal and Hiro Ito and Matias Korman and Stefan Langerman","Helly Numbers of Polyominoes","This paper was published in Graphs and Combinatorics, September 2013,
  Volume 29, Issue 5, pp 1221-1234",,"10.1007/s00373-012-1203-x",,"cs.CG","http://arxiv.org/licenses/nonexclusive-distrib/1.0/","  We define the Helly number of a polyomino $P$ as the smallest number $h$ such
that the $h$-Helly property holds for the family of symmetric and translated
copies of $P$ on the integer grid. We prove the following: (i) the only
polyominoes with Helly number 2 are the rectangles, (ii) there does not exist
any polyomino with Helly number 3, (iii) there exist polyominoes of Helly
number $k$ for any $k\neq 1,3$.
","[{""version"":""v1"",""created"":""Mon, 21 Aug 2017 02:28:10 GMT""}]","2017-08-22"
"1708.06064","Matias Korman","Oswin Aichholzer and Matias Korman and Alexander Pilz and Birgit
  Vogtenhuber","Geodesic Order Types","This paper was published in Algorithmica, September 2014, Volume 70,
  Issue 1, pp 112-128",,"10.1007/978-3-642-32241-9_19",,"cs.CG","http://arxiv.org/licenses/nonexclusive-distrib/1.0/","  The geodesic between two points $a$ and $b$ in the interior of a simple
polygon~$P$ is the shortest polygonal path inside $P$ that connects $a$ to $b$.
It is thus the natural generalization of straight line segments on
unconstrained point sets to polygonal environments. In this paper we use this
extension to generalize the concept of the order type of a set of points in the
Euclidean plane to geodesic order types. In particular, we show that, for any
set $S$ of points and an ordered subset $\mathcal{B} \subseteq S$ of at least
four points, one can always construct a polygon $P$ such that the points of
$\mathcal{B}$ define the geodesic hull of~$S$ w.r.t.~$P$, in the specified
order. Moreover, we show that an abstract order type derived from the dual of
the Pappus arrangement can be realized as a geodesic order type.
","[{""version"":""v1"",""created"":""Mon, 21 Aug 2017 02:30:45 GMT""}]","2017-08-22"
"1708.06065","Ben Southworth","Ben S. Southworth, Thomas A. Manteuffel, and John Ruge","Nonsymmetric Algebraic Multigrid Based on Local Approximate Ideal
  Restriction (lAIR)","SIAM Journal on Scientific Computing, 40(6), A4105-A4130",,,,"math.NA","http://arxiv.org/licenses/nonexclusive-distrib/1.0/","  Algebraic multigrid (AMG) solvers and preconditioners are some of the fastest
numerical methods to solve linear systems, particularly in a parallel
environment, scaling to hundreds of thousands of cores. Most AMG methods and
theory assume a symmetric positive definite operator. This paper presents a new
variation on classical AMG for nonsymmetric matrices (denoted lAIR), based on a
local approximation to the ideal restriction operator, coupled with
F-relaxation. A new block decomposition of the AMG error-propagation operator
is used for a spectral analysis of convergence, and the efficacy of the
algorithm is demonstrated on systems arising from the discrete form of the
advection-diffusion-reaction equation. lAIR is shown to be a robust solver for
various discretizations of the advection-diffusion-reaction equation, including
time-dependent and steady-state, from purely advective to purely diffusive.
Convergence is robust for discretizations on unstructured meshes and using
higher-order finite elements, and is particularly effective on upwind
discontinuous Galerkin discretizations. Although the implementation used here
is not parallel, each part of the algorithm is highly parallelizable, avoiding
common multigrid adjustments for strong advection such as line-relaxation and
K- or W-cycles that can be effective in serial, but suffer from high
communication costs in parallel, limiting their scalability.
","[{""version"":""v1"",""created"":""Mon, 21 Aug 2017 02:34:28 GMT""},{""version"":""v2"",""created"":""Tue, 17 Jul 2018 21:38:58 GMT""},{""version"":""v3"",""created"":""Mon, 29 Oct 2018 15:05:14 GMT""},{""version"":""v4"",""created"":""Fri, 1 Mar 2019 01:39:03 GMT""}]","2019-03-04"
"1708.06066","Jinxiu Mao","Jinxiu Mao and Zengqin Zhao","Laplace's equation with concave and convex boundary nonlinearities on an
  exterior region",,,,,"math.FA","http://arxiv.org/licenses/nonexclusive-distrib/1.0/","  This paper studies Laplace's equation $-\Delta\,u=0$ in an exterior region
$U\varsubsetneq{\mathbb R}^N$, when $N\geq3$, subject to the nonlinear boundary
condition $\frac{\partial
u}{\partial\nu}=\lambda{\left\vert{u}\right\vert}^{q-2}u+\mu{\left\vert{u}\right\vert}^{p-2}u$
on $\partial U$ with $1<q<2<p<2^*$.
  In the function space $\mathscr{H}\left(U\right)$, one observes when
$\lambda>0$ and $\mu\in\mathbb R$ arbitrary, then there exists a sequence
$\left\{u_k\right\}$ of solutions with negative energy converging to $0$ as
$k\to\infty$; on the other hand, when $\lambda\in\mathbb R$ and $\mu>0$
arbitrary, then there exists a sequence $\left\{\tilde{u}_k\right\}$ of
solutions with positive and unbounded energy.
  Also, associated with the $p$-Laplacian equation $-\Delta_p\,u=0$, the
exterior $p$-harmonic Steklov eigenvalue problems are described.
","[{""version"":""v1"",""created"":""Mon, 21 Aug 2017 02:37:32 GMT""}]","2017-08-22"
"1708.06067","Scott Paulin","Scott Paulin, Tom Botterill, XiaoQi Chen, Richard Green","Finding shorter paths for robot arms using their redundancy",,,,,"cs.RO","http://arxiv.org/licenses/nonexclusive-distrib/1.0/","  Many robot arms can accomplish one task using many different joint
configurations. Often only one of these configurations is used as a goal by the
path planner. Ideally the robot's path planner would be able to use the extra
configurations to find higher quality paths. In this paper we use the extra
goal configurations to find significantly shorter paths that are faster to
execute compared to a planner that chooses one goal configuration arbitrarily.
In a grape vine pruning robot arm experiment our proposed approach reduced
execution times by 58%.
","[{""version"":""v1"",""created"":""Mon, 21 Aug 2017 03:00:03 GMT""}]","2017-08-22"
"1708.06068","Barathi Ganesh H B","Barathi Ganesh HB and Anand Kumar M and Soman KP","Vector Space Model as Cognitive Space for Text Classification","6 pages, 6 figures, 3 tables",,,,"cs.CL cs.AI cs.SI","http://arxiv.org/licenses/nonexclusive-distrib/1.0/","  In this era of digitization, knowing the user's sociolect aspects have become
essential features to build the user specific recommendation systems. These
sociolect aspects could be found by mining the user's language sharing in the
form of text in social media and reviews. This paper describes about the
experiment that was performed in PAN Author Profiling 2017 shared task. The
objective of the task is to find the sociolect aspects of the users from their
tweets. The sociolect aspects considered in this experiment are user's gender
and native language information. Here user's tweets written in a different
language from their native language are represented as Document - Term Matrix
with document frequency as the constraint. Further classification is done using
the Support Vector Machine by taking gender and native language as target
classes. This experiment attains the average accuracy of 73.42% in gender
prediction and 76.26% in the native language identification task.
","[{""version"":""v1"",""created"":""Mon, 21 Aug 2017 03:06:07 GMT""}]","2018-04-13"
"1708.06069","Saul Rappaport","S. Rappaport, A. Vanderburg, T. Jacobs, D. LaCourse, J. Jenkins, A.
  Kraus, A. Rizzuto, D.W. Latham, A. Bieryla, M. Lazarevic, and A. Schmitt","Likely Transiting Exocomets Detected by Kepler","17 pages, 13 figures, accepted for publication in MNRAS; modified in
  response to comments by the referee",,"10.1093/mnras/stx2735",,"astro-ph.EP","http://arxiv.org/licenses/nonexclusive-distrib/1.0/","  We present the first good evidence for exocomet transits of a host star in
continuum light in data from the Kepler mission. The Kepler star in question,
KIC 3542116, is of spectral type F2V and is quite bright at K_p = 10. The
transits have a distinct asymmetric shape with a steeper ingress and slower
egress that can be ascribed to objects with a trailing dust tail passing over
the stellar disk. There are three deeper transits with depths of ~0.1% that
last for about a day, and three that are several times more shallow and of
shorter duration. The transits were found via an exhaustive visual search of
the entire Kepler photometric data set, which we describe in some detail. We
review the methods we use to validate the Kepler data showing the comet
transits, and rule out instrumental artefacts as sources of the signals. We fit
the transits with a simple dust-tail model, and find that a transverse comet
speed of ~35-50 km/s and a minimum amount of dust present in the tail of ~10^16
g are required to explain the larger transits. For a dust replenishment time of
~10 days, and a comet lifetime of only ~300 days, this implies a total cometary
mass of > 3 x 10^17 g, or about the mass of Halley's comet. We also discuss the
number of comets and orbital geometry that would be necessary to explain the
six transits detected over the four years of Kepler prime-field observations.
Finally, we also report the discovery of a single comet-shaped transit in KIC
11084727 with very similar transit and host-star properties.
","[{""version"":""v1"",""created"":""Mon, 21 Aug 2017 03:06:12 GMT""},{""version"":""v2"",""created"":""Thu, 26 Oct 2017 01:55:13 GMT""}]","2018-01-24"
"1708.06070","Oliver Knill","Oliver Knill","On Atiyah-Singer and Atiyah-Bott for finite abstract simplicial
  complexes","12 pages",,,,"math.GN cs.DM","http://arxiv.org/licenses/nonexclusive-distrib/1.0/","  A linear or multi-linear valuation on a finite abstract simplicial complex
can be expressed as an analytic index dim(ker(D)) -dim(ker(D^*)) of a
differential complex D:E -> F. In the discrete, a complex D can be called
elliptic if a McKean-Singer spectral symmetry applies as this implies
str(exp(-t D^2)) is t-independent. In that case, the analytic index of D is the
sum of (-1)^k b_k(D), where b_k(D) is the k'th Betti number, which by Hodge is
the nullity of the (k+1)'th block of the Hodge operator L=D^2. It can also be
written as a topological index summing K(v) over the set of zero-dimensional
simplices in G and where K is an Euler type curvature defined by G and D. This
can be interpreted as a Atiyah-Singer type correspondence between analytic and
topological index. Examples are the de Rham differential complex for the Euler
characteristic X(G) or the connection differential complex for Wu
characteristic w_k(G). Given an endomorphism T of an elliptic complex, the
Lefschetz number X(T,G,D) is defined as the super trace of T acting on
cohomology defined by E. It is equal to the sum i(v) over V which are contained
in fixed simplices of T, and i is a Brouwer type index. This Atiyah-Bott result
generalizes the Brouwer-Lefschetz fixed point theorem for an endomorphism of
the simplicial complex G. In both the static and dynamic setting, the proof is
done by heat deforming the Koopman operator U(T) to get the cohomological
picture str(exp(-t D^2) U(T)) in the limit t to infinity and then use Hodge,
and then by applying a discrete gradient flow to the simplex data defining the
valuation to push str(U(T)) to V, getting curvature K(v) or the Brouwer type
index i(v).
","[{""version"":""v1"",""created"":""Mon, 21 Aug 2017 03:07:21 GMT""}]","2017-08-22"
