"1708.06233","Co-Pierre Georg","Christoph Aymanns and Jakob Foerster and Co-Pierre Georg","Fake News in Social Networks",,,,,"cs.AI cs.MA cs.SI physics.soc-ph q-fin.EC","http://arxiv.org/licenses/nonexclusive-distrib/1.0/","  We model the spread of news as a social learning game on a network. Agents
can either endorse or oppose a claim made in a piece of news, which itself may
be either true or false. Agents base their decision on a private signal and
their neighbors' past actions. Given these inputs, agents follow strategies
derived via multi-agent deep reinforcement learning and receive utility from
acting in accordance with the veracity of claims. Our framework yields
strategies with agent utility close to a theoretical, Bayes optimal benchmark,
while remaining flexible to model re-specification. Optimized strategies allow
agents to correctly identify most false claims, when all agents receive
unbiased private signals. However, an adversary's attempt to spread fake news
by targeting a subset of agents with a biased private signal can be successful.
Even more so when the adversary has information about agents' network position
or private signal. When agents are aware of the presence of an adversary they
re-optimize their strategies in the training stage and the adversary's attack
is less effective. Hence, exposing agents to the possibility of fake news can
be an effective way to curtail the spread of fake news in social networks. Our
results also highlight that information about the users' private beliefs and
their social network structure can be extremely valuable to adversaries and
should be well protected.
","[{""version"":""v1"",""created"":""Mon, 21 Aug 2017 14:09:31 GMT""}]","2017-08-22"
"1708.06234","Kodai Wada","Haruko A. Miyazawa, Kodai Wada, Akira Yasuhara","Link invariants derived from multiplexing of crossings","9 pages, 16 figures","Algebr. Geom. Topol. 18 (2018) 2497-2507","10.2140/agt.2018.18.2497",,"math.GT","http://arxiv.org/licenses/nonexclusive-distrib/1.0/","  We introduce the multiplexing of a crossing, replacing a classical crossing
of a virtual link diagram with multiple crossings which is a mixture of
classical and virtual. For integers $m_{i}$ $(i=1,\ldots,n)$ and an ordered
$n$-component virtual link diagram $D$, a new virtual link diagram
$D(m_{1},\ldots,m_{n})$ is obtained from $D$ by the multiplexing of all
crossings. For welded isotopic virtual link diagrams $D$ and $D'$,
$D(m_{1},\ldots,m_{n})$ and $D'(m_{1},\ldots,m_{n})$ are welded isotopic. From
the point of view of classical link theory, it seems very interesting that
$D(m_{1},\ldots,m_{n})$ could not be welded isotopic to a classical link
diagram even if $D$ is a classical one, and new classical link invariants are
expected from known welded link invariants via the multiplexing of crossings.
","[{""version"":""v1"",""created"":""Mon, 21 Aug 2017 14:10:28 GMT""}]","2018-05-02"
"1708.06235","Joao Vieira","Joao Vieira, Erik Leitinger, Muris Sarajlic, Xuhong Li and Fredrik
  Tufvesson","Deep Convolutional Neural Networks for Massive MIMO Fingerprint-Based
  Positioning","Accepted in the IEEE International Symposium on Personal, Indoor and
  Mobile Radio Communications (PIMRC) 2017",,,,"stat.ML cs.IT math.IT","http://arxiv.org/licenses/nonexclusive-distrib/1.0/","  This paper provides an initial investigation on the application of
convolutional neural networks (CNNs) for fingerprint-based positioning using
measured massive MIMO channels. When represented in appropriate domains,
massive MIMO channels have a sparse structure which can be efficiently learned
by CNNs for positioning purposes. We evaluate the positioning accuracy of
state-of-the-art CNNs with channel fingerprints generated from a channel model
with a rich clustered structure: the COST 2100 channel model. We find that
moderately deep CNNs can achieve fractional-wavelength positioning accuracies,
provided that an enough representative data set is available for training.
","[{""version"":""v1"",""created"":""Mon, 21 Aug 2017 14:10:31 GMT""}]","2017-08-22"
"1708.06239","Richard Woodard","S. P. Miao (NCKU), T. Prokopec (Utrecht) and R. P. Woodard (Florida)","Deducing Cosmological Observables from the S-matrix","28 pages, 5 figures, uses LaTeX2e","Phys. Rev. D 96, 104029 (2017)","10.1103/PhysRevD.96.104029","UFIFT-QG-17-03","gr-qc astro-ph.CO","http://arxiv.org/licenses/nonexclusive-distrib/1.0/","  We study one loop quantum gravitational corrections to the long range force
induced by the exchange of a massless scalar between two massive scalars. The
various diagrams contributing to the flat space S-matrix are evaluated in a
general covariant gauge and we show that dependence on the gauge parameters
cancels at a point considerably {\it before} forming the full S-matrix, which
is unobservable in cosmology. It is possible to interpret our computation as a
solution to the effective field equations --- which could be done even in
cosmology --- but taking account of quantum gravitational corrections from the
source and from the observer.
","[{""version"":""v1"",""created"":""Mon, 21 Aug 2017 14:15:10 GMT""}]","2017-11-22"
"1708.06241","Anton Travinsky","Anton Travinskya, Dmitry Vorobiev, Zoran Ninkov, Alan Raisanen, Manuel
  A. Quijada, Stephen A. Smee, Jonathan A. Pellish, Tim Schwartz, Massimo
  Robberto, Sara Heap, Devin Conley, Carlos Benavides, Nicholas Garcia, Zach
  Bredl, Sebastian Yllanes","Evaluation of Digital Micromirror Devices for use in space-based
  Multi-Object Spectrometer application",,"J. of Astronomical Telescopes, Instruments, and Systems, 3(3),
  035003 (2017)","10.1117/1.JATIS.3.3.035003",,"astro-ph.IM","http://arxiv.org/licenses/nonexclusive-distrib/1.0/","  The astronomical community continues to be interested in suitable
programmable slit masks for use in multi-object spectrometers (MOSs) on space
missions. There have been ground-based MOS utilizing digital micromirror
devices (DMDs) and they have proven to be highly accurate and reliable
instruments. This paper summarizes the results of a continuing study to
investigate the performance of DMDs under conditions associated with space
deployment. This includes the response of DMDs to radiation, to the vibration
and mechanical shock loads associated with launch, and the operability of DMD
under cryogenic temperatures. The optical contrast ratio and a study of the
long-term reflectance of a bare device have also been investigated. The results
of the radiation testing demonstrate that DMDs in orbit would experience
negligible heavy-ion induced single event upset (SEU) rate burden, we predict
SEU rate of 5.6 micromirrors per 24 hours. Vibration and mechanical shock
testing was performed according to the NASA General Environmental Verification
Standard (GEVS), no mirrors failed in the devices tested. The results of low
temperature testing suggest that DMDs are not affected by the thermal load and
operate smoothly at temperatures at least as low as 78 K. The reflectivity of a
bare DMD did not measurably change even after being exposed to ambient
conditions over a period of 13 months. The measured contrast ratio (on state vs
off state of the DMD micromirrors) was greater than 6000/:1 when illuminated
with an f/4 optical beam. Overall, DMDs are extremely robust and promise to
provide a reliable alternative to micro shutter arrays (MSA) to be used in
space as remotely programmable slit masks for MOS design.
","[{""version"":""v1"",""created"":""Mon, 21 Aug 2017 14:17:02 GMT""}]","2017-08-22"
"1708.06242","Pablo Dorta-Gonzalez","Pablo Dorta-Gonz\'alez, Yolanda Santana-Jim\'enez","Prevalence and citation advantage of gold open access in the subject
  areas of the Scopus database","32 pages, 2 figures, 7 tables, 3 annex",,,,"cs.DL","http://creativecommons.org/licenses/by/4.0/","  The potential benefit of open access (OA) in relation to citation impact has
been discussed in the literature in depth. The methodology used to test the OA
citation advantage includes comparing OA vs. non-OA journal impact factors and
citations of OA versus non-OA articles published in the same non-OA journals.
However, one problem with many studies is that they are small -restricted to a
discipline or set of journals-. Moreover, conclusions are not entirely
consistent among research areas and 'early view' and 'selection bias' have been
suggested as possible explications. In the present paper, an analysis of gold
OA from across all areas of research -the 27 subject areas of the Scopus
database- is realized. As a novel contribution, this paper takes a
journal-level approach to assessing the OA citation advantage, whereas many
others take a paper-level approach. Data were obtained from Scimago Lab, sorted
using Scopus database, and tagged as OA/non-OA using the DOAJ list. Jointly
with the OA citation advantage, the OA prevalence as well as the differences
between access types (OA vs. non-OA) in production and referencing are tested.
A total of 3,737 OA journals (16.8%) and 18,485 non-OA journals (83.2%)
published in 2015 are considered. As the main conclusion, there is no
generalizable gold OA citation advantage at journal level.
","[{""version"":""v1"",""created"":""Mon, 21 Aug 2017 14:18:40 GMT""},{""version"":""v2"",""created"":""Mon, 11 Sep 2017 11:34:51 GMT""}]","2017-09-12"
"1708.06248","Linghao Song","Linghao Song, Youwei Zhuo, Xuehai Qian, Hai Li, Yiran Chen","GraphR: Accelerating Graph Processing Using ReRAM","Accepted to HPCA 2018",,,,"cs.DC cs.AR","http://arxiv.org/licenses/nonexclusive-distrib/1.0/","  This paper presents GRAPHR, the first ReRAM-based graph processing
accelerator. GRAPHR follows the principle of near-data processing and explores
the opportunity of performing massive parallel analog operations with low
hardware and energy cost. The analog computation is suit- able for graph
processing because: 1) The algorithms are iterative and could inherently
tolerate the imprecision; 2) Both probability calculation (e.g., PageRank and
Collaborative Filtering) and typical graph algorithms involving integers (e.g.,
BFS/SSSP) are resilient to errors. The key insight of GRAPHR is that if a
vertex program of a graph algorithm can be expressed in sparse matrix vector
multiplication (SpMV), it can be efficiently performed by ReRAM crossbar. We
show that this assumption is generally true for a large set of graph
algorithms. GRAPHR is a novel accelerator architecture consisting of two
components: memory ReRAM and graph engine (GE). The core graph computations are
performed in sparse matrix format in GEs (ReRAM crossbars). The
vector/matrix-based graph computation is not new, but ReRAM offers the unique
opportunity to realize the massive parallelism with unprecedented energy
efficiency and low hardware cost. With small subgraphs processed by GEs, the
gain of performing parallel operations overshadows the wastes due to sparsity.
The experiment results show that GRAPHR achieves a 16.01x (up to 132.67x)
speedup and a 33.82x energy saving on geometric mean compared to a CPU baseline
system. Com- pared to GPU, GRAPHR achieves 1.69x to 2.19x speedup and consumes
4.77x to 8.91x less energy. GRAPHR gains a speedup of 1.16x to 4.12x, and is
3.67x to 10.96x more energy efficiency compared to PIM-based architecture.
","[{""version"":""v1"",""created"":""Mon, 21 Aug 2017 14:21:36 GMT""},{""version"":""v2"",""created"":""Sat, 30 Sep 2017 04:23:14 GMT""},{""version"":""v3"",""created"":""Sun, 22 Oct 2017 19:18:28 GMT""},{""version"":""v4"",""created"":""Fri, 8 Dec 2017 22:02:14 GMT""}]","2017-12-12"
"1708.06249","Hadrien Kurkjian","Hadrien Kurkjian, Jacques Tempere","Absorption and emission of a collective excitation by a fermionic
  quasiparticle in a Fermi superfluid","13 pages, 5 figures","New Journal of Physics, Institute of Physics: Open Access
  Journals, 2017, 19 (11)","10.1088/1367-2630/aa969b",,"physics.atm-clus cond-mat.quant-gas physics.atom-ph","http://arxiv.org/licenses/nonexclusive-distrib/1.0/","  We study the process of absorption or emission of a bosonic collective
excitation by a fermionic quasiparticle in a superfluid of paired fermions.
From the RPA equation of motion of the bosonic excitation annihilation
operator, we obtain an expression of the coupling amplitude of this process
which is limited neither to resonant processes nor to the long wavelength
limit. We confirm our result by independently deriving it in the functional
integral approach using the gaussian fluctuation approximation, and by
comparing it in the long wavelength limit to the quantum hydrodynamic result.
Last, we give a straightforward application of the coupling amplitude we obtain
by calculating the lifetime of the bosonic excitations of arbitrary wave
number. We find a mode quality factor that decreases from its maximum at low
wave numbers and vanishes when the bosonic branch hits the pair-breaking
continuum.
","[{""version"":""v1"",""created"":""Mon, 21 Aug 2017 14:21:54 GMT""},{""version"":""v2"",""created"":""Mon, 23 Apr 2018 13:31:59 GMT""},{""version"":""v3"",""created"":""Mon, 18 May 2020 15:38:39 GMT""}]","2020-05-19"
"1708.06253","Van Cyr","Van Cyr, Bryna Kra","The automorphism group of a shift of slow growth is amenable",,"Ergod. Th. Dynam. Sys. 40 (2020) 1788-1804","10.1017/etds.2018.126",,"math.DS","http://arxiv.org/licenses/nonexclusive-distrib/1.0/","  Suppose $(X,\sigma)$ is a subshift, $P_X(n)$ is the word complexity function
of $X$, and ${\rm Aut}(X)$ is the group of automorphisms of $X$. We show that
if $P_X(n)=o(n^2/\log^2 n)$, then ${\rm Aut}(X)$ is amenable (as a countable,
discrete group). We further show that if $P_X(n)=o(n^2)$, then ${\rm Aut}(X)$
can never contain a nonabelian free semigroup (and, in particular, can never
contain a nonabelian free subgroup). This is in contrast to recent examples,
due to Salo and Schraudner, of subshifts with quadratic complexity that do
contain such a semigroup.
","[{""version"":""v1"",""created"":""Mon, 21 Aug 2017 14:26:18 GMT""}]","2020-06-10"
"1708.06254","Igor Khanonkin Mr.","Igor Khanonkin, Akhilesh K. Mishra, Ouri Karni, Saddam Banyoudeh,
  Florian Schnabel, Vitalii Sichkovskyi, Vissarion Michelashvili, Johann P.
  Reithmaier, Gadi Eisenstein","Ramsey fringes in a room temperature quantum dot semiconductor optical
  amplifier",,"Phys. Rev. B 97, 241117 (2018)","10.1103/PhysRevB.97.241117",,"quant-ph physics.optics","http://arxiv.org/licenses/nonexclusive-distrib/1.0/","  The ability to induce, observe and control quantum coherent interactions in
room temperature, electrically driven optoelectronic devices is of outmost
significance for advancing quantum science and engineering towards practical
applications. We demonstrate here a quantum interference phenomena, Ramsey
fringes, in an inhomogeneously broadened InAs/InP quantum dot (QD) ensemble in
the form of a 1.5 mm long optical amplifier operating at room temperature.
Observation of Ramsey fringes in semiconductor QD was previously achieved only
at cryogenic temperatures and only in isolated single dot systems. A
high-resolution pump probe scheme where both pulses are characterized by cross
frequency resolved optical gating (X-FROG) reveals a clear oscillatory behavior
both in the amplitude and the instantaneous frequency of the probe pulse with a
period that equals one optical cycle at operational wavelength. Using nominal
input delays of 600 to 900 fs and scanning the separation around each delay in
1 fs steps, we map the evolution of the material de-coherence and extract a
coherence time. Moreover we notice a unique phenomenon, which can not be
observed in single dot systems, that the temporal position of the output probe
pulse also oscillates with the same periodicity but with a quarter cycle delay
relative to the intensity variations. This delay is the time domain
manifestation of coupling between the real and imaginary parts of the complex
susceptibility.
","[{""version"":""v1"",""created"":""Mon, 21 Aug 2017 14:28:16 GMT""},{""version"":""v2"",""created"":""Sat, 2 Dec 2017 10:44:46 GMT""}]","2018-07-04"
"1708.06256","David Petrecca","Simone Calamai and David Petrecca","Toric extremal Kaehler-Ricci solitons are Kaehler-Einstein","4 pages. Some changes in the references, modified introduction and
  misprints corrected. Comments are welcome",,,,"math.DG","http://arxiv.org/licenses/nonexclusive-distrib/1.0/","  In this short note, we prove that a Calabi extremal Kaehler-Ricci soliton on
a compact toric Kaehler manifold is Einstein. This solves for the class of
toric manifolds a general problem stated by the authors that they solved only
under some curvature assumptions.
","[{""version"":""v1"",""created"":""Mon, 21 Aug 2017 14:30:35 GMT""},{""version"":""v2"",""created"":""Tue, 5 Sep 2017 07:04:33 GMT""}]","2017-09-06"
"1708.06257","Zhen Li","Zhen Li, Zuoqiang Shi","A Flow Model of Neural Networks",,,,,"cs.LG cs.AI cs.NE","http://arxiv.org/licenses/nonexclusive-distrib/1.0/","  Based on a natural connection between ResNet and transport equation or its
characteristic equation, we propose a continuous flow model for both ResNet and
plain net. Through this continuous model, a ResNet can be explicitly
constructed as a refinement of a plain net. The flow model provides an
alternative perspective to understand phenomena in deep neural networks, such
as why it is necessary and sufficient to use 2-layer blocks in ResNets, why
deeper is better, and why ResNets are even deeper, and so on. It also opens a
gate to bring in more tools from the huge area of differential equations.
","[{""version"":""v1"",""created"":""Mon, 21 Aug 2017 14:30:49 GMT""},{""version"":""v2"",""created"":""Mon, 11 Dec 2017 11:26:00 GMT""}]","2017-12-12"
"1708.06258","Carlos Matheus","Carlos Matheus and Carlos Gustavo Moreira","$HD(M\setminus L)<0.986927$","16 pages, no figures. This preprint became a portion of the latest
  version of arXiv:1803.01230 and, for this reason, we are withdrawing it",,,,"math.DS","http://arxiv.org/licenses/nonexclusive-distrib/1.0/","  We show that several portions of the complement $M\setminus L$ of the
Lagrange spectrum $L$ in the Markov spectrum $M$ can be seen as subsets of
arithmetic sums of Cantor sets with controlled Hausdorff dimensions. In
particular, we prove that $M\setminus L$ has Hausdorff dimension strictly
smaller than one.
","[{""version"":""v1"",""created"":""Mon, 21 Aug 2017 14:31:00 GMT""},{""version"":""v2"",""created"":""Mon, 18 Sep 2017 07:55:15 GMT""},{""version"":""v3"",""created"":""Thu, 3 Oct 2019 10:24:02 GMT""}]","2019-10-04"
"1708.06259","\'Ad\'am Gali","Viktor Iv\'ady, Joel Davidsson, Nguyen Tien Son, Takeshi Ohshima, Igor
  A. Abrikosov, and Adam Gali","Identification of Si-vacancy related room temperature qubits in 4H
  silicon carbide","3 figures","Phys. Rev. B 96, 161114 (2017)","10.1103/PhysRevB.96.161114",,"cond-mat.mtrl-sci","http://arxiv.org/licenses/nonexclusive-distrib/1.0/","  Identification of microscopic configuration of point defects acting as
quantum bits is a key step in the advance of quantum information processing and
sensing. Among the numerous candidates, silicon vacancy related centers in
silicon carbide (SiC) have shown remarkable properties owing to their
particular spin-3/2 ground and excited states. Although, these centers were
observed decades ago, still two competing models, the isolated negatively
charged silicon vacancy and the complex of negatively charged silicon vacancy
and neutral carbon vacancy [Phys. Rev. Lett.\ \textbf{115}, 247602 (2015)] are
argued as an origin. By means of high precision first principles calculations
and high resolution electron spin resonance measurements, we here unambiguously
identify the Si-vacancy related qubits in hexagonal SiC as isolated negatively
charged silicon vacancies. Moreover, we identify the Si-vacancy qubit
configurations that provide room temperature optical readout.
","[{""version"":""v1"",""created"":""Mon, 21 Aug 2017 14:33:53 GMT""},{""version"":""v2"",""created"":""Fri, 13 Oct 2017 20:01:18 GMT""}]","2017-11-01"
"1708.06260","Annette Werner","Sevda Kurul and Annette Werner","On Endomorphisms of Arrangement Complements","12 pages","Proc. Amer. Math. Soc. 147 (2019), 2797-2808",,,"math.AG","http://arxiv.org/licenses/nonexclusive-distrib/1.0/","  Let $\Omega$ be the complement of a connected, essential hyperplane
arrangement. We prove that every dominant endomorphism of $\Omega$ extends to
an endomorphism of the tropical compactification $X$ of $\Omega$ associated to
the Bergman fan structure on the tropicalization of $\Omega$. This generalizes
a previous result by R\'emy, Thuillier and the second author which states that
every automorphism of Drinfeld's half-space over a finite field $\mathbb{F}_q$
extends to an automorphism of the successive blow-up of projective space at all
$\mathbb{F}_q$-rational linear subspaces. This successive blow-up is in fact
the minimal wonderful compactification by de Concini and Procesi, which
coincides with $X$ by results of Feichtner and Sturmfels. Whereas the previous
proof is based on Berkovich analytic geometry over the trivially valued finite
ground field, the generalization discussed in the present paper relies on
matroids and tropical geometry.
","[{""version"":""v1"",""created"":""Mon, 21 Aug 2017 14:34:09 GMT""},{""version"":""v2"",""created"":""Sat, 6 Jun 2020 15:25:55 GMT""}]","2020-06-09"
"1708.06261","Viktor Holubec","Viktor Holubec and Artem Ryabov","Diverging, but negligible power at Carnot efficiency: theory and
  experiment","10 pages, 6 figures","Phys. Rev. E 96, 062107 (2017)","10.1103/PhysRevE.96.062107",,"cond-mat.stat-mech","http://arxiv.org/licenses/nonexclusive-distrib/1.0/","  We discuss the possibility of reaching the Carnot efficiency by heat engines
(HEs) out of quasi-static conditions at nonzero power output. We focus on
several models widely used to describe the performance of actual HEs. These
models comprise quantum thermoelectric devices, linear irreversible HEs,
minimally nonlinear irreversible HEs, HEs working in the regime of low
dissipation, over-damped stochastic HEs and an under-damped stochastic HE.
Although some of these HEs can reach the Carnot efficiency at nonzero and even
diverging power, the magnitude of this power is always negligible compared to
the maximum power attainable in these systems. We provide conditions for
attaining the Carnot efficiency in the individual models and explain practical
aspects connected with reaching the Carnot efficiency at large power output.
Furthermore, we show how our findings can be tested in practice using a
standard Brownian HE realizable with available micromanipulation techniques.
","[{""version"":""v1"",""created"":""Mon, 21 Aug 2017 14:35:00 GMT""},{""version"":""v2"",""created"":""Mon, 16 Oct 2017 09:21:33 GMT""},{""version"":""v3"",""created"":""Thu, 16 Nov 2017 10:26:24 GMT""},{""version"":""v4"",""created"":""Thu, 5 Apr 2018 12:35:19 GMT""}]","2018-04-06"
"1708.06262","Konstantinos Koutrolikos","I. L. Buchbinder, S. James Gates Jr. and Konstantinos Koutrolikos","Higher Spin Superfield interactions with the Chiral Supermultiplet:
  Conserved Supercurrents and Cubic Vertices",,,,,"hep-th math-ph math.MP","http://arxiv.org/licenses/nonexclusive-distrib/1.0/","  We investigate cubic interactions between a chiral superfield and higher spin
superfield corresponding to irreducible representations of the $4D,\,
\mathcal{N}=1$ super-Poincar\'{e} algebra. We do this by demanding an
invariance under the most general transformation, linear in the chiral
superfield. Following Noether's method we construct an infinite tower of higher
spin supercurrent multiplets which are quadratic in the chiral superfield and
include higher derivatives. The results are that a single, massless, chiral
superfield can couple only to the half-integer spin supermultiplets
$(s+1,s+1/2)$ and for every value of spin there is an appropriate improvement
term that reduces the supercurrent multiplet to a minimal multiplet which
matches that of superconformal higher spins. On the other hand a single,
massive, chiral superfield can couple only to higher spin supermultiplets of
type $(2l+2\hspace{0.3ex},\hspace{0.1ex}2l+3/2)$ and there is no minimal
multiplet. Furthermore, for the massless case we discuss the component level
higher spin currents and provide explicit expressions for the integer and
half-integer spin conserved currents together with a R-symmetry current.
","[{""version"":""v1"",""created"":""Mon, 21 Aug 2017 14:36:14 GMT""},{""version"":""v2"",""created"":""Tue, 10 Oct 2017 11:30:52 GMT""},{""version"":""v3"",""created"":""Thu, 26 Oct 2017 12:58:59 GMT""},{""version"":""v4"",""created"":""Thu, 28 Dec 2017 09:07:42 GMT""}]","2017-12-29"
"1708.06263","Barak Weiss","Amos Nevo, Rene R\""uhr and Barak Weiss","Effective counting on translation surfaces","updated version, accepted for publication in Adv. Math",,,,"math.DS","http://arxiv.org/licenses/nonexclusive-distrib/1.0/","  We prove an effective version of a celebrated result of Eskin and Masur: for
any affine invariant manifold of translation surfaces, almost every translation
surface has quadratic growth for the saddle connection holonomy vectors, with
an effective bound of the error. We also provide effective versions of counting
in sectors and in ellipses.
","[{""version"":""v1"",""created"":""Mon, 21 Aug 2017 14:41:49 GMT""},{""version"":""v2"",""created"":""Tue, 22 Aug 2017 15:04:16 GMT""},{""version"":""v3"",""created"":""Fri, 8 Nov 2019 11:05:56 GMT""}]","2019-11-11"
